smartctl 7.1 2019-12-30 r5022 [x86_64-linux-3.10.0-1062...] (local build)
Copyright (C) 2002-19, Bruce Allen, Christian Franke, www.smartmontools.org

=== START OF INFORMATION SECTION ===
Model Number:                       INTEL SSDPE2MD400G4
Serial Number:                      --
Firmware Version:                   8DV10171
PCI Vendor/Subsystem ID:            0x8086
IEEE OUI Identifier:                0x5cd2e4
Controller ID:                      0
Number of Namespaces:               1
Namespace 1 Size/Capacity:          400,088,457,216 [400 GB]
Namespace 1 Formatted LBA Size:     512
Local Time is:                      Tue Apr ... 2020 +07

=== START OF READ SMART DATA SECTION ===
SMART overall-health self-assessment test result: PASSED

SMART/Health Information (NVMe Log 0x02)
Critical Warning:                   0x00
Temperature:                        24 Celsius
Available Spare:                    100%
Available Spare Threshold:          10%
Percentage Used:                    6%
Data Units Read:                    243,168,743 [124 TB]
Data Units Written:                 1,449,697,823 [742 TB]
Host Read Commands:                 3,418,971,673
Host Write Commands:                19,379,629,392
Controller Busy Time:               330
Power Cycles:                       56
Power On Hours:                     20,202
Unsafe Shutdowns:                   37
Media and Data Integrity Errors:    0
Error Information Log Entries:      0

