smartctl 7.0 2019-12-10 r4999 [x86_64-linux-3.10.0-862...] (local build)
Copyright (C) 2002-18, Bruce Allen, Christian Franke, www.smartmontools.org

=== START OF INFORMATION SECTION ===
Model Number:                       INTEL SSDPE2MD400G4
Serial Number:                      --
Firmware Version:                   8DV10171
PCI Vendor/Subsystem ID:            0x8086
IEEE OUI Identifier:                0x5cd2e4
Controller ID:                      0
Number of Namespaces:               1
Namespace 1 Size/Capacity:          400,088,457,216 [400 GB]
Namespace 1 Formatted LBA Size:     512
Local Time is:                      --

=== START OF READ SMART DATA SECTION ===
SMART overall-health self-assessment test result: PASSED

SMART/Health Information (NVMe Log 0x02)
Critical Warning:                   0x00
Temperature:                        20 Celsius
Available Spare:                    100%
Available Spare Threshold:          10%
Percentage Used:                    21%
Data Units Read:                    4,822,538,384 [2.46 PB]
Data Units Written:                 6,754,346,238 [3.45 PB]
Host Read Commands:                 52,562,122,245
Host Write Commands:                100,273,264,281
Controller Busy Time:               2,396
Power Cycles:                       14
Power On Hours:                     27,112
Unsafe Shutdowns:                   12
Media and Data Integrity Errors:    0
Error Information Log Entries:      0

