smartctl 7.1 2019-12-30 r5022 [x86_64-linux-3.10.0-1062...] (local build)
Copyright (C) 2002-19, Bruce Allen, Christian Franke, www.smartmontools.org

=== START OF INFORMATION SECTION ===
Model Number:                       INTEL SSDPEDMD400G4
Serial Number:                      --
Firmware Version:                   8DV10171
PCI Vendor/Subsystem ID:            0x8086
IEEE OUI Identifier:                0x5cd2e4
Controller ID:                      0
Number of Namespaces:               1
Namespace 1 Size/Capacity:          400,088,457,216 [400 GB]
Namespace 1 Formatted LBA Size:     512
Local Time is:                      --

=== START OF READ SMART DATA SECTION ===
SMART overall-health self-assessment test result: PASSED

SMART/Health Information (NVMe Log 0x02)
Critical Warning:                   0x00
Temperature:                        33 Celsius
Available Spare:                    100%
Available Spare Threshold:          10%
Percentage Used:                    25%
Data Units Read:                    2,425,315,394 [1.24 PB]
Data Units Written:                 7,318,230,172 [3.74 PB]
Host Read Commands:                 66,079,004,244
Host Write Commands:                127,600,013,344
Controller Busy Time:               2,256
Power Cycles:                       19
Power On Hours:                     29,985
Unsafe Shutdowns:                   14
Media and Data Integrity Errors:    0
Error Information Log Entries:      0

