smartctl 7.0 2019-05-21 r4916 [x86_64-linux-3.10.0-957...] (local build)
Copyright (C) 2002-18, Bruce Allen, Christian Franke, www.smartmontools.org

=== START OF INFORMATION SECTION ===
Model Number:                       INTEL SSDPEDMD400G4
Serial Number:                      --
Firmware Version:                   8DV10171
PCI Vendor/Subsystem ID:            0x8086
IEEE OUI Identifier:                0x5cd2e4
Controller ID:                      0
Number of Namespaces:               1
Namespace 1 Size/Capacity:          400,088,457,216 [400 GB]
Namespace 1 Formatted LBA Size:     512
Local Time is:                      Tue Apr ... 2020 UTC

=== START OF READ SMART DATA SECTION ===
SMART overall-health self-assessment test result: PASSED

SMART/Health Information (NVMe Log 0x02)
Critical Warning:                   0x00
Temperature:                        39 Celsius
Available Spare:                    100%
Available Spare Threshold:          10%
Percentage Used:                    2%
Data Units Read:                    554,070,397 [283 TB]
Data Units Written:                 692,885,017 [354 TB]
Host Read Commands:                 13,486,189,199
Host Write Commands:                13,709,904,223
Controller Busy Time:               101
Power Cycles:                       12
Power On Hours:                     29,134
Unsafe Shutdowns:                   2
Media and Data Integrity Errors:    0
Error Information Log Entries:      0

