smartctl 7.1 2020-06-20 r5066 [x86_64-linux-3.10.0-1160...] (local build)
Copyright (C) 2002-19, Bruce Allen, Christian Franke, www.smartmontools.org

=== START OF INFORMATION SECTION ===
Model Number:                       INTEL SSDPEDMD400G4
Serial Number:                      --
Firmware Version:                   8DV10171
PCI Vendor/Subsystem ID:            0x8086
IEEE OUI Identifier:                0x5cd2e4
Controller ID:                      0
Number of Namespaces:               1
Namespace 1 Size/Capacity:          400,088,457,216 [400 GB]
Namespace 1 Formatted LBA Size:     512
Local Time is:                      Mon Aug ... 2022 MSK

=== START OF READ SMART DATA SECTION ===
SMART overall-health self-assessment test result: PASSED

SMART/Health Information (NVMe Log 0x02)
Critical Warning:                   0x00
Temperature:                        18 Celsius
Available Spare:                    100%
Available Spare Threshold:          10%
Percentage Used:                    13%
Data Units Read:                    1,411,879,936 [722 TB]
Data Units Written:                 3,824,566,781 [1.95 PB]
Host Read Commands:                 20,381,972,235
Host Write Commands:                40,187,622,809
Controller Busy Time:               1,003
Power Cycles:                       27
Power On Hours:                     32,497
Unsafe Shutdowns:                   26
Media and Data Integrity Errors:    0
Error Information Log Entries:      0

