smartctl 7.1 2020-06-20 r5066 [x86_64-linux-3.10.0-1127...] (local build)
Copyright (C) 2002-19, Bruce Allen, Christian Franke, www.smartmontools.org

=== START OF INFORMATION SECTION ===
Model Number:                       INTEL SSDPEDMD400G4
Serial Number:                      --
Firmware Version:                   8DV10131
PCI Vendor/Subsystem ID:            0x8086
IEEE OUI Identifier:                0x5cd2e4
Controller ID:                      0
Number of Namespaces:               1
Namespace 1 Size/Capacity:          400,088,457,216 [400 GB]
Namespace 1 Formatted LBA Size:     512
Local Time is:                      --

=== START OF READ SMART DATA SECTION ===
SMART overall-health self-assessment test result: PASSED

SMART/Health Information (NVMe Log 0x02)
Critical Warning:                   0x00
Temperature:                        26 Celsius
Available Spare:                    99%
Available Spare Threshold:          10%
Percentage Used:                    28%
Data Units Read:                    258,397 [132 GB]
Data Units Written:                 157,787 [80.7 GB]
Host Read Commands:                 7,108,275,849
Host Write Commands:                129,310,182,826
Controller Busy Time:               1,700
Power Cycles:                       8
Power On Hours:                     48,480
Unsafe Shutdowns:                   4
Media and Data Integrity Errors:    0
Error Information Log Entries:      0

