smartctl 6.6 2017-11-05 r4594 [x86_64-linux-3.10.0-693...] (local build)
Copyright (C) 2002-17, Bruce Allen, Christian Franke, www.smartmontools.org

=== START OF INFORMATION SECTION ===
Model Family:     Intel 520 Series SSDs
Device Model:     INTEL SSDSC2CW180A3
Serial Number:    --
LU WWN Device Id: 5 5cd2e4 ...
Firmware Version: 400i
User Capacity:    180,045,766,656 bytes [180 GB]
Sector Size:      512 bytes logical/physical
Rotation Rate:    Solid State Device
Device is:        In smartctl database [for details use: -P show]
ATA Version is:   ACS-2 T13/2015-D revision 3
SATA Version is:  SATA 3.0, 6.0 Gb/s (current: 6.0 Gb/s)
Local Time is:    Wed Mar ... 2019 EST

=== START OF READ SMART DATA SECTION ===
SMART overall-health self-assessment test result: PASSED

SMART Attributes Data Structure revision number: 10
Vendor Specific SMART Attributes with Thresholds:
ID# ATTRIBUTE_NAME          FLAGS    VALUE WORST THRESH FAIL RAW_VALUE
  5 Reallocated_Sector_Ct   -O--CK   100   100   000    -    0
  9 Power_On_Hours_and_Msec -O--CK   000   000   000    -    941359h+11m+16.260s
 12 Power_Cycle_Count       -O--CK   100   100   000    -    44
170 Available_Reservd_Space PO--CK   100   100   010    -    0
171 Program_Fail_Count      -O--CK   100   100   000    -    0
172 Erase_Fail_Count        -O--CK   100   100   000    -    0
174 Unexpect_Power_Loss_Ct  -O--CK   100   100   000    -    43
184 End-to-End_Error        PO--CK   100   100   090    -    0
187 Uncorrectable_Error_Cnt -O--CK   100   100   000    -    0
192 Power-Off_Retract_Count -O--CK   100   100   000    -    43
225 Host_Writes_32MiB       -O--CK   100   100   000    -    100559
226 Workld_Media_Wear_Indic -O--CK   100   100   000    -    65535
227 Workld_Host_Reads_Perc  -O--CK   100   100   000    -    35
228 Workload_Minutes        -O--CK   100   100   000    -    65535
232 Available_Reservd_Space PO--CK   100   100   010    -    0
233 Media_Wearout_Indicator -O--CK   100   100   000    -    0
241 Host_Writes_32MiB       -O--CK   100   100   000    -    100559
242 Host_Reads_32MiB        -O--CK   100   100   000    -    56273
249 NAND_Writes_1GiB        PO--C-   100   100   000    -    11707
                            ||||||_ K auto-keep
                            |||||__ C event count
                            ||||___ R error rate
                            |||____ S speed/performance
                            ||_____ O updated online
                            |______ P prefailure warning

Current Temperature:                    30 Celsius

