smartctl 7.4 2023-08-01 r5530 [x86_64-linux-3.10.0-1160...] (local build)
Copyright (C) 2002-23, Bruce Allen, Christian Franke, www.smartmontools.org

=== START OF INFORMATION SECTION ===
Model Number:                       SAMSUNG MZQL27T6HBLA-00A07
Serial Number:                      --
Firmware Version:                   GDC5A02Q
PCI Vendor/Subsystem ID:            0x144d
IEEE OUI Identifier:                0x002538
Total NVM Capacity:                 7,681,501,126,656 [7.68 TB]
Unallocated NVM Capacity:           0
Controller ID:                      6
NVMe Version:                       1.4
Number of Namespaces:               32
Namespace 1 Size/Capacity:          7,681,501,126,656 [7.68 TB]
Namespace 1 Utilization:            1,992,533,995,520 [1.99 TB]
Namespace 1 Formatted LBA Size:     512
Local Time is:                      Tue Dec ... 2025 MSK

=== START OF READ SMART DATA SECTION ===
SMART overall-health self-assessment test result: PASSED

SMART/Health Information (NVMe Log 0x02)
Critical Warning:                   0x00
Temperature:                        32 Celsius
Available Spare:                    100%
Available Spare Threshold:          10%
Percentage Used:                    0%
Data Units Read:                    15,603,055 [7.98 TB]
Data Units Written:                 13,163,157 [6.73 TB]
Host Read Commands:                 40,693,220
Host Write Commands:                171,016,635
Controller Busy Time:               106
Power Cycles:                       4
Power On Hours:                     1,680
Unsafe Shutdowns:                   2
Media and Data Integrity Errors:    0
Error Information Log Entries:      0
Warning  Comp. Temperature Time:    0
Critical Comp. Temperature Time:    0
Temperature Sensor 1:               32 Celsius
Temperature Sensor 2:               39 Celsius

Error Information (NVMe Log 0x01, 16 of 64 entries)
No Errors Logged

Read Self-test Log failed: Invalid Field in Command (0x002)

