smartctl 7.1 2020-06-20 r5066 [x86_64-linux-3.10.0-1160...] (local build)
Copyright (C) 2002-19, Bruce Allen, Christian Franke, www.smartmontools.org

=== START OF INFORMATION SECTION ===
Model Number:                       SAMSUNG MZQL27T6HBLA-00A07
Serial Number:                      --
Firmware Version:                   GDC5302Q
PCI Vendor/Subsystem ID:            0x144d
IEEE OUI Identifier:                0x002538
Total NVM Capacity:                 7,681,501,126,656 [7.68 TB]
Unallocated NVM Capacity:           0
Controller ID:                      6
Number of Namespaces:               32
Namespace 1 Size/Capacity:          7,681,501,126,656 [7.68 TB]
Namespace 1 Utilization:            4,461,176,000,512 [4.46 TB]
Namespace 1 Formatted LBA Size:     512
Local Time is:                      Mon May ... 2022 CEST

=== START OF READ SMART DATA SECTION ===
SMART overall-health self-assessment test result: PASSED

SMART/Health Information (NVMe Log 0x02)
Critical Warning:                   0x00
Temperature:                        32 Celsius
Available Spare:                    100%
Available Spare Threshold:          10%
Percentage Used:                    0%
Data Units Read:                    157,556,667 [80.6 TB]
Data Units Written:                 265,020,503 [135 TB]
Host Read Commands:                 14,441,285,286
Host Write Commands:                2,295,736,170
Controller Busy Time:               15,578
Power Cycles:                       9
Power On Hours:                     1,943
Unsafe Shutdowns:                   7
Media and Data Integrity Errors:    0
Error Information Log Entries:      0
Warning  Comp. Temperature Time:    0
Critical Comp. Temperature Time:    0
Temperature Sensor 1:               32 Celsius
Temperature Sensor 2:               40 Celsius

