smartctl 7.0 2019-05-21 r4916 [x86_64-linux-3.10.0-957...] (local build)
Copyright (C) 2002-18, Bruce Allen, Christian Franke, www.smartmontools.org

=== START OF INFORMATION SECTION ===
Model Family:     Seagate Constellation ES.3
Device Model:     ST4000NM0033-9ZM170
Serial Number:    --
LU WWN Device Id: 5 000c50 ...
Add. Product Id:  DELL(tm)
Firmware Version: GA6E
User Capacity:    4,000,787,030,016 bytes [4.00 TB]
Sector Size:      512 bytes logical/physical
Rotation Rate:    7200 rpm
Form Factor:      3.5 inches
Device is:        In smartctl database [for details use: -P show]
ATA Version is:   ACS-2 (minor revision not indicated)
SATA Version is:  SATA 3.0, 6.0 Gb/s (current: 6.0 Gb/s)
Local Time is:    Tue Mar ... 2020 GMT
Rd look-ahead is: Enabled
Write cache is:   Disabled
ATA Security is:  Disabled, frozen [SEC2]

=== START OF READ SMART DATA SECTION ===
SMART overall-health self-assessment test result: PASSED

General SMART Values:
Offline data collection status:  (0x82)	Offline data collection activity
					was completed without error.

Self-test execution status:      (   0)	The previous self-test routine completed
					without error or no self-test has ever 
					been run.
Total time to complete Offline 
data collection: 		(   90) seconds.
Offline data collection
capabilities: 			 (0x7b) SMART execute Offline immediate.

					Suspend Offline collection upon new
					command.
					Offline surface scan supported.
					Self-test supported.
					Conveyance Self-test supported.
					Selective Self-test supported.
SMART capabilities:            (0x0003)	Saves SMART data before entering
					power-saving mode.

Error logging capability:        (0x01)	Error logging supported.
					General Purpose Logging supported.
Short self-test routine 
recommended polling time: 	 (   2) minutes.
Extended self-test routine
recommended polling time: 	 ( 486) minutes.
Conveyance self-test routine
recommended polling time: 	 (   3) minutes.
SCT capabilities: 	       (0x50bd)	SCT Status supported.
					SCT Error Recovery Control supported.
					SCT Feature Control supported.
					SCT Data Table supported.

SMART Attributes Data Structure revision number: 10
Vendor Specific SMART Attributes with Thresholds:
ID# ATTRIBUTE_NAME          FLAGS    VALUE WORST THRESH FAIL RAW_VALUE
  1 Raw_Read_Error_Rate     POSR--+  081   063   ---    -    122310631
  3 Spin_Up_Time            PO----+  091   091   ---    -    0
  4 Start_Stop_Count        -O--CK   100   100   ---    -    44
  5 Reallocated_Sector_Ct   PO--CK+  100   100   ---    -    1
  7 Seek_Error_Rate         POSR--   093   060   ---    -    1884230736
  9 Power_On_Hours          -O--CK   070   070   ---    -    26396
 10 Spin_Retry_Count        PO--C-   100   100   ---    -    0
 12 Power_Cycle_Count       -O--CK   100   100   ---    -    41
184 End-to-End_Error        -O--CK   100   100   ---    -    0
187 Reported_Uncorrect      -O--CK   100   100   ---    -    0
188 Command_Timeout         -O--CK   100   100   ---    -    0
189 High_Fly_Writes         -O-RCK   097   097   ---    -    3
190 Airflow_Temperature_Cel -O---K   064   043   ---    -    36 (Min/Max 36/41)
191 G-Sense_Error_Rate      -O--CK   100   100   ---    -    0
192 Power-Off_Retract_Count -O--CK   100   100   ---    -    32
193 Load_Cycle_Count        -O--CK   100   100   ---    -    1704
194 Temperature_Celsius     -O---K   036   057   ---    -    36 (0 22 0 0 0)
195 Hardware_ECC_Recovered  -O-RC-   033   003   ---    -    122310631
196 Reallocated_Event_Count -O--CK   000   000   ---    -    21846
197 Current_Pending_Sector  -O--C-   100   100   ---    -    0
198 Offline_Uncorrectable   ----C-   100   100   ---    -    0
199 UDMA_CRC_Error_Count    -OSRCK   200   200   ---    -    0
240 Head_Flying_Hours       ------   100   253   ---    -    26337 (15 109 0)
241 Total_LBAs_Written      ------   100   253   ---    -    255121078108
242 Total_LBAs_Read         ------   100   253   ---    -    74315387447
                            ||||||_ K auto-keep
                            |||||__ C event count
                            ||||___ R error rate
                            |||____ S speed/performance
                            ||_____ O updated online
                            |______ P prefailure warning

General Purpose Log Directory Version 1
SMART           Log Directory Version 1 [multi-sector log support]
Address    Access  R/W   Size  Description
0x00       GPL,SL  R/O      1  Log Directory
0x01           SL  R/O      1  Summary SMART error log
0x02           SL  R/O      5  Comprehensive SMART error log
0x03       GPL     R/O      5  Ext. Comprehensive SMART error log
0x04       GPL,SL  R/O      8  Device Statistics log
0x06           SL  R/O      1  SMART self-test log
0x07       GPL     R/O      1  Extended self-test log
0x08       GPL     R/O      2  Power Conditions log
0x09           SL  R/W      1  Selective self-test log
0x10       GPL     R/O      1  NCQ Command Error log
0x11       GPL     R/O      1  SATA Phy Event Counters log
0x21       GPL     R/O      1  Write stream error log
0x22       GPL     R/O      1  Read stream error log
0x24       GPL     R/O    512  Current Device Internal Status Data log
0x30       GPL,SL  R/O      9  IDENTIFY DEVICE data log
0x80-0x98  GPL,SL  R/W     16  Host vendor specific log
0x99-0x9a  GPL,SL  R/W      1  Host vendor specific log
0x9b-0x9f  GPL,SL  R/W     16  Host vendor specific log
0xa1       GPL,SL  VS      20  Device vendor specific log
0xa2       GPL     VS    4496  Device vendor specific log
0xa6       GPL     VS     192  Device vendor specific log
0xa8       GPL,SL  VS     129  Device vendor specific log
0xa9       GPL,SL  VS       1  Device vendor specific log
0xb0       GPL     VS    5176  Device vendor specific log
0xbd       GPL     VS     512  Device vendor specific log
0xbe-0xbf  GPL     VS   65535  Device vendor specific log
0xc1       GPL,SL  VS      10  Device vendor specific log
0xc3       GPL,SL  VS       8  Device vendor specific log
0xd1       GPL     VS      39  Device vendor specific log
0xdf       GPL,SL  VS       1  Device vendor specific log
0xe0       GPL,SL  R/W      1  SCT Command/Status
0xe1       GPL,SL  R/W      1  SCT Data Transfer

SMART Extended Comprehensive Error Log Version: 1 (5 sectors)
No Errors Logged

SMART Extended Self-test Log Version: 1 (1 sectors)
Num  Test_Description    Status                  Remaining  LifeTime(hours)  LBA_of_first_error
# 1  Extended offline    Completed without error       00%     22168         -
# 2  Extended offline    Completed without error       00%     22148         -
# 3  Short offline       Completed without error       00%     22091         -
# 4  Short offline       Completed without error       00%     22090         -
# 5  Extended offline    Completed without error       00%     22076         -
# 6  Short offline       Completed without error       00%     22065         -
# 7  Extended offline    Completed without error       00%     22051         -
# 8  Extended offline    Completed without error       00%     22030         -
# 9  Extended offline    Completed without error       00%     22022         -
#10  Extended offline    Completed without error       00%     21993         -
#11  Extended offline    Completed without error       00%     21983         -
#12  Extended offline    Completed without error       00%     21963         -
#13  Short offline       Completed without error       00%         3         -
#14  Vendor (0xdf)       Completed without error       00%         3         -
#15  Short offline       Completed without error       00%         1         -

SMART Selective self-test log data structure revision number 1
 SPAN  MIN_LBA  MAX_LBA  CURRENT_TEST_STATUS
    1        0        0  Not_testing
    2        0        0  Not_testing
    3        0        0  Not_testing
    4        0        0  Not_testing
    5        0        0  Not_testing
Selective self-test flags (0x0):
  After scanning selected spans, do NOT read-scan remainder of disk.
If Selective self-test is pending on power-up, resume after 0 minute delay.

SCT Status Version:                  3
SCT Version (vendor specific):       522 (0x020a)
Device State:                        Active (0)
Current Temperature:                    36 Celsius
Power Cycle Min/Max Temperature:     36/41 Celsius
Lifetime    Min/Max Temperature:     22/56 Celsius
Under/Over Temperature Limit Count:   0/1159

SCT Temperature History Version:     2
Temperature Sampling Period:         1 minute
Temperature Logging Interval:        10 minutes
Min/Max recommended Temperature:      0/ 0 Celsius
Min/Max Temperature Limit:            0/ 0 Celsius
Temperature History Size (Index):    128 (48)

SCT Error Recovery Control:
           Read:     80 (8.0 seconds)
          Write:     80 (8.0 seconds)

Device Statistics (GP Log 0x04)
Page  Offset Size        Value Flags Description
0x01  =====  =               =  ===  == General Statistics (rev 1) ==
0x01  0x008  4              41  ---  Lifetime Power-On Resets
0x01  0x010  4           26396  ---  Power-on Hours
0x01  0x018  6    255110233399  ---  Logical Sectors Written
0x01  0x020  6      1084402011  ---  Number of Write Commands
0x01  0x028  6     74236165786  ---  Logical Sectors Read
0x01  0x030  6       682784966  ---  Number of Read Commands
0x01  0x038  6               -  ---  Date and Time TimeStamp
0x03  =====  =               =  ===  == Rotating Media Statistics (rev 1) ==
0x03  0x008  4           26392  ---  Spindle Motor Power-on Hours
0x03  0x010  4             248  ---  Head Flying Hours
0x03  0x018  4            1704  ---  Head Load Events
0x03  0x020  4               1  ---  Number of Reallocated Logical Sectors
0x03  0x028  4               0  ---  Read Recovery Attempts
0x03  0x030  4               0  ---  Number of Mechanical Start Failures
0x03  0x038  4               0  ---  Number of Realloc. Candidate Logical Sectors
0x03  0x040  4              33  ---  Number of High Priority Unload Events
0x04  =====  =               =  ===  == General Errors Statistics (rev 1) ==
0x04  0x008  4               0  ---  Number of Reported Uncorrectable Errors
0x04  0x010  4               0  ---  Resets Between Cmd Acceptance and Completion
0x05  =====  =               =  ===  == Temperature Statistics (rev 1) ==
0x05  0x008  1              36  ---  Current Temperature
0x05  0x020  1              56  ---  Highest Temperature
0x05  0x028  1              26  ---  Lowest Temperature
0x05  0x030  1               -  ---  Highest Average Short Term Temperature
0x05  0x038  1               -  ---  Lowest Average Short Term Temperature
0x05  0x040  1               -  ---  Highest Average Long Term Temperature
0x05  0x048  1               -  ---  Lowest Average Long Term Temperature
0x05  0x050  4              20  ---  Time in Over-Temperature
0x05  0x058  1              55  ---  Specified Maximum Operating Temperature
0x05  0x060  4               0  ---  Time in Under-Temperature
0x05  0x068  1              13  ---  Specified Minimum Operating Temperature
                                |||_ C monitored condition met
                                ||__ D supports DSN
                                |___ N normalized value

SATA Phy Event Counters (GP Log 0x11)
ID      Size     Value  Description
0x000a  2            6  Device-to-host register FISes sent due to a COMRESET
0x0001  2            0  Command failed due to ICRC error
0x0003  2            0  R_ERR response for device-to-host data FIS
0x0004  2            0  R_ERR response for host-to-device data FIS
0x0006  2            0  R_ERR response for device-to-host non-data FIS
0x0007  2            0  R_ERR response for host-to-device non-data FIS
0x000b  2            0  CRC errors within host-to-device FIS
0x000d  2            0  Non-CRC errors within host-to-device FIS

