smartctl 6.6 2017-11-05 r4594 [x86_64-linux-3.10.0-862...] (local build)
Copyright (C) 2002-17, Bruce Allen, Christian Franke, www.smartmontools.org

=== START OF INFORMATION SECTION ===
Model Family:     Crucial/Micron MX1/2/300, M5/600, 1100 Client SSDs
Device Model:     Crucial_CT525MX300SSD1
Serial Number:    --
LU WWN Device Id: 5 00a075 ...
Firmware Version: M0CR040
User Capacity:    525,112,713,216 bytes [525 GB]
Sector Size:      512 bytes logical/physical
Rotation Rate:    Solid State Device
Form Factor:      2.5 inches
Device is:        In smartctl database [for details use: -P show]
ATA Version is:   ACS-3 T13/2161-D revision 5
SATA Version is:  SATA 3.2, 6.0 Gb/s (current: 1.5 Gb/s)
Local Time is:    --

=== START OF READ SMART DATA SECTION ===
SMART overall-health self-assessment test result: PASSED

SMART Attributes Data Structure revision number: 16
Vendor Specific SMART Attributes with Thresholds:
ID# ATTRIBUTE_NAME          FLAGS    VALUE WORST THRESH FAIL RAW_VALUE
  1 Raw_Read_Error_Rate     POSR-K   100   100   000    -    0
  5 Reallocate_NAND_Blk_Cnt -O--CK   100   100   010    -    0
  9 Power_On_Hours          -O--CK   100   100   000    -    13853
 12 Power_Cycle_Count       -O--CK   100   100   000    -    13
171 Program_Fail_Count      -O--CK   100   100   000    -    0
172 Erase_Fail_Count        -O--CK   100   100   000    -    0
173 Ave_Block-Erase_Count   -O--CK   065   065   000    -    538
174 Unexpect_Power_Loss_Ct  -O--CK   100   100   000    -    10
183 SATA_Interfac_Downshift -O--CK   100   100   000    -    0
184 Error_Correction_Count  -O--CK   100   100   000    -    0
187 Reported_Uncorrect      -O--CK   100   100   000    -    0
194 Temperature_Celsius     -O---K   071   059   000    -    29 (Min/Max 23/41)
196 Reallocated_Event_Count -O--CK   100   100   000    -    0
197 Current_Pending_Sector  -O--CK   100   100   000    -    0
198 Offline_Uncorrectable   ----CK   100   100   000    -    0
199 UDMA_CRC_Error_Count    -O--CK   100   100   000    -    0
202 Percent_Lifetime_Used   ----CK   065   065   001    -    35
206 Write_Error_Rate        -OSR--   100   100   000    -    0
246 Total_Host_Sector_Write -O--CK   100   100   000    -    102498413389
247 Host_Program_Page_Count -O--CK   100   100   000    -    3236155459
248 Bckgnd_Program_Page_Cnt -O--CK   100   100   000    -    14317878218
180 Unused_Reserve_NAND_Blk PO--CK   000   000   000    -    1928
210 Success_RAIN_Recov_Cnt  -O--CK   100   100   000    -    0
                            ||||||_ K auto-keep
                            |||||__ C event count
                            ||||___ R error rate
                            |||____ S speed/performance
                            ||_____ O updated online
                            |______ P prefailure warning

SMART Extended Comprehensive Error Log Version: 1 (16383 sectors)
No Errors Logged

Current Temperature:                    29 Celsius

