smartctl 7.1 2020-06-20 r5066 [x86_64-linux-3.10.0-1127...] (local build)
Copyright (C) 2002-19, Bruce Allen, Christian Franke, www.smartmontools.org

=== START OF INFORMATION SECTION ===
Device Model:     ST6000NM021A-2R7101
Serial Number:    --
LU WWN Device Id: 5 000c50 ...
Firmware Version: SN03
User Capacity:    6,001,175,126,016 bytes [6.00 TB]
Sector Sizes:     512 bytes logical, 4096 bytes physical
Rotation Rate:    7200 rpm
Form Factor:      3.5 inches
Device is:        Not in smartctl database [for details use: -P showall]
ATA Version is:   ACS-4 (minor revision not indicated)
SATA Version is:  SATA 3.3, 6.0 Gb/s (current: 6.0 Gb/s)
Local Time is:    --
Rd look-ahead is: Enabled
Write cache is:   Enabled
DSN feature is:   Disabled
ATA Security is:  Disabled, NOT FROZEN [SEC1]

=== START OF READ SMART DATA SECTION ===
SMART overall-health self-assessment test result: PASSED

General SMART Values:
Offline data collection status:  (0x82)	Offline data collection activity
					was completed without error.

Self-test execution status:      (   0)	The previous self-test routine completed
					without error or no self-test has ever 
					been run.
Total time to complete Offline 
data collection: 		(  559) seconds.
Offline data collection
capabilities: 			 (0x7b) SMART execute Offline immediate.

					Suspend Offline collection upon new
					command.
					Offline surface scan supported.
					Self-test supported.
					Conveyance Self-test supported.
					Selective Self-test supported.
SMART capabilities:            (0x0003)	Saves SMART data before entering
					power-saving mode.

Error logging capability:        (0x01)	Error logging supported.
					General Purpose Logging supported.
Short self-test routine 
recommended polling time: 	 (   1) minutes.
Extended self-test routine
recommended polling time: 	 ( 548) minutes.
Conveyance self-test routine
recommended polling time: 	 (   2) minutes.
SCT capabilities: 	       (0x70bd)	SCT Status supported.
					SCT Error Recovery Control supported.
					SCT Feature Control supported.
					SCT Data Table supported.

SMART Attributes Data Structure revision number: 10
Vendor Specific SMART Attributes with Thresholds:
ID# ATTRIBUTE_NAME          FLAGS    VALUE WORST THRESH FAIL RAW_VALUE
  1 Raw_Read_Error_Rate     POSR--   081   064   044    -    136612823
  3 Spin_Up_Time            PO----   095   095   000    -    0
  4 Start_Stop_Count        -O--CK   100   100   020    -    7
  5 Reallocated_Sector_Ct   PO--CK   100   100   010    -    0
  7 Seek_Error_Rate         POSR--   073   060   045    -    60359927766
  9 Power_On_Hours          -O--CK   091   091   000    -    7956
 10 Spin_Retry_Count        PO--C-   100   100   097    -    0
 12 Power_Cycle_Count       -O--CK   100   100   020    -    6
 18 Unknown_Attribute       PO-R--   100   100   050    -    0
187 Reported_Uncorrect      -O--CK   083   083   000    -    17
188 Command_Timeout         -O--CK   100   099   000    -    65537
190 Airflow_Temperature_Cel -O---K   076   059   040    -    24 (Min/Max 22/34)
192 Power-Off_Retract_Count -O--CK   100   100   000    -    2
193 Load_Cycle_Count        -O--CK   100   100   000    -    332
194 Temperature_Celsius     -O---K   024   040   000    -    24 (0 18 0 0 0)
195 Hardware_ECC_Recovered  -O-RC-   015   008   000    -    136612823
197 Current_Pending_Sector  -O--C-   100   100   000    -    0
198 Offline_Uncorrectable   ----C-   100   100   000    -    0
199 UDMA_CRC_Error_Count    -OSRCK   200   200   000    -    0
240 Head_Flying_Hours       ------   100   253   000    -    7237 (166 230 0)
241 Total_LBAs_Written      ------   100   253   000    -    32872256473
242 Total_LBAs_Read         ------   100   253   000    -    16120366495
                            ||||||_ K auto-keep
                            |||||__ C event count
                            ||||___ R error rate
                            |||____ S speed/performance
                            ||_____ O updated online
                            |______ P prefailure warning

General Purpose Log Directory Version 1
SMART           Log Directory Version 1 [multi-sector log support]
Address    Access  R/W   Size  Description
0x00       GPL,SL  R/O      1  Log Directory
0x01           SL  R/O      1  Summary SMART error log
0x02           SL  R/O      5  Comprehensive SMART error log
0x03       GPL     R/O      5  Ext. Comprehensive SMART error log
0x04       GPL     R/O    256  Device Statistics log
0x04       SL      R/O      8  Device Statistics log
0x06           SL  R/O      1  SMART self-test log
0x07       GPL     R/O      1  Extended self-test log
0x08       GPL     R/O      2  Power Conditions log
0x09           SL  R/W      1  Selective self-test log
0x0a       GPL     R/W      8  Device Statistics Notification
0x0c       GPL     R/O   2048  Pending Defects log
0x10       GPL     R/O      1  NCQ Command Error log
0x11       GPL     R/O      1  SATA Phy Event Counters log
0x13       GPL     R/O      1  SATA NCQ Send and Receive log
0x15       GPL     R/W      1  Rebuild Assist log
0x21       GPL     R/O      1  Write stream error log
0x22       GPL     R/O      1  Read stream error log
0x24       GPL     R/O    768  Current Device Internal Status Data log
0x2f       GPL     -        1  Set Sector Configuration
0x30       GPL,SL  R/O      9  IDENTIFY DEVICE data log
0x80-0x9f  GPL,SL  R/W     16  Host vendor specific log
0xa1       GPL,SL  VS      24  Device vendor specific log
0xa2       GPL     VS   16320  Device vendor specific log
0xa4       GPL,SL  VS     160  Device vendor specific log
0xa6       GPL     VS     192  Device vendor specific log
0xa8-0xa9  GPL,SL  VS     136  Device vendor specific log
0xab       GPL     VS       1  Device vendor specific log
0xad       GPL     VS      16  Device vendor specific log
0xb6       GPL     VS    1920  Device vendor specific log
0xbe-0xbf  GPL     VS   65535  Device vendor specific log
0xc1       GPL,SL  VS       8  Device vendor specific log
0xc3       GPL,SL  VS      32  Device vendor specific log
0xc9       GPL,SL  VS       8  Device vendor specific log
0xca       GPL,SL  VS      16  Device vendor specific log
0xcd       GPL,SL  VS       8  Device vendor specific log
0xd1       GPL     VS     336  Device vendor specific log
0xd2       GPL     VS   10000  Device vendor specific log
0xd4       GPL     VS    2048  Device vendor specific log
0xda       GPL,SL  VS       1  Device vendor specific log
0xe0       GPL,SL  R/W      1  SCT Command/Status
0xe1       GPL,SL  R/W      1  SCT Data Transfer

SMART Extended Comprehensive Error Log Version: 1 (5 sectors)
Device Error Count: 17
	CR     = Command Register
	FEATR  = Features Register
	COUNT  = Count (was: Sector Count) Register
	LBA_48 = Upper bytes of LBA High/Mid/Low Registers ]  ATA-8
	LH     = LBA High (was: Cylinder High) Register    ]   LBA
	LM     = LBA Mid (was: Cylinder Low) Register      ] Register
	LL     = LBA Low (was: Sector Number) Register     ]
	DV     = Device (was: Device/Head) Register
	DC     = Device Control Register
	ER     = Error register
	ST     = Status register
Powered_Up_Time is measured from power on, and printed as
DDd+hh:mm:SS.sss where DD=days, hh=hours, mm=minutes,
SS=sec, and sss=millisec. It "wraps" after 49.710 days.

Error 17 [16] occurred at disk power-on lifetime: 7925 hours (330 days + 5 hours)
  When the command that caused the error occurred, the device was active or idle.

  After command completion occurred, registers were:
  ER -- ST COUNT  LBA_48  LH LM LL DV DC
  -- -- -- == -- == == == -- -- -- -- --
  40 -- 53 00 00 00 02 ab 0c d4 30 00 00  Error: UNC at LBA = 0x2ab0cd430 = 11459679280

  Commands leading to the command that caused the error were:
  CR FEATR COUNT  LBA_48  LH LM LL DV DC  Powered_Up_Time  Command/Feature_Name
  -- == -- == -- == == == -- -- -- -- --  ---------------  --------------------
  60 00 00 02 00 00 00 6a 62 61 00 40 00 31d+ ...          READ FPDMA QUEUED
  61 00 00 04 00 00 02 b6 08 99 c0 40 00 31d+ ...          WRITE FPDMA QUEUED
  60 00 00 01 00 00 02 b6 04 1d 08 40 00 31d+ ...          READ FPDMA QUEUED
  60 00 00 02 00 00 00 6a 4a 27 00 40 00 31d+ ...          READ FPDMA QUEUED
  60 00 00 00 38 00 00 60 d9 b0 f0 40 00 31d+ ...          READ FPDMA QUEUED

Error 16 [15] occurred at disk power-on lifetime: 7915 hours (329 days + 19 hours)
  When the command that caused the error occurred, the device was active or idle.

  After command completion occurred, registers were:
  ER -- ST COUNT  LBA_48  LH LM LL DV DC
  -- -- -- == -- == == == -- -- -- -- --
  40 -- 53 00 00 00 02 a1 04 91 50 00 00  Error: UNC at LBA = 0x2a1049150 = 11291365712

  Commands leading to the command that caused the error were:
  CR FEATR COUNT  LBA_48  LH LM LL DV DC  Powered_Up_Time  Command/Feature_Name
  -- == -- == -- == == == -- -- -- -- --  ---------------  --------------------
  60 00 00 00 a8 00 02 a4 04 11 60 40 00 31d+ ...          READ FPDMA QUEUED
  60 00 00 00 08 00 02 a1 04 91 50 40 00 31d+ ...          READ FPDMA QUEUED
  60 00 00 00 08 00 02 b9 8c 9f 90 40 00 31d+ ...          READ FPDMA QUEUED
  60 00 00 01 08 00 02 b5 04 1a 00 40 00 31d+ ...          READ FPDMA QUEUED
  60 00 00 00 40 00 02 b0 88 13 78 40 00 31d+ ...          READ FPDMA QUEUED

Error 15 [14] occurred at disk power-on lifetime: 7903 hours (329 days + 7 hours)
  When the command that caused the error occurred, the device was active or idle.

  After command completion occurred, registers were:
  ER -- ST COUNT  LBA_48  LH LM LL DV DC
  -- -- -- == -- == == == -- -- -- -- --
  40 -- 53 00 00 00 01 d7 8a 66 28 00 00  Error: UNC at LBA = 0x1d78a6628 = 7911138856

  Commands leading to the command that caused the error were:
  CR FEATR COUNT  LBA_48  LH LM LL DV DC  Powered_Up_Time  Command/Feature_Name
  -- == -- == -- == == == -- -- -- -- --  ---------------  --------------------
  60 00 00 00 a8 00 02 29 fe d8 00 40 00 30d+ ...          READ FPDMA QUEUED
  60 00 00 00 08 00 01 e5 ca a2 a8 40 00 30d+ ...          READ FPDMA QUEUED
  60 00 00 00 20 00 01 d7 8a 66 28 40 00 30d+ ...          READ FPDMA QUEUED
  60 00 00 00 20 00 02 b3 c4 15 e8 40 00 30d+ ...          READ FPDMA QUEUED
  60 00 00 00 08 00 02 b3 c4 15 e0 40 00 30d+ ...          READ FPDMA QUEUED

Error 14 [13] occurred at disk power-on lifetime: 7895 hours (328 days + 23 hours)
  When the command that caused the error occurred, the device was active or idle.

  After command completion occurred, registers were:
  ER -- ST COUNT  LBA_48  LH LM LL DV DC
  -- -- -- == -- == == == -- -- -- -- --
  40 -- 53 00 00 00 02 96 04 17 58 00 00  Error: UNC at LBA = 0x296041758 = 11106785112

  Commands leading to the command that caused the error were:
  CR FEATR COUNT  LBA_48  LH LM LL DV DC  Powered_Up_Time  Command/Feature_Name
  -- == -- == -- == == == -- -- -- -- --  ---------------  --------------------
  60 00 00 00 10 00 02 b9 88 7e f0 40 00 30d+ ...          READ FPDMA QUEUED
  60 00 00 00 48 00 02 b5 04 1a c0 40 00 30d+ ...          READ FPDMA QUEUED
  60 00 00 00 08 00 02 96 04 17 e8 40 00 30d+ ...          READ FPDMA QUEUED
  60 00 00 00 08 00 02 b5 04 1a b0 40 00 30d+ ...          READ FPDMA QUEUED
  60 00 00 00 08 00 02 96 04 17 f0 40 00 30d+ ...          READ FPDMA QUEUED

Error 13 [12] occurred at disk power-on lifetime: 7893 hours (328 days + 21 hours)
  When the command that caused the error occurred, the device was active or idle.

  After command completion occurred, registers were:
  ER -- ST COUNT  LBA_48  LH LM LL DV DC
  -- -- -- == -- == == == -- -- -- -- --
  40 -- 53 00 00 00 02 b8 44 95 38 00 00  Error: WP at LBA = 0x2b8449538 = 11681436984

  Commands leading to the command that caused the error were:
  CR FEATR COUNT  LBA_48  LH LM LL DV DC  Powered_Up_Time  Command/Feature_Name
  -- == -- == -- == == == -- -- -- -- --  ---------------  --------------------
  61 00 00 04 00 00 00 60 e6 00 00 40 00 30d+ ...          WRITE FPDMA QUEUED
  60 00 00 02 00 00 02 41 98 19 00 40 00 30d+ ...          READ FPDMA QUEUED
  61 00 00 04 00 00 00 60 e5 fc 00 40 00 30d+ ...          WRITE FPDMA QUEUED
  60 00 00 00 08 00 02 b8 44 95 38 40 00 30d+ ...          READ FPDMA QUEUED
  60 00 00 00 08 00 02 b9 c4 13 00 40 00 30d+ ...          READ FPDMA QUEUED

Error 12 [11] occurred at disk power-on lifetime: 7834 hours (326 days + 10 hours)
  When the command that caused the error occurred, the device was active or idle.

  After command completion occurred, registers were:
  ER -- ST COUNT  LBA_48  LH LM LL DV DC
  -- -- -- == -- == == == -- -- -- -- --
  40 -- 53 00 00 00 02 b0 04 16 b0 00 00  Error: UNC at LBA = 0x2b00416b0 = 11542992560

  Commands leading to the command that caused the error were:
  CR FEATR COUNT  LBA_48  LH LM LL DV DC  Powered_Up_Time  Command/Feature_Name
  -- == -- == -- == == == -- -- -- -- --  ---------------  --------------------
  60 00 00 00 80 00 02 b1 08 c5 50 40 00 27d+ ...          READ FPDMA QUEUED
  60 00 00 00 18 00 02 b1 08 c5 28 40 00 27d+ ...          READ FPDMA QUEUED
  60 00 00 00 50 00 02 b0 84 18 b8 40 00 27d+ ...          READ FPDMA QUEUED
  60 00 00 00 08 00 02 b0 84 18 a0 40 00 27d+ ...          READ FPDMA QUEUED
  60 00 00 00 50 00 02 b0 84 18 48 40 00 27d+ ...          READ FPDMA QUEUED

Error 11 [10] occurred at disk power-on lifetime: 7756 hours (323 days + 4 hours)
  When the command that caused the error occurred, the device was active or idle.

  After command completion occurred, registers were:
  ER -- ST COUNT  LBA_48  LH LM LL DV DC
  -- -- -- == -- == == == -- -- -- -- --
  40 -- 53 00 00 00 02 4a 0a 85 e8 00 00  Error: UNC at LBA = 0x24a0a85e8 = 9832138216

  Commands leading to the command that caused the error were:
  CR FEATR COUNT  LBA_48  LH LM LL DV DC  Powered_Up_Time  Command/Feature_Name
  -- == -- == -- == == == -- -- -- -- --  ---------------  --------------------
  60 00 00 00 08 00 01 03 88 3f c0 40 00 24d+ ...          READ FPDMA QUEUED
  60 00 00 00 08 00 02 43 08 bb f8 40 00 24d+ ...          READ FPDMA QUEUED
  61 00 00 00 10 00 00 00 cb 5e c0 40 00 24d+ ...          WRITE FPDMA QUEUED
  60 00 00 00 08 00 02 49 4b ba 00 40 00 24d+ ...          READ FPDMA QUEUED
  60 00 00 00 10 00 02 48 cb dc 68 40 00 24d+ ...          READ FPDMA QUEUED

Error 10 [9] occurred at disk power-on lifetime: 7618 hours (317 days + 10 hours)
  When the command that caused the error occurred, the device was active or idle.

  After command completion occurred, registers were:
  ER -- ST COUNT  LBA_48  LH LM LL DV DC
  -- -- -- == -- == == == -- -- -- -- --
  40 -- 53 00 00 00 02 b0 88 92 48 00 00  Error: UNC at LBA = 0x2b0889248 = 11551674952

  Commands leading to the command that caused the error were:
  CR FEATR COUNT  LBA_48  LH LM LL DV DC  Powered_Up_Time  Command/Feature_Name
  -- == -- == -- == == == -- -- -- -- --  ---------------  --------------------
  60 00 00 01 00 00 01 77 ca 7e 48 40 00 18d+ ...          READ FPDMA QUEUED
  60 00 00 01 00 00 01 77 ca 7d 48 40 00 18d+ ...          READ FPDMA QUEUED
  60 00 00 01 08 00 01 76 02 24 30 40 00 18d+ ...          READ FPDMA QUEUED
  60 00 00 00 08 00 02 b0 8a 40 20 40 00 18d+ ...          READ FPDMA QUEUED
  61 00 00 00 10 00 02 b0 c9 1f 50 40 00 18d+ ...          WRITE FPDMA QUEUED

SMART Extended Self-test Log Version: 1 (1 sectors)
No self-tests have been logged.  [To run self-tests, use: smartctl -t]

SMART Selective self-test log data structure revision number 1
 SPAN  MIN_LBA  MAX_LBA  CURRENT_TEST_STATUS
    1        0        0  Not_testing
    2        0        0  Not_testing
    3        0        0  Not_testing
    4        0        0  Not_testing
    5        0        0  Not_testing
Selective self-test flags (0x0):
  After scanning selected spans, do NOT read-scan remainder of disk.
If Selective self-test is pending on power-up, resume after 0 minute delay.

SCT Status Version:                  3
SCT Version (vendor specific):       522 (0x020a)
Device State:                        Active (0)
Current Temperature:                    24 Celsius
Power Cycle Min/Max Temperature:     22/34 Celsius
Lifetime    Min/Max Temperature:     18/41 Celsius
Under/Over Temperature Limit Count:   0/0
SMART Status:                        0xc24f (PASSED)
Vendor specific:
00 00 00 00 00 00 00 00 00 00 00 00 00 00 00 00
00 00 00 00 02 00 00 00 00 00 00 00 00 00 00 00

SCT Temperature History Version:     2
Temperature Sampling Period:         3 minutes
Temperature Logging Interval:        59 minutes
Min/Max recommended Temperature:     10/40 Celsius
Min/Max Temperature Limit:            5/60 Celsius
Temperature History Size (Index):    128 (85)

SCT Error Recovery Control:
           Read:    100 (10.0 seconds)
          Write:    100 (10.0 seconds)

Device Statistics (GP Log 0x04)
Page  Offset Size        Value Flags Description
0x01  =====  =               =  ===  == General Statistics (rev 1) ==
0x01  0x008  4               6  ---  Lifetime Power-On Resets
0x01  0x010  4            7956  ---  Power-on Hours
0x01  0x018  6     32872257298  ---  Logical Sectors Written
0x01  0x020  6       577426670  ---  Number of Write Commands
0x01  0x028  6     16120360148  ---  Logical Sectors Read
0x01  0x030  6        66073263  ---  Number of Read Commands
0x01  0x038  6               -  ---  Date and Time TimeStamp
0x03  =====  =               =  ===  == Rotating Media Statistics (rev 1) ==
0x03  0x008  4            7954  ---  Spindle Motor Power-on Hours
0x03  0x010  4            7291  ---  Head Flying Hours
0x03  0x018  4             332  ---  Head Load Events
0x03  0x020  4               0  ---  Number of Reallocated Logical Sectors
0x03  0x028  4               0  ---  Read Recovery Attempts
0x03  0x030  4               0  ---  Number of Mechanical Start Failures
0x03  0x038  4               0  ---  Number of Realloc. Candidate Logical Sectors
0x03  0x040  4               1  ---  Number of High Priority Unload Events
0x04  =====  =               =  ===  == General Errors Statistics (rev 1) ==
0x04  0x008  4               0  ---  Number of Reported Uncorrectable Errors
0x04  0x010  4               1  ---  Resets Between Cmd Acceptance and Completion
0x05  =====  =               =  ===  == Temperature Statistics (rev 1) ==
0x05  0x008  1              24  ---  Current Temperature
0x05  0x010  1              24  ---  Average Short Term Temperature
0x05  0x018  1              25  ---  Average Long Term Temperature
0x05  0x020  1              36  ---  Highest Temperature
0x05  0x028  1              18  ---  Lowest Temperature
0x05  0x030  1              29  ---  Highest Average Short Term Temperature
0x05  0x038  1               0  ---  Lowest Average Short Term Temperature
0x05  0x040  1              26  ---  Highest Average Long Term Temperature
0x05  0x048  1              16  ---  Lowest Average Long Term Temperature
0x05  0x050  4               0  ---  Time in Over-Temperature
0x05  0x058  1              60  ---  Specified Maximum Operating Temperature
0x05  0x060  4           19490  ---  Time in Under-Temperature
0x05  0x068  1               5  ---  Specified Minimum Operating Temperature
0x06  =====  =               =  ===  == Transport Statistics (rev 1) ==
0x06  0x008  4              34  ---  Number of Hardware Resets
0x06  0x010  4              10  ---  Number of ASR Events
0x06  0x018  4               0  ---  Number of Interface CRC Errors
0xff  =====  =               =  ===  == Vendor Specific Statistics (rev 1) ==
0xff  0x010  7               0  ---  Vendor Specific
0xff  0x018  7               0  ---  Vendor Specific
                                |||_ C monitored condition met
                                ||__ D supports DSN
                                |___ N normalized value

Pending Defects log (GP Log 0x0c)
No Defects Logged

SATA Phy Event Counters (GP Log 0x11)
ID      Size     Value  Description
0x000a  2            1  Device-to-host register FISes sent due to a COMRESET
0x0001  2            0  Command failed due to ICRC error
0x0003  2            0  R_ERR response for device-to-host data FIS
0x0004  2            0  R_ERR response for host-to-device data FIS
0x0006  2            0  R_ERR response for device-to-host non-data FIS
0x0007  2            0  R_ERR response for host-to-device non-data FIS

