smartctl 7.1 2020-06-20 r5066 [x86_64-linux-3.10.0-1160...] (local build)
Copyright (C) 2002-19, Bruce Allen, Christian Franke, www.smartmontools.org

=== START OF INFORMATION SECTION ===
Model Number:                       SAMSUNG MZPLJ12THALA-00007
Serial Number:                      --
Firmware Version:                   EPK9AB5Q
PCI Vendor/Subsystem ID:            0x144d
IEEE OUI Identifier:                0x002538
Total NVM Capacity:                 12,800,076,283,904 [12.8 TB]
Unallocated NVM Capacity:           0
Controller ID:                      65
Number of Namespaces:               32
Namespace 1 Size/Capacity:          12,800,076,283,904 [12.8 TB]
Namespace 1 Formatted LBA Size:     512
Local Time is:                      Sat May ... 2025 MSK

=== START OF READ SMART DATA SECTION ===
SMART overall-health self-assessment test result: PASSED

SMART/Health Information (NVMe Log 0x02)
Critical Warning:                   0x00
Temperature:                        32 Celsius
Available Spare:                    100%
Available Spare Threshold:          10%
Percentage Used:                    0%
Data Units Read:                    344,985,015 [176 TB]
Data Units Written:                 198,095,187 [101 TB]
Host Read Commands:                 1,770,167,588
Host Write Commands:                1,557,008,173
Controller Busy Time:               1,130
Power Cycles:                       133
Power On Hours:                     15,820
Unsafe Shutdowns:                   56
Media and Data Integrity Errors:    0
Error Information Log Entries:      0
Warning  Comp. Temperature Time:    0
Critical Comp. Temperature Time:    0
Temperature Sensor 1:               32 Celsius
Temperature Sensor 2:               30 Celsius
Temperature Sensor 3:               30 Celsius

