smartctl 7.1 2020-06-20 r5066 [x86_64-linux-3.10.0-1160...] (local build)
Copyright (C) 2002-19, Bruce Allen, Christian Franke, www.smartmontools.org

=== START OF INFORMATION SECTION ===
Model Number:                       SAMSUNG MZPLJ12THALA-00007
Serial Number:                      --
Firmware Version:                   EPK9AB5Q
PCI Vendor/Subsystem ID:            0x144d
IEEE OUI Identifier:                0x002538
Total NVM Capacity:                 12,800,076,283,904 [12.8 TB]
Unallocated NVM Capacity:           0
Controller ID:                      65
Number of Namespaces:               32
Namespace 1 Size/Capacity:          12,800,076,283,904 [12.8 TB]
Namespace 1 Formatted LBA Size:     512
Local Time is:                      Fri Sep ... 2024 MSK

=== START OF READ SMART DATA SECTION ===
SMART overall-health self-assessment test result: PASSED

SMART/Health Information (NVMe Log 0x02)
Critical Warning:                   0x00
Temperature:                        31 Celsius
Available Spare:                    100%
Available Spare Threshold:          10%
Percentage Used:                    0%
Data Units Read:                    101,457,711 [51.9 TB]
Data Units Written:                 14,685,265 [7.51 TB]
Host Read Commands:                 421,395,279
Host Write Commands:                226,587,954
Controller Busy Time:               158
Power Cycles:                       133
Power On Hours:                     10,430
Unsafe Shutdowns:                   56
Media and Data Integrity Errors:    0
Error Information Log Entries:      0
Warning  Comp. Temperature Time:    0
Critical Comp. Temperature Time:    0
Temperature Sensor 1:               31 Celsius
Temperature Sensor 2:               28 Celsius
Temperature Sensor 3:               29 Celsius

