smartctl 7.1 2020-06-20 r5066 [x86_64-linux-3.10.0-1127...] (local build)
Copyright (C) 2002-19, Bruce Allen, Christian Franke, www.smartmontools.org

=== START OF INFORMATION SECTION ===
Model Number:                       KXG60ZNV1T02 TOSHIBA
Serial Number:                      --
Firmware Version:                   AGGA4104
PCI Vendor/Subsystem ID:            0x1179
IEEE OUI Identifier:                0x8ce38e
Total NVM Capacity:                 1,024,209,543,168 [1.02 TB]
Unallocated NVM Capacity:           0
Controller ID:                      0
Number of Namespaces:               1
Namespace 1 Size/Capacity:          1,024,209,543,168 [1.02 TB]
Namespace 1 Formatted LBA Size:     512
Namespace 1 IEEE EUI-64:            8ce38e ...
Local Time is:                      Thu Aug ... 2020 CEST

=== START OF READ SMART DATA SECTION ===
SMART overall-health self-assessment test result: PASSED

SMART/Health Information (NVMe Log 0x02)
Critical Warning:                   0x00
Temperature:                        35 Celsius
Available Spare:                    100%
Available Spare Threshold:          10%
Percentage Used:                    0%
Data Units Read:                    3,166,019 [1.62 TB]
Data Units Written:                 267,568 [136 GB]
Host Read Commands:                 320,400,372
Host Write Commands:                5,915,420
Controller Busy Time:               99
Power Cycles:                       8
Power On Hours:                     356
Unsafe Shutdowns:                   2
Media and Data Integrity Errors:    0
Error Information Log Entries:      0
Warning  Comp. Temperature Time:    0
Critical Comp. Temperature Time:    0
Temperature Sensor 1:               35 Celsius

