smartctl 6.6 2017-11-05 r4594 [x86_64-linux-3.10.0-957...] (local build)
Copyright (C) 2002-17, Bruce Allen, Christian Franke, www.smartmontools.org

=== START OF INFORMATION SECTION ===
Model Family:     Seagate Barracuda 7200.14 (AF)
Device Model:     ST500DM002-1BD142
Serial Number:    --
LU WWN Device Id: 5 000c50 ...
Firmware Version: HP74
User Capacity:    500,107,862,016 bytes [500 GB]
Sector Sizes:     512 bytes logical, 4096 bytes physical
Rotation Rate:    7200 rpm
Device is:        In smartctl database [for details use: -P show]
ATA Version is:   ATA8-ACS T13/1699-D revision 4
SATA Version is:  SATA 3.0, 6.0 Gb/s (current: 6.0 Gb/s)
Local Time is:    Fri Aug ... 2019 -04

=== START OF READ SMART DATA SECTION ===
SMART overall-health self-assessment test result: PASSED

SMART Attributes Data Structure revision number: 10
Vendor Specific SMART Attributes with Thresholds:
ID# ATTRIBUTE_NAME          FLAGS    VALUE WORST THRESH FAIL RAW_VALUE
  1 Raw_Read_Error_Rate     POSR-K   102   099   006    -    4842296
  3 Spin_Up_Time            PO---K   100   100   000    -    0
  4 Start_Stop_Count        -O--CK   100   100   020    -    107
  5 Reallocated_Sector_Ct   PO--CK   100   100   036    -    0
  7 Seek_Error_Rate         POSR-K   076   060   030    -    13005118032
  9 Power_On_Hours          -O--CK   087   087   000    -    12263
 10 Spin_Retry_Count        PO--CK   100   100   097    -    0
 12 Power_Cycle_Count       -O--CK   100   100   020    -    107
180 Unknown_HDD_Attribute   PO-R-K   100   100   000    -    199153376
183 Runtime_Bad_Block       -O--CK   100   100   000    -    0
184 End-to-End_Error        PO--CK   100   100   097    -    0
187 Reported_Uncorrect      -O--CK   100   100   000    -    0
188 Command_Timeout         -O--CK   100   100   000    -    0 0 0
189 High_Fly_Writes         -O-RCK   100   100   000    -    0
190 Airflow_Temperature_Cel -O---K   071   058   045    -    29 (Min/Max 23/32)
194 Temperature_Celsius     -O---K   029   042   000    -    29 (0 16 0 0 0)
195 Hardware_ECC_Recovered  -O-RCK   017   017   000    -    4842296
196 Reallocated_Event_Count -O--CK   100   100   036    -    0
197 Current_Pending_Sector  -O--CK   100   100   000    -    0
198 Offline_Uncorrectable   ----CK   100   100   000    -    0
199 UDMA_CRC_Error_Count    -O--CK   200   200   000    -    0
                            ||||||_ K auto-keep
                            |||||__ C event count
                            ||||___ R error rate
                            |||____ S speed/performance
                            ||_____ O updated online
                            |______ P prefailure warning

SMART Extended Comprehensive Error Log Version: 1 (5 sectors)
No Errors Logged

Current Temperature:                    29 Celsius

