smartctl 7.4 2023-08-01 r5530 [x86_64-linux-3.10.0-1160...] (local build)
Copyright (C) 2002-23, Bruce Allen, Christian Franke, www.smartmontools.org

=== START OF INFORMATION SECTION ===
Model Number:                       INTEL SSDPE2KX010T8
Serial Number:                      --
Firmware Version:                   VDV10131
PCI Vendor/Subsystem ID:            0x8086
IEEE OUI Identifier:                0x5cd2e4
Total NVM Capacity:                 1,000,204,886,016 [1.00 TB]
Unallocated NVM Capacity:           0
Controller ID:                      0
NVMe Version:                       1.2
Number of Namespaces:               1
Namespace 1 Size/Capacity:          1,000,204,886,016 [1.00 TB]
Namespace 1 Formatted LBA Size:     512
Namespace 1 IEEE EUI-64:            5cd2e4 ...
Local Time is:                      Sun Dec ... 2025 MSK

=== START OF READ SMART DATA SECTION ===
SMART overall-health self-assessment test result: PASSED

SMART/Health Information (NVMe Log 0x02)
Critical Warning:                   0x00
Temperature:                        27 Celsius
Available Spare:                    100%
Available Spare Threshold:          10%
Percentage Used:                    5%
Data Units Read:                    361,917,757 [185 TB]
Data Units Written:                 440,503,734 [225 TB]
Host Read Commands:                 3,460,415,987
Host Write Commands:                10,071,869,036
Controller Busy Time:               1,199
Power Cycles:                       27
Power On Hours:                     25,412
Unsafe Shutdowns:                   14
Media and Data Integrity Errors:    0
Error Information Log Entries:      0
Warning  Comp. Temperature Time:    0
Critical Comp. Temperature Time:    0

Error Information (NVMe Log 0x01, 16 of 64 entries)
No Errors Logged

