smartctl 7.0 2019-12-10 r4999 [x86_64-linux-3.10.0-862...] (local build)
Copyright (C) 2002-18, Bruce Allen, Christian Franke, www.smartmontools.org

=== START OF INFORMATION SECTION ===
Model Family:     Phison Driven SSDs
Device Model:     KINGSTON SA400S37480G
Serial Number:    --
LU WWN Device Id: 5 0026b7 ...
Firmware Version: SBFK71B1
User Capacity:    480,103,981,056 bytes [480 GB]
Sector Size:      512 bytes logical/physical
Rotation Rate:    Solid State Device
Device is:        In smartctl database [for details use: -P show]
ATA Version is:   ACS-3 T13/2161-D revision 4
SATA Version is:  SATA 3.2, 6.0 Gb/s (current: 6.0 Gb/s)
Local Time is:    --
APM feature is:   Disabled
Rd look-ahead is: Enabled
Write cache is:   Enabled
ATA Security is:  Disabled, NOT FROZEN [SEC1]

=== START OF READ SMART DATA SECTION ===
SMART overall-health self-assessment test result: PASSED

General SMART Values:
Offline data collection status:  (0x00)	Offline data collection activity
					was never started.

Total time to complete Offline 
data collection: 		(65535) seconds.
Offline data collection
capabilities: 			 (0x00) 	Offline data collection not supported.
SMART capabilities:            (0x0003)	Saves SMART data before entering
					power-saving mode.

Error logging capability:        (0x01)	Error logging supported.
					General Purpose Logging supported.

SMART Attributes Data Structure revision number: 16
Vendor Specific SMART Attributes with Thresholds:
ID# ATTRIBUTE_NAME          FLAGS    VALUE WORST THRESH FAIL RAW_VALUE
  1 Raw_Read_Error_Rate     -O--CK   001   100   000    -    44
  9 Power_On_Hours          -O--CK   100   100   000    -    14105
 12 Power_Cycle_Count       -O--CK   100   100   000    -    17
148 Unknown_Attribute       ------   100   100   000    -    132
149 Unknown_Attribute       ------   100   100   000    -    200
167 Write_Protect_Mode      ------   100   100   000    -    0
168 SATA_Phy_Error_Count    -O--C-   100   100   000    -    0
169 Bad_Block_Rate          ------   100   100   000    -    34
170 Bad_Blk_Ct_Erl/Lat      ------   100   100   000    -    0/10
172 Erase_Fail_Count        -O--CK   100   100   000    -    0
173 MaxAvgErase_Ct          ------   100   100   000    -    195 (Average 133)
181 Program_Fail_Count      -O--CK   100   100   000    -    0
182 Erase_Fail_Count        ------   100   100   000    -    41
187 Reported_Uncorrect      -O--CK   100   100   000    -    34
192 Unsafe_Shutdown_Count   -O--C-   100   100   000    -    14
194 Temperature_Celsius     -O---K   064   057   000    -    36 (Min/Max 18/43)
196 Reallocated_Event_Count -O--CK   100   100   000    -    70
199 SATA_CRC_Error_Count    -O--CK   100   100   000    -    0
218 CRC_Error_Count         -O--CK   100   100   000    -    0
231 SSD_Life_Left           ------   014   014   000    -    86
233 Flash_Writes_GiB        -O--CK   100   100   000    -    69192
241 Lifetime_Writes_GiB     -O--CK   100   100   000    -    41444
242 Lifetime_Reads_GiB      -O--CK   100   100   000    -    331009
244 Average_Erase_Count     ------   100   100   000    -    133
245 Max_Erase_Count         ------   100   100   000    -    195
246 Total_Erase_Count       ------   100   100   000    -    2757620
                            ||||||_ K auto-keep
                            |||||__ C event count
                            ||||___ R error rate
                            |||____ S speed/performance
                            ||_____ O updated online
                            |______ P prefailure warning

General Purpose Log Directory Version 1
SMART           Log Directory Version 1 [multi-sector log support]
Address    Access  R/W   Size  Description
0x00       GPL,SL  R/O      1  Log Directory
0x01           SL  R/O      1  Summary SMART error log
0x02           SL  R/O     51  Comprehensive SMART error log
0x03       GPL     R/O     64  Ext. Comprehensive SMART error log
0x04       GPL,SL  R/O      8  Device Statistics log
0x06           SL  R/O      1  SMART self-test log
0x07       GPL     R/O      1  Extended self-test log
0x09           SL  R/W      1  Selective self-test log
0x10       GPL     R/O      1  NCQ Command Error log
0x11       GPL     R/O      1  SATA Phy Event Counters log
0x30       GPL,SL  R/O      9  IDENTIFY DEVICE data log
0x80-0x9f  GPL,SL  R/W     16  Host vendor specific log

SMART Extended Comprehensive Error Log Version: 1 (64 sectors)
Device Error Count: 17
	CR     = Command Register
	FEATR  = Features Register
	COUNT  = Count (was: Sector Count) Register
	LBA_48 = Upper bytes of LBA High/Mid/Low Registers ]  ATA-8
	LH     = LBA High (was: Cylinder High) Register    ]   LBA
	LM     = LBA Mid (was: Cylinder Low) Register      ] Register
	LL     = LBA Low (was: Sector Number) Register     ]
	DV     = Device (was: Device/Head) Register
	DC     = Device Control Register
	ER     = Error register
	ST     = Status register
Powered_Up_Time is measured from power on, and printed as
DDd+hh:mm:SS.sss where DD=days, hh=hours, mm=minutes,
SS=sec, and sss=millisec. It "wraps" after 49.710 days.

Error 17 [16] occurred at disk power-on lifetime: 8821 hours (367 days + 13 hours)
  When the command that caused the error occurred, the device was active or idle.

  After command completion occurred, registers were:
  ER -- ST COUNT  LBA_48  LH LM LL DV DC
  -- -- -- == -- == == == -- -- -- -- --
  40 -- 51 00 08 00 00 00 db 66 00 ec 08  Error: UNC 8 sectors at LBA = 0x0cdb6600 = 215705088

  Commands leading to the command that caused the error were:
  CR FEATR COUNT  LBA_48  LH LM LL DV DC  Powered_Up_Time  Command/Feature_Name
  -- == -- == -- == == == -- -- -- -- --  ---------------  --------------------
  c8 00 00 00 08 00 00 00 db 66 00 ec 08     00:00:00.000  READ DMA
  c8 00 00 00 08 00 00 00 db 65 f8 ec 08     00:00:00.000  READ DMA
  c8 00 00 00 08 00 00 00 db 65 f0 ec 08     00:00:00.000  READ DMA
  c8 00 00 00 08 00 00 00 db 65 e8 ec 08     00:00:00.000  READ DMA
  c8 00 00 00 08 00 00 00 db 65 e0 ec 08     00:00:00.000  READ DMA

Error 16 [15] occurred at disk power-on lifetime: 8821 hours (367 days + 13 hours)
  When the command that caused the error occurred, the device was active or idle.

  After command completion occurred, registers were:
  ER -- ST COUNT  LBA_48  LH LM LL DV DC
  -- -- -- == -- == == == -- -- -- -- --
  40 -- 51 00 d0 00 00 00 db 65 38 ec 08  Error: UNC 208 sectors at LBA = 0x0cdb6538 = 215704888

  Commands leading to the command that caused the error were:
  CR FEATR COUNT  LBA_48  LH LM LL DV DC  Powered_Up_Time  Command/Feature_Name
  -- == -- == -- == == == -- -- -- -- --  ---------------  --------------------
  c8 00 00 00 d0 00 00 00 db 65 38 ec 08     00:00:00.000  READ DMA
  c8 00 00 00 08 00 00 00 cc 03 d0 e5 08     00:00:00.000  READ DMA
  c8 00 00 00 08 00 00 00 75 63 78 e2 08     00:00:00.000  READ DMA
  ea 00 00 00 00 00 00 00 00 00 00 a0 08     00:00:00.000  FLUSH CACHE EXT
  c8 00 00 00 20 00 00 00 75 63 48 e2 08     00:00:00.000  READ DMA

Error 15 [14] occurred at disk power-on lifetime: 8607 hours (358 days + 15 hours)
  When the command that caused the error occurred, the device was active or idle.

  After command completion occurred, registers were:
  ER -- ST COUNT  LBA_48  LH LM LL DV DC
  -- -- -- == -- == == == -- -- -- -- --
  40 -- 51 00 08 00 00 15 74 d1 d8 e0 08  Error: UNC 8 sectors at LBA = 0x1574d1d8 = 359977432

  Commands leading to the command that caused the error were:
  CR FEATR COUNT  LBA_48  LH LM LL DV DC  Powered_Up_Time  Command/Feature_Name
  -- == -- == -- == == == -- -- -- -- --  ---------------  --------------------
  25 00 00 00 08 00 00 15 74 d1 d8 e0 08     00:00:00.000  READ DMA EXT
  c8 00 00 00 20 00 00 00 79 47 68 e9 08     00:00:00.000  READ DMA
  c8 00 00 00 08 00 00 00 73 be 70 e9 08     00:00:00.000  READ DMA
  c8 00 00 00 08 00 00 00 79 47 58 e9 08     00:00:00.000  READ DMA
  c8 00 00 00 08 00 00 00 73 be 40 e9 08     00:00:00.000  READ DMA

Error 14 [13] occurred at disk power-on lifetime: 6653 hours (277 days + 5 hours)
  When the command that caused the error occurred, the device was active or idle.

  After command completion occurred, registers were:
  ER -- ST COUNT  LBA_48  LH LM LL DV DC
  -- -- -- == -- == == == -- -- -- -- --
  40 -- 51 00 f8 00 00 14 3c d8 e0 e0 08  Error: UNC 248 sectors at LBA = 0x143cd8e0 = 339532000

  Commands leading to the command that caused the error were:
  CR FEATR COUNT  LBA_48  LH LM LL DV DC  Powered_Up_Time  Command/Feature_Name
  -- == -- == -- == == == -- -- -- -- --  ---------------  --------------------
  25 00 00 00 f8 00 00 14 3c d8 e0 e0 08     00:00:00.000  READ DMA EXT
  ca 00 00 00 04 00 00 00 cc 00 10 e2 08     00:00:00.000  WRITE DMA
  ea 00 00 00 00 00 00 00 00 00 00 a0 08     00:00:00.000  FLUSH CACHE EXT
  25 00 00 00 08 00 00 14 3c d9 d0 e0 08     00:00:00.000  READ DMA EXT
  25 00 00 00 08 00 00 14 3c d9 c8 e0 08     00:00:00.000  READ DMA EXT

Error 13 [12] occurred at disk power-on lifetime: 6653 hours (277 days + 5 hours)
  When the command that caused the error occurred, the device was active or idle.

  After command completion occurred, registers were:
  ER -- ST COUNT  LBA_48  LH LM LL DV DC
  -- -- -- == -- == == == -- -- -- -- --
  40 -- 51 00 08 00 00 14 3c d9 30 e0 08  Error: UNC 8 sectors at LBA = 0x143cd930 = 339532080

  Commands leading to the command that caused the error were:
  CR FEATR COUNT  LBA_48  LH LM LL DV DC  Powered_Up_Time  Command/Feature_Name
  -- == -- == -- == == == -- -- -- -- --  ---------------  --------------------
  25 00 00 00 08 00 00 14 3c d9 30 e0 08     00:00:00.000  READ DMA EXT
  25 00 00 00 08 00 00 14 3c d9 28 e0 08     00:00:00.000  READ DMA EXT
  25 00 00 00 08 00 00 14 3c d9 20 e0 08     00:00:00.000  READ DMA EXT
  25 00 00 00 08 00 00 14 3c d9 18 e0 08     00:00:00.000  READ DMA EXT
  25 00 00 00 08 00 00 14 3c d9 10 e0 08     00:00:00.000  READ DMA EXT

Error 12 [11] occurred at disk power-on lifetime: 6653 hours (277 days + 5 hours)
  When the command that caused the error occurred, the device was active or idle.

  After command completion occurred, registers were:
  ER -- ST COUNT  LBA_48  LH LM LL DV DC
  -- -- -- == -- == == == -- -- -- -- --
  40 -- 51 00 f8 00 00 14 3c d8 e0 e0 08  Error: UNC 248 sectors at LBA = 0x143cd8e0 = 339532000

  Commands leading to the command that caused the error were:
  CR FEATR COUNT  LBA_48  LH LM LL DV DC  Powered_Up_Time  Command/Feature_Name
  -- == -- == -- == == == -- -- -- -- --  ---------------  --------------------
  25 00 00 00 f8 00 00 14 3c d8 e0 e0 08     00:00:00.000  READ DMA EXT
  25 00 00 00 08 00 00 14 3c d9 d0 e0 08     00:00:00.000  READ DMA EXT
  25 00 00 00 08 00 00 14 3c d9 c8 e0 08     00:00:00.000  READ DMA EXT
  25 00 00 00 08 00 00 14 3c d9 c0 e0 08     00:00:00.000  READ DMA EXT
  25 00 00 00 08 00 00 14 3c d9 b8 e0 08     00:00:00.000  READ DMA EXT

Error 11 [10] occurred at disk power-on lifetime: 6653 hours (277 days + 5 hours)
  When the command that caused the error occurred, the device was active or idle.

  After command completion occurred, registers were:
  ER -- ST COUNT  LBA_48  LH LM LL DV DC
  -- -- -- == -- == == == -- -- -- -- --
  40 -- 51 00 f8 00 00 14 3c d8 e0 e0 08  Error: UNC 248 sectors at LBA = 0x143cd8e0 = 339532000

  Commands leading to the command that caused the error were:
  CR FEATR COUNT  LBA_48  LH LM LL DV DC  Powered_Up_Time  Command/Feature_Name
  -- == -- == -- == == == -- -- -- -- --  ---------------  --------------------
  25 00 00 00 f8 00 00 14 3c d8 e0 e0 08     00:00:00.000  READ DMA EXT
  ea 00 00 00 00 00 00 00 00 00 00 a0 08     00:00:00.000  FLUSH CACHE EXT
  35 00 00 00 60 00 00 10 77 47 a0 e0 08     00:00:00.000  WRITE DMA EXT
  35 00 00 00 08 00 00 1b 8d 13 f0 e0 08     00:00:00.000  WRITE DMA EXT
  35 00 00 00 08 00 00 1b 89 35 00 e0 08     00:00:00.000  WRITE DMA EXT

Error 10 [9] occurred at disk power-on lifetime: 5422 hours (225 days + 22 hours)
  When the command that caused the error occurred, the device was active or idle.

  After command completion occurred, registers were:
  ER -- ST COUNT  LBA_48  LH LM LL DV DC
  -- -- -- == -- == == == -- -- -- -- --
  40 -- 51 00 f8 00 00 13 d9 b2 e0 e0 08  Error: UNC 248 sectors at LBA = 0x13d9b2e0 = 333034208

  Commands leading to the command that caused the error were:
  CR FEATR COUNT  LBA_48  LH LM LL DV DC  Powered_Up_Time  Command/Feature_Name
  -- == -- == -- == == == -- -- -- -- --  ---------------  --------------------
  25 00 00 00 f8 00 00 13 d9 b2 e0 e0 08     00:00:00.000  READ DMA EXT
  ea 00 00 00 00 00 00 00 00 00 00 a0 08     00:00:00.000  FLUSH CACHE EXT
  ca 00 00 00 08 00 00 00 af 81 70 e8 08     00:00:00.000  WRITE DMA
  ea 00 00 00 00 00 00 00 00 00 00 a0 08     00:00:00.000  FLUSH CACHE EXT
  ca 00 00 00 38 00 00 00 af 81 38 e8 08     00:00:00.000  WRITE DMA

SMART Extended Self-test Log Version: 1 (1 sectors)
No self-tests have been logged.  [To run self-tests, use: smartctl -t]

Device Statistics (GP Log 0x04)
Page  Offset Size        Value Flags Description
0x01  =====  =               =  ===  == General Statistics (rev 1) ==
0x01  0x008  4              17  ---  Lifetime Power-On Resets
0x01  0x010  4           14105  ---  Power-on Hours
0x01  0x018  6     86915246140  ---  Logical Sectors Written
0x01  0x028  6    694177449487  ---  Logical Sectors Read
0x04  =====  =               =  ===  == General Errors Statistics (rev 1) ==
0x04  0x008  4              44  ---  Number of Reported Uncorrectable Errors
0x05  =====  =               =  ===  == Temperature Statistics (rev 1) ==
0x05  0x008  1              36  ---  Current Temperature
0x05  0x020  1              43  ---  Highest Temperature
0x05  0x028  1              18  ---  Lowest Temperature
0x06  =====  =               =  ===  == Transport Statistics (rev 1) ==
0x06  0x018  4               0  ---  Number of Interface CRC Errors
0x07  =====  =               =  ===  == Solid State Device Statistics (rev 1) ==
0x07  0x008  1              13  ---  Percentage Used Endurance Indicator
                                |||_ C monitored condition met
                                ||__ D supports DSN
                                |___ N normalized value

SATA Phy Event Counters (GP Log 0x11)
ID      Size     Value  Description
0x0001  2            0  Command failed due to ICRC error
0x0003  2            0  R_ERR response for device-to-host data FIS
0x0004  2            0  R_ERR response for host-to-device data FIS
0x0006  2            0  R_ERR response for device-to-host non-data FIS
0x0007  2            0  R_ERR response for host-to-device non-data FIS
0x0008  2            0  Device-to-host non-data FIS retries
0x0009  4           26  Transition from drive PhyRdy to drive PhyNRdy
0x000a  4           20  Device-to-host register FISes sent due to a COMRESET
0x000f  2            0  R_ERR response for host-to-device data FIS, CRC
0x0010  2            0  R_ERR response for host-to-device data FIS, non-CRC
0x0012  2            0  R_ERR response for host-to-device non-data FIS, CRC
0x0013  2            0  R_ERR response for host-to-device non-data FIS, non-CRC

