smartctl 7.0 2019-08-20 r4949 [x86_64-linux-3.10.0-1062...] (local build)
Copyright (C) 2002-18, Bruce Allen, Christian Franke, www.smartmontools.org

=== START OF INFORMATION SECTION ===
Model Number:                       Dell Express Flash CD5 960G SFF
Serial Number:                      --
Firmware Version:                   1.1.1
PCI Vendor ID:                      0x1179
PCI Vendor Subsystem ID:            0x1028
IEEE OUI Identifier:                0x8ce38e
Total NVM Capacity:                 960,197,124,096 [960 GB]
Unallocated NVM Capacity:           0
Controller ID:                      1
Number of Namespaces:               1
Namespace 1 Size/Capacity:          960,197,124,096 [960 GB]
Namespace 1 Utilization:            931,198,271,488 [931 GB]
Namespace 1 Formatted LBA Size:     512
Namespace 1 IEEE EUI-64:            8ce38e ...
Local Time is:                      --

=== START OF READ SMART DATA SECTION ===
SMART overall-health self-assessment test result: PASSED

SMART/Health Information (NVMe Log 0x02)
Critical Warning:                   0x00
Temperature:                        37 Celsius
Available Spare:                    100%
Available Spare Threshold:          10%
Percentage Used:                    1%
Data Units Read:                    81,322,689 [41.6 TB]
Data Units Written:                 107,504,840 [55.0 TB]
Host Read Commands:                 610,453,413
Host Write Commands:                1,017,085,794
Controller Busy Time:               2,204
Power Cycles:                       14
Power On Hours:                     1,437
Unsafe Shutdowns:                   12
Media and Data Integrity Errors:    0
Error Information Log Entries:      18
Warning  Comp. Temperature Time:    0
Critical Comp. Temperature Time:    0

