smartctl 7.1 2020-06-20 r5066 [x86_64-linux-3.10.0-1160...] (local build)
Copyright (C) 2002-19, Bruce Allen, Christian Franke, www.smartmontools.org

=== START OF INFORMATION SECTION ===
Model Number:                       Dell Express Flash CD5 960G SFF
Serial Number:                      --
Firmware Version:                   1.2.0
PCI Vendor ID:                      0x1179
PCI Vendor Subsystem ID:            0x1028
IEEE OUI Identifier:                0x8ce38e
Total NVM Capacity:                 960,197,124,096 [960 GB]
Unallocated NVM Capacity:           0
Controller ID:                      1
Number of Namespaces:               1
Namespace 1 Size/Capacity:          960,197,124,096 [960 GB]
Namespace 1 Utilization:            26,246,029,312 [26.2 GB]
Namespace 1 Formatted LBA Size:     512
Namespace 1 IEEE EUI-64:            8ce38e ...
Local Time is:                      --

=== START OF READ SMART DATA SECTION ===
SMART overall-health self-assessment test result: PASSED

SMART/Health Information (NVMe Log 0x02)
Critical Warning:                   0x00
Temperature:                        27 Celsius
Available Spare:                    100%
Available Spare Threshold:          10%
Percentage Used:                    0%
Data Units Read:                    1,989,531 [1.01 TB]
Data Units Written:                 699,205 [357 GB]
Host Read Commands:                 15,427,290
Host Write Commands:                22,464,883
Controller Busy Time:               41
Power Cycles:                       29
Power On Hours:                     610
Unsafe Shutdowns:                   21
Media and Data Integrity Errors:    0
Error Information Log Entries:      109
Warning  Comp. Temperature Time:    0
Critical Comp. Temperature Time:    0

