smartctl 7.1 2020-06-20 r5066 [x86_64-linux-3.10.0-1160...] (local build)
Copyright (C) 2002-19, Bruce Allen, Christian Franke, www.smartmontools.org

=== START OF INFORMATION SECTION ===
Model Number:                       WUS3BA196C7P3E3
Serial Number:                      --
Firmware Version:                   R0112001
PCI Vendor/Subsystem ID:            0x1b96
IEEE OUI Identifier:                0x0014ee
Total NVM Capacity:                 800,166,076,416 [800 GB]
Unallocated NVM Capacity:           0
Controller ID:                      0
Number of Namespaces:               1
Namespace 1 Size/Capacity:          800,166,076,416 [800 GB]
Namespace 1 Formatted LBA Size:     512
Namespace 1 IEEE EUI-64:            0014ee ...
Local Time is:                      Tue Nov ... 2021 MSK

=== START OF READ SMART DATA SECTION ===
SMART overall-health self-assessment test result: PASSED

SMART/Health Information (NVMe Log 0x02)
Critical Warning:                   0x00
Temperature:                        29 Celsius
Available Spare:                    100%
Available Spare Threshold:          10%
Percentage Used:                    15%
Data Units Read:                    529,688,072 [271 TB]
Data Units Written:                 1,478,079,490 [756 TB]
Host Read Commands:                 13,723,155,135
Host Write Commands:                26,462,093,559
Controller Busy Time:               141,589
Power Cycles:                       24
Power On Hours:                     17,808
Unsafe Shutdowns:                   19
Media and Data Integrity Errors:    0
Error Information Log Entries:      543
Warning  Comp. Temperature Time:    0
Critical Comp. Temperature Time:    0
Temperature Sensor 1:               32 Celsius

