smartctl 6.6 2017-11-05 r4594 [x86_64-linux-3.10.0-957...] (local build)
Copyright (C) 2002-17, Bruce Allen, Christian Franke, www.smartmontools.org

=== START OF INFORMATION SECTION ===
Model Family:     Intel 3710 Series SSDs
Device Model:     INTEL SSDSC2BA800G4R
Serial Number:    --
LU WWN Device Id: 5 5cd2e4 ...
Add. Product Id:  DELL(tm)
Firmware Version: G201DL29
User Capacity:    800,166,076,416 bytes [800 GB]
Sector Sizes:     512 bytes logical, 4096 bytes physical
Rotation Rate:    Solid State Device
Form Factor:      2.5 inches
Device is:        In smartctl database [for details use: -P show]
ATA Version is:   ACS-3 T13/2161-D revision 5
SATA Version is:  SATA 3.1, 6.0 Gb/s (current: 6.0 Gb/s)
Local Time is:    --

=== START OF READ SMART DATA SECTION ===
SMART overall-health self-assessment test result: PASSED

SMART Attributes Data Structure revision number: 1
Vendor Specific SMART Attributes with Thresholds:
ID# ATTRIBUTE_NAME          FLAGS    VALUE WORST THRESH FAIL RAW_VALUE
  1 Raw_Read_Error_Rate     -OSR--   130   130   039    -    1046334
  5 Reallocated_Sector_Ct   PO--CK   100   100   001    -    0
  9 Power_On_Hours_and_Msec -O--CK   100   100   000    -    22532h+00m+00.000s
 12 Power_Cycle_Count       -O--CK   100   100   000    -    146
 13 Read_Soft_Error_Rate    -OSRC-   130   100   000    -    1046334
179 Used_Rsvd_Blk_Cnt_Tot   PO--CK   100   100   010    -    0
180 Unused_Rsvd_Blk_Cnt_Tot -O--CK   100   100   000    -    60932
181 Program_Fail_Cnt_Total  -O-RCK   100   100   000    -    0
182 Erase_Fail_Count_Total  -O-RCK   100   100   000    -    0
184 End-to-End_Error        -O--CK   100   100   000    -    0
194 Temperature_Celsius     -O---K   100   100   000    -    38
195 Hardware_ECC_Recovered  -O--CK   100   100   000    -    0
198 Offline_Uncorrectable   ----C-   100   100   000    -    0
199 UDMA_CRC_Error_Count    -OSRCK   100   100   000    -    0
201 Unknown_SSD_Attribute   PO--CK   100   100   010    -    382325303166
202 Unknown_SSD_Attribute   POS--K   100   100   000    -    0
226 Workld_Media_Wear_Indic -O--CK   100   100   000    -    102400
227 Workld_Host_Reads_Perc  -O--CK   100   100   000    -    0
228 Workload_Minutes        -O--CK   100   100   000    -    3784618102
233 Media_Wearout_Indicator -O--CK   100   100   000    -    21563
245 Unknown_Attribute       -O--CK   100   100   000    -    0
                            ||||||_ K auto-keep
                            |||||__ C event count
                            ||||___ R error rate
                            |||____ S speed/performance
                            ||_____ O updated online
                            |______ P prefailure warning

SMART Extended Comprehensive Error Log Version: 1 (20 sectors)
No Errors Logged

Current Temperature:                    38 Celsius

