smartctl 7.1 2020-06-20 r5066 [x86_64-linux-3.10.0-1160...] (local build)
Copyright (C) 2002-19, Bruce Allen, Christian Franke, www.smartmontools.org

=== START OF INFORMATION SECTION ===
Model Number:                       INTEL SSDPEDME400G4
Serial Number:                      --
Firmware Version:                   8DV10171
PCI Vendor/Subsystem ID:            0x8086
IEEE OUI Identifier:                0x5cd2e4
Controller ID:                      0
Number of Namespaces:               1
Namespace 1 Size/Capacity:          400,088,457,216 [400 GB]
Namespace 1 Formatted LBA Size:     512
Local Time is:                      Tue Nov ... 2021 MSK

=== START OF READ SMART DATA SECTION ===
SMART overall-health self-assessment test result: PASSED

SMART/Health Information (NVMe Log 0x02)
Critical Warning:                   0x00
Temperature:                        24 Celsius
Available Spare:                    100%
Available Spare Threshold:          10%
Percentage Used:                    44%
Data Units Read:                    2,456,580,338 [1.25 PB]
Data Units Written:                 4,412,817,901 [2.25 PB]
Host Read Commands:                 77,581,954,385
Host Write Commands:                102,932,564,907
Controller Busy Time:               8,331
Power Cycles:                       120
Power On Hours:                     39,679
Unsafe Shutdowns:                   108
Media and Data Integrity Errors:    0
Error Information Log Entries:      0

