smartctl 7.1 2020-06-20 r5066 [x86_64-linux-3.10.0-1160...] (local build)
Copyright (C) 2002-19, Bruce Allen, Christian Franke, www.smartmontools.org

=== START OF INFORMATION SECTION ===
Model Number:                       INTEL SSDPEDME400G4
Serial Number:                      --
Firmware Version:                   8DV10171
PCI Vendor/Subsystem ID:            0x8086
IEEE OUI Identifier:                0x5cd2e4
Controller ID:                      0
Number of Namespaces:               1
Namespace 1 Size/Capacity:          400,088,457,216 [400 GB]
Namespace 1 Formatted LBA Size:     512
Local Time is:                      Mon Dec ... 2021 MSK

=== START OF READ SMART DATA SECTION ===
SMART overall-health self-assessment test result: PASSED

SMART/Health Information (NVMe Log 0x02)
Critical Warning:                   0x00
Temperature:                        28 Celsius
Available Spare:                    99%
Available Spare Threshold:          10%
Percentage Used:                    56%
Data Units Read:                    2,982,610,155 [1.52 PB]
Data Units Written:                 5,679,471,277 [2.90 PB]
Host Read Commands:                 106,605,733,473
Host Write Commands:                116,492,889,746
Controller Busy Time:               10,017
Power Cycles:                       133
Power On Hours:                     39,991
Unsafe Shutdowns:                   121
Media and Data Integrity Errors:    0
Error Information Log Entries:      0

