smartctl 7.1 2020-06-20 r5066 [x86_64-linux-3.10.0-1160...] (local build)
Copyright (C) 2002-19, Bruce Allen, Christian Franke, www.smartmontools.org

=== START OF INFORMATION SECTION ===
Model Family:     Micron 5100 Pro / 5200 / 5300 SSDs
Device Model:     Micron_5100_MTFDDAK480TCB
Serial Number:    --
LU WWN Device Id: 5 00a075 ...
Firmware Version: D0MU037
User Capacity:    480,103,981,056 bytes [480 GB]
Sector Sizes:     512 bytes logical, 4096 bytes physical
Rotation Rate:    Solid State Device
Form Factor:      2.5 inches
Device is:        In smartctl database [for details use: -P show]
ATA Version is:   ACS-3 T13/2161-D revision 5
SATA Version is:  SATA 3.2, 6.0 Gb/s (current: 6.0 Gb/s)
Local Time is:    Fri Apr ... 2022 UTC
APM level is:     254 (maximum performance)
Rd look-ahead is: Enabled
Write cache is:   Enabled
ATA Security is:  Disabled, frozen [SEC2]

=== START OF READ SMART DATA SECTION ===
SMART overall-health self-assessment test result: PASSED

General SMART Values:
Offline data collection status:  (0x06)	Offline data collection activity
					was aborted by the device with a fatal error.

Self-test execution status:      (   0)	The previous self-test routine completed
					without error or no self-test has ever 
					been run.
Total time to complete Offline 
data collection: 		( 1309) seconds.
Offline data collection
capabilities: 			 (0x7b) SMART execute Offline immediate.

					Suspend Offline collection upon new
					command.
					Offline surface scan supported.
					Self-test supported.
					Conveyance Self-test supported.
					Selective Self-test supported.
SMART capabilities:            (0x0003)	Saves SMART data before entering
					power-saving mode.

Error logging capability:        (0x01)	Error logging supported.
					General Purpose Logging supported.
Short self-test routine 
recommended polling time: 	 (   2) minutes.
Extended self-test routine
recommended polling time: 	 (   6) minutes.
Conveyance self-test routine
recommended polling time: 	 (   3) minutes.
SCT capabilities: 	       (0x0035)	SCT Status supported.
					SCT Feature Control supported.
					SCT Data Table supported.

SMART Attributes Data Structure revision number: 16
Vendor Specific SMART Attributes with Thresholds:
ID# ATTRIBUTE_NAME          FLAGS    VALUE WORST THRESH FAIL RAW_VALUE
  1 Raw_Read_Error_Rate     POSR-K   100   100   050    -    124
  5 Reallocated_Sector_Ct   -O--CK   100   100   001    -    35
  9 Power_On_Hours          -O--CK   100   100   001    -    31313
 12 Power_Cycle_Count       -O--CK   100   100   001    -    2
170 Reserved_Block_Pct      PO--CK   100   100   010    -    35
171 Program_Fail_Count      -O--CK   100   100   000    -    0
172 Erase_Fail_Count        -O--CK   100   100   001    -    0
173 Avg_Block-Erase_Count   -O--CK   099   099   000    -    45
174 Unexpect_Power_Loss_Ct  -O--CK   100   100   000    -    1
183 SATA_Int_Downshift_Ct   -O--CK   100   100   000    -    0
184 End-to-End_Error        -O--CK   100   100   000    -    0
187 Reported_Uncorrect      -O--CK   100   100   000    -    115
188 Command_Timeout         -O--CK   100   100   000    -    2
194 Temperature_Celsius     -O---K   058   051   000    -    42 (Min/Max 28/49)
195 Hardware_ECC_Recovered  -O--CK   100   100   000    -    9
196 Reallocated_Event_Count -O--CK   100   100   000    -    35
197 Current_Pending_Sector  -O--CK   100   100   000    -    0
198 Offline_Uncorrectable   ----CK   100   100   000    -    1
199 UDMA_CRC_Error_Count    -O--CK   100   100   000    -    0
202 Percent_Lifetime_Remain ----CK   099   099   001    -    1
206 Write_Error_Rate        -OSR--   100   100   000    -    0
246 Unknown_Micron_Attrib   -O--CK   100   100   000    -    28859107215
247 Host_Program_Page_Count -O--CK   100   100   000    -    964270639
248 Bckgnd_Program_Page_Cnt -O--CK   100   100   000    -    1029553972
180 Unused_Rsvd_Blk_Cnt_Tot PO--CK   000   000   000    -    7730
210 RAIN_Success_Recovered  -O--CK   100   100   000    -    2526
                            ||||||_ K auto-keep
                            |||||__ C event count
                            ||||___ R error rate
                            |||____ S speed/performance
                            ||_____ O updated online
                            |______ P prefailure warning

General Purpose Log Directory Version 1
SMART           Log Directory Version 1 [multi-sector log support]
Address    Access  R/W   Size  Description
0x00       GPL,SL  R/O      1  Log Directory
0x01           SL  R/O      1  Summary SMART error log
0x02           SL  R/O     51  Comprehensive SMART error log
0x03       GPL     R/O  16383  Ext. Comprehensive SMART error log
0x04       GPL,SL  R/O      8  Device Statistics log
0x06           SL  R/O      1  SMART self-test log
0x07       GPL     R/O      1  Extended self-test log
0x09           SL  R/W      1  Selective self-test log
0x10       GPL     R/O      1  NCQ Command Error log
0x11       GPL     R/O      1  SATA Phy Event Counters log
0x13       GPL     R/O      1  SATA NCQ Send and Receive log
0x24       GPL     R/O   8000  Current Device Internal Status Data log
0x25       GPL     R/O   8000  Saved Device Internal Status Data log
0x30       GPL,SL  R/O      9  IDENTIFY DEVICE data log
0x80-0x9f  GPL,SL  R/W     16  Host vendor specific log
0xa0       GPL     VS   35328  Device vendor specific log
0xa1       GPL,SL  VS       4  Device vendor specific log
0xa3       GPL     VS   13824  Device vendor specific log
0xa4       GPL     VS     354  Device vendor specific log
0xa4       SL      VS      98  Device vendor specific log
0xa5       GPL     VS    8000  Device vendor specific log
0xa5       SL      VS      64  Device vendor specific log
0xa6       GPL     VS    8000  Device vendor specific log
0xa6       SL      VS      64  Device vendor specific log
0xe0       GPL,SL  R/W      1  SCT Command/Status
0xe1       GPL,SL  R/W      1  SCT Data Transfer

SMART Extended Comprehensive Error Log Version: 1 (16383 sectors)
Device Error Count: 115
	CR     = Command Register
	FEATR  = Features Register
	COUNT  = Count (was: Sector Count) Register
	LBA_48 = Upper bytes of LBA High/Mid/Low Registers ]  ATA-8
	LH     = LBA High (was: Cylinder High) Register    ]   LBA
	LM     = LBA Mid (was: Cylinder Low) Register      ] Register
	LL     = LBA Low (was: Sector Number) Register     ]
	DV     = Device (was: Device/Head) Register
	DC     = Device Control Register
	ER     = Error register
	ST     = Status register
Powered_Up_Time is measured from power on, and printed as
DDd+hh:mm:SS.sss where DD=days, hh=hours, mm=minutes,
SS=sec, and sss=millisec. It "wraps" after 49.710 days.

Error 115 [114] occurred at disk power-on lifetime: 26251 hours (1093 days + 19 hours)
  When the command that caused the error occurred, the device was active or idle.

  After command completion occurred, registers were:
  ER -- ST COUNT  LBA_48  LH LM LL DV DC
  -- -- -- == -- == == == -- -- -- -- --
  40 -- 51 01 00 00 00 07 92 24 00 40 08  Error: UNC at LBA = 0x07922400 = 127017984

  Commands leading to the command that caused the error were:
  CR FEATR COUNT  LBA_48  LH LM LL DV DC  Powered_Up_Time  Command/Feature_Name
  -- == -- == -- == == == -- -- -- -- --  ---------------  --------------------
  60 00 00 01 00 00 00 07 92 24 00 40 08     04:09:39.488  READ FPDMA QUEUED
  60 00 00 01 00 00 00 07 92 23 00 40 08     04:09:39.488  READ FPDMA QUEUED
  60 00 00 01 00 00 00 07 92 22 00 40 08     04:09:39.488  READ FPDMA QUEUED
  60 00 00 01 00 00 00 07 92 21 00 40 08     04:09:39.488  READ FPDMA QUEUED
  60 00 00 01 00 00 00 07 92 20 00 40 08     04:09:39.488  READ FPDMA QUEUED

Error 114 [113] occurred at disk power-on lifetime: 26251 hours (1093 days + 19 hours)
  When the command that caused the error occurred, the device was active or idle.

  After command completion occurred, registers were:
  ER -- ST COUNT  LBA_48  LH LM LL DV DC
  -- -- -- == -- == == == -- -- -- -- --
  40 -- 51 01 00 00 00 07 90 c7 00 40 08  Error: UNC at LBA = 0x0790c700 = 126928640

  Commands leading to the command that caused the error were:
  CR FEATR COUNT  LBA_48  LH LM LL DV DC  Powered_Up_Time  Command/Feature_Name
  -- == -- == -- == == == -- -- -- -- --  ---------------  --------------------
  60 00 00 01 00 00 00 07 90 c7 00 40 08     04:09:39.488  READ FPDMA QUEUED
  60 00 00 01 00 00 00 07 90 c6 00 40 08     04:09:39.488  READ FPDMA QUEUED
  60 00 00 01 00 00 00 07 90 c5 00 40 08     04:09:39.488  READ FPDMA QUEUED
  60 00 00 01 00 00 00 07 90 c4 00 40 08     04:09:39.488  READ FPDMA QUEUED
  60 00 00 01 00 00 00 07 90 c3 00 40 08     04:09:39.488  READ FPDMA QUEUED

Error 113 [112] occurred at disk power-on lifetime: 26251 hours (1093 days + 19 hours)
  When the command that caused the error occurred, the device was active or idle.

  After command completion occurred, registers were:
  ER -- ST COUNT  LBA_48  LH LM LL DV DC
  -- -- -- == -- == == == -- -- -- -- --
  40 -- 51 01 00 00 00 05 90 39 00 40 08  Error: UNC at LBA = 0x05903900 = 93337856

  Commands leading to the command that caused the error were:
  CR FEATR COUNT  LBA_48  LH LM LL DV DC  Powered_Up_Time  Command/Feature_Name
  -- == -- == -- == == == -- -- -- -- --  ---------------  --------------------
  60 00 00 01 00 00 00 05 90 39 00 40 08     04:08:39.488  READ FPDMA QUEUED
  60 00 00 01 00 00 00 05 90 38 00 40 08     04:08:39.488  READ FPDMA QUEUED
  60 00 00 01 00 00 00 05 90 37 00 40 08     04:08:39.488  READ FPDMA QUEUED
  60 00 00 01 00 00 00 05 90 36 00 40 08     04:08:39.488  READ FPDMA QUEUED
  60 00 00 01 00 00 00 05 90 35 00 40 08     04:08:39.488  READ FPDMA QUEUED

Error 112 [111] occurred at disk power-on lifetime: 26251 hours (1093 days + 19 hours)
  When the command that caused the error occurred, the device was active or idle.

  After command completion occurred, registers were:
  ER -- ST COUNT  LBA_48  LH LM LL DV DC
  -- -- -- == -- == == == -- -- -- -- --
  40 -- 51 01 00 00 00 01 91 00 00 40 08  Error: UNC at LBA = 0x01910000 = 26279936

  Commands leading to the command that caused the error were:
  CR FEATR COUNT  LBA_48  LH LM LL DV DC  Powered_Up_Time  Command/Feature_Name
  -- == -- == -- == == == -- -- -- -- --  ---------------  --------------------
  60 00 00 01 00 00 00 01 91 00 00 40 08     04:05:39.488  READ FPDMA QUEUED
  60 00 00 01 00 00 00 01 90 ff 00 40 08     04:05:39.488  READ FPDMA QUEUED
  60 00 00 01 00 00 00 01 90 fe 00 40 08     04:05:39.488  READ FPDMA QUEUED
  60 00 00 01 00 00 00 01 90 fd 00 40 08     04:05:39.488  READ FPDMA QUEUED
  60 00 00 01 00 00 00 01 90 fc 00 40 08     04:05:39.488  READ FPDMA QUEUED

Error 111 [110] occurred at disk power-on lifetime: 26251 hours (1093 days + 19 hours)
  When the command that caused the error occurred, the device was active or idle.

  After command completion occurred, registers were:
  ER -- ST COUNT  LBA_48  LH LM LL DV DC
  -- -- -- == -- == == == -- -- -- -- --
  40 -- 51 01 00 00 00 01 90 e0 00 40 08  Error: UNC at LBA = 0x0190e000 = 26271744

  Commands leading to the command that caused the error were:
  CR FEATR COUNT  LBA_48  LH LM LL DV DC  Powered_Up_Time  Command/Feature_Name
  -- == -- == -- == == == -- -- -- -- --  ---------------  --------------------
  60 00 00 01 00 00 00 01 90 e0 00 40 08     04:05:39.488  READ FPDMA QUEUED
  60 00 00 01 00 00 00 01 90 df 00 40 08     04:05:39.488  READ FPDMA QUEUED
  60 00 00 01 00 00 00 01 90 de 00 40 08     04:05:39.488  READ FPDMA QUEUED
  60 00 00 01 00 00 00 01 90 dd 00 40 08     04:05:39.488  READ FPDMA QUEUED
  60 00 00 01 00 00 00 01 90 dc 00 40 08     04:05:39.488  READ FPDMA QUEUED

Error 110 [109] occurred at disk power-on lifetime: 26251 hours (1093 days + 19 hours)
  When the command that caused the error occurred, the device was active or idle.

  After command completion occurred, registers were:
  ER -- ST COUNT  LBA_48  LH LM LL DV DC
  -- -- -- == -- == == == -- -- -- -- --
  40 -- 51 01 00 00 00 01 90 c3 00 40 08  Error: UNC at LBA = 0x0190c300 = 26264320

  Commands leading to the command that caused the error were:
  CR FEATR COUNT  LBA_48  LH LM LL DV DC  Powered_Up_Time  Command/Feature_Name
  -- == -- == -- == == == -- -- -- -- --  ---------------  --------------------
  60 00 00 01 00 00 00 01 90 c3 00 40 08     04:05:39.488  READ FPDMA QUEUED
  60 00 00 01 00 00 00 01 90 c2 00 40 08     04:05:39.488  READ FPDMA QUEUED
  60 00 00 01 00 00 00 01 90 c1 00 40 08     04:05:39.488  READ FPDMA QUEUED
  60 00 00 01 00 00 00 01 90 c0 00 40 08     04:05:39.488  READ FPDMA QUEUED
  60 00 00 01 00 00 00 01 90 bf 00 40 08     04:05:39.488  READ FPDMA QUEUED

Error 109 [108] occurred at disk power-on lifetime: 26234 hours (1093 days + 2 hours)
  When the command that caused the error occurred, the device was active or idle.

  After command completion occurred, registers were:
  ER -- ST COUNT  LBA_48  LH LM LL DV DC
  -- -- -- == -- == == == -- -- -- -- --
  40 -- 51 00 08 00 00 00 0e 23 b0 40 08  Error: UNC at LBA = 0x000e23b0 = 926640

  Commands leading to the command that caused the error were:
  CR FEATR COUNT  LBA_48  LH LM LL DV DC  Powered_Up_Time  Command/Feature_Name
  -- == -- == -- == == == -- -- -- -- --  ---------------  --------------------
  60 00 00 00 08 00 00 00 0e 23 b0 40 08 49d+ ...          READ FPDMA QUEUED
  60 00 00 00 08 00 00 00 0e 23 a8 40 08 49d+ ...          READ FPDMA QUEUED
  61 00 00 00 08 00 00 00 0e 23 a8 40 08 49d+ ...          WRITE FPDMA QUEUED
  ef 00 10 00 02 00 00 00 00 00 00 a0 08 49d+ ...          SET FEATURES [Enable SATA feature]
  ec 00 00 00 00 00 00 00 00 00 00 a0 08 49d+ ...          IDENTIFY DEVICE

Error 108 [107] occurred at disk power-on lifetime: 26234 hours (1093 days + 2 hours)
  When the command that caused the error occurred, the device was active or idle.

  After command completion occurred, registers were:
  ER -- ST COUNT  LBA_48  LH LM LL DV DC
  -- -- -- == -- == == == -- -- -- -- --
  40 -- 51 00 08 00 00 00 0e 23 a8 40 08  Error: UNC at LBA = 0x000e23a8 = 926632

  Commands leading to the command that caused the error were:
  CR FEATR COUNT  LBA_48  LH LM LL DV DC  Powered_Up_Time  Command/Feature_Name
  -- == -- == -- == == == -- -- -- -- --  ---------------  --------------------
  60 00 00 00 08 00 00 00 0e 23 a8 40 08 49d+ ...          READ FPDMA QUEUED
  60 00 00 00 38 00 00 00 0e 23 e8 40 08 49d+ ...          READ FPDMA QUEUED
  ef 00 10 00 02 00 00 00 00 00 00 a0 08 49d+ ...          SET FEATURES [Enable SATA feature]
  ec 00 00 00 00 00 00 00 00 00 00 a0 08 49d+ ...          IDENTIFY DEVICE
  ef 00 03 00 46 00 00 00 00 00 00 a0 08 49d+ ...          SET FEATURES [Set transfer mode]

SMART Extended Self-test Log Version: 1 (1 sectors)
Num  Test_Description    Status                  Remaining  LifeTime(hours)  LBA_of_first_error
# 1  Vendor (0xff)       Completed without error       00%      3825         -
# 2  Vendor (0xff)       Completed without error       00%      3749         -
# 3  Vendor (0xff)       Completed without error       00%      3501         -
# 4  Vendor (0xff)       Completed without error       00%      3262         -
# 5  Vendor (0xff)       Completed without error       00%      3025         -
# 6  Vendor (0xff)       Completed without error       00%      2793         -
# 7  Vendor (0xff)       Completed without error       00%      2584         -
# 8  Vendor (0xff)       Completed without error       00%      2367         -
# 9  Vendor (0xff)       Completed without error       00%      2150         -
#10  Vendor (0xff)       Completed without error       00%      1933         -
#11  Vendor (0xff)       Completed without error       00%      1722         -
#12  Vendor (0xff)       Completed without error       00%      1485         -
#13  Vendor (0xff)       Completed without error       00%      1247         -
#14  Vendor (0xff)       Completed without error       00%      1009         -
#15  Vendor (0xff)       Completed without error       00%       780         -
#16  Vendor (0xff)       Completed without error       00%       571         -
#17  Vendor (0xff)       Completed without error       00%       343         -
#18  Vendor (0xff)       Completed without error       00%       154         -

SMART Selective self-test log data structure revision number 1
 SPAN  MIN_LBA  MAX_LBA  CURRENT_TEST_STATUS
    1        0        0  Not_testing
    2        0        0  Not_testing
    3        0        0  Not_testing
    4        0        0  Not_testing
    5        0        0  Not_testing
Selective self-test flags (0x0):
  After scanning selected spans, do NOT read-scan remainder of disk.
If Selective self-test is pending on power-up, resume after 0 minute delay.

SCT Status Version:                  3
SCT Version (vendor specific):       1 (0x0001)
Device State:                        SMART Off-line Data Collection executing in background (4)
Current Temperature:                    42 Celsius
Power Cycle Min/Max Temperature:     35/49 Celsius
Lifetime    Min/Max Temperature:     28/49 Celsius
Under/Over Temperature Limit Count:   0/0

SCT Temperature History Version:     2
Temperature Sampling Period:         1 minute
Temperature Logging Interval:        1 minute
Min/Max recommended Temperature:      0/70 Celsius
Min/Max Temperature Limit:           -5/75 Celsius
Temperature History Size (Index):    478 (369)

Device Statistics (GP Log 0x04)
Page  Offset Size        Value Flags Description
0x01  =====  =               =  ===  == General Statistics (rev 1) ==
0x01  0x008  4               2  ---  Lifetime Power-On Resets
0x01  0x010  4           31313  ---  Power-on Hours
0x01  0x018  6     28859107215  ---  Logical Sectors Written
0x01  0x020  6       968618810  ---  Number of Write Commands
0x01  0x028  6     39326185039  ---  Logical Sectors Read
0x01  0x030  6       209416321  ---  Number of Read Commands
0x01  0x038  6    112727880000  ---  Date and Time TimeStamp
0x04  =====  =               =  ===  == General Errors Statistics (rev 1) ==
0x04  0x008  4             115  ---  Number of Reported Uncorrectable Errors
0x04  0x010  4               2  ---  Resets Between Cmd Acceptance and Completion
0x05  =====  =               =  ===  == Temperature Statistics (rev 1) ==
0x05  0x008  1              42  ---  Current Temperature
0x05  0x010  1              42  ---  Average Short Term Temperature
0x05  0x018  1              41  ---  Average Long Term Temperature
0x05  0x020  1              49  ---  Highest Temperature
0x05  0x028  1              28  ---  Lowest Temperature
0x05  0x030  1              44  ---  Highest Average Short Term Temperature
0x05  0x038  1              39  ---  Lowest Average Short Term Temperature
0x05  0x040  1              42  ---  Highest Average Long Term Temperature
0x05  0x048  1              40  ---  Lowest Average Long Term Temperature
0x05  0x050  4               0  ---  Time in Over-Temperature
0x05  0x058  1              70  ---  Specified Maximum Operating Temperature
0x05  0x060  4               0  ---  Time in Under-Temperature
0x05  0x068  1               0  ---  Specified Minimum Operating Temperature
0x06  =====  =               =  ===  == Transport Statistics (rev 1) ==
0x06  0x008  4              65  ---  Number of Hardware Resets
0x06  0x010  4              21  ---  Number of ASR Events
0x06  0x018  4               0  ---  Number of Interface CRC Errors
0x07  =====  =               =  ===  == Solid State Device Statistics (rev 1) ==
0x07  0x008  1               1  N--  Percentage Used Endurance Indicator
                                |||_ C monitored condition met
                                ||__ D supports DSN
                                |___ N normalized value

SATA Phy Event Counters (GP Log 0x11)
ID      Size     Value  Description
0x0001  4            0  Command failed due to ICRC error
0x0003  4            0  R_ERR response for device-to-host data FIS
0x0004  4            0  R_ERR response for host-to-device data FIS
0x0006  4            0  R_ERR response for device-to-host non-data FIS
0x000a  4           64  Device-to-host register FISes sent due to a COMRESET
0x000b  4            0  CRC errors within host-to-device FIS
0x000d  4            0  Non-CRC errors within host-to-device FIS

