smartctl 7.1 2020-06-20 r5066 [x86_64-linux-3.10.0-1160...] (local build)
Copyright (C) 2002-19, Bruce Allen, Christian Franke, www.smartmontools.org

=== START OF INFORMATION SECTION ===
Model Family:     Seagate Pipeline HD 5900.2
Device Model:     ST3500312CS
Serial Number:    --
LU WWN Device Id: 5 000c50 ...
Firmware Version: CA14
User Capacity:    500,107,862,016 bytes [500 GB]
Sector Size:      512 bytes logical/physical
Rotation Rate:    5900 rpm
Device is:        In smartctl database [for details use: -P show]
ATA Version is:   ATA8-ACS T13/1699-D revision 4
SATA Version is:  SATA 2.6, 3.0 Gb/s (current: 3.0 Gb/s)
Local Time is:    --
APM level is:     254 (maximum performance)
Rd look-ahead is: Enabled
Write cache is:   Enabled
ATA Security is:  Disabled, frozen [SEC2]

=== START OF READ SMART DATA SECTION ===
SMART overall-health self-assessment test result: PASSED

General SMART Values:
Offline data collection status:  (0x82)	Offline data collection activity
					was completed without error.

Self-test execution status:      (   0)	The previous self-test routine completed
					without error or no self-test has ever 
					been run.
Total time to complete Offline 
data collection: 		(  623) seconds.
Offline data collection
capabilities: 			 (0x7b) SMART execute Offline immediate.

					Suspend Offline collection upon new
					command.
					Offline surface scan supported.
					Self-test supported.
					Conveyance Self-test supported.
					Selective Self-test supported.
SMART capabilities:            (0x0003)	Saves SMART data before entering
					power-saving mode.

Error logging capability:        (0x01)	Error logging supported.
					General Purpose Logging supported.
Short self-test routine 
recommended polling time: 	 (   1) minutes.
Extended self-test routine
recommended polling time: 	 ( 111) minutes.
Conveyance self-test routine
recommended polling time: 	 (   2) minutes.
SCT capabilities: 	       (0x103b)	SCT Status supported.
					SCT Error Recovery Control supported.
					SCT Feature Control supported.
					SCT Data Table supported.

SMART Attributes Data Structure revision number: 10
Vendor Specific SMART Attributes with Thresholds:
ID# ATTRIBUTE_NAME          FLAGS    VALUE WORST THRESH FAIL RAW_VALUE
  1 Raw_Read_Error_Rate     POSR--   119   099   006    -    222966082
  3 Spin_Up_Time            PO----   098   097   000    -    0
  4 Start_Stop_Count        -O--CK   037   037   020    -    65535
  5 Reallocated_Sector_Ct   PO--CK   100   100   036    -    0
  7 Seek_Error_Rate         POSR--   076   060   030    -    41963840
  9 Power_On_Hours          -O--CK   082   082   000    -    15808
 10 Spin_Retry_Count        PO--C-   100   100   097    -    0
 12 Power_Cycle_Count       -O--CK   100   100   020    -    222
184 End-to-End_Error        -O--CK   100   100   099    -    0
187 Reported_Uncorrect      -O--CK   089   089   000    -    11
188 Command_Timeout         -O--CK   100   097   000    -    4295032865
189 High_Fly_Writes         -O-RCK   084   084   000    -    16
190 Airflow_Temperature_Cel -O---K   073   036   045    Past 27 (44 198 30 22 0)
194 Temperature_Celsius     -O---K   027   064   000    -    27 (0 13 0 0 0)
195 Hardware_ECC_Recovered  -O-RC-   046   041   000    -    222966082
197 Current_Pending_Sector  -O--C-   100   100   000    -    0
198 Offline_Uncorrectable   ----C-   100   100   000    -    0
199 UDMA_CRC_Error_Count    -OSRCK   200   200   000    -    0
                            ||||||_ K auto-keep
                            |||||__ C event count
                            ||||___ R error rate
                            |||____ S speed/performance
                            ||_____ O updated online
                            |______ P prefailure warning

General Purpose Log Directory Version 1
SMART           Log Directory Version 1 [multi-sector log support]
Address    Access  R/W   Size  Description
0x00       GPL,SL  R/O      1  Log Directory
0x01       GPL,SL  R/O      1  Summary SMART error log
0x02       GPL,SL  R/O      5  Comprehensive SMART error log
0x03       GPL     R/O      5  Ext. Comprehensive SMART error log
0x06       GPL,SL  R/O      1  SMART self-test log
0x07       GPL     R/O      1  Extended self-test log
0x09       GPL,SL  R/W      1  Selective self-test log
0x10       GPL     R/O      1  NCQ Command Error log
0x11       GPL     R/O      1  SATA Phy Event Counters log
0x21       GPL     R/O      1  Write stream error log
0x22       GPL     R/O      1  Read stream error log
0x80-0x9f  GPL,SL  R/W     16  Host vendor specific log
0xa1       GPL,SL  VS      20  Device vendor specific log
0xa2       GPL     VS    2248  Device vendor specific log
0xa8       GPL,SL  VS     129  Device vendor specific log
0xa9       GPL,SL  VS       1  Device vendor specific log
0xb0       GPL     VS    2928  Device vendor specific log
0xbd       GPL     VS     252  Device vendor specific log
0xbe-0xbf  GPL     VS   65535  Device vendor specific log
0xe0       GPL,SL  R/W      1  SCT Command/Status
0xe1       GPL,SL  R/W      1  SCT Data Transfer

SMART Extended Comprehensive Error Log Version: 1 (5 sectors)
Device Error Count: 7
	CR     = Command Register
	FEATR  = Features Register
	COUNT  = Count (was: Sector Count) Register
	LBA_48 = Upper bytes of LBA High/Mid/Low Registers ]  ATA-8
	LH     = LBA High (was: Cylinder High) Register    ]   LBA
	LM     = LBA Mid (was: Cylinder Low) Register      ] Register
	LL     = LBA Low (was: Sector Number) Register     ]
	DV     = Device (was: Device/Head) Register
	DC     = Device Control Register
	ER     = Error register
	ST     = Status register
Powered_Up_Time is measured from power on, and printed as
DDd+hh:mm:SS.sss where DD=days, hh=hours, mm=minutes,
SS=sec, and sss=millisec. It "wraps" after 49.710 days.

Error 7 [6] occurred at disk power-on lifetime: 13934 hours (580 days + 14 hours)
  When the command that caused the error occurred, the device was active or idle.

  After command completion occurred, registers were:
  ER -- ST COUNT  LBA_48  LH LM LL DV DC
  -- -- -- == -- == == == -- -- -- -- --
  40 -- 51 00 00 00 04 80 00 74 5c 00 00  Error: UNC at LBA = 0x48000745c = 19327382620

  Commands leading to the command that caused the error were:
  CR FEATR COUNT  LBA_48  LH LM LL DV DC  Powered_Up_Time  Command/Feature_Name
  -- == -- == -- == == == -- -- -- -- --  ---------------  --------------------
  25 00 00 05 00 00 04 7f 00 74 00 e0 00     01:03:31.365  READ DMA EXT
  ea 00 00 00 00 00 1e ab 00 97 17 a0 00     01:03:31.316  FLUSH CACHE EXT
  35 00 00 00 08 00 1e ab 00 97 10 e0 00     01:03:31.292  WRITE DMA EXT
  c8 00 00 00 00 00 04 7e 00 74 00 e4 00     01:03:31.290  READ DMA
  ea 00 00 00 04 10 13 08 08 10 10 a0 00     01:03:31.271  FLUSH CACHE EXT

Error 6 [5] occurred at disk power-on lifetime: 1653 hours (68 days + 21 hours)
  When the command that caused the error occurred, the device was active or idle.

  After command completion occurred, registers were:
  ER -- ST COUNT  LBA_48  LH LM LL DV DC
  -- -- -- == -- == == == -- -- -- -- --
  40 -- 51 00 00 00 04 80 00 74 4a 00 00  Error: UNC at LBA = 0x48000744a = 19327382602

  Commands leading to the command that caused the error were:
  CR FEATR COUNT  LBA_48  LH LM LL DV DC  Powered_Up_Time  Command/Feature_Name
  -- == -- == -- == == == -- -- -- -- --  ---------------  --------------------
  25 aa 03 00 80 00 04 80 00 74 4a e0 00  6d+ ...          READ DMA EXT
  00 00 00 00 00 00 00 00 00 00 00 00 04  6d+ ...          NOP [Abort queued commands]
  25 aa 03 00 80 00 04 80 00 74 4a e0 00  6d+ ...          READ DMA EXT
  00 00 00 00 00 00 00 00 00 00 00 00 04  6d+ ...          NOP [Abort queued commands]
  25 aa 03 00 80 00 04 80 00 74 4a e0 00  6d+ ...          READ DMA EXT

Error 5 [4] occurred at disk power-on lifetime: 1653 hours (68 days + 21 hours)
  When the command that caused the error occurred, the device was active or idle.

  After command completion occurred, registers were:
  ER -- ST COUNT  LBA_48  LH LM LL DV DC
  -- -- -- == -- == == == -- -- -- -- --
  40 -- 51 00 00 00 04 80 00 74 4a 00 00  Error: UNC at LBA = 0x48000744a = 19327382602

  Commands leading to the command that caused the error were:
  CR FEATR COUNT  LBA_48  LH LM LL DV DC  Powered_Up_Time  Command/Feature_Name
  -- == -- == -- == == == -- -- -- -- --  ---------------  --------------------
  25 aa 03 00 80 00 04 80 00 74 4a e0 00  6d+ ...          READ DMA EXT
  00 00 00 00 00 00 00 00 00 00 00 00 04  6d+ ...          NOP [Abort queued commands]
  25 aa 03 00 80 00 04 80 00 74 4a e0 00  6d+ ...          READ DMA EXT
  00 00 00 00 00 00 00 00 00 00 00 00 04  6d+ ...          NOP [Abort queued commands]
  25 aa 03 00 80 00 04 80 00 74 4a e0 00  6d+ ...          READ DMA EXT

Error 4 [3] occurred at disk power-on lifetime: 1653 hours (68 days + 21 hours)
  When the command that caused the error occurred, the device was active or idle.

  After command completion occurred, registers were:
  ER -- ST COUNT  LBA_48  LH LM LL DV DC
  -- -- -- == -- == == == -- -- -- -- --
  40 -- 51 00 00 00 04 80 00 74 4a 00 00  Error: UNC at LBA = 0x48000744a = 19327382602

  Commands leading to the command that caused the error were:
  CR FEATR COUNT  LBA_48  LH LM LL DV DC  Powered_Up_Time  Command/Feature_Name
  -- == -- == -- == == == -- -- -- -- --  ---------------  --------------------
  25 aa 03 00 80 00 04 80 00 74 4a e0 00  6d+ ...          READ DMA EXT
  00 00 00 00 00 00 00 00 00 00 00 00 04  6d+ ...          NOP [Abort queued commands]
  25 aa 03 00 80 00 04 80 00 74 4a e0 00  6d+ ...          READ DMA EXT
  00 00 00 00 00 00 00 00 00 00 00 00 04  6d+ ...          NOP [Abort queued commands]
  25 aa 03 00 80 00 04 80 00 74 4a e0 00  6d+ ...          READ DMA EXT

Error 3 [2] occurred at disk power-on lifetime: 1125 hours (46 days + 21 hours)
  When the command that caused the error occurred, the device was active or idle.

  After command completion occurred, registers were:
  ER -- ST COUNT  LBA_48  LH LM LL DV DC
  -- -- -- == -- == == == -- -- -- -- --
  40 -- 51 00 00 00 04 80 00 74 49 00 00  Error: UNC at LBA = 0x480007449 = 19327382601

  Commands leading to the command that caused the error were:
  CR FEATR COUNT  LBA_48  LH LM LL DV DC  Powered_Up_Time  Command/Feature_Name
  -- == -- == -- == == == -- -- -- -- --  ---------------  --------------------
  25 aa 03 00 80 00 04 80 00 74 3e e0 00  7d+ ...          READ DMA EXT
  00 00 00 00 00 00 00 00 00 00 00 00 04  7d+ ...          NOP [Abort queued commands]
  25 aa 03 00 80 00 04 80 00 74 3e e0 00  7d+ ...          READ DMA EXT
  00 00 00 00 00 00 00 00 00 00 00 00 04  7d+ ...          NOP [Abort queued commands]
  25 aa 03 00 80 00 04 80 00 74 3e e0 00  7d+ ...          READ DMA EXT

Error 2 [1] occurred at disk power-on lifetime: 1125 hours (46 days + 21 hours)
  When the command that caused the error occurred, the device was active or idle.

  After command completion occurred, registers were:
  ER -- ST COUNT  LBA_48  LH LM LL DV DC
  -- -- -- == -- == == == -- -- -- -- --
  40 -- 51 00 00 00 04 80 00 74 49 00 00  Error: UNC at LBA = 0x480007449 = 19327382601

  Commands leading to the command that caused the error were:
  CR FEATR COUNT  LBA_48  LH LM LL DV DC  Powered_Up_Time  Command/Feature_Name
  -- == -- == -- == == == -- -- -- -- --  ---------------  --------------------
  25 aa 03 00 80 00 04 80 00 74 3e e0 00  7d+ ...          READ DMA EXT
  00 00 00 00 00 00 00 00 00 00 00 00 04  7d+ ...          NOP [Abort queued commands]
  25 aa 03 00 80 00 04 80 00 74 3e e0 00  7d+ ...          READ DMA EXT
  00 00 00 00 00 00 00 00 00 00 00 00 04  7d+ ...          NOP [Abort queued commands]
  25 aa 03 00 80 00 04 80 00 74 3e e0 00  7d+ ...          READ DMA EXT

Error 1 [0] occurred at disk power-on lifetime: 1125 hours (46 days + 21 hours)
  When the command that caused the error occurred, the device was active or idle.

  After command completion occurred, registers were:
  ER -- ST COUNT  LBA_48  LH LM LL DV DC
  -- -- -- == -- == == == -- -- -- -- --
  40 -- 51 00 00 00 04 80 00 74 49 00 00  Error: UNC at LBA = 0x480007449 = 19327382601

  Commands leading to the command that caused the error were:
  CR FEATR COUNT  LBA_48  LH LM LL DV DC  Powered_Up_Time  Command/Feature_Name
  -- == -- == -- == == == -- -- -- -- --  ---------------  --------------------
  25 aa 03 00 80 00 04 80 00 74 3e e0 00  7d+ ...          READ DMA EXT
  00 00 00 00 00 00 00 00 00 00 00 00 04  7d+ ...          NOP [Abort queued commands]
  25 aa 03 00 80 00 04 80 00 74 3e e0 00  7d+ ...          READ DMA EXT
  00 00 00 00 00 00 00 00 00 00 00 00 04  7d+ ...          NOP [Abort queued commands]
  25 aa 03 00 80 00 04 80 00 74 3e e0 00  7d+ ...          READ DMA EXT

SMART Extended Self-test Log Version: 1 (1 sectors)
Num  Test_Description    Status                  Remaining  LifeTime(hours)  LBA_of_first_error
# 1  Short offline       Completed without error       00%     13933         -

SMART Selective self-test log data structure revision number 1
 SPAN  MIN_LBA  MAX_LBA  CURRENT_TEST_STATUS
    1        0        0  Not_testing
    2        0        0  Not_testing
    3        0        0  Not_testing
    4        0        0  Not_testing
    5        0        0  Not_testing
Selective self-test flags (0x0):
  After scanning selected spans, do NOT read-scan remainder of disk.
If Selective self-test is pending on power-up, resume after 0 minute delay.

SCT Status Version:                  3
SCT Version (vendor specific):       522 (0x020a)
Device State:                        Active (0)
Current Temperature:                    27 Celsius
Power Cycle Min/Max Temperature:     22/30 Celsius
Lifetime    Min/Max Temperature:     13/64 Celsius
Under/Over Temperature Limit Count:   0/0

SCT Temperature History Version:     2
Temperature Sampling Period:         2 minutes
Temperature Logging Interval:        94 minutes
Min/Max recommended Temperature:      1/61 Celsius
Min/Max Temperature Limit:            2/60 Celsius
Temperature History Size (Index):    128 (59)

SCT Error Recovery Control:
           Read: Disabled
          Write: Disabled

SATA Phy Event Counters (GP Log 0x11)
ID      Size     Value  Description
0x000a  2           13  Device-to-host register FISes sent due to a COMRESET
0x0001  2            0  Command failed due to ICRC error
0x0003  2            0  R_ERR response for device-to-host data FIS
0x0004  2            0  R_ERR response for host-to-device data FIS
0x0006  2            0  R_ERR response for device-to-host non-data FIS
0x0007  2            0  R_ERR response for host-to-device non-data FIS

