smartctl 7.1 2019-12-30 r5022 [x86_64-linux-3.10.0-1062...] (local build)
Copyright (C) 2002-19, Bruce Allen, Christian Franke, www.smartmontools.org

=== START OF INFORMATION SECTION ===
Model Number:                       INTEL SSDPED1K750GA
Serial Number:                      --
Firmware Version:                   E2010325
PCI Vendor/Subsystem ID:            0x8086
IEEE OUI Identifier:                0x5cd2e4
Controller ID:                      0
Number of Namespaces:               1
Namespace 1 Size/Capacity:          750,156,374,016 [750 GB]
Namespace 1 Formatted LBA Size:     512
Namespace 1 IEEE EUI-64:            e4d25c ...
Local Time is:                      --

=== START OF READ SMART DATA SECTION ===
SMART overall-health self-assessment test result: PASSED

SMART/Health Information (NVMe Log 0x02)
Critical Warning:                   0x00
Temperature:                        42 Celsius
Available Spare:                    100%
Available Spare Threshold:          0%
Percentage Used:                    2%
Data Units Read:                    117,537,385 [60.1 TB]
Data Units Written:                 2,330,082,400 [1.19 PB]
Host Read Commands:                 1,003,628,925
Host Write Commands:                23,937,252,232
Controller Busy Time:               10,886
Power Cycles:                       7
Power On Hours:                     14,170
Unsafe Shutdowns:                   1
Media and Data Integrity Errors:    0
Error Information Log Entries:      0

