smartctl 7.1 2020-06-20 r5066 [x86_64-linux-3.10.0-1160...] (local build)
Copyright (C) 2002-19, Bruce Allen, Christian Franke, www.smartmontools.org

=== START OF INFORMATION SECTION ===
Model Number:                       INTEL SSDPED1K750GA
Serial Number:                      --
Firmware Version:                   E2010485
PCI Vendor/Subsystem ID:            0x8086
IEEE OUI Identifier:                0x5cd2e4
Controller ID:                      0
Number of Namespaces:               1
Namespace 1 Size/Capacity:          750,156,374,016 [750 GB]
Namespace 1 Formatted LBA Size:     512
Namespace 1 IEEE EUI-64:            5cd2e4 ...
Local Time is:                      --

=== START OF READ SMART DATA SECTION ===
SMART overall-health self-assessment test result: PASSED

SMART/Health Information (NVMe Log 0x02)
Critical Warning:                   0x00
Temperature:                        49 Celsius
Available Spare:                    100%
Available Spare Threshold:          0%
Percentage Used:                    0%
Data Units Read:                    1,207,669 [618 GB]
Data Units Written:                 1,889,765 [967 GB]
Host Read Commands:                 143,323,652
Host Write Commands:                146,009,512
Controller Busy Time:               30
Power Cycles:                       10
Power On Hours:                     19
Unsafe Shutdowns:                   3
Media and Data Integrity Errors:    0
Error Information Log Entries:      0

