smartctl 7.1 2020-06-20 r5066 [x86_64-linux-3.10.0-1160...] (local build)
Copyright (C) 2002-19, Bruce Allen, Christian Franke, www.smartmontools.org

=== START OF INFORMATION SECTION ===
Model Family:     Intel 730 and DC S35x0/3610/3700 Series SSDs
Device Model:     INTEL SSDSC2BB480G4
Serial Number:    --
LU WWN Device Id: 5 5cd2e4 ...
Firmware Version: D2010370
User Capacity:    480,103,981,056 bytes [480 GB]
Sector Sizes:     512 bytes logical, 4096 bytes physical
Rotation Rate:    Solid State Device
Form Factor:      2.5 inches
Device is:        In smartctl database [for details use: -P show]
ATA Version is:   ACS-2 T13/2015-D revision 3
SATA Version is:  SATA 2.6, 6.0 Gb/s (current: 3.0 Gb/s)
Local Time is:    Fri Nov ... 2021 EST
Rd look-ahead is: Enabled
Write cache is:   Enabled
ATA Security is:  Disabled, frozen [SEC2]

=== START OF READ SMART DATA SECTION ===
SMART overall-health self-assessment test result: PASSED

General SMART Values:
Offline data collection status:  (0x02)	Offline data collection activity
					was completed without error.

Self-test execution status:      (   0)	The previous self-test routine completed
					without error or no self-test has ever 
					been run.
Total time to complete Offline 
data collection: 		(    2) seconds.
Offline data collection
capabilities: 			 (0x79) SMART execute Offline immediate.

					Suspend Offline collection upon new
					command.
					Offline surface scan supported.
					Self-test supported.
					Conveyance Self-test supported.
					Selective Self-test supported.
SMART capabilities:            (0x0003)	Saves SMART data before entering
					power-saving mode.

Error logging capability:        (0x01)	Error logging supported.
					General Purpose Logging supported.
Short self-test routine 
recommended polling time: 	 (   1) minutes.
Extended self-test routine
recommended polling time: 	 (   2) minutes.
Conveyance self-test routine
recommended polling time: 	 (   2) minutes.
SCT capabilities: 	       (0x003d)	SCT Status supported.
					SCT Error Recovery Control supported.
					SCT Feature Control supported.
					SCT Data Table supported.

SMART Attributes Data Structure revision number: 1
Vendor Specific SMART Attributes with Thresholds:
ID# ATTRIBUTE_NAME          FLAGS    VALUE WORST THRESH FAIL RAW_VALUE
  5 Reallocated_Sector_Ct   -O--CK   100   100   000    -    0
  9 Power_On_Hours          -O--CK   100   100   000    -    31639
 12 Power_Cycle_Count       -O--CK   100   100   000    -    52
170 Available_Reservd_Space PO--CK   100   100   010    -    0
171 Program_Fail_Count      -O--CK   100   100   000    -    0
172 Erase_Fail_Count        -O--CK   100   100   000    -    0
174 Unsafe_Shutdown_Count   -O--CK   100   100   000    -    47
175 Power_Loss_Cap_Test     PO--CK   100   100   010    -    605 (181 7503)
183 SATA_Downshift_Count    -O--CK   100   100   000    -    3
184 End-to-End_Error        PO--CK   100   100   090    -    0
187 Reported_Uncorrect      -O--CK   100   100   000    -    0
190 Temperature_Case        -O---K   087   085   000    -    13 (Min/Max 12/27)
192 Unsafe_Shutdown_Count   -O--CK   100   100   000    -    47
194 Temperature_Internal    -O---K   100   100   000    -    24
197 Current_Pending_Sector  -O--CK   100   100   000    -    0
199 CRC_Error_Count         -OSRCK   100   100   000    -    12760
225 Host_Writes_32MiB       -O--CK   100   100   000    -    2436173
226 Workld_Media_Wear_Indic -O--CK   100   100   000    -    7711
227 Workld_Host_Reads_Perc  -O--CK   100   100   000    -    93
228 Workload_Minutes        -O--CK   100   100   000    -    1898254
232 Available_Reservd_Space PO--CK   100   100   010    -    0
233 Media_Wearout_Indicator -O--CK   093   093   000    -    0
234 Thermal_Throttle        -O--CK   100   100   000    -    0/0
241 Host_Writes_32MiB       -O--CK   100   100   000    -    2436173
242 Host_Reads_32MiB        -O--CK   100   100   000    -    36492557
                            ||||||_ K auto-keep
                            |||||__ C event count
                            ||||___ R error rate
                            |||____ S speed/performance
                            ||_____ O updated online
                            |______ P prefailure warning

General Purpose Log Directory Version 1
SMART           Log Directory Version 1 [multi-sector log support]
Address    Access  R/W   Size  Description
0x00       GPL,SL  R/O      1  Log Directory
0x01       GPL,SL  R/O      1  Summary SMART error log
0x02       GPL,SL  R/O      8  Comprehensive SMART error log
0x03       GPL,SL  R/O     20  Ext. Comprehensive SMART error log
0x04       GPL,SL  R/O      8  Device Statistics log
0x06       GPL,SL  R/O      1  SMART self-test log
0x07       GPL,SL  R/O      2  Extended self-test log
0x09       GPL,SL  R/W      1  Selective self-test log
0x10       GPL,SL  R/O      1  NCQ Command Error log
0x11       GPL,SL  R/O      1  SATA Phy Event Counters log
0x80-0x9f  GPL,SL  R/W     16  Host vendor specific log
0xb0       GPL,SL  VS       1  Device vendor specific log
0xb1       GPL,SL  VS      33  Device vendor specific log
0xdd       GPL,SL  VS       1  Device vendor specific log
0xde       GPL     VS     768  Device vendor specific log
0xdf       GPL     VS    1152  Device vendor specific log
0xdf       SL      VS     128  Device vendor specific log
0xe0       GPL,SL  R/W      1  SCT Command/Status
0xe1       GPL,SL  R/W      1  SCT Data Transfer

SMART Extended Comprehensive Error Log Version: 1 (20 sectors)
Device Error Count: 4538 (device log contains only the most recent 80 errors)
	CR     = Command Register
	FEATR  = Features Register
	COUNT  = Count (was: Sector Count) Register
	LBA_48 = Upper bytes of LBA High/Mid/Low Registers ]  ATA-8
	LH     = LBA High (was: Cylinder High) Register    ]   LBA
	LM     = LBA Mid (was: Cylinder Low) Register      ] Register
	LL     = LBA Low (was: Sector Number) Register     ]
	DV     = Device (was: Device/Head) Register
	DC     = Device Control Register
	ER     = Error register
	ST     = Status register
Powered_Up_Time is measured from power on, and printed as
DDd+hh:mm:SS.sss where DD=days, hh=hours, mm=minutes,
SS=sec, and sss=millisec. It "wraps" after 49.710 days.

Error 4538 [57] occurred at disk power-on lifetime: 21882 hours (911 days + 18 hours)
  When the command that caused the error occurred, the device was active or idle.

  After command completion occurred, registers were:
  ER -- ST COUNT  LBA_48  LH LM LL DV DC
  -- -- -- == -- == == == -- -- -- -- --
  84 -- 41 02 00 00 00 01 f9 de 00 40 00  Error: ICRC, ABRT at LBA = 0x01f9de00 = 33152512

  Commands leading to the command that caused the error were:
  CR FEATR COUNT  LBA_48  LH LM LL DV DC  Powered_Up_Time  Command/Feature_Name
  -- == -- == -- == == == -- -- -- -- --  ---------------  --------------------
  60 00 00 02 00 00 00 01 f9 de 00 40 00 35d+ ...          READ FPDMA QUEUED
  60 00 00 02 00 00 00 01 f9 dc 00 40 00 35d+ ...          READ FPDMA QUEUED
  60 00 00 02 00 00 00 01 f9 da 00 40 00 35d+ ...          READ FPDMA QUEUED
  60 00 00 00 90 00 00 01 f9 d8 00 40 00 35d+ ...          READ FPDMA QUEUED
  60 00 00 00 03 00 00 01 f9 d8 90 40 00 35d+ ...          READ FPDMA QUEUED

Error 4537 [56] occurred at disk power-on lifetime: 21882 hours (911 days + 18 hours)
  When the command that caused the error occurred, the device was active or idle.

  After command completion occurred, registers were:
  ER -- ST COUNT  LBA_48  LH LM LL DV DC
  -- -- -- == -- == == == -- -- -- -- --
  84 -- 41 02 00 00 00 02 86 94 00 40 00  Error: ICRC, ABRT at LBA = 0x02869400 = 42374144

  Commands leading to the command that caused the error were:
  CR FEATR COUNT  LBA_48  LH LM LL DV DC  Powered_Up_Time  Command/Feature_Name
  -- == -- == -- == == == -- -- -- -- --  ---------------  --------------------
  60 00 00 02 00 00 00 02 86 94 00 40 00 35d+ ...          READ FPDMA QUEUED
  60 00 00 02 00 00 00 02 86 92 00 40 00 35d+ ...          READ FPDMA QUEUED
  60 00 00 02 00 00 00 02 86 90 00 40 00 35d+ ...          READ FPDMA QUEUED
  60 00 00 00 40 00 00 02 86 88 62 40 00 35d+ ...          READ FPDMA QUEUED
  60 00 00 00 02 00 00 01 fb 8d 60 40 00 35d+ ...          READ FPDMA QUEUED

Error 4536 [55] occurred at disk power-on lifetime: 21882 hours (911 days + 18 hours)
  When the command that caused the error occurred, the device was active or idle.

  After command completion occurred, registers were:
  ER -- ST COUNT  LBA_48  LH LM LL DV DC
  -- -- -- == -- == == == -- -- -- -- --
  84 -- 41 00 20 00 00 03 d6 30 00 40 00  Error: ICRC, ABRT at LBA = 0x03d63000 = 64368640

  Commands leading to the command that caused the error were:
  CR FEATR COUNT  LBA_48  LH LM LL DV DC  Powered_Up_Time  Command/Feature_Name
  -- == -- == -- == == == -- -- -- -- --  ---------------  --------------------
  60 00 00 00 20 00 00 03 d6 30 00 40 00 35d+ ...          READ FPDMA QUEUED
  60 00 00 00 01 00 00 01 ec bd 03 40 00 35d+ ...          READ FPDMA QUEUED
  61 00 00 00 08 00 00 0b b4 62 78 40 00 35d+ ...          WRITE FPDMA QUEUED
  61 00 00 00 10 00 00 0b b4 24 00 40 00 35d+ ...          WRITE FPDMA QUEUED
  61 00 00 00 40 00 00 0b b4 02 d8 40 00 35d+ ...          WRITE FPDMA QUEUED

Error 4535 [54] occurred at disk power-on lifetime: 21882 hours (911 days + 18 hours)
  When the command that caused the error occurred, the device was active or idle.

  After command completion occurred, registers were:
  ER -- ST COUNT  LBA_48  LH LM LL DV DC
  -- -- -- == -- == == == -- -- -- -- --
  84 -- 41 01 a0 00 00 0d d7 b8 60 40 00  Error: ICRC, ABRT at LBA = 0x0dd7b860 = 232241248

  Commands leading to the command that caused the error were:
  CR FEATR COUNT  LBA_48  LH LM LL DV DC  Powered_Up_Time  Command/Feature_Name
  -- == -- == -- == == == -- -- -- -- --  ---------------  --------------------
  60 00 00 01 a0 00 00 0d d7 b8 60 40 00 35d+ ...          READ FPDMA QUEUED
  60 00 00 01 20 00 00 28 ff 30 e0 40 00 35d+ ...          READ FPDMA QUEUED
  60 00 00 02 00 00 00 0d d7 be 00 40 00 35d+ ...          READ FPDMA QUEUED
  60 00 00 02 00 00 00 0d d7 bc 00 40 00 35d+ ...          READ FPDMA QUEUED
  60 00 00 02 00 00 00 0d d7 ba 00 40 00 35d+ ...          READ FPDMA QUEUED

Error 4534 [53] occurred at disk power-on lifetime: 21882 hours (911 days + 18 hours)
  When the command that caused the error occurred, the device was active or idle.

  After command completion occurred, registers were:
  ER -- ST COUNT  LBA_48  LH LM LL DV DC
  -- -- -- == -- == == == -- -- -- -- --
  84 -- 41 00 38 00 00 27 90 b8 0a 40 00  Error: ICRC, ABRT at LBA = 0x2790b80a = 663795722

  Commands leading to the command that caused the error were:
  CR FEATR COUNT  LBA_48  LH LM LL DV DC  Powered_Up_Time  Command/Feature_Name
  -- == -- == -- == == == -- -- -- -- --  ---------------  --------------------
  60 00 00 00 38 00 00 27 90 b8 0a 40 00 35d+ ...          READ FPDMA QUEUED
  60 00 00 00 10 00 00 28 ff 7b f0 40 00 35d+ ...          READ FPDMA QUEUED
  60 00 00 00 40 00 00 27 90 e6 a2 40 00 35d+ ...          READ FPDMA QUEUED
  60 00 00 00 10 00 00 10 c6 89 90 40 00 35d+ ...          READ FPDMA QUEUED
  60 00 00 00 40 00 00 09 93 60 50 40 00 35d+ ...          READ FPDMA QUEUED

Error 4533 [52] occurred at disk power-on lifetime: 21882 hours (911 days + 18 hours)
  When the command that caused the error occurred, the device was active or idle.

  After command completion occurred, registers were:
  ER -- ST COUNT  LBA_48  LH LM LL DV DC
  -- -- -- == -- == == == -- -- -- -- --
  84 -- 41 00 40 00 00 01 eb d4 8a 40 00  Error: ICRC, ABRT at LBA = 0x01ebd48a = 32232586

  Commands leading to the command that caused the error were:
  CR FEATR COUNT  LBA_48  LH LM LL DV DC  Powered_Up_Time  Command/Feature_Name
  -- == -- == -- == == == -- -- -- -- --  ---------------  --------------------
  60 00 00 00 40 00 00 01 eb d4 8a 40 00 35d+ ...          READ FPDMA QUEUED
  60 00 00 00 12 00 00 02 8d 99 ce 40 00 35d+ ...          READ FPDMA QUEUED
  60 00 00 00 30 00 00 02 8d 92 3a 40 00 35d+ ...          READ FPDMA QUEUED
  60 00 00 00 08 00 00 10 c5 a2 a0 40 00 35d+ ...          READ FPDMA QUEUED
  60 00 00 00 27 00 00 01 f3 f5 38 40 00 35d+ ...          READ FPDMA QUEUED

Error 4532 [51] occurred at disk power-on lifetime: 21882 hours (911 days + 18 hours)
  When the command that caused the error occurred, the device was active or idle.

  After command completion occurred, registers were:
  ER -- ST COUNT  LBA_48  LH LM LL DV DC
  -- -- -- == -- == == == -- -- -- -- --
  84 -- 41 02 00 00 00 12 33 66 00 40 00  Error: ICRC, ABRT at LBA = 0x12336600 = 305358336

  Commands leading to the command that caused the error were:
  CR FEATR COUNT  LBA_48  LH LM LL DV DC  Powered_Up_Time  Command/Feature_Name
  -- == -- == -- == == == -- -- -- -- --  ---------------  --------------------
  60 00 00 02 00 00 00 12 33 66 00 40 00 35d+ ...          READ FPDMA QUEUED
  60 00 00 00 88 00 00 12 33 5f 78 40 00 35d+ ...          READ FPDMA QUEUED
  60 00 00 02 00 00 00 12 33 64 00 40 00 35d+ ...          READ FPDMA QUEUED
  60 00 00 02 00 00 00 12 33 62 00 40 00 35d+ ...          READ FPDMA QUEUED
  60 00 00 02 00 00 00 12 33 60 00 40 00 35d+ ...          READ FPDMA QUEUED

Error 4531 [50] occurred at disk power-on lifetime: 21882 hours (911 days + 18 hours)
  When the command that caused the error occurred, the device was active or idle.

  After command completion occurred, registers were:
  ER -- ST COUNT  LBA_48  LH LM LL DV DC
  -- -- -- == -- == == == -- -- -- -- --
  84 -- 41 02 00 00 00 19 e4 dc 00 40 00  Error: ICRC, ABRT at LBA = 0x19e4dc00 = 434428928

  Commands leading to the command that caused the error were:
  CR FEATR COUNT  LBA_48  LH LM LL DV DC  Powered_Up_Time  Command/Feature_Name
  -- == -- == -- == == == -- -- -- -- --  ---------------  --------------------
  60 00 00 02 00 00 00 19 e4 dc 00 40 00 35d+ ...          READ FPDMA QUEUED
  60 00 00 02 00 00 00 19 e4 da 00 40 00 35d+ ...          READ FPDMA QUEUED
  60 00 00 02 00 00 00 19 e4 d8 00 40 00 35d+ ...          READ FPDMA QUEUED
  60 00 00 02 00 00 00 19 e4 d6 00 40 00 35d+ ...          READ FPDMA QUEUED
  60 00 00 02 00 00 00 19 e4 d4 00 40 00 35d+ ...          READ FPDMA QUEUED

SMART Extended Self-test Log Version: 1 (2 sectors)
Num  Test_Description    Status                  Remaining  LifeTime(hours)  LBA_of_first_error
# 1  Short offline       Completed without error       00%     30170         -
# 2  Short offline       Completed without error       00%     28254         -

SMART Selective self-test log data structure revision number 1
 SPAN  MIN_LBA  MAX_LBA  CURRENT_TEST_STATUS
    1        0        0  Not_testing
    2        0        0  Not_testing
    3        0        0  Not_testing
    4        0        0  Not_testing
    5        0        0  Not_testing
Selective self-test flags (0x0):
  After scanning selected spans, do NOT read-scan remainder of disk.
If Selective self-test is pending on power-up, resume after 0 minute delay.

SCT Status Version:                  3
SCT Version (vendor specific):       1 (0x0001)
Device State:                        Active (0)
Current Temperature:                    13 Celsius
Power Cycle Min/Max Temperature:     12/27 Celsius
Lifetime    Min/Max Temperature:      5/44 Celsius
Specified Max Operating Temperature:    70 Celsius
Under/Over Temperature Limit Count:   0/0
Vendor specific:
00 00 59 00 00 00 00 00 00 00 00 00 00 00 00 00
00 00 00 00 00 00 00 00 00 00 00 00 00 00 00 00

SCT Temperature History Version:     2
Temperature Sampling Period:         1 minute
Temperature Logging Interval:        1 minute
Min/Max recommended Temperature:      0/70 Celsius
Min/Max Temperature Limit:            0/70 Celsius
Temperature History Size (Index):    478 (309)

SCT Error Recovery Control:
           Read: Disabled
          Write: Disabled

Device Statistics (GP Log 0x04)
Page  Offset Size        Value Flags Description
0x01  =====  =               =  ===  == General Statistics (rev 2) ==
0x01  0x008  4              52  ---  Lifetime Power-On Resets
0x01  0x018  6    159657078601  ---  Logical Sectors Written
0x01  0x020  6      2830703778  ---  Number of Write Commands
0x01  0x028  6   2391576232349  ---  Logical Sectors Read
0x01  0x030  6     31248853371  ---  Number of Read Commands
0x04  =====  =               =  ===  == General Errors Statistics (rev 1) ==
0x04  0x008  4               0  ---  Number of Reported Uncorrectable Errors
0x04  0x010  4               0  ---  Resets Between Cmd Acceptance and Completion
0x05  =====  =               =  ===  == Temperature Statistics (rev 1) ==
0x05  0x008  1              13  ---  Current Temperature
0x05  0x010  1              13  ---  Average Short Term Temperature
0x05  0x018  1              13  ---  Average Long Term Temperature
0x05  0x020  1              43  ---  Highest Temperature
0x05  0x028  1               5  ---  Lowest Temperature
0x05  0x030  1              32  ---  Highest Average Short Term Temperature
0x05  0x038  1               6  ---  Lowest Average Short Term Temperature
0x05  0x040  1              20  ---  Highest Average Long Term Temperature
0x05  0x048  1              10  ---  Lowest Average Long Term Temperature
0x05  0x050  4               0  ---  Time in Over-Temperature
0x05  0x058  1              70  ---  Specified Maximum Operating Temperature
0x05  0x060  4               0  ---  Time in Under-Temperature
0x05  0x068  1               0  ---  Specified Minimum Operating Temperature
0x06  =====  =               =  ===  == Transport Statistics (rev 1) ==
0x06  0x008  4            4193  ---  Number of Hardware Resets
0x06  0x010  4            1122  ---  Number of ASR Events
0x06  0x018  4           12760  ---  Number of Interface CRC Errors
0x07  =====  =               =  ===  == Solid State Device Statistics (rev 1) ==
0x07  0x008  1               7  ---  Percentage Used Endurance Indicator
                                |||_ C monitored condition met
                                ||__ D supports DSN
                                |___ N normalized value

SATA Phy Event Counters (GP Log 0x11)
ID      Size     Value  Description
0x0001  4            0  Command failed due to ICRC error
0x0003  4            0  R_ERR response for device-to-host data FIS
0x0004  4            0  R_ERR response for host-to-device data FIS
0x0006  4            0  R_ERR response for device-to-host non-data FIS
0x000a  4          163  Device-to-host register FISes sent due to a COMRESET
0x000b  4            0  CRC errors within host-to-device FIS
0x000d  4            0  Non-CRC errors within host-to-device FIS

