smartctl 7.1 2020-06-20 r5066 [x86_64-linux-3.10.0-1127...] (local build)
Copyright (C) 2002-19, Bruce Allen, Christian Franke, www.smartmontools.org

=== START OF INFORMATION SECTION ===
Model Family:     Seagate Barracuda ES
Device Model:     ST3750640NS
Serial Number:    --
Firmware Version: 3.AEE
User Capacity:    750,156,374,016 bytes [750 GB]
Sector Size:      512 bytes logical/physical
Device is:        In smartctl database [for details use: -P show]
ATA Version is:   ATA/ATAPI-7 (minor revision not indicated)
Local Time is:    --
APM level is:     254 (maximum performance)
Rd look-ahead is: Enabled
Write cache is:   Enabled
ATA Security is:  Disabled, frozen [SEC2]

=== START OF READ SMART DATA SECTION ===
SMART overall-health self-assessment test result: PASSED

General SMART Values:
Offline data collection status:  (0x82)	Offline data collection activity
					was completed without error.

Self-test execution status:      (   0)	The previous self-test routine completed
					without error or no self-test has ever 
					been run.
Total time to complete Offline 
data collection: 		(  430) seconds.
Offline data collection
capabilities: 			 (0x5b) SMART execute Offline immediate.

					Suspend Offline collection upon new
					command.
					Offline surface scan supported.
					Self-test supported.
					No Conveyance Self-test supported.
					Selective Self-test supported.
SMART capabilities:            (0x0003)	Saves SMART data before entering
					power-saving mode.

Error logging capability:        (0x01)	Error logging supported.
					General Purpose Logging supported.
Short self-test routine 
recommended polling time: 	 (   1) minutes.
Extended self-test routine
recommended polling time: 	 ( 202) minutes.
SCT capabilities: 	       (0x003d)	SCT Status supported.
					SCT Error Recovery Control supported.
					SCT Feature Control supported.
					SCT Data Table supported.

SMART Attributes Data Structure revision number: 10
Vendor Specific SMART Attributes with Thresholds:
ID# ATTRIBUTE_NAME          FLAGS    VALUE WORST THRESH FAIL RAW_VALUE
  1 Raw_Read_Error_Rate     POSR--   115   097   006    -    0
  3 Spin_Up_Time            PO----   086   086   000    -    0
  4 Start_Stop_Count        -O--CK   100   100   020    -    12
  5 Reallocated_Sector_Ct   PO--CK   100   100   036    -    0
  7 Seek_Error_Rate         POSR--   079   060   030    -    85236637
  9 Power_On_Hours          -O--CK   056   056   000    -    38868
 10 Spin_Retry_Count        PO--C-   100   100   097    -    0
 12 Power_Cycle_Count       -O--CK   100   100   020    -    13
187 Reported_Uncorrect      -O--CK   088   088   000    -    12
189 High_Fly_Writes         -O-RCK   100   100   000    -    0
190 Airflow_Temperature_Cel -O---K   072   066   045    -    28 (Min/Max 20/31)
194 Temperature_Celsius     -O---K   028   040   000    -    28 (0 18 0 0 0)
195 Hardware_ECC_Recovered  -O-RC-   063   055   000    -    217946771
197 Current_Pending_Sector  -O--C-   100   100   000    -    0
198 Offline_Uncorrectable   ----C-   100   100   000    -    0
199 UDMA_CRC_Error_Count    -OSRCK   200   200   000    -    0
200 Multi_Zone_Error_Rate   ------   100   253   000    -    0
202 Data_Address_Mark_Errs  -O--CK   100   253   000    -    0
                            ||||||_ K auto-keep
                            |||||__ C event count
                            ||||___ R error rate
                            |||____ S speed/performance
                            ||_____ O updated online
                            |______ P prefailure warning

General Purpose Log Directory Version 1
SMART           Log Directory Version 1 [multi-sector log support]
Address    Access  R/W   Size  Description
0x00       GPL,SL  R/O      1  Log Directory
0x01       GPL,SL  R/O      1  Summary SMART error log
0x02       GPL,SL  R/O      5  Comprehensive SMART error log
0x03       GPL,SL  R/O      5  Ext. Comprehensive SMART error log
0x06       GPL,SL  R/O      1  SMART self-test log
0x07       GPL,SL  R/O      1  Extended self-test log
0x09       GPL,SL  R/W      1  Selective self-test log
0x10       GPL,SL  R/O      1  NCQ Command Error log
0x11       GPL,SL  R/O      1  SATA Phy Event Counters log
0x20       GPL,SL  R/O      1  Streaming performance log [OBS-8]
0x21       GPL,SL  R/O      1  Write stream error log
0x22       GPL,SL  R/O      1  Read stream error log
0x23       GPL,SL  R/O      1  Delayed sector log [OBS-8]
0x80-0x9f  GPL,SL  R/W     16  Host vendor specific log
0xa0       GPL,SL  VS       1  Device vendor specific log
0xa1       GPL,SL  VS      20  Device vendor specific log
0xa2       GPL,SL  VS     101  Device vendor specific log
0xa8       GPL,SL  VS      20  Device vendor specific log
0xa9       GPL,SL  VS       1  Device vendor specific log
0xe0       GPL,SL  R/W      1  SCT Command/Status
0xe1       GPL,SL  R/W      1  SCT Data Transfer
0xff       GPL     -    23040  Reserved

SMART Extended Comprehensive Error Log Version: 1 (5 sectors)
Device Error Count: 12
	CR     = Command Register
	FEATR  = Features Register
	COUNT  = Count (was: Sector Count) Register
	LBA_48 = Upper bytes of LBA High/Mid/Low Registers ]  ATA-8
	LH     = LBA High (was: Cylinder High) Register    ]   LBA
	LM     = LBA Mid (was: Cylinder Low) Register      ] Register
	LL     = LBA Low (was: Sector Number) Register     ]
	DV     = Device (was: Device/Head) Register
	DC     = Device Control Register
	ER     = Error register
	ST     = Status register
Powered_Up_Time is measured from power on, and printed as
DDd+hh:mm:SS.sss where DD=days, hh=hours, mm=minutes,
SS=sec, and sss=millisec. It "wraps" after 49.710 days.

Error 12 [11] occurred at disk power-on lifetime: 38492 hours (1603 days + 20 hours)
  When the command that caused the error occurred, the device was active or idle.

  After command completion occurred, registers were:
  ER -- ST COUNT  LBA_48  LH LM LL DV DC
  -- -- -- == -- == == == -- -- -- -- --
  40 -- 51 00 00 00 4e fd 0c 0a 0c e0 00  Error: UNC at LBA = 0x4efd0c0a0c = 339252873740

  Commands leading to the command that caused the error were:
  CR FEATR COUNT  LBA_48  LH LM LL DV DC  Powered_Up_Time  Command/Feature_Name
  -- == -- == -- == == == -- -- -- -- --  ---------------  --------------------
  25 00 00 01 00 00 4e fd 00 0a 00 e0 00     04:13:42.416  READ DMA EXT
  25 00 00 01 00 00 4e fc 00 0a 00 e0 00     04:13:42.415  READ DMA EXT
  25 00 00 01 00 00 4e fb 00 0a 00 e0 00     04:13:42.414  READ DMA EXT
  35 00 00 00 08 00 1d d5 00 6f e8 e0 00     04:13:41.762  WRITE DMA EXT
  35 00 00 00 08 00 43 11 00 64 18 e0 00     04:13:41.762  WRITE DMA EXT

Error 11 [10] occurred at disk power-on lifetime: 38492 hours (1603 days + 20 hours)
  When the command that caused the error occurred, the device was active or idle.

  After command completion occurred, registers were:
  ER -- ST COUNT  LBA_48  LH LM LL DV DC
  -- -- -- == -- == == == -- -- -- -- --
  40 -- 51 00 00 00 4e f6 0d 0a 0d e0 00  Error: UNC at LBA = 0x4ef60d0a0d = 339135498765

  Commands leading to the command that caused the error were:
  CR FEATR COUNT  LBA_48  LH LM LL DV DC  Powered_Up_Time  Command/Feature_Name
  -- == -- == -- == == == -- -- -- -- --  ---------------  --------------------
  25 00 00 01 00 00 4e f9 00 0a 00 e0 00     04:13:31.439  READ DMA EXT
  35 00 00 00 08 00 1d 3a 00 ec f8 e0 00     04:13:31.419  WRITE DMA EXT
  c8 00 00 00 20 00 06 10 00 20 00 e6 00     04:13:31.419  READ DMA
  35 00 00 00 08 00 1d 4b 00 e4 80 e0 00     04:13:31.419  WRITE DMA EXT
  25 00 00 01 00 00 4e f8 00 0a 00 e0 00     04:13:31.517  READ DMA EXT

Error 10 [9] occurred at disk power-on lifetime: 38492 hours (1603 days + 20 hours)
  When the command that caused the error occurred, the device was active or idle.

  After command completion occurred, registers were:
  ER -- ST COUNT  LBA_48  LH LM LL DV DC
  -- -- -- == -- == == == -- -- -- -- --
  40 -- 51 00 00 00 4e f6 0c 0a 0c e0 00  Error: UNC at LBA = 0x4ef60c0a0c = 339135433228

  Commands leading to the command that caused the error were:
  CR FEATR COUNT  LBA_48  LH LM LL DV DC  Powered_Up_Time  Command/Feature_Name
  -- == -- == -- == == == -- -- -- -- --  ---------------  --------------------
  25 00 00 01 00 00 4e f6 00 0a 00 e0 00     04:13:28.742  READ DMA EXT
  25 00 00 01 00 00 4e f5 00 0a 00 e0 00     04:13:28.595  READ DMA EXT
  25 00 00 01 00 00 4e f4 00 0a 00 e0 00     04:13:28.123  READ DMA EXT
  35 00 00 00 08 00 22 95 00 82 b8 e0 00     04:13:28.004  WRITE DMA EXT
  35 00 00 00 08 00 43 11 00 64 18 e0 00     04:13:28.004  WRITE DMA EXT

Error 9 [8] occurred at disk power-on lifetime: 38492 hours (1603 days + 20 hours)
  When the command that caused the error occurred, the device was active or idle.

  After command completion occurred, registers were:
  ER -- ST COUNT  LBA_48  LH LM LL DV DC
  -- -- -- == -- == == == -- -- -- -- --
  40 -- 51 00 00 00 4e f2 d0 0a d0 e0 00  Error: UNC at LBA = 0x4ef2d00ad0 = 339081169616

  Commands leading to the command that caused the error were:
  CR FEATR COUNT  LBA_48  LH LM LL DV DC  Powered_Up_Time  Command/Feature_Name
  -- == -- == -- == == == -- -- -- -- --  ---------------  --------------------
  25 00 00 01 00 00 4e f2 00 0a 00 e0 00     04:13:24.545  READ DMA EXT
  35 00 00 00 18 00 43 14 00 64 a0 e0 00     04:13:24.544  WRITE DMA EXT
  35 00 00 00 08 00 22 95 00 82 b0 e0 00     04:13:24.544  WRITE DMA EXT
  35 00 00 00 08 00 43 11 00 64 18 e0 00     04:13:24.544  WRITE DMA EXT
  35 00 00 00 08 00 22 ef 00 7e 70 e0 00     04:13:24.544  WRITE DMA EXT

Error 8 [7] occurred at disk power-on lifetime: 38492 hours (1603 days + 20 hours)
  When the command that caused the error occurred, the device was active or idle.

  After command completion occurred, registers were:
  ER -- ST COUNT  LBA_48  LH LM LL DV DC
  -- -- -- == -- == == == -- -- -- -- --
  40 -- 51 00 00 00 4e fd 0c 0a 0c e0 00  Error: UNC at LBA = 0x4efd0c0a0c = 339252873740

  Commands leading to the command that caused the error were:
  CR FEATR COUNT  LBA_48  LH LM LL DV DC  Powered_Up_Time  Command/Feature_Name
  -- == -- == -- == == == -- -- -- -- --  ---------------  --------------------
  25 00 00 01 00 00 4e fd 00 0a 00 e0 00     04:13:42.416  READ DMA EXT
  25 00 00 01 00 00 4e fc 00 0a 00 e0 00     04:13:42.415  READ DMA EXT
  25 00 00 01 00 00 4e fb 00 0a 00 e0 00     04:13:42.414  READ DMA EXT
  35 00 00 00 08 00 1d d5 00 6f e8 e0 00     04:13:41.762  WRITE DMA EXT
  35 00 00 00 08 00 43 11 00 64 18 e0 00     04:13:41.762  WRITE DMA EXT

Error 7 [6] occurred at disk power-on lifetime: 38492 hours (1603 days + 20 hours)
  When the command that caused the error occurred, the device was active or idle.

  After command completion occurred, registers were:
  ER -- ST COUNT  LBA_48  LH LM LL DV DC
  -- -- -- == -- == == == -- -- -- -- --
  40 -- 51 00 00 00 4e f6 0d 0a 0d e0 00  Error: UNC at LBA = 0x4ef60d0a0d = 339135498765

  Commands leading to the command that caused the error were:
  CR FEATR COUNT  LBA_48  LH LM LL DV DC  Powered_Up_Time  Command/Feature_Name
  -- == -- == -- == == == -- -- -- -- --  ---------------  --------------------
  25 00 00 01 00 00 4e f9 00 0a 00 e0 00     04:13:31.439  READ DMA EXT
  35 00 00 00 08 00 1d 3a 00 ec f8 e0 00     04:13:31.419  WRITE DMA EXT
  c8 00 00 00 20 00 06 10 00 20 00 e6 00     04:13:31.419  READ DMA
  35 00 00 00 08 00 1d 4b 00 e4 80 e0 00     04:13:31.419  WRITE DMA EXT
  25 00 00 01 00 00 4e f8 00 0a 00 e0 00     04:13:31.517  READ DMA EXT

Error 6 [5] occurred at disk power-on lifetime: 38492 hours (1603 days + 20 hours)
  When the command that caused the error occurred, the device was active or idle.

  After command completion occurred, registers were:
  ER -- ST COUNT  LBA_48  LH LM LL DV DC
  -- -- -- == -- == == == -- -- -- -- --
  40 -- 51 00 00 00 4e f6 0c 0a 0c e0 00  Error: UNC at LBA = 0x4ef60c0a0c = 339135433228

  Commands leading to the command that caused the error were:
  CR FEATR COUNT  LBA_48  LH LM LL DV DC  Powered_Up_Time  Command/Feature_Name
  -- == -- == -- == == == -- -- -- -- --  ---------------  --------------------
  25 00 00 01 00 00 4e f6 00 0a 00 e0 00     04:13:28.742  READ DMA EXT
  25 00 00 01 00 00 4e f5 00 0a 00 e0 00     04:13:28.595  READ DMA EXT
  25 00 00 01 00 00 4e f4 00 0a 00 e0 00     04:13:28.123  READ DMA EXT
  35 00 00 00 08 00 22 95 00 82 b8 e0 00     04:13:28.004  WRITE DMA EXT
  35 00 00 00 08 00 43 11 00 64 18 e0 00     04:13:28.004  WRITE DMA EXT

Error 5 [4] occurred at disk power-on lifetime: 38492 hours (1603 days + 20 hours)
  When the command that caused the error occurred, the device was active or idle.

  After command completion occurred, registers were:
  ER -- ST COUNT  LBA_48  LH LM LL DV DC
  -- -- -- == -- == == == -- -- -- -- --
  40 -- 51 00 00 00 4e f2 d0 0a d0 e0 00  Error: UNC at LBA = 0x4ef2d00ad0 = 339081169616

  Commands leading to the command that caused the error were:
  CR FEATR COUNT  LBA_48  LH LM LL DV DC  Powered_Up_Time  Command/Feature_Name
  -- == -- == -- == == == -- -- -- -- --  ---------------  --------------------
  25 00 00 01 00 00 4e f2 00 0a 00 e0 00     04:13:24.545  READ DMA EXT
  35 00 00 00 18 00 43 14 00 64 a0 e0 00     04:13:24.544  WRITE DMA EXT
  35 00 00 00 08 00 22 95 00 82 b0 e0 00     04:13:24.544  WRITE DMA EXT
  35 00 00 00 08 00 43 11 00 64 18 e0 00     04:13:24.544  WRITE DMA EXT
  35 00 00 00 08 00 22 ef 00 7e 70 e0 00     04:13:24.544  WRITE DMA EXT

SMART Extended Self-test Log Version: 1 (1 sectors)

SMART Selective self-test log data structure revision number 1
 SPAN  MIN_LBA  MAX_LBA  CURRENT_TEST_STATUS
    1        0        0  Not_testing
    2        0        0  Not_testing
    3        0        0  Not_testing
    4        0        0  Not_testing
    5        0        0  Not_testing
Selective self-test flags (0x0):
  After scanning selected spans, do NOT read-scan remainder of disk.
If Selective self-test is pending on power-up, resume after 0 minute delay.

SCT Status Version:                  2
SCT Version (vendor specific):       521 (0x0209)
Device State:                        Active (0)
Current Temperature:                    28 Celsius
Power Cycle Min/Max Temperature:     --/32 Celsius
Lifetime    Min/Max Temperature:     --/34 Celsius

SATA Phy Event Counters (GP Log 0x11)
ID      Size     Value  Description
0x000a  2           13  Device-to-host register FISes sent due to a COMRESET
0x0001  2            0  Command failed due to ICRC error
0x0003  2            0  R_ERR response for device-to-host data FIS
0x0004  2            0  R_ERR response for host-to-device data FIS
0x0006  2            0  R_ERR response for device-to-host non-data FIS
0x0007  2            0  R_ERR response for host-to-device non-data FIS

