smartctl 6.6 2017-11-05 r4594 [x86_64-linux-3.10.0-862...] (local build)
Copyright (C) 2002-17, Bruce Allen, Christian Franke, www.smartmontools.org

=== START OF INFORMATION SECTION ===
Model Family:     Crucial/Micron RealSSD m4/C400/P400
Device Model:     MTFDDAK128MAM-1J1
Serial Number:    --
LU WWN Device Id: 5 00a075 ...
Firmware Version: 0809
User Capacity:    128,035,676,160 bytes [128 GB]
Sector Size:      512 bytes logical/physical
Rotation Rate:    Solid State Device
Form Factor:      2.5 inches
Device is:        In smartctl database [for details use: -P show]
ATA Version is:   ACS-2, ATA8-ACS T13/1699-D revision 6
SATA Version is:  SATA 3.0, 6.0 Gb/s (current: 6.0 Gb/s)
Local Time is:    Thu Oct ... 2019 UTC

=== START OF READ SMART DATA SECTION ===
SMART overall-health self-assessment test result: PASSED

SMART Attributes Data Structure revision number: 16
Vendor Specific SMART Attributes with Thresholds:
ID# ATTRIBUTE_NAME          FLAGS    VALUE WORST THRESH FAIL RAW_VALUE
  1 Raw_Read_Error_Rate     POSR-K   100   100   050    -    0
  5 Reallocated_Sector_Ct   PO--CK   100   100   010    -    0
  9 Power_On_Hours          -O--CK   100   100   000    -    58218
 12 Power_Cycle_Count       -O--CK   100   100   000    -    78
170 Grown_Failing_Block_Ct  PO--CK   100   100   010    -    0
171 Program_Fail_Count      -O--CK   100   100   000    -    0
172 Erase_Fail_Count        -O--CK   100   100   000    -    0
173 Wear_Leveling_Count     PO--CK   172   172   010    -    5549
174 Unexpect_Power_Loss_Ct  -O--CK   100   100   000    -    0
181 Non4k_Aligned_Access    -O---K   100   100   000    -    69 0 69
183 SATA_Iface_Downshift    -O--CK   100   100   000    -    0
184 End-to-End_Error        PO--CK   100   100   050    -    0
187 Reported_Uncorrect      -O--CK   100   100   000    -    0
188 Command_Timeout         -O--CK   100   100   000    -    0
189 Factory_Bad_Block_Ct    -OSR--   100   100   000    -    90
194 Temperature_Celsius     -O---K   100   100   000    -    0
195 Hardware_ECC_Recovered  -O-RCK   100   100   000    -    2361
196 Reallocated_Event_Count -O--CK   100   100   000    -    0
197 Current_Pending_Sector  -O--CK   100   100   000    -    0
198 Offline_Uncorrectable   ----CK   100   100   000    -    0
199 UDMA_CRC_Error_Count    -OS-CK   100   100   000    -    0
202 Perc_Rated_Life_Used    ---RC-   174   174   000    -    182
206 Write_Error_Rate        -OSR--   100   100   000    -    0
                            ||||||_ K auto-keep
                            |||||__ C event count
                            ||||___ R error rate
                            |||____ S speed/performance
                            ||_____ O updated online
                            |______ P prefailure warning

SMART Extended Comprehensive Error Log Version: 1 (16383 sectors)
No Errors Logged

