smartctl 7.0 2019-12-10 r4999 [x86_64-linux-3.10.0-1062...] (local build)
Copyright (C) 2002-18, Bruce Allen, Christian Franke, www.smartmontools.org

=== START OF INFORMATION SECTION ===
Model Number:                       VO0400KEFJB
Serial Number:                      --
Firmware Version:                   4IFDHPK3
PCI Vendor ID:                      0x8086
PCI Vendor Subsystem ID:            0x1590
IEEE OUI Identifier:                0x5cd2e4
Controller ID:                      0
Number of Namespaces:               1
Namespace 1 Size/Capacity:          400,088,457,216 [400 GB]
Namespace 1 Formatted LBA Size:     512
Local Time is:                      Sun Apr ... 2020 +07

=== START OF READ SMART DATA SECTION ===
SMART overall-health self-assessment test result: FAILED!
- media has been placed in read only mode

SMART/Health Information (NVMe Log 0x02)
Critical Warning:                   0x08
Temperature:                        48 Celsius
Available Spare:                    100%
Available Spare Threshold:          10%
Percentage Used:                    105%
Data Units Read:                    1,645,067,165 [842 TB]
Data Units Written:                 2,637,752,031 [1.35 PB]
Host Read Commands:                 45,547,340,459
Host Write Commands:                31,633,773,145
Controller Busy Time:               0
Power Cycles:                       461
Power On Hours:                     15,601
Unsafe Shutdowns:                   0
Media and Data Integrity Errors:    0
Error Information Log Entries:      0

