smartctl 7.1 2019-12-30 r5022 [x86_64-linux-3.10.0-1062...] (local build)
Copyright (C) 2002-19, Bruce Allen, Christian Franke, www.smartmontools.org

=== START OF INFORMATION SECTION ===
Model Number:                       Dell Express Flash PM1725a 6.4TB AIC
Serial Number:                      --
Firmware Version:                   1.0.4
PCI Vendor ID:                      0x144d
PCI Vendor Subsystem ID:            0x1028
IEEE OUI Identifier:                0x002538
Total NVM Capacity:                 6,401,252,745,216 [6.40 TB]
Unallocated NVM Capacity:           0
Controller ID:                      33
Number of Namespaces:               1
Namespace 1 Size/Capacity:          6,401,252,745,216 [6.40 TB]
Namespace 1 Formatted LBA Size:     512
Namespace 1 IEEE EUI-64:            002538 ...
Local Time is:                      --

=== START OF READ SMART DATA SECTION ===
SMART overall-health self-assessment test result: PASSED

SMART/Health Information (NVMe Log 0x02)
Critical Warning:                   0x00
Temperature:                        25 Celsius
Available Spare:                    100%
Available Spare Threshold:          10%
Percentage Used:                    0%
Data Units Read:                    31,535,949 [16.1 TB]
Data Units Written:                 199,165,663 [101 TB]
Host Read Commands:                 375,211,124
Host Write Commands:                3,495,405,375
Controller Busy Time:               1,417
Power Cycles:                       15
Power On Hours:                     12,661
Unsafe Shutdowns:                   13
Media and Data Integrity Errors:    0
Error Information Log Entries:      0
Warning  Comp. Temperature Time:    0
Critical Comp. Temperature Time:    0
Temperature Sensor 1:               25 Celsius
Temperature Sensor 2:               23 Celsius
Temperature Sensor 3:               23 Celsius

