smartctl 7.1 2020-06-20 r5066 [x86_64-linux-3.10.0-1127...] (local build)
Copyright (C) 2002-19, Bruce Allen, Christian Franke, www.smartmontools.org

=== START OF INFORMATION SECTION ===
Model Number:                       Seagate FireCuda 520 SSD ZP500GM30002
Serial Number:                      --
Firmware Version:                   STNSC014
PCI Vendor/Subsystem ID:            0x1bb1
IEEE OUI Identifier:                0x0024cf
Total NVM Capacity:                 500,107,862,016 [500 GB]
Unallocated NVM Capacity:           0
Controller ID:                      1
Number of Namespaces:               1
Namespace 1 Size/Capacity:          500,107,862,016 [500 GB]
Namespace 1 Formatted LBA Size:     512
Namespace 1 IEEE EUI-64:            0024cf ...
Local Time is:                      --

=== START OF READ SMART DATA SECTION ===
SMART overall-health self-assessment test result: PASSED

SMART/Health Information (NVMe Log 0x02)
Critical Warning:                   0x00
Temperature:                        30 Celsius
Available Spare:                    100%
Available Spare Threshold:          5%
Percentage Used:                    0%
Data Units Read:                    5,830,154 [2.98 TB]
Data Units Written:                 1,577,031 [807 GB]
Host Read Commands:                 32,221,928
Host Write Commands:                103,092,821
Controller Busy Time:               26,653
Power Cycles:                       6
Power On Hours:                     4,793
Unsafe Shutdowns:                   2
Media and Data Integrity Errors:    0
Error Information Log Entries:      16
Warning  Comp. Temperature Time:    0
Critical Comp. Temperature Time:    0

