smartctl 6.6 2017-11-05 r4594 [x86_64-linux-3.10.0-862...] (local build)
Copyright (C) 2002-17, Bruce Allen, Christian Franke, www.smartmontools.org

=== START OF INFORMATION SECTION ===
Model Family:     HP 250GB SATA disk VB0250EAVER
Device Model:     VB0250EAVER
Serial Number:    --
LU WWN Device Id: 5 000c50 ...
Firmware Version: HPG7
User Capacity:    250,059,350,016 bytes [250 GB]
Sector Size:      512 bytes logical/physical
Rotation Rate:    7200 rpm
Form Factor:      3.5 inches
Device is:        In smartctl database [for details use: -P show]
ATA Version is:   ATA8-ACS T13/1699-D revision 6
SATA Version is:  SATA 2.6, 3.0 Gb/s (current: 3.0 Gb/s)
Local Time is:    Fri Oct ... 2018 +07

=== START OF READ SMART DATA SECTION ===
SMART overall-health self-assessment test result: PASSED

SMART Attributes Data Structure revision number: 10
Vendor Specific SMART Attributes with Thresholds:
ID# ATTRIBUTE_NAME          FLAGS    VALUE WORST THRESH FAIL RAW_VALUE
  1 Raw_Read_Error_Rate     POSR-K   106   100   006    -    12476349
  3 Spin_Up_Time            PO---K   098   097   000    -    0
  4 Start_Stop_Count        -O--CK   099   099   020    -    1651
  5 Reallocated_Sector_Ct   PO--CK   100   100   036    -    0
  7 Seek_Error_Rate         POSR-K   068   060   030    -    6458046
  9 Power_On_Hours          -O--CK   095   095   000    -    5232
 10 Spin_Retry_Count        PO--CK   100   100   097    -    0
 12 Power_Cycle_Count       -O--CK   100   100   020    -    373
180 Unknown_HDD_Attribute   PO-R-K   100   100   000    -    4294967295
183 Runtime_Bad_Block       -O--CK   100   100   000    -    0
184 End-to-End_Error        -O--CK   100   100   097    -    0
187 Reported_Uncorrect      -O--CK   100   100   000    -    0
188 Command_Timeout         -O--CK   100   099   000    -    23
189 High_Fly_Writes         -O-RCK   100   100   000    -    0
190 Airflow_Temperature_Cel -O---K   079   052   045    -    21 (Min/Max 19/26)
194 Temperature_Celsius     -O---K   021   048   000    -    21 (0 17 0 0 0)
195 Hardware_ECC_Recovered  -O-RCK   036   028   000    -    12476349
196 Reallocated_Event_Count -O--CK   100   100   036    -    0
197 Current_Pending_Sector  -O--CK   100   100   000    -    0
198 Offline_Uncorrectable   ----CK   100   100   000    -    0
199 UDMA_CRC_Error_Count    -O--CK   200   200   000    -    0
                            ||||||_ K auto-keep
                            |||||__ C event count
                            ||||___ R error rate
                            |||____ S speed/performance
                            ||_____ O updated online
                            |______ P prefailure warning

SMART Extended Comprehensive Error Log Version: 1 (5 sectors)
No Errors Logged

Current Temperature:                    21 Celsius

