smartctl 7.1 2020-06-20 r5066 [x86_64-linux-3.10.0-1160...] (local build)
Copyright (C) 2002-19, Bruce Allen, Christian Franke, www.smartmontools.org

=== START OF INFORMATION SECTION ===
Model Number:                       SAMSUNG MZQLB1T9HAJR-00007
Serial Number:                      --
Firmware Version:                   EDA5502Q
PCI Vendor/Subsystem ID:            0x144d
IEEE OUI Identifier:                0x002538
Total NVM Capacity:                 1,920,383,410,176 [1.92 TB]
Unallocated NVM Capacity:           0
Controller ID:                      4
Number of Namespaces:               1
Namespace 1 Size/Capacity:          1,920,383,410,176 [1.92 TB]
Namespace 1 Utilization:            1,920,241,532,928 [1.92 TB]
Namespace 1 Formatted LBA Size:     512
Local Time is:                      Mon Jan ... 2022 MSK

=== START OF READ SMART DATA SECTION ===
SMART overall-health self-assessment test result: PASSED

SMART/Health Information (NVMe Log 0x02)
Critical Warning:                   0x00
Temperature:                        42 Celsius
Available Spare:                    100%
Available Spare Threshold:          10%
Percentage Used:                    3%
Data Units Read:                    1,396,876,521 [715 TB]
Data Units Written:                 618,205,836 [316 TB]
Host Read Commands:                 6,172,449,380
Host Write Commands:                3,540,797,193
Controller Busy Time:               16,780
Power Cycles:                       8
Power On Hours:                     8,754
Unsafe Shutdowns:                   2
Media and Data Integrity Errors:    0
Error Information Log Entries:      8
Warning  Comp. Temperature Time:    0
Critical Comp. Temperature Time:    0
Temperature Sensor 1:               42 Celsius
Temperature Sensor 2:               45 Celsius
Temperature Sensor 3:               52 Celsius

