smartctl 7.1 2020-06-20 r5066 [x86_64-linux-3.10.0-1160...] (local build)
Copyright (C) 2002-19, Bruce Allen, Christian Franke, www.smartmontools.org

=== START OF INFORMATION SECTION ===
Model Number:                       SAMSUNG MZQLB1T9HAJR-00007
Serial Number:                      --
Firmware Version:                   EDA5302Q
PCI Vendor/Subsystem ID:            0x144d
IEEE OUI Identifier:                0x002538
Total NVM Capacity:                 1,920,383,410,176 [1.92 TB]
Unallocated NVM Capacity:           0
Controller ID:                      4
Number of Namespaces:               1
Namespace 1 Size/Capacity:          1,920,383,410,176 [1.92 TB]
Namespace 1 Utilization:            408,181,641,216 [408 GB]
Namespace 1 Formatted LBA Size:     512
Local Time is:                      Fri Aug ... 2021 EDT

=== START OF READ SMART DATA SECTION ===
SMART overall-health self-assessment test result: PASSED

SMART/Health Information (NVMe Log 0x02)
Critical Warning:                   0x00
Temperature:                        37 Celsius
Available Spare:                    100%
Available Spare Threshold:          10%
Percentage Used:                    0%
Data Units Read:                    6,417,183 [3.28 TB]
Data Units Written:                 7,088,861 [3.62 TB]
Host Read Commands:                 43,560,817
Host Write Commands:                42,826,762
Controller Busy Time:               66
Power Cycles:                       73
Power On Hours:                     1,055
Unsafe Shutdowns:                   41
Media and Data Integrity Errors:    0
Error Information Log Entries:      50
Warning  Comp. Temperature Time:    0
Critical Comp. Temperature Time:    0
Temperature Sensor 1:               37 Celsius
Temperature Sensor 2:               42 Celsius
Temperature Sensor 3:               49 Celsius

