smartctl 7.1 2020-06-20 r5066 [x86_64-linux-3.10.0-1160...] (local build)
Copyright (C) 2002-19, Bruce Allen, Christian Franke, www.smartmontools.org

=== START OF INFORMATION SECTION ===
Model Number:                       SAMSUNG MZQLB1T9HAJR-00007
Serial Number:                      --
Firmware Version:                   EDA5702Q
PCI Vendor/Subsystem ID:            0x144d
IEEE OUI Identifier:                0x002538
Total NVM Capacity:                 1.920.383.410.176 [1,92 TB]
Unallocated NVM Capacity:           0
Controller ID:                      4
Number of Namespaces:               1
Namespace 1 Size/Capacity:          1.920.383.410.176 [1,92 TB]
Namespace 1 Utilization:            40.896.348.160 [40,8 GB]
Namespace 1 Formatted LBA Size:     512
Local Time is:                      Wed Nov ... 2021 CET

=== START OF READ SMART DATA SECTION ===
SMART overall-health self-assessment test result: PASSED

SMART/Health Information (NVMe Log 0x02)
Critical Warning:                   0x00
Temperature:                        36 Celsius
Available Spare:                    100%
Available Spare Threshold:          10%
Percentage Used:                    0%
Data Units Read:                    33.087.643 [16,9 TB]
Data Units Written:                 31.478.637 [16,1 TB]
Host Read Commands:                 221.947.165
Host Write Commands:                278.734.133
Controller Busy Time:               305
Power Cycles:                       50
Power On Hours:                     5.450
Unsafe Shutdowns:                   46
Media and Data Integrity Errors:    0
Error Information Log Entries:      0
Warning  Comp. Temperature Time:    0
Critical Comp. Temperature Time:    0
Temperature Sensor 1:               36 Celsius
Temperature Sensor 2:               40 Celsius
Temperature Sensor 3:               46 Celsius

