smartctl 7.1 2020-06-20 r5066 [x86_64-linux-3.10.0-1127...] (local build)
Copyright (C) 2002-19, Bruce Allen, Christian Franke, www.smartmontools.org

=== START OF INFORMATION SECTION ===
Model Number:                       SAMSUNG MZQLB1T9HAJR-00007
Serial Number:                      --
Firmware Version:                   EDA5302Q
PCI Vendor/Subsystem ID:            0x144d
IEEE OUI Identifier:                0x002538
Total NVM Capacity:                 1,920,383,410,176 [1.92 TB]
Unallocated NVM Capacity:           0
Controller ID:                      4
Number of Namespaces:               1
Namespace 1 Size/Capacity:          1,920,383,410,176 [1.92 TB]
Namespace 1 Utilization:            1,498,279,124,992 [1.49 TB]
Namespace 1 Formatted LBA Size:     512
Local Time is:                      Wed Nov ... 2021 GMT

=== START OF READ SMART DATA SECTION ===
SMART overall-health self-assessment test result: PASSED

SMART/Health Information (NVMe Log 0x02)
Critical Warning:                   0x00
Temperature:                        32 Celsius
Available Spare:                    100%
Available Spare Threshold:          10%
Percentage Used:                    0%
Data Units Read:                    118,113,672 [60.4 TB]
Data Units Written:                 19,036,552 [9.74 TB]
Host Read Commands:                 273,590,696
Host Write Commands:                184,033,634
Controller Busy Time:               745
Power Cycles:                       13
Power On Hours:                     10,044
Unsafe Shutdowns:                   5
Media and Data Integrity Errors:    0
Error Information Log Entries:      54
Warning  Comp. Temperature Time:    0
Critical Comp. Temperature Time:    0
Temperature Sensor 1:               32 Celsius
Temperature Sensor 2:               36 Celsius
Temperature Sensor 3:               44 Celsius

