smartctl 7.1 2020-06-20 r5066 [x86_64-linux-3.10.0-1160...] (local build)
Copyright (C) 2002-19, Bruce Allen, Christian Franke, www.smartmontools.org

=== START OF INFORMATION SECTION ===
Model Number:                       SAMSUNG MZQLB1T9HAJR-00007
Serial Number:                      --
Firmware Version:                   EDA5402Q
PCI Vendor/Subsystem ID:            0x144d
IEEE OUI Identifier:                0x002538
Total NVM Capacity:                 1,920,383,410,176 [1.92 TB]
Unallocated NVM Capacity:           0
Controller ID:                      4
Number of Namespaces:               1
Namespace 1 Size/Capacity:          1,920,383,410,176 [1.92 TB]
Namespace 1 Utilization:            1,872,090,697,728 [1.87 TB]
Namespace 1 Formatted LBA Size:     512
Local Time is:                      --

=== START OF READ SMART DATA SECTION ===
SMART overall-health self-assessment test result: PASSED

SMART/Health Information (NVMe Log 0x02)
Critical Warning:                   0x00
Temperature:                        45 Celsius
Available Spare:                    100%
Available Spare Threshold:          10%
Percentage Used:                    0%
Data Units Read:                    296,126,026 [151 TB]
Data Units Written:                 105,318,478 [53.9 TB]
Host Read Commands:                 7,410,826,245
Host Write Commands:                1,956,969,404
Controller Busy Time:               6,277
Power Cycles:                       91
Power On Hours:                     8,287
Unsafe Shutdowns:                   87
Media and Data Integrity Errors:    0
Error Information Log Entries:      8,577
Warning  Comp. Temperature Time:    0
Critical Comp. Temperature Time:    0
Temperature Sensor 1:               45 Celsius
Temperature Sensor 2:               48 Celsius
Temperature Sensor 3:               53 Celsius

