smartctl 7.1 2020-06-20 r5066 [x86_64-linux-3.10.0-1160...] (local build)
Copyright (C) 2002-19, Bruce Allen, Christian Franke, www.smartmontools.org

=== START OF INFORMATION SECTION ===
Model Number:                       SAMSUNG MZQLB1T9HAJR-00007
Serial Number:                      --
Firmware Version:                   EDA5702Q
PCI Vendor/Subsystem ID:            0x144d
IEEE OUI Identifier:                0x002538
Total NVM Capacity:                 1,920,383,410,176 [1.92 TB]
Unallocated NVM Capacity:           0
Controller ID:                      4
Number of Namespaces:               1
Namespace 1 Size/Capacity:          1,920,383,410,176 [1.92 TB]
Namespace 1 Utilization:            870,567,841,792 [870 GB]
Namespace 1 Formatted LBA Size:     512
Local Time is:                      --

=== START OF READ SMART DATA SECTION ===
SMART overall-health self-assessment test result: PASSED

SMART/Health Information (NVMe Log 0x02)
Critical Warning:                   0x00
Temperature:                        27 Celsius
Available Spare:                    100%
Available Spare Threshold:          10%
Percentage Used:                    0%
Data Units Read:                    12,152,843 [6.22 TB]
Data Units Written:                 22,287,368 [11.4 TB]
Host Read Commands:                 170,519,903
Host Write Commands:                603,741,079
Controller Busy Time:               211
Power Cycles:                       22
Power On Hours:                     1,325
Unsafe Shutdowns:                   18
Media and Data Integrity Errors:    0
Error Information Log Entries:      0
Warning  Comp. Temperature Time:    0
Critical Comp. Temperature Time:    0
Temperature Sensor 1:               27 Celsius
Temperature Sensor 2:               32 Celsius
Temperature Sensor 3:               39 Celsius

