smartctl 7.1 2020-06-20 r5066 [x86_64-linux-3.10.0-1160...] (local build)
Copyright (C) 2002-19, Bruce Allen, Christian Franke, www.smartmontools.org

=== START OF INFORMATION SECTION ===
Model Number:                       XPG GAMMIX S11 Pro
Serial Number:                      --
Firmware Version:                   32B3T8EB
PCI Vendor/Subsystem ID:            0x1cc1
IEEE OUI Identifier:                0x000000
Controller ID:                      1
Number of Namespaces:               1
Namespace 1 Size/Capacity:          256,060,514,304 [256 GB]
Namespace 1 Utilization:            25,197,690,880 [25.1 GB]
Namespace 1 Formatted LBA Size:     512
Local Time is:                      --

=== START OF READ SMART DATA SECTION ===
SMART overall-health self-assessment test result: PASSED

SMART/Health Information (NVMe Log 0x02)
Critical Warning:                   0x00
Temperature:                        43 Celsius
Available Spare:                    100%
Available Spare Threshold:          10%
Percentage Used:                    0%
Data Units Read:                    4,806,100 [2.46 TB]
Data Units Written:                 514,217 [263 GB]
Host Read Commands:                 12,522,234
Host Write Commands:                30,133,674
Controller Busy Time:               343
Power Cycles:                       92
Power On Hours:                     589
Unsafe Shutdowns:                   18
Media and Data Integrity Errors:    0
Error Information Log Entries:      0
Warning  Comp. Temperature Time:    0
Critical Comp. Temperature Time:    0

