smartctl 7.1 2020-06-20 r5066 [x86_64-linux-3.10.0-1127...] (local build)
Copyright (C) 2002-19, Bruce Allen, Christian Franke, www.smartmontools.org

=== START OF INFORMATION SECTION ===
Device Model:     MB2000GCEHK
Serial Number:    --
LU WWN Device Id: 5 000c50 ...
Firmware Version: HPGC
User Capacity:    2,000,398,934,016 bytes [2.00 TB]
Sector Size:      512 bytes logical/physical
Rotation Rate:    7202 rpm
Form Factor:      3.5 inches
Device is:        Not in smartctl database [for details use: -P showall]
ATA Version is:   ATA8-ACS T13/1699-D revision 6
SATA Version is:  SATA 3.0, 6.0 Gb/s (current: 1.5 Gb/s)
Local Time is:    --
Rd look-ahead is: Enabled
Write cache is:   Disabled

=== START OF READ SMART DATA SECTION ===
SMART overall-health self-assessment test result: FAILED!
Drive failure expected in less than 24 hours. SAVE ALL DATA.

General SMART Values:
Offline data collection status:  (0x82)	Offline data collection activity
					was completed without error.

Self-test execution status:      (   0)	The previous self-test routine completed
					without error or no self-test has ever 
					been run.
Total time to complete Offline 
data collection: 		(  600) seconds.
Offline data collection
capabilities: 			 (0x7b) SMART execute Offline immediate.

					Suspend Offline collection upon new
					command.
					Offline surface scan supported.
					Self-test supported.
					Conveyance Self-test supported.
					Selective Self-test supported.
SMART capabilities:            (0x0003)	Saves SMART data before entering
					power-saving mode.

Error logging capability:        (0x01)	Error logging supported.
					General Purpose Logging supported.
Short self-test routine 
recommended polling time: 	 (   2) minutes.
Extended self-test routine
recommended polling time: 	 ( 294) minutes.
Conveyance self-test routine
recommended polling time: 	 (   3) minutes.
SCT capabilities: 	       (0x103d)	SCT Status supported.
					SCT Error Recovery Control supported.
					SCT Feature Control supported.
					SCT Data Table supported.

SMART Attributes Data Structure revision number: 10
Vendor Specific SMART Attributes with Thresholds:
ID# ATTRIBUTE_NAME          FLAGS    VALUE WORST THRESH FAIL RAW_VALUE
  1 Raw_Read_Error_Rate     POSR--   065   048   044    -    196475451
  3 Spin_Up_Time            PO----   093   091   070    -    0
  4 Start_Stop_Count        -O--CK   100   100   020    -    36
  5 Reallocated_Sector_Ct   PO--CK   001   001   036    NOW  4095
  7 Seek_Error_Rate         POSR--   092   060   030    -    1718032083
  9 Power_On_Hours          -O--CK   055   055   000    -    39447
 10 Spin_Retry_Count        PO--C-   100   100   097    -    0
 12 Power_Cycle_Count       -O--CK   100   100   020    -    36
180 Unknown_HDD_Attribute   PO-RCK   100   100   030    -    745579703
184 End-to-End_Error        -O--CK   100   100   003    -    0
187 Reported_Uncorrect      -O--CK   016   016   000    -    84
188 Command_Timeout         -O--CK   100   099   000    -    8590065669
189 High_Fly_Writes         -O-RCK   100   100   000    -    0
190 Airflow_Temperature_Cel -O---K   070   056   045    -    30 (Min/Max 25/33)
191 G-Sense_Error_Rate      -O--CK   100   100   000    -    0
192 Power-Off_Retract_Count -O--CK   100   100   000    -    32
193 Load_Cycle_Count        -O--CK   100   100   000    -    36
194 Temperature_Celsius     -O---K   030   044   000    -    30 (0 13 0 0 0)
195 Hardware_ECC_Recovered  -O-RC-   118   099   000    -    196475451
196 Reallocated_Event_Count PO--CK   001   001   036    NOW  4095
197 Current_Pending_Sector  -O--C-   100   100   000    -    0
198 Offline_Uncorrectable   ----C-   100   100   000    -    0
199 UDMA_CRC_Error_Count    -OSRCK   200   200   000    -    8
                            ||||||_ K auto-keep
                            |||||__ C event count
                            ||||___ R error rate
                            |||____ S speed/performance
                            ||_____ O updated online
                            |______ P prefailure warning

General Purpose Log Directory Version 1
SMART           Log Directory Version 1 [multi-sector log support]
Address    Access  R/W   Size  Description
0x00       GPL,SL  R/O      1  Log Directory
0x01           SL  R/O      1  Summary SMART error log
0x02           SL  R/O      5  Comprehensive SMART error log
0x03       GPL     R/O      5  Ext. Comprehensive SMART error log
0x04       GPL,SL  R/O      8  Device Statistics log
0x06           SL  R/O      1  SMART self-test log
0x07       GPL     R/O      1  Extended self-test log
0x09           SL  R/W      1  Selective self-test log
0x10       GPL     R/O      1  NCQ Command Error log
0x11       GPL     R/O      1  SATA Phy Event Counters log
0x12       GPL,SL  R/O      1  SATA NCQ Non-Data log
0x21       GPL     R/O      1  Write stream error log
0x22       GPL     R/O      1  Read stream error log
0x80-0x9f  GPL,SL  R/W     16  Host vendor specific log
0xa1       GPL,SL  VS      20  Device vendor specific log
0xa2       GPL     VS    4496  Device vendor specific log
0xa8       GPL,SL  VS     129  Device vendor specific log
0xa9       GPL,SL  VS       1  Device vendor specific log
0xb0       GPL     VS    5176  Device vendor specific log
0xb6       GPL     VS    1918  Device vendor specific log
0xbd       GPL     VS     252  Device vendor specific log
0xbe-0xbf  GPL     VS   65535  Device vendor specific log
0xe0       GPL,SL  R/W      1  SCT Command/Status
0xe1       GPL,SL  R/W      1  SCT Data Transfer

SMART Extended Comprehensive Error Log Version: 1 (5 sectors)
Device Error Count: 326 (device log contains only the most recent 20 errors)
	CR     = Command Register
	FEATR  = Features Register
	COUNT  = Count (was: Sector Count) Register
	LBA_48 = Upper bytes of LBA High/Mid/Low Registers ]  ATA-8
	LH     = LBA High (was: Cylinder High) Register    ]   LBA
	LM     = LBA Mid (was: Cylinder Low) Register      ] Register
	LL     = LBA Low (was: Sector Number) Register     ]
	DV     = Device (was: Device/Head) Register
	DC     = Device Control Register
	ER     = Error register
	ST     = Status register
Powered_Up_Time is measured from power on, and printed as
DDd+hh:mm:SS.sss where DD=days, hh=hours, mm=minutes,
SS=sec, and sss=millisec. It "wraps" after 49.710 days.

Error 326 [5] occurred at disk power-on lifetime: 39405 hours (1641 days + 21 hours)
  When the command that caused the error occurred, the device was active or idle.

  After command completion occurred, registers were:
  ER -- ST COUNT  LBA_48  LH LM LL DV DC
  -- -- -- == -- == == == -- -- -- -- --
  40 -- 51 00 00 00 00 08 d5 6d eb 00 00  Error: UNC at LBA = 0x08d56deb = 148205035

  Commands leading to the command that caused the error were:
  CR FEATR COUNT  LBA_48  LH LM LL DV DC  Powered_Up_Time  Command/Feature_Name
  -- == -- == -- == == == -- -- -- -- --  ---------------  --------------------
  25 00 00 02 00 00 00 08 d5 6a 00 e0 00 29d+ ...          READ DMA EXT
  25 00 00 02 00 00 00 08 d5 68 00 e0 00 29d+ ...          READ DMA EXT
  25 00 00 02 00 00 00 08 ed 2a 00 e0 00 29d+ ...          READ DMA EXT
  25 00 00 02 00 00 00 08 ed 28 00 e0 00 29d+ ...          READ DMA EXT
  ca 00 00 00 01 00 00 08 61 10 08 e8 00 29d+ ...          WRITE DMA

Error 325 [4] occurred at disk power-on lifetime: 39388 hours (1641 days + 4 hours)
  When the command that caused the error occurred, the device was active or idle.

  After command completion occurred, registers were:
  ER -- ST COUNT  LBA_48  LH LM LL DV DC
  -- -- -- == -- == == == -- -- -- -- --
  40 -- 51 00 00 00 00 01 62 31 07 00 00  Error: UNC at LBA = 0x01623107 = 23212295

  Commands leading to the command that caused the error were:
  CR FEATR COUNT  LBA_48  LH LM LL DV DC  Powered_Up_Time  Command/Feature_Name
  -- == -- == -- == == == -- -- -- -- --  ---------------  --------------------
  c8 00 00 00 00 00 00 01 61 b1 00 e1 00 28d+ ...          READ DMA
  c8 00 00 00 00 00 00 01 61 b0 00 e1 00 28d+ ...          READ DMA
  c8 00 00 00 00 00 00 01 61 2a 00 e1 00 28d+ ...          READ DMA
  c8 00 00 00 00 00 00 01 61 29 00 e1 00 28d+ ...          READ DMA
  ca 00 00 00 01 00 00 00 20 10 08 e0 00 28d+ ...          WRITE DMA

Error 324 [3] occurred at disk power-on lifetime: 39388 hours (1641 days + 4 hours)
  When the command that caused the error occurred, the device was active or idle.

  After command completion occurred, registers were:
  ER -- ST COUNT  LBA_48  LH LM LL DV DC
  -- -- -- == -- == == == -- -- -- -- --
  40 -- 51 00 00 00 00 01 61 26 34 00 00  Error: UNC at LBA = 0x01612634 = 23143988

  Commands leading to the command that caused the error were:
  CR FEATR COUNT  LBA_48  LH LM LL DV DC  Powered_Up_Time  Command/Feature_Name
  -- == -- == -- == == == -- -- -- -- --  ---------------  --------------------
  c8 00 00 00 00 00 00 01 61 26 00 e1 00 28d+ ...          READ DMA
  c8 00 00 00 00 00 00 01 61 25 00 e1 00 28d+ ...          READ DMA
  c8 00 00 00 00 00 00 01 61 24 00 e1 00 28d+ ...          READ DMA
  c8 00 00 00 00 00 00 01 61 23 00 e1 00 28d+ ...          READ DMA
  ca 00 00 00 01 00 00 08 61 10 08 e8 00 28d+ ...          WRITE DMA

Error 323 [2] occurred at disk power-on lifetime: 39388 hours (1641 days + 4 hours)
  When the command that caused the error occurred, the device was active or idle.

  After command completion occurred, registers were:
  ER -- ST COUNT  LBA_48  LH LM LL DV DC
  -- -- -- == -- == == == -- -- -- -- --
  40 -- 51 00 00 00 00 01 61 21 ae 00 00  Error: UNC at LBA = 0x016121ae = 23142830

  Commands leading to the command that caused the error were:
  CR FEATR COUNT  LBA_48  LH LM LL DV DC  Powered_Up_Time  Command/Feature_Name
  -- == -- == -- == == == -- -- -- -- --  ---------------  --------------------
  c8 00 00 00 00 00 00 01 61 21 00 e1 00 28d+ ...          READ DMA
  c8 00 00 00 00 00 00 01 61 1e 00 e1 00 28d+ ...          READ DMA
  c8 00 00 00 00 00 00 01 61 1d 00 e1 00 28d+ ...          READ DMA
  c8 00 00 00 00 00 00 01 61 1c 00 e1 00 28d+ ...          READ DMA
  c8 00 00 00 00 00 00 01 61 1b 00 e1 00 28d+ ...          READ DMA

Error 322 [1] occurred at disk power-on lifetime: 39379 hours (1640 days + 19 hours)
  When the command that caused the error occurred, the device was active or idle.

  After command completion occurred, registers were:
  ER -- ST COUNT  LBA_48  LH LM LL DV DC
  -- -- -- == -- == == == -- -- -- -- --
  40 -- 51 00 00 00 00 09 57 05 f7 00 00  Error: UNC at LBA = 0x095705f7 = 156698103

  Commands leading to the command that caused the error were:
  CR FEATR COUNT  LBA_48  LH LM LL DV DC  Powered_Up_Time  Command/Feature_Name
  -- == -- == -- == == == -- -- -- -- --  ---------------  --------------------
  c8 00 00 00 00 00 00 09 56 96 00 e9 00 28d+ ...          READ DMA
  c8 00 00 00 00 00 00 09 56 95 00 e9 00 28d+ ...          READ DMA
  c8 00 00 00 00 00 00 09 56 94 00 e9 00 28d+ ...          READ DMA
  c8 00 00 00 00 00 00 09 56 93 00 e9 00 28d+ ...          READ DMA
  c8 00 00 00 00 00 00 09 56 92 00 e9 00 28d+ ...          READ DMA

Error 321 [0] occurred at disk power-on lifetime: 39357 hours (1639 days + 21 hours)
  When the command that caused the error occurred, the device was active or idle.

  After command completion occurred, registers were:
  ER -- ST COUNT  LBA_48  LH LM LL DV DC
  -- -- -- == -- == == == -- -- -- -- --
  40 -- 51 00 00 00 00 08 d5 1d 6c 00 00  Error: UNC at LBA = 0x08d51d6c = 148184428

  Commands leading to the command that caused the error were:
  CR FEATR COUNT  LBA_48  LH LM LL DV DC  Powered_Up_Time  Command/Feature_Name
  -- == -- == -- == == == -- -- -- -- --  ---------------  --------------------
  c8 00 00 00 08 00 00 08 d5 1d 68 e8 00 27d+ ...          READ DMA
  c8 00 00 00 08 00 00 08 d5 1d 60 e8 00 27d+ ...          READ DMA
  c8 00 00 00 08 00 00 08 d5 1d 58 e8 00 27d+ ...          READ DMA
  c8 00 00 00 08 00 00 08 d5 1d 50 e8 00 27d+ ...          READ DMA
  c8 00 00 00 08 00 00 08 d5 1d 48 e8 00 27d+ ...          READ DMA

Error 320 [19] occurred at disk power-on lifetime: 39357 hours (1639 days + 21 hours)
  When the command that caused the error occurred, the device was active or idle.

  After command completion occurred, registers were:
  ER -- ST COUNT  LBA_48  LH LM LL DV DC
  -- -- -- == -- == == == -- -- -- -- --
  40 -- 51 00 00 00 00 08 d5 1d 6c 00 00  Error: UNC at LBA = 0x08d51d6c = 148184428

  Commands leading to the command that caused the error were:
  CR FEATR COUNT  LBA_48  LH LM LL DV DC  Powered_Up_Time  Command/Feature_Name
  -- == -- == -- == == == -- -- -- -- --  ---------------  --------------------
  25 00 00 04 00 00 00 08 d5 1c 00 e0 00 27d+ ...          READ DMA EXT
  25 00 00 02 00 00 00 08 d5 1a 00 e0 00 27d+ ...          READ DMA EXT
  25 00 00 02 00 00 00 08 d5 18 00 e0 00 27d+ ...          READ DMA EXT
  25 00 00 01 98 00 00 08 d5 10 00 e0 00 27d+ ...          READ DMA EXT
  c8 00 00 00 08 00 00 0f 69 10 48 ef 00 27d+ ...          READ DMA

Error 319 [18] occurred at disk power-on lifetime: 39333 hours (1638 days + 21 hours)
  When the command that caused the error occurred, the device was active or idle.

  After command completion occurred, registers were:
  ER -- ST COUNT  LBA_48  LH LM LL DV DC
  -- -- -- == -- == == == -- -- -- -- --
  40 -- 51 00 00 00 00 08 d5 1d 94 00 00  Error: UNC at LBA = 0x08d51d94 = 148184468

  Commands leading to the command that caused the error were:
  CR FEATR COUNT  LBA_48  LH LM LL DV DC  Powered_Up_Time  Command/Feature_Name
  -- == -- == -- == == == -- -- -- -- --  ---------------  --------------------
  c8 00 00 00 08 00 00 08 d5 1d 90 e8 00 26d+ ...          READ DMA
  ca 00 00 00 01 00 00 00 20 10 10 e0 00 26d+ ...          WRITE DMA
  ca 00 00 00 10 00 00 02 4b 4d 28 e2 00 26d+ ...          WRITE DMA
  c8 00 00 00 08 00 00 08 d5 1d 88 e8 00 26d+ ...          READ DMA
  ca 00 00 00 08 00 00 03 27 9c e0 e3 00 26d+ ...          WRITE DMA

SMART Extended Self-test Log Version: 1 (1 sectors)
Num  Test_Description    Status                  Remaining  LifeTime(hours)  LBA_of_first_error
# 1  Short offline       Completed without error       00%     11060         -
# 2  Short offline       Completed without error       00%     10515         -
# 3  Short offline       Completed without error       00%      1204         -

SMART Selective self-test log data structure revision number 1
 SPAN  MIN_LBA  MAX_LBA  CURRENT_TEST_STATUS
    1        0        0  Not_testing
    2        0        0  Not_testing
    3        0        0  Not_testing
    4        0        0  Not_testing
    5        0        0  Not_testing
Selective self-test flags (0x0):
  After scanning selected spans, do NOT read-scan remainder of disk.
If Selective self-test is pending on power-up, resume after 0 minute delay.

SCT Status Version:                  3
SCT Version (vendor specific):       522 (0x020a)
Device State:                        Active (0)
Current Temperature:                    30 Celsius
Power Cycle Min/Max Temperature:     25/33 Celsius
Lifetime    Min/Max Temperature:     13/44 Celsius
Specified Max Operating Temperature:    60 Celsius
Under/Over Temperature Limit Count:   0/11688

SCT Temperature History Version:     2
Temperature Sampling Period:         1 minute
Temperature Logging Interval:        10 minutes
Min/Max recommended Temperature:      0/ 0 Celsius
Min/Max Temperature Limit:            0/ 0 Celsius
Temperature History Size (Index):    128 (58)

SCT Error Recovery Control:
           Read:    100 (10.0 seconds)
          Write:    100 (10.0 seconds)

Device Statistics (GP Log 0x04)
Page  Offset Size        Value Flags Description
0x01  =====  =               =  ===  == General Statistics (rev 2) ==
0x01  0x008  4              36  ---  Lifetime Power-On Resets
0x01  0x010  4           39447  ---  Power-on Hours
0x01  0x018  6    276937048334  ---  Logical Sectors Written
0x01  0x020  6      2185623174  ---  Number of Write Commands
0x01  0x028  6    572691122760  ---  Logical Sectors Read
0x01  0x030  6      3298947554  ---  Number of Read Commands
0x03  =====  =               =  ===  == Rotating Media Statistics (rev 1) ==
0x03  0x008  4           39369  ---  Spindle Motor Power-on Hours
0x03  0x010  4           39369  ---  Head Flying Hours
0x03  0x018  4              36  ---  Head Load Events
0x03  0x020  4            4095  ---  Number of Reallocated Logical Sectors
0x03  0x028  4              52  ---  Read Recovery Attempts
0x03  0x030  4               1  ---  Number of Mechanical Start Failures
0x04  =====  =               =  ===  == General Errors Statistics (rev 1) ==
0x04  0x008  4             108  ---  Number of Reported Uncorrectable Errors
0x04  0x010  4               5  ---  Resets Between Cmd Acceptance and Completion
                                |||_ C monitored condition met
                                ||__ D supports DSN
                                |___ N normalized value

SATA Phy Event Counters (GP Log 0x11)
ID      Size     Value  Description
0x000a  2            3  Device-to-host register FISes sent due to a COMRESET
0x0001  2            2  Command failed due to ICRC error
0x0003  2            3  R_ERR response for device-to-host data FIS
0x0004  2            0  R_ERR response for host-to-device data FIS
0x0006  2            0  R_ERR response for device-to-host non-data FIS
0x0007  2            0  R_ERR response for host-to-device non-data FIS

