smartctl 7.1 2020-06-20 r5066 [x86_64-linux-3.10.0-1127...] (local build)
Copyright (C) 2002-19, Bruce Allen, Christian Franke, www.smartmontools.org

=== START OF INFORMATION SECTION ===
Model Number:                       VO001920KWVMT
Serial Number:                      --
Firmware Version:                   HPK2
PCI Vendor ID:                      0x144d
PCI Vendor Subsystem ID:            0x1590
IEEE OUI Identifier:                0x002538
Total NVM Capacity:                 1,920,383,410,176 [1.92 TB]
Unallocated NVM Capacity:           0
Controller ID:                      33
Number of Namespaces:               32
Namespace 1 Size/Capacity:          1,920,383,410,176 [1.92 TB]
Namespace 1 Formatted LBA Size:     512
Namespace 1 IEEE EUI-64:            002538 ...
Local Time is:                      Mon Mar ... 2022 CEST

=== START OF READ SMART DATA SECTION ===
SMART overall-health self-assessment test result: PASSED

SMART/Health Information (NVMe Log 0x02)
Critical Warning:                   0x00
Temperature:                        23 Celsius
Available Spare:                    100%
Available Spare Threshold:          10%
Percentage Used:                    0%
Data Units Read:                    31,222,198 [15.9 TB]
Data Units Written:                 173,654,054 [88.9 TB]
Host Read Commands:                 2,383,047,621
Host Write Commands:                3,623,512,733
Controller Busy Time:               5,583
Power Cycles:                       24
Power On Hours:                     12,962
Unsafe Shutdowns:                   18
Media and Data Integrity Errors:    0
Error Information Log Entries:      0
Warning  Comp. Temperature Time:    0
Critical Comp. Temperature Time:    0
Temperature Sensor 1:               23 Celsius
Temperature Sensor 2:               23 Celsius
Temperature Sensor 3:               18 Celsius

