smartctl 7.4 2023-08-01 r5530 [x86_64-linux-3.10.0-1160...] (local build)
Copyright (C) 2002-23, Bruce Allen, Christian Franke, www.smartmontools.org

=== START OF INFORMATION SECTION ===
Model Number:                       HP SSD FX900 Plus M.2 1TB
Serial Number:                      --
Firmware Version:                   SN10191
PCI Vendor/Subsystem ID:            0x1e4b
IEEE OUI Identifier:                0x000000
Total NVM Capacity:                 1,024,209,543,168 [1.02 TB]
Unallocated NVM Capacity:           0
Controller ID:                      0
NVMe Version:                       1.4
Number of Namespaces:               1
Namespace 1 Size/Capacity:          1,024,209,543,168 [1.02 TB]
Namespace 1 Formatted LBA Size:     512
Namespace 1 IEEE EUI-64:            000000 ...
Local Time is:                      Tue Dec ... 2025 MSK

=== START OF READ SMART DATA SECTION ===
SMART overall-health self-assessment test result: PASSED

SMART/Health Information (NVMe Log 0x02)
Critical Warning:                   0x00
Temperature:                        42 Celsius
Available Spare:                    100%
Available Spare Threshold:          1%
Percentage Used:                    31%
Data Units Read:                    17,787,934 [9.10 TB]
Data Units Written:                 168,050,844 [86.0 TB]
Host Read Commands:                 230,150,016
Host Write Commands:                1,821,460,617
Controller Busy Time:               4,331
Power Cycles:                       26
Power On Hours:                     10,188
Unsafe Shutdowns:                   22
Media and Data Integrity Errors:    0
Error Information Log Entries:      0
Warning  Comp. Temperature Time:    0
Critical Comp. Temperature Time:    0
Temperature Sensor 1:               42 Celsius
Temperature Sensor 2:               29 Celsius

Error Information (NVMe Log 0x01, 16 of 64 entries)
No Errors Logged

Read Self-test Log failed: Invalid Field in Command (0x2002)

