smartctl 7.1 2019-12-30 r5022 [x86_64-linux-3.10.0-1062...] (local build)
Copyright (C) 2002-19, Bruce Allen, Christian Franke, www.smartmontools.org

=== START OF INFORMATION SECTION ===
Model Family:     Western Digital Red
Device Model:     WDC WD60EFRX-68L0BN1
Serial Number:    --
LU WWN Device Id: 5 0014ee ...
Firmware Version: 82.00A82
User Capacity:    6,001,175,126,016 bytes [6.00 TB]
Sector Sizes:     512 bytes logical, 4096 bytes physical
Rotation Rate:    5700 rpm
Device is:        In smartctl database [for details use: -P show]
ATA Version is:   ACS-2, ACS-3 T13/2161-D revision 3b
SATA Version is:  SATA 3.1, 6.0 Gb/s (current: 6.0 Gb/s)
Local Time is:    --
Rd look-ahead is: Enabled
Write cache is:   Enabled
ATA Security is:  Disabled, NOT FROZEN [SEC1]

=== START OF READ SMART DATA SECTION ===
SMART overall-health self-assessment test result: PASSED
Warning: This result is based on an Attribute check.

General SMART Values:
Offline data collection status:  (0x00)	Offline data collection activity
					was never started.

Self-test execution status:      (   0)	The previous self-test routine completed
					without error or no self-test has ever 
					been run.
Total time to complete Offline 
data collection: 		( 3824) seconds.
Offline data collection
capabilities: 			 (0x7b) SMART execute Offline immediate.

					Suspend Offline collection upon new
					command.
					Offline surface scan supported.
					Self-test supported.
					Conveyance Self-test supported.
					Selective Self-test supported.
SMART capabilities:            (0x0003)	Saves SMART data before entering
					power-saving mode.

Error logging capability:        (0x01)	Error logging supported.
					General Purpose Logging supported.
Short self-test routine 
recommended polling time: 	 (   2) minutes.
Extended self-test routine
recommended polling time: 	 ( 692) minutes.
Conveyance self-test routine
recommended polling time: 	 (   5) minutes.
SCT capabilities: 	       (0x303d)	SCT Status supported.
					SCT Error Recovery Control supported.
					SCT Feature Control supported.
					SCT Data Table supported.

SMART Attributes Data Structure revision number: 16
Vendor Specific SMART Attributes with Thresholds:
ID# ATTRIBUTE_NAME          FLAGS    VALUE WORST THRESH FAIL RAW_VALUE
  1 Raw_Read_Error_Rate     POSR-K   200   200   051    -    0
  3 Spin_Up_Time            POS--K   232   232   021    -    7391
  4 Start_Stop_Count        -O--CK   100   100   000    -    6
  5 Reallocated_Sector_Ct   PO--CK   200   200   140    -    0
  7 Seek_Error_Rate         -OSR-K   100   253   000    -    0
  9 Power_On_Hours          -O--CK   051   051   000    -    36295
 10 Spin_Retry_Count        -O--CK   100   253   000    -    0
 11 Calibration_Retry_Count -O--CK   100   253   000    -    0
 12 Power_Cycle_Count       -O--CK   100   100   000    -    6
192 Power-Off_Retract_Count -O--CK   200   200   000    -    4
193 Load_Cycle_Count        -O--CK   200   200   000    -    364
194 Temperature_Celsius     -O---K   120   114   000    -    32
196 Reallocated_Event_Count -O--CK   200   200   000    -    0
197 Current_Pending_Sector  -O--CK   200   200   000    -    0
198 Offline_Uncorrectable   ----CK   100   253   000    -    0
199 UDMA_CRC_Error_Count    -O--CK   200   200   000    -    0
200 Multi_Zone_Error_Rate   ---R--   100   253   000    -    0
                            ||||||_ K auto-keep
                            |||||__ C event count
                            ||||___ R error rate
                            |||____ S speed/performance
                            ||_____ O updated online
                            |______ P prefailure warning

General Purpose Log Directory Version 1
SMART           Log Directory Version 1 [multi-sector log support]
Address    Access  R/W   Size  Description
0x00       GPL,SL  R/O      1  Log Directory
0x01           SL  R/O      1  Summary SMART error log
0x02           SL  R/O      5  Comprehensive SMART error log
0x03       GPL     R/O      6  Ext. Comprehensive SMART error log
0x06           SL  R/O      1  SMART self-test log
0x07       GPL     R/O      1  Extended self-test log
0x09           SL  R/W      1  Selective self-test log
0x10       GPL     R/O      1  NCQ Command Error log
0x11       GPL     R/O      1  SATA Phy Event Counters log
0x21       GPL     R/O      1  Write stream error log
0x22       GPL     R/O      1  Read stream error log
0x30       GPL,SL  R/O      9  IDENTIFY DEVICE data log
0x80-0x9f  GPL,SL  R/W     16  Host vendor specific log
0xa0-0xa7  GPL,SL  VS      16  Device vendor specific log
0xa8-0xb6  GPL,SL  VS       1  Device vendor specific log
0xb7       GPL,SL  VS      54  Device vendor specific log
0xbd       GPL,SL  VS       1  Device vendor specific log
0xc0       GPL,SL  VS       1  Device vendor specific log
0xc1       GPL     VS      93  Device vendor specific log
0xe0       GPL,SL  R/W      1  SCT Command/Status
0xe1       GPL,SL  R/W      1  SCT Data Transfer

SMART Extended Comprehensive Error Log Version: 1 (6 sectors)
Device Error Count: 7
	CR     = Command Register
	FEATR  = Features Register
	COUNT  = Count (was: Sector Count) Register
	LBA_48 = Upper bytes of LBA High/Mid/Low Registers ]  ATA-8
	LH     = LBA High (was: Cylinder High) Register    ]   LBA
	LM     = LBA Mid (was: Cylinder Low) Register      ] Register
	LL     = LBA Low (was: Sector Number) Register     ]
	DV     = Device (was: Device/Head) Register
	DC     = Device Control Register
	ER     = Error register
	ST     = Status register
Powered_Up_Time is measured from power on, and printed as
DDd+hh:mm:SS.sss where DD=days, hh=hours, mm=minutes,
SS=sec, and sss=millisec. It "wraps" after 49.710 days.

Error 7 [6] occurred at disk power-on lifetime: 11317 hours (471 days + 13 hours)
  When the command that caused the error occurred, the device was active or idle.

  After command completion occurred, registers were:
  ER -- ST COUNT  LBA_48  LH LM LL DV DC
  -- -- -- == -- == == == -- -- -- -- --
  40 -- 51 00 00 00 02 49 4e 51 c0 40 00  Error: UNC at LBA = 0x2494e51c0 = 9819804096

  Commands leading to the command that caused the error were:
  CR FEATR COUNT  LBA_48  LH LM LL DV DC  Powered_Up_Time  Command/Feature_Name
  -- == -- == -- == == == -- -- -- -- --  ---------------  --------------------
  60 03 e8 00 00 00 02 49 4e 51 c0 40 00 23d+ ...          READ FPDMA QUEUED
  60 00 30 00 00 00 02 49 18 79 e8 40 00 23d+ ...          READ FPDMA QUEUED
  60 02 50 00 10 00 02 49 18 77 98 40 00 23d+ ...          READ FPDMA QUEUED
  60 04 00 00 08 00 02 49 18 73 98 40 00 23d+ ...          READ FPDMA QUEUED
  60 04 00 00 00 00 02 49 18 6f 98 40 00 23d+ ...          READ FPDMA QUEUED

Error 6 [5] occurred at disk power-on lifetime: 9424 hours (392 days + 16 hours)
  When the command that caused the error occurred, the device was active or idle.

  After command completion occurred, registers were:
  ER -- ST COUNT  LBA_48  LH LM LL DV DC
  -- -- -- == -- == == == -- -- -- -- --
  40 -- 51 00 00 00 00 15 61 d3 48 40 00  Error: UNC at LBA = 0x1561d348 = 358732616

  Commands leading to the command that caused the error were:
  CR FEATR COUNT  LBA_48  LH LM LL DV DC  Powered_Up_Time  Command/Feature_Name
  -- == -- == -- == == == -- -- -- -- --  ---------------  --------------------
  60 00 b8 00 00 00 00 15 61 d3 48 40 00 44d+ ...          READ FPDMA QUEUED
  60 01 00 00 00 00 00 15 61 d2 48 40 00 44d+ ...          READ FPDMA QUEUED
  60 01 00 00 00 00 00 15 61 d1 48 40 00 44d+ ...          READ FPDMA QUEUED
  60 01 00 00 00 00 00 15 61 d0 48 40 00 44d+ ...          READ FPDMA QUEUED
  60 01 00 00 00 00 00 15 61 cf 48 40 00 44d+ ...          READ FPDMA QUEUED

Error 5 [4] occurred at disk power-on lifetime: 9390 hours (391 days + 6 hours)
  When the command that caused the error occurred, the device was active or idle.

  After command completion occurred, registers were:
  ER -- ST COUNT  LBA_48  LH LM LL DV DC
  -- -- -- == -- == == == -- -- -- -- --
  40 -- 51 00 00 00 02 6c 44 84 30 40 00  Error: UNC at LBA = 0x26c448430 = 10406364208

  Commands leading to the command that caused the error were:
  CR FEATR COUNT  LBA_48  LH LM LL DV DC  Powered_Up_Time  Command/Feature_Name
  -- == -- == -- == == == -- -- -- -- --  ---------------  --------------------
  60 01 00 00 00 00 02 6c 44 69 30 40 00 42d+ ...          READ FPDMA QUEUED
  60 01 00 00 00 00 02 6c 44 68 30 40 00 42d+ ...          READ FPDMA QUEUED
  60 01 00 00 00 00 02 6c 44 67 30 40 00 42d+ ...          READ FPDMA QUEUED
  60 01 00 00 00 00 02 6c 44 66 30 40 00 42d+ ...          READ FPDMA QUEUED
  60 01 00 00 00 00 02 6c 44 65 30 40 00 42d+ ...          READ FPDMA QUEUED

Error 4 [3] occurred at disk power-on lifetime: 9324 hours (388 days + 12 hours)
  When the command that caused the error occurred, the device was active or idle.

  After command completion occurred, registers were:
  ER -- ST COUNT  LBA_48  LH LM LL DV DC
  -- -- -- == -- == == == -- -- -- -- --
  40 -- 51 00 00 00 02 3c b1 60 20 40 00  Error: UNC at LBA = 0x23cb16020 = 9608192032

  Commands leading to the command that caused the error were:
  CR FEATR COUNT  LBA_48  LH LM LL DV DC  Powered_Up_Time  Command/Feature_Name
  -- == -- == -- == == == -- -- -- -- --  ---------------  --------------------
  60 00 e0 00 00 00 02 3c b1 60 20 40 00 40d+ ...          READ FPDMA QUEUED
  60 01 00 00 00 00 02 3c b1 5f 20 40 00 40d+ ...          READ FPDMA QUEUED
  60 01 00 00 00 00 02 3c b1 5e 20 40 00 40d+ ...          READ FPDMA QUEUED
  60 01 00 00 00 00 02 3c b1 5d 20 40 00 40d+ ...          READ FPDMA QUEUED
  60 01 00 00 00 00 02 3c b1 5c 20 40 00 40d+ ...          READ FPDMA QUEUED

Error 3 [2] occurred at disk power-on lifetime: 7915 hours (329 days + 19 hours)
  When the command that caused the error occurred, the device was active or idle.

  After command completion occurred, registers were:
  ER -- ST COUNT  LBA_48  LH LM LL DV DC
  -- -- -- == -- == == == -- -- -- -- --
  10 -- 51 00 00 00 02 36 40 0b 90 40 00  Error: IDNF at LBA = 0x236400b90 = 9500101520

  Commands leading to the command that caused the error were:
  CR FEATR COUNT  LBA_48  LH LM LL DV DC  Powered_Up_Time  Command/Feature_Name
  -- == -- == -- == == == -- -- -- -- --  ---------------  --------------------
  61 00 08 00 00 00 02 36 40 0b 90 40 00 31d+ ...          WRITE FPDMA QUEUED
  61 00 08 00 00 00 01 5d 45 0e c0 41 00 31d+ ...          WRITE FPDMA QUEUED
  ea 00 00 00 00 00 00 00 00 00 00 40 00 31d+ ...          FLUSH CACHE EXT
  61 00 10 00 00 00 01 5d 45 0e b0 40 00 31d+ ...          WRITE FPDMA QUEUED
  60 01 a8 00 00 00 02 56 15 20 00 40 00 31d+ ...          READ FPDMA QUEUED

Error 2 [1] occurred at disk power-on lifetime: 6573 hours (273 days + 21 hours)
  When the command that caused the error occurred, the device was active or idle.

  After command completion occurred, registers were:
  ER -- ST COUNT  LBA_48  LH LM LL DV DC
  -- -- -- == -- == == == -- -- -- -- --
  10 -- 51 00 00 00 02 36 40 0c a0 40 00  Error: IDNF at LBA = 0x236400ca0 = 9500101792

  Commands leading to the command that caused the error were:
  CR FEATR COUNT  LBA_48  LH LM LL DV DC  Powered_Up_Time  Command/Feature_Name
  -- == -- == -- == == == -- -- -- -- --  ---------------  --------------------
  61 00 08 00 00 00 02 36 40 0c a0 40 00 24d+ ...          WRITE FPDMA QUEUED
  60 00 70 00 00 00 02 63 aa f3 68 40 00 24d+ ...          READ FPDMA QUEUED
  60 02 00 00 00 00 02 63 aa f1 68 40 00 24d+ ...          READ FPDMA QUEUED
  60 00 e8 00 00 00 02 63 aa f0 80 40 00 24d+ ...          READ FPDMA QUEUED
  60 00 18 00 00 00 02 63 aa f0 68 40 00 24d+ ...          READ FPDMA QUEUED

Error 1 [0] occurred at disk power-on lifetime: 4412 hours (183 days + 20 hours)
  When the command that caused the error occurred, the device was active or idle.

  After command completion occurred, registers were:
  ER -- ST COUNT  LBA_48  LH LM LL DV DC
  -- -- -- == -- == == == -- -- -- -- --
  10 -- 51 00 00 00 01 5d 45 a1 08 c0 00  Error: IDNF at LBA = 0x15d45a108 = 5859811592

  Commands leading to the command that caused the error were:
  CR FEATR COUNT  LBA_48  LH LM LL DV DC  Powered_Up_Time  Command/Feature_Name
  -- == -- == -- == == == -- -- -- -- --  ---------------  --------------------
  61 00 08 00 00 00 01 5d 45 a1 08 41 00 34d+ ...          WRITE FPDMA QUEUED
  ea 00 00 00 00 00 00 00 00 00 00 40 00 34d+ ...          FLUSH CACHE EXT
  61 00 40 00 00 00 01 5d 45 a0 c8 40 00 34d+ ...          WRITE FPDMA QUEUED
  61 00 08 00 00 00 02 36 45 35 d0 40 00 34d+ ...          WRITE FPDMA QUEUED
  61 00 08 00 00 00 02 36 45 35 d0 40 00 34d+ ...          WRITE FPDMA QUEUED

SMART Extended Self-test Log Version: 1 (1 sectors)
No self-tests have been logged.  [To run self-tests, use: smartctl -t]

SMART Selective self-test log data structure revision number 1
 SPAN  MIN_LBA  MAX_LBA  CURRENT_TEST_STATUS
    1        0        0  Not_testing
    2        0        0  Not_testing
    3        0        0  Not_testing
    4        0        0  Not_testing
    5        0        0  Not_testing
Selective self-test flags (0x0):
  After scanning selected spans, do NOT read-scan remainder of disk.
If Selective self-test is pending on power-up, resume after 0 minute delay.

SCT Status Version:                  3
SCT Version (vendor specific):       258 (0x0102)
Device State:                        Active (0)
Current Temperature:                    32 Celsius
Power Cycle Min/Max Temperature:     27/38 Celsius
Lifetime    Min/Max Temperature:     18/38 Celsius
Under/Over Temperature Limit Count:   0/0
Vendor specific:
01 00 00 00 00 00 00 00 00 00 00 00 00 00 00 00
00 00 00 00 00 00 00 00 00 00 00 00 00 00 00 00

SCT Temperature History Version:     2
Temperature Sampling Period:         1 minute
Temperature Logging Interval:        1 minute
Min/Max recommended Temperature:      0/60 Celsius
Min/Max Temperature Limit:           -41/85 Celsius
Temperature History Size (Index):    478 (70)

SATA Phy Event Counters (GP Log 0x11)
ID      Size     Value  Description
0x0001  2            0  Command failed due to ICRC error
0x0002  2            0  R_ERR response for data FIS
0x0003  2            0  R_ERR response for device-to-host data FIS
0x0004  2            0  R_ERR response for host-to-device data FIS
0x0005  2            0  R_ERR response for non-data FIS
0x0006  2            0  R_ERR response for device-to-host non-data FIS
0x0007  2            0  R_ERR response for host-to-device non-data FIS
0x0008  2            0  Device-to-host non-data FIS retries
0x0009  2           29  Transition from drive PhyRdy to drive PhyNRdy
0x000a  2           91  Device-to-host register FISes sent due to a COMRESET
0x000b  2            0  CRC errors within host-to-device FIS
0x000d  2            0  Non-CRC errors within host-to-device FIS
0x000f  2            0  R_ERR response for host-to-device data FIS, CRC
0x0012  2            0  R_ERR response for host-to-device non-data FIS, CRC
0x8000  4    134921829  Vendor specific

