smartctl 7.1 2019-12-30 r5022 [x86_64-linux-3.10.0-1062...] (local build)
Copyright (C) 2002-19, Bruce Allen, Christian Franke, www.smartmontools.org

=== START OF INFORMATION SECTION ===
Model Family:     Western Digital Red
Device Model:     WDC WD60EFRX-68L0BN1
Serial Number:    --
LU WWN Device Id: 5 0014ee ...
Firmware Version: 82.00A82
User Capacity:    6,001,175,126,016 bytes [6.00 TB]
Sector Sizes:     512 bytes logical, 4096 bytes physical
Rotation Rate:    5700 rpm
Device is:        In smartctl database [for details use: -P show]
ATA Version is:   ACS-2, ACS-3 T13/2161-D revision 3b
SATA Version is:  SATA 3.1, 6.0 Gb/s (current: 6.0 Gb/s)
Local Time is:    --
Rd look-ahead is: Enabled
Write cache is:   Enabled
ATA Security is:  Disabled, NOT FROZEN [SEC1]

=== START OF READ SMART DATA SECTION ===
SMART overall-health self-assessment test result: PASSED
Warning: This result is based on an Attribute check.

General SMART Values:
Offline data collection status:  (0x00)	Offline data collection activity
					was never started.

Self-test execution status:      (   0)	The previous self-test routine completed
					without error or no self-test has ever 
					been run.
Total time to complete Offline 
data collection: 		( 3164) seconds.
Offline data collection
capabilities: 			 (0x7b) SMART execute Offline immediate.

					Suspend Offline collection upon new
					command.
					Offline surface scan supported.
					Self-test supported.
					Conveyance Self-test supported.
					Selective Self-test supported.
SMART capabilities:            (0x0003)	Saves SMART data before entering
					power-saving mode.

Error logging capability:        (0x01)	Error logging supported.
					General Purpose Logging supported.
Short self-test routine 
recommended polling time: 	 (   2) minutes.
Extended self-test routine
recommended polling time: 	 ( 685) minutes.
Conveyance self-test routine
recommended polling time: 	 (   5) minutes.
SCT capabilities: 	       (0x303d)	SCT Status supported.
					SCT Error Recovery Control supported.
					SCT Feature Control supported.
					SCT Data Table supported.

SMART Attributes Data Structure revision number: 16
Vendor Specific SMART Attributes with Thresholds:
ID# ATTRIBUTE_NAME          FLAGS    VALUE WORST THRESH FAIL RAW_VALUE
  1 Raw_Read_Error_Rate     POSR-K   200   200   051    -    0
  3 Spin_Up_Time            POS--K   220   214   021    -    7958
  4 Start_Stop_Count        -O--CK   100   100   000    -    17
  5 Reallocated_Sector_Ct   PO--CK   200   200   140    -    0
  7 Seek_Error_Rate         -OSR-K   200   200   000    -    0
  9 Power_On_Hours          -O--CK   066   066   000    -    25404
 10 Spin_Retry_Count        -O--CK   100   253   000    -    0
 11 Calibration_Retry_Count -O--CK   100   253   000    -    0
 12 Power_Cycle_Count       -O--CK   100   100   000    -    17
192 Power-Off_Retract_Count -O--CK   200   200   000    -    15
193 Load_Cycle_Count        -O--CK   200   200   000    -    1765
194 Temperature_Celsius     -O---K   122   111   000    -    30
196 Reallocated_Event_Count -O--CK   200   200   000    -    0
197 Current_Pending_Sector  -O--CK   200   200   000    -    0
198 Offline_Uncorrectable   ----CK   100   253   000    -    0
199 UDMA_CRC_Error_Count    -O--CK   200   200   000    -    0
200 Multi_Zone_Error_Rate   ---R--   100   253   000    -    0
                            ||||||_ K auto-keep
                            |||||__ C event count
                            ||||___ R error rate
                            |||____ S speed/performance
                            ||_____ O updated online
                            |______ P prefailure warning

General Purpose Log Directory Version 1
SMART           Log Directory Version 1 [multi-sector log support]
Address    Access  R/W   Size  Description
0x00       GPL,SL  R/O      1  Log Directory
0x01           SL  R/O      1  Summary SMART error log
0x02           SL  R/O      5  Comprehensive SMART error log
0x03       GPL     R/O      6  Ext. Comprehensive SMART error log
0x06           SL  R/O      1  SMART self-test log
0x07       GPL     R/O      1  Extended self-test log
0x09           SL  R/W      1  Selective self-test log
0x10       GPL     R/O      1  NCQ Command Error log
0x11       GPL     R/O      1  SATA Phy Event Counters log
0x21       GPL     R/O      1  Write stream error log
0x22       GPL     R/O      1  Read stream error log
0x30       GPL,SL  R/O      9  IDENTIFY DEVICE data log
0x80-0x9f  GPL,SL  R/W     16  Host vendor specific log
0xa0-0xa7  GPL,SL  VS      16  Device vendor specific log
0xa8-0xb6  GPL,SL  VS       1  Device vendor specific log
0xb7       GPL,SL  VS      54  Device vendor specific log
0xbd       GPL,SL  VS       1  Device vendor specific log
0xc0       GPL,SL  VS       1  Device vendor specific log
0xc1       GPL     VS      93  Device vendor specific log
0xe0       GPL,SL  R/W      1  SCT Command/Status
0xe1       GPL,SL  R/W      1  SCT Data Transfer

SMART Extended Comprehensive Error Log Version: 1 (6 sectors)
Device Error Count: 7
	CR     = Command Register
	FEATR  = Features Register
	COUNT  = Count (was: Sector Count) Register
	LBA_48 = Upper bytes of LBA High/Mid/Low Registers ]  ATA-8
	LH     = LBA High (was: Cylinder High) Register    ]   LBA
	LM     = LBA Mid (was: Cylinder Low) Register      ] Register
	LL     = LBA Low (was: Sector Number) Register     ]
	DV     = Device (was: Device/Head) Register
	DC     = Device Control Register
	ER     = Error register
	ST     = Status register
Powered_Up_Time is measured from power on, and printed as
DDd+hh:mm:SS.sss where DD=days, hh=hours, mm=minutes,
SS=sec, and sss=millisec. It "wraps" after 49.710 days.

Error 7 [6] occurred at disk power-on lifetime: 22876 hours (953 days + 4 hours)
  When the command that caused the error occurred, the device was active or idle.

  After command completion occurred, registers were:
  ER -- ST COUNT  LBA_48  LH LM LL DV DC
  -- -- -- == -- == == == -- -- -- -- --
  40 -- 51 00 00 00 02 9b 9a 90 00 40 00  Error: UNC at LBA = 0x29b9a9000 = 11200532480

  Commands leading to the command that caused the error were:
  CR FEATR COUNT  LBA_48  LH LM LL DV DC  Powered_Up_Time  Command/Feature_Name
  -- == -- == -- == == == -- -- -- -- --  ---------------  --------------------
  60 01 48 00 00 00 02 9b 9a 90 00 40 00 35d+ ...          READ FPDMA QUEUED
  60 04 00 00 00 00 02 9b 9a 8c 00 40 00 35d+ ...          READ FPDMA QUEUED
  60 04 00 00 00 00 02 9b 9a 88 00 40 00 35d+ ...          READ FPDMA QUEUED
  60 04 00 00 00 00 02 9b 9a 84 00 40 00 35d+ ...          READ FPDMA QUEUED
  60 04 00 00 00 00 02 9b 9a 80 00 40 00 35d+ ...          READ FPDMA QUEUED

Error 6 [5] occurred at disk power-on lifetime: 18711 hours (779 days + 15 hours)
  When the command that caused the error occurred, the device was active or idle.

  After command completion occurred, registers were:
  ER -- ST COUNT  LBA_48  LH LM LL DV DC
  -- -- -- == -- == == == -- -- -- -- --
  40 -- 51 00 00 00 00 19 37 33 08 40 00  Error: UNC at LBA = 0x19373308 = 423047944

  Commands leading to the command that caused the error were:
  CR FEATR COUNT  LBA_48  LH LM LL DV DC  Powered_Up_Time  Command/Feature_Name
  -- == -- == -- == == == -- -- -- -- --  ---------------  --------------------
  60 00 10 00 00 00 00 19 37 33 08 40 00 10d+ ...          READ FPDMA QUEUED
  60 00 20 00 00 00 00 19 37 32 98 40 00 10d+ ...          READ FPDMA QUEUED
  60 00 20 00 00 00 00 19 37 32 78 40 00 10d+ ...          READ FPDMA QUEUED
  60 00 10 00 00 00 00 19 37 32 68 40 00 10d+ ...          READ FPDMA QUEUED
  60 00 08 00 00 00 00 19 37 32 60 40 00 10d+ ...          READ FPDMA QUEUED

Error 5 [4] occurred at disk power-on lifetime: 18159 hours (756 days + 15 hours)
  When the command that caused the error occurred, the device was active or idle.

  After command completion occurred, registers were:
  ER -- ST COUNT  LBA_48  LH LM LL DV DC
  -- -- -- == -- == == == -- -- -- -- --
  40 -- 51 00 00 00 00 04 ee fa 98 40 00  Error: UNC at LBA = 0x04eefa98 = 82770584

  Commands leading to the command that caused the error were:
  CR FEATR COUNT  LBA_48  LH LM LL DV DC  Powered_Up_Time  Command/Feature_Name
  -- == -- == -- == == == -- -- -- -- --  ---------------  --------------------
  60 00 90 00 00 00 00 04 ee dc 08 40 00 37d+ ...          READ FPDMA QUEUED
  60 00 70 00 00 00 00 04 ee db 98 40 00 37d+ ...          READ FPDMA QUEUED
  60 00 90 00 00 00 00 04 ee db 08 40 00 37d+ ...          READ FPDMA QUEUED
  60 00 70 00 00 00 00 04 ee da 98 40 00 37d+ ...          READ FPDMA QUEUED
  60 00 90 00 10 00 00 04 ee da 08 40 00 37d+ ...          READ FPDMA QUEUED

Error 4 [3] occurred at disk power-on lifetime: 17992 hours (749 days + 16 hours)
  When the command that caused the error occurred, the device was active or idle.

  After command completion occurred, registers were:
  ER -- ST COUNT  LBA_48  LH LM LL DV DC
  -- -- -- == -- == == == -- -- -- -- --
  40 -- 51 00 00 00 02 93 f7 46 78 40 00  Error: UNC at LBA = 0x293f74678 = 11072390776

  Commands leading to the command that caused the error were:
  CR FEATR COUNT  LBA_48  LH LM LL DV DC  Powered_Up_Time  Command/Feature_Name
  -- == -- == -- == == == -- -- -- -- --  ---------------  --------------------
  60 00 d0 00 00 00 02 93 f7 3a 78 40 00 30d+ ...          READ FPDMA QUEUED
  60 01 00 00 00 00 02 93 f7 39 78 40 00 30d+ ...          READ FPDMA QUEUED
  60 01 00 00 00 00 02 93 f7 38 78 40 00 30d+ ...          READ FPDMA QUEUED
  60 00 30 00 08 00 02 93 f7 38 48 40 00 30d+ ...          READ FPDMA QUEUED
  60 00 d0 00 00 00 02 93 f7 37 78 40 00 30d+ ...          READ FPDMA QUEUED

Error 3 [2] occurred at disk power-on lifetime: 13671 hours (569 days + 15 hours)
  When the command that caused the error occurred, the device was active or idle.

  After command completion occurred, registers were:
  ER -- ST COUNT  LBA_48  LH LM LL DV DC
  -- -- -- == -- == == == -- -- -- -- --
  40 -- 51 00 00 00 01 3b 1a 5d b8 40 00  Error: UNC at LBA = 0x13b1a5db8 = 5286550968

  Commands leading to the command that caused the error were:
  CR FEATR COUNT  LBA_48  LH LM LL DV DC  Powered_Up_Time  Command/Feature_Name
  -- == -- == -- == == == -- -- -- -- --  ---------------  --------------------
  60 00 40 00 00 00 01 3b 1a 5d b8 40 00 49d+ ...          READ FPDMA QUEUED
  60 01 00 00 00 00 01 3b 1a 5c b8 40 00 49d+ ...          READ FPDMA QUEUED
  60 01 00 00 00 00 01 3b 1a 5b b8 40 00 49d+ ...          READ FPDMA QUEUED
  60 01 00 00 00 00 01 3b 1a 5a b8 40 00 49d+ ...          READ FPDMA QUEUED
  60 01 00 00 00 00 01 3b 1a 59 b8 40 00 49d+ ...          READ FPDMA QUEUED

Error 2 [1] occurred at disk power-on lifetime: 10181 hours (424 days + 5 hours)
  When the command that caused the error occurred, the device was active or idle.

  After command completion occurred, registers were:
  ER -- ST COUNT  LBA_48  LH LM LL DV DC
  -- -- -- == -- == == == -- -- -- -- --
  10 -- 51 00 00 00 01 22 00 0a 10 40 00  Error: IDNF at LBA = 0x122000a10 = 4865395216

  Commands leading to the command that caused the error were:
  CR FEATR COUNT  LBA_48  LH LM LL DV DC  Powered_Up_Time  Command/Feature_Name
  -- == -- == -- == == == -- -- -- -- --  ---------------  --------------------
  61 00 08 00 00 00 01 22 00 0a 10 40 00  3d+ ...          WRITE FPDMA QUEUED
  60 01 00 00 00 00 01 37 8a 3b f0 40 00  3d+ ...          READ FPDMA QUEUED
  60 00 60 00 00 00 01 37 8a 3b 90 40 00  3d+ ...          READ FPDMA QUEUED
  60 00 a0 00 00 00 01 37 8a 3a f0 40 00  3d+ ...          READ FPDMA QUEUED
  60 01 00 00 00 00 01 37 8a 39 f0 40 00  3d+ ...          READ FPDMA QUEUED

Error 1 [0] occurred at disk power-on lifetime: 6768 hours (282 days + 0 hours)
  When the command that caused the error occurred, the device was active or idle.

  After command completion occurred, registers were:
  ER -- ST COUNT  LBA_48  LH LM LL DV DC
  -- -- -- == -- == == == -- -- -- -- --
  10 -- 51 00 fe 00 01 22 40 09 08 40 00  Error: IDNF at LBA = 0x122400908 = 4869589256

  Commands leading to the command that caused the error were:
  CR FEATR COUNT  LBA_48  LH LM LL DV DC  Powered_Up_Time  Command/Feature_Name
  -- == -- == -- == == == -- -- -- -- --  ---------------  --------------------
  61 00 08 00 00 00 01 22 40 09 08 40 00 10d+ ...          WRITE FPDMA QUEUED
  61 00 08 00 00 00 01 5d 44 5e 88 41 00 10d+ ...          WRITE FPDMA QUEUED
  ea 00 00 00 00 00 00 00 00 00 00 40 00 10d+ ...          FLUSH CACHE EXT
  61 00 10 00 00 00 01 5d 44 5e 78 40 00 10d+ ...          WRITE FPDMA QUEUED
  60 03 f8 00 00 00 01 28 4f c8 00 40 00 10d+ ...          READ FPDMA QUEUED

SMART Extended Self-test Log Version: 1 (1 sectors)
No self-tests have been logged.  [To run self-tests, use: smartctl -t]

SMART Selective self-test log data structure revision number 1
 SPAN  MIN_LBA  MAX_LBA  CURRENT_TEST_STATUS
    1        0        0  Not_testing
    2        0        0  Not_testing
    3        0        0  Not_testing
    4        0        0  Not_testing
    5        0        0  Not_testing
Selective self-test flags (0x0):
  After scanning selected spans, do NOT read-scan remainder of disk.
If Selective self-test is pending on power-up, resume after 0 minute delay.

SCT Status Version:                  3
SCT Version (vendor specific):       258 (0x0102)
Device State:                        Active (0)
Current Temperature:                    30 Celsius
Power Cycle Min/Max Temperature:     23/41 Celsius
Lifetime    Min/Max Temperature:     19/41 Celsius
Under/Over Temperature Limit Count:   0/0
Vendor specific:
01 00 00 00 00 00 00 00 00 00 00 00 00 00 00 00
00 00 00 00 00 00 00 00 00 00 00 00 00 00 00 00

SCT Temperature History Version:     2
Temperature Sampling Period:         1 minute
Temperature Logging Interval:        1 minute
Min/Max recommended Temperature:      0/60 Celsius
Min/Max Temperature Limit:           -41/85 Celsius
Temperature History Size (Index):    478 (322)

SATA Phy Event Counters (GP Log 0x11)
ID      Size     Value  Description
0x0001  2            0  Command failed due to ICRC error
0x0002  2            0  R_ERR response for data FIS
0x0003  2            0  R_ERR response for device-to-host data FIS
0x0004  2            0  R_ERR response for host-to-device data FIS
0x0005  2            0  R_ERR response for non-data FIS
0x0006  2            0  R_ERR response for device-to-host non-data FIS
0x0007  2            0  R_ERR response for host-to-device non-data FIS
0x0008  2            0  Device-to-host non-data FIS retries
0x0009  2           27  Transition from drive PhyRdy to drive PhyNRdy
0x000a  2          141  Device-to-host register FISes sent due to a COMRESET
0x000b  2            0  CRC errors within host-to-device FIS
0x000d  2            0  Non-CRC errors within host-to-device FIS
0x000f  2            0  R_ERR response for host-to-device data FIS, CRC
0x0012  2            0  R_ERR response for host-to-device non-data FIS, CRC
0x8000  4     85143818  Vendor specific

