smartctl 7.1 2020-06-20 r5066 [x86_64-linux-3.10.0-1160...] (local build)
Copyright (C) 2002-19, Bruce Allen, Christian Franke, www.smartmontools.org

=== START OF INFORMATION SECTION ===
Model Family:     Seagate Barracuda 7200.8
Device Model:     ST3300831AS
Serial Number:    --
Firmware Version: 3.06
User Capacity:    300,069,052,416 bytes [300 GB]
Sector Size:      512 bytes logical/physical
Device is:        In smartctl database [for details use: -P show]
ATA Version is:   ATA/ATAPI-7 (minor revision not indicated)
Local Time is:    --
Rd look-ahead is: Enabled
Write cache is:   Enabled
ATA Security is:  Disabled, NOT FROZEN [SEC1]

=== START OF READ SMART DATA SECTION ===
SMART overall-health self-assessment test result: PASSED

General SMART Values:
Offline data collection status:  (0x82)	Offline data collection activity
					was completed without error.

Self-test execution status:      (   0)	The previous self-test routine completed
					without error or no self-test has ever 
					been run.
Total time to complete Offline 
data collection: 		(  430) seconds.
Offline data collection
capabilities: 			 (0x5b) SMART execute Offline immediate.

					Suspend Offline collection upon new
					command.
					Offline surface scan supported.
					Self-test supported.
					No Conveyance Self-test supported.
					Selective Self-test supported.
SMART capabilities:            (0x0003)	Saves SMART data before entering
					power-saving mode.

Error logging capability:        (0x01)	Error logging supported.
					General Purpose Logging supported.
Short self-test routine 
recommended polling time: 	 (   1) minutes.
Extended self-test routine
recommended polling time: 	 ( 101) minutes.

SMART Attributes Data Structure revision number: 10
Vendor Specific SMART Attributes with Thresholds:
ID# ATTRIBUTE_NAME          FLAGS    VALUE WORST THRESH FAIL RAW_VALUE
  1 Raw_Read_Error_Rate     POSR--   055   046   006    -    151204703
  3 Spin_Up_Time            PO----   097   097   000    -    0
  4 Start_Stop_Count        -O--CK   100   100   020    -    79
  5 Reallocated_Sector_Ct   PO--CK   100   100   036    -    0
  7 Seek_Error_Rate         POSR--   088   060   030    -    776678872
  9 Power_On_Hours          -O--CK   067   067   000    -    29652
 10 Spin_Retry_Count        PO--C-   100   100   097    -    0
 12 Power_Cycle_Count       -O--CK   100   100   020    -    81
194 Temperature_Celsius     -O---K   043   060   000    -    43 (0 20 0 0 0)
195 Hardware_ECC_Recovered  -O-RC-   055   046   000    -    151204703
197 Current_Pending_Sector  -O--C-   100   100   000    -    1
198 Offline_Uncorrectable   ----C-   100   100   000    -    1
199 UDMA_CRC_Error_Count    -OSRCK   200   199   000    -    573
200 Multi_Zone_Error_Rate   ------   100   253   000    -    0
202 Data_Address_Mark_Errs  -O--CK   100   253   000    -    0
                            ||||||_ K auto-keep
                            |||||__ C event count
                            ||||___ R error rate
                            |||____ S speed/performance
                            ||_____ O updated online
                            |______ P prefailure warning

General Purpose Log Directory Version 1
SMART           Log Directory Version 1 [multi-sector log support]
Address    Access  R/W   Size  Description
0x00       GPL,SL  R/O      1  Log Directory
0x01       GPL,SL  R/O      1  Summary SMART error log
0x02       GPL,SL  R/O      5  Comprehensive SMART error log
0x03       GPL,SL  R/O      5  Ext. Comprehensive SMART error log
0x06       GPL,SL  R/O      1  SMART self-test log
0x07       GPL,SL  R/O      1  Extended self-test log
0x09       GPL,SL  R/W      1  Selective self-test log
0x10       GPL,SL  R/O      1  NCQ Command Error log
0x11       GPL,SL  R/O      1  SATA Phy Event Counters log
0x20       GPL,SL  R/O      1  Streaming performance log [OBS-8]
0x21       GPL,SL  R/O      1  Write stream error log
0x22       GPL,SL  R/O      1  Read stream error log
0x23       GPL,SL  R/O      1  Delayed sector log [OBS-8]
0x80-0x9f  GPL,SL  R/W     16  Host vendor specific log
0xa0       GPL,SL  VS       1  Device vendor specific log
0xa1       GPL,SL  VS      20  Device vendor specific log
0xa2       GPL,SL  VS     101  Device vendor specific log
0xa8       GPL,SL  VS      20  Device vendor specific log
0xa9       GPL,SL  VS       1  Device vendor specific log
0xe0       GPL,SL  R/W      1  SCT Command/Status
0xe1       GPL,SL  R/W      1  SCT Data Transfer
0xff       GPL     -    23040  Reserved

SMART Extended Comprehensive Error Log Version: 1 (5 sectors)
Device Error Count: 555 (device log contains only the most recent 20 errors)
	CR     = Command Register
	FEATR  = Features Register
	COUNT  = Count (was: Sector Count) Register
	LBA_48 = Upper bytes of LBA High/Mid/Low Registers ]  ATA-8
	LH     = LBA High (was: Cylinder High) Register    ]   LBA
	LM     = LBA Mid (was: Cylinder Low) Register      ] Register
	LL     = LBA Low (was: Sector Number) Register     ]
	DV     = Device (was: Device/Head) Register
	DC     = Device Control Register
	ER     = Error register
	ST     = Status register
Powered_Up_Time is measured from power on, and printed as
DDd+hh:mm:SS.sss where DD=days, hh=hours, mm=minutes,
SS=sec, and sss=millisec. It "wraps" after 49.710 days.

Error 555 [14] occurred at disk power-on lifetime: 29108 hours (1212 days + 20 hours)
  When the command that caused the error occurred, the device was active or idle.

  After command completion occurred, registers were:
  ER -- ST COUNT  LBA_48  LH LM LL DV DC
  -- -- -- == -- == == == -- -- -- -- --
  84 -- 11 00 01 00 00 00 00 00 00 00 00  Error: ICRC, ABRT 1 sectors at LBA = 0x00000000 = 0

  Commands leading to the command that caused the error were:
  CR FEATR COUNT  LBA_48  LH LM LL DV DC  Powered_Up_Time  Command/Feature_Name
  -- == -- == -- == == == -- -- -- -- --  ---------------  --------------------
  25 00 00 01 00 00 10 15 00 73 e0 e0 00     10:31:56.079  READ DMA EXT
  25 00 00 01 00 00 10 14 00 73 e0 e0 00     10:31:56.064  READ DMA EXT
  25 00 00 01 00 00 10 13 00 73 e0 e0 00     10:31:56.045  READ DMA EXT
  25 00 00 01 00 00 10 12 00 73 e0 e0 00     10:31:56.044  READ DMA EXT
  25 00 00 01 00 00 10 11 00 73 e0 e0 00     10:31:56.044  READ DMA EXT

Error 554 [13] occurred at disk power-on lifetime: 29108 hours (1212 days + 20 hours)
  When the command that caused the error occurred, the device was active or idle.

  After command completion occurred, registers were:
  ER -- ST COUNT  LBA_48  LH LM LL DV DC
  -- -- -- == -- == == == -- -- -- -- --
  84 -- 11 00 01 00 00 00 00 00 00 00 00  Error: ICRC, ABRT 1 sectors at LBA = 0x00000000 = 0

  Commands leading to the command that caused the error were:
  CR FEATR COUNT  LBA_48  LH LM LL DV DC  Powered_Up_Time  Command/Feature_Name
  -- == -- == -- == == == -- -- -- -- --  ---------------  --------------------
  25 00 00 01 00 00 10 11 00 73 e0 e0 00     10:31:22.768  READ DMA EXT
  25 00 00 01 00 00 10 10 00 73 e0 e0 00     10:31:22.758  READ DMA EXT
  25 00 00 01 00 00 10 0f 00 73 e0 e0 00     10:31:22.748  READ DMA EXT
  25 00 00 01 00 00 10 0e 00 73 e0 e0 00     10:31:22.737  READ DMA EXT
  25 00 00 01 00 00 10 0d 00 73 e0 e0 00     10:31:22.726  READ DMA EXT

Error 553 [12] occurred at disk power-on lifetime: 29108 hours (1212 days + 20 hours)
  When the command that caused the error occurred, the device was active or idle.

  After command completion occurred, registers were:
  ER -- ST COUNT  LBA_48  LH LM LL DV DC
  -- -- -- == -- == == == -- -- -- -- --
  84 -- 11 00 01 00 00 00 00 00 00 00 00  Error: ICRC, ABRT 1 sectors at LBA = 0x00000000 = 0

  Commands leading to the command that caused the error were:
  CR FEATR COUNT  LBA_48  LH LM LL DV DC  Powered_Up_Time  Command/Feature_Name
  -- == -- == -- == == == -- -- -- -- --  ---------------  --------------------
  25 00 00 01 00 00 10 07 00 73 e0 e0 00     10:30:16.071  READ DMA EXT
  25 00 00 01 00 00 10 06 00 73 e0 e0 00     10:30:16.055  READ DMA EXT
  ec 00 00 01 00 00 ff ff 00 ff ff a0 00     10:30:16.037  IDENTIFY DEVICE
  ef 00 03 00 42 00 ff ff 00 ff ff a0 00     10:30:16.037  SET FEATURES [Set transfer mode]
  ec 00 00 01 00 00 ff ff 00 ff ff a0 00     10:30:16.037  IDENTIFY DEVICE

Error 552 [11] occurred at disk power-on lifetime: 29108 hours (1212 days + 20 hours)
  When the command that caused the error occurred, the device was active or idle.

  After command completion occurred, registers were:
  ER -- ST COUNT  LBA_48  LH LM LL DV DC
  -- -- -- == -- == == == -- -- -- -- --
  84 -- 11 00 01 00 00 00 00 00 00 00 00  Error: ICRC, ABRT 1 sectors at LBA = 0x00000000 = 0

  Commands leading to the command that caused the error were:
  CR FEATR COUNT  LBA_48  LH LM LL DV DC  Powered_Up_Time  Command/Feature_Name
  -- == -- == -- == == == -- -- -- -- --  ---------------  --------------------
  25 00 00 01 00 00 10 e9 00 73 e0 e0 00     10:33:38.753  READ DMA EXT
  25 00 00 01 00 00 10 e8 00 73 e0 e0 00     10:33:38.743  READ DMA EXT
  25 00 00 01 00 00 10 e7 00 73 e0 e0 00     10:33:38.733  READ DMA EXT
  25 00 00 01 00 00 10 e6 00 73 e0 e0 00     10:33:38.723  READ DMA EXT
  25 00 00 01 00 00 10 e5 00 73 e0 e0 00     10:33:38.713  READ DMA EXT

Error 551 [10] occurred at disk power-on lifetime: 29108 hours (1212 days + 20 hours)
  When the command that caused the error occurred, the device was active or idle.

  After command completion occurred, registers were:
  ER -- ST COUNT  LBA_48  LH LM LL DV DC
  -- -- -- == -- == == == -- -- -- -- --
  84 -- 11 00 01 00 00 00 00 00 00 00 00  Error: ICRC, ABRT 1 sectors at LBA = 0x00000000 = 0

  Commands leading to the command that caused the error were:
  CR FEATR COUNT  LBA_48  LH LM LL DV DC  Powered_Up_Time  Command/Feature_Name
  -- == -- == -- == == == -- -- -- -- --  ---------------  --------------------
  25 00 00 01 00 00 10 15 00 73 e0 e0 00     10:31:56.079  READ DMA EXT
  25 00 00 01 00 00 10 14 00 73 e0 e0 00     10:31:56.064  READ DMA EXT
  25 00 00 01 00 00 10 13 00 73 e0 e0 00     10:31:56.045  READ DMA EXT
  25 00 00 01 00 00 10 12 00 73 e0 e0 00     10:31:56.044  READ DMA EXT
  25 00 00 01 00 00 10 11 00 73 e0 e0 00     10:31:56.044  READ DMA EXT

Error 550 [9] occurred at disk power-on lifetime: 29108 hours (1212 days + 20 hours)
  When the command that caused the error occurred, the device was active or idle.

  After command completion occurred, registers were:
  ER -- ST COUNT  LBA_48  LH LM LL DV DC
  -- -- -- == -- == == == -- -- -- -- --
  84 -- 11 00 01 00 00 00 00 00 00 00 00  Error: ICRC, ABRT 1 sectors at LBA = 0x00000000 = 0

  Commands leading to the command that caused the error were:
  CR FEATR COUNT  LBA_48  LH LM LL DV DC  Powered_Up_Time  Command/Feature_Name
  -- == -- == -- == == == -- -- -- -- --  ---------------  --------------------
  25 00 00 01 00 00 10 11 00 73 e0 e0 00     10:31:22.768  READ DMA EXT
  25 00 00 01 00 00 10 10 00 73 e0 e0 00     10:31:22.758  READ DMA EXT
  25 00 00 01 00 00 10 0f 00 73 e0 e0 00     10:31:22.748  READ DMA EXT
  25 00 00 01 00 00 10 0e 00 73 e0 e0 00     10:31:22.737  READ DMA EXT
  25 00 00 01 00 00 10 0d 00 73 e0 e0 00     10:31:22.726  READ DMA EXT

Error 549 [8] occurred at disk power-on lifetime: 29108 hours (1212 days + 20 hours)
  When the command that caused the error occurred, the device was active or idle.

  After command completion occurred, registers were:
  ER -- ST COUNT  LBA_48  LH LM LL DV DC
  -- -- -- == -- == == == -- -- -- -- --
  84 -- 11 00 01 00 00 00 00 00 00 00 00  Error: ICRC, ABRT 1 sectors at LBA = 0x00000000 = 0

  Commands leading to the command that caused the error were:
  CR FEATR COUNT  LBA_48  LH LM LL DV DC  Powered_Up_Time  Command/Feature_Name
  -- == -- == -- == == == -- -- -- -- --  ---------------  --------------------
  25 00 00 01 00 00 10 07 00 73 e0 e0 00     10:30:16.071  READ DMA EXT
  25 00 00 01 00 00 10 06 00 73 e0 e0 00     10:30:16.055  READ DMA EXT
  ec 00 00 01 00 00 ff ff 00 ff ff a0 00     10:30:16.037  IDENTIFY DEVICE
  ef 00 03 00 42 00 ff ff 00 ff ff a0 00     10:30:16.037  SET FEATURES [Set transfer mode]
  ec 00 00 01 00 00 ff ff 00 ff ff a0 00     10:30:16.037  IDENTIFY DEVICE

Error 548 [7] occurred at disk power-on lifetime: 29108 hours (1212 days + 20 hours)
  When the command that caused the error occurred, the device was active or idle.

  After command completion occurred, registers were:
  ER -- ST COUNT  LBA_48  LH LM LL DV DC
  -- -- -- == -- == == == -- -- -- -- --
  84 -- 11 00 01 00 00 00 00 00 00 00 00  Error: ICRC, ABRT 1 sectors at LBA = 0x00000000 = 0

  Commands leading to the command that caused the error were:
  CR FEATR COUNT  LBA_48  LH LM LL DV DC  Powered_Up_Time  Command/Feature_Name
  -- == -- == -- == == == -- -- -- -- --  ---------------  --------------------
  25 00 00 01 00 00 10 e9 00 73 e0 e0 00     10:33:38.753  READ DMA EXT
  25 00 00 01 00 00 10 e8 00 73 e0 e0 00     10:33:38.743  READ DMA EXT
  25 00 00 01 00 00 10 e7 00 73 e0 e0 00     10:33:38.733  READ DMA EXT
  25 00 00 01 00 00 10 e6 00 73 e0 e0 00     10:33:38.723  READ DMA EXT
  25 00 00 01 00 00 10 e5 00 73 e0 e0 00     10:33:38.713  READ DMA EXT

SMART Extended Self-test Log Version: 1 (1 sectors)
No self-tests have been logged.  [To run self-tests, use: smartctl -t]

SMART Selective self-test log data structure revision number 1
 SPAN  MIN_LBA  MAX_LBA  CURRENT_TEST_STATUS
    1        0        0  Not_testing
    2        0        0  Not_testing
    3        0        0  Not_testing
    4        0        0  Not_testing
    5        0        0  Not_testing
Selective self-test flags (0x0):
  After scanning selected spans, do NOT read-scan remainder of disk.
If Selective self-test is pending on power-up, resume after 0 minute delay.

