smartctl 7.1 2020-06-20 r5066 [x86_64-linux-3.10.0-1160...] (local build)
Copyright (C) 2002-19, Bruce Allen, Christian Franke, www.smartmontools.org

=== START OF INFORMATION SECTION ===
Device Model:     MB1000GCEHH
Serial Number:    --
LU WWN Device Id: 5 000c50 ...
Firmware Version: HPGD
User Capacity:    1,000,204,886,016 bytes [1.00 TB]
Sector Size:      512 bytes logical/physical
Rotation Rate:    7202 rpm
Form Factor:      3.5 inches
Device is:        Not in smartctl database [for details use: -P showall]
ATA Version is:   ATA8-ACS T13/1699-D revision 6
SATA Version is:  SATA 3.0, 6.0 Gb/s (current: 6.0 Gb/s)
Local Time is:    Fri Jan ... 2022 IST
Rd look-ahead is: Enabled
Write cache is:   Disabled

=== START OF READ SMART DATA SECTION ===
SMART overall-health self-assessment test result: FAILED!
Drive failure expected in less than 24 hours. SAVE ALL DATA.

General SMART Values:
Offline data collection status:  (0x82)	Offline data collection activity
					was completed without error.

Self-test execution status:      (   0)	The previous self-test routine completed
					without error or no self-test has ever 
					been run.
Total time to complete Offline 
data collection: 		(  617) seconds.
Offline data collection
capabilities: 			 (0x7b) SMART execute Offline immediate.

					Suspend Offline collection upon new
					command.
					Offline surface scan supported.
					Self-test supported.
					Conveyance Self-test supported.
					Selective Self-test supported.
SMART capabilities:            (0x0003)	Saves SMART data before entering
					power-saving mode.

Error logging capability:        (0x01)	Error logging supported.
					General Purpose Logging supported.
Short self-test routine 
recommended polling time: 	 (   2) minutes.
Extended self-test routine
recommended polling time: 	 ( 157) minutes.
Conveyance self-test routine
recommended polling time: 	 (   3) minutes.
SCT capabilities: 	       (0x103d)	SCT Status supported.
					SCT Error Recovery Control supported.
					SCT Feature Control supported.
					SCT Data Table supported.

SMART Attributes Data Structure revision number: 10
Vendor Specific SMART Attributes with Thresholds:
ID# ATTRIBUTE_NAME          FLAGS    VALUE WORST THRESH FAIL RAW_VALUE
  1 Raw_Read_Error_Rate     POSR--   055   055   044    -    92906952
  3 Spin_Up_Time            PO----   095   095   070    -    0
  4 Start_Stop_Count        -O--CK   100   100   020    -    375
  5 Reallocated_Sector_Ct   PO--CK   001   001   036    NOW  4095
  7 Seek_Error_Rate         POSR--   080   060   030    -    107744193
  9 Power_On_Hours          -O--CK   017   017   000    -    73270
 10 Spin_Retry_Count        PO--C-   100   100   097    -    0
 12 Power_Cycle_Count       -O--CK   100   100   020    -    374
180 Unknown_HDD_Attribute   PO-RCK   100   100   030    -    22298253
184 End-to-End_Error        -O--CK   100   100   003    -    0
187 Reported_Uncorrect      -O--CK   001   001   000    -    243
188 Command_Timeout         -O--CK   100   100   000    -    0
189 High_Fly_Writes         -O-RCK   100   100   000    -    0
190 Airflow_Temperature_Cel -O---K   074   049   045    -    26 (Min/Max 25/28)
191 G-Sense_Error_Rate      -O--CK   100   100   000    -    0
192 Power-Off_Retract_Count -O--CK   100   100   000    -    373
193 Load_Cycle_Count        -O--CK   099   099   000    -    2657
194 Temperature_Celsius     -O---K   026   051   000    -    26 (0 17 0 0 0)
195 Hardware_ECC_Recovered  -O-RC-   115   099   000    -    92906952
196 Reallocated_Event_Count PO--CK   001   001   036    NOW  4095
197 Current_Pending_Sector  -O--C-   100   100   000    -    0
198 Offline_Uncorrectable   ----C-   100   100   000    -    0
199 UDMA_CRC_Error_Count    -OSRCK   200   200   000    -    0
                            ||||||_ K auto-keep
                            |||||__ C event count
                            ||||___ R error rate
                            |||____ S speed/performance
                            ||_____ O updated online
                            |______ P prefailure warning

General Purpose Log Directory Version 1
SMART           Log Directory Version 1 [multi-sector log support]
Address    Access  R/W   Size  Description
0x00       GPL,SL  R/O      1  Log Directory
0x01           SL  R/O      1  Summary SMART error log
0x02           SL  R/O      5  Comprehensive SMART error log
0x03       GPL     R/O      5  Ext. Comprehensive SMART error log
0x04       GPL,SL  R/O      8  Device Statistics log
0x06           SL  R/O      1  SMART self-test log
0x07       GPL     R/O      1  Extended self-test log
0x09           SL  R/W      1  Selective self-test log
0x10       GPL     R/O      1  NCQ Command Error log
0x11       GPL     R/O      1  SATA Phy Event Counters log
0x12       GPL,SL  R/O      1  SATA NCQ Non-Data log
0x21       GPL     R/O      1  Write stream error log
0x22       GPL     R/O      1  Read stream error log
0x80-0x9f  GPL,SL  R/W     16  Host vendor specific log
0xa1       GPL,SL  VS      20  Device vendor specific log
0xa2       GPL     VS    4496  Device vendor specific log
0xa8       GPL,SL  VS     129  Device vendor specific log
0xa9       GPL,SL  VS       1  Device vendor specific log
0xb0       GPL     VS    5176  Device vendor specific log
0xb6       GPL     VS    1918  Device vendor specific log
0xbd       GPL     VS     252  Device vendor specific log
0xbe-0xbf  GPL     VS   65535  Device vendor specific log
0xe0       GPL,SL  R/W      1  SCT Command/Status
0xe1       GPL,SL  R/W      1  SCT Data Transfer

SMART Extended Comprehensive Error Log Version: 1 (5 sectors)
Device Error Count: 289 (device log contains only the most recent 20 errors)
	CR     = Command Register
	FEATR  = Features Register
	COUNT  = Count (was: Sector Count) Register
	LBA_48 = Upper bytes of LBA High/Mid/Low Registers ]  ATA-8
	LH     = LBA High (was: Cylinder High) Register    ]   LBA
	LM     = LBA Mid (was: Cylinder Low) Register      ] Register
	LL     = LBA Low (was: Sector Number) Register     ]
	DV     = Device (was: Device/Head) Register
	DC     = Device Control Register
	ER     = Error register
	ST     = Status register
Powered_Up_Time is measured from power on, and printed as
DDd+hh:mm:SS.sss where DD=days, hh=hours, mm=minutes,
SS=sec, and sss=millisec. It "wraps" after 49.710 days.

Error 289 [8] occurred at disk power-on lifetime: 63598 hours (2649 days + 22 hours)
  When the command that caused the error occurred, the device was active or idle.

  After command completion occurred, registers were:
  ER -- ST COUNT  LBA_48  LH LM LL DV DC
  -- -- -- == -- == == == -- -- -- -- --
  40 -- 51 00 00 00 00 0f ff ff d8 00 00  Error: UNC at LBA = 0x0fffffd8 = 268435416

  Commands leading to the command that caused the error were:
  CR FEATR COUNT  LBA_48  LH LM LL DV DC  Powered_Up_Time  Command/Feature_Name
  -- == -- == -- == == == -- -- -- -- --  ---------------  --------------------
  60 00 00 00 08 00 00 74 70 6d a8 40 00  7d+ ...          READ FPDMA QUEUED
  60 00 00 00 08 00 00 0f ff ff d8 40 00  7d+ ...          READ FPDMA QUEUED
  60 00 00 00 08 00 00 00 00 00 08 40 00  7d+ ...          READ FPDMA QUEUED
  e5 00 00 00 00 00 00 00 00 00 00 00 00  7d+ ...          CHECK POWER MODE
  60 00 00 00 08 00 00 00 00 00 00 40 00  7d+ ...          READ FPDMA QUEUED

Error 288 [7] occurred at disk power-on lifetime: 63598 hours (2649 days + 22 hours)
  When the command that caused the error occurred, the device was active or idle.

  After command completion occurred, registers were:
  ER -- ST COUNT  LBA_48  LH LM LL DV DC
  -- -- -- == -- == == == -- -- -- -- --
  40 -- 51 00 00 00 00 0f ff ff c8 00 00  Error: UNC at LBA = 0x0fffffc8 = 268435400

  Commands leading to the command that caused the error were:
  CR FEATR COUNT  LBA_48  LH LM LL DV DC  Powered_Up_Time  Command/Feature_Name
  -- == -- == -- == == == -- -- -- -- --  ---------------  --------------------
  60 00 00 00 08 00 00 0f ff ff c8 40 00  7d+ ...          READ FPDMA QUEUED
  60 00 00 00 08 00 00 00 00 00 00 40 00  7d+ ...          READ FPDMA QUEUED
  2f 00 00 00 01 00 00 00 00 00 10 00 00  7d+ ...          READ LOG EXT
  60 00 00 00 08 00 00 00 00 00 00 40 00  7d+ ...          READ FPDMA QUEUED
  60 00 00 00 c0 00 00 0f ff ff c8 40 00  7d+ ...          READ FPDMA QUEUED

Error 287 [6] occurred at disk power-on lifetime: 63598 hours (2649 days + 22 hours)
  When the command that caused the error occurred, the device was active or idle.

  After command completion occurred, registers were:
  ER -- ST COUNT  LBA_48  LH LM LL DV DC
  -- -- -- == -- == == == -- -- -- -- --
  40 -- 51 00 00 00 00 0f ff ff c8 00 00  Error: UNC at LBA = 0x0fffffc8 = 268435400

  Commands leading to the command that caused the error were:
  CR FEATR COUNT  LBA_48  LH LM LL DV DC  Powered_Up_Time  Command/Feature_Name
  -- == -- == -- == == == -- -- -- -- --  ---------------  --------------------
  60 00 00 00 08 00 00 00 00 00 00 40 00  7d+ ...          READ FPDMA QUEUED
  60 00 00 00 c0 00 00 0f ff ff c8 40 00  7d+ ...          READ FPDMA QUEUED
  60 00 00 00 08 00 00 74 70 6d a0 40 00  7d+ ...          READ FPDMA QUEUED
  2f 00 00 00 01 00 00 00 00 00 10 00 00  7d+ ...          READ LOG EXT
  60 00 00 00 08 00 00 74 70 6d a0 40 00  7d+ ...          READ FPDMA QUEUED

Error 286 [5] occurred at disk power-on lifetime: 63598 hours (2649 days + 22 hours)
  When the command that caused the error occurred, the device was active or idle.

  After command completion occurred, registers were:
  ER -- ST COUNT  LBA_48  LH LM LL DV DC
  -- -- -- == -- == == == -- -- -- -- --
  40 -- 51 00 00 00 00 0f ff ff b8 00 00  Error: UNC at LBA = 0x0fffffb8 = 268435384

  Commands leading to the command that caused the error were:
  CR FEATR COUNT  LBA_48  LH LM LL DV DC  Powered_Up_Time  Command/Feature_Name
  -- == -- == -- == == == -- -- -- -- --  ---------------  --------------------
  60 00 00 00 08 00 00 74 70 6d a0 40 00  7d+ ...          READ FPDMA QUEUED
  60 00 00 00 08 00 00 0f ff ff b8 40 00  7d+ ...          READ FPDMA QUEUED
  60 00 00 00 08 00 00 74 70 6d 00 40 00  7d+ ...          READ FPDMA QUEUED
  e5 00 00 00 00 00 00 00 00 00 00 00 00  7d+ ...          CHECK POWER MODE
  ec 00 00 00 01 00 00 00 00 00 00 00 00  7d+ ...          IDENTIFY DEVICE

Error 285 [4] occurred at disk power-on lifetime: 63598 hours (2649 days + 22 hours)
  When the command that caused the error occurred, the device was active or idle.

  After command completion occurred, registers were:
  ER -- ST COUNT  LBA_48  LH LM LL DV DC
  -- -- -- == -- == == == -- -- -- -- --
  40 -- 51 00 00 00 00 0f ff ff b8 00 00  Error: UNC at LBA = 0x0fffffb8 = 268435384

  Commands leading to the command that caused the error were:
  CR FEATR COUNT  LBA_48  LH LM LL DV DC  Powered_Up_Time  Command/Feature_Name
  -- == -- == -- == == == -- -- -- -- --  ---------------  --------------------
  60 00 00 00 10 00 00 0f ff ff b8 40 00  7d+ ...          READ FPDMA QUEUED
  e5 00 00 00 00 00 00 00 00 00 00 00 00  7d+ ...          CHECK POWER MODE
  ef 00 10 00 02 00 00 00 00 00 00 00 00  7d+ ...          SET FEATURES [Enable SATA feature]
  ef 00 aa 00 00 00 00 00 00 00 00 00 00  7d+ ...          SET FEATURES [Enable read look-ahead]
  ef 00 03 00 46 00 00 00 00 00 00 00 00  7d+ ...          SET FEATURES [Set transfer mode]

Error 284 [3] occurred at disk power-on lifetime: 63598 hours (2649 days + 22 hours)
  When the command that caused the error occurred, the device was active or idle.

  After command completion occurred, registers were:
  ER -- ST COUNT  LBA_48  LH LM LL DV DC
  -- -- -- == -- == == == -- -- -- -- --
  40 -- 51 00 00 00 00 0f ff ff b0 00 00  Error: UNC at LBA = 0x0fffffb0 = 268435376

  Commands leading to the command that caused the error were:
  CR FEATR COUNT  LBA_48  LH LM LL DV DC  Powered_Up_Time  Command/Feature_Name
  -- == -- == -- == == == -- -- -- -- --  ---------------  --------------------
  60 00 00 00 08 00 00 0f ff ff b0 40 00  7d+ ...          READ FPDMA QUEUED
  e5 00 00 00 00 00 00 00 00 00 00 00 00  7d+ ...          CHECK POWER MODE
  ef 00 10 00 02 00 00 00 00 00 00 00 00  7d+ ...          SET FEATURES [Enable SATA feature]
  ef 00 aa 00 00 00 00 00 00 00 00 00 00  7d+ ...          SET FEATURES [Enable read look-ahead]
  ef 00 03 00 46 00 00 00 00 00 00 00 00  7d+ ...          SET FEATURES [Set transfer mode]

Error 283 [2] occurred at disk power-on lifetime: 63598 hours (2649 days + 22 hours)
  When the command that caused the error occurred, the device was active or idle.

  After command completion occurred, registers were:
  ER -- ST COUNT  LBA_48  LH LM LL DV DC
  -- -- -- == -- == == == -- -- -- -- --
  40 -- 51 00 00 00 00 0f ff ff b0 00 00  Error: UNC at LBA = 0x0fffffb0 = 268435376

  Commands leading to the command that caused the error were:
  CR FEATR COUNT  LBA_48  LH LM LL DV DC  Powered_Up_Time  Command/Feature_Name
  -- == -- == -- == == == -- -- -- -- --  ---------------  --------------------
  60 00 00 01 00 00 00 00 00 08 00 40 00  7d+ ...          READ FPDMA QUEUED
  60 00 00 00 08 00 00 0f ff ff b0 40 00  7d+ ...          READ FPDMA QUEUED
  e5 00 00 00 00 00 00 00 00 00 00 00 00  7d+ ...          CHECK POWER MODE
  e5 00 00 00 00 00 00 00 00 00 00 00 00  7d+ ...          CHECK POWER MODE
  e5 00 00 00 00 00 00 00 00 00 00 00 00  7d+ ...          CHECK POWER MODE

Error 282 [1] occurred at disk power-on lifetime: 63598 hours (2649 days + 22 hours)
  When the command that caused the error occurred, the device was active or idle.

  After command completion occurred, registers were:
  ER -- ST COUNT  LBA_48  LH LM LL DV DC
  -- -- -- == -- == == == -- -- -- -- --
  40 -- 51 00 00 00 00 0f ff ff b0 00 00  Error: UNC at LBA = 0x0fffffb0 = 268435376

  Commands leading to the command that caused the error were:
  CR FEATR COUNT  LBA_48  LH LM LL DV DC  Powered_Up_Time  Command/Feature_Name
  -- == -- == -- == == == -- -- -- -- --  ---------------  --------------------
  60 00 00 00 08 00 00 0f ff ff b0 40 00  7d+ ...          READ FPDMA QUEUED
  e5 00 00 00 00 00 00 00 00 00 00 00 00  7d+ ...          CHECK POWER MODE
  60 00 00 00 08 00 00 74 70 69 d0 40 00  7d+ ...          READ FPDMA QUEUED
  e5 00 00 00 00 00 00 00 00 00 00 00 00  7d+ ...          CHECK POWER MODE
  60 00 00 00 08 00 00 74 70 69 e0 40 00  7d+ ...          READ FPDMA QUEUED

SMART Extended Self-test Log Version: 1 (1 sectors)
Num  Test_Description    Status                  Remaining  LifeTime(hours)  LBA_of_first_error
# 1  Short offline       Completed without error       00%     15690         -

SMART Selective self-test log data structure revision number 1
 SPAN  MIN_LBA  MAX_LBA  CURRENT_TEST_STATUS
    1        0        0  Not_testing
    2        0        0  Not_testing
    3        0        0  Not_testing
    4        0        0  Not_testing
    5        0        0  Not_testing
Selective self-test flags (0x0):
  After scanning selected spans, do NOT read-scan remainder of disk.
If Selective self-test is pending on power-up, resume after 0 minute delay.

SCT Status Version:                  3
SCT Version (vendor specific):       522 (0x020a)
Device State:                        Active (0)
Current Temperature:                    27 Celsius
Power Cycle Min/Max Temperature:     25/27 Celsius
Lifetime    Min/Max Temperature:     17/51 Celsius
Specified Max Operating Temperature:    60 Celsius
Under/Over Temperature Limit Count:   0/34

SCT Temperature History Version:     2
Temperature Sampling Period:         1 minute
Temperature Logging Interval:        10 minutes
Min/Max recommended Temperature:      0/ 0 Celsius
Min/Max Temperature Limit:            0/ 0 Celsius
Temperature History Size (Index):    128 (15)

SCT Error Recovery Control:
           Read:    100 (10.0 seconds)
          Write:    100 (10.0 seconds)

Device Statistics (GP Log 0x04)
Page  Offset Size        Value Flags Description
0x01  =====  =               =  ===  == General Statistics (rev 2) ==
0x01  0x008  4             374  ---  Lifetime Power-On Resets
0x01  0x010  4           73270  ---  Power-on Hours
0x01  0x018  6     12531020345  ---  Logical Sectors Written
0x01  0x020  6       127432626  ---  Number of Write Commands
0x01  0x028  6      4606103382  ---  Logical Sectors Read
0x01  0x030  6       149515873  ---  Number of Read Commands
0x03  =====  =               =  ===  == Rotating Media Statistics (rev 1) ==
0x03  0x008  4           67423  ---  Spindle Motor Power-on Hours
0x03  0x010  4           67423  ---  Head Flying Hours
0x03  0x018  4            2657  ---  Head Load Events
0x03  0x020  4            4095  ---  Number of Reallocated Logical Sectors
0x03  0x028  4             236  ---  Read Recovery Attempts
0x03  0x030  4               3  ---  Number of Mechanical Start Failures
0x04  =====  =               =  ===  == General Errors Statistics (rev 1) ==
0x04  0x008  4             243  ---  Number of Reported Uncorrectable Errors
0x04  0x010  4               0  ---  Resets Between Cmd Acceptance and Completion
                                |||_ C monitored condition met
                                ||__ D supports DSN
                                |___ N normalized value

SATA Phy Event Counters (GP Log 0x11)
ID      Size     Value  Description
0x000a  2            3  Device-to-host register FISes sent due to a COMRESET
0x0001  2            0  Command failed due to ICRC error
0x0003  2            0  R_ERR response for device-to-host data FIS
0x0004  2            0  R_ERR response for host-to-device data FIS
0x0006  2            0  R_ERR response for device-to-host non-data FIS
0x0007  2            0  R_ERR response for host-to-device non-data FIS

