smartctl 7.1 2020-06-20 r5066 [x86_64-linux-3.10.0-1160...] (local build)
Copyright (C) 2002-19, Bruce Allen, Christian Franke, www.smartmontools.org

=== START OF INFORMATION SECTION ===
Model Number:                       INTEL SSDPE2KX080T8
Serial Number:                      --
Firmware Version:                   VDV10152
PCI Vendor/Subsystem ID:            0x8086
IEEE OUI Identifier:                0x5cd2e4
Total NVM Capacity:                 8,001,563,222,016 [8.00 TB]
Unallocated NVM Capacity:           0
Controller ID:                      0
Number of Namespaces:               128
Namespace 1 Size/Capacity:          8,001,563,222,016 [8.00 TB]
Namespace 1 Formatted LBA Size:     512
Namespace 1 IEEE EUI-64:            5cd2e4 ...
Local Time is:                      --

=== START OF READ SMART DATA SECTION ===
SMART overall-health self-assessment test result: PASSED

SMART/Health Information (NVMe Log 0x02)
Critical Warning:                   0x00
Temperature:                        29 Celsius
Available Spare:                    99%
Available Spare Threshold:          10%
Percentage Used:                    4%
Data Units Read:                    2,156,262,113 [1.10 PB]
Data Units Written:                 2,684,039,343 [1.37 PB]
Host Read Commands:                 17,781,137,546
Host Write Commands:                37,967,458,409
Controller Busy Time:               10,059
Power Cycles:                       56
Power On Hours:                     25,090
Unsafe Shutdowns:                   54
Media and Data Integrity Errors:    0
Error Information Log Entries:      0
Warning  Comp. Temperature Time:    0
Critical Comp. Temperature Time:    0

