smartctl 7.1 2020-06-20 r5066 [x86_64-linux-3.10.0-1160...] (local build)
Copyright (C) 2002-19, Bruce Allen, Christian Franke, www.smartmontools.org

=== START OF INFORMATION SECTION ===
Model Number:                       SAMSUNG MZQL2960HCJR-00A07
Serial Number:                      --
Firmware Version:                   GDC5602Q
PCI Vendor/Subsystem ID:            0x144d
IEEE OUI Identifier:                0x002538
Total NVM Capacity:                 960,197,124,096 [960 GB]
Unallocated NVM Capacity:           0
Controller ID:                      6
Number of Namespaces:               32
Namespace 1 Size/Capacity:          960,197,124,096 [960 GB]
Namespace 1 Utilization:            224,324,497,408 [224 GB]
Namespace 1 Formatted LBA Size:     512
Local Time is:                      Tue Apr ... 2023 UTC

=== START OF READ SMART DATA SECTION ===
SMART overall-health self-assessment test result: PASSED

SMART/Health Information (NVMe Log 0x02)
Critical Warning:                   0x00
Temperature:                        28 Celsius
Available Spare:                    100%
Available Spare Threshold:          10%
Percentage Used:                    0%
Data Units Read:                    28,827,156 [14.7 TB]
Data Units Written:                 10,407,873 [5.32 TB]
Host Read Commands:                 62,681,154
Host Write Commands:                298,133,248
Controller Busy Time:               138
Power Cycles:                       15
Power On Hours:                     3,366
Unsafe Shutdowns:                   13
Media and Data Integrity Errors:    0
Error Information Log Entries:      0
Warning  Comp. Temperature Time:    0
Critical Comp. Temperature Time:    0
Temperature Sensor 1:               28 Celsius
Temperature Sensor 2:               36 Celsius

