smartctl 6.6 2017-11-05 r4594 [x86_64-linux-3.10.0-957...] (local build)
Copyright (C) 2002-17, Bruce Allen, Christian Franke, www.smartmontools.org

=== START OF INFORMATION SECTION ===
Model Family:     Seagate Barracuda 7200.14 (AF)
Device Model:     ST250DM000-1BD141
Serial Number:    --
LU WWN Device Id: 5 000c50 ...
Firmware Version: KC45
User Capacity:    250,059,350,016 bytes [250 GB]
Sector Sizes:     512 bytes logical, 4096 bytes physical
Rotation Rate:    7200 rpm
Device is:        In smartctl database [for details use: -P show]
ATA Version is:   ATA8-ACS T13/1699-D revision 4
SATA Version is:  SATA 3.0, 6.0 Gb/s (current: 3.0 Gb/s)
Local Time is:    --

=== START OF READ SMART DATA SECTION ===
SMART overall-health self-assessment test result: PASSED

SMART Attributes Data Structure revision number: 10
Vendor Specific SMART Attributes with Thresholds:
ID# ATTRIBUTE_NAME          FLAGS    VALUE WORST THRESH FAIL RAW_VALUE
  1 Raw_Read_Error_Rate     POSR--   108   099   006    -    17433192
  3 Spin_Up_Time            PO----   100   100   000    -    0
  4 Start_Stop_Count        -O--CK   100   100   020    -    933
  5 Reallocated_Sector_Ct   PO--CK   100   100   036    -    0
  7 Seek_Error_Rate         POSR--   088   060   030    -    729795777
  9 Power_On_Hours          -O--CK   070   070   000    -    26349
 10 Spin_Retry_Count        PO--C-   100   100   097    -    0
 12 Power_Cycle_Count       -O--CK   100   100   020    -    932
183 Runtime_Bad_Block       -O--CK   100   100   000    -    0
184 End-to-End_Error        -O--CK   100   100   099    -    0
187 Reported_Uncorrect      -O--CK   098   098   000    -    2
188 Command_Timeout         -O--CK   100   099   000    -    0 0 37
189 High_Fly_Writes         -O-RCK   100   100   000    -    0
190 Airflow_Temperature_Cel -O---K   067   050   045    -    33 (Min/Max 31/50)
194 Temperature_Celsius     -O---K   033   050   000    -    33 (0 9 0 0 0)
195 Hardware_ECC_Recovered  -O-RC-   029   029   000    -    17433192
197 Current_Pending_Sector  -O--C-   100   100   000    -    8
198 Offline_Uncorrectable   ----C-   100   100   000    -    8
199 UDMA_CRC_Error_Count    -OSRCK   200   200   000    -    0
240 Head_Flying_Hours       ------   100   253   000    -    26339h+04m+08.297s
241 Total_LBAs_Written      ------   100   253   000    -    140964448
242 Total_LBAs_Read         ------   100   253   000    -    3159377283
                            ||||||_ K auto-keep
                            |||||__ C event count
                            ||||___ R error rate
                            |||____ S speed/performance
                            ||_____ O updated online
                            |______ P prefailure warning

SMART Extended Comprehensive Error Log Version: 1 (5 sectors)
Device Error Count: 2

Current Temperature:                    33 Celsius

