smartctl 7.1 2020-06-20 r5066 [x86_64-linux-3.10.0-1160...] (local build)
Copyright (C) 2002-19, Bruce Allen, Christian Franke, www.smartmontools.org

=== START OF INFORMATION SECTION ===
Model Number:                       Micron_7400_MTFDKCB1T9TDZ
Serial Number:                      --
Firmware Version:                   E1MU23BC
PCI Vendor/Subsystem ID:            0x1344
IEEE OUI Identifier:                0x00a075
Total NVM Capacity:                 1,920,383,410,176 [1.92 TB]
Unallocated NVM Capacity:           0
Controller ID:                      0
Number of Namespaces:               128
Namespace 1 Size/Capacity:          1,920,383,410,176 [1.92 TB]
Namespace 1 Utilization:            137,786,245,120 [137 GB]
Namespace 1 Formatted LBA Size:     512
Namespace 1 IEEE EUI-64:            00a075 ...
Local Time is:                      Mon Apr ... 2022 CDT

=== START OF READ SMART DATA SECTION ===
SMART overall-health self-assessment test result: PASSED

SMART/Health Information (NVMe Log 0x02)
Critical Warning:                   0x00
Temperature:                        28 Celsius
Available Spare:                    100%
Available Spare Threshold:          10%
Percentage Used:                    0%
Data Units Read:                    681 [348 MB]
Data Units Written:                 1,092,589 [559 GB]
Host Read Commands:                 15,036
Host Write Commands:                51,009,724
Controller Busy Time:               6
Power Cycles:                       7
Power On Hours:                     1,439
Unsafe Shutdowns:                   5
Media and Data Integrity Errors:    0
Error Information Log Entries:      0
Warning  Comp. Temperature Time:    0
Critical Comp. Temperature Time:    0
Temperature Sensor 1:               35 Celsius
Temperature Sensor 2:               30 Celsius
Temperature Sensor 3:               28 Celsius

