smartctl 7.1 2020-06-20 r5066 [x86_64-linux-3.10.0-1127...] (local build)
Copyright (C) 2002-19, Bruce Allen, Christian Franke, www.smartmontools.org

=== START OF INFORMATION SECTION ===
Model Family:     Seagate Barracuda 7200.14 (AF)
Device Model:     ST1000DM003-1SB102
Serial Number:    --
LU WWN Device Id: 5 000c50 ...
Firmware Version: CC43
User Capacity:    1,000,204,886,016 bytes [1.00 TB]
Sector Sizes:     512 bytes logical, 4096 bytes physical
Rotation Rate:    7200 rpm
Form Factor:      3.5 inches
Device is:        In smartctl database [for details use: -P show]
ATA Version is:   ATA8-ACS T13/1699-D revision 4
SATA Version is:  SATA 3.0, 6.0 Gb/s (current: 6.0 Gb/s)
Local Time is:    Thu Aug ... 2021 -03
APM level is:     128 (minimum power consumption without standby)
Rd look-ahead is: Enabled
Write cache is:   Enabled
ATA Security is:  Disabled, frozen [SEC2]

=== START OF READ SMART DATA SECTION ===
SMART overall-health self-assessment test result: PASSED

General SMART Values:
Offline data collection status:  (0x00)	Offline data collection activity
					was never started.

Self-test execution status:      (   0)	The previous self-test routine completed
					without error or no self-test has ever 
					been run.
Total time to complete Offline 
data collection: 		(    0) seconds.
Offline data collection
capabilities: 			 (0x73) SMART execute Offline immediate.

					Suspend Offline collection upon new
					command.
					No Offline surface scan supported.
					Self-test supported.
					Conveyance Self-test supported.
					Selective Self-test supported.
SMART capabilities:            (0x0003)	Saves SMART data before entering
					power-saving mode.

Error logging capability:        (0x01)	Error logging supported.
					General Purpose Logging supported.
Short self-test routine 
recommended polling time: 	 (   1) minutes.
Extended self-test routine
recommended polling time: 	 ( 103) minutes.
Conveyance self-test routine
recommended polling time: 	 (   2) minutes.
SCT capabilities: 	       (0x1085)	SCT Status supported.

SMART Attributes Data Structure revision number: 10
Vendor Specific SMART Attributes with Thresholds:
ID# ATTRIBUTE_NAME          FLAGS    VALUE WORST THRESH FAIL RAW_VALUE
  1 Raw_Read_Error_Rate     POSR--   076   063   006    -    44185586
  3 Spin_Up_Time            PO----   098   097   000    -    0
  4 Start_Stop_Count        -O--CK   100   100   020    -    38
  5 Reallocated_Sector_Ct   PO--CK   100   100   010    -    64
  7 Seek_Error_Rate         POSR--   073   060   045    -    21934359
  9 Power_On_Hours          -O--CK   066   066   000    -    30433
 10 Spin_Retry_Count        PO--C-   100   100   097    -    0
 12 Power_Cycle_Count       -O--CK   100   100   020    -    100
183 Runtime_Bad_Block       -O--CK   100   100   000    -    0
184 End-to-End_Error        -O--CK   100   100   099    -    0
187 Reported_Uncorrect      -O--CK   042   042   000    -    58
188 Command_Timeout         -O--CK   100   100   000    -    0 0 0
189 High_Fly_Writes         -O-RCK   100   100   000    -    0
190 Airflow_Temperature_Cel -O---K   056   056   040    -    44 (Min/Max 25/44)
193 Load_Cycle_Count        -O--CK   100   100   000    -    574
194 Temperature_Celsius     -O---K   044   019   000    -    44 (0 19 0 0 0)
195 Hardware_ECC_Recovered  -O-RC-   023   001   000    -    44185586
197 Current_Pending_Sector  -O--C-   100   100   000    -    0
198 Offline_Uncorrectable   ----C-   100   100   000    -    0
199 UDMA_CRC_Error_Count    -OSRCK   200   200   000    -    0
240 Head_Flying_Hours       ------   100   253   000    -    3276h+54m+12.512s
241 Total_LBAs_Written      ------   100   253   000    -    6901971090
242 Total_LBAs_Read         ------   100   253   000    -    4028614075
                            ||||||_ K auto-keep
                            |||||__ C event count
                            ||||___ R error rate
                            |||____ S speed/performance
                            ||_____ O updated online
                            |______ P prefailure warning

General Purpose Log Directory Version 1
SMART           Log Directory Version 1 [multi-sector log support]
Address    Access  R/W   Size  Description
0x00       GPL,SL  R/O      1  Log Directory
0x01           SL  R/O      1  Summary SMART error log
0x02           SL  R/O      5  Comprehensive SMART error log
0x03       GPL     R/O      5  Ext. Comprehensive SMART error log
0x04       GPL,SL  R/O      8  Device Statistics log
0x06           SL  R/O      1  SMART self-test log
0x07       GPL     R/O      1  Extended self-test log
0x09           SL  R/W      1  Selective self-test log
0x10       GPL     R/O      1  NCQ Command Error log
0x11       GPL     R/O      1  SATA Phy Event Counters log
0x21       GPL     R/O      1  Write stream error log
0x22       GPL     R/O      1  Read stream error log
0x24       GPL     R/O    512  Current Device Internal Status Data log
0x30       GPL,SL  R/O      9  IDENTIFY DEVICE data log
0x80-0x9f  GPL,SL  R/W     16  Host vendor specific log
0xa1       GPL,SL  VS      20  Device vendor specific log
0xa2       GPL     VS    4120  Device vendor specific log
0xa8       GPL,SL  VS     129  Device vendor specific log
0xa9       GPL,SL  VS       1  Device vendor specific log
0xab       GPL     VS       1  Device vendor specific log
0xb0       GPL     VS    4800  Device vendor specific log
0xbe-0xbf  GPL     VS   65535  Device vendor specific log
0xc0       GPL,SL  VS       1  Device vendor specific log
0xc1       GPL,SL  VS      10  Device vendor specific log
0xe0       GPL,SL  R/W      1  SCT Command/Status
0xe1       GPL,SL  R/W      1  SCT Data Transfer

SMART Extended Comprehensive Error Log Version: 1 (5 sectors)
Device Error Count: 58 (device log contains only the most recent 20 errors)
	CR     = Command Register
	FEATR  = Features Register
	COUNT  = Count (was: Sector Count) Register
	LBA_48 = Upper bytes of LBA High/Mid/Low Registers ]  ATA-8
	LH     = LBA High (was: Cylinder High) Register    ]   LBA
	LM     = LBA Mid (was: Cylinder Low) Register      ] Register
	LL     = LBA Low (was: Sector Number) Register     ]
	DV     = Device (was: Device/Head) Register
	DC     = Device Control Register
	ER     = Error register
	ST     = Status register
Powered_Up_Time is measured from power on, and printed as
DDd+hh:mm:SS.sss where DD=days, hh=hours, mm=minutes,
SS=sec, and sss=millisec. It "wraps" after 49.710 days.

Error 58 [17] occurred at disk power-on lifetime: 321 hours (13 days + 9 hours)
  When the command that caused the error occurred, the device was active or idle.

  After command completion occurred, registers were:
  ER -- ST COUNT  LBA_48  LH LM LL DV DC
  -- -- -- == -- == == == -- -- -- -- --
  40 -- 51 00 00 00 00 14 e9 40 5f 00 00  Error: UNC at LBA = 0x14e9405f = 350830687

  Commands leading to the command that caused the error were:
  CR FEATR COUNT  LBA_48  LH LM LL DV DC  Powered_Up_Time  Command/Feature_Name
  -- == -- == -- == == == -- -- -- -- --  ---------------  --------------------
  25 00 00 00 01 00 00 14 e9 40 5f e0 00  4d+ ...          READ DMA EXT
  25 00 00 00 01 00 00 14 e9 40 5e e0 00  4d+ ...          READ DMA EXT
  35 00 00 00 01 00 00 14 e9 40 5e e0 00  4d+ ...          WRITE DMA EXT
  35 00 00 00 08 00 00 40 f0 9c 60 e0 00  4d+ ...          WRITE DMA EXT
  25 00 00 00 01 00 00 14 e9 40 5e e0 00  4d+ ...          READ DMA EXT

Error 57 [16] occurred at disk power-on lifetime: 321 hours (13 days + 9 hours)
  When the command that caused the error occurred, the device was active or idle.

  After command completion occurred, registers were:
  ER -- ST COUNT  LBA_48  LH LM LL DV DC
  -- -- -- == -- == == == -- -- -- -- --
  40 -- 51 00 00 00 00 14 e9 40 5e 00 00  Error: UNC at LBA = 0x14e9405e = 350830686

  Commands leading to the command that caused the error were:
  CR FEATR COUNT  LBA_48  LH LM LL DV DC  Powered_Up_Time  Command/Feature_Name
  -- == -- == -- == == == -- -- -- -- --  ---------------  --------------------
  25 00 00 00 01 00 00 14 e9 40 5e e0 00  4d+ ...          READ DMA EXT
  35 00 00 00 20 00 00 42 27 70 20 e0 00  4d+ ...          WRITE DMA EXT
  25 00 00 00 01 00 00 14 e9 40 5d e0 00  4d+ ...          READ DMA EXT
  35 00 00 00 20 00 00 42 27 ea 40 e0 00  4d+ ...          WRITE DMA EXT
  35 00 00 00 01 00 00 14 e9 40 5d e0 00  4d+ ...          WRITE DMA EXT

Error 56 [15] occurred at disk power-on lifetime: 321 hours (13 days + 9 hours)
  When the command that caused the error occurred, the device was active or idle.

  After command completion occurred, registers were:
  ER -- ST COUNT  LBA_48  LH LM LL DV DC
  -- -- -- == -- == == == -- -- -- -- --
  40 -- 51 00 00 00 00 14 e9 40 5d 00 00  Error: UNC at LBA = 0x14e9405d = 350830685

  Commands leading to the command that caused the error were:
  CR FEATR COUNT  LBA_48  LH LM LL DV DC  Powered_Up_Time  Command/Feature_Name
  -- == -- == -- == == == -- -- -- -- --  ---------------  --------------------
  25 00 00 00 01 00 00 14 e9 40 5d e0 00  4d+ ...          READ DMA EXT
  35 00 00 00 08 00 00 40 f0 98 08 e0 00  4d+ ...          WRITE DMA EXT
  25 00 00 00 01 00 00 14 e9 40 5c e0 00  4d+ ...          READ DMA EXT
  35 00 00 00 20 00 00 42 27 70 20 e0 00  4d+ ...          WRITE DMA EXT
  35 00 00 00 01 00 00 14 e9 40 5c e0 00  4d+ ...          WRITE DMA EXT

Error 55 [14] occurred at disk power-on lifetime: 321 hours (13 days + 9 hours)
  When the command that caused the error occurred, the device was active or idle.

  After command completion occurred, registers were:
  ER -- ST COUNT  LBA_48  LH LM LL DV DC
  -- -- -- == -- == == == -- -- -- -- --
  40 -- 51 00 00 00 00 14 e9 40 5c 00 00  Error: UNC at LBA = 0x14e9405c = 350830684

  Commands leading to the command that caused the error were:
  CR FEATR COUNT  LBA_48  LH LM LL DV DC  Powered_Up_Time  Command/Feature_Name
  -- == -- == -- == == == -- -- -- -- --  ---------------  --------------------
  25 00 00 00 01 00 00 14 e9 40 5c e0 00  4d+ ...          READ DMA EXT
  25 00 00 00 20 00 00 40 f0 98 00 e0 00  4d+ ...          READ DMA EXT
  25 00 00 00 01 00 00 14 e9 40 5b e0 00  4d+ ...          READ DMA EXT
  35 00 00 00 08 00 00 40 f0 90 50 e0 00  4d+ ...          WRITE DMA EXT
  35 00 00 00 01 00 00 14 e9 40 5b e0 00  4d+ ...          WRITE DMA EXT

Error 54 [13] occurred at disk power-on lifetime: 321 hours (13 days + 9 hours)
  When the command that caused the error occurred, the device was active or idle.

  After command completion occurred, registers were:
  ER -- ST COUNT  LBA_48  LH LM LL DV DC
  -- -- -- == -- == == == -- -- -- -- --
  40 -- 51 00 00 00 00 14 e9 40 5b 00 00  Error: UNC at LBA = 0x14e9405b = 350830683

  Commands leading to the command that caused the error were:
  CR FEATR COUNT  LBA_48  LH LM LL DV DC  Powered_Up_Time  Command/Feature_Name
  -- == -- == -- == == == -- -- -- -- --  ---------------  --------------------
  25 00 00 00 01 00 00 14 e9 40 5b e0 00  4d+ ...          READ DMA EXT
  35 00 00 00 20 00 00 42 27 ea 00 e0 00  4d+ ...          WRITE DMA EXT
  25 00 00 00 01 00 00 14 e9 40 5a e0 00  4d+ ...          READ DMA EXT
  35 00 00 00 08 00 00 00 66 e0 28 e0 00  4d+ ...          WRITE DMA EXT
  25 00 00 00 20 00 00 40 f0 90 40 e0 00  4d+ ...          READ DMA EXT

Error 53 [12] occurred at disk power-on lifetime: 321 hours (13 days + 9 hours)
  When the command that caused the error occurred, the device was active or idle.

  After command completion occurred, registers were:
  ER -- ST COUNT  LBA_48  LH LM LL DV DC
  -- -- -- == -- == == == -- -- -- -- --
  40 -- 51 00 00 00 00 14 e9 40 5a 00 00  Error: UNC at LBA = 0x14e9405a = 350830682

  Commands leading to the command that caused the error were:
  CR FEATR COUNT  LBA_48  LH LM LL DV DC  Powered_Up_Time  Command/Feature_Name
  -- == -- == -- == == == -- -- -- -- --  ---------------  --------------------
  25 00 00 00 01 00 00 14 e9 40 5a e0 00  4d+ ...          READ DMA EXT
  35 00 00 00 20 00 00 06 20 00 20 e0 00  4d+ ...          WRITE DMA EXT
  35 00 00 00 20 00 00 42 27 70 20 e0 00  4d+ ...          WRITE DMA EXT
  25 00 00 00 01 00 00 14 e9 40 59 e0 00  4d+ ...          READ DMA EXT
  35 00 00 00 60 00 00 06 20 3a 40 e0 00  4d+ ...          WRITE DMA EXT

Error 52 [11] occurred at disk power-on lifetime: 321 hours (13 days + 9 hours)
  When the command that caused the error occurred, the device was active or idle.

  After command completion occurred, registers were:
  ER -- ST COUNT  LBA_48  LH LM LL DV DC
  -- -- -- == -- == == == -- -- -- -- --
  40 -- 51 00 00 00 00 14 e9 40 59 00 00  Error: UNC at LBA = 0x14e94059 = 350830681

  Commands leading to the command that caused the error were:
  CR FEATR COUNT  LBA_48  LH LM LL DV DC  Powered_Up_Time  Command/Feature_Name
  -- == -- == -- == == == -- -- -- -- --  ---------------  --------------------
  25 00 00 00 01 00 00 14 e9 40 59 e0 00  4d+ ...          READ DMA EXT
  35 00 00 00 08 00 00 11 de c9 c8 e0 00  4d+ ...          WRITE DMA EXT
  35 00 00 00 20 00 00 06 20 00 20 e0 00  4d+ ...          WRITE DMA EXT
  35 00 00 00 04 00 00 00 99 f1 20 e0 00  4d+ ...          WRITE DMA EXT
  35 00 00 00 08 00 00 00 6d 15 78 e0 00  4d+ ...          WRITE DMA EXT

Error 51 [10] occurred at disk power-on lifetime: 321 hours (13 days + 9 hours)
  When the command that caused the error occurred, the device was active or idle.

  After command completion occurred, registers were:
  ER -- ST COUNT  LBA_48  LH LM LL DV DC
  -- -- -- == -- == == == -- -- -- -- --
  40 -- 51 00 00 00 00 14 e9 40 58 00 00  Error: UNC at LBA = 0x14e94058 = 350830680

  Commands leading to the command that caused the error were:
  CR FEATR COUNT  LBA_48  LH LM LL DV DC  Powered_Up_Time  Command/Feature_Name
  -- == -- == -- == == == -- -- -- -- --  ---------------  --------------------
  25 00 00 00 01 00 00 14 e9 40 58 e0 00  4d+ ...          READ DMA EXT
  35 00 00 00 08 00 00 0c 90 37 80 e0 00  4d+ ...          WRITE DMA EXT
  35 00 00 00 a0 00 00 06 20 38 60 e0 00  4d+ ...          WRITE DMA EXT
  35 00 00 00 20 00 00 42 27 e9 80 e0 00  4d+ ...          WRITE DMA EXT
  25 00 00 00 20 00 00 40 ee 3a 00 e0 00  4d+ ...          READ DMA EXT

SMART Extended Self-test Log Version: 1 (1 sectors)
No self-tests have been logged.  [To run self-tests, use: smartctl -t]

SMART Selective self-test log data structure revision number 1
 SPAN  MIN_LBA  MAX_LBA  CURRENT_TEST_STATUS
    1        0        0  Not_testing
    2        0        0  Not_testing
    3        0        0  Not_testing
    4        0        0  Not_testing
    5        0        0  Not_testing
Selective self-test flags (0x0):
  After scanning selected spans, do NOT read-scan remainder of disk.
If Selective self-test is pending on power-up, resume after 0 minute delay.

SCT Status Version:                  3
SCT Version (vendor specific):       522 (0x020a)
Device State:                        Active (0)
Current Temperature:                    44 Celsius
Power Cycle Min/Max Temperature:     25/44 Celsius
Lifetime    Min/Max Temperature:     19/48 Celsius
Under/Over Temperature Limit Count:   0/0

Device Statistics (GP Log 0x04)
Page  Offset Size        Value Flags Description
0x01  =====  =               =  ===  == General Statistics (rev 1) ==
0x01  0x008  4             100  ---  Lifetime Power-On Resets
0x01  0x010  4           30433  ---  Power-on Hours
0x01  0x018  6     13294841430  ---  Logical Sectors Written
0x01  0x020  6       350986478  ---  Number of Write Commands
0x01  0x028  6      4029012720  ---  Logical Sectors Read
0x01  0x030  6        19781733  ---  Number of Read Commands
0x01  0x038  6               -  ---  Date and Time TimeStamp
0x03  =====  =               =  ===  == Rotating Media Statistics (rev 1) ==
0x03  0x008  4      3370291052  N--  Spindle Motor Power-on Hours
0x03  0x010  4      3370262193  N--  Head Flying Hours
0x03  0x018  4             574  ---  Head Load Events
0x03  0x020  4              64  ---  Number of Reallocated Logical Sectors
0x03  0x028  4               0  ---  Read Recovery Attempts
0x03  0x030  4               0  ---  Number of Mechanical Start Failures
0x03  0x038  4               0  ---  Number of Realloc. Candidate Logical Sectors
0x04  =====  =               =  ===  == General Errors Statistics (rev 1) ==
0x04  0x008  4              17  ---  Number of Reported Uncorrectable Errors
0x04  0x010  4               0  ---  Resets Between Cmd Acceptance and Completion
0x05  =====  =               =  ===  == Temperature Statistics (rev 1) ==
0x05  0x008  1              44  ---  Current Temperature
0x05  0x010  1              38  ---  Average Short Term Temperature
0x05  0x018  1              34  ---  Average Long Term Temperature
0x05  0x020  1              48  ---  Highest Temperature
0x05  0x028  1              25  ---  Lowest Temperature
0x05  0x030  1              47  ---  Highest Average Short Term Temperature
0x05  0x038  1              26  ---  Lowest Average Short Term Temperature
0x05  0x040  1              38  ---  Highest Average Long Term Temperature
0x05  0x048  1              27  ---  Lowest Average Long Term Temperature
0x05  0x050  4               0  ---  Time in Over-Temperature
0x05  0x058  1              55  ---  Specified Maximum Operating Temperature
0x05  0x060  4               0  ---  Time in Under-Temperature
0x05  0x068  1              13  ---  Specified Minimum Operating Temperature
                                |||_ C monitored condition met
                                ||__ D supports DSN
                                |___ N normalized value

SATA Phy Event Counters (GP Log 0x11)
ID      Size     Value  Description
0x000a  2           25  Device-to-host register FISes sent due to a COMRESET
0x0001  2            0  Command failed due to ICRC error
0x0003  2            0  R_ERR response for device-to-host data FIS
0x0004  2            0  R_ERR response for host-to-device data FIS
0x0006  2            0  R_ERR response for device-to-host non-data FIS
0x0007  2            0  R_ERR response for host-to-device non-data FIS

