smartctl 7.1 2019-12-30 r5022 [x86_64-linux-3.10.0-1127...] (local build)
Copyright (C) 2002-19, Bruce Allen, Christian Franke, www.smartmontools.org

=== START OF INFORMATION SECTION ===
Model Number:                       MT0800KEXUU
Serial Number:                      --
Firmware Version:                   4IFDHPK3
PCI Vendor ID:                      0x8086
PCI Vendor Subsystem ID:            0x1590
IEEE OUI Identifier:                0x5cd2e4
Controller ID:                      0
Number of Namespaces:               1
Namespace 1 Size/Capacity:          800,166,076,416 [800 GB]
Namespace 1 Formatted LBA Size:     512
Local Time is:                      --

=== START OF READ SMART DATA SECTION ===
SMART overall-health self-assessment test result: PASSED

SMART/Health Information (NVMe Log 0x02)
Critical Warning:                   0x00
Temperature:                        30 Celsius
Available Spare:                    100%
Available Spare Threshold:          10%
Percentage Used:                    3%
Data Units Read:                    51,740,726 [26.4 TB]
Data Units Written:                 1,562,300,412 [799 TB]
Host Read Commands:                 817,119,062
Host Write Commands:                19,001,168,441
Controller Busy Time:               16
Power Cycles:                       24
Power On Hours:                     10,520
Unsafe Shutdowns:                   0
Media and Data Integrity Errors:    0
Error Information Log Entries:      0

