smartctl 7.0 2018-12-30 r4883 [x86_64-linux-3.10.0-1160...] (local build)
Copyright (C) 2002-18, Bruce Allen, Christian Franke, www.smartmontools.org

=== START OF INFORMATION SECTION ===
Model Number:                       SAMSUNG MZVLB1T0HBLR-00000
Serial Number:                      --
Firmware Version:                   EXF7201Q
PCI Vendor/Subsystem ID:            0x144d
IEEE OUI Identifier:                0x002538
Total NVM Capacity:                 1,024,209,543,168 [1.02 TB]
Unallocated NVM Capacity:           0
Controller ID:                      4
Number of Namespaces:               1
Namespace 1 Size/Capacity:          1,024,209,543,168 [1.02 TB]
Namespace 1 Utilization:            993,893,466,112 [993 GB]
Namespace 1 Formatted LBA Size:     512
Namespace 1 IEEE EUI-64:            002538 ...
Local Time is:                      Fri Dec ... 2021 CET

=== START OF READ SMART DATA SECTION ===
SMART overall-health self-assessment test result: PASSED

SMART/Health Information (NVMe Log 0x02)
Critical Warning:                   0x00
Temperature:                        42 Celsius
Available Spare:                    100%
Available Spare Threshold:          10%
Percentage Used:                    7%
Data Units Read:                    105,074,891 [53.7 TB]
Data Units Written:                 74,196,905 [37.9 TB]
Host Read Commands:                 1,323,929,461
Host Write Commands:                2,090,711,030
Controller Busy Time:               13,416
Power Cycles:                       6
Power On Hours:                     2,538
Unsafe Shutdowns:                   1
Media and Data Integrity Errors:    0
Error Information Log Entries:      16
Warning  Comp. Temperature Time:    0
Critical Comp. Temperature Time:    0
Temperature Sensor 1:               42 Celsius
Temperature Sensor 2:               54 Celsius

