smartctl 7.1 2020-06-20 r5066 [x86_64-linux-3.10.0-1127...] (local build)
Copyright (C) 2002-19, Bruce Allen, Christian Franke, www.smartmontools.org

=== START OF INFORMATION SECTION ===
Model Number:                       SAMSUNG MZVLB1T0HBLR-00000
Serial Number:                      --
Firmware Version:                   EXF7201Q
PCI Vendor/Subsystem ID:            0x144d
IEEE OUI Identifier:                0x002538
Total NVM Capacity:                 1,024,209,543,168 [1.02 TB]
Unallocated NVM Capacity:           0
Controller ID:                      4
Number of Namespaces:               1
Namespace 1 Size/Capacity:          1,024,209,543,168 [1.02 TB]
Namespace 1 Utilization:            953,500,651,520 [953 GB]
Namespace 1 Formatted LBA Size:     512
Namespace 1 IEEE EUI-64:            002538 ...
Local Time is:                      --

=== START OF READ SMART DATA SECTION ===
SMART overall-health self-assessment test result: PASSED

SMART/Health Information (NVMe Log 0x02)
Critical Warning:                   0x00
Temperature:                        46 Celsius
Available Spare:                    100%
Available Spare Threshold:          10%
Percentage Used:                    10%
Data Units Read:                    13,331,408 [6.82 TB]
Data Units Written:                 88,336,036 [45.2 TB]
Host Read Commands:                 639,126,565
Host Write Commands:                4,506,537,852
Controller Busy Time:               50,566
Power Cycles:                       4
Power On Hours:                     7,588
Unsafe Shutdowns:                   0
Media and Data Integrity Errors:    0
Error Information Log Entries:      0
Warning  Comp. Temperature Time:    0
Critical Comp. Temperature Time:    0
Temperature Sensor 1:               46 Celsius
Temperature Sensor 2:               65 Celsius

