smartctl 6.6 2017-11-05 r4594 [x86_64-linux-3.10.0-862...] (local build)
Copyright (C) 2002-17, Bruce Allen, Christian Franke, www.smartmontools.org

=== START OF INFORMATION SECTION ===
Device Model:     XA1920LE10063
Serial Number:    --
LU WWN Device Id: 5 000c50 ...
Firmware Version: SF4400ZU
User Capacity:    1,920,383,410,176 bytes [1.92 TB]
Sector Sizes:     512 bytes logical, 4096 bytes physical
Rotation Rate:    Solid State Device
Device is:        Not in smartctl database [for details use: -P showall]
ATA Version is:   ACS-4, ACS-2 T13/2015-D revision 3
SATA Version is:  SATA 3.3, 6.0 Gb/s (current: 6.0 Gb/s)
Local Time is:    --

=== START OF READ SMART DATA SECTION ===
SMART overall-health self-assessment test result: PASSED

SMART Attributes Data Structure revision number: 10
Vendor Specific SMART Attributes with Thresholds:
ID# ATTRIBUTE_NAME          FLAGS    VALUE WORST THRESH FAIL RAW_VALUE
  1 Raw_Read_Error_Rate     POSR-K   100   100   090    -    67
  5 Reallocated_Sector_Ct   -O--CK   100   100   000    -    0
  9 Power_On_Hours          -O--CK   100   100   000    -    2618
 12 Power_Cycle_Count       -O--CK   100   100   000    -    4
100 Unknown_Attribute       -O--CK   100   100   000    -    29432
102 Unknown_Attribute       -O--CK   100   100   000    -    0
103 Unknown_Attribute       -O--CK   100   100   000    -    0
170 Unknown_Attribute       -O--CK   100   100   000    -    0
171 Unknown_Attribute       -O--CK   100   100   000    -    0
172 Unknown_Attribute       -O--CK   100   100   000    -    0
173 Unknown_Attribute       -O--CK   100   100   000    -    16
174 Unknown_Attribute       -O--CK   100   100   000    -    1
177 Wear_Leveling_Count     PO---K   100   100   089    -    0
183 Runtime_Bad_Block       -O--CK   100   100   000    -    0
187 Reported_Uncorrect      -O--CK   100   100   000    -    0
194 Temperature_Celsius     -O---K   022   045   000    -    22 (Min/Max 19/45)
195 Hardware_ECC_Recovered  -O--CK   100   100   000    -    0
198 Offline_Uncorrectable   -O--CK   100   100   000    -    0
199 UDMA_CRC_Error_Count    -O--CK   100   100   000    -    0
230 Unknown_SSD_Attribute   PO---K   090   100   000    -    90
231 Temperature_Celsius     PO--CK   100   100   010    -    6579200
232 Available_Reservd_Space POS--K   100   100   003    -    0
233 Media_Wearout_Indicator -O--CK   100   100   000    -    15043
241 Total_LBAs_Written      -O--CK   100   100   000    -    12401
242 Total_LBAs_Read         -O--CK   100   100   000    -    10965
243 Unknown_Attribute       -OS--K   087   087   003    -    37645390276129
                            ||||||_ K auto-keep
                            |||||__ C event count
                            ||||___ R error rate
                            |||____ S speed/performance
                            ||_____ O updated online
                            |______ P prefailure warning

SMART Extended Comprehensive Error Log Version: 1 (20 sectors)

Current Temperature:                    26 Celsius

