smartctl 7.1 2020-06-20 r5066 [x86_64-linux-3.10.0-1127...] (local build)
Copyright (C) 2002-19, Bruce Allen, Christian Franke, www.smartmontools.org

=== START OF INFORMATION SECTION ===
Model Family:     Seagate Constellation ES (SATA 6Gb/s)
Device Model:     ST500NM0011
Serial Number:    --
LU WWN Device Id: 5 000c50 ...
Add. Product Id:  DELL(tm)
Firmware Version: PA07
User Capacity:    500,107,862,016 bytes [500 GB]
Sector Size:      512 bytes logical/physical
Rotation Rate:    7200 rpm
Form Factor:      3.5 inches
Device is:        In smartctl database [for details use: -P show]
ATA Version is:   ATA8-ACS T13/1699-D revision 4
SATA Version is:  SATA 3.0, 3.0 Gb/s (current: 3.0 Gb/s)
Local Time is:    --
Rd look-ahead is: Enabled
Write cache is:   Enabled
ATA Security is:  Disabled, NOT FROZEN [SEC1]

=== START OF READ SMART DATA SECTION ===
SMART overall-health self-assessment test result: PASSED
Warning: This result is based on an Attribute check.

General SMART Values:
Offline data collection status:  (0x82)	Offline data collection activity
					was completed without error.

Self-test execution status:      (   0)	The previous self-test routine completed
					without error or no self-test has ever 
					been run.
Total time to complete Offline 
data collection: 		(  600) seconds.
Offline data collection
capabilities: 			 (0x7b) SMART execute Offline immediate.

					Suspend Offline collection upon new
					command.
					Offline surface scan supported.
					Self-test supported.
					Conveyance Self-test supported.
					Selective Self-test supported.
SMART capabilities:            (0x0003)	Saves SMART data before entering
					power-saving mode.

Error logging capability:        (0x01)	Error logging supported.
					General Purpose Logging supported.
Short self-test routine 
recommended polling time: 	 (   2) minutes.
Extended self-test routine
recommended polling time: 	 (  71) minutes.
Conveyance self-test routine
recommended polling time: 	 (   3) minutes.
SCT capabilities: 	       (0x10bd)	SCT Status supported.
					SCT Error Recovery Control supported.
					SCT Feature Control supported.
					SCT Data Table supported.

SMART Attributes Data Structure revision number: 10
Vendor Specific SMART Attributes with Thresholds:
ID# ATTRIBUTE_NAME          FLAGS    VALUE WORST THRESH FAIL RAW_VALUE
  1 Raw_Read_Error_Rate     POSR--   080   063   044    -    108512480
  3 Spin_Up_Time            PO----   096   096   000    -    0
  4 Start_Stop_Count        -O--CK   100   100   020    -    307
  5 Reallocated_Sector_Ct   PO--CK   100   100   036    -    0
  7 Seek_Error_Rate         POSR--   084   060   030    -    300377590
  9 Power_On_Hours          -O--CK   064   064   000    -    31860
 10 Spin_Retry_Count        PO--C-   100   100   097    -    0
 12 Power_Cycle_Count       -O--CK   100   100   020    -    244
184 End-to-End_Error        -O--CK   100   100   099    -    0
187 Reported_Uncorrect      -O--CK   096   096   000    -    4
188 Command_Timeout         -O--CK   100   100   000    -    0
189 High_Fly_Writes         -O-RCK   100   100   000    -    0
190 Airflow_Temperature_Cel -O---K   070   051   045    -    30 (Min/Max 24/34)
191 G-Sense_Error_Rate      -O--CK   100   100   000    -    0
192 Power-Off_Retract_Count -O--CK   100   100   000    -    299
193 Load_Cycle_Count        -O--CK   100   100   000    -    307
194 Temperature_Celsius     -O---K   030   049   000    -    30 (0 15 0 0 0)
195 Hardware_ECC_Recovered  -O-RC-   116   099   000    -    108512480
197 Current_Pending_Sector  -O--C-   100   100   000    -    0
198 Offline_Uncorrectable   ----C-   100   100   000    -    0
199 UDMA_CRC_Error_Count    -OSRCK   200   200   000    -    0
240 Head_Flying_Hours       ------   100   253   000    -    31232 (62 225 0)
241 Total_LBAs_Written      ------   100   253   000    -    1616666533
242 Total_LBAs_Read         ------   100   253   000    -    4178492001
                            ||||||_ K auto-keep
                            |||||__ C event count
                            ||||___ R error rate
                            |||____ S speed/performance
                            ||_____ O updated online
                            |______ P prefailure warning

General Purpose Log Directory Version 1
SMART           Log Directory Version 1 [multi-sector log support]
Address    Access  R/W   Size  Description
0x00       GPL,SL  R/O      1  Log Directory
0x01           SL  R/O      1  Summary SMART error log
0x02           SL  R/O      5  Comprehensive SMART error log
0x03       GPL     R/O      5  Ext. Comprehensive SMART error log
0x06           SL  R/O      1  SMART self-test log
0x07       GPL     R/O      1  Extended self-test log
0x09           SL  R/W      1  Selective self-test log
0x10       GPL     R/O      1  NCQ Command Error log
0x11       GPL     R/O      1  SATA Phy Event Counters log
0x21       GPL     R/O      1  Write stream error log
0x22       GPL     R/O      1  Read stream error log
0x80-0x9f  GPL,SL  R/W     16  Host vendor specific log
0xa1       GPL,SL  VS      20  Device vendor specific log
0xa2       GPL     VS    4496  Device vendor specific log
0xa8       GPL,SL  VS     129  Device vendor specific log
0xa9       GPL,SL  VS       1  Device vendor specific log
0xb0       GPL     VS    5176  Device vendor specific log
0xbd       GPL     VS     252  Device vendor specific log
0xbe-0xbf  GPL     VS   65535  Device vendor specific log
0xe0       GPL,SL  R/W      1  SCT Command/Status
0xe1       GPL,SL  R/W      1  SCT Data Transfer

SMART Extended Comprehensive Error Log Version: 1 (5 sectors)
Device Error Count: 52 (device log contains only the most recent 20 errors)
	CR     = Command Register
	FEATR  = Features Register
	COUNT  = Count (was: Sector Count) Register
	LBA_48 = Upper bytes of LBA High/Mid/Low Registers ]  ATA-8
	LH     = LBA High (was: Cylinder High) Register    ]   LBA
	LM     = LBA Mid (was: Cylinder Low) Register      ] Register
	LL     = LBA Low (was: Sector Number) Register     ]
	DV     = Device (was: Device/Head) Register
	DC     = Device Control Register
	ER     = Error register
	ST     = Status register
Powered_Up_Time is measured from power on, and printed as
DDd+hh:mm:SS.sss where DD=days, hh=hours, mm=minutes,
SS=sec, and sss=millisec. It "wraps" after 49.710 days.

Error 52 [11] occurred at disk power-on lifetime: 978 hours (40 days + 18 hours)
  When the command that caused the error occurred, the device was active or idle.

  After command completion occurred, registers were:
  ER -- ST COUNT  LBA_48  LH LM LL DV DC
  -- -- -- == -- == == == -- -- -- -- --
  40 -- 51 00 00 00 00 33 13 40 d3 00 00  Error: UNC at LBA = 0x331340d3 = 856899795

  Commands leading to the command that caused the error were:
  CR FEATR COUNT  LBA_48  LH LM LL DV DC  Powered_Up_Time  Command/Feature_Name
  -- == -- == -- == == == -- -- -- -- --  ---------------  --------------------
  42 00 00 10 00 00 00 33 0a 80 00 40 00     02:40:42.581  READ VERIFY SECTOR(S) EXT
  42 00 00 10 00 00 00 33 0a 70 00 40 00     02:40:42.542  READ VERIFY SECTOR(S) EXT
  61 00 00 00 08 00 00 00 66 83 b8 40 00     02:40:39.834  WRITE FPDMA QUEUED
  61 00 00 00 08 00 00 00 66 84 48 40 00     02:40:39.834  WRITE FPDMA QUEUED
  61 00 00 00 10 00 00 00 67 b9 48 40 00     02:40:39.833  WRITE FPDMA QUEUED

Error 51 [10] occurred at disk power-on lifetime: 892 hours (37 days + 4 hours)
  When the command that caused the error occurred, the device was active or idle.

  After command completion occurred, registers were:
  ER -- ST COUNT  LBA_48  LH LM LL DV DC
  -- -- -- == -- == == == -- -- -- -- --
  40 -- 51 00 00 00 00 19 7c 4b 2d 00 00  Error: UNC at LBA = 0x197c4b2d = 427576109

  Commands leading to the command that caused the error were:
  CR FEATR COUNT  LBA_48  LH LM LL DV DC  Powered_Up_Time  Command/Feature_Name
  -- == -- == -- == == == -- -- -- -- --  ---------------  --------------------
  42 00 00 10 00 00 00 19 78 ea a6 40 00     00:12:49.853  READ VERIFY SECTOR(S) EXT
  42 00 00 10 00 00 00 19 68 fa a6 40 00     00:12:46.002  READ VERIFY SECTOR(S) EXT
  42 00 00 10 00 00 00 19 59 1a a6 40 00     00:12:42.162  READ VERIFY SECTOR(S) EXT
  42 00 00 10 00 00 00 19 59 0a a6 40 00     00:12:42.131  READ VERIFY SECTOR(S) EXT
  42 00 00 00 01 00 00 3a 38 1d d7 40 00     00:12:42.114  READ VERIFY SECTOR(S) EXT

Error 50 [9] occurred at disk power-on lifetime: 892 hours (37 days + 4 hours)
  When the command that caused the error occurred, the device was active or idle.

  After command completion occurred, registers were:
  ER -- ST COUNT  LBA_48  LH LM LL DV DC
  -- -- -- == -- == == == -- -- -- -- --
  40 -- 51 00 00 00 00 19 59 0a a5 00 00  Error: UNC at LBA = 0x19590aa5 = 425265829

  Commands leading to the command that caused the error were:
  CR FEATR COUNT  LBA_48  LH LM LL DV DC  Powered_Up_Time  Command/Feature_Name
  -- == -- == -- == == == -- -- -- -- --  ---------------  --------------------
  42 00 00 10 00 00 00 19 55 f0 00 40 00     00:12:38.487  READ VERIFY SECTOR(S) EXT
  42 00 00 10 00 00 00 19 55 e0 00 40 00     00:12:38.466  READ VERIFY SECTOR(S) EXT
  61 00 00 00 08 00 00 00 66 83 c0 40 00     00:12:35.852  WRITE FPDMA QUEUED
  61 00 00 00 08 00 00 00 66 83 c8 40 00     00:12:35.852  WRITE FPDMA QUEUED
  61 00 00 00 08 00 00 00 66 89 e8 40 00     00:12:35.852  WRITE FPDMA QUEUED

Error 49 [8] occurred at disk power-on lifetime: 820 hours (34 days + 4 hours)
  When the command that caused the error occurred, the device was active or idle.

  After command completion occurred, registers were:
  ER -- ST COUNT  LBA_48  LH LM LL DV DC
  -- -- -- == -- == == == -- -- -- -- --
  40 -- 51 00 00 00 00 00 60 2f 15 00 00  Error: UNC at LBA = 0x00602f15 = 6303509

  Commands leading to the command that caused the error were:
  CR FEATR COUNT  LBA_48  LH LM LL DV DC  Powered_Up_Time  Command/Feature_Name
  -- == -- == -- == == == -- -- -- -- --  ---------------  --------------------
  25 00 00 00 08 00 00 00 60 2f 10 e0 00     00:01:45.610  READ DMA EXT
  35 00 00 00 70 00 00 00 5b de c8 e0 00     00:01:45.609  WRITE DMA EXT
  35 00 00 00 08 00 00 09 de b3 f0 e0 00     00:01:45.609  WRITE DMA EXT
  35 00 00 00 08 00 00 09 ca b4 48 e0 00     00:01:45.608  WRITE DMA EXT
  35 00 00 00 08 00 00 09 c5 a5 a0 e0 00     00:01:45.608  WRITE DMA EXT

Error 48 [7] occurred at disk power-on lifetime: 820 hours (34 days + 4 hours)
  When the command that caused the error occurred, the device was active or idle.

  After command completion occurred, registers were:
  ER -- ST COUNT  LBA_48  LH LM LL DV DC
  -- -- -- == -- == == == -- -- -- -- --
  40 -- 51 00 00 00 00 00 60 2f 15 00 00  Error: UNC at LBA = 0x00602f15 = 6303509

  Commands leading to the command that caused the error were:
  CR FEATR COUNT  LBA_48  LH LM LL DV DC  Powered_Up_Time  Command/Feature_Name
  -- == -- == -- == == == -- -- -- -- --  ---------------  --------------------
  25 00 00 00 08 00 00 00 60 2f 10 e0 00     00:01:43.227  READ DMA EXT
  35 00 00 00 18 00 00 00 5b 87 80 e0 00     00:01:43.226  WRITE DMA EXT
  35 00 00 00 08 00 00 09 b4 55 78 e0 00     00:01:43.226  WRITE DMA EXT
  35 00 00 00 08 00 00 09 ab c0 78 e0 00     00:01:43.226  WRITE DMA EXT
  35 00 00 00 08 00 00 09 a8 54 98 e0 00     00:01:43.225  WRITE DMA EXT

Error 47 [6] occurred at disk power-on lifetime: 820 hours (34 days + 4 hours)
  When the command that caused the error occurred, the device was active or idle.

  After command completion occurred, registers were:
  ER -- ST COUNT  LBA_48  LH LM LL DV DC
  -- -- -- == -- == == == -- -- -- -- --
  40 -- 51 00 00 00 00 00 60 2f 15 00 00  Error: UNC at LBA = 0x00602f15 = 6303509

  Commands leading to the command that caused the error were:
  CR FEATR COUNT  LBA_48  LH LM LL DV DC  Powered_Up_Time  Command/Feature_Name
  -- == -- == -- == == == -- -- -- -- --  ---------------  --------------------
  25 00 00 00 08 00 00 00 60 2f 10 e0 00     00:01:40.844  READ DMA EXT
  35 00 00 00 08 00 00 00 5b 8b 80 e0 00     00:01:40.844  WRITE DMA EXT
  35 00 00 00 08 00 00 09 b3 8f 28 e0 00     00:01:40.844  WRITE DMA EXT
  35 00 00 00 08 00 00 09 af 00 b0 e0 00     00:01:40.844  WRITE DMA EXT
  35 00 00 00 08 00 00 09 a3 ab 40 e0 00     00:01:40.843  WRITE DMA EXT

Error 46 [5] occurred at disk power-on lifetime: 820 hours (34 days + 4 hours)
  When the command that caused the error occurred, the device was active or idle.

  After command completion occurred, registers were:
  ER -- ST COUNT  LBA_48  LH LM LL DV DC
  -- -- -- == -- == == == -- -- -- -- --
  40 -- 51 00 00 00 00 00 60 2f 15 00 00  Error: UNC at LBA = 0x00602f15 = 6303509

  Commands leading to the command that caused the error were:
  CR FEATR COUNT  LBA_48  LH LM LL DV DC  Powered_Up_Time  Command/Feature_Name
  -- == -- == -- == == == -- -- -- -- --  ---------------  --------------------
  25 00 00 00 08 00 00 00 60 2f 10 e0 00     00:01:38.462  READ DMA EXT
  35 00 00 00 08 00 00 00 5b 8b 90 e0 00     00:01:38.462  WRITE DMA EXT
  35 00 00 00 18 00 00 00 5b 87 58 e0 00     00:01:38.462  WRITE DMA EXT
  35 00 00 00 10 00 00 00 00 01 50 e0 00     00:01:38.461  WRITE DMA EXT
  35 00 00 00 30 00 00 00 00 01 20 e0 00     00:01:38.461  WRITE DMA EXT

Error 45 [4] occurred at disk power-on lifetime: 820 hours (34 days + 4 hours)
  When the command that caused the error occurred, the device was active or idle.

  After command completion occurred, registers were:
  ER -- ST COUNT  LBA_48  LH LM LL DV DC
  -- -- -- == -- == == == -- -- -- -- --
  40 -- 51 00 00 00 00 00 60 2f 15 00 00  Error: UNC at LBA = 0x00602f15 = 6303509

  Commands leading to the command that caused the error were:
  CR FEATR COUNT  LBA_48  LH LM LL DV DC  Powered_Up_Time  Command/Feature_Name
  -- == -- == -- == == == -- -- -- -- --  ---------------  --------------------
  25 00 00 00 08 00 00 00 60 2f 10 e0 00     00:01:36.091  READ DMA EXT
  35 00 00 00 70 00 00 00 5b de 58 e0 00     00:01:36.089  WRITE DMA EXT
  35 00 00 00 50 00 00 00 5b 89 d0 e0 00     00:01:36.088  WRITE DMA EXT
  35 00 00 00 50 00 00 00 5b 87 08 e0 00     00:01:36.087  WRITE DMA EXT
  35 00 00 00 40 00 00 11 90 ce d8 e0 00     00:01:36.086  WRITE DMA EXT

SMART Extended Self-test Log Version: 1 (1 sectors)
Num  Test_Description    Status                  Remaining  LifeTime(hours)  LBA_of_first_error
# 1  Short offline       Completed without error       00%         2         -
# 2  Extended offline    Completed without error       00%         2         -
# 3  Short offline       Completed without error       00%         0         -

SMART Selective self-test log data structure revision number 1
 SPAN  MIN_LBA  MAX_LBA  CURRENT_TEST_STATUS
    1        0        0  Not_testing
    2        0        0  Not_testing
    3        0        0  Not_testing
    4        0        0  Not_testing
    5        0        0  Not_testing
Selective self-test flags (0x0):
  After scanning selected spans, do NOT read-scan remainder of disk.
If Selective self-test is pending on power-up, resume after 0 minute delay.

SCT Status Version:                  3
SCT Version (vendor specific):       522 (0x020a)
Device State:                        Active (0)
Current Temperature:                    30 Celsius
Power Cycle Min/Max Temperature:     24/34 Celsius
Lifetime    Min/Max Temperature:     15/49 Celsius
Under/Over Temperature Limit Count:   0/10634

SCT Temperature History Version:     2
Temperature Sampling Period:         1 minute
Temperature Logging Interval:        10 minutes
Min/Max recommended Temperature:      0/ 0 Celsius
Min/Max Temperature Limit:            0/ 0 Celsius
Temperature History Size (Index):    128 (84)

SATA Phy Event Counters (GP Log 0x11)
ID      Size     Value  Description
0x000a  2            3  Device-to-host register FISes sent due to a COMRESET
0x0001  2            0  Command failed due to ICRC error
0x0003  2            0  R_ERR response for device-to-host data FIS
0x0004  2            0  R_ERR response for host-to-device data FIS
0x0006  2            0  R_ERR response for device-to-host non-data FIS
0x0007  2            0  R_ERR response for host-to-device non-data FIS
0x000b  2            0  CRC errors within host-to-device FIS
0x000d  2            0  Non-CRC errors within host-to-device FIS

