smartctl 7.1 2020-06-20 r5066 [x86_64-linux-3.10.0-1160...] (local build)
Copyright (C) 2002-19, Bruce Allen, Christian Franke, www.smartmontools.org

=== START OF INFORMATION SECTION ===
Model Family:     Western Digital RE4
Device Model:     WDC WD1003FBYX-01Y7B1
Serial Number:    --
LU WWN Device Id: 5 0014ee ...
Firmware Version: 01.01V02
User Capacity:    1,000,204,886,016 bytes [1.00 TB]
Sector Size:      512 bytes logical/physical
Rotation Rate:    7200 rpm
Device is:        In smartctl database [for details use: -P show]
ATA Version is:   ATA8-ACS (minor revision not indicated)
SATA Version is:  SATA 3.0, 3.0 Gb/s (current: 3.0 Gb/s)
Local Time is:    --
APM level is:     128 (minimum power consumption without standby)
Rd look-ahead is: Enabled
Write cache is:   Enabled
ATA Security is:  Disabled, NOT FROZEN [SEC1]

=== START OF READ SMART DATA SECTION ===
SMART overall-health self-assessment test result: PASSED

General SMART Values:
Offline data collection status:  (0x84)	Offline data collection activity
					was suspended by an interrupting command from host.

Self-test execution status:      (   0)	The previous self-test routine completed
					without error or no self-test has ever 
					been run.
Total time to complete Offline 
data collection: 		(16200) seconds.
Offline data collection
capabilities: 			 (0x7b) SMART execute Offline immediate.

					Suspend Offline collection upon new
					command.
					Offline surface scan supported.
					Self-test supported.
					Conveyance Self-test supported.
					Selective Self-test supported.
SMART capabilities:            (0x0003)	Saves SMART data before entering
					power-saving mode.

Error logging capability:        (0x01)	Error logging supported.
					General Purpose Logging supported.
Short self-test routine 
recommended polling time: 	 (   2) minutes.
Extended self-test routine
recommended polling time: 	 ( 159) minutes.
Conveyance self-test routine
recommended polling time: 	 (   5) minutes.
SCT capabilities: 	       (0x303f)	SCT Status supported.
					SCT Error Recovery Control supported.
					SCT Feature Control supported.
					SCT Data Table supported.

SMART Attributes Data Structure revision number: 16
Vendor Specific SMART Attributes with Thresholds:
ID# ATTRIBUTE_NAME          FLAGS    VALUE WORST THRESH FAIL RAW_VALUE
  1 Raw_Read_Error_Rate     POSR-K   200   200   051    -    2
  3 Spin_Up_Time            POS--K   174   174   021    -    4300
  4 Start_Stop_Count        -O--CK   100   100   000    -    25
  5 Reallocated_Sector_Ct   PO--CK   200   200   140    -    0
  7 Seek_Error_Rate         -OSR-K   200   200   000    -    0
  9 Power_On_Hours          -O--CK   078   078   000    -    16512
 10 Spin_Retry_Count        -O--CK   100   253   000    -    0
 11 Calibration_Retry_Count -O--CK   100   253   000    -    0
 12 Power_Cycle_Count       -O--CK   100   100   000    -    23
192 Power-Off_Retract_Count -O--CK   200   200   000    -    20
193 Load_Cycle_Count        -O--CK   200   200   000    -    4
194 Temperature_Celsius     -O---K   116   098   000    -    31
196 Reallocated_Event_Count -O--CK   200   200   000    -    0
197 Current_Pending_Sector  -O--CK   200   200   000    -    0
198 Offline_Uncorrectable   ----CK   200   200   000    -    0
199 UDMA_CRC_Error_Count    -O--CK   200   200   000    -    0
200 Multi_Zone_Error_Rate   ---R--   200   200   000    -    0
                            ||||||_ K auto-keep
                            |||||__ C event count
                            ||||___ R error rate
                            |||____ S speed/performance
                            ||_____ O updated online
                            |______ P prefailure warning

General Purpose Log Directory Version 1
SMART           Log Directory Version 1 [multi-sector log support]
Address    Access  R/W   Size  Description
0x00       GPL,SL  R/O      1  Log Directory
0x01           SL  R/O      1  Summary SMART error log
0x02           SL  R/O      5  Comprehensive SMART error log
0x03       GPL     R/O      6  Ext. Comprehensive SMART error log
0x06           SL  R/O      1  SMART self-test log
0x07       GPL     R/O      1  Extended self-test log
0x08       GPL     R/O      2  Power Conditions log
0x09           SL  R/W      1  Selective self-test log
0x10       GPL     R/O      1  NCQ Command Error log
0x11       GPL     R/O      1  SATA Phy Event Counters log
0x80-0x9f  GPL,SL  R/W     16  Host vendor specific log
0xa0-0xa7  GPL,SL  VS      16  Device vendor specific log
0xa8-0xb5  GPL,SL  VS       1  Device vendor specific log
0xb6       GPL     VS       1  Device vendor specific log
0xb7       GPL,SL  VS       1  Device vendor specific log
0xbd       GPL,SL  VS       1  Device vendor specific log
0xc0       GPL,SL  VS       1  Device vendor specific log
0xc1       GPL     VS      24  Device vendor specific log
0xe0       GPL,SL  R/W      1  SCT Command/Status
0xe1       GPL,SL  R/W      1  SCT Data Transfer

SMART Extended Comprehensive Error Log Version: 1 (6 sectors)
Device Error Count: 212 (device log contains only the most recent 24 errors)
	CR     = Command Register
	FEATR  = Features Register
	COUNT  = Count (was: Sector Count) Register
	LBA_48 = Upper bytes of LBA High/Mid/Low Registers ]  ATA-8
	LH     = LBA High (was: Cylinder High) Register    ]   LBA
	LM     = LBA Mid (was: Cylinder Low) Register      ] Register
	LL     = LBA Low (was: Sector Number) Register     ]
	DV     = Device (was: Device/Head) Register
	DC     = Device Control Register
	ER     = Error register
	ST     = Status register
Powered_Up_Time is measured from power on, and printed as
DDd+hh:mm:SS.sss where DD=days, hh=hours, mm=minutes,
SS=sec, and sss=millisec. It "wraps" after 49.710 days.

Error 212 [19] occurred at disk power-on lifetime: 16134 hours (672 days + 6 hours)
  When the command that caused the error occurred, the device was active or idle.

  After command completion occurred, registers were:
  ER -- ST COUNT  LBA_48  LH LM LL DV DC
  -- -- -- == -- == == == -- -- -- -- --
  40 -- 51 00 00 00 00 0a 3f 3d 71 40 00  Error: UNC at LBA = 0x0a3f3d71 = 171916657

  Commands leading to the command that caused the error were:
  CR FEATR COUNT  LBA_48  LH LM LL DV DC  Powered_Up_Time  Command/Feature_Name
  -- == -- == -- == == == -- -- -- -- --  ---------------  --------------------
  60 00 80 00 78 00 00 0a 3f 41 80 40 08 44d+ ...          READ FPDMA QUEUED
  60 04 00 00 70 00 00 0a 3f 3d 80 40 08 44d+ ...          READ FPDMA QUEUED
  60 04 00 00 68 00 00 0a 3f 39 80 40 08 44d+ ...          READ FPDMA QUEUED
  ea 00 00 00 00 00 00 00 00 00 00 e0 08 44d+ ...          FLUSH CACHE EXT
  60 02 00 00 48 00 00 0a 3f 37 80 40 08 44d+ ...          READ FPDMA QUEUED

Error 211 [18] occurred at disk power-on lifetime: 15634 hours (651 days + 10 hours)
  When the command that caused the error occurred, the device was active or idle.

  After command completion occurred, registers were:
  ER -- ST COUNT  LBA_48  LH LM LL DV DC
  -- -- -- == -- == == == -- -- -- -- --
  40 -- 51 00 00 00 00 0a 3f 3d 71 40 00  Error: UNC at LBA = 0x0a3f3d71 = 171916657

  Commands leading to the command that caused the error were:
  CR FEATR COUNT  LBA_48  LH LM LL DV DC  Powered_Up_Time  Command/Feature_Name
  -- == -- == -- == == == -- -- -- -- --  ---------------  --------------------
  60 01 00 00 d0 00 00 0a 3f 3d 00 40 08 23d+ ...          READ FPDMA QUEUED
  60 01 00 00 c8 00 00 0a 3f 3e 00 40 08 23d+ ...          READ FPDMA QUEUED
  60 00 80 00 c0 00 00 0a 3f 3f 00 40 08 23d+ ...          READ FPDMA QUEUED
  60 00 80 00 b8 00 00 0a 3f 3f 80 40 08 23d+ ...          READ FPDMA QUEUED
  60 00 80 00 b0 00 00 0a 3f 40 00 40 08 23d+ ...          READ FPDMA QUEUED

Error 210 [17] occurred at disk power-on lifetime: 15634 hours (651 days + 10 hours)
  When the command that caused the error occurred, the device was active or idle.

  After command completion occurred, registers were:
  ER -- ST COUNT  LBA_48  LH LM LL DV DC
  -- -- -- == -- == == == -- -- -- -- --
  40 -- 51 00 00 00 00 0a 3f 3d 71 40 00  Error: UNC at LBA = 0x0a3f3d71 = 171916657

  Commands leading to the command that caused the error were:
  CR FEATR COUNT  LBA_48  LH LM LL DV DC  Powered_Up_Time  Command/Feature_Name
  -- == -- == -- == == == -- -- -- -- --  ---------------  --------------------
  60 00 80 00 90 00 00 0a 3f 41 00 40 08 23d+ ...          READ FPDMA QUEUED
  60 00 80 00 88 00 00 0a 3f 40 80 40 08 23d+ ...          READ FPDMA QUEUED
  60 00 80 00 80 00 00 0a 3f 40 00 40 08 23d+ ...          READ FPDMA QUEUED
  60 00 80 00 78 00 00 0a 3f 3f 80 40 08 23d+ ...          READ FPDMA QUEUED
  60 00 80 00 70 00 00 0a 3f 3f 00 40 08 23d+ ...          READ FPDMA QUEUED

Error 209 [16] occurred at disk power-on lifetime: 16006 hours (666 days + 22 hours)
  When the command that caused the error occurred, the device was active or idle.

  After command completion occurred, registers were:
  ER -- ST COUNT  LBA_48  LH LM LL DV DC
  -- -- -- == -- == == == -- -- -- -- --
  40 -- 51 00 00 00 00 0a 3f 0f 13 40 00  Error: UNC at LBA = 0x0a3f0f13 = 171904787

  Commands leading to the command that caused the error were:
  CR FEATR COUNT  LBA_48  LH LM LL DV DC  Powered_Up_Time  Command/Feature_Name
  -- == -- == -- == == == -- -- -- -- --  ---------------  --------------------
  60 04 00 00 60 00 00 0a 3f 0b 80 40 08 39d+ ...          READ FPDMA QUEUED
  ef 00 10 00 02 00 00 00 00 00 00 a0 08 39d+ ...          SET FEATURES [Enable SATA feature]
  27 00 00 00 00 00 00 00 00 00 00 e0 08 39d+ ...          READ NATIVE MAX ADDRESS EXT [OBS-ACS-3]
  ec 00 00 00 00 00 00 00 00 00 00 a0 08 39d+ ...          IDENTIFY DEVICE
  ef 00 03 00 46 00 00 00 00 00 00 a0 08 39d+ ...          SET FEATURES [Set transfer mode]

Error 208 [15] occurred at disk power-on lifetime: 16006 hours (666 days + 22 hours)
  When the command that caused the error occurred, the device was active or idle.

  After command completion occurred, registers were:
  ER -- ST COUNT  LBA_48  LH LM LL DV DC
  -- -- -- == -- == == == -- -- -- -- --
  40 -- 51 00 00 00 00 0a 3f 0f 13 40 00  Error: UNC at LBA = 0x0a3f0f13 = 171904787

  Commands leading to the command that caused the error were:
  CR FEATR COUNT  LBA_48  LH LM LL DV DC  Powered_Up_Time  Command/Feature_Name
  -- == -- == -- == == == -- -- -- -- --  ---------------  --------------------
  60 04 00 00 28 00 00 0a 3f 0b 80 40 08 39d+ ...          READ FPDMA QUEUED
  60 01 00 00 20 00 00 0a 3f 13 00 40 08 39d+ ...          READ FPDMA QUEUED
  60 03 80 00 18 00 00 0a 3f 0f 80 40 08 39d+ ...          READ FPDMA QUEUED
  ef 00 10 00 02 00 00 00 00 00 00 a0 08 39d+ ...          SET FEATURES [Enable SATA feature]
  27 00 00 00 00 00 00 00 00 00 00 e0 08 39d+ ...          READ NATIVE MAX ADDRESS EXT [OBS-ACS-3]

Error 207 [14] occurred at disk power-on lifetime: 16006 hours (666 days + 22 hours)
  When the command that caused the error occurred, the device was active or idle.

  After command completion occurred, registers were:
  ER -- ST COUNT  LBA_48  LH LM LL DV DC
  -- -- -- == -- == == == -- -- -- -- --
  40 -- 51 00 00 00 00 0a 3f 0f 13 40 00  Error: UNC at LBA = 0x0a3f0f13 = 171904787

  Commands leading to the command that caused the error were:
  CR FEATR COUNT  LBA_48  LH LM LL DV DC  Powered_Up_Time  Command/Feature_Name
  -- == -- == -- == == == -- -- -- -- --  ---------------  --------------------
  60 04 00 00 00 00 00 0a 3f 0b 80 40 08 39d+ ...          READ FPDMA QUEUED
  60 03 80 00 f0 00 00 0a 3f 0f 80 40 08 39d+ ...          READ FPDMA QUEUED
  60 01 00 00 e8 00 00 0a 3f 13 00 40 08 39d+ ...          READ FPDMA QUEUED
  ef 00 10 00 02 00 00 00 00 00 00 a0 08 39d+ ...          SET FEATURES [Enable SATA feature]
  27 00 00 00 00 00 00 00 00 00 00 e0 08 39d+ ...          READ NATIVE MAX ADDRESS EXT [OBS-ACS-3]

Error 206 [13] occurred at disk power-on lifetime: 16006 hours (666 days + 22 hours)
  When the command that caused the error occurred, the device was active or idle.

  After command completion occurred, registers were:
  ER -- ST COUNT  LBA_48  LH LM LL DV DC
  -- -- -- == -- == == == -- -- -- -- --
  40 -- 51 00 00 00 00 0a 3f 0f 13 40 00  Error: UNC at LBA = 0x0a3f0f13 = 171904787

  Commands leading to the command that caused the error were:
  CR FEATR COUNT  LBA_48  LH LM LL DV DC  Powered_Up_Time  Command/Feature_Name
  -- == -- == -- == == == -- -- -- -- --  ---------------  --------------------
  60 01 00 00 d0 00 00 0a 3f 13 00 40 08 39d+ ...          READ FPDMA QUEUED
  60 03 80 00 c8 00 00 0a 3f 0f 80 40 08 39d+ ...          READ FPDMA QUEUED
  60 04 00 00 c0 00 00 0a 3f 0b 80 40 08 39d+ ...          READ FPDMA QUEUED
  ef 00 10 00 02 00 00 00 00 00 00 a0 08 39d+ ...          SET FEATURES [Enable SATA feature]
  27 00 00 00 00 00 00 00 00 00 00 e0 08 39d+ ...          READ NATIVE MAX ADDRESS EXT [OBS-ACS-3]

Error 205 [12] occurred at disk power-on lifetime: 16006 hours (666 days + 22 hours)
  When the command that caused the error occurred, the device was active or idle.

  After command completion occurred, registers were:
  ER -- ST COUNT  LBA_48  LH LM LL DV DC
  -- -- -- == -- == == == -- -- -- -- --
  40 -- 51 00 00 00 00 0a 3f 0f 13 40 00  Error: UNC at LBA = 0x0a3f0f13 = 171904787

  Commands leading to the command that caused the error were:
  CR FEATR COUNT  LBA_48  LH LM LL DV DC  Powered_Up_Time  Command/Feature_Name
  -- == -- == -- == == == -- -- -- -- --  ---------------  --------------------
  60 04 00 00 a8 00 00 0a 3f 0b 80 40 08 39d+ ...          READ FPDMA QUEUED
  60 03 80 00 a0 00 00 0a 3f 0f 80 40 08 39d+ ...          READ FPDMA QUEUED
  60 01 00 00 98 00 00 0a 3f 13 00 40 08 39d+ ...          READ FPDMA QUEUED
  ef 00 10 00 02 00 00 00 00 00 00 a0 08 39d+ ...          SET FEATURES [Enable SATA feature]
  27 00 00 00 00 00 00 00 00 00 00 e0 08 39d+ ...          READ NATIVE MAX ADDRESS EXT [OBS-ACS-3]

SMART Extended Self-test Log Version: 1 (1 sectors)
No self-tests have been logged.  [To run self-tests, use: smartctl -t]

SMART Selective self-test log data structure revision number 1
 SPAN  MIN_LBA  MAX_LBA  CURRENT_TEST_STATUS
    1        0        0  Not_testing
    2        0        0  Not_testing
    3        0        0  Not_testing
    4        0        0  Not_testing
    5        0        0  Not_testing
Selective self-test flags (0x0):
  After scanning selected spans, do NOT read-scan remainder of disk.
If Selective self-test is pending on power-up, resume after 0 minute delay.

SCT Status Version:                  3
SCT Version (vendor specific):       258 (0x0102)
Device State:                        Active (0)
Current Temperature:                    31 Celsius
Power Cycle Min/Max Temperature:     29/37 Celsius
Lifetime    Min/Max Temperature:     29/49 Celsius
Under/Over Temperature Limit Count:   0/0

SCT Temperature History Version:     2
Temperature Sampling Period:         1 minute
Temperature Logging Interval:        1 minute
Min/Max recommended Temperature:      0/60 Celsius
Min/Max Temperature Limit:           -41/85 Celsius
Temperature History Size (Index):    478 (68)

SCT Error Recovery Control:
           Read:     70 (7.0 seconds)
          Write:     70 (7.0 seconds)

SATA Phy Event Counters (GP Log 0x11)
ID      Size     Value  Description
0x0001  2            0  Command failed due to ICRC error
0x0002  2            0  R_ERR response for data FIS
0x0003  2            0  R_ERR response for device-to-host data FIS
0x0004  2            0  R_ERR response for host-to-device data FIS
0x0005  2            0  R_ERR response for non-data FIS
0x0006  2            0  R_ERR response for device-to-host non-data FIS
0x0007  2            0  R_ERR response for host-to-device non-data FIS
0x0008  2            0  Device-to-host non-data FIS retries
0x0009  2           71  Transition from drive PhyRdy to drive PhyNRdy
0x000a  2           22  Device-to-host register FISes sent due to a COMRESET
0x000b  2            0  CRC errors within host-to-device FIS
0x000f  2            0  R_ERR response for host-to-device data FIS, CRC
0x0012  2            0  R_ERR response for host-to-device non-data FIS, CRC
0x8000  4      1162151  Vendor specific

