smartctl 7.1 2019-12-30 r5022 [x86_64-linux-3.10.0-1062...] (local build)
Copyright (C) 2002-19, Bruce Allen, Christian Franke, www.smartmontools.org

=== START OF INFORMATION SECTION ===
Model Number:                       INTEL SSDPE21K100GA
Serial Number:                      --
Firmware Version:                   E2010435
PCI Vendor/Subsystem ID:            0x8086
IEEE OUI Identifier:                0x5cd2e4
Controller ID:                      0
Number of Namespaces:               1
Namespace 1 Size/Capacity:          100,030,242,816 [100 GB]
Namespace 1 Formatted LBA Size:     512
Namespace 1 IEEE EUI-64:            5cd2e4 ...
Local Time is:                      --

=== START OF READ SMART DATA SECTION ===
SMART overall-health self-assessment test result: PASSED

SMART/Health Information (NVMe Log 0x02)
Critical Warning:                   0x00
Temperature:                        30 Celsius
Available Spare:                    100%
Available Spare Threshold:          0%
Percentage Used:                    0%
Data Units Read:                    4,048 [2.07 GB]
Data Units Written:                 1,984,630 [1.01 TB]
Host Read Commands:                 70,764
Host Write Commands:                111,601,326
Controller Busy Time:               22
Power Cycles:                       26
Power On Hours:                     4,933
Unsafe Shutdowns:                   21
Media and Data Integrity Errors:    0
Error Information Log Entries:      0

