smartctl 7.1 2019-12-30 r5022 [x86_64-linux-3.10.0-1062...] (local build)
Copyright (C) 2002-19, Bruce Allen, Christian Franke, www.smartmontools.org

=== START OF INFORMATION SECTION ===
Model Number:                       INTEL SSDPEDKE020T7
Serial Number:                      --
Firmware Version:                   QDV10170
PCI Vendor/Subsystem ID:            0x8086
IEEE OUI Identifier:                0x5cd2e4
Total NVM Capacity:                 2,000,398,934,016 [2.00 TB]
Unallocated NVM Capacity:           0
Controller ID:                      0
Number of Namespaces:               1
Namespace 1 Size/Capacity:          2,000,398,934,016 [2.00 TB]
Namespace 1 Formatted LBA Size:     512
Namespace 1 IEEE EUI-64:            5cd2e4 ...
Local Time is:                      --

=== START OF READ SMART DATA SECTION ===
SMART overall-health self-assessment test result: PASSED

SMART/Health Information (NVMe Log 0x02)
Critical Warning:                   0x00
Temperature:                        21 Celsius
Available Spare:                    100%
Available Spare Threshold:          10%
Percentage Used:                    11%
Data Units Read:                    144,312,124 [73.8 TB]
Data Units Written:                 3,516,715,777 [1.80 PB]
Host Read Commands:                 2,236,558,130
Host Write Commands:                36,171,346,892
Controller Busy Time:               1,736
Power Cycles:                       11
Power On Hours:                     18,211
Unsafe Shutdowns:                   8
Media and Data Integrity Errors:    0
Error Information Log Entries:      0
Warning  Comp. Temperature Time:    0
Critical Comp. Temperature Time:    0

