smartctl 7.1 2020-06-20 r5066 [x86_64-linux-3.10.0-1160...] (local build)
Copyright (C) 2002-19, Bruce Allen, Christian Franke, www.smartmontools.org

=== START OF INFORMATION SECTION ===
Model Number:                       KINGSTON SKC3000S1024G
Serial Number:                      --
Firmware Version:                   EIFK31.6
PCI Vendor/Subsystem ID:            0x2646
IEEE OUI Identifier:                0x0026b7
Total NVM Capacity:                 1,024,209,543,168 [1.02 TB]
Unallocated NVM Capacity:           0
Controller ID:                      1
Number of Namespaces:               1
Namespace 1 Size/Capacity:          1,024,209,543,168 [1.02 TB]
Namespace 1 Formatted LBA Size:     512
Namespace 1 IEEE EUI-64:            0026b7 ...
Local Time is:                      Sat Jan ... 2022 EST

=== START OF READ SMART DATA SECTION ===
SMART overall-health self-assessment test result: PASSED

SMART/Health Information (NVMe Log 0x02)
Critical Warning:                   0x00
Temperature:                        22 Celsius
Available Spare:                    100%
Available Spare Threshold:          10%
Percentage Used:                    0%
Data Units Read:                    12,861,614 [6.58 TB]
Data Units Written:                 2,158,935 [1.10 TB]
Host Read Commands:                 57,855,414
Host Write Commands:                42,022,766
Controller Busy Time:               147
Power Cycles:                       5
Power On Hours:                     1,259
Unsafe Shutdowns:                   3
Media and Data Integrity Errors:    0
Error Information Log Entries:      0
Warning  Comp. Temperature Time:    0
Critical Comp. Temperature Time:    0
Temperature Sensor 2:               39 Celsius

