smartctl 7.1 2019-12-30 r5022 [x86_64-linux-3.10.0-1062...] (local build)
Copyright (C) 2002-19, Bruce Allen, Christian Franke, www.smartmontools.org

=== START OF INFORMATION SECTION ===
Model Family:     Intel S4510/S4610/S4500/S4600 Series SSDs
Device Model:     INTEL SSDSC2KB960G8
Serial Number:    --
LU WWN Device Id: 5 5cd2e4 ...
Firmware Version: XCV10100
User Capacity:    960,197,124,096 bytes [960 GB]
Sector Sizes:     512 bytes logical, 4096 bytes physical
Rotation Rate:    Solid State Device
Form Factor:      2.5 inches
Device is:        In smartctl database [for details use: -P show]
ATA Version is:   ACS-3 T13/2161-D revision 5
SATA Version is:  SATA 3.2, 6.0 Gb/s (current: 6.0 Gb/s)
Local Time is:    Fri May ... 2022 +07
Rd look-ahead is: Enabled
Write cache is:   Enabled
ATA Security is:  Disabled, NOT FROZEN [SEC1]

=== START OF READ SMART DATA SECTION ===
SMART overall-health self-assessment test result: PASSED
Warning: This result is based on an Attribute check.

General SMART Values:
Offline data collection status:  (0x00)	Offline data collection activity
					was never started.

Self-test execution status:      (   0)	The previous self-test routine completed
					without error or no self-test has ever 
					been run.
Total time to complete Offline 
data collection: 		(    0) seconds.
Offline data collection
capabilities: 			 (0x79) SMART execute Offline immediate.

					Suspend Offline collection upon new
					command.
					Offline surface scan supported.
					Self-test supported.
					Conveyance Self-test supported.
					Selective Self-test supported.
SMART capabilities:            (0x0003)	Saves SMART data before entering
					power-saving mode.

Error logging capability:        (0x01)	Error logging supported.
					General Purpose Logging supported.
Short self-test routine 
recommended polling time: 	 (   1) minutes.
Extended self-test routine
recommended polling time: 	 (   2) minutes.
Conveyance self-test routine
recommended polling time: 	 (   2) minutes.
SCT capabilities: 	       (0x003d)	SCT Status supported.
					SCT Error Recovery Control supported.
					SCT Feature Control supported.
					SCT Data Table supported.

SMART Attributes Data Structure revision number: 1
Vendor Specific SMART Attributes with Thresholds:
ID# ATTRIBUTE_NAME          FLAGS    VALUE WORST THRESH FAIL RAW_VALUE
  5 Reallocated_Sector_Ct   -O--CK   100   100   000    -    0
  9 Power_On_Hours          -O--CK   100   100   000    -    26824
 12 Power_Cycle_Count       -O--CK   100   100   000    -    15
170 Available_Reservd_Space PO--CK   100   100   010    -    0
171 Program_Fail_Count      -O--CK   100   100   000    -    0
172 Erase_Fail_Count        -O--CK   100   100   000    -    0
174 Unsafe_Shutdown_Count   -O--CK   100   100   000    -    10
175 Power_Loss_Cap_Test     PO--CK   100   100   010    -    2302 (15 65535)
183 SATA_Downshift_Count    -O--CK   100   100   000    -    0
184 End-to-End_Error_Count  PO--CK   100   100   090    -    0
187 Uncorrectable_Error_Cnt -O--CK   100   100   000    -    0
190 Drive_Temperature       -O---K   071   064   000    -    29 (Min/Max 25/37)
192 Unsafe_Shutdown_Count   -O--CK   100   100   000    -    10
194 Temperature_Celsius     -O---K   100   100   000    -    29
197 Pending_Sector_Count    -O--C-   100   100   000    -    0
199 CRC_Error_Count         -OSRCK   100   100   000    -    279
225 Host_Writes_32MiB       -O--CK   100   100   000    -    4794984
226 Workld_Media_Wear_Indic -O--CK   100   100   000    -    3809
227 Workld_Host_Reads_Perc  -O--CK   100   100   000    -    57
228 Workload_Minutes        -O--CK   100   100   000    -    1609427
232 Available_Reservd_Space PO--CK   100   100   010    -    0
233 Media_Wearout_Indicator -O--CK   097   097   000    -    0
234 Thermal_Throttle_Status -O--CK   100   100   000    -    0/0
235 Power_Loss_Cap_Test     PO--CK   100   100   010    -    2302 (15 65535)
241 Host_Writes_32MiB       -O--CK   100   100   000    -    4794984
242 Host_Reads_32MiB        -O--CK   100   100   000    -    6496830
243 NAND_Writes_32MiB       -O--CK   100   100   000    -    13905039
                            ||||||_ K auto-keep
                            |||||__ C event count
                            ||||___ R error rate
                            |||____ S speed/performance
                            ||_____ O updated online
                            |______ P prefailure warning

General Purpose Log Directory Version 1
SMART           Log Directory Version 1 [multi-sector log support]
Address    Access  R/W   Size  Description
0x00       GPL,SL  R/O      1  Log Directory
0x01           SL  R/O      1  Summary SMART error log
0x02           SL  R/O      8  Comprehensive SMART error log
0x03       GPL     R/O     20  Ext. Comprehensive SMART error log
0x04       GPL,SL  R/O      8  Device Statistics log
0x06           SL  R/O      1  SMART self-test log
0x07       GPL     R/O      2  Extended self-test log
0x08       GPL     R/O      2  Power Conditions log
0x09           SL  R/W      1  Selective self-test log
0x10       GPL     R/O      1  NCQ Command Error log
0x11       GPL     R/O      1  SATA Phy Event Counters log
0x30       GPL,SL  R/O      9  IDENTIFY DEVICE data log
0x80-0x9f  GPL,SL  R/W     16  Host vendor specific log
0xb8       GPL,SL  VS       1  Device vendor specific log
0xb9       GPL     VS    3336  Device vendor specific log
0xb9       SL      VS       8  Device vendor specific log
0xba       GPL     VS    1280  Device vendor specific log
0xe0       GPL,SL  R/W      1  SCT Command/Status
0xe1       GPL,SL  R/W      8  SCT Data Transfer

SMART Extended Comprehensive Error Log Version: 1 (20 sectors)
Device Error Count: 507 (device log contains only the most recent 80 errors)
	CR     = Command Register
	FEATR  = Features Register
	COUNT  = Count (was: Sector Count) Register
	LBA_48 = Upper bytes of LBA High/Mid/Low Registers ]  ATA-8
	LH     = LBA High (was: Cylinder High) Register    ]   LBA
	LM     = LBA Mid (was: Cylinder Low) Register      ] Register
	LL     = LBA Low (was: Sector Number) Register     ]
	DV     = Device (was: Device/Head) Register
	DC     = Device Control Register
	ER     = Error register
	ST     = Status register
Powered_Up_Time is measured from power on, and printed as
DDd+hh:mm:SS.sss where DD=days, hh=hours, mm=minutes,
SS=sec, and sss=millisec. It "wraps" after 49.710 days.

Error 507 [26] occurred at disk power-on lifetime: 25550 hours (1064 days + 14 hours)
  When the command that caused the error occurred, the device was active or idle.

  After command completion occurred, registers were:
  ER -- ST COUNT  LBA_48  LH LM LL DV DC
  -- -- -- == -- == == == -- -- -- -- --
  84 -- 41 00 00 00 00 55 c5 f8 50 40 00  Error: ICRC, ABRT at LBA = 0x55c5f850 = 1439037520

  Commands leading to the command that caused the error were:
  CR FEATR COUNT  LBA_48  LH LM LL DV DC  Powered_Up_Time  Command/Feature_Name
  -- == -- == -- == == == -- -- -- -- --  ---------------  --------------------
  60 00 20 00 00 00 00 55 c5 f8 50 40 00     10:34:25.462  READ FPDMA QUEUED
  61 00 d8 00 08 00 00 37 c4 0a 60 40 00     10:34:25.462  WRITE FPDMA QUEUED
  61 00 08 00 08 00 00 2b 1f 2e f8 40 00     10:34:25.462  WRITE FPDMA QUEUED
  60 00 20 00 00 00 00 55 c5 f8 20 40 00     10:34:25.462  READ FPDMA QUEUED
  61 01 00 00 08 00 00 55 46 e0 00 40 00     10:34:25.141  WRITE FPDMA QUEUED

Error 506 [25] occurred at disk power-on lifetime: 25550 hours (1064 days + 14 hours)
  When the command that caused the error occurred, the device was active or idle.

  After command completion occurred, registers were:
  ER -- ST COUNT  LBA_48  LH LM LL DV DC
  -- -- -- == -- == == == -- -- -- -- --
  84 -- 41 00 00 00 00 40 6c 13 00 40 00  Error: ICRC, ABRT at LBA = 0x406c1300 = 1080824576

  Commands leading to the command that caused the error were:
  CR FEATR COUNT  LBA_48  LH LM LL DV DC  Powered_Up_Time  Command/Feature_Name
  -- == -- == -- == == == -- -- -- -- --  ---------------  --------------------
  60 01 00 00 00 00 00 40 6c 13 00 40 00     10:33:38.733  READ FPDMA QUEUED
  61 01 00 00 08 00 00 53 b8 e8 00 40 00     10:33:38.732  WRITE FPDMA QUEUED
  60 01 00 00 18 00 00 40 6c 12 00 40 00     10:33:38.712  READ FPDMA QUEUED
  60 01 00 00 10 00 00 40 6c 11 00 40 00     10:33:38.711  READ FPDMA QUEUED
  60 01 00 00 08 00 00 40 6c 10 00 40 00     10:33:38.711  READ FPDMA QUEUED

Error 505 [24] occurred at disk power-on lifetime: 25550 hours (1064 days + 14 hours)
  When the command that caused the error occurred, the device was active or idle.

  After command completion occurred, registers were:
  ER -- ST COUNT  LBA_48  LH LM LL DV DC
  -- -- -- == -- == == == -- -- -- -- --
  84 -- 41 00 38 00 00 53 a9 99 00 40 00  Error: ICRC, ABRT at LBA = 0x53a99900 = 1403623680

  Commands leading to the command that caused the error were:
  CR FEATR COUNT  LBA_48  LH LM LL DV DC  Powered_Up_Time  Command/Feature_Name
  -- == -- == -- == == == -- -- -- -- --  ---------------  --------------------
  61 01 00 00 38 00 00 53 a9 99 00 40 00     10:33:29.888  WRITE FPDMA QUEUED
  61 01 00 00 28 00 00 53 70 8c 00 40 00     10:33:29.888  WRITE FPDMA QUEUED
  61 01 00 00 40 00 00 53 a9 9a 00 40 00     10:33:29.888  WRITE FPDMA QUEUED
  61 01 00 00 30 00 00 53 a9 98 00 40 00     10:33:29.888  WRITE FPDMA QUEUED
  61 01 00 00 48 00 00 53 a9 9b 00 40 00     10:33:29.888  WRITE FPDMA QUEUED

Error 504 [23] occurred at disk power-on lifetime: 25550 hours (1064 days + 14 hours)
  When the command that caused the error occurred, the device was active or idle.

  After command completion occurred, registers were:
  ER -- ST COUNT  LBA_48  LH LM LL DV DC
  -- -- -- == -- == == == -- -- -- -- --
  84 -- 51 00 00 00 00 53 a9 95 00 40 00  Error: ICRC, ABRT at LBA = 0x53a99500 = 1403622656

  Commands leading to the command that caused the error were:
  CR FEATR COUNT  LBA_48  LH LM LL DV DC  Powered_Up_Time  Command/Feature_Name
  -- == -- == -- == == == -- -- -- -- --  ---------------  --------------------
  61 01 00 00 00 00 00 53 a9 95 00 40 00     10:33:28.640  WRITE FPDMA QUEUED
  ef 00 02 00 00 00 00 00 00 00 00 00 00     10:33:28.387  SET FEATURES [Enable write cache]
  ef 00 aa 00 00 00 00 00 00 00 00 00 00     10:33:28.387  SET FEATURES [Enable read look-ahead]
  ef 00 03 00 46 00 00 00 00 00 00 00 00     10:33:28.387  SET FEATURES [Set transfer mode]
  ef 00 03 00 0c 00 00 00 00 00 00 00 00     10:33:28.387  SET FEATURES [Set transfer mode]

Error 503 [22] occurred at disk power-on lifetime: 25550 hours (1064 days + 14 hours)
  When the command that caused the error occurred, the device was active or idle.

  After command completion occurred, registers were:
  ER -- ST COUNT  LBA_48  LH LM LL DV DC
  -- -- -- == -- == == == -- -- -- -- --
  84 -- 41 00 08 00 00 53 70 7a 00 40 00  Error: ICRC, ABRT at LBA = 0x53707a00 = 1399880192

  Commands leading to the command that caused the error were:
  CR FEATR COUNT  LBA_48  LH LM LL DV DC  Powered_Up_Time  Command/Feature_Name
  -- == -- == -- == == == -- -- -- -- --  ---------------  --------------------
  61 01 00 00 08 00 00 53 70 7a 00 40 00     10:33:20.996  WRITE FPDMA QUEUED
  61 01 00 00 00 00 00 53 70 79 00 40 00     10:33:20.996  WRITE FPDMA QUEUED
  61 01 00 00 08 00 00 53 70 78 00 40 00     10:33:20.996  WRITE FPDMA QUEUED
  61 01 00 00 00 00 00 53 70 77 00 40 00     10:33:20.995  WRITE FPDMA QUEUED
  61 01 00 00 00 00 00 53 70 76 00 40 00     10:33:20.995  WRITE FPDMA QUEUED

Error 502 [21] occurred at disk power-on lifetime: 25550 hours (1064 days + 14 hours)
  When the command that caused the error occurred, the device was active or idle.

  After command completion occurred, registers were:
  ER -- ST COUNT  LBA_48  LH LM LL DV DC
  -- -- -- == -- == == == -- -- -- -- --
  84 -- 41 00 40 00 00 53 54 90 00 40 00  Error: ICRC, ABRT at LBA = 0x53549000 = 1398050816

  Commands leading to the command that caused the error were:
  CR FEATR COUNT  LBA_48  LH LM LL DV DC  Powered_Up_Time  Command/Feature_Name
  -- == -- == -- == == == -- -- -- -- --  ---------------  --------------------
  61 01 00 00 40 00 00 53 54 90 00 40 00     10:32:55.377  WRITE FPDMA QUEUED
  61 01 00 00 00 00 00 53 54 88 00 40 00     10:32:55.377  WRITE FPDMA QUEUED
  61 01 00 00 38 00 00 53 54 8f 00 40 00     10:32:55.377  WRITE FPDMA QUEUED
  61 01 00 00 30 00 00 53 54 8e 00 40 00     10:32:55.377  WRITE FPDMA QUEUED
  61 01 00 00 28 00 00 53 54 8d 00 40 00     10:32:55.377  WRITE FPDMA QUEUED

Error 501 [20] occurred at disk power-on lifetime: 25550 hours (1064 days + 14 hours)
  When the command that caused the error occurred, the device was active or idle.

  After command completion occurred, registers were:
  ER -- ST COUNT  LBA_48  LH LM LL DV DC
  -- -- -- == -- == == == -- -- -- -- --
  84 -- 41 00 08 00 00 53 54 69 00 40 00  Error: ICRC, ABRT at LBA = 0x53546900 = 1398040832

  Commands leading to the command that caused the error were:
  CR FEATR COUNT  LBA_48  LH LM LL DV DC  Powered_Up_Time  Command/Feature_Name
  -- == -- == -- == == == -- -- -- -- --  ---------------  --------------------
  61 01 00 00 08 00 00 53 54 69 00 40 00     10:32:42.856  WRITE FPDMA QUEUED
  61 01 00 00 00 00 00 53 54 68 00 40 00     10:32:42.855  WRITE FPDMA QUEUED
  61 01 00 00 00 00 00 53 54 67 00 40 00     10:32:42.855  WRITE FPDMA QUEUED
  61 01 00 00 00 00 00 53 54 66 00 40 00     10:32:42.855  WRITE FPDMA QUEUED
  ea 00 00 00 00 00 00 00 00 00 00 00 00     10:32:42.854  FLUSH CACHE EXT

Error 500 [19] occurred at disk power-on lifetime: 25550 hours (1064 days + 14 hours)
  When the command that caused the error occurred, the device was active or idle.

  After command completion occurred, registers were:
  ER -- ST COUNT  LBA_48  LH LM LL DV DC
  -- -- -- == -- == == == -- -- -- -- --
  84 -- 41 00 10 00 00 53 a8 b2 00 40 00  Error: ICRC, ABRT at LBA = 0x53a8b200 = 1403564544

  Commands leading to the command that caused the error were:
  CR FEATR COUNT  LBA_48  LH LM LL DV DC  Powered_Up_Time  Command/Feature_Name
  -- == -- == -- == == == -- -- -- -- --  ---------------  --------------------
  61 01 00 00 10 00 00 53 a8 b2 00 40 00     10:32:29.945  WRITE FPDMA QUEUED
  61 01 00 00 08 00 00 53 a8 b1 00 40 00     10:32:29.945  WRITE FPDMA QUEUED
  61 01 00 00 00 00 00 53 a8 b0 00 40 00     10:32:29.945  WRITE FPDMA QUEUED
  61 01 00 00 10 00 00 53 54 47 00 40 00     10:32:29.945  WRITE FPDMA QUEUED
  61 01 00 00 08 00 00 53 54 46 00 40 00     10:32:29.945  WRITE FPDMA QUEUED

SMART Extended Self-test Log Version: 1 (2 sectors)
No self-tests have been logged.  [To run self-tests, use: smartctl -t]

SMART Selective self-test log data structure revision number 1
 SPAN  MIN_LBA  MAX_LBA  CURRENT_TEST_STATUS
    1        0        0  Not_testing
    2        0        0  Not_testing
    3        0        0  Not_testing
    4        0        0  Not_testing
    5        0        0  Not_testing
Selective self-test flags (0x0):
  After scanning selected spans, do NOT read-scan remainder of disk.
If Selective self-test is pending on power-up, resume after 0 minute delay.

SCT Status Version:                  3
SCT Version (vendor specific):       1 (0x0001)
Device State:                        Active (0)
Current Temperature:                    29 Celsius
Power Cycle Min/Max Temperature:     25/37 Celsius
Lifetime    Min/Max Temperature:     11/37 Celsius
Specified Max Operating Temperature:    73 Celsius
Under/Over Temperature Limit Count:   0/0
Vendor specific:
00 00 2c 01 00 00 00 00 00 00 00 00 00 00 00 00
00 00 00 00 00 00 00 00 00 00 00 00 00 00 00 00

SCT Temperature History Version:     2
Temperature Sampling Period:         1 minute
Temperature Logging Interval:        1 minute
Min/Max recommended Temperature:      0/73 Celsius
Min/Max Temperature Limit:            0/73 Celsius
Temperature History Size (Index):    478 (109)

Device Statistics (GP Log 0x04)
Page  Offset Size        Value Flags Description
0x01  =====  =               =  ===  == General Statistics (rev 2) ==
0x01  0x008  4              15  ---  Lifetime Power-On Resets
0x01  0x018  6    314244084397  ---  Logical Sectors Written
0x01  0x020  6      7075116196  ---  Number of Write Commands
0x01  0x028  6    425776278494  ---  Logical Sectors Read
0x01  0x030  6      2485407506  ---  Number of Read Commands
0x01  0x038  6      2080353530  ---  Date and Time TimeStamp
0x04  =====  =               =  ===  == General Errors Statistics (rev 1) ==
0x04  0x008  4               0  ---  Number of Reported Uncorrectable Errors
0x04  0x010  4               0  ---  Resets Between Cmd Acceptance and Completion
0x05  =====  =               =  ===  == Temperature Statistics (rev 1) ==
0x05  0x008  1              29  ---  Current Temperature
0x05  0x010  1              28  ---  Average Short Term Temperature
0x05  0x018  1              28  ---  Average Long Term Temperature
0x05  0x020  1              36  ---  Highest Temperature
0x05  0x028  1              11  ---  Lowest Temperature
0x05  0x030  1              31  ---  Highest Average Short Term Temperature
0x05  0x038  1              11  ---  Lowest Average Short Term Temperature
0x05  0x040  1              29  ---  Highest Average Long Term Temperature
0x05  0x048  1              12  ---  Lowest Average Long Term Temperature
0x05  0x050  4               0  ---  Time in Over-Temperature
0x05  0x058  1              73  ---  Specified Maximum Operating Temperature
0x05  0x060  4               0  ---  Time in Under-Temperature
0x05  0x068  1               0  ---  Specified Minimum Operating Temperature
0x06  =====  =               =  ===  == Transport Statistics (rev 1) ==
0x06  0x008  4             685  ---  Number of Hardware Resets
0x06  0x010  4             312  ---  Number of ASR Events
0x06  0x018  4             279  ---  Number of Interface CRC Errors
0x07  =====  =               =  ===  == Solid State Device Statistics (rev 1) ==
0x07  0x008  1               3  ---  Percentage Used Endurance Indicator
                                |||_ C monitored condition met
                                ||__ D supports DSN
                                |___ N normalized value

SATA Phy Event Counters (GP Log 0x11)
ID      Size     Value  Description
0x0001  4          279  Command failed due to ICRC error
0x0002  4          279  R_ERR response for data FIS
0x0003  4          278  R_ERR response for device-to-host data FIS
0x0004  4            1  R_ERR response for host-to-device data FIS
0x0005  4           92  R_ERR response for non-data FIS
0x0006  4           92  R_ERR response for device-to-host non-data FIS
0x0007  4            0  R_ERR response for host-to-device non-data FIS
0x000a  4          677  Device-to-host register FISes sent due to a COMRESET
0x000b  4            0  CRC errors within host-to-device FIS
0x000d  4            0  Non-CRC errors within host-to-device FIS

