smartctl 7.1 2020-06-20 r5066 [x86_64-linux-3.10.0-1160...] (local build)
Copyright (C) 2002-19, Bruce Allen, Christian Franke, www.smartmontools.org

=== START OF INFORMATION SECTION ===
Model Number:                       KINGSTON SEDC1500M3840G
Serial Number:                      --
Firmware Version:                   S67F0103
PCI Vendor/Subsystem ID:            0x2646
IEEE OUI Identifier:                0x0026b7
Total NVM Capacity:                 3,840,755,982,336 [3.84 TB]
Unallocated NVM Capacity:           0
Controller ID:                      1
Number of Namespaces:               64
Namespace 1 Size/Capacity:          3,840,755,982,336 [3.84 TB]
Namespace 1 Formatted LBA Size:     512
Namespace 1 IEEE EUI-64:            0026b7 ...
Local Time is:                      Mon Mar ... 2024 MSK

=== START OF READ SMART DATA SECTION ===
SMART overall-health self-assessment test result: PASSED

SMART/Health Information (NVMe Log 0x02)
Critical Warning:                   0x00
Temperature:                        25 Celsius
Available Spare:                    100%
Available Spare Threshold:          10%
Percentage Used:                    1%
Data Units Read:                    158,382,796 [81.0 TB]
Data Units Written:                 342,205,098 [175 TB]
Host Read Commands:                 2,803,013,398
Host Write Commands:                1,851,342,780
Controller Busy Time:               23,779
Power Cycles:                       102
Power On Hours:                     8,382
Unsafe Shutdowns:                   72
Media and Data Integrity Errors:    0
Error Information Log Entries:      0
Warning  Comp. Temperature Time:    0
Critical Comp. Temperature Time:    0

