smartctl 7.1 2020-06-20 r5066 [x86_64-linux-3.10.0-1062...] (local build)
Copyright (C) 2002-19, Bruce Allen, Christian Franke, www.smartmontools.org

=== START OF INFORMATION SECTION ===
Model Number:                       SAMSUNG MZQLW960HMJP-00003
Serial Number:                      --
Firmware Version:                   CXV8301Q
PCI Vendor/Subsystem ID:            0x144d
IEEE OUI Identifier:                0x002538
Total NVM Capacity:                 960,197,124,096 [960 GB]
Unallocated NVM Capacity:           0
Controller ID:                      2
Number of Namespaces:               1
Namespace 1 Size/Capacity:          960,197,124,096 [960 GB]
Namespace 1 Utilization:            917,192,441,856 [917 GB]
Namespace 1 Formatted LBA Size:     512
Local Time is:                      --

=== START OF READ SMART DATA SECTION ===
SMART overall-health self-assessment test result: PASSED

SMART/Health Information (NVMe Log 0x02)
Critical Warning:                   0x00
Temperature:                        43 Celsius
Available Spare:                    100%
Available Spare Threshold:          10%
Percentage Used:                    3%
Data Units Read:                    77,584,307 [39.7 TB]
Data Units Written:                 232,798,086 [119 TB]
Host Read Commands:                 2,859,047,935
Host Write Commands:                8,210,918,450
Controller Busy Time:               5,363
Power Cycles:                       27
Power On Hours:                     19,105
Unsafe Shutdowns:                   18
Media and Data Integrity Errors:    0
Error Information Log Entries:      4
Warning  Comp. Temperature Time:    0
Critical Comp. Temperature Time:    0
Temperature Sensor 1:               43 Celsius

