smartctl 7.0 2019-08-20 r4949 [x86_64-linux-3.10.0-1062...] (local build)
Copyright (C) 2002-18, Bruce Allen, Christian Franke, www.smartmontools.org

=== START OF INFORMATION SECTION ===
Model Number:                       SAMSUNG MZQLW960HMJP-00003
Serial Number:                      --
Firmware Version:                   CXV8001Q
PCI Vendor/Subsystem ID:            0x144d
IEEE OUI Identifier:                0x002538
Total NVM Capacity:                 960,197,124,096 [960 GB]
Unallocated NVM Capacity:           0
Controller ID:                      2
Number of Namespaces:               1
Namespace 1 Size/Capacity:          960,197,124,096 [960 GB]
Namespace 1 Utilization:            942,876,180,480 [942 GB]
Namespace 1 Formatted LBA Size:     512
Local Time is:                      Sat May ... 2021 WIB

=== START OF READ SMART DATA SECTION ===
SMART overall-health self-assessment test result: PASSED

SMART/Health Information (NVMe Log 0x02)
Critical Warning:                   0x00
Temperature:                        29 Celsius
Available Spare:                    99%
Available Spare Threshold:          10%
Percentage Used:                    6%
Data Units Read:                    923,361,730 [472 TB]
Data Units Written:                 547,312,473 [280 TB]
Host Read Commands:                 9,601,064,928
Host Write Commands:                10,048,532,870
Controller Busy Time:               18,916
Power Cycles:                       14
Power On Hours:                     41,598
Unsafe Shutdowns:                   10
Media and Data Integrity Errors:    1
Error Information Log Entries:      15
Warning  Comp. Temperature Time:    0
Critical Comp. Temperature Time:    0
Temperature Sensor 1:               29 Celsius

