smartctl 7.4 2023-08-01 r5530 [x86_64-linux-3.10.0-1160...] (local build)
Copyright (C) 2002-23, Bruce Allen, Christian Franke, www.smartmontools.org

=== START OF INFORMATION SECTION ===
Model Number:                       SAMSUNG MZVLW256HEHP-000L7
Serial Number:                      --
Firmware Version:                   5L7QCXB7
PCI Vendor/Subsystem ID:            0x144d
IEEE OUI Identifier:                0x002538
Total NVM Capacity:                 256,060,514,304 [256 GB]
Unallocated NVM Capacity:           0
Controller ID:                      2
NVMe Version:                       1.2
Number of Namespaces:               1
Namespace 1 Size/Capacity:          256,060,514,304 [256 GB]
Namespace 1 Utilization:            22,800,654,336 [22.8 GB]
Namespace 1 Formatted LBA Size:     512
Namespace 1 IEEE EUI-64:            002538 ...
Local Time is:                      Sun Aug ... 2024 MSK

=== START OF READ SMART DATA SECTION ===
SMART overall-health self-assessment test result: PASSED

SMART/Health Information (NVMe Log 0x02)
Critical Warning:                   0x00
Temperature:                        47 Celsius
Available Spare:                    100%
Available Spare Threshold:          10%
Percentage Used:                    1%
Data Units Read:                    18,341,089 [9.39 TB]
Data Units Written:                 12,524,668 [6.41 TB]
Host Read Commands:                 278,685,379
Host Write Commands:                207,960,624
Controller Busy Time:               704
Power Cycles:                       2,062
Power On Hours:                     298
Unsafe Shutdowns:                   97
Media and Data Integrity Errors:    0
Error Information Log Entries:      2,905
Warning  Comp. Temperature Time:    0
Critical Comp. Temperature Time:    0
Temperature Sensor 1:               47 Celsius
Temperature Sensor 2:               62 Celsius

Error Information (NVMe Log 0x01, 16 of 64 entries)
Num   ErrCount  SQId   CmdId  Status  PELoc          LBA  NSID    VS  Message
  0       2905     0  0x2014  0x4004      -            0     0     -  Invalid Field in Command
  1       2904     0  0x4019  0x4004      -            0     0     -  Invalid Field in Command
  2       2903     0  0x300e  0x4004      -            0     0     -  Invalid Field in Command
  3       2902     0  0x401a  0x4004      -            0     0     -  Invalid Field in Command
  4       2901     0  0x1001  0x4004      -            0     0     -  Invalid Field in Command
  5       2900     0  0x0012  0x4212  0x028            0     -     -  Invalid Log Page
  6       2899     0  0x001a  0x4004  0x02c            0     0     -  Invalid Field in Command
  7       2898     0  0x0019  0x4004  0x02c            0     0     -  Invalid Field in Command
  8       2897     0  0x0015  0x4212  0x028            0     -     -  Invalid Log Page
  9       2896     0  0x0002  0x4004  0x028            0     0     -  Invalid Field in Command
 10       2895     0  0x001a  0x4004  0x02c            0     0     -  Invalid Field in Command
 11       2894     0  0x0019  0x4004  0x02c            0     0     -  Invalid Field in Command
 12       2893     0  0x0015  0x4212  0x028            0     -     -  Invalid Log Page
 13       2892     0  0x0002  0x4004  0x028            0     0     -  Invalid Field in Command
 14       2891     0  0x001a  0x4004  0x02c            0     0     -  Invalid Field in Command
 15       2890     0  0x0019  0x4004  0x02c            0     0     -  Invalid Field in Command
... (48 entries not read)

Self-test Log (NVMe Log 0x06)
Self-test status: No self-test in progress
No Self-tests Logged

