smartctl 7.1 2020-06-20 r5066 [x86_64-linux-3.10.0-1127...] (local build)
Copyright (C) 2002-19, Bruce Allen, Christian Franke, www.smartmontools.org

=== START OF INFORMATION SECTION ===
Model Number:                       Samsung SSD 970 PRO 512GB
Serial Number:                      --
Firmware Version:                   1B2QEXP7
PCI Vendor/Subsystem ID:            0x144d
IEEE OUI Identifier:                0x002538
Total NVM Capacity:                 512,110,190,592 [512 GB]
Unallocated NVM Capacity:           0
Controller ID:                      4
Number of Namespaces:               1
Namespace 1 Size/Capacity:          512,110,190,592 [512 GB]
Namespace 1 Utilization:            221,047,943,168 [221 GB]
Namespace 1 Formatted LBA Size:     512
Namespace 1 IEEE EUI-64:            002538 ...
Local Time is:                      Fri Apr ... 2022 CEST

=== START OF READ SMART DATA SECTION ===
SMART overall-health self-assessment test result: FAILED!
- NVM subsystem reliability has been degraded

SMART/Health Information (NVMe Log 0x02)
Critical Warning:                   0x04
Temperature:                        55 Celsius
Available Spare:                    100%
Available Spare Threshold:          10%
Percentage Used:                    204%
Data Units Read:                    1,030,627,857 [527 TB]
Data Units Written:                 2,339,451,931 [1.19 PB]
Host Read Commands:                 17,703,610,908
Host Write Commands:                27,605,366,676
Controller Busy Time:               16,298,651,218
Power Cycles:                       15
Power On Hours:                     28,666
Unsafe Shutdowns:                   7
Media and Data Integrity Errors:    0
Error Information Log Entries:      0
Warning  Comp. Temperature Time:    0
Critical Comp. Temperature Time:    0
Temperature Sensor 1:               55 Celsius
Temperature Sensor 2:               62 Celsius

