smartctl 7.1 2020-06-20 r5066 [x86_64-linux-3.10.0-1160...] (local build)
Copyright (C) 2002-19, Bruce Allen, Christian Franke, www.smartmontools.org

=== START OF INFORMATION SECTION ===
Model Family:     Samsung based SSDs
Device Model:     Samsung SSD 850 EVO 2TB
Serial Number:    --
LU WWN Device Id: 5 002538 ...
Firmware Version: EMT02B6Q
User Capacity:    2,000,398,934,016 bytes [2.00 TB]
Sector Size:      512 bytes logical/physical
Rotation Rate:    Solid State Device
Form Factor:      2.5 inches
Device is:        In smartctl database [for details use: -P show]
ATA Version is:   ACS-2, ATA8-ACS T13/1699-D revision 4c
SATA Version is:  SATA 3.1, 6.0 Gb/s (current: 6.0 Gb/s)
Local Time is:    --
Rd look-ahead is: Enabled
Write cache is:   Enabled
ATA Security is:  Disabled, frozen [SEC2]

=== START OF READ SMART DATA SECTION ===
SMART overall-health self-assessment test result: PASSED

General SMART Values:
Offline data collection status:  (0x00)	Offline data collection activity
					was never started.

Self-test execution status:      (   0)	The previous self-test routine completed
					without error or no self-test has ever 
					been run.
Total time to complete Offline 
data collection: 		(    0) seconds.
Offline data collection
capabilities: 			 (0x53) SMART execute Offline immediate.

					Suspend Offline collection upon new
					command.
					No Offline surface scan supported.
					Self-test supported.
					No Conveyance Self-test supported.
					Selective Self-test supported.
SMART capabilities:            (0x0003)	Saves SMART data before entering
					power-saving mode.

Error logging capability:        (0x01)	Error logging supported.
					General Purpose Logging supported.
Short self-test routine 
recommended polling time: 	 (   2) minutes.
Extended self-test routine
recommended polling time: 	 ( 265) minutes.
SCT capabilities: 	       (0x003d)	SCT Status supported.
					SCT Error Recovery Control supported.
					SCT Feature Control supported.
					SCT Data Table supported.

SMART Attributes Data Structure revision number: 1
Vendor Specific SMART Attributes with Thresholds:
ID# ATTRIBUTE_NAME          FLAGS    VALUE WORST THRESH FAIL RAW_VALUE
  5 Reallocated_Sector_Ct   PO--CK   099   099   010    -    33
  9 Power_On_Hours          -O--CK   091   091   000    -    43186
 12 Power_Cycle_Count       -O--CK   099   099   000    -    24
177 Wear_Leveling_Count     PO--C-   053   053   000    -    990
179 Used_Rsvd_Blk_Cnt_Tot   PO--C-   099   099   010    -    33
181 Program_Fail_Cnt_Total  -O--CK   100   100   010    -    0
182 Erase_Fail_Count_Total  -O--CK   100   100   010    -    0
183 Runtime_Bad_Block       PO--C-   099   099   010    -    33
187 Uncorrectable_Error_Cnt -O--CK   099   099   000    -    55
190 Airflow_Temperature_Cel -O--CK   072   052   000    -    28
195 ECC_Error_Rate          -O-RC-   199   199   000    -    55
199 CRC_Error_Count         -OSRCK   100   100   000    -    0
235 POR_Recovery_Count      -O--C-   099   099   000    -    12
241 Total_LBAs_Written      -O--CK   099   099   000    -    556534110776
                            ||||||_ K auto-keep
                            |||||__ C event count
                            ||||___ R error rate
                            |||____ S speed/performance
                            ||_____ O updated online
                            |______ P prefailure warning

General Purpose Log Directory Version 1
SMART           Log Directory Version 1 [multi-sector log support]
Address    Access  R/W   Size  Description
0x00       GPL,SL  R/O      1  Log Directory
0x01           SL  R/O      1  Summary SMART error log
0x02           SL  R/O      1  Comprehensive SMART error log
0x03       GPL     R/O      1  Ext. Comprehensive SMART error log
0x06           SL  R/O      1  SMART self-test log
0x07       GPL     R/O      1  Extended self-test log
0x09           SL  R/W      1  Selective self-test log
0x10       GPL     R/O      1  NCQ Command Error log
0x11       GPL     R/O      1  SATA Phy Event Counters log
0x13       GPL     R/O      1  SATA NCQ Send and Receive log
0x30       GPL,SL  R/O      9  IDENTIFY DEVICE data log
0x80-0x9f  GPL,SL  R/W     16  Host vendor specific log
0xa1           SL  VS      16  Device vendor specific log
0xa5           SL  VS      16  Device vendor specific log
0xce           SL  VS      16  Device vendor specific log
0xe0       GPL,SL  R/W      1  SCT Command/Status
0xe1       GPL,SL  R/W      1  SCT Data Transfer

SMART Extended Comprehensive Error Log Version: 1 (1 sectors)
Device Error Count: 55 (device log contains only the most recent 4 errors)
	CR     = Command Register
	FEATR  = Features Register
	COUNT  = Count (was: Sector Count) Register
	LBA_48 = Upper bytes of LBA High/Mid/Low Registers ]  ATA-8
	LH     = LBA High (was: Cylinder High) Register    ]   LBA
	LM     = LBA Mid (was: Cylinder Low) Register      ] Register
	LL     = LBA Low (was: Sector Number) Register     ]
	DV     = Device (was: Device/Head) Register
	DC     = Device Control Register
	ER     = Error register
	ST     = Status register
Powered_Up_Time is measured from power on, and printed as
DDd+hh:mm:SS.sss where DD=days, hh=hours, mm=minutes,
SS=sec, and sss=millisec. It "wraps" after 49.710 days.

Error 55 [2] occurred at disk power-on lifetime: 42559 hours (1773 days + 7 hours)
  When the command that caused the error occurred, the device was active or idle.

  After command completion occurred, registers were:
  ER -- ST COUNT  LBA_48  LH LM LL DV DC
  -- -- -- == -- == == == -- -- -- -- --
  40 -- 51 00 c0 00 00 0b 73 29 00 40 00  Error: UNC at LBA = 0x0b732900 = 192096512

  Commands leading to the command that caused the error were:
  CR FEATR COUNT  LBA_48  LH LM LL DV DC  Powered_Up_Time  Command/Feature_Name
  -- == -- == -- == == == -- -- -- -- --  ---------------  --------------------
  60 01 00 00 c0 00 00 0b 73 29 00 40 18 39d+ ...          READ FPDMA QUEUED
  60 01 00 00 b8 00 00 0b 73 28 00 40 17 39d+ ...          READ FPDMA QUEUED
  60 01 00 00 b0 00 00 0b 73 27 00 40 16 39d+ ...          READ FPDMA QUEUED
  60 01 00 00 a8 00 00 0b 73 26 00 40 15 39d+ ...          READ FPDMA QUEUED
  60 01 00 00 a0 00 00 0b 73 25 00 40 14 39d+ ...          READ FPDMA QUEUED

Error 54 [1] occurred at disk power-on lifetime: 42559 hours (1773 days + 7 hours)
  When the command that caused the error occurred, the device was active or idle.

  After command completion occurred, registers were:
  ER -- ST COUNT  LBA_48  LH LM LL DV DC
  -- -- -- == -- == == == -- -- -- -- --
  40 -- 51 00 40 00 00 e0 54 5a 00 40 00  Error: UNC at LBA = 0xe0545a00 = 3763624448

  Commands leading to the command that caused the error were:
  CR FEATR COUNT  LBA_48  LH LM LL DV DC  Powered_Up_Time  Command/Feature_Name
  -- == -- == -- == == == -- -- -- -- --  ---------------  --------------------
  60 01 00 00 40 00 00 e0 54 5a 00 40 08 39d+ ...          READ FPDMA QUEUED
  60 01 00 00 38 00 00 e0 54 59 00 40 07 39d+ ...          READ FPDMA QUEUED
  60 01 00 00 30 00 00 e0 54 58 00 40 06 39d+ ...          READ FPDMA QUEUED
  60 01 00 00 28 00 00 e0 54 57 00 40 05 39d+ ...          READ FPDMA QUEUED
  60 01 00 00 20 00 00 e0 54 56 00 40 04 39d+ ...          READ FPDMA QUEUED

Error 53 [0] occurred at disk power-on lifetime: 42559 hours (1773 days + 7 hours)
  When the command that caused the error occurred, the device was active or idle.

  After command completion occurred, registers were:
  ER -- ST COUNT  LBA_48  LH LM LL DV DC
  -- -- -- == -- == == == -- -- -- -- --
  40 -- 51 00 28 00 00 de d2 e3 00 40 00  Error: UNC at LBA = 0xded2e300 = 3738362624

  Commands leading to the command that caused the error were:
  CR FEATR COUNT  LBA_48  LH LM LL DV DC  Powered_Up_Time  Command/Feature_Name
  -- == -- == -- == == == -- -- -- -- --  ---------------  --------------------
  60 01 00 00 28 00 00 de d2 e3 00 40 05 39d+ ...          READ FPDMA QUEUED
  60 01 00 00 20 00 00 de d2 e2 00 40 04 39d+ ...          READ FPDMA QUEUED
  60 01 00 00 18 00 00 de d2 e1 00 40 03 39d+ ...          READ FPDMA QUEUED
  60 01 00 00 10 00 00 de d2 e0 00 40 02 39d+ ...          READ FPDMA QUEUED
  60 01 00 00 08 00 00 de d2 df 00 40 01 39d+ ...          READ FPDMA QUEUED

Error 52 [3] occurred at disk power-on lifetime: 42559 hours (1773 days + 7 hours)
  When the command that caused the error occurred, the device was active or idle.

  After command completion occurred, registers were:
  ER -- ST COUNT  LBA_48  LH LM LL DV DC
  -- -- -- == -- == == == -- -- -- -- --
  40 -- 51 00 28 00 00 c8 80 02 00 40 00  Error: UNC at LBA = 0xc8800200 = 3363832320

  Commands leading to the command that caused the error were:
  CR FEATR COUNT  LBA_48  LH LM LL DV DC  Powered_Up_Time  Command/Feature_Name
  -- == -- == -- == == == -- -- -- -- --  ---------------  --------------------
  60 01 00 00 28 00 00 c8 80 02 00 40 05 39d+ ...          READ FPDMA QUEUED
  60 01 00 00 20 00 00 c8 80 01 00 40 04 39d+ ...          READ FPDMA QUEUED
  60 01 00 00 18 00 00 c8 80 00 00 40 03 39d+ ...          READ FPDMA QUEUED
  60 01 00 00 10 00 00 c8 7f ff 00 40 02 39d+ ...          READ FPDMA QUEUED
  60 01 00 00 08 00 00 c8 7f fe 00 40 01 39d+ ...          READ FPDMA QUEUED

SMART Extended Self-test Log Version: 1 (1 sectors)
No self-tests have been logged.  [To run self-tests, use: smartctl -t]

SMART Selective self-test log data structure revision number 1
 SPAN  MIN_LBA  MAX_LBA  CURRENT_TEST_STATUS
    1        0        0  Not_testing
    2        0        0  Not_testing
    3        0        0  Not_testing
    4        0        0  Not_testing
    5        0        0  Not_testing
  255        0    65535  Read_scanning was never started
Selective self-test flags (0x0):
  After scanning selected spans, do NOT read-scan remainder of disk.
If Selective self-test is pending on power-up, resume after 0 minute delay.

SCT Status Version:                  3
SCT Version (vendor specific):       256 (0x0100)
Device State:                        Active (0)
Current Temperature:                    28 Celsius
Power Cycle Min/Max Temperature:     23/34 Celsius
Lifetime    Min/Max Temperature:     21/47 Celsius
Under/Over Temperature Limit Count:   0/0

SCT Temperature History Version:     2
Temperature Sampling Period:         1 minute
Temperature Logging Interval:        10 minutes
Min/Max recommended Temperature:      0/70 Celsius
Min/Max Temperature Limit:            0/70 Celsius
Temperature History Size (Index):    128 (31)

SCT Error Recovery Control:
           Read: Disabled
          Write: Disabled

SATA Phy Event Counters (GP Log 0x11)
ID      Size     Value  Description
0x0001  2            0  Command failed due to ICRC error
0x0002  2            0  R_ERR response for data FIS
0x0003  2            0  R_ERR response for device-to-host data FIS
0x0004  2            0  R_ERR response for host-to-device data FIS
0x0005  2            0  R_ERR response for non-data FIS
0x0006  2            0  R_ERR response for device-to-host non-data FIS
0x0007  2            0  R_ERR response for host-to-device non-data FIS
0x0008  2            0  Device-to-host non-data FIS retries
0x0009  2           16  Transition from drive PhyRdy to drive PhyNRdy
0x000a  2           16  Device-to-host register FISes sent due to a COMRESET
0x000b  2            0  CRC errors within host-to-device FIS
0x000d  2            0  Non-CRC errors within host-to-device FIS
0x000f  2            0  R_ERR response for host-to-device data FIS, CRC
0x0010  2            0  R_ERR response for host-to-device data FIS, non-CRC
0x0012  2            0  R_ERR response for host-to-device non-data FIS, CRC
0x0013  2            0  R_ERR response for host-to-device non-data FIS, non-CRC

