smartctl 7.1 2020-06-20 r5066 [x86_64-linux-3.10.0-1127...] (local build)
Copyright (C) 2002-19, Bruce Allen, Christian Franke, www.smartmontools.org

=== START OF INFORMATION SECTION ===
Model Number:                       SAMSUNG MZSLW1T0HMLH-000L1
Serial Number:                      --
Firmware Version:                   3L0QCXY7
PCI Vendor/Subsystem ID:            0x144d
IEEE OUI Identifier:                0x002538
Controller ID:                      2
Number of Namespaces:               1
Namespace 1 Size/Capacity:          1,024,209,543,168 [1.02 TB]
Namespace 1 Utilization:            972,487,389,184 [972 GB]
Namespace 1 Formatted LBA Size:     512
Namespace 1 IEEE EUI-64:            002538 ...
Local Time is:                      Wed Nov ... 2021 CET

=== START OF READ SMART DATA SECTION ===
SMART overall-health self-assessment test result: PASSED

SMART/Health Information (NVMe Log 0x02)
Critical Warning:                   0x00
Temperature:                        39 Celsius
Available Spare:                    100%
Available Spare Threshold:          10%
Percentage Used:                    14%
Data Units Read:                    114,446,231 [58.5 TB]
Data Units Written:                 74,551,771 [38.1 TB]
Host Read Commands:                 851,784,864
Host Write Commands:                1,863,623,341
Controller Busy Time:               20,091
Power Cycles:                       194
Power On Hours:                     10,819
Unsafe Shutdowns:                   136
Media and Data Integrity Errors:    0
Error Information Log Entries:      124

