smartctl 7.1 2020-06-20 r5066 [x86_64-linux-3.10.0-1127...] (local build)
Copyright (C) 2002-19, Bruce Allen, Christian Franke, www.smartmontools.org

=== START OF INFORMATION SECTION ===
Model Number:                       SAMSUNG MZSLW1T0HMLH-000L1
Serial Number:                      --
Firmware Version:                   3L0QCXY7
PCI Vendor/Subsystem ID:            0x144d
IEEE OUI Identifier:                0x002538
Controller ID:                      2
Number of Namespaces:               1
Namespace 1 Size/Capacity:          1,024,209,543,168 [1.02 TB]
Namespace 1 Utilization:            972,389,232,640 [972 GB]
Namespace 1 Formatted LBA Size:     512
Namespace 1 IEEE EUI-64:            002538 ...
Local Time is:                      --

=== START OF READ SMART DATA SECTION ===
SMART overall-health self-assessment test result: PASSED

SMART/Health Information (NVMe Log 0x02)
Critical Warning:                   0x00
Temperature:                        38 Celsius
Available Spare:                    100%
Available Spare Threshold:          10%
Percentage Used:                    12%
Data Units Read:                    105,266,531 [53.8 TB]
Data Units Written:                 63,610,229 [32.5 TB]
Host Read Commands:                 804,554,783
Host Write Commands:                1,744,644,274
Controller Busy Time:               18,756
Power Cycles:                       194
Power On Hours:                     10,059
Unsafe Shutdowns:                   136
Media and Data Integrity Errors:    0
Error Information Log Entries:      124

