smartctl 7.1 2020-06-20 r5066 [x86_64-linux-3.10.0-1160...] (local build)
Copyright (C) 2002-19, Bruce Allen, Christian Franke, www.smartmontools.org

=== START OF INFORMATION SECTION ===
Model Family:     Western Digital VelociRaptor
Device Model:     WDC WD3000HLHX-01JJPV0
Serial Number:    --
LU WWN Device Id: 5 0014ee ...
Firmware Version: 04.05G04
User Capacity:    300,069,052,416 bytes [300 GB]
Sector Size:      512 bytes logical/physical
Rotation Rate:    10000 rpm
Device is:        In smartctl database [for details use: -P show]
ATA Version is:   ATA8-ACS (minor revision not indicated)
SATA Version is:  SATA 2.6, 6.0 Gb/s
Local Time is:    --
APM level is:     128 (minimum power consumption without standby)
Rd look-ahead is: Enabled
Write cache is:   Enabled
ATA Security is:  Disabled, NOT FROZEN [SEC1]

=== START OF READ SMART DATA SECTION ===
SMART overall-health self-assessment test result: PASSED

General SMART Values:
Offline data collection status:  (0x84)	Offline data collection activity
					was suspended by an interrupting command from host.

Self-test execution status:      (   0)	The previous self-test routine completed
					without error or no self-test has ever 
					been run.
Total time to complete Offline 
data collection: 		( 4200) seconds.
Offline data collection
capabilities: 			 (0x7b) SMART execute Offline immediate.

					Suspend Offline collection upon new
					command.
					Offline surface scan supported.
					Self-test supported.
					Conveyance Self-test supported.
					Selective Self-test supported.
SMART capabilities:            (0x0003)	Saves SMART data before entering
					power-saving mode.

Error logging capability:        (0x01)	Error logging supported.
					General Purpose Logging supported.
Short self-test routine 
recommended polling time: 	 (   2) minutes.
Extended self-test routine
recommended polling time: 	 (  47) minutes.
Conveyance self-test routine
recommended polling time: 	 (   5) minutes.
SCT capabilities: 	       (0x303d)	SCT Status supported.
					SCT Error Recovery Control supported.
					SCT Feature Control supported.
					SCT Data Table supported.

SMART Attributes Data Structure revision number: 16
Vendor Specific SMART Attributes with Thresholds:
ID# ATTRIBUTE_NAME          FLAGS    VALUE WORST THRESH FAIL RAW_VALUE
  1 Raw_Read_Error_Rate     POSR-K   200   200   051    -    3
  3 Spin_Up_Time            POS--K   215   213   021    -    2241
  4 Start_Stop_Count        -O--CK   100   100   000    -    70
  5 Reallocated_Sector_Ct   PO--CK   200   200   140    -    0
  7 Seek_Error_Rate         -OSR-K   200   200   000    -    0
  9 Power_On_Hours          -O--CK   033   033   000    -    49315
 10 Spin_Retry_Count        -O--CK   100   253   000    -    0
 11 Calibration_Retry_Count -O--CK   100   253   000    -    0
 12 Power_Cycle_Count       -O--CK   100   100   000    -    68
192 Power-Off_Retract_Count -O--CK   200   200   000    -    41
193 Load_Cycle_Count        -O--CK   200   200   000    -    28
194 Temperature_Celsius     -O---K   117   100   000    -    30
196 Reallocated_Event_Count -O--CK   200   200   000    -    0
197 Current_Pending_Sector  -O--CK   200   200   000    -    0
198 Offline_Uncorrectable   ----CK   200   200   000    -    0
199 UDMA_CRC_Error_Count    -O--CK   200   200   000    -    0
200 Multi_Zone_Error_Rate   ---R--   200   200   000    -    8
                            ||||||_ K auto-keep
                            |||||__ C event count
                            ||||___ R error rate
                            |||____ S speed/performance
                            ||_____ O updated online
                            |______ P prefailure warning

General Purpose Log Directory Version 1
SMART           Log Directory Version 1 [multi-sector log support]
Address    Access  R/W   Size  Description
0x00       GPL,SL  R/O      1  Log Directory
0x01           SL  R/O      1  Summary SMART error log
0x02           SL  R/O      5  Comprehensive SMART error log
0x03       GPL     R/O      6  Ext. Comprehensive SMART error log
0x06           SL  R/O      1  SMART self-test log
0x07       GPL     R/O      1  Extended self-test log
0x09           SL  R/W      1  Selective self-test log
0x10       GPL     R/O      1  NCQ Command Error log
0x11       GPL     R/O      1  SATA Phy Event Counters log
0x80-0x9f  GPL,SL  R/W     16  Host vendor specific log
0xa0-0xa7  GPL,SL  VS      16  Device vendor specific log
0xa8-0xb5  GPL,SL  VS       1  Device vendor specific log
0xb6       GPL     VS       1  Device vendor specific log
0xb7       GPL,SL  VS       1  Device vendor specific log
0xbd       GPL,SL  VS       1  Device vendor specific log
0xc0       GPL,SL  VS       1  Device vendor specific log
0xc1       GPL     VS      24  Device vendor specific log
0xe0       GPL,SL  R/W      1  SCT Command/Status
0xe1       GPL,SL  R/W      1  SCT Data Transfer

SMART Extended Comprehensive Error Log Version: 1 (6 sectors)
Device Error Count: 24
	CR     = Command Register
	FEATR  = Features Register
	COUNT  = Count (was: Sector Count) Register
	LBA_48 = Upper bytes of LBA High/Mid/Low Registers ]  ATA-8
	LH     = LBA High (was: Cylinder High) Register    ]   LBA
	LM     = LBA Mid (was: Cylinder Low) Register      ] Register
	LL     = LBA Low (was: Sector Number) Register     ]
	DV     = Device (was: Device/Head) Register
	DC     = Device Control Register
	ER     = Error register
	ST     = Status register
Powered_Up_Time is measured from power on, and printed as
DDd+hh:mm:SS.sss where DD=days, hh=hours, mm=minutes,
SS=sec, and sss=millisec. It "wraps" after 49.710 days.

Error 24 [23] occurred at disk power-on lifetime: 7404 hours (308 days + 12 hours)
  When the command that caused the error occurred, the device was active or idle.

  After command completion occurred, registers were:
  ER -- ST COUNT  LBA_48  LH LM LL DV DC
  -- -- -- == -- == == == -- -- -- -- --
  40 -- 51 00 08 00 00 1e 40 08 20 e0 00  Error: UNC 8 sectors at LBA = 0x1e400820 = 507512864

  Commands leading to the command that caused the error were:
  CR FEATR COUNT  LBA_48  LH LM LL DV DC  Powered_Up_Time  Command/Feature_Name
  -- == -- == -- == == == -- -- -- -- --  ---------------  --------------------
  25 00 00 00 08 00 00 1e 40 08 20 e0 08     00:11:12.774  READ DMA EXT
  27 00 00 00 00 00 00 00 00 00 00 e0 08     00:11:12.774  READ NATIVE MAX ADDRESS EXT [OBS-ACS-3]
  ec 00 00 00 00 00 00 00 00 00 00 a0 08     00:11:12.771  IDENTIFY DEVICE
  ef 00 03 00 46 00 00 00 00 00 00 a0 08     00:11:12.771  SET FEATURES [Set transfer mode]
  27 00 00 00 00 00 00 00 00 00 00 e0 08     00:11:12.765  READ NATIVE MAX ADDRESS EXT [OBS-ACS-3]

Error 23 [22] occurred at disk power-on lifetime: 7404 hours (308 days + 12 hours)
  When the command that caused the error occurred, the device was active or idle.

  After command completion occurred, registers were:
  ER -- ST COUNT  LBA_48  LH LM LL DV DC
  -- -- -- == -- == == == -- -- -- -- --
  40 -- 51 00 08 00 00 1e 40 08 20 e0 00  Error: UNC 8 sectors at LBA = 0x1e400820 = 507512864

  Commands leading to the command that caused the error were:
  CR FEATR COUNT  LBA_48  LH LM LL DV DC  Powered_Up_Time  Command/Feature_Name
  -- == -- == -- == == == -- -- -- -- --  ---------------  --------------------
  25 00 00 00 08 00 00 1e 40 08 20 e0 08     00:11:11.522  READ DMA EXT
  27 00 00 00 00 00 00 00 00 00 00 e0 08     00:11:11.522  READ NATIVE MAX ADDRESS EXT [OBS-ACS-3]
  ec 00 00 00 00 00 00 00 00 00 00 a0 08     00:11:11.519  IDENTIFY DEVICE
  ef 00 03 00 46 00 00 00 00 00 00 a0 08     00:11:11.518  SET FEATURES [Set transfer mode]
  27 00 00 00 00 00 00 00 00 00 00 e0 08     00:11:11.512  READ NATIVE MAX ADDRESS EXT [OBS-ACS-3]

Error 22 [21] occurred at disk power-on lifetime: 7404 hours (308 days + 12 hours)
  When the command that caused the error occurred, the device was active or idle.

  After command completion occurred, registers were:
  ER -- ST COUNT  LBA_48  LH LM LL DV DC
  -- -- -- == -- == == == -- -- -- -- --
  40 -- 51 00 08 00 00 1e 40 08 20 e0 00  Error: UNC 8 sectors at LBA = 0x1e400820 = 507512864

  Commands leading to the command that caused the error were:
  CR FEATR COUNT  LBA_48  LH LM LL DV DC  Powered_Up_Time  Command/Feature_Name
  -- == -- == -- == == == -- -- -- -- --  ---------------  --------------------
  25 00 00 00 08 00 00 1e 40 08 20 e0 08     00:11:10.268  READ DMA EXT
  27 00 00 00 00 00 00 00 00 00 00 e0 08     00:11:10.268  READ NATIVE MAX ADDRESS EXT [OBS-ACS-3]
  ec 00 00 00 00 00 00 00 00 00 00 a0 08     00:11:10.266  IDENTIFY DEVICE
  ef 00 03 00 46 00 00 00 00 00 00 a0 08     00:11:10.266  SET FEATURES [Set transfer mode]
  27 00 00 00 00 00 00 00 00 00 00 e0 08     00:11:10.259  READ NATIVE MAX ADDRESS EXT [OBS-ACS-3]

Error 21 [20] occurred at disk power-on lifetime: 7404 hours (308 days + 12 hours)
  When the command that caused the error occurred, the device was active or idle.

  After command completion occurred, registers were:
  ER -- ST COUNT  LBA_48  LH LM LL DV DC
  -- -- -- == -- == == == -- -- -- -- --
  40 -- 51 00 08 00 00 1e 40 08 20 e0 00  Error: UNC 8 sectors at LBA = 0x1e400820 = 507512864

  Commands leading to the command that caused the error were:
  CR FEATR COUNT  LBA_48  LH LM LL DV DC  Powered_Up_Time  Command/Feature_Name
  -- == -- == -- == == == -- -- -- -- --  ---------------  --------------------
  25 00 00 00 08 00 00 1e 40 08 20 e0 08     00:11:09.017  READ DMA EXT
  27 00 00 00 00 00 00 00 00 00 00 e0 08     00:11:09.017  READ NATIVE MAX ADDRESS EXT [OBS-ACS-3]
  ec 00 00 00 00 00 00 00 00 00 00 a0 08     00:11:09.014  IDENTIFY DEVICE
  ef 00 03 00 46 00 00 00 00 00 00 a0 08     00:11:09.013  SET FEATURES [Set transfer mode]
  27 00 00 00 00 00 00 00 00 00 00 e0 08     00:11:09.006  READ NATIVE MAX ADDRESS EXT [OBS-ACS-3]

Error 20 [19] occurred at disk power-on lifetime: 7404 hours (308 days + 12 hours)
  When the command that caused the error occurred, the device was active or idle.

  After command completion occurred, registers were:
  ER -- ST COUNT  LBA_48  LH LM LL DV DC
  -- -- -- == -- == == == -- -- -- -- --
  40 -- 51 00 08 00 00 1e 40 08 20 e0 00  Error: UNC 8 sectors at LBA = 0x1e400820 = 507512864

  Commands leading to the command that caused the error were:
  CR FEATR COUNT  LBA_48  LH LM LL DV DC  Powered_Up_Time  Command/Feature_Name
  -- == -- == -- == == == -- -- -- -- --  ---------------  --------------------
  25 00 00 00 08 00 00 1e 40 08 20 e0 08     00:11:07.763  READ DMA EXT
  27 00 00 00 00 00 00 00 00 00 00 e0 08     00:11:07.763  READ NATIVE MAX ADDRESS EXT [OBS-ACS-3]
  ec 00 00 00 00 00 00 00 00 00 00 a0 08     00:11:07.760  IDENTIFY DEVICE
  ef 00 03 00 46 00 00 00 00 00 00 a0 08     00:11:07.760  SET FEATURES [Set transfer mode]
  27 00 00 00 00 00 00 00 00 00 00 e0 08     00:11:07.754  READ NATIVE MAX ADDRESS EXT [OBS-ACS-3]

Error 19 [18] occurred at disk power-on lifetime: 7404 hours (308 days + 12 hours)
  When the command that caused the error occurred, the device was active or idle.

  After command completion occurred, registers were:
  ER -- ST COUNT  LBA_48  LH LM LL DV DC
  -- -- -- == -- == == == -- -- -- -- --
  40 -- 51 00 08 00 00 1e 40 08 20 e0 00  Error: UNC 8 sectors at LBA = 0x1e400820 = 507512864

  Commands leading to the command that caused the error were:
  CR FEATR COUNT  LBA_48  LH LM LL DV DC  Powered_Up_Time  Command/Feature_Name
  -- == -- == -- == == == -- -- -- -- --  ---------------  --------------------
  25 00 00 00 08 00 00 1e 40 08 20 e0 08     00:11:06.512  READ DMA EXT
  25 00 00 00 60 00 00 1e 40 08 88 e0 08     00:11:06.512  READ DMA EXT
  27 00 00 00 00 00 00 00 00 00 00 e0 08     00:11:06.510  READ NATIVE MAX ADDRESS EXT [OBS-ACS-3]
  ec 00 00 00 00 00 00 00 00 00 00 a0 08     00:11:06.508  IDENTIFY DEVICE
  ef 00 03 00 46 00 00 00 00 00 00 a0 08     00:11:06.508  SET FEATURES [Set transfer mode]

Error 18 [17] occurred at disk power-on lifetime: 7404 hours (308 days + 12 hours)
  When the command that caused the error occurred, the device was active or idle.

  After command completion occurred, registers were:
  ER -- ST COUNT  LBA_48  LH LM LL DV DC
  -- -- -- == -- == == == -- -- -- -- --
  40 -- 51 00 60 00 00 1e 40 08 08 e0 00  Error: UNC 96 sectors at LBA = 0x1e400808 = 507512840

  Commands leading to the command that caused the error were:
  CR FEATR COUNT  LBA_48  LH LM LL DV DC  Powered_Up_Time  Command/Feature_Name
  -- == -- == -- == == == -- -- -- -- --  ---------------  --------------------
  25 00 00 00 60 00 00 1e 40 08 08 e0 08     00:11:05.258  READ DMA EXT
  27 00 00 00 00 00 00 00 00 00 00 e0 08     00:11:05.257  READ NATIVE MAX ADDRESS EXT [OBS-ACS-3]
  ec 00 00 00 00 00 00 00 00 00 00 a0 08     00:11:05.255  IDENTIFY DEVICE
  ef 00 03 00 46 00 00 00 00 00 00 a0 08     00:11:05.255  SET FEATURES [Set transfer mode]
  27 00 00 00 00 00 00 00 00 00 00 e0 08     00:11:05.247  READ NATIVE MAX ADDRESS EXT [OBS-ACS-3]

Error 17 [16] occurred at disk power-on lifetime: 7404 hours (308 days + 12 hours)
  When the command that caused the error occurred, the device was active or idle.

  After command completion occurred, registers were:
  ER -- ST COUNT  LBA_48  LH LM LL DV DC
  -- -- -- == -- == == == -- -- -- -- --
  40 -- 51 00 60 00 00 1e 40 08 08 e0 00  Error: UNC 96 sectors at LBA = 0x1e400808 = 507512840

  Commands leading to the command that caused the error were:
  CR FEATR COUNT  LBA_48  LH LM LL DV DC  Powered_Up_Time  Command/Feature_Name
  -- == -- == -- == == == -- -- -- -- --  ---------------  --------------------
  25 00 00 00 60 00 00 1e 40 08 08 e0 08     00:11:04.006  READ DMA EXT
  27 00 00 00 00 00 00 00 00 00 00 e0 08     00:11:04.006  READ NATIVE MAX ADDRESS EXT [OBS-ACS-3]
  ec 00 00 00 00 00 00 00 00 00 00 a0 08     00:11:04.003  IDENTIFY DEVICE
  ef 00 03 00 46 00 00 00 00 00 00 a0 08     00:11:04.003  SET FEATURES [Set transfer mode]
  27 00 00 00 00 00 00 00 00 00 00 e0 08     00:11:03.996  READ NATIVE MAX ADDRESS EXT [OBS-ACS-3]

SMART Extended Self-test Log Version: 1 (1 sectors)
No self-tests have been logged.  [To run self-tests, use: smartctl -t]

SMART Selective self-test log data structure revision number 1
 SPAN  MIN_LBA  MAX_LBA  CURRENT_TEST_STATUS
    1        0        0  Not_testing
    2        0        0  Not_testing
    3        0        0  Not_testing
    4        0        0  Not_testing
    5        0        0  Not_testing
Selective self-test flags (0x0):
  After scanning selected spans, do NOT read-scan remainder of disk.
If Selective self-test is pending on power-up, resume after 0 minute delay.

SCT Status Version:                  3
SCT Version (vendor specific):       258 (0x0102)
Device State:                        Active (0)
Current Temperature:                    30 Celsius
Power Cycle Min/Max Temperature:     29/34 Celsius
Lifetime    Min/Max Temperature:     29/47 Celsius
Under/Over Temperature Limit Count:   0/0

SCT Temperature History Version:     2
Temperature Sampling Period:         1 minute
Temperature Logging Interval:        1 minute
Min/Max recommended Temperature:      0/60 Celsius
Min/Max Temperature Limit:           -41/85 Celsius
Temperature History Size (Index):    478 (178)

SCT Error Recovery Control:
           Read:     70 (7.0 seconds)
          Write:     70 (7.0 seconds)

SATA Phy Event Counters (GP Log 0x11)
ID      Size     Value  Description
0x0001  2            0  Command failed due to ICRC error
0x0002  2            0  R_ERR response for data FIS
0x0003  2            0  R_ERR response for device-to-host data FIS
0x0004  2            0  R_ERR response for host-to-device data FIS
0x0005  2            0  R_ERR response for non-data FIS
0x0006  2            0  R_ERR response for device-to-host non-data FIS
0x0007  2            0  R_ERR response for host-to-device non-data FIS
0x000a  2            2  Device-to-host register FISes sent due to a COMRESET
0x000b  2            0  CRC errors within host-to-device FIS
0x8000  4      2600055  Vendor specific

