smartctl 7.1 2020-06-20 r5066 [x86_64-linux-3.10.0-1160...] (local build)
Copyright (C) 2002-19, Bruce Allen, Christian Franke, www.smartmontools.org

=== START OF INFORMATION SECTION ===
Model Number:                       Samsung SSD 950 PRO 512GB
Serial Number:                      --
Firmware Version:                   1B0QBXX7
PCI Vendor/Subsystem ID:            0x144d
IEEE OUI Identifier:                0x002538
Controller ID:                      1
Number of Namespaces:               1
Namespace 1 Size/Capacity:          512,110,190,592 [512 GB]
Namespace 1 Utilization:            403,764,002,816 [403 GB]
Namespace 1 Formatted LBA Size:     512
Namespace 1 IEEE EUI-64:            002538 ...
Local Time is:                      Thu Dec ... 2021 AEDT

=== START OF READ SMART DATA SECTION ===
SMART overall-health self-assessment test result: PASSED

SMART/Health Information (NVMe Log 0x02)
Critical Warning:                   0x00
Temperature:                        34 Celsius
Available Spare:                    100%
Available Spare Threshold:          10%
Percentage Used:                    2%
Data Units Read:                    30,586,512 [15.6 TB]
Data Units Written:                 54,187,215 [27.7 TB]
Host Read Commands:                 278,953,956
Host Write Commands:                1,959,640,895
Controller Busy Time:               1,513
Power Cycles:                       1,131
Power On Hours:                     14,909
Unsafe Shutdowns:                   730
Media and Data Integrity Errors:    0
Error Information Log Entries:      553

