smartctl 7.0 2019-05-21 r4916 [x86_64-linux-3.10.0-862...] (local build)
Copyright (C) 2002-18, Bruce Allen, Christian Franke, www.smartmontools.org

=== START OF INFORMATION SECTION ===
Model Number:                       INTEL SSDPEDMW400G4
Serial Number:                      --
Firmware Version:                   8EV10171
PCI Vendor/Subsystem ID:            0x8086
IEEE OUI Identifier:                0x5cd2e4
Controller ID:                      0
Number of Namespaces:               1
Namespace 1 Size/Capacity:          400,088,457,216 [400 GB]
Namespace 1 Formatted LBA Size:     512
Local Time is:                      --

=== START OF READ SMART DATA SECTION ===
SMART overall-health self-assessment test result: FAILED!
- media has been placed in read only mode

SMART/Health Information (NVMe Log 0x02)
Critical Warning:                   0x08
Temperature:                        28 Celsius
Available Spare:                    99%
Available Spare Threshold:          10%
Percentage Used:                    105%
Data Units Read:                    88,059,649 [45.0 TB]
Data Units Written:                 1,214,978,607 [622 TB]
Host Read Commands:                 2,303,992,483
Host Write Commands:                13,496,240,487
Controller Busy Time:               368
Power Cycles:                       2
Power On Hours:                     27,302
Unsafe Shutdowns:                   1
Media and Data Integrity Errors:    0
Error Information Log Entries:      0

