smartctl 7.1 2020-06-20 r5066 [x86_64-linux-3.10.0-1160...] (local build)
Copyright (C) 2002-19, Bruce Allen, Christian Franke, www.smartmontools.org

=== START OF INFORMATION SECTION ===
Model Family:     Seagate Barracuda 7200.14 (AF)
Device Model:     ST1000DM003-9YN162
Serial Number:    --
LU WWN Device Id: 5 000c50 ...
Firmware Version: CC4B
User Capacity:    1,000,204,886,016 bytes [1.00 TB]
Sector Sizes:     512 bytes logical, 4096 bytes physical
Rotation Rate:    7200 rpm
Device is:        In smartctl database [for details use: -P show]
ATA Version is:   ATA8-ACS T13/1699-D revision 4
SATA Version is:  SATA 3.0, 6.0 Gb/s (current: 6.0 Gb/s)
Local Time is:    --
APM level is:     128 (minimum power consumption without standby)
Rd look-ahead is: Enabled
Write cache is:   Enabled
ATA Security is:  Disabled, frozen [SEC2]

=== START OF READ SMART DATA SECTION ===
SMART overall-health self-assessment test result: PASSED

General SMART Values:
Offline data collection status:  (0x00)	Offline data collection activity
					was never started.

Self-test execution status:      (   0)	The previous self-test routine completed
					without error or no self-test has ever 
					been run.
Total time to complete Offline 
data collection: 		(  575) seconds.
Offline data collection
capabilities: 			 (0x73) SMART execute Offline immediate.

					Suspend Offline collection upon new
					command.
					No Offline surface scan supported.
					Self-test supported.
					Conveyance Self-test supported.
					Selective Self-test supported.
SMART capabilities:            (0x0003)	Saves SMART data before entering
					power-saving mode.

Error logging capability:        (0x01)	Error logging supported.
					General Purpose Logging supported.
Short self-test routine 
recommended polling time: 	 (   1) minutes.
Extended self-test routine
recommended polling time: 	 ( 106) minutes.
Conveyance self-test routine
recommended polling time: 	 (   2) minutes.
SCT capabilities: 	       (0x3085)	SCT Status supported.

SMART Attributes Data Structure revision number: 10
Vendor Specific SMART Attributes with Thresholds:
ID# ATTRIBUTE_NAME          FLAGS    VALUE WORST THRESH FAIL RAW_VALUE
  1 Raw_Read_Error_Rate     POSR--   099   084   006    -    184495416
  3 Spin_Up_Time            PO----   097   097   000    -    0
  4 Start_Stop_Count        -O--CK   100   100   020    -    38
  5 Reallocated_Sector_Ct   PO--CK   091   091   036    -    13104
  7 Seek_Error_Rate         POSR--   086   060   030    -    403960497
  9 Power_On_Hours          -O--CK   015   015   000    -    75264
 10 Spin_Retry_Count        PO--C-   100   100   097    -    0
 12 Power_Cycle_Count       -O--CK   100   100   020    -    37
183 Runtime_Bad_Block       -O--CK   100   100   000    -    0
184 End-to-End_Error        -O--CK   100   100   099    -    0
187 Reported_Uncorrect      -O--CK   001   001   000    -    1557
188 Command_Timeout         -O--CK   100   099   000    -    2 2 2
189 High_Fly_Writes         -O-RCK   100   100   000    -    0
190 Airflow_Temperature_Cel -O---K   075   058   045    -    25 (Min/Max 24/26)
191 G-Sense_Error_Rate      -O--CK   100   100   000    -    0
192 Power-Off_Retract_Count -O--CK   100   100   000    -    28
193 Load_Cycle_Count        -O--CK   001   001   000    -    360669
194 Temperature_Celsius     -O---K   025   042   000    -    25 (0 20 0 0 0)
197 Current_Pending_Sector  -O--C-   100   001   000    -    88
198 Offline_Uncorrectable   ----C-   100   001   000    -    88
199 UDMA_CRC_Error_Count    -OSRCK   200   200   000    -    0
240 Head_Flying_Hours       ------   100   253   000    -    63282h+43m+17.291s
241 Total_LBAs_Written      ------   100   253   000    -    1522593898514
242 Total_LBAs_Read         ------   100   253   000    -    31980582462223
                            ||||||_ K auto-keep
                            |||||__ C event count
                            ||||___ R error rate
                            |||____ S speed/performance
                            ||_____ O updated online
                            |______ P prefailure warning

General Purpose Log Directory Version 1
SMART           Log Directory Version 1 [multi-sector log support]
Address    Access  R/W   Size  Description
0x00       GPL,SL  R/O      1  Log Directory
0x01           SL  R/O      1  Summary SMART error log
0x02           SL  R/O      5  Comprehensive SMART error log
0x03       GPL     R/O      5  Ext. Comprehensive SMART error log
0x06           SL  R/O      1  SMART self-test log
0x07       GPL     R/O      1  Extended self-test log
0x09           SL  R/W      1  Selective self-test log
0x10       GPL     R/O      1  NCQ Command Error log
0x11       GPL     R/O      1  SATA Phy Event Counters log
0x21       GPL     R/O      1  Write stream error log
0x22       GPL     R/O      1  Read stream error log
0x80-0x9f  GPL,SL  R/W     16  Host vendor specific log
0xa1       GPL,SL  VS      20  Device vendor specific log
0xa2       GPL     VS    4496  Device vendor specific log
0xa8       GPL,SL  VS      20  Device vendor specific log
0xa9       GPL,SL  VS       1  Device vendor specific log
0xab       GPL     VS       1  Device vendor specific log
0xb0       GPL     VS    5067  Device vendor specific log
0xbd       GPL     VS     512  Device vendor specific log
0xbe-0xbf  GPL     VS   65535  Device vendor specific log
0xc0       GPL,SL  VS       1  Device vendor specific log
0xe0       GPL,SL  R/W      1  SCT Command/Status
0xe1       GPL,SL  R/W      1  SCT Data Transfer

SMART Extended Comprehensive Error Log Version: 1 (5 sectors)
Device Error Count: 1557 (device log contains only the most recent 20 errors)
	CR     = Command Register
	FEATR  = Features Register
	COUNT  = Count (was: Sector Count) Register
	LBA_48 = Upper bytes of LBA High/Mid/Low Registers ]  ATA-8
	LH     = LBA High (was: Cylinder High) Register    ]   LBA
	LM     = LBA Mid (was: Cylinder Low) Register      ] Register
	LL     = LBA Low (was: Sector Number) Register     ]
	DV     = Device (was: Device/Head) Register
	DC     = Device Control Register
	ER     = Error register
	ST     = Status register
Powered_Up_Time is measured from power on, and printed as
DDd+hh:mm:SS.sss where DD=days, hh=hours, mm=minutes,
SS=sec, and sss=millisec. It "wraps" after 49.710 days.

Error 1557 [16] occurred at disk power-on lifetime: 8343 hours (347 days + 15 hours)
  When the command that caused the error occurred, the device was active or idle.

  After command completion occurred, registers were:
  ER -- ST COUNT  LBA_48  LH LM LL DV DC
  -- -- -- == -- == == == -- -- -- -- --
  40 -- 51 00 00 00 00 3a a0 18 58 00 00  Error: UNC at LBA = 0x3aa01858 = 983570520

  Commands leading to the command that caused the error were:
  CR FEATR COUNT  LBA_48  LH LM LL DV DC  Powered_Up_Time  Command/Feature_Name
  -- == -- == -- == == == -- -- -- -- --  ---------------  --------------------
  60 00 00 00 08 00 00 3a a0 19 68 40 00     00:08:59.565  READ FPDMA QUEUED
  60 00 00 00 08 00 00 3a a0 19 60 40 00     00:08:59.565  READ FPDMA QUEUED
  60 00 00 00 08 00 00 3a a0 19 58 40 00     00:08:59.565  READ FPDMA QUEUED
  60 00 00 00 08 00 00 3a a0 19 00 40 00     00:08:59.565  READ FPDMA QUEUED
  60 00 00 00 08 00 00 3a a0 18 f8 40 00     00:08:59.565  READ FPDMA QUEUED

Error 1556 [15] occurred at disk power-on lifetime: 8343 hours (347 days + 15 hours)
  When the command that caused the error occurred, the device was active or idle.

  After command completion occurred, registers were:
  ER -- ST COUNT  LBA_48  LH LM LL DV DC
  -- -- -- == -- == == == -- -- -- -- --
  40 -- 51 00 00 00 00 3a a0 18 50 00 00  Error: UNC at LBA = 0x3aa01850 = 983570512

  Commands leading to the command that caused the error were:
  CR FEATR COUNT  LBA_48  LH LM LL DV DC  Powered_Up_Time  Command/Feature_Name
  -- == -- == -- == == == -- -- -- -- --  ---------------  --------------------
  60 00 00 00 08 00 00 3a a0 18 50 40 00     00:08:55.724  READ FPDMA QUEUED
  60 00 00 00 08 00 00 3a a0 18 58 40 00     00:08:55.723  READ FPDMA QUEUED
  60 00 00 00 08 00 00 3a a0 18 60 40 00     00:08:55.723  READ FPDMA QUEUED
  60 00 00 00 08 00 00 3a a0 18 68 40 00     00:08:55.723  READ FPDMA QUEUED
  60 00 00 00 08 00 00 3a a0 18 70 40 00     00:08:55.723  READ FPDMA QUEUED

Error 1555 [14] occurred at disk power-on lifetime: 8343 hours (347 days + 15 hours)
  When the command that caused the error occurred, the device was active or idle.

  After command completion occurred, registers were:
  ER -- ST COUNT  LBA_48  LH LM LL DV DC
  -- -- -- == -- == == == -- -- -- -- --
  40 -- 51 00 00 00 00 3a a0 18 48 00 00  Error: UNC at LBA = 0x3aa01848 = 983570504

  Commands leading to the command that caused the error were:
  CR FEATR COUNT  LBA_48  LH LM LL DV DC  Powered_Up_Time  Command/Feature_Name
  -- == -- == -- == == == -- -- -- -- --  ---------------  --------------------
  60 00 00 00 08 00 00 3a a0 19 78 40 00     00:08:52.705  READ FPDMA QUEUED
  60 00 00 00 08 00 00 3a a0 19 70 40 00     00:08:52.705  READ FPDMA QUEUED
  60 00 00 00 08 00 00 3a a0 19 68 40 00     00:08:52.705  READ FPDMA QUEUED
  60 00 00 00 08 00 00 3a a0 19 60 40 00     00:08:52.705  READ FPDMA QUEUED
  60 00 00 00 08 00 00 3a a0 19 58 40 00     00:08:52.705  READ FPDMA QUEUED

Error 1554 [13] occurred at disk power-on lifetime: 8343 hours (347 days + 15 hours)
  When the command that caused the error occurred, the device was active or idle.

  After command completion occurred, registers were:
  ER -- ST COUNT  LBA_48  LH LM LL DV DC
  -- -- -- == -- == == == -- -- -- -- --
  40 -- 51 00 00 00 00 3a a0 19 90 00 00  Error: UNC at LBA = 0x3aa01990 = 983570832

  Commands leading to the command that caused the error were:
  CR FEATR COUNT  LBA_48  LH LM LL DV DC  Powered_Up_Time  Command/Feature_Name
  -- == -- == -- == == == -- -- -- -- --  ---------------  --------------------
  60 00 00 00 d0 00 00 3a a0 19 88 40 00     00:08:48.047  READ FPDMA QUEUED
  60 00 00 00 08 00 00 3a a0 18 48 40 00     00:08:48.047  READ FPDMA QUEUED
  60 00 00 00 08 00 00 3a a0 18 50 40 00     00:08:48.047  READ FPDMA QUEUED
  60 00 00 00 08 00 00 3a a0 18 58 40 00     00:08:48.047  READ FPDMA QUEUED
  60 00 00 00 08 00 00 3a a0 18 60 40 00     00:08:48.047  READ FPDMA QUEUED

Error 1553 [12] occurred at disk power-on lifetime: 8343 hours (347 days + 15 hours)
  When the command that caused the error occurred, the device was active or idle.

  After command completion occurred, registers were:
  ER -- ST COUNT  LBA_48  LH LM LL DV DC
  -- -- -- == -- == == == -- -- -- -- --
  40 -- 51 00 00 00 00 3a a0 18 40 00 00  Error: UNC at LBA = 0x3aa01840 = 983570496

  Commands leading to the command that caused the error were:
  CR FEATR COUNT  LBA_48  LH LM LL DV DC  Powered_Up_Time  Command/Feature_Name
  -- == -- == -- == == == -- -- -- -- --  ---------------  --------------------
  60 00 00 00 08 00 00 3a a0 19 80 40 00     00:08:45.219  READ FPDMA QUEUED
  60 00 00 00 08 00 00 3a a0 19 78 40 00     00:08:45.186  READ FPDMA QUEUED
  60 00 00 00 08 00 00 3a a0 19 70 40 00     00:08:45.186  READ FPDMA QUEUED
  60 00 00 00 08 00 00 3a a0 19 68 40 00     00:08:45.186  READ FPDMA QUEUED
  60 00 00 00 08 00 00 3a a0 19 60 40 00     00:08:45.186  READ FPDMA QUEUED

Error 1552 [11] occurred at disk power-on lifetime: 8343 hours (347 days + 15 hours)
  When the command that caused the error occurred, the device was active or idle.

  After command completion occurred, registers were:
  ER -- ST COUNT  LBA_48  LH LM LL DV DC
  -- -- -- == -- == == == -- -- -- -- --
  40 -- 51 00 00 00 00 3a a0 19 58 00 00  Error: UNC at LBA = 0x3aa01958 = 983570776

  Commands leading to the command that caused the error were:
  CR FEATR COUNT  LBA_48  LH LM LL DV DC  Powered_Up_Time  Command/Feature_Name
  -- == -- == -- == == == -- -- -- -- --  ---------------  --------------------
  60 00 00 00 08 00 00 3a a0 19 58 40 00     00:08:41.145  READ FPDMA QUEUED
  60 00 00 00 08 00 00 01 1c 14 48 40 00     00:08:41.031  READ FPDMA QUEUED
  60 00 00 00 08 00 00 01 1c 14 20 40 00     00:08:40.917  READ FPDMA QUEUED
  ef 00 10 00 02 00 00 00 00 00 00 a0 00     00:08:40.917  SET FEATURES [Enable SATA feature]
  27 00 00 00 00 00 00 00 00 00 00 e0 00     00:08:40.917  READ NATIVE MAX ADDRESS EXT [OBS-ACS-3]

Error 1551 [10] occurred at disk power-on lifetime: 8343 hours (347 days + 15 hours)
  When the command that caused the error occurred, the device was active or idle.

  After command completion occurred, registers were:
  ER -- ST COUNT  LBA_48  LH LM LL DV DC
  -- -- -- == -- == == == -- -- -- -- --
  40 -- 51 00 00 00 00 3a a0 19 58 00 00  Error: UNC at LBA = 0x3aa01958 = 983570776

  Commands leading to the command that caused the error were:
  CR FEATR COUNT  LBA_48  LH LM LL DV DC  Powered_Up_Time  Command/Feature_Name
  -- == -- == -- == == == -- -- -- -- --  ---------------  --------------------
  60 00 00 00 08 00 00 3a a0 19 58 40 00     00:08:37.901  READ FPDMA QUEUED
  60 00 00 00 08 00 00 3a a0 18 30 40 00     00:08:37.867  READ FPDMA QUEUED
  60 00 00 00 08 00 00 3a a0 18 28 40 00     00:08:37.833  READ FPDMA QUEUED
  60 00 00 00 08 00 00 01 1c 14 30 40 00     00:08:37.808  READ FPDMA QUEUED
  60 00 00 00 08 00 00 01 1c 14 70 40 00     00:08:37.794  READ FPDMA QUEUED

Error 1550 [9] occurred at disk power-on lifetime: 8343 hours (347 days + 15 hours)
  When the command that caused the error occurred, the device was active or idle.

  After command completion occurred, registers were:
  ER -- ST COUNT  LBA_48  LH LM LL DV DC
  -- -- -- == -- == == == -- -- -- -- --
  40 -- 51 00 00 00 00 3a a0 18 40 00 00  Error: UNC at LBA = 0x3aa01840 = 983570496

  Commands leading to the command that caused the error were:
  CR FEATR COUNT  LBA_48  LH LM LL DV DC  Powered_Up_Time  Command/Feature_Name
  -- == -- == -- == == == -- -- -- -- --  ---------------  --------------------
  60 00 00 00 c0 00 00 3a a0 18 28 40 00     00:08:32.190  READ FPDMA QUEUED
  60 00 00 00 20 00 00 3a a0 18 08 40 00     00:08:28.707  READ FPDMA QUEUED
  60 00 00 00 08 00 00 01 1c 17 80 40 00     00:08:28.706  READ FPDMA QUEUED
  60 00 00 00 08 00 00 3a a0 18 00 40 00     00:08:27.820  READ FPDMA QUEUED
  60 00 00 00 08 00 00 01 1c 3c a8 40 00     00:08:27.800  READ FPDMA QUEUED

SMART Extended Self-test Log Version: 1 (1 sectors)
No self-tests have been logged.  [To run self-tests, use: smartctl -t]

SMART Selective self-test log data structure revision number 1
 SPAN  MIN_LBA  MAX_LBA  CURRENT_TEST_STATUS
    1        0        0  Not_testing
    2        0        0  Not_testing
    3        0        0  Not_testing
    4        0        0  Not_testing
    5        0        0  Not_testing
Selective self-test flags (0x0):
  After scanning selected spans, do NOT read-scan remainder of disk.
If Selective self-test is pending on power-up, resume after 0 minute delay.

SCT Status Version:                  3
SCT Version (vendor specific):       522 (0x020a)
Device State:                        Active (0)
Current Temperature:                    25 Celsius
Power Cycle Min/Max Temperature:     24/26 Celsius
Lifetime    Min/Max Temperature:     20/42 Celsius
Under/Over Temperature Limit Count:   0/0

SATA Phy Event Counters (GP Log 0x11)
ID      Size     Value  Description
0x000a  2           16  Device-to-host register FISes sent due to a COMRESET
0x0001  2            0  Command failed due to ICRC error
0x0003  2            0  R_ERR response for device-to-host data FIS
0x0004  2            0  R_ERR response for host-to-device data FIS
0x0006  2            0  R_ERR response for device-to-host non-data FIS
0x0007  2            0  R_ERR response for host-to-device non-data FIS

