smartctl 7.1 2020-06-20 r5066 [x86_64-linux-3.10.0-1160...] (local build)
Copyright (C) 2002-19, Bruce Allen, Christian Franke, www.smartmontools.org

=== START OF INFORMATION SECTION ===
Model Number:                       Samsung SSD 970 PRO 1TB
Serial Number:                      --
Firmware Version:                   1B2QEXP7
PCI Vendor/Subsystem ID:            0x144d
IEEE OUI Identifier:                0x002538
Total NVM Capacity:                 1,024,209,543,168 [1.02 TB]
Unallocated NVM Capacity:           0
Controller ID:                      4
Number of Namespaces:               1
Namespace 1 Size/Capacity:          1,024,209,543,168 [1.02 TB]
Namespace 1 Utilization:            745,836,032,000 [745 GB]
Namespace 1 Formatted LBA Size:     512
Namespace 1 IEEE EUI-64:            002538 ...
Local Time is:                      Tue Apr ... 2022 CEST

=== START OF READ SMART DATA SECTION ===
SMART overall-health self-assessment test result: FAILED!
- NVM subsystem reliability has been degraded

SMART/Health Information (NVMe Log 0x02)
Critical Warning:                   0x04
Temperature:                        39 Celsius
Available Spare:                    100%
Available Spare Threshold:          10%
Percentage Used:                    131%
Data Units Read:                    188,508,988 [96.5 TB]
Data Units Written:                 1,893,130,648 [969 TB]
Host Read Commands:                 4,326,949,645
Host Write Commands:                36,448,127,496
Controller Busy Time:               10,033,779,491
Power Cycles:                       10
Power On Hours:                     15,562
Unsafe Shutdowns:                   4
Media and Data Integrity Errors:    0
Error Information Log Entries:      52
Warning  Comp. Temperature Time:    0
Critical Comp. Temperature Time:    0
Temperature Sensor 1:               39 Celsius
Temperature Sensor 2:               65 Celsius

