smartctl 7.1 2020-06-20 r5066 [x86_64-linux-3.10.0-1062...] (local build)
Copyright (C) 2002-19, Bruce Allen, Christian Franke, www.smartmontools.org

=== START OF INFORMATION SECTION ===
Model Family:     Seagate Momentus 5400.6
Device Model:     ST9500325AS
Serial Number:    --
LU WWN Device Id: 5 000c50 ...
Firmware Version: 0003BSM1
User Capacity:    500,107,862,016 bytes [500 GB]
Sector Size:      512 bytes logical/physical
Rotation Rate:    5400 rpm
Device is:        In smartctl database [for details use: -P show]
ATA Version is:   ATA8-ACS T13/1699-D revision 4
SATA Version is:  SATA 2.6, 1.5 Gb/s
Local Time is:    --
APM level is:     128 (minimum power consumption without standby)
Rd look-ahead is: Enabled
Write cache is:   Enabled
ATA Security is:  Disabled, NOT FROZEN [SEC1]

=== START OF READ SMART DATA SECTION ===
SMART overall-health self-assessment test result: PASSED

General SMART Values:
Offline data collection status:  (0x00)	Offline data collection activity
					was never started.

Self-test execution status:      (   0)	The previous self-test routine completed
					without error or no self-test has ever 
					been run.
Total time to complete Offline 
data collection: 		(    0) seconds.
Offline data collection
capabilities: 			 (0x73) SMART execute Offline immediate.

					Suspend Offline collection upon new
					command.
					No Offline surface scan supported.
					Self-test supported.
					Conveyance Self-test supported.
					Selective Self-test supported.
SMART capabilities:            (0x0003)	Saves SMART data before entering
					power-saving mode.

Error logging capability:        (0x01)	Error logging supported.
					General Purpose Logging supported.
Short self-test routine 
recommended polling time: 	 (   1) minutes.
Extended self-test routine
recommended polling time: 	 ( 139) minutes.
Conveyance self-test routine
recommended polling time: 	 (   2) minutes.
SCT capabilities: 	       (0x103b)	SCT Status supported.
					SCT Error Recovery Control supported.
					SCT Feature Control supported.
					SCT Data Table supported.

SMART Attributes Data Structure revision number: 10
Vendor Specific SMART Attributes with Thresholds:
ID# ATTRIBUTE_NAME          FLAGS    VALUE WORST THRESH FAIL RAW_VALUE
  1 Raw_Read_Error_Rate     POSR--   118   096   006    -    184326553
  3 Spin_Up_Time            PO----   098   098   000    -    0
  4 Start_Stop_Count        -O--CK   100   100   020    -    136
  5 Reallocated_Sector_Ct   PO--CK   098   098   036    -    44
  7 Seek_Error_Rate         POSR--   083   060   030    -    224185947
  9 Power_On_Hours          -O--CK   037   037   000    -    55786
 10 Spin_Retry_Count        PO--C-   100   100   097    -    0
 12 Power_Cycle_Count       -O--CK   100   037   020    -    44
184 End-to-End_Error        -O--CK   100   100   099    -    0
187 Reported_Uncorrect      -O--CK   011   011   000    -    89
188 Command_Timeout         -O--CK   100   089   000    -    4295032872
189 High_Fly_Writes         -O-RCK   100   100   000    -    0
190 Airflow_Temperature_Cel -O---K   069   049   045    -    31 (Min/Max 23/33)
191 G-Sense_Error_Rate      -O--CK   100   100   000    -    753
192 Power-Off_Retract_Count -O--CK   100   100   000    -    9
193 Load_Cycle_Count        -O--CK   100   100   000    -    243
194 Temperature_Celsius     -O---K   031   051   000    -    31 (0 16 0 0 0)
195 Hardware_ECC_Recovered  -O-RC-   048   034   000    -    184326553
197 Current_Pending_Sector  -O--C-   100   100   000    -    1
198 Offline_Uncorrectable   ----C-   100   100   000    -    1
199 UDMA_CRC_Error_Count    -OSRCK   200   200   000    -    0
                            ||||||_ K auto-keep
                            |||||__ C event count
                            ||||___ R error rate
                            |||____ S speed/performance
                            ||_____ O updated online
                            |______ P prefailure warning

General Purpose Log Directory Version 1
SMART           Log Directory Version 1 [multi-sector log support]
Address    Access  R/W   Size  Description
0x00       GPL,SL  R/O      1  Log Directory
0x01       GPL,SL  R/O      1  Summary SMART error log
0x02       GPL,SL  R/O      5  Comprehensive SMART error log
0x03       GPL,SL  R/O      5  Ext. Comprehensive SMART error log
0x06       GPL,SL  R/O      1  SMART self-test log
0x07       GPL,SL  R/O      1  Extended self-test log
0x09       GPL,SL  R/W      1  Selective self-test log
0x10       GPL,SL  R/O      1  NCQ Command Error log
0x11       GPL,SL  R/O      1  SATA Phy Event Counters log
0x21       GPL,SL  R/O      1  Write stream error log
0x22       GPL,SL  R/O      1  Read stream error log
0x80-0x9f  GPL,SL  R/W     16  Host vendor specific log
0xa1       GPL,SL  VS      20  Device vendor specific log
0xa2       GPL     VS    2248  Device vendor specific log
0xa8       GPL,SL  VS      65  Device vendor specific log
0xa9       GPL,SL  VS       1  Device vendor specific log
0xb0       GPL     VS    2864  Device vendor specific log
0xbe-0xbf  GPL     VS   65535  Device vendor specific log
0xc0       GPL,SL  VS       1  Device vendor specific log
0xe0       GPL,SL  R/W      1  SCT Command/Status
0xe1       GPL,SL  R/W      1  SCT Data Transfer

SMART Extended Comprehensive Error Log Version: 1 (5 sectors)
Device Error Count: 89 (device log contains only the most recent 20 errors)
	CR     = Command Register
	FEATR  = Features Register
	COUNT  = Count (was: Sector Count) Register
	LBA_48 = Upper bytes of LBA High/Mid/Low Registers ]  ATA-8
	LH     = LBA High (was: Cylinder High) Register    ]   LBA
	LM     = LBA Mid (was: Cylinder Low) Register      ] Register
	LL     = LBA Low (was: Sector Number) Register     ]
	DV     = Device (was: Device/Head) Register
	DC     = Device Control Register
	ER     = Error register
	ST     = Status register
Powered_Up_Time is measured from power on, and printed as
DDd+hh:mm:SS.sss where DD=days, hh=hours, mm=minutes,
SS=sec, and sss=millisec. It "wraps" after 49.710 days.

Error 89 [8] occurred at disk power-on lifetime: 50821 hours (2117 days + 13 hours)
  When the command that caused the error occurred, the device was active or idle.

  After command completion occurred, registers were:
  ER -- ST COUNT  LBA_48  LH LM LL DV DC
  -- -- -- == -- == == == -- -- -- -- --
  40 -- 51 00 00 00 00 39 3e d6 6f 00 00  Error: UNC at LBA = 0x393ed66f = 960419439

  Commands leading to the command that caused the error were:
  CR FEATR COUNT  LBA_48  LH LM LL DV DC  Powered_Up_Time  Command/Feature_Name
  -- == -- == -- == == == -- -- -- -- --  ---------------  --------------------
  60 00 00 00 08 00 00 39 3e d6 68 40 00     00:10:58.468  READ FPDMA QUEUED
  ea 00 00 00 00 00 00 00 00 00 00 a0 00     00:10:57.914  FLUSH CACHE EXT
  61 00 00 00 08 00 00 36 3d e8 68 40 00     00:10:57.914  WRITE FPDMA QUEUED
  ea 00 00 00 00 00 00 00 00 00 00 a0 00     00:10:57.888  FLUSH CACHE EXT
  61 00 00 00 80 00 00 36 3d e7 e8 40 00     00:10:57.887  WRITE FPDMA QUEUED

Error 88 [7] occurred at disk power-on lifetime: 50821 hours (2117 days + 13 hours)
  When the command that caused the error occurred, the device was active or idle.

  After command completion occurred, registers were:
  ER -- ST COUNT  LBA_48  LH LM LL DV DC
  -- -- -- == -- == == == -- -- -- -- --
  40 -- 51 00 00 00 00 39 3e d6 6f 00 00  Error: UNC at LBA = 0x393ed66f = 960419439

  Commands leading to the command that caused the error were:
  CR FEATR COUNT  LBA_48  LH LM LL DV DC  Powered_Up_Time  Command/Feature_Name
  -- == -- == -- == == == -- -- -- -- --  ---------------  --------------------
  60 00 00 00 08 00 00 39 3e d6 68 40 00     00:10:45.466  READ FPDMA QUEUED
  61 00 00 00 08 00 00 35 9e 20 50 40 00     00:10:44.639  WRITE FPDMA QUEUED
  61 00 00 00 08 00 00 35 95 95 20 40 00     00:10:44.636  WRITE FPDMA QUEUED
  61 00 00 00 08 00 00 35 91 ef c0 40 00     00:10:44.634  WRITE FPDMA QUEUED
  61 00 00 01 20 00 00 32 69 c5 c8 40 00     00:10:44.633  WRITE FPDMA QUEUED

Error 87 [6] occurred at disk power-on lifetime: 50821 hours (2117 days + 13 hours)
  When the command that caused the error occurred, the device was active or idle.

  After command completion occurred, registers were:
  ER -- ST COUNT  LBA_48  LH LM LL DV DC
  -- -- -- == -- == == == -- -- -- -- --
  40 -- 51 00 00 00 00 39 3e d6 6f 00 00  Error: UNC at LBA = 0x393ed66f = 960419439

  Commands leading to the command that caused the error were:
  CR FEATR COUNT  LBA_48  LH LM LL DV DC  Powered_Up_Time  Command/Feature_Name
  -- == -- == -- == == == -- -- -- -- --  ---------------  --------------------
  60 00 00 00 08 00 00 39 3e d6 68 40 00     00:10:37.472  READ FPDMA QUEUED
  61 00 00 00 08 00 00 36 7c 80 50 40 00     00:10:37.124  WRITE FPDMA QUEUED
  ea 00 00 00 00 00 00 00 00 00 00 a0 00     00:10:35.478  FLUSH CACHE EXT
  61 00 00 00 08 00 00 36 3d de d0 40 00     00:10:35.476  WRITE FPDMA QUEUED
  ea 00 00 00 00 00 00 00 00 00 00 a0 00     00:10:35.467  FLUSH CACHE EXT

Error 86 [5] occurred at disk power-on lifetime: 50821 hours (2117 days + 13 hours)
  When the command that caused the error occurred, the device was active or idle.

  After command completion occurred, registers were:
  ER -- ST COUNT  LBA_48  LH LM LL DV DC
  -- -- -- == -- == == == -- -- -- -- --
  40 -- 51 00 00 00 00 39 3e d6 6f 00 00  Error: WP at LBA = 0x393ed66f = 960419439

  Commands leading to the command that caused the error were:
  CR FEATR COUNT  LBA_48  LH LM LL DV DC  Powered_Up_Time  Command/Feature_Name
  -- == -- == -- == == == -- -- -- -- --  ---------------  --------------------
  61 00 00 00 08 00 00 36 3d d3 f8 40 00     00:10:24.517  WRITE FPDMA QUEUED
  60 00 00 00 08 00 00 39 3e d6 68 40 00     00:10:24.516  READ FPDMA QUEUED
  ea 00 00 00 00 00 00 00 00 00 00 a0 00     00:10:24.343  FLUSH CACHE EXT
  61 00 00 01 28 00 00 36 3d d2 d0 40 00     00:10:24.338  WRITE FPDMA QUEUED
  61 00 00 00 08 00 00 36 80 76 00 40 00     00:10:24.328  WRITE FPDMA QUEUED

Error 85 [4] occurred at disk power-on lifetime: 50821 hours (2117 days + 13 hours)
  When the command that caused the error occurred, the device was active or idle.

  After command completion occurred, registers were:
  ER -- ST COUNT  LBA_48  LH LM LL DV DC
  -- -- -- == -- == == == -- -- -- -- --
  40 -- 51 00 00 00 00 39 3e d6 6f 00 00  Error: UNC at LBA = 0x393ed66f = 960419439

  Commands leading to the command that caused the error were:
  CR FEATR COUNT  LBA_48  LH LM LL DV DC  Powered_Up_Time  Command/Feature_Name
  -- == -- == -- == == == -- -- -- -- --  ---------------  --------------------
  60 00 00 00 08 00 00 39 3e d6 68 40 00     00:10:16.467  READ FPDMA QUEUED
  ea 00 00 00 00 00 00 00 00 00 00 a0 00     00:10:15.273  FLUSH CACHE EXT
  61 00 00 00 08 00 00 36 3d d0 d8 40 00     00:10:15.273  WRITE FPDMA QUEUED
  ea 00 00 00 00 00 00 00 00 00 00 a0 00     00:10:15.235  FLUSH CACHE EXT
  61 00 00 02 28 00 00 36 3d ce b0 40 00     00:10:15.177  WRITE FPDMA QUEUED

Error 84 [3] occurred at disk power-on lifetime: 50821 hours (2117 days + 13 hours)
  When the command that caused the error occurred, the device was active or idle.

  After command completion occurred, registers were:
  ER -- ST COUNT  LBA_48  LH LM LL DV DC
  -- -- -- == -- == == == -- -- -- -- --
  40 -- 51 00 00 00 00 39 3e d6 6f 00 00  Error: UNC at LBA = 0x393ed66f = 960419439

  Commands leading to the command that caused the error were:
  CR FEATR COUNT  LBA_48  LH LM LL DV DC  Powered_Up_Time  Command/Feature_Name
  -- == -- == -- == == == -- -- -- -- --  ---------------  --------------------
  60 00 00 00 08 00 00 39 3e d6 68 40 00     00:10:03.474  READ FPDMA QUEUED
  ea 00 00 00 00 00 00 00 00 00 00 a0 00     00:09:59.685  FLUSH CACHE EXT
  61 00 00 00 08 00 00 36 3d bf 80 40 00     00:09:59.684  WRITE FPDMA QUEUED
  ea 00 00 00 00 00 00 00 00 00 00 a0 00     00:09:59.646  FLUSH CACHE EXT
  61 00 00 01 b0 00 00 36 3d bd d0 40 00     00:09:59.586  WRITE FPDMA QUEUED

Error 83 [2] occurred at disk power-on lifetime: 50821 hours (2117 days + 13 hours)
  When the command that caused the error occurred, the device was active or idle.

  After command completion occurred, registers were:
  ER -- ST COUNT  LBA_48  LH LM LL DV DC
  -- -- -- == -- == == == -- -- -- -- --
  40 -- 51 00 00 00 00 39 3e d6 6f 00 00  Error: UNC at LBA = 0x393ed66f = 960419439

  Commands leading to the command that caused the error were:
  CR FEATR COUNT  LBA_48  LH LM LL DV DC  Powered_Up_Time  Command/Feature_Name
  -- == -- == -- == == == -- -- -- -- --  ---------------  --------------------
  60 00 00 00 08 00 00 39 3e d6 68 40 00     00:09:55.247  READ FPDMA QUEUED
  ea 00 00 00 00 00 00 00 00 00 00 a0 00     00:09:54.177  FLUSH CACHE EXT
  61 00 00 00 08 00 00 36 3d bd c8 40 00     00:09:54.176  WRITE FPDMA QUEUED
  ea 00 00 00 00 00 00 00 00 00 00 a0 00     00:09:54.131  FLUSH CACHE EXT
  61 00 00 00 d0 00 00 36 3d bc f8 40 00     00:09:54.129  WRITE FPDMA QUEUED

Error 82 [1] occurred at disk power-on lifetime: 50821 hours (2117 days + 13 hours)
  When the command that caused the error occurred, the device was active or idle.

  After command completion occurred, registers were:
  ER -- ST COUNT  LBA_48  LH LM LL DV DC
  -- -- -- == -- == == == -- -- -- -- --
  40 -- 51 00 00 00 00 39 3e d6 6f 00 00  Error: WP at LBA = 0x393ed66f = 960419439

  Commands leading to the command that caused the error were:
  CR FEATR COUNT  LBA_48  LH LM LL DV DC  Powered_Up_Time  Command/Feature_Name
  -- == -- == -- == == == -- -- -- -- --  ---------------  --------------------
  61 00 00 00 c8 00 00 36 3d b7 a8 40 00     00:09:42.248  WRITE FPDMA QUEUED
  60 00 00 00 08 00 00 39 3e d6 68 40 00     00:09:42.237  READ FPDMA QUEUED
  ea 00 00 00 00 00 00 00 00 00 00 a0 00     00:09:41.997  FLUSH CACHE EXT
  61 00 00 00 08 00 00 36 3d b7 a0 40 00     00:09:41.996  WRITE FPDMA QUEUED
  ea 00 00 00 00 00 00 00 00 00 00 a0 00     00:09:41.985  FLUSH CACHE EXT

SMART Extended Self-test Log Version: 1 (1 sectors)
Num  Test_Description    Status                  Remaining  LifeTime(hours)  LBA_of_first_error
# 1  Short offline       Completed without error       00%         4         -

SMART Selective self-test log data structure revision number 1
 SPAN  MIN_LBA  MAX_LBA  CURRENT_TEST_STATUS
    1        0        0  Not_testing
    2        0        0  Not_testing
    3        0        0  Not_testing
    4        0        0  Not_testing
    5        0        0  Not_testing
Selective self-test flags (0x0):
  After scanning selected spans, do NOT read-scan remainder of disk.
If Selective self-test is pending on power-up, resume after 0 minute delay.

SCT Status Version:                  3
SCT Version (vendor specific):       522 (0x020a)
Device State:                        Active (0)
Current Temperature:                    31 Celsius
Power Cycle Min/Max Temperature:     23/33 Celsius
Lifetime    Min/Max Temperature:     16/51 Celsius
Under/Over Temperature Limit Count:   0/135611

SCT Temperature History Version:     2
Temperature Sampling Period:         1 minute
Temperature Logging Interval:        1 minute
Min/Max recommended Temperature:      0/ 0 Celsius
Min/Max Temperature Limit:            0/ 0 Celsius
Temperature History Size (Index):    128 (122)

SCT Error Recovery Control:
           Read: Disabled
          Write: Disabled

SATA Phy Event Counters (GP Log 0x11)
ID      Size     Value  Description
0x000a  2            6  Device-to-host register FISes sent due to a COMRESET
0x0001  2            0  Command failed due to ICRC error
0x0003  2            0  R_ERR response for device-to-host data FIS
0x0004  2            0  R_ERR response for host-to-device data FIS
0x0006  2            0  R_ERR response for device-to-host non-data FIS
0x0007  2            0  R_ERR response for host-to-device non-data FIS

