smartctl 7.1 2020-06-20 r5066 [x86_64-linux-3.10.0-1127...] (local build)
Copyright (C) 2002-19, Bruce Allen, Christian Franke, www.smartmontools.org

=== START OF INFORMATION SECTION ===
Model Number:                       WUS4BB096D7P3E1
Serial Number:                      --
Firmware Version:                   R1110009
PCI Vendor/Subsystem ID:            0x1b96
IEEE OUI Identifier:                0x0014ee
Total NVM Capacity:                 960,197,124,096 [960 GB]
Unallocated NVM Capacity:           0
Controller ID:                      0
Number of Namespaces:               1
Namespace 1 Size/Capacity:          960,197,124,096 [960 GB]
Namespace 1 Formatted LBA Size:     512
Namespace 1 IEEE EUI-64:            0014ee ...
Local Time is:                      --

=== START OF READ SMART DATA SECTION ===
SMART overall-health self-assessment test result: PASSED

SMART/Health Information (NVMe Log 0x02)
Critical Warning:                   0x00
Temperature:                        48 Celsius
Available Spare:                    100%
Available Spare Threshold:          10%
Percentage Used:                    1%
Data Units Read:                    80,409,579 [41.1 TB]
Data Units Written:                 101,007,218 [51.7 TB]
Host Read Commands:                 601,051,909
Host Write Commands:                2,596,517,061
Controller Busy Time:               212,963
Power Cycles:                       4
Power On Hours:                     4,216
Unsafe Shutdowns:                   1
Media and Data Integrity Errors:    0
Error Information Log Entries:      1
Warning  Comp. Temperature Time:    0
Critical Comp. Temperature Time:    0
Temperature Sensor 1:               47 Celsius

