smartctl 7.1 2020-06-20 r5066 [x86_64-linux-3.10.0-1127...] (local build)
Copyright (C) 2002-19, Bruce Allen, Christian Franke, www.smartmontools.org

=== START OF INFORMATION SECTION ===
Model Number:                       WUS4BB096D7P3E1
Serial Number:                      --
Firmware Version:                   R1110012
PCI Vendor/Subsystem ID:            0x1b96
IEEE OUI Identifier:                0x0014ee
Total NVM Capacity:                 720,150,552,576 [720 GB]
Unallocated NVM Capacity:           0
Controller ID:                      0
Number of Namespaces:               1
Namespace 1 Size/Capacity:          720,150,552,576 [720 GB]
Namespace 1 Formatted LBA Size:     512
Namespace 1 IEEE EUI-64:            0014ee ...
Local Time is:                      --

=== START OF READ SMART DATA SECTION ===
SMART overall-health self-assessment test result: PASSED

SMART/Health Information (NVMe Log 0x02)
Critical Warning:                   0x00
Temperature:                        45 Celsius
Available Spare:                    100%
Available Spare Threshold:          10%
Percentage Used:                    0%
Data Units Read:                    14,870,484 [7.61 TB]
Data Units Written:                 105,568,237 [54.0 TB]
Host Read Commands:                 620,250,376
Host Write Commands:                1,010,267,805
Controller Busy Time:               369,909
Power Cycles:                       8
Power On Hours:                     7,212
Unsafe Shutdowns:                   2
Media and Data Integrity Errors:    0
Error Information Log Entries:      4
Warning  Comp. Temperature Time:    0
Critical Comp. Temperature Time:    0
Temperature Sensor 1:               42 Celsius

