smartctl 7.0 2019-05-21 r4916 [x86_64-linux-3.10.0-862...] (local build)
Copyright (C) 2002-18, Bruce Allen, Christian Franke, www.smartmontools.org

=== START OF INFORMATION SECTION ===
Model Family:     Seagate Barracuda 7200.12
Device Model:     ST31000524AS
Serial Number:    --
LU WWN Device Id: 5 000c50 ...
Firmware Version: JC4B
User Capacity:    1,000,204,886,016 bytes [1.00 TB]
Sector Size:      512 bytes logical/physical
Rotation Rate:    7200 rpm
Device is:        In smartctl database [for details use: -P show]
ATA Version is:   ATA8-ACS T13/1699-D revision 4
SATA Version is:  SATA 3.0, 6.0 Gb/s (current: 3.0 Gb/s)
Local Time is:    Mon Jan ... 2022 CET

AAM level is:     254 (maximum performance), recommended: 208
Rd look-ahead is: Enabled
Write cache is:   Enabled
ATA Security is:  Disabled, NOT FROZEN [SEC1]

=== START OF READ SMART DATA SECTION ===
SMART overall-health self-assessment test result: FAILED!
Drive failure expected in less than 24 hours. SAVE ALL DATA.

General SMART Values:
Offline data collection status:  (0x82)	Offline data collection activity
					was completed without error.

Self-test execution status:      (   0)	The previous self-test routine completed
					without error or no self-test has ever 
					been run.
Total time to complete Offline 
data collection: 		(  600) seconds.
Offline data collection
capabilities: 			 (0x7b) SMART execute Offline immediate.

					Suspend Offline collection upon new
					command.
					Offline surface scan supported.
					Self-test supported.
					Conveyance Self-test supported.
					Selective Self-test supported.
SMART capabilities:            (0x0003)	Saves SMART data before entering
					power-saving mode.

Error logging capability:        (0x01)	Error logging supported.
					General Purpose Logging supported.
Short self-test routine 
recommended polling time: 	 (   1) minutes.
Extended self-test routine
recommended polling time: 	 ( 174) minutes.
Conveyance self-test routine
recommended polling time: 	 (   2) minutes.
SCT capabilities: 	       (0x103f)	SCT Status supported.
					SCT Error Recovery Control supported.
					SCT Feature Control supported.
					SCT Data Table supported.

SMART Attributes Data Structure revision number: 10
Vendor Specific SMART Attributes with Thresholds:
ID# ATTRIBUTE_NAME          FLAGS    VALUE WORST THRESH FAIL RAW_VALUE
  1 Raw_Read_Error_Rate     POSR--   074   073   006    -    103362713
  3 Spin_Up_Time            PO----   100   100   000    -    0
  4 Start_Stop_Count        -O--CK   100   100   020    -    61
  5 Reallocated_Sector_Ct   PO--CK   002   002   036    NOW  4015
  7 Seek_Error_Rate         POSR--   087   060   030    -    620472544
  9 Power_On_Hours          -O--CK   055   055   000    -    40264
 10 Spin_Retry_Count        PO--C-   100   100   097    -    0
 12 Power_Cycle_Count       -O--CK   100   100   020    -    59
183 Runtime_Bad_Block       -O--CK   001   001   000    -    1110
184 End-to-End_Error        -O--CK   100   100   099    -    0
187 Reported_Uncorrect      -O--CK   001   001   000    -    1290
188 Command_Timeout         -O--CK   100   063   000    -    4690177623166
189 High_Fly_Writes         -O-RCK   100   100   000    -    0
190 Airflow_Temperature_Cel -O---K   077   059   045    -    23 (Min/Max 22/41)
194 Temperature_Celsius     -O---K   023   041   000    -    23 (0 21 0 0 0)
195 Hardware_ECC_Recovered  -O-RC-   041   015   000    -    103362713
197 Current_Pending_Sector  -O--C-   100   100   000    -    0
198 Offline_Uncorrectable   ----C-   100   100   000    -    0
199 UDMA_CRC_Error_Count    -OSRCK   200   200   000    -    0
240 Head_Flying_Hours       ------   100   253   000    -    40367 (172 47 0)
241 Total_LBAs_Written      ------   100   253   000    -    1804039349
242 Total_LBAs_Read         ------   100   253   000    -    573921159
                            ||||||_ K auto-keep
                            |||||__ C event count
                            ||||___ R error rate
                            |||____ S speed/performance
                            ||_____ O updated online
                            |______ P prefailure warning

General Purpose Log Directory Version 1
SMART           Log Directory Version 1 [multi-sector log support]
Address    Access  R/W   Size  Description
0x00       GPL,SL  R/O      1  Log Directory
0x01       GPL,SL  R/O      1  Summary SMART error log
0x02       GPL,SL  R/O      5  Comprehensive SMART error log
0x03       GPL     R/O      5  Ext. Comprehensive SMART error log
0x06       GPL,SL  R/O      1  SMART self-test log
0x07       GPL     R/O      1  Extended self-test log
0x09       GPL,SL  R/W      1  Selective self-test log
0x10       GPL     R/O      1  NCQ Command Error log
0x11       GPL     R/O      1  SATA Phy Event Counters log
0x21       GPL     R/O      1  Write stream error log
0x22       GPL     R/O      1  Read stream error log
0x80-0x9f  GPL,SL  R/W     16  Host vendor specific log
0xa1       GPL,SL  VS      20  Device vendor specific log
0xa2       GPL     VS    2248  Device vendor specific log
0xa8       GPL,SL  VS     129  Device vendor specific log
0xa9       GPL,SL  VS       1  Device vendor specific log
0xb0       GPL     VS    2928  Device vendor specific log
0xbd       GPL     VS     252  Device vendor specific log
0xbe-0xbf  GPL     VS   65535  Device vendor specific log
0xc0       GPL,SL  VS       1  Device vendor specific log
0xe0       GPL,SL  R/W      1  SCT Command/Status
0xe1       GPL,SL  R/W      1  SCT Data Transfer

SMART Extended Comprehensive Error Log Version: 1 (5 sectors)
Device Error Count: 1277 (device log contains only the most recent 20 errors)
	CR     = Command Register
	FEATR  = Features Register
	COUNT  = Count (was: Sector Count) Register
	LBA_48 = Upper bytes of LBA High/Mid/Low Registers ]  ATA-8
	LH     = LBA High (was: Cylinder High) Register    ]   LBA
	LM     = LBA Mid (was: Cylinder Low) Register      ] Register
	LL     = LBA Low (was: Sector Number) Register     ]
	DV     = Device (was: Device/Head) Register
	DC     = Device Control Register
	ER     = Error register
	ST     = Status register
Powered_Up_Time is measured from power on, and printed as
DDd+hh:mm:SS.sss where DD=days, hh=hours, mm=minutes,
SS=sec, and sss=millisec. It "wraps" after 49.710 days.

Error 1277 [16] occurred at disk power-on lifetime: 39616 hours (1650 days + 16 hours)
  When the command that caused the error occurred, the device was active or idle.

  After command completion occurred, registers were:
  ER -- ST COUNT  LBA_48  LH LM LL DV DC
  -- -- -- == -- == == == -- -- -- -- --
  40 -- 51 00 00 00 00 2e 04 ad e9 00 00  Error: UNC at LBA = 0x2e04ade9 = 772058601

  Commands leading to the command that caused the error were:
  CR FEATR COUNT  LBA_48  LH LM LL DV DC  Powered_Up_Time  Command/Feature_Name
  -- == -- == -- == == == -- -- -- -- --  ---------------  --------------------
  25 00 00 00 08 00 00 2e 04 ad e8 e0 00     23:29:06.764  READ DMA EXT
  25 00 00 00 08 00 00 2e 04 ad e0 e0 00     23:29:06.603  READ DMA EXT
  35 00 00 00 08 00 00 19 0c 74 10 e0 00     23:29:06.602  WRITE DMA EXT
  ea 00 00 00 00 00 00 00 00 00 00 a0 00     23:29:06.561  FLUSH CACHE EXT
  35 00 00 00 08 00 00 19 0c 72 00 e0 00     23:29:06.561  WRITE DMA EXT

Error 1276 [15] occurred at disk power-on lifetime: 39616 hours (1650 days + 16 hours)
  When the command that caused the error occurred, the device was active or idle.

  After command completion occurred, registers were:
  ER -- ST COUNT  LBA_48  LH LM LL DV DC
  -- -- -- == -- == == == -- -- -- -- --
  40 -- 51 00 00 00 00 2e 04 ad e9 00 00  Error: UNC at LBA = 0x2e04ade9 = 772058601

  Commands leading to the command that caused the error were:
  CR FEATR COUNT  LBA_48  LH LM LL DV DC  Powered_Up_Time  Command/Feature_Name
  -- == -- == -- == == == -- -- -- -- --  ---------------  --------------------
  25 00 00 00 20 00 00 2e 04 ad e0 e0 00     23:29:02.100  READ DMA EXT
  25 00 00 00 08 00 00 2d 1e d1 78 e0 00     23:29:02.093  READ DMA EXT
  25 00 00 00 08 00 00 2b c1 04 10 e0 00     23:29:02.092  READ DMA EXT
  25 00 00 00 08 00 00 2b c1 03 c8 e0 00     23:29:02.083  READ DMA EXT
  25 00 00 00 08 00 00 27 49 e9 c0 e0 00     23:29:02.076  READ DMA EXT

Error 1275 [14] occurred at disk power-on lifetime: 39616 hours (1650 days + 16 hours)
  When the command that caused the error occurred, the device was active or idle.

  After command completion occurred, registers were:
  ER -- ST COUNT  LBA_48  LH LM LL DV DC
  -- -- -- == -- == == == -- -- -- -- --
  40 -- 51 00 00 00 00 4b bc 12 06 00 00  Error: UNC at LBA = 0x4bbc1206 = 1270616582

  Commands leading to the command that caused the error were:
  CR FEATR COUNT  LBA_48  LH LM LL DV DC  Powered_Up_Time  Command/Feature_Name
  -- == -- == -- == == == -- -- -- -- --  ---------------  --------------------
  25 00 00 00 08 00 00 4b bc 11 b8 e0 00     23:26:54.935  READ DMA EXT
  25 00 00 00 08 00 00 4b bc 11 a8 e0 00     23:26:53.928  READ DMA EXT
  25 00 00 00 08 00 00 4b bc 11 a0 e0 00     23:26:53.595  READ DMA EXT
  25 00 00 00 08 00 00 4b bc 11 98 e0 00     23:26:53.464  READ DMA EXT
  25 00 00 00 08 00 00 4b bc 11 90 e0 00     23:26:53.463  READ DMA EXT

Error 1274 [13] occurred at disk power-on lifetime: 39616 hours (1650 days + 16 hours)
  When the command that caused the error occurred, the device was active or idle.

  After command completion occurred, registers were:
  ER -- ST COUNT  LBA_48  LH LM LL DV DC
  -- -- -- == -- == == == -- -- -- -- --
  40 -- 51 00 00 00 00 4b bc 11 96 00 00  Error: UNC at LBA = 0x4bbc1196 = 1270616470

  Commands leading to the command that caused the error were:
  CR FEATR COUNT  LBA_48  LH LM LL DV DC  Powered_Up_Time  Command/Feature_Name
  -- == -- == -- == == == -- -- -- -- --  ---------------  --------------------
  25 00 00 00 08 00 00 4b bc 11 90 e0 00     23:26:50.664  READ DMA EXT
  25 00 00 00 08 00 00 4b bc 11 88 e0 00     23:26:42.163  READ DMA EXT
  25 00 00 00 08 00 00 4b bc 11 80 e0 00     23:26:41.793  READ DMA EXT
  35 00 00 00 08 00 00 72 62 0c 38 e0 00     23:26:41.626  WRITE DMA EXT
  35 00 00 00 08 00 00 6f 6d 24 80 e0 00     23:26:41.625  WRITE DMA EXT

Error 1273 [12] occurred at disk power-on lifetime: 39616 hours (1650 days + 16 hours)
  When the command that caused the error occurred, the device was active or idle.

  After command completion occurred, registers were:
  ER -- ST COUNT  LBA_48  LH LM LL DV DC
  -- -- -- == -- == == == -- -- -- -- --
  40 -- 51 00 00 00 00 52 a8 cb 54 00 00  Error: UNC at LBA = 0x52a8cb54 = 1386793812

  Commands leading to the command that caused the error were:
  CR FEATR COUNT  LBA_48  LH LM LL DV DC  Powered_Up_Time  Command/Feature_Name
  -- == -- == -- == == == -- -- -- -- --  ---------------  --------------------
  25 00 00 00 08 00 00 52 a8 cb 08 e0 00     23:26:24.637  READ DMA EXT
  25 00 00 00 08 00 00 52 a8 cb 00 e0 00     23:26:24.611  READ DMA EXT
  35 00 00 00 08 00 00 72 62 0c 20 e0 00     23:26:24.611  WRITE DMA EXT
  35 00 00 00 08 00 00 5e 50 c4 28 e0 00     23:26:24.610  WRITE DMA EXT
  35 00 00 00 08 00 00 54 65 17 20 e0 00     23:26:24.610  WRITE DMA EXT

Error 1272 [11] occurred at disk power-on lifetime: 39616 hours (1650 days + 16 hours)
  When the command that caused the error occurred, the device was active or idle.

  After command completion occurred, registers were:
  ER -- ST COUNT  LBA_48  LH LM LL DV DC
  -- -- -- == -- == == == -- -- -- -- --
  40 -- 51 00 00 00 00 52 b4 62 00 00 00  Error: UNC at LBA = 0x52b46200 = 1387553280

  Commands leading to the command that caused the error were:
  CR FEATR COUNT  LBA_48  LH LM LL DV DC  Powered_Up_Time  Command/Feature_Name
  -- == -- == -- == == == -- -- -- -- --  ---------------  --------------------
  25 00 00 00 08 00 00 52 b4 61 a0 e0 00     23:26:07.545  READ DMA EXT
  25 00 00 00 08 00 00 52 b4 61 98 e0 00     23:26:07.513  READ DMA EXT
  25 00 00 00 08 00 00 52 b4 61 88 e0 00     23:26:07.071  READ DMA EXT
  25 00 00 00 08 00 00 52 b4 61 80 e0 00     23:26:07.039  READ DMA EXT
  ca 00 00 00 08 00 00 00 5c 49 80 e0 00     23:26:07.027  WRITE DMA

Error 1271 [10] occurred at disk power-on lifetime: 39616 hours (1650 days + 16 hours)
  When the command that caused the error occurred, the device was active or idle.

  After command completion occurred, registers were:
  ER -- ST COUNT  LBA_48  LH LM LL DV DC
  -- -- -- == -- == == == -- -- -- -- --
  40 -- 51 00 00 00 00 4b bc 11 96 00 00  Error: UNC at LBA = 0x4bbc1196 = 1270616470

  Commands leading to the command that caused the error were:
  CR FEATR COUNT  LBA_48  LH LM LL DV DC  Powered_Up_Time  Command/Feature_Name
  -- == -- == -- == == == -- -- -- -- --  ---------------  --------------------
  25 00 00 03 80 00 00 4b bc 10 00 e0 00     23:24:52.199  READ DMA EXT
  25 00 00 00 80 00 00 49 8e ef 80 e0 00     23:24:52.190  READ DMA EXT
  25 00 00 04 00 00 00 49 33 7c 00 e0 00     23:24:52.184  READ DMA EXT
  25 00 00 04 00 00 00 49 33 78 00 e0 00     23:24:52.164  READ DMA EXT
  25 00 00 00 60 00 00 65 8b 4d e8 e0 00     23:24:52.145  READ DMA EXT

Error 1270 [9] occurred at disk power-on lifetime: 39616 hours (1650 days + 16 hours)
  When the command that caused the error occurred, the device was active or idle.

  After command completion occurred, registers were:
  ER -- ST COUNT  LBA_48  LH LM LL DV DC
  -- -- -- == -- == == == -- -- -- -- --
  40 -- 51 00 00 00 00 52 a8 cb 54 00 00  Error: UNC at LBA = 0x52a8cb54 = 1386793812

  Commands leading to the command that caused the error were:
  CR FEATR COUNT  LBA_48  LH LM LL DV DC  Powered_Up_Time  Command/Feature_Name
  -- == -- == -- == == == -- -- -- -- --  ---------------  --------------------
  25 00 00 04 00 00 00 52 a8 c8 00 e0 00     23:23:17.314  READ DMA EXT
  25 00 00 02 80 00 00 4e cd c5 80 e0 00     23:23:17.219  READ DMA EXT
  25 00 00 04 00 00 00 4e cd c1 80 e0 00     23:23:17.160  READ DMA EXT
  25 00 00 01 08 00 00 4c 6d f0 f8 e0 00     23:23:17.150  READ DMA EXT
  25 00 00 00 80 00 00 49 fc 87 80 e0 00     23:23:17.148  READ DMA EXT

SMART Extended Self-test Log Version: 1 (1 sectors)
No self-tests have been logged.  [To run self-tests, use: smartctl -t]

SMART Selective self-test log data structure revision number 1
 SPAN  MIN_LBA  MAX_LBA  CURRENT_TEST_STATUS
    1        0        0  Not_testing
    2        0        0  Not_testing
    3        0        0  Not_testing
    4        0        0  Not_testing
    5        0        0  Not_testing
Selective self-test flags (0x0):
  After scanning selected spans, do NOT read-scan remainder of disk.
If Selective self-test is pending on power-up, resume after 0 minute delay.

SCT Status Version:                  3
SCT Version (vendor specific):       522 (0x020a)
Device State:                        Active (0)
Current Temperature:                    23 Celsius
Power Cycle Min/Max Temperature:     22/41 Celsius
Lifetime    Min/Max Temperature:     21/41 Celsius
Under/Over Temperature Limit Count:   0/0

SCT Temperature History Version:     2
Temperature Sampling Period:         1 minute
Temperature Logging Interval:        59 minutes
Min/Max recommended Temperature:     14/55 Celsius
Min/Max Temperature Limit:           10/60 Celsius
Temperature History Size (Index):    128 (74)

SCT Error Recovery Control:
           Read: Disabled
          Write: Disabled

SATA Phy Event Counters (GP Log 0x11)
ID      Size     Value  Description
0x000a  2         1164  Device-to-host register FISes sent due to a COMRESET
0x0001  2            0  Command failed due to ICRC error
0x0003  2            8  R_ERR response for device-to-host data FIS
0x0004  2            0  R_ERR response for host-to-device data FIS
0x0006  2            8  R_ERR response for device-to-host non-data FIS
0x0007  2            0  R_ERR response for host-to-device non-data FIS

