smartctl 7.1 2020-06-20 r5066 [x86_64-linux-3.10.0-1160...] (local build)
Copyright (C) 2002-19, Bruce Allen, Christian Franke, www.smartmontools.org

=== START OF INFORMATION SECTION ===
Model Number:                       ADATA SX8200PNP
Serial Number:                      --
Firmware Version:                   42A4SANA
PCI Vendor/Subsystem ID:            0x1cc1
IEEE OUI Identifier:                0x000000
Controller ID:                      1
Number of Namespaces:               1
Namespace 1 Size/Capacity:          512,110,190,592 [512 GB]
Namespace 1 Utilization:            464,938,102,784 [464 GB]
Namespace 1 Formatted LBA Size:     512
Local Time is:                      --

=== START OF READ SMART DATA SECTION ===
SMART overall-health self-assessment test result: PASSED

SMART/Health Information (NVMe Log 0x02)
Critical Warning:                   0x00
Temperature:                        33 Celsius
Available Spare:                    100%
Available Spare Threshold:          10%
Percentage Used:                    50%
Data Units Read:                    10,435,609 [5.34 TB]
Data Units Written:                 158,267,886 [81.0 TB]
Host Read Commands:                 123,700,579
Host Write Commands:                6,881,764,557
Controller Busy Time:               70,008
Power Cycles:                       26
Power On Hours:                     3,334
Unsafe Shutdowns:                   20
Media and Data Integrity Errors:    0
Error Information Log Entries:      0
Warning  Comp. Temperature Time:    0
Critical Comp. Temperature Time:    0
Temperature Sensor 2:               33 Celsius
Temperature Sensor 3:               41 Celsius
Temperature Sensor 4:               28 Celsius
Temperature Sensor 5:               28 Celsius
Temperature Sensor 6:               33 Celsius

