smartctl 7.1 2020-06-20 r5066 [x86_64-linux-3.10.0-957...] (local build)
Copyright (C) 2002-19, Bruce Allen, Christian Franke, www.smartmontools.org

=== START OF INFORMATION SECTION ===
Model Number:                       Samsung SSD 970 EVO Plus 1TB
Serial Number:                      --
Firmware Version:                   2B2QEXM7
PCI Vendor/Subsystem ID:            0x144d
IEEE OUI Identifier:                0x002538
Total NVM Capacity:                 1,000,204,886,016 [1.00 TB]
Unallocated NVM Capacity:           0
Controller ID:                      4
Number of Namespaces:               1
Namespace 1 Size/Capacity:          1,000,204,886,016 [1.00 TB]
Namespace 1 Utilization:            948,734,939,136 [948 GB]
Namespace 1 Formatted LBA Size:     512
Namespace 1 IEEE EUI-64:            002538 ...
Local Time is:                      --

=== START OF READ SMART DATA SECTION ===
SMART overall-health self-assessment test result: PASSED

SMART/Health Information (NVMe Log 0x02)
Critical Warning:                   0x00
Temperature:                        59 Celsius
Available Spare:                    100%
Available Spare Threshold:          10%
Percentage Used:                    22%
Data Units Read:                    243,706,001 [124 TB]
Data Units Written:                 336,992,633 [172 TB]
Host Read Commands:                 8,403,411,873
Host Write Commands:                10,008,588,570
Controller Busy Time:               64,130
Power Cycles:                       12
Power On Hours:                     10,303
Unsafe Shutdowns:                   8
Media and Data Integrity Errors:    0
Error Information Log Entries:      0
Warning  Comp. Temperature Time:    0
Critical Comp. Temperature Time:    0
Temperature Sensor 1:               59 Celsius
Temperature Sensor 2:               79 Celsius

