smartctl 7.1 2020-06-20 r5066 [x86_64-linux-3.10.0-1160...] (local build)
Copyright (C) 2002-19, Bruce Allen, Christian Franke, www.smartmontools.org

=== START OF INFORMATION SECTION ===
Model Number:                       Micron_2200_MTFDHBA512TCK
Serial Number:                      --
Firmware Version:                   P1MU003
PCI Vendor/Subsystem ID:            0x1344
IEEE OUI Identifier:                0x00a075
Controller ID:                      0
Number of Namespaces:               1
Namespace 1 Size/Capacity:          512,110,190,592 [512 GB]
Namespace 1 Formatted LBA Size:     512
Namespace 1 IEEE EUI-64:            00a075 ...
Local Time is:                      Sat Jan ... 2022 WIB

=== START OF READ SMART DATA SECTION ===
SMART overall-health self-assessment test result: PASSED

SMART/Health Information (NVMe Log 0x02)
Critical Warning:                   0x00
Temperature:                        66 Celsius
Available Spare:                    100%
Available Spare Threshold:          5%
Percentage Used:                    20%
Data Units Read:                    13,544,677 [6.93 TB]
Data Units Written:                 34,956,822 [17.8 TB]
Host Read Commands:                 100,013,740
Host Write Commands:                1,802,618,793
Controller Busy Time:               29,657
Power Cycles:                       28
Power On Hours:                     10,267
Unsafe Shutdowns:                   8
Media and Data Integrity Errors:    0
Error Information Log Entries:      0
Warning  Comp. Temperature Time:    0
Critical Comp. Temperature Time:    0
Temperature Sensor 1:               66 Celsius
Temperature Sensor 2:               70 Celsius

