smartctl 7.1 2020-06-20 r5066 [x86_64-linux-3.10.0-1160...] (local build)
Copyright (C) 2002-19, Bruce Allen, Christian Franke, www.smartmontools.org

=== START OF INFORMATION SECTION ===
Model Number:                       Micron_2200_MTFDHBA512TCK
Serial Number:                      --
Firmware Version:                   P1MU003
PCI Vendor/Subsystem ID:            0x1344
IEEE OUI Identifier:                0x00a075
Controller ID:                      0
Number of Namespaces:               1
Namespace 1 Size/Capacity:          512,110,190,592 [512 GB]
Namespace 1 Formatted LBA Size:     512
Namespace 1 IEEE EUI-64:            00a075 ...
Local Time is:                      Sat Nov ... 2021 WIB

=== START OF READ SMART DATA SECTION ===
SMART overall-health self-assessment test result: PASSED

SMART/Health Information (NVMe Log 0x02)
Critical Warning:                   0x00
Temperature:                        66 Celsius
Available Spare:                    100%
Available Spare Threshold:          5%
Percentage Used:                    40%
Data Units Read:                    18,903,197 [9.67 TB]
Data Units Written:                 113,128,685 [57.9 TB]
Host Read Commands:                 122,771,028
Host Write Commands:                3,342,848,323
Controller Busy Time:               55,324
Power Cycles:                       33
Power On Hours:                     10,022
Unsafe Shutdowns:                   10
Media and Data Integrity Errors:    0
Error Information Log Entries:      0
Warning  Comp. Temperature Time:    0
Critical Comp. Temperature Time:    0
Temperature Sensor 1:               66 Celsius
Temperature Sensor 2:               70 Celsius

