smartctl 7.1 2020-06-20 r5066 [x86_64-linux-3.10.0-1127...] (local build)
Copyright (C) 2002-19, Bruce Allen, Christian Franke, www.smartmontools.org

=== START OF INFORMATION SECTION ===
Model Number:                       Micron_2200_MTFDHBA512TCK
Serial Number:                      --
Firmware Version:                   P1MU003
PCI Vendor/Subsystem ID:            0x1344
IEEE OUI Identifier:                0x00a075
Controller ID:                      0
Number of Namespaces:               1
Namespace 1 Size/Capacity:          512,110,190,592 [512 GB]
Namespace 1 Formatted LBA Size:     512
Namespace 1 IEEE EUI-64:            00a075 ...
Local Time is:                      Sun Sep ... 2021 WIB

=== START OF READ SMART DATA SECTION ===
SMART overall-health self-assessment test result: PASSED

SMART/Health Information (NVMe Log 0x02)
Critical Warning:                   0x00
Temperature:                        60 Celsius
Available Spare:                    100%
Available Spare Threshold:          5%
Percentage Used:                    2%
Data Units Read:                    4,525,147 [2.31 TB]
Data Units Written:                 9,732,967 [4.98 TB]
Host Read Commands:                 73,702,264
Host Write Commands:                621,609,327
Controller Busy Time:               10,436
Power Cycles:                       24
Power On Hours:                     2,238
Unsafe Shutdowns:                   5
Media and Data Integrity Errors:    0
Error Information Log Entries:      0
Warning  Comp. Temperature Time:    0
Critical Comp. Temperature Time:    0
Temperature Sensor 1:               60 Celsius
Temperature Sensor 2:               64 Celsius

