smartctl 7.1 2020-06-20 r5066 [x86_64-linux-3.10.0-1160...] (local build)
Copyright (C) 2002-19, Bruce Allen, Christian Franke, www.smartmontools.org

=== START OF INFORMATION SECTION ===
Model Number:                       SAMSUNG MZQLB3T8HALS-00007
Serial Number:                      --
Firmware Version:                   EDA5502Q
PCI Vendor/Subsystem ID:            0x144d
IEEE OUI Identifier:                0x002538
Total NVM Capacity:                 3,840,755,982,336 [3.84 TB]
Unallocated NVM Capacity:           0
Controller ID:                      4
Number of Namespaces:               1
Namespace 1 Size/Capacity:          3,840,755,982,336 [3.84 TB]
Namespace 1 Utilization:            2,321,201,356,800 [2.32 TB]
Namespace 1 Formatted LBA Size:     512
Local Time is:                      Mon Nov ... 2021 +07

=== START OF READ SMART DATA SECTION ===
SMART overall-health self-assessment test result: PASSED

SMART/Health Information (NVMe Log 0x02)
Critical Warning:                   0x00
Temperature:                        42 Celsius
Available Spare:                    100%
Available Spare Threshold:          10%
Percentage Used:                    0%
Data Units Read:                    18,321,053 [9.38 TB]
Data Units Written:                 54,076,079 [27.6 TB]
Host Read Commands:                 100,887,166
Host Write Commands:                1,055,157,707
Controller Busy Time:               508
Power Cycles:                       4
Power On Hours:                     4,957
Unsafe Shutdowns:                   1
Media and Data Integrity Errors:    0
Error Information Log Entries:      1
Warning  Comp. Temperature Time:    0
Critical Comp. Temperature Time:    0
Temperature Sensor 1:               42 Celsius
Temperature Sensor 2:               46 Celsius
Temperature Sensor 3:               51 Celsius

