smartctl 7.1 2020-06-20 r5066 [x86_64-linux-3.10.0-1160...] (local build)
Copyright (C) 2002-19, Bruce Allen, Christian Franke, www.smartmontools.org

=== START OF INFORMATION SECTION ===
Model Number:                       SAMSUNG MZQLB3T8HALS-00007
Serial Number:                      --
Firmware Version:                   EDA5402Q
PCI Vendor/Subsystem ID:            0x144d
IEEE OUI Identifier:                0x002538
Total NVM Capacity:                 3,840,755,982,336 [3.84 TB]
Unallocated NVM Capacity:           0
Controller ID:                      4
Number of Namespaces:               1
Namespace 1 Size/Capacity:          3,840,755,982,336 [3.84 TB]
Namespace 1 Utilization:            3,004,409,200,640 [3.00 TB]
Namespace 1 Formatted LBA Size:     512
Local Time is:                      --

=== START OF READ SMART DATA SECTION ===
SMART overall-health self-assessment test result: PASSED

SMART/Health Information (NVMe Log 0x02)
Critical Warning:                   0x00
Temperature:                        29 Celsius
Available Spare:                    100%
Available Spare Threshold:          10%
Percentage Used:                    0%
Data Units Read:                    73,670,561 [37.7 TB]
Data Units Written:                 59,076,944 [30.2 TB]
Host Read Commands:                 402,179,378
Host Write Commands:                1,455,596,205
Controller Busy Time:               1,151
Power Cycles:                       2
Power On Hours:                     2,931
Unsafe Shutdowns:                   0
Media and Data Integrity Errors:    0
Error Information Log Entries:      0
Warning  Comp. Temperature Time:    0
Critical Comp. Temperature Time:    0
Temperature Sensor 1:               29 Celsius
Temperature Sensor 2:               33 Celsius
Temperature Sensor 3:               40 Celsius

