smartctl 7.1 2020-06-20 r5066 [x86_64-linux-3.10.0-1160...] (local build)
Copyright (C) 2002-19, Bruce Allen, Christian Franke, www.smartmontools.org

=== START OF INFORMATION SECTION ===
Model Number:                       SAMSUNG MZQLB3T8HALS-00007
Serial Number:                      --
Firmware Version:                   EDA5502Q
PCI Vendor/Subsystem ID:            0x144d
IEEE OUI Identifier:                0x002538
Total NVM Capacity:                 3 840 755 982 336 [3,84 TB]
Unallocated NVM Capacity:           0
Controller ID:                      4
Number of Namespaces:               1
Namespace 1 Size/Capacity:          3 840 755 982 336 [3,84 TB]
Namespace 1 Utilization:            3 839 759 740 928 [3,83 TB]
Namespace 1 Formatted LBA Size:     512
Local Time is:                      Wed Jan ... 2022 +07

=== START OF READ SMART DATA SECTION ===
SMART overall-health self-assessment test result: PASSED

SMART/Health Information (NVMe Log 0x02)
Critical Warning:                   0x00
Temperature:                        49 Celsius
Available Spare:                    100%
Available Spare Threshold:          10%
Percentage Used:                    4%
Data Units Read:                    1 849 487 707 [946 TB]
Data Units Written:                 1 866 691 970 [955 TB]
Host Read Commands:                 3 258 856 393
Host Write Commands:                2 247 047 443
Controller Busy Time:               29 886
Power Cycles:                       14
Power On Hours:                     6 839
Unsafe Shutdowns:                   5
Media and Data Integrity Errors:    0
Error Information Log Entries:      193
Warning  Comp. Temperature Time:    0
Critical Comp. Temperature Time:    0
Temperature Sensor 1:               49 Celsius
Temperature Sensor 2:               53 Celsius
Temperature Sensor 3:               58 Celsius

