smartctl 7.1 2020-06-20 r5066 [x86_64-linux-3.10.0-1160...] (local build)
Copyright (C) 2002-19, Bruce Allen, Christian Franke, www.smartmontools.org

=== START OF INFORMATION SECTION ===
Model Family:     Western Digital Red
Device Model:     WDC WD40EFRX-68WT0N0
Serial Number:    --
LU WWN Device Id: 5 0014ee ...
Firmware Version: 82.00A82
User Capacity:    4,000,787,030,016 bytes [4.00 TB]
Sector Sizes:     512 bytes logical, 4096 bytes physical
Rotation Rate:    5400 rpm
Device is:        In smartctl database [for details use: -P show]
ATA Version is:   ACS-2 (minor revision not indicated)
SATA Version is:  SATA 3.0, 6.0 Gb/s (current: 6.0 Gb/s)
Local Time is:    --
Rd look-ahead is: Enabled
Write cache is:   Disabled
ATA Security is:  Disabled, NOT FROZEN [SEC1]

=== START OF READ SMART DATA SECTION ===
SMART overall-health self-assessment test result: PASSED

General SMART Values:
Offline data collection status:  (0x00)	Offline data collection activity
					was never started.

Self-test execution status:      (   0)	The previous self-test routine completed
					without error or no self-test has ever 
					been run.
Total time to complete Offline 
data collection: 		(53160) seconds.
Offline data collection
capabilities: 			 (0x7b) SMART execute Offline immediate.

					Suspend Offline collection upon new
					command.
					Offline surface scan supported.
					Self-test supported.
					Conveyance Self-test supported.
					Selective Self-test supported.
SMART capabilities:            (0x0003)	Saves SMART data before entering
					power-saving mode.

Error logging capability:        (0x01)	Error logging supported.
					General Purpose Logging supported.
Short self-test routine 
recommended polling time: 	 (   2) minutes.
Extended self-test routine
recommended polling time: 	 ( 532) minutes.
Conveyance self-test routine
recommended polling time: 	 (   5) minutes.
SCT capabilities: 	       (0x703d)	SCT Status supported.
					SCT Error Recovery Control supported.
					SCT Feature Control supported.
					SCT Data Table supported.

SMART Attributes Data Structure revision number: 16
Vendor Specific SMART Attributes with Thresholds:
ID# ATTRIBUTE_NAME          FLAGS    VALUE WORST THRESH FAIL RAW_VALUE
  1 Raw_Read_Error_Rate     POSR-K   200   200   051    -    29479
  3 Spin_Up_Time            POS--K   186   183   021    -    7700
  4 Start_Stop_Count        -O--CK   089   089   000    -    11881
  5 Reallocated_Sector_Ct   PO--CK   200   200   140    -    0
  7 Seek_Error_Rate         -OSR-K   200   200   000    -    0
  9 Power_On_Hours          -O--CK   027   027   000    -    53419
 10 Spin_Retry_Count        -O--CK   100   100   000    -    0
 11 Calibration_Retry_Count -O--CK   100   100   000    -    0
 12 Power_Cycle_Count       -O--CK   089   089   000    -    11880
192 Power-Off_Retract_Count -O--CK   185   185   000    -    11878
193 Load_Cycle_Count        -O--CK   194   194   000    -    19482
194 Temperature_Celsius     -O---K   122   106   000    -    30
196 Reallocated_Event_Count -O--CK   200   200   000    -    0
197 Current_Pending_Sector  -O--CK   200   200   000    -    0
198 Offline_Uncorrectable   ----CK   100   253   000    -    0
199 UDMA_CRC_Error_Count    -O--CK   200   200   000    -    0
200 Multi_Zone_Error_Rate   ---R--   100   253   000    -    0
                            ||||||_ K auto-keep
                            |||||__ C event count
                            ||||___ R error rate
                            |||____ S speed/performance
                            ||_____ O updated online
                            |______ P prefailure warning

General Purpose Log Directory Version 1
SMART           Log Directory Version 1 [multi-sector log support]
Address    Access  R/W   Size  Description
0x00       GPL,SL  R/O      1  Log Directory
0x01           SL  R/O      1  Summary SMART error log
0x02           SL  R/O      5  Comprehensive SMART error log
0x03       GPL     R/O      6  Ext. Comprehensive SMART error log
0x06           SL  R/O      1  SMART self-test log
0x07       GPL     R/O      1  Extended self-test log
0x09           SL  R/W      1  Selective self-test log
0x10       GPL     R/O      1  NCQ Command Error log
0x11       GPL     R/O      1  SATA Phy Event Counters log
0x21       GPL     R/O      1  Write stream error log
0x22       GPL     R/O      1  Read stream error log
0x80-0x9f  GPL,SL  R/W     16  Host vendor specific log
0xa0-0xa7  GPL,SL  VS      16  Device vendor specific log
0xa8-0xb6  GPL,SL  VS       1  Device vendor specific log
0xb7       GPL,SL  VS      39  Device vendor specific log
0xbd       GPL,SL  VS       1  Device vendor specific log
0xc0       GPL,SL  VS       1  Device vendor specific log
0xc1       GPL     VS      93  Device vendor specific log
0xe0       GPL,SL  R/W      1  SCT Command/Status
0xe1       GPL,SL  R/W      1  SCT Data Transfer

SMART Extended Comprehensive Error Log Version: 1 (6 sectors)
Device Error Count: 6
	CR     = Command Register
	FEATR  = Features Register
	COUNT  = Count (was: Sector Count) Register
	LBA_48 = Upper bytes of LBA High/Mid/Low Registers ]  ATA-8
	LH     = LBA High (was: Cylinder High) Register    ]   LBA
	LM     = LBA Mid (was: Cylinder Low) Register      ] Register
	LL     = LBA Low (was: Sector Number) Register     ]
	DV     = Device (was: Device/Head) Register
	DC     = Device Control Register
	ER     = Error register
	ST     = Status register
Powered_Up_Time is measured from power on, and printed as
DDd+hh:mm:SS.sss where DD=days, hh=hours, mm=minutes,
SS=sec, and sss=millisec. It "wraps" after 49.710 days.

Error 6 [5] occurred at disk power-on lifetime: 34909 hours (1454 days + 13 hours)
  When the command that caused the error occurred, the device was active or idle.

  After command completion occurred, registers were:
  ER -- ST COUNT  LBA_48  LH LM LL DV DC
  -- -- -- == -- == == == -- -- -- -- --
  40 -- 51 00 01 00 00 00 4e e3 90 40 00  Error: UNC at LBA = 0x004ee390 = 5170064

  Commands leading to the command that caused the error were:
  CR FEATR COUNT  LBA_48  LH LM LL DV DC  Powered_Up_Time  Command/Feature_Name
  -- == -- == -- == == == -- -- -- -- --  ---------------  --------------------
  60 03 00 00 10 00 00 00 4e e4 80 40 00 30d+ ...          READ FPDMA QUEUED
  60 03 00 00 00 00 00 00 4e e1 80 40 00 30d+ ...          READ FPDMA QUEUED
  61 00 08 00 08 00 00 e8 c7 c5 38 c0 00 30d+ ...          WRITE FPDMA QUEUED
  61 00 08 00 00 00 00 00 05 20 b0 40 00 30d+ ...          WRITE FPDMA QUEUED
  ea 00 00 00 00 00 00 00 00 00 00 40 00 30d+ ...          FLUSH CACHE EXT

Error 5 [4] occurred at disk power-on lifetime: 12870 hours (536 days + 6 hours)
  When the command that caused the error occurred, the device was active or idle.

  After command completion occurred, registers were:
  ER -- ST COUNT  LBA_48  LH LM LL DV DC
  -- -- -- == -- == == == -- -- -- -- --
  10 -- 51 00 00 00 00 4a b0 da 00 40 00  Error: IDNF at LBA = 0x4ab0da00 = 1253104128

  Commands leading to the command that caused the error were:
  CR FEATR COUNT  LBA_48  LH LM LL DV DC  Powered_Up_Time  Command/Feature_Name
  -- == -- == -- == == == -- -- -- -- --  ---------------  --------------------
  61 02 00 00 e8 00 00 4a b0 da 00 40 00 20d+ ...          WRITE FPDMA QUEUED
  61 02 00 00 e0 00 00 4a b0 d8 00 40 00 20d+ ...          WRITE FPDMA QUEUED
  61 02 00 00 d8 00 00 4a b0 d6 00 40 00 20d+ ...          WRITE FPDMA QUEUED
  61 02 00 00 d0 00 00 4a b0 d4 00 40 00 20d+ ...          WRITE FPDMA QUEUED
  61 02 00 00 c8 00 00 4a b0 d2 00 40 00 20d+ ...          WRITE FPDMA QUEUED

Error 4 [3] occurred at disk power-on lifetime: 12707 hours (529 days + 11 hours)
  When the command that caused the error occurred, the device was active or idle.

  After command completion occurred, registers were:
  ER -- ST COUNT  LBA_48  LH LM LL DV DC
  -- -- -- == -- == == == -- -- -- -- --
  10 -- 51 00 00 00 01 95 2e 0a 00 40 00  Error: IDNF at LBA = 0x1952e0a00 = 6797789696

  Commands leading to the command that caused the error were:
  CR FEATR COUNT  LBA_48  LH LM LL DV DC  Powered_Up_Time  Command/Feature_Name
  -- == -- == -- == == == -- -- -- -- --  ---------------  --------------------
  61 02 00 00 b0 00 01 95 2e 0c 00 40 00 13d+ ...          WRITE FPDMA QUEUED
  61 02 00 00 a8 00 01 95 2e 0a 00 40 00 13d+ ...          WRITE FPDMA QUEUED
  61 02 00 00 a0 00 01 95 2e 08 00 40 00 13d+ ...          WRITE FPDMA QUEUED
  61 02 00 00 98 00 01 95 2e 06 00 40 00 13d+ ...          WRITE FPDMA QUEUED
  61 02 00 00 90 00 01 95 2e 04 00 40 00 13d+ ...          WRITE FPDMA QUEUED

Error 3 [2] occurred at disk power-on lifetime: 12172 hours (507 days + 4 hours)
  When the command that caused the error occurred, the device was active or idle.

  After command completion occurred, registers were:
  ER -- ST COUNT  LBA_48  LH LM LL DV DC
  -- -- -- == -- == == == -- -- -- -- --
  10 -- 51 00 00 00 01 13 a9 74 00 40 00  Error: IDNF at LBA = 0x113a97400 = 4624839680

  Commands leading to the command that caused the error were:
  CR FEATR COUNT  LBA_48  LH LM LL DV DC  Powered_Up_Time  Command/Feature_Name
  -- == -- == -- == == == -- -- -- -- --  ---------------  --------------------
  61 02 00 00 b0 00 01 13 a9 74 00 40 00 40d+ ...          WRITE FPDMA QUEUED
  61 02 00 00 a8 00 01 13 a9 72 00 40 00 40d+ ...          WRITE FPDMA QUEUED
  61 02 00 00 a0 00 01 13 a9 70 00 40 00 40d+ ...          WRITE FPDMA QUEUED
  61 02 00 00 98 00 01 13 a9 6e 00 40 00 40d+ ...          WRITE FPDMA QUEUED
  61 02 00 00 90 00 01 13 a9 6c 00 40 00 40d+ ...          WRITE FPDMA QUEUED

Error 2 [1] occurred at disk power-on lifetime: 12000 hours (500 days + 0 hours)
  When the command that caused the error occurred, the device was active or idle.

  After command completion occurred, registers were:
  ER -- ST COUNT  LBA_48  LH LM LL DV DC
  -- -- -- == -- == == == -- -- -- -- --
  10 -- 51 00 00 00 00 16 93 84 00 40 00  Error: IDNF at LBA = 0x16938400 = 378766336

  Commands leading to the command that caused the error were:
  CR FEATR COUNT  LBA_48  LH LM LL DV DC  Powered_Up_Time  Command/Feature_Name
  -- == -- == -- == == == -- -- -- -- --  ---------------  --------------------
  61 02 00 00 50 00 00 16 93 84 00 40 00 33d+ ...          WRITE FPDMA QUEUED
  61 02 00 00 48 00 00 16 93 82 00 40 00 33d+ ...          WRITE FPDMA QUEUED
  61 02 00 00 40 00 00 16 93 80 00 40 00 33d+ ...          WRITE FPDMA QUEUED
  61 02 00 00 38 00 00 16 93 7e 00 40 00 33d+ ...          WRITE FPDMA QUEUED
  61 02 00 00 30 00 00 16 93 7c 00 40 00 33d+ ...          WRITE FPDMA QUEUED

Error 1 [0] occurred at disk power-on lifetime: 11760 hours (490 days + 0 hours)
  When the command that caused the error occurred, the device was active or idle.

  After command completion occurred, registers were:
  ER -- ST COUNT  LBA_48  LH LM LL DV DC
  -- -- -- == -- == == == -- -- -- -- --
  10 -- 51 00 00 00 00 f4 9b b4 00 40 00  Error: IDNF at LBA = 0xf49bb400 = 4103844864

  Commands leading to the command that caused the error were:
  CR FEATR COUNT  LBA_48  LH LM LL DV DC  Powered_Up_Time  Command/Feature_Name
  -- == -- == -- == == == -- -- -- -- --  ---------------  --------------------
  61 02 00 00 48 00 00 f4 9b b4 00 40 00 23d+ ...          WRITE FPDMA QUEUED
  61 02 00 00 40 00 00 f4 9b b2 00 40 00 23d+ ...          WRITE FPDMA QUEUED
  61 02 00 00 38 00 00 f4 9b b0 00 40 00 23d+ ...          WRITE FPDMA QUEUED
  61 02 00 00 30 00 00 f4 9b ae 00 40 00 23d+ ...          WRITE FPDMA QUEUED
  61 02 00 00 28 00 00 f4 9b ac 00 40 00 23d+ ...          WRITE FPDMA QUEUED

SMART Extended Self-test Log Version: 1 (1 sectors)
No self-tests have been logged.  [To run self-tests, use: smartctl -t]

SMART Selective self-test log data structure revision number 1
 SPAN  MIN_LBA  MAX_LBA  CURRENT_TEST_STATUS
    1        0        0  Not_testing
    2        0        0  Not_testing
    3        0        0  Not_testing
    4        0        0  Not_testing
    5        0        0  Not_testing
Selective self-test flags (0x0):
  After scanning selected spans, do NOT read-scan remainder of disk.
If Selective self-test is pending on power-up, resume after 0 minute delay.

SCT Status Version:                  3
SCT Version (vendor specific):       258 (0x0102)
Device State:                        Active (0)
Current Temperature:                    30 Celsius
Power Cycle Min/Max Temperature:     24/31 Celsius
Lifetime    Min/Max Temperature:      3/46 Celsius
Under/Over Temperature Limit Count:   0/0
Vendor specific:
01 00 00 00 00 00 00 00 00 00 00 00 00 00 00 00
00 00 00 00 00 00 00 00 00 00 00 00 00 00 00 00

SCT Temperature History Version:     2
Temperature Sampling Period:         1 minute
Temperature Logging Interval:        1 minute
Min/Max recommended Temperature:      0/60 Celsius
Min/Max Temperature Limit:           -41/85 Celsius
Temperature History Size (Index):    478 (339)

SCT Error Recovery Control:
           Read:     70 (7.0 seconds)
          Write:     70 (7.0 seconds)

SATA Phy Event Counters (GP Log 0x11)
ID      Size     Value  Description
0x0001  2            0  Command failed due to ICRC error
0x0002  2            0  R_ERR response for data FIS
0x0003  2            0  R_ERR response for device-to-host data FIS
0x0004  2            0  R_ERR response for host-to-device data FIS
0x0005  2            6  R_ERR response for non-data FIS
0x0006  2            6  R_ERR response for device-to-host non-data FIS
0x0007  2            0  R_ERR response for host-to-device non-data FIS
0x0008  2            0  Device-to-host non-data FIS retries
0x0009  2           15  Transition from drive PhyRdy to drive PhyNRdy
0x000a  2           16  Device-to-host register FISes sent due to a COMRESET
0x000b  2            0  CRC errors within host-to-device FIS
0x000f  2            0  R_ERR response for host-to-device data FIS, CRC
0x0012  2            0  R_ERR response for host-to-device non-data FIS, CRC
0x8000  4      7292047  Vendor specific

