smartctl 7.1 2020-06-20 r5066 [x86_64-linux-3.10.0-1127...] (local build)
Copyright (C) 2002-19, Bruce Allen, Christian Franke, www.smartmontools.org

=== START OF INFORMATION SECTION ===
Model Family:     Western Digital Red
Device Model:     WDC WD40EFRX-68WT0N0
Serial Number:    --
LU WWN Device Id: 5 0014ee ...
Firmware Version: 82.00A82
User Capacity:    4,000,787,030,016 bytes [4.00 TB]
Sector Sizes:     512 bytes logical, 4096 bytes physical
Rotation Rate:    5400 rpm
Device is:        In smartctl database [for details use: -P show]
ATA Version is:   ACS-2 (minor revision not indicated)
SATA Version is:  SATA 3.0, 6.0 Gb/s (current: 6.0 Gb/s)
Local Time is:    --
Rd look-ahead is: Enabled
Write cache is:   Enabled
ATA Security is:  Disabled, NOT FROZEN [SEC1]

=== START OF READ SMART DATA SECTION ===
SMART overall-health self-assessment test result: PASSED

General SMART Values:
Offline data collection status:  (0x00)	Offline data collection activity
					was never started.

Self-test execution status:      (   0)	The previous self-test routine completed
					without error or no self-test has ever 
					been run.
Total time to complete Offline 
data collection: 		(55560) seconds.
Offline data collection
capabilities: 			 (0x7b) SMART execute Offline immediate.

					Suspend Offline collection upon new
					command.
					Offline surface scan supported.
					Self-test supported.
					Conveyance Self-test supported.
					Selective Self-test supported.
SMART capabilities:            (0x0003)	Saves SMART data before entering
					power-saving mode.

Error logging capability:        (0x01)	Error logging supported.
					General Purpose Logging supported.
Short self-test routine 
recommended polling time: 	 (   2) minutes.
Extended self-test routine
recommended polling time: 	 ( 555) minutes.
Conveyance self-test routine
recommended polling time: 	 (   5) minutes.
SCT capabilities: 	       (0x703d)	SCT Status supported.
					SCT Error Recovery Control supported.
					SCT Feature Control supported.
					SCT Data Table supported.

SMART Attributes Data Structure revision number: 16
Vendor Specific SMART Attributes with Thresholds:
ID# ATTRIBUTE_NAME          FLAGS    VALUE WORST THRESH FAIL RAW_VALUE
  1 Raw_Read_Error_Rate     POSR-K   200   200   051    -    3703
  3 Spin_Up_Time            POS--K   189   182   021    -    7525
  4 Start_Stop_Count        -O--CK   100   100   000    -    24
  5 Reallocated_Sector_Ct   PO--CK   200   200   140    -    0
  7 Seek_Error_Rate         -OSR-K   194   194   000    -    77
  9 Power_On_Hours          -O--CK   030   030   000    -    51581
 10 Spin_Retry_Count        -O--CK   100   253   000    -    0
 11 Calibration_Retry_Count -O--CK   100   253   000    -    0
 12 Power_Cycle_Count       -O--CK   100   100   000    -    24
192 Power-Off_Retract_Count -O--CK   200   200   000    -    22
193 Load_Cycle_Count        -O--CK   182   182   000    -    55123
194 Temperature_Celsius     -O---K   123   109   000    -    29
196 Reallocated_Event_Count -O--CK   200   200   000    -    0
197 Current_Pending_Sector  -O--CK   200   200   000    -    4
198 Offline_Uncorrectable   ----CK   100   253   000    -    0
199 UDMA_CRC_Error_Count    -O--CK   200   200   000    -    0
200 Multi_Zone_Error_Rate   ---R--   100   253   000    -    0
                            ||||||_ K auto-keep
                            |||||__ C event count
                            ||||___ R error rate
                            |||____ S speed/performance
                            ||_____ O updated online
                            |______ P prefailure warning

General Purpose Log Directory Version 1
SMART           Log Directory Version 1 [multi-sector log support]
Address    Access  R/W   Size  Description
0x00       GPL,SL  R/O      1  Log Directory
0x01           SL  R/O      1  Summary SMART error log
0x02           SL  R/O      5  Comprehensive SMART error log
0x03       GPL     R/O      6  Ext. Comprehensive SMART error log
0x06           SL  R/O      1  SMART self-test log
0x07       GPL     R/O      1  Extended self-test log
0x09           SL  R/W      1  Selective self-test log
0x10       GPL     R/O      1  NCQ Command Error log
0x11       GPL     R/O      1  SATA Phy Event Counters log
0x21       GPL     R/O      1  Write stream error log
0x22       GPL     R/O      1  Read stream error log
0x80-0x9f  GPL,SL  R/W     16  Host vendor specific log
0xa0-0xa7  GPL,SL  VS      16  Device vendor specific log
0xa8-0xb6  GPL,SL  VS       1  Device vendor specific log
0xb7       GPL,SL  VS      39  Device vendor specific log
0xbd       GPL,SL  VS       1  Device vendor specific log
0xc0       GPL,SL  VS       1  Device vendor specific log
0xc1       GPL     VS      93  Device vendor specific log
0xe0       GPL,SL  R/W      1  SCT Command/Status
0xe1       GPL,SL  R/W      1  SCT Data Transfer

SMART Extended Comprehensive Error Log Version: 1 (6 sectors)
Device Error Count: 65 (device log contains only the most recent 24 errors)
	CR     = Command Register
	FEATR  = Features Register
	COUNT  = Count (was: Sector Count) Register
	LBA_48 = Upper bytes of LBA High/Mid/Low Registers ]  ATA-8
	LH     = LBA High (was: Cylinder High) Register    ]   LBA
	LM     = LBA Mid (was: Cylinder Low) Register      ] Register
	LL     = LBA Low (was: Sector Number) Register     ]
	DV     = Device (was: Device/Head) Register
	DC     = Device Control Register
	ER     = Error register
	ST     = Status register
Powered_Up_Time is measured from power on, and printed as
DDd+hh:mm:SS.sss where DD=days, hh=hours, mm=minutes,
SS=sec, and sss=millisec. It "wraps" after 49.710 days.

Error 65 [16] occurred at disk power-on lifetime: 51355 hours (2139 days + 19 hours)
  When the command that caused the error occurred, the device was active or idle.

  After command completion occurred, registers were:
  ER -- ST COUNT  LBA_48  LH LM LL DV DC
  -- -- -- == -- == == == -- -- -- -- --
  10 -- 51 00 01 00 00 33 68 e9 00 40 00  Error: IDNF at LBA = 0x3368e900 = 862513408

  Commands leading to the command that caused the error were:
  CR FEATR COUNT  LBA_48  LH LM LL DV DC  Powered_Up_Time  Command/Feature_Name
  -- == -- == -- == == == -- -- -- -- --  ---------------  --------------------
  61 03 00 00 a0 00 00 33 68 e9 00 40 00 42d+ ...          WRITE FPDMA QUEUED
  61 04 00 00 98 00 00 33 68 e5 00 40 00 42d+ ...          WRITE FPDMA QUEUED
  61 03 00 00 90 00 00 33 68 e1 00 40 00 42d+ ...          WRITE FPDMA QUEUED
  61 04 00 00 88 00 00 33 68 dd 00 40 00 42d+ ...          WRITE FPDMA QUEUED
  61 03 00 00 58 00 00 33 68 d9 00 40 00 42d+ ...          WRITE FPDMA QUEUED

Error 64 [15] occurred at disk power-on lifetime: 51343 hours (2139 days + 7 hours)
  When the command that caused the error occurred, the device was active or idle.

  After command completion occurred, registers were:
  ER -- ST COUNT  LBA_48  LH LM LL DV DC
  -- -- -- == -- == == == -- -- -- -- --
  40 -- 51 00 00 00 01 ce 82 18 90 40 00  Error: UNC at LBA = 0x1ce821890 = 7759599760

  Commands leading to the command that caused the error were:
  CR FEATR COUNT  LBA_48  LH LM LL DV DC  Powered_Up_Time  Command/Feature_Name
  -- == -- == -- == == == -- -- -- -- --  ---------------  --------------------
  60 04 00 00 00 00 01 ce 82 15 00 40 00 42d+ ...          READ FPDMA QUEUED
  ea 00 00 00 00 00 00 00 00 00 00 40 00 42d+ ...          FLUSH CACHE EXT
  61 00 08 00 00 00 00 00 06 12 60 40 00 42d+ ...          WRITE FPDMA QUEUED
  ea 00 00 00 00 00 00 00 00 00 00 40 00 42d+ ...          FLUSH CACHE EXT
  61 00 08 00 08 00 00 e8 c5 d7 38 c0 00 42d+ ...          WRITE FPDMA QUEUED

Error 63 [14] occurred at disk power-on lifetime: 51343 hours (2139 days + 7 hours)
  When the command that caused the error occurred, the device was active or idle.

  After command completion occurred, registers were:
  ER -- ST COUNT  LBA_48  LH LM LL DV DC
  -- -- -- == -- == == == -- -- -- -- --
  40 -- 51 00 01 00 01 ce 81 83 b0 40 00  Error: UNC at LBA = 0x1ce8183b0 = 7759561648

  Commands leading to the command that caused the error were:
  CR FEATR COUNT  LBA_48  LH LM LL DV DC  Powered_Up_Time  Command/Feature_Name
  -- == -- == -- == == == -- -- -- -- --  ---------------  --------------------
  60 04 00 00 00 00 01 ce 81 81 00 40 00 42d+ ...          READ FPDMA QUEUED
  60 04 00 00 00 00 01 ce 81 7d 00 40 00 42d+ ...          READ FPDMA QUEUED
  60 04 00 00 00 00 01 ce 81 79 00 40 00 42d+ ...          READ FPDMA QUEUED
  60 04 00 00 00 00 01 ce 81 75 00 40 00 42d+ ...          READ FPDMA QUEUED
  ea 00 00 00 00 00 00 00 00 00 00 40 00 42d+ ...          FLUSH CACHE EXT

Error 62 [13] occurred at disk power-on lifetime: 51339 hours (2139 days + 3 hours)
  When the command that caused the error occurred, the device was active or idle.

  After command completion occurred, registers were:
  ER -- ST COUNT  LBA_48  LH LM LL DV DC
  -- -- -- == -- == == == -- -- -- -- --
  40 -- 51 00 00 00 01 c3 55 be e7 40 00  Error: WP at LBA = 0x1c355bee7 = 7572143847

  Commands leading to the command that caused the error were:
  CR FEATR COUNT  LBA_48  LH LM LL DV DC  Powered_Up_Time  Command/Feature_Name
  -- == -- == -- == == == -- -- -- -- --  ---------------  --------------------
  61 00 10 00 08 00 00 00 1f 59 d0 40 00 42d+ ...          WRITE FPDMA QUEUED
  60 04 00 00 00 00 01 c3 55 bc 00 40 00 42d+ ...          READ FPDMA QUEUED
  ea 00 00 00 00 00 00 00 00 00 00 40 00 42d+ ...          FLUSH CACHE EXT
  61 00 08 00 08 00 00 e8 c4 c3 80 c0 00 42d+ ...          WRITE FPDMA QUEUED
  61 00 08 00 00 00 00 00 05 17 c0 40 00 42d+ ...          WRITE FPDMA QUEUED

Error 61 [12] occurred at disk power-on lifetime: 51339 hours (2139 days + 3 hours)
  When the command that caused the error occurred, the device was active or idle.

  After command completion occurred, registers were:
  ER -- ST COUNT  LBA_48  LH LM LL DV DC
  -- -- -- == -- == == == -- -- -- -- --
  40 -- 51 00 00 00 01 c3 55 b7 e0 40 00  Error: WP at LBA = 0x1c355b7e0 = 7572142048

  Commands leading to the command that caused the error were:
  CR FEATR COUNT  LBA_48  LH LM LL DV DC  Powered_Up_Time  Command/Feature_Name
  -- == -- == -- == == == -- -- -- -- --  ---------------  --------------------
  61 00 08 00 20 00 01 a8 80 11 10 40 00 42d+ ...          WRITE FPDMA QUEUED
  61 00 08 00 18 00 01 a8 80 10 c8 40 00 42d+ ...          WRITE FPDMA QUEUED
  61 00 08 00 10 00 01 a8 80 10 78 40 00 42d+ ...          WRITE FPDMA QUEUED
  61 00 08 00 08 00 00 00 1f 59 88 40 00 42d+ ...          WRITE FPDMA QUEUED
  61 00 08 00 20 00 01 a8 80 0f d0 40 00 42d+ ...          WRITE FPDMA QUEUED

Error 60 [11] occurred at disk power-on lifetime: 51339 hours (2139 days + 3 hours)
  When the command that caused the error occurred, the device was active or idle.

  After command completion occurred, registers were:
  ER -- ST COUNT  LBA_48  LH LM LL DV DC
  -- -- -- == -- == == == -- -- -- -- --
  40 -- 51 00 00 00 01 c3 1e 6f a0 40 00  Error: WP at LBA = 0x1c31e6fa0 = 7568519072

  Commands leading to the command that caused the error were:
  CR FEATR COUNT  LBA_48  LH LM LL DV DC  Powered_Up_Time  Command/Feature_Name
  -- == -- == -- == == == -- -- -- -- --  ---------------  --------------------
  61 00 08 00 08 00 00 00 1f 58 a0 40 00 42d+ ...          WRITE FPDMA QUEUED
  60 04 00 00 00 00 01 c3 1e 6c 00 40 00 42d+ ...          READ FPDMA QUEUED
  ea 00 00 00 00 00 00 00 00 00 00 40 00 42d+ ...          FLUSH CACHE EXT
  61 00 08 00 00 00 00 00 05 16 90 40 00 42d+ ...          WRITE FPDMA QUEUED
  ea 00 00 00 00 00 00 00 00 00 00 40 00 42d+ ...          FLUSH CACHE EXT

Error 59 [10] occurred at disk power-on lifetime: 51338 hours (2139 days + 2 hours)
  When the command that caused the error occurred, the device was active or idle.

  After command completion occurred, registers were:
  ER -- ST COUNT  LBA_48  LH LM LL DV DC
  -- -- -- == -- == == == -- -- -- -- --
  40 -- 51 00 00 00 01 c6 10 4a b7 40 00  Error: UNC at LBA = 0x1c6104ab7 = 7617923767

  Commands leading to the command that caused the error were:
  CR FEATR COUNT  LBA_48  LH LM LL DV DC  Powered_Up_Time  Command/Feature_Name
  -- == -- == -- == == == -- -- -- -- --  ---------------  --------------------
  60 04 00 00 00 00 01 c6 10 48 00 40 00 42d+ ...          READ FPDMA QUEUED
  ea 00 00 00 00 00 00 00 00 00 00 40 00 42d+ ...          FLUSH CACHE EXT
  61 00 08 00 08 00 00 e8 c4 67 00 c0 00 42d+ ...          WRITE FPDMA QUEUED
  61 00 08 00 00 00 00 00 04 cf e8 40 00 42d+ ...          WRITE FPDMA QUEUED
  ea 00 00 00 00 00 00 00 00 00 00 40 00 42d+ ...          FLUSH CACHE EXT

Error 58 [9] occurred at disk power-on lifetime: 51338 hours (2139 days + 2 hours)
  When the command that caused the error occurred, the device was active or idle.

  After command completion occurred, registers were:
  ER -- ST COUNT  LBA_48  LH LM LL DV DC
  -- -- -- == -- == == == -- -- -- -- --
  40 -- 51 00 00 00 01 c6 0f bb 97 40 00  Error: UNC at LBA = 0x1c60fbb97 = 7617887127

  Commands leading to the command that caused the error were:
  CR FEATR COUNT  LBA_48  LH LM LL DV DC  Powered_Up_Time  Command/Feature_Name
  -- == -- == -- == == == -- -- -- -- --  ---------------  --------------------
  60 04 00 00 00 00 01 c6 0f b8 00 40 00 42d+ ...          READ FPDMA QUEUED
  ea 00 00 00 00 00 00 00 00 00 00 40 00 42d+ ...          FLUSH CACHE EXT
  61 00 08 00 00 00 00 00 04 48 00 40 00 42d+ ...          WRITE FPDMA QUEUED
  ea 00 00 00 00 00 00 00 00 00 00 40 00 42d+ ...          FLUSH CACHE EXT
  61 00 08 00 00 00 00 e8 c4 66 78 c0 00 42d+ ...          WRITE FPDMA QUEUED

SMART Extended Self-test Log Version: 1 (1 sectors)
No self-tests have been logged.  [To run self-tests, use: smartctl -t]

SMART Selective self-test log data structure revision number 1
 SPAN  MIN_LBA  MAX_LBA  CURRENT_TEST_STATUS
    1        0        0  Not_testing
    2        0        0  Not_testing
    3        0        0  Not_testing
    4        0        0  Not_testing
    5        0        0  Not_testing
Selective self-test flags (0x0):
  After scanning selected spans, do NOT read-scan remainder of disk.
If Selective self-test is pending on power-up, resume after 0 minute delay.

SCT Status Version:                  3
SCT Version (vendor specific):       258 (0x0102)
Device State:                        Active (0)
Current Temperature:                    29 Celsius
Power Cycle Min/Max Temperature:     27/43 Celsius
Lifetime    Min/Max Temperature:      3/43 Celsius
Under/Over Temperature Limit Count:   0/0
Vendor specific:
01 00 00 00 00 00 00 00 00 00 00 00 00 00 00 00
00 00 00 00 00 00 00 00 00 00 00 00 00 00 00 00

SCT Temperature History Version:     2
Temperature Sampling Period:         1 minute
Temperature Logging Interval:        1 minute
Min/Max recommended Temperature:      0/60 Celsius
Min/Max Temperature Limit:           -41/85 Celsius
Temperature History Size (Index):    478 (273)

SCT Error Recovery Control:
           Read:     70 (7.0 seconds)
          Write:     70 (7.0 seconds)

SATA Phy Event Counters (GP Log 0x11)
ID      Size     Value  Description
0x0001  2            0  Command failed due to ICRC error
0x0002  2            6  R_ERR response for data FIS
0x0003  2            0  R_ERR response for device-to-host data FIS
0x0004  2            6  R_ERR response for host-to-device data FIS
0x0005  2           28  R_ERR response for non-data FIS
0x0006  2           21  R_ERR response for device-to-host non-data FIS
0x0007  2            7  R_ERR response for host-to-device non-data FIS
0x0008  2            0  Device-to-host non-data FIS retries
0x0009  2           52  Transition from drive PhyRdy to drive PhyNRdy
0x000a  2           53  Device-to-host register FISes sent due to a COMRESET
0x000b  2           13  CRC errors within host-to-device FIS
0x000f  2            6  R_ERR response for host-to-device data FIS, CRC
0x0012  2            7  R_ERR response for host-to-device non-data FIS, CRC
0x8000  4     38880729  Vendor specific

