smartctl 7.0 2019-05-21 r4916 [x86_64-linux-3.10.0-693...] (local build)
Copyright (C) 2002-18, Bruce Allen, Christian Franke, www.smartmontools.org

=== START OF INFORMATION SECTION ===
Model Family:     Western Digital Caviar Black
Device Model:     WDC WD2002FAEX-007BA0
Serial Number:    --
LU WWN Device Id: 5 0014ee ...
Firmware Version: 05.01D05
User Capacity:    2,000,398,934,016 bytes [2.00 TB]
Sector Size:      512 bytes logical/physical
Device is:        In smartctl database [for details use: -P show]
ATA Version is:   ATA8-ACS (minor revision not indicated)
SATA Version is:  SATA 2.6, 6.0 Gb/s (current: 6.0 Gb/s)
Local Time is:    --
AAM feature is:   Disabled
Rd look-ahead is: Enabled
Write cache is:   Disabled
ATA Security is:  Disabled, NOT FROZEN [SEC1]

=== START OF READ SMART DATA SECTION ===
SMART overall-health self-assessment test result: PASSED

General SMART Values:
Offline data collection status:  (0x84)	Offline data collection activity
					was suspended by an interrupting command from host.

Self-test execution status:      ( 121)	The previous self-test completed having
					the read element of the test failed.
Total time to complete Offline 
data collection: 		(29580) seconds.
Offline data collection
capabilities: 			 (0x7b) SMART execute Offline immediate.

					Suspend Offline collection upon new
					command.
					Offline surface scan supported.
					Self-test supported.
					Conveyance Self-test supported.
					Selective Self-test supported.
SMART capabilities:            (0x0003)	Saves SMART data before entering
					power-saving mode.

Error logging capability:        (0x01)	Error logging supported.
					General Purpose Logging supported.
Short self-test routine 
recommended polling time: 	 (   2) minutes.
Extended self-test routine
recommended polling time: 	 ( 301) minutes.
Conveyance self-test routine
recommended polling time: 	 (   5) minutes.
SCT capabilities: 	       (0x3037)	SCT Status supported.
					SCT Feature Control supported.
					SCT Data Table supported.

SMART Attributes Data Structure revision number: 16
Vendor Specific SMART Attributes with Thresholds:
ID# ATTRIBUTE_NAME          FLAGS    VALUE WORST THRESH FAIL RAW_VALUE
  1 Raw_Read_Error_Rate     POSR-K   200   200   051    -    2
  3 Spin_Up_Time            POS--K   253   253   021    -    8808
  4 Start_Stop_Count        -O--CK   100   100   000    -    54
  5 Reallocated_Sector_Ct   PO--CK   157   157   140    -    340
  7 Seek_Error_Rate         -OSR-K   200   200   000    -    0
  9 Power_On_Hours          -O--CK   033   033   000    -    48931
 10 Spin_Retry_Count        -O--CK   100   253   000    -    0
 11 Calibration_Retry_Count -O--CK   100   253   000    -    0
 12 Power_Cycle_Count       -O--CK   100   100   000    -    52
192 Power-Off_Retract_Count -O--CK   200   200   000    -    48
193 Load_Cycle_Count        -O--CK   200   200   000    -    5
194 Temperature_Celsius     -O---K   120   101   000    -    32
196 Reallocated_Event_Count -O--CK   001   001   000    -    297
197 Current_Pending_Sector  -O--CK   198   198   000    -    891
198 Offline_Uncorrectable   ----CK   198   198   000    -    681
199 UDMA_CRC_Error_Count    -O--CK   200   200   000    -    0
200 Multi_Zone_Error_Rate   ---R--   187   179   000    -    2779
                            ||||||_ K auto-keep
                            |||||__ C event count
                            ||||___ R error rate
                            |||____ S speed/performance
                            ||_____ O updated online
                            |______ P prefailure warning

General Purpose Log Directory Version 1
SMART           Log Directory Version 1 [multi-sector log support]
Address    Access  R/W   Size  Description
0x00       GPL,SL  R/O      1  Log Directory
0x01           SL  R/O      1  Summary SMART error log
0x02           SL  R/O      5  Comprehensive SMART error log
0x03       GPL     R/O      6  Ext. Comprehensive SMART error log
0x06           SL  R/O      1  SMART self-test log
0x07       GPL     R/O      1  Extended self-test log
0x09           SL  R/W      1  Selective self-test log
0x10       GPL     R/O      1  NCQ Command Error log
0x11       GPL     R/O      1  SATA Phy Event Counters log
0x80-0x9f  GPL,SL  R/W     16  Host vendor specific log
0xa0-0xa7  GPL,SL  VS      16  Device vendor specific log
0xa8-0xb5  GPL,SL  VS       1  Device vendor specific log
0xb6       GPL     VS       1  Device vendor specific log
0xb7       GPL,SL  VS       1  Device vendor specific log
0xbd       GPL,SL  VS       1  Device vendor specific log
0xc0       GPL,SL  VS       1  Device vendor specific log
0xc1       GPL     VS      24  Device vendor specific log
0xe0       GPL,SL  R/W      1  SCT Command/Status
0xe1       GPL,SL  R/W      1  SCT Data Transfer

SMART Extended Comprehensive Error Log Version: 1 (6 sectors)
Device Error Count: 113 (device log contains only the most recent 24 errors)
	CR     = Command Register
	FEATR  = Features Register
	COUNT  = Count (was: Sector Count) Register
	LBA_48 = Upper bytes of LBA High/Mid/Low Registers ]  ATA-8
	LH     = LBA High (was: Cylinder High) Register    ]   LBA
	LM     = LBA Mid (was: Cylinder Low) Register      ] Register
	LL     = LBA Low (was: Sector Number) Register     ]
	DV     = Device (was: Device/Head) Register
	DC     = Device Control Register
	ER     = Error register
	ST     = Status register
Powered_Up_Time is measured from power on, and printed as
DDd+hh:mm:SS.sss where DD=days, hh=hours, mm=minutes,
SS=sec, and sss=millisec. It "wraps" after 49.710 days.

Error 113 [16] occurred at disk power-on lifetime: 43872 hours (1828 days + 0 hours)
  When the command that caused the error occurred, the device was active or idle.

  After command completion occurred, registers were:
  ER -- ST COUNT  LBA_48  LH LM LL DV DC
  -- -- -- == -- == == == -- -- -- -- --
  40 -- 51 01 00 00 00 26 11 9b 3d 40 00  Error: UNC at LBA = 0x26119b3d = 638688061

  Commands leading to the command that caused the error were:
  CR FEATR COUNT  LBA_48  LH LM LL DV DC  Powered_Up_Time  Command/Feature_Name
  -- == -- == -- == == == -- -- -- -- --  ---------------  --------------------
  60 01 00 00 08 00 00 26 11 9c 00 40 00 44d+ ...          READ FPDMA QUEUED
  60 01 00 00 00 00 00 26 11 9b 00 40 00 44d+ ...          READ FPDMA QUEUED
  60 01 00 00 00 00 00 26 11 9a 00 40 00 44d+ ...          READ FPDMA QUEUED
  60 01 00 00 08 00 00 26 11 99 00 40 00 44d+ ...          READ FPDMA QUEUED
  60 01 00 00 00 00 00 26 11 98 00 40 00 44d+ ...          READ FPDMA QUEUED

Error 112 [15] occurred at disk power-on lifetime: 43872 hours (1828 days + 0 hours)
  When the command that caused the error occurred, the device was active or idle.

  After command completion occurred, registers were:
  ER -- ST COUNT  LBA_48  LH LM LL DV DC
  -- -- -- == -- == == == -- -- -- -- --
  40 -- 51 01 00 00 00 26 11 30 92 40 00  Error: UNC at LBA = 0x26113092 = 638660754

  Commands leading to the command that caused the error were:
  CR FEATR COUNT  LBA_48  LH LM LL DV DC  Powered_Up_Time  Command/Feature_Name
  -- == -- == -- == == == -- -- -- -- --  ---------------  --------------------
  60 01 00 00 08 00 00 26 11 2f d2 40 00 44d+ ...          READ FPDMA QUEUED
  60 01 00 00 00 00 00 26 11 2e d2 40 00 44d+ ...          READ FPDMA QUEUED
  60 01 00 00 08 00 00 26 11 2d d2 40 00 44d+ ...          READ FPDMA QUEUED
  60 01 00 00 00 00 00 26 11 2c d2 40 00 44d+ ...          READ FPDMA QUEUED
  60 01 00 00 08 00 00 26 11 2b d2 40 00 44d+ ...          READ FPDMA QUEUED

Error 111 [14] occurred at disk power-on lifetime: 43872 hours (1828 days + 0 hours)
  When the command that caused the error occurred, the device was active or idle.

  After command completion occurred, registers were:
  ER -- ST COUNT  LBA_48  LH LM LL DV DC
  -- -- -- == -- == == == -- -- -- -- --
  40 -- 51 01 00 00 00 26 0e b9 d6 40 00  Error: UNC at LBA = 0x260eb9d6 = 638499286

  Commands leading to the command that caused the error were:
  CR FEATR COUNT  LBA_48  LH LM LL DV DC  Powered_Up_Time  Command/Feature_Name
  -- == -- == -- == == == -- -- -- -- --  ---------------  --------------------
  60 01 00 00 10 00 00 26 0e ba 6f 40 00 44d+ ...          READ FPDMA QUEUED
  60 01 00 00 08 00 00 26 0e b9 6f 40 00 44d+ ...          READ FPDMA QUEUED
  60 01 00 00 08 00 00 26 0e b8 6f 40 00 44d+ ...          READ FPDMA QUEUED
  60 01 00 00 08 00 00 26 0e b7 6f 40 00 44d+ ...          READ FPDMA QUEUED
  60 01 00 00 10 00 00 26 0e b6 6f 40 00 44d+ ...          READ FPDMA QUEUED

Error 110 [13] occurred at disk power-on lifetime: 43872 hours (1828 days + 0 hours)
  When the command that caused the error occurred, the device was active or idle.

  After command completion occurred, registers were:
  ER -- ST COUNT  LBA_48  LH LM LL DV DC
  -- -- -- == -- == == == -- -- -- -- --
  40 -- 51 01 00 00 00 26 0e 3b bb 40 00  Error: UNC at LBA = 0x260e3bbb = 638467003

  Commands leading to the command that caused the error were:
  CR FEATR COUNT  LBA_48  LH LM LL DV DC  Powered_Up_Time  Command/Feature_Name
  -- == -- == -- == == == -- -- -- -- --  ---------------  --------------------
  60 01 00 00 08 00 00 26 0e 3b 86 40 00 44d+ ...          READ FPDMA QUEUED
  60 01 00 00 08 00 00 26 0e 3a 86 40 00 44d+ ...          READ FPDMA QUEUED
  60 01 00 00 08 00 00 26 0e 39 86 40 00 44d+ ...          READ FPDMA QUEUED
  60 01 00 00 08 00 00 26 0e 38 86 40 00 44d+ ...          READ FPDMA QUEUED
  60 01 00 00 08 00 00 26 0e 37 86 40 00 44d+ ...          READ FPDMA QUEUED

Error 109 [12] occurred at disk power-on lifetime: 43872 hours (1828 days + 0 hours)
  When the command that caused the error occurred, the device was active or idle.

  After command completion occurred, registers were:
  ER -- ST COUNT  LBA_48  LH LM LL DV DC
  -- -- -- == -- == == == -- -- -- -- --
  40 -- 51 01 00 00 00 26 0d d0 ee 40 00  Error: WP at LBA = 0x260dd0ee = 638439662

  Commands leading to the command that caused the error were:
  CR FEATR COUNT  LBA_48  LH LM LL DV DC  Powered_Up_Time  Command/Feature_Name
  -- == -- == -- == == == -- -- -- -- --  ---------------  --------------------
  61 00 10 00 08 00 00 e8 e0 44 10 40 00 44d+ ...          WRITE FPDMA QUEUED
  60 01 00 00 28 00 00 26 0d d0 30 40 00 44d+ ...          READ FPDMA QUEUED
  60 01 00 00 10 00 00 26 0d cf 30 40 00 44d+ ...          READ FPDMA QUEUED
  60 01 00 00 08 00 00 26 0d ce 30 40 00 44d+ ...          READ FPDMA QUEUED
  61 00 10 00 00 00 00 00 00 0a 10 40 00 44d+ ...          WRITE FPDMA QUEUED

Error 108 [11] occurred at disk power-on lifetime: 43872 hours (1828 days + 0 hours)
  When the command that caused the error occurred, the device was active or idle.

  After command completion occurred, registers were:
  ER -- ST COUNT  LBA_48  LH LM LL DV DC
  -- -- -- == -- == == == -- -- -- -- --
  40 -- 51 01 00 00 00 26 0d c7 38 40 00  Error: UNC at LBA = 0x260dc738 = 638437176

  Commands leading to the command that caused the error were:
  CR FEATR COUNT  LBA_48  LH LM LL DV DC  Powered_Up_Time  Command/Feature_Name
  -- == -- == -- == == == -- -- -- -- --  ---------------  --------------------
  60 01 00 00 08 00 00 26 0d c7 30 40 00 44d+ ...          READ FPDMA QUEUED
  60 01 00 00 00 00 00 26 0d c6 30 40 00 44d+ ...          READ FPDMA QUEUED
  60 01 00 00 08 00 00 26 0d c5 30 40 00 44d+ ...          READ FPDMA QUEUED
  60 01 00 00 00 00 00 26 0d c4 30 40 00 44d+ ...          READ FPDMA QUEUED
  60 01 00 00 00 00 00 26 0d c3 30 40 00 44d+ ...          READ FPDMA QUEUED

Error 107 [10] occurred at disk power-on lifetime: 43872 hours (1828 days + 0 hours)
  When the command that caused the error occurred, the device was active or idle.

  After command completion occurred, registers were:
  ER -- ST COUNT  LBA_48  LH LM LL DV DC
  -- -- -- == -- == == == -- -- -- -- --
  40 -- 51 01 00 00 00 26 0d b5 34 40 00  Error: UNC at LBA = 0x260db534 = 638432564

  Commands leading to the command that caused the error were:
  CR FEATR COUNT  LBA_48  LH LM LL DV DC  Powered_Up_Time  Command/Feature_Name
  -- == -- == -- == == == -- -- -- -- --  ---------------  --------------------
  60 01 00 00 08 00 00 26 0d b6 30 40 00 44d+ ...          READ FPDMA QUEUED
  60 01 00 00 00 00 00 26 0d b5 30 40 00 44d+ ...          READ FPDMA QUEUED
  60 01 00 00 08 00 00 26 0d b4 23 40 00 44d+ ...          READ FPDMA QUEUED
  60 01 00 00 00 00 00 26 0d b3 23 40 00 44d+ ...          READ FPDMA QUEUED
  60 01 00 00 00 00 00 26 0d b2 23 40 00 44d+ ...          READ FPDMA QUEUED

Error 106 [9] occurred at disk power-on lifetime: 43872 hours (1828 days + 0 hours)
  When the command that caused the error occurred, the device was active or idle.

  After command completion occurred, registers were:
  ER -- ST COUNT  LBA_48  LH LM LL DV DC
  -- -- -- == -- == == == -- -- -- -- --
  40 -- 51 01 00 00 00 26 f9 28 38 40 00  Error: UNC at LBA = 0x26f92838 = 653862968

  Commands leading to the command that caused the error were:
  CR FEATR COUNT  LBA_48  LH LM LL DV DC  Powered_Up_Time  Command/Feature_Name
  -- == -- == -- == == == -- -- -- -- --  ---------------  --------------------
  60 01 00 00 20 00 00 26 f9 27 60 40 00 44d+ ...          READ FPDMA QUEUED
  60 01 00 00 18 00 00 26 f9 25 9e 40 00 44d+ ...          READ FPDMA QUEUED
  61 00 10 00 10 00 00 e8 e0 44 10 40 00 44d+ ...          WRITE FPDMA QUEUED
  61 00 10 00 00 00 00 e8 e0 46 10 40 00 44d+ ...          WRITE FPDMA QUEUED
  60 01 00 00 20 00 00 26 f9 24 9e 40 00 44d+ ...          READ FPDMA QUEUED

SMART Extended Self-test Log Version: 1 (1 sectors)
Num  Test_Description    Status                  Remaining  LifeTime(hours)  LBA_of_first_error
# 1  Extended offline    Completed: read failure       90%     44383         306131730
# 2  Extended offline    Completed: read failure       90%     44319         306131730
# 3  Extended offline    Completed without error       00%     27718         -
# 4  Extended offline    Completed without error       00%     24951         -
# 5  Short offline       Completed without error       00%     24946         -
# 6  Short offline       Completed without error       00%     23817         -

SMART Selective self-test log data structure revision number 1
 SPAN  MIN_LBA  MAX_LBA  CURRENT_TEST_STATUS
    1        0        0  Not_testing
    2        0        0  Not_testing
    3        0        0  Not_testing
    4        0        0  Not_testing
    5        0        0  Not_testing
Selective self-test flags (0x0):
  After scanning selected spans, do NOT read-scan remainder of disk.
If Selective self-test is pending on power-up, resume after 0 minute delay.

SCT Status Version:                  3
SCT Version (vendor specific):       258 (0x0102)
Device State:                        Active (0)
Current Temperature:                    32 Celsius
Power Cycle Min/Max Temperature:     27/48 Celsius
Lifetime    Min/Max Temperature:     27/51 Celsius
Under/Over Temperature Limit Count:   0/0

SCT Temperature History Version:     2
Temperature Sampling Period:         1 minute
Temperature Logging Interval:        1 minute
Min/Max recommended Temperature:      0/60 Celsius
Min/Max Temperature Limit:           -41/85 Celsius
Temperature History Size (Index):    478 (277)

SATA Phy Event Counters (GP Log 0x11)
ID      Size     Value  Description
0x0001  2            0  Command failed due to ICRC error
0x0002  2            0  R_ERR response for data FIS
0x0003  2            0  R_ERR response for device-to-host data FIS
0x0004  2            0  R_ERR response for host-to-device data FIS
0x0005  2            0  R_ERR response for non-data FIS
0x0006  2            0  R_ERR response for device-to-host non-data FIS
0x0007  2            0  R_ERR response for host-to-device non-data FIS
0x000a  2           12  Device-to-host register FISes sent due to a COMRESET
0x000b  2            0  CRC errors within host-to-device FIS
0x8000  4     16606503  Vendor specific

