smartctl 7.1 2019-12-30 r5022 [x86_64-linux-3.10.0-1062...] (local build)
Copyright (C) 2002-19, Bruce Allen, Christian Franke, www.smartmontools.org

=== START OF INFORMATION SECTION ===
Model Family:     Western Digital Caviar Black
Device Model:     WDC WD2002FAEX-007BA0
Serial Number:    --
LU WWN Device Id: 5 0014ee ...
Firmware Version: 05.01D05
User Capacity:    2,000,398,934,016 bytes [2.00 TB]
Sector Size:      512 bytes logical/physical
Device is:        In smartctl database [for details use: -P show]
ATA Version is:   ATA8-ACS (minor revision not indicated)
SATA Version is:  SATA 2.6, 6.0 Gb/s (current: 3.0 Gb/s)
Local Time is:    --
AAM feature is:   Disabled
Rd look-ahead is: Enabled
Write cache is:   Enabled
ATA Security is:  Disabled, NOT FROZEN [SEC1]

=== START OF READ SMART DATA SECTION ===
SMART overall-health self-assessment test result: PASSED

General SMART Values:
Offline data collection status:  (0x82)	Offline data collection activity
					was completed without error.

Self-test execution status:      (   0)	The previous self-test routine completed
					without error or no self-test has ever 
					been run.
Total time to complete Offline 
data collection: 		(28560) seconds.
Offline data collection
capabilities: 			 (0x7b) SMART execute Offline immediate.

					Suspend Offline collection upon new
					command.
					Offline surface scan supported.
					Self-test supported.
					Conveyance Self-test supported.
					Selective Self-test supported.
SMART capabilities:            (0x0003)	Saves SMART data before entering
					power-saving mode.

Error logging capability:        (0x01)	Error logging supported.
					General Purpose Logging supported.
Short self-test routine 
recommended polling time: 	 (   2) minutes.
Extended self-test routine
recommended polling time: 	 ( 291) minutes.
Conveyance self-test routine
recommended polling time: 	 (   5) minutes.
SCT capabilities: 	       (0x3037)	SCT Status supported.
					SCT Feature Control supported.
					SCT Data Table supported.

SMART Attributes Data Structure revision number: 16
Vendor Specific SMART Attributes with Thresholds:
ID# ATTRIBUTE_NAME          FLAGS    VALUE WORST THRESH FAIL RAW_VALUE
  1 Raw_Read_Error_Rate     POSR-K   200   200   051    -    0
  3 Spin_Up_Time            POS--K   253   253   021    -    7291
  4 Start_Stop_Count        -O--CK   100   100   000    -    17
  5 Reallocated_Sector_Ct   PO--CK   200   200   140    -    0
  7 Seek_Error_Rate         -OSR-K   200   200   000    -    0
  9 Power_On_Hours          -O--CK   067   067   000    -    24113
 10 Spin_Retry_Count        -O--CK   100   253   000    -    0
 11 Calibration_Retry_Count -O--CK   100   253   000    -    0
 12 Power_Cycle_Count       -O--CK   100   100   000    -    15
192 Power-Off_Retract_Count -O--CK   200   200   000    -    14
193 Load_Cycle_Count        -O--CK   200   200   000    -    2
194 Temperature_Celsius     -O---K   124   109   000    -    28
196 Reallocated_Event_Count -O--CK   200   200   000    -    0
197 Current_Pending_Sector  -O--CK   200   200   000    -    0
198 Offline_Uncorrectable   ----CK   200   200   000    -    0
199 UDMA_CRC_Error_Count    -O--CK   200   200   000    -    0
200 Multi_Zone_Error_Rate   ---R--   200   200   000    -    0
                            ||||||_ K auto-keep
                            |||||__ C event count
                            ||||___ R error rate
                            |||____ S speed/performance
                            ||_____ O updated online
                            |______ P prefailure warning

General Purpose Log Directory Version 1
SMART           Log Directory Version 1 [multi-sector log support]
Address    Access  R/W   Size  Description
0x00       GPL,SL  R/O      1  Log Directory
0x01           SL  R/O      1  Summary SMART error log
0x02           SL  R/O      5  Comprehensive SMART error log
0x03       GPL     R/O      6  Ext. Comprehensive SMART error log
0x06           SL  R/O      1  SMART self-test log
0x07       GPL     R/O      1  Extended self-test log
0x09           SL  R/W      1  Selective self-test log
0x10       GPL     R/O      1  NCQ Command Error log
0x11       GPL     R/O      1  SATA Phy Event Counters log
0x80-0x9f  GPL,SL  R/W     16  Host vendor specific log
0xa0-0xa7  GPL,SL  VS      16  Device vendor specific log
0xa8-0xb5  GPL,SL  VS       1  Device vendor specific log
0xb6       GPL     VS       1  Device vendor specific log
0xb7       GPL,SL  VS       1  Device vendor specific log
0xbd       GPL,SL  VS       1  Device vendor specific log
0xc0       GPL,SL  VS       1  Device vendor specific log
0xc1       GPL     VS      24  Device vendor specific log
0xe0       GPL,SL  R/W      1  SCT Command/Status
0xe1       GPL,SL  R/W      1  SCT Data Transfer

SMART Extended Comprehensive Error Log Version: 1 (6 sectors)
Device Error Count: 17
	CR     = Command Register
	FEATR  = Features Register
	COUNT  = Count (was: Sector Count) Register
	LBA_48 = Upper bytes of LBA High/Mid/Low Registers ]  ATA-8
	LH     = LBA High (was: Cylinder High) Register    ]   LBA
	LM     = LBA Mid (was: Cylinder Low) Register      ] Register
	LL     = LBA Low (was: Sector Number) Register     ]
	DV     = Device (was: Device/Head) Register
	DC     = Device Control Register
	ER     = Error register
	ST     = Status register
Powered_Up_Time is measured from power on, and printed as
DDd+hh:mm:SS.sss where DD=days, hh=hours, mm=minutes,
SS=sec, and sss=millisec. It "wraps" after 49.710 days.

Error 17 [16] occurred at disk power-on lifetime: 2355 hours (98 days + 3 hours)
  When the command that caused the error occurred, the device was active or idle.

  After command completion occurred, registers were:
  ER -- ST COUNT  LBA_48  LH LM LL DV DC
  -- -- -- == -- == == == -- -- -- -- --
  40 -- 51 00 80 00 00 16 6e 0b b0 40 00  Error: UNC 128 sectors at LBA = 0x166e0bb0 = 376310704

  Commands leading to the command that caused the error were:
  CR FEATR COUNT  LBA_48  LH LM LL DV DC  Powered_Up_Time  Command/Feature_Name
  -- == -- == -- == == == -- -- -- -- --  ---------------  --------------------
  25 00 00 00 80 00 00 16 6e 0b b0 40 00 48d+ ...          READ DMA EXT
  25 00 00 01 00 00 00 12 cf 51 f0 40 00 48d+ ...          READ DMA EXT
  25 00 00 01 00 00 00 cd fc 62 d0 40 00 48d+ ...          READ DMA EXT
  25 00 00 00 80 00 00 91 14 2f d0 40 00 48d+ ...          READ DMA EXT
  35 00 00 00 20 00 00 67 1e c9 f0 40 00 48d+ ...          WRITE DMA EXT

Error 16 [15] occurred at disk power-on lifetime: 2355 hours (98 days + 3 hours)
  When the command that caused the error occurred, the device was active or idle.

  After command completion occurred, registers were:
  ER -- ST COUNT  LBA_48  LH LM LL DV DC
  -- -- -- == -- == == == -- -- -- -- --
  40 -- 51 00 80 00 00 16 6e 1f b0 40 00  Error: UNC 128 sectors at LBA = 0x166e1fb0 = 376315824

  Commands leading to the command that caused the error were:
  CR FEATR COUNT  LBA_48  LH LM LL DV DC  Powered_Up_Time  Command/Feature_Name
  -- == -- == -- == == == -- -- -- -- --  ---------------  --------------------
  25 00 00 00 80 00 00 16 6e 1f b0 40 00 48d+ ...          READ DMA EXT
  25 00 00 00 80 00 00 82 9f 30 d0 40 00 48d+ ...          READ DMA EXT
  25 00 00 00 80 00 00 80 c3 8b b0 40 00 48d+ ...          READ DMA EXT
  35 00 00 00 20 00 00 67 1e c9 f0 40 00 48d+ ...          WRITE DMA EXT
  25 00 00 00 80 00 00 5c 03 7f 30 40 00 48d+ ...          READ DMA EXT

Error 15 [14] occurred at disk power-on lifetime: 2355 hours (98 days + 3 hours)
  When the command that caused the error occurred, the device was active or idle.

  After command completion occurred, registers were:
  ER -- ST COUNT  LBA_48  LH LM LL DV DC
  -- -- -- == -- == == == -- -- -- -- --
  40 -- 51 00 80 00 00 16 6e 0b b0 40 00  Error: UNC 128 sectors at LBA = 0x166e0bb0 = 376310704

  Commands leading to the command that caused the error were:
  CR FEATR COUNT  LBA_48  LH LM LL DV DC  Powered_Up_Time  Command/Feature_Name
  -- == -- == -- == == == -- -- -- -- --  ---------------  --------------------
  25 00 00 00 80 00 00 16 6e 0b b0 40 00 48d+ ...          READ DMA EXT
  25 00 00 00 80 00 00 bd bd 7f f0 40 00 48d+ ...          READ DMA EXT
  35 00 00 00 20 00 00 7b 3e 11 30 40 00 48d+ ...          WRITE DMA EXT
  25 00 00 01 00 00 00 bb 29 3d 90 40 00 48d+ ...          READ DMA EXT
  35 00 00 00 20 00 00 7f e0 cb 70 40 00 48d+ ...          WRITE DMA EXT

Error 14 [13] occurred at disk power-on lifetime: 2355 hours (98 days + 3 hours)
  When the command that caused the error occurred, the device was active or idle.

  After command completion occurred, registers were:
  ER -- ST COUNT  LBA_48  LH LM LL DV DC
  -- -- -- == -- == == == -- -- -- -- --
  40 -- 51 00 80 00 00 16 6e 1f b0 40 00  Error: UNC 128 sectors at LBA = 0x166e1fb0 = 376315824

  Commands leading to the command that caused the error were:
  CR FEATR COUNT  LBA_48  LH LM LL DV DC  Powered_Up_Time  Command/Feature_Name
  -- == -- == -- == == == -- -- -- -- --  ---------------  --------------------
  25 00 00 00 80 00 00 16 6e 1f b0 40 00 48d+ ...          READ DMA EXT
  35 00 00 00 18 00 00 b4 e2 72 f0 40 00 48d+ ...          WRITE DMA EXT
  35 00 00 00 60 00 00 b4 e2 6c 90 40 00 48d+ ...          WRITE DMA EXT
  35 00 00 00 0c 00 00 b3 56 74 10 40 00 48d+ ...          WRITE DMA EXT
  35 00 00 00 14 00 00 b3 4c f5 d0 40 00 48d+ ...          WRITE DMA EXT

Error 13 [12] occurred at disk power-on lifetime: 2355 hours (98 days + 3 hours)
  When the command that caused the error occurred, the device was active or idle.

  After command completion occurred, registers were:
  ER -- ST COUNT  LBA_48  LH LM LL DV DC
  -- -- -- == -- == == == -- -- -- -- --
  40 -- 51 00 80 00 00 16 6e 0b b0 40 00  Error: UNC 128 sectors at LBA = 0x166e0bb0 = 376310704

  Commands leading to the command that caused the error were:
  CR FEATR COUNT  LBA_48  LH LM LL DV DC  Powered_Up_Time  Command/Feature_Name
  -- == -- == -- == == == -- -- -- -- --  ---------------  --------------------
  25 00 00 00 80 00 00 16 6e 0b b0 40 00 48d+ ...          READ DMA EXT
  25 00 00 00 04 00 00 14 9f 3f d0 40 00 48d+ ...          READ DMA EXT
  35 00 00 00 20 00 00 8d 83 0b 70 40 00 48d+ ...          WRITE DMA EXT
  25 00 00 00 80 00 00 81 a3 ad 10 40 00 48d+ ...          READ DMA EXT
  25 00 00 00 80 00 00 81 4b 1d 30 40 00 48d+ ...          READ DMA EXT

Error 12 [11] occurred at disk power-on lifetime: 2355 hours (98 days + 3 hours)
  When the command that caused the error occurred, the device was active or idle.

  After command completion occurred, registers were:
  ER -- ST COUNT  LBA_48  LH LM LL DV DC
  -- -- -- == -- == == == -- -- -- -- --
  40 -- 51 00 80 00 00 16 6e 1f b0 40 00  Error: UNC 128 sectors at LBA = 0x166e1fb0 = 376315824

  Commands leading to the command that caused the error were:
  CR FEATR COUNT  LBA_48  LH LM LL DV DC  Powered_Up_Time  Command/Feature_Name
  -- == -- == -- == == == -- -- -- -- --  ---------------  --------------------
  25 00 00 00 80 00 00 16 6e 1f b0 40 00 48d+ ...          READ DMA EXT
  c8 00 00 00 80 00 00 09 54 04 d0 e9 00 48d+ ...          READ DMA
  35 00 00 00 20 00 00 b5 be c6 d0 40 00 48d+ ...          WRITE DMA EXT
  35 00 00 00 20 00 00 b5 a2 13 30 40 00 48d+ ...          WRITE DMA EXT
  35 00 00 00 20 00 00 b5 90 db 10 40 00 48d+ ...          WRITE DMA EXT

Error 11 [10] occurred at disk power-on lifetime: 2355 hours (98 days + 3 hours)
  When the command that caused the error occurred, the device was active or idle.

  After command completion occurred, registers were:
  ER -- ST COUNT  LBA_48  LH LM LL DV DC
  -- -- -- == -- == == == -- -- -- -- --
  40 -- 51 01 00 00 00 16 6e 1f b0 40 00  Error: UNC 256 sectors at LBA = 0x166e1fb0 = 376315824

  Commands leading to the command that caused the error were:
  CR FEATR COUNT  LBA_48  LH LM LL DV DC  Powered_Up_Time  Command/Feature_Name
  -- == -- == -- == == == -- -- -- -- --  ---------------  --------------------
  25 00 00 01 00 00 00 16 6e 1f b0 40 00 48d+ ...          READ DMA EXT
  25 00 00 01 00 00 00 16 6e 1e b0 40 00 48d+ ...          READ DMA EXT
  25 00 00 01 00 00 00 16 6e 1d b0 40 00 48d+ ...          READ DMA EXT
  25 00 00 01 00 00 00 16 6e 1c b0 40 00 48d+ ...          READ DMA EXT
  25 00 00 01 00 00 00 16 6e 1b b0 40 00 48d+ ...          READ DMA EXT

Error 10 [9] occurred at disk power-on lifetime: 2355 hours (98 days + 3 hours)
  When the command that caused the error occurred, the device was active or idle.

  After command completion occurred, registers were:
  ER -- ST COUNT  LBA_48  LH LM LL DV DC
  -- -- -- == -- == == == -- -- -- -- --
  40 -- 51 00 80 00 00 16 6e 0b b0 40 00  Error: UNC 128 sectors at LBA = 0x166e0bb0 = 376310704

  Commands leading to the command that caused the error were:
  CR FEATR COUNT  LBA_48  LH LM LL DV DC  Powered_Up_Time  Command/Feature_Name
  -- == -- == -- == == == -- -- -- -- --  ---------------  --------------------
  25 00 00 00 80 00 00 16 6e 0b b0 40 00 48d+ ...          READ DMA EXT
  25 00 00 00 80 00 00 d1 fd 8c 30 40 00 48d+ ...          READ DMA EXT
  35 00 00 00 10 00 00 b4 f3 cf 90 40 00 48d+ ...          WRITE DMA EXT
  35 00 00 00 40 00 00 b4 f3 97 b0 40 00 48d+ ...          WRITE DMA EXT
  25 00 00 00 80 00 00 8a 81 08 d0 40 00 48d+ ...          READ DMA EXT

SMART Extended Self-test Log Version: 1 (1 sectors)
Num  Test_Description    Status                  Remaining  LifeTime(hours)  LBA_of_first_error
# 1  Short offline       Completed without error       00%     23483         -
# 2  Extended offline    Completed without error       00%     18153         -
# 3  Short offline       Completed without error       00%     17980         -
# 4  Extended offline    Completed without error       00%     16774         -
# 5  Short offline       Completed without error       00%     16768         -
# 6  Extended offline    Completed without error       00%     12288         -
# 7  Short offline       Completed without error       00%     12282         -
# 8  Short offline       Completed without error       00%      7725         -

SMART Selective self-test log data structure revision number 1
 SPAN  MIN_LBA  MAX_LBA  CURRENT_TEST_STATUS
    1        0        0  Not_testing
    2        0        0  Not_testing
    3        0        0  Not_testing
    4        0        0  Not_testing
    5        0        0  Not_testing
Selective self-test flags (0x0):
  After scanning selected spans, do NOT read-scan remainder of disk.
If Selective self-test is pending on power-up, resume after 0 minute delay.

SCT Status Version:                  3
SCT Version (vendor specific):       258 (0x0102)
Device State:                        Active (0)
Current Temperature:                    28 Celsius
Power Cycle Min/Max Temperature:     25/30 Celsius
Lifetime    Min/Max Temperature:     25/43 Celsius
Under/Over Temperature Limit Count:   0/0

SCT Temperature History Version:     2
Temperature Sampling Period:         1 minute
Temperature Logging Interval:        1 minute
Min/Max recommended Temperature:      0/60 Celsius
Min/Max Temperature Limit:           -41/85 Celsius
Temperature History Size (Index):    478 (135)

SATA Phy Event Counters (GP Log 0x11)
ID      Size     Value  Description
0x0001  2            0  Command failed due to ICRC error
0x0002  2            0  R_ERR response for data FIS
0x0003  2            0  R_ERR response for device-to-host data FIS
0x0004  2            0  R_ERR response for host-to-device data FIS
0x0005  2            0  R_ERR response for non-data FIS
0x0006  2            0  R_ERR response for device-to-host non-data FIS
0x0007  2            0  R_ERR response for host-to-device non-data FIS
0x000a  2           11  Device-to-host register FISes sent due to a COMRESET
0x000b  2            0  CRC errors within host-to-device FIS
0x8000  4       846501  Vendor specific

