smartctl 7.1 2020-06-20 r5066 [x86_64-linux-3.10.0-1160...] (local build)
Copyright (C) 2002-19, Bruce Allen, Christian Franke, www.smartmontools.org

=== START OF INFORMATION SECTION ===
Model Number:                       Samsung SSD 960 PRO 1TB
Serial Number:                      --
Firmware Version:                   4B6QCXP7
PCI Vendor/Subsystem ID:            0x144d
IEEE OUI Identifier:                0x002538
Total NVM Capacity:                 1,024,209,543,168 [1.02 TB]
Unallocated NVM Capacity:           0
Controller ID:                      2
Number of Namespaces:               1
Namespace 1 Size/Capacity:          1,024,209,543,168 [1.02 TB]
Namespace 1 Formatted LBA Size:     512
Namespace 1 IEEE EUI-64:            002538 ...
Local Time is:                      Sun Jul ... 2021 UTC

=== START OF READ SMART DATA SECTION ===
SMART overall-health self-assessment test result: FAILED!
- NVM subsystem reliability has been degraded

SMART/Health Information (NVMe Log 0x02)
Critical Warning:                   0x04
Temperature:                        37 Celsius
Available Spare:                    100%
Available Spare Threshold:          10%
Percentage Used:                    100%
Data Units Read:                    617,084,457 [315 TB]
Data Units Written:                 1,053,038,585 [539 TB]
Host Read Commands:                 4,379,338,365
Host Write Commands:                7,008,855,689
Controller Busy Time:               18,028,702,429
Power Cycles:                       9
Power On Hours:                     20,643
Unsafe Shutdowns:                   4
Media and Data Integrity Errors:    0
Error Information Log Entries:      0
Warning  Comp. Temperature Time:    0
Critical Comp. Temperature Time:    0
Temperature Sensor 1:               37 Celsius
Temperature Sensor 2:               49 Celsius

