smartctl 7.1 2020-06-20 r5066 [x86_64-linux-3.10.0-1127...] (local build)
Copyright (C) 2002-19, Bruce Allen, Christian Franke, www.smartmontools.org

=== START OF INFORMATION SECTION ===
Model Number:                       WDC PC SN720 SDAPNTW-1T00
Serial Number:                      --
Firmware Version:                   10123000
PCI Vendor/Subsystem ID:            0x15b7
IEEE OUI Identifier:                0x001b44
Total NVM Capacity:                 1,024,209,543,168 [1.02 TB]
Unallocated NVM Capacity:           0
Controller ID:                      8215
Number of Namespaces:               1
Namespace 1 Size/Capacity:          1,024,209,543,168 [1.02 TB]
Namespace 1 Formatted LBA Size:     512
Namespace 1 IEEE EUI-64:            001b44 ...
Local Time is:                      --

=== START OF READ SMART DATA SECTION ===
SMART overall-health self-assessment test result: PASSED

SMART/Health Information (NVMe Log 0x02)
Critical Warning:                   0x00
Temperature:                        64 Celsius
Available Spare:                    100%
Available Spare Threshold:          10%
Percentage Used:                    255%
Data Units Read:                    100,629,621 [51.5 TB]
Data Units Written:                 2,077,664,124 [1.06 PB]
Host Read Commands:                 2,320,312,161
Host Write Commands:                97,397,492,159
Controller Busy Time:               117,519
Power Cycles:                       16
Power On Hours:                     19,787
Unsafe Shutdowns:                   8
Media and Data Integrity Errors:    0
Error Information Log Entries:      0
Warning  Comp. Temperature Time:    16629
Critical Comp. Temperature Time:    0

