smartctl 7.1 2020-06-20 r5066 [x86_64-linux-3.10.0-1160...] (local build)
Copyright (C) 2002-19, Bruce Allen, Christian Franke, www.smartmontools.org

=== START OF INFORMATION SECTION ===
Model Family:     Micron 5100 Pro / 5200 / 5300 SSDs
Device Model:     Micron_5100_MTFDDAK1T9TBY
Serial Number:    --
LU WWN Device Id: 5 00a075 ...
Firmware Version: D0MU037
User Capacity:    1,920,383,410,176 bytes [1.92 TB]
Sector Sizes:     512 bytes logical, 4096 bytes physical
Rotation Rate:    Solid State Device
Form Factor:      2.5 inches
Device is:        In smartctl database [for details use: -P show]
ATA Version is:   ACS-3 T13/2161-D revision 5
SATA Version is:  SATA 3.2, 6.0 Gb/s (current: 6.0 Gb/s)
Local Time is:    --
APM level is:     254 (maximum performance)
Rd look-ahead is: Enabled
Write cache is:   Enabled
ATA Security is:  Disabled, frozen [SEC2]

=== START OF READ SMART DATA SECTION ===
SMART overall-health self-assessment test result: PASSED

General SMART Values:
Offline data collection status:  (0x06)	Offline data collection activity
					was aborted by the device with a fatal error.

Self-test execution status:      (   0)	The previous self-test routine completed
					without error or no self-test has ever 
					been run.
Total time to complete Offline 
data collection: 		( 3440) seconds.
Offline data collection
capabilities: 			 (0x7b) SMART execute Offline immediate.

					Suspend Offline collection upon new
					command.
					Offline surface scan supported.
					Self-test supported.
					Conveyance Self-test supported.
					Selective Self-test supported.
SMART capabilities:            (0x0003)	Saves SMART data before entering
					power-saving mode.

Error logging capability:        (0x01)	Error logging supported.
					General Purpose Logging supported.
Short self-test routine 
recommended polling time: 	 (   2) minutes.
Extended self-test routine
recommended polling time: 	 (  14) minutes.
Conveyance self-test routine
recommended polling time: 	 (   3) minutes.
SCT capabilities: 	       (0x0035)	SCT Status supported.
					SCT Feature Control supported.
					SCT Data Table supported.

SMART Attributes Data Structure revision number: 16
Vendor Specific SMART Attributes with Thresholds:
ID# ATTRIBUTE_NAME          FLAGS    VALUE WORST THRESH FAIL RAW_VALUE
  1 Raw_Read_Error_Rate     POSR-K   100   100   050    -    8
  5 Reallocated_Sector_Ct   -O--CK   099   099   001    -    216
  9 Power_On_Hours          -O--CK   100   100   001    -    26842
 12 Power_Cycle_Count       -O--CK   100   100   001    -    1
170 Reserved_Block_Pct      PO--CK   099   099   010    -    216
171 Program_Fail_Count      -O--CK   100   100   000    -    0
172 Erase_Fail_Count        -O--CK   100   100   001    -    0
173 Avg_Block-Erase_Count   -O--CK   100   100   000    -    7
174 Unexpect_Power_Loss_Ct  -O--CK   100   100   000    -    0
183 SATA_Int_Downshift_Ct   -O--CK   100   100   000    -    0
184 End-to-End_Error        -O--CK   100   100   000    -    0
187 Reported_Uncorrect      -O--CK   100   100   000    -    8
188 Command_Timeout         -O--CK   100   100   000    -    1
194 Temperature_Celsius     -O---K   080   070   000    -    20 (Min/Max 12/30)
195 Hardware_ECC_Recovered  -O--CK   100   100   000    -    0
196 Reallocated_Event_Count -O--CK   100   100   000    -    216
197 Current_Pending_Sector  -O--CK   100   100   000    -    0
198 Offline_Uncorrectable   ----CK   100   100   000    -    4
199 UDMA_CRC_Error_Count    -O--CK   100   100   000    -    0
202 Percent_Lifetime_Remain ----CK   100   100   001    -    0
206 Write_Error_Rate        -OSR--   100   100   000    -    0
246 Unknown_Micron_Attrib   -O--CK   100   100   000    -    27321119893
247 Host_Program_Page_Count -O--CK   100   100   000    -    852587066
248 Bckgnd_Program_Page_Cnt -O--CK   100   100   000    -    246842972
180 Unused_Rsvd_Blk_Cnt_Tot PO--CK   000   000   000    -    13147
210 RAIN_Success_Recovered  -O--CK   100   100   000    -    820
                            ||||||_ K auto-keep
                            |||||__ C event count
                            ||||___ R error rate
                            |||____ S speed/performance
                            ||_____ O updated online
                            |______ P prefailure warning

General Purpose Log Directory Version 1
SMART           Log Directory Version 1 [multi-sector log support]
Address    Access  R/W   Size  Description
0x00       GPL,SL  R/O      1  Log Directory
0x01           SL  R/O      1  Summary SMART error log
0x02           SL  R/O     51  Comprehensive SMART error log
0x03       GPL     R/O  16383  Ext. Comprehensive SMART error log
0x04       GPL,SL  R/O      8  Device Statistics log
0x06           SL  R/O      1  SMART self-test log
0x07       GPL     R/O      1  Extended self-test log
0x09           SL  R/W      1  Selective self-test log
0x10       GPL     R/O      1  NCQ Command Error log
0x11       GPL     R/O      1  SATA Phy Event Counters log
0x13       GPL     R/O      1  SATA NCQ Send and Receive log
0x24       GPL     R/O   8000  Current Device Internal Status Data log
0x25       GPL     R/O   8000  Saved Device Internal Status Data log
0x30       GPL,SL  R/O      9  IDENTIFY DEVICE data log
0x80-0x9f  GPL,SL  R/W     16  Host vendor specific log
0xa0       GPL     VS   35328  Device vendor specific log
0xa1       GPL,SL  VS       4  Device vendor specific log
0xa3       GPL     VS   13824  Device vendor specific log
0xa4       GPL     VS     354  Device vendor specific log
0xa4       SL      VS      98  Device vendor specific log
0xa5       GPL     VS    8000  Device vendor specific log
0xa5       SL      VS      64  Device vendor specific log
0xa6       GPL     VS    8000  Device vendor specific log
0xa6       SL      VS      64  Device vendor specific log
0xe0       GPL,SL  R/W      1  SCT Command/Status
0xe1       GPL,SL  R/W      1  SCT Data Transfer

SMART Extended Comprehensive Error Log Version: 1 (16383 sectors)
Device Error Count: 8
	CR     = Command Register
	FEATR  = Features Register
	COUNT  = Count (was: Sector Count) Register
	LBA_48 = Upper bytes of LBA High/Mid/Low Registers ]  ATA-8
	LH     = LBA High (was: Cylinder High) Register    ]   LBA
	LM     = LBA Mid (was: Cylinder Low) Register      ] Register
	LL     = LBA Low (was: Sector Number) Register     ]
	DV     = Device (was: Device/Head) Register
	DC     = Device Control Register
	ER     = Error register
	ST     = Status register
Powered_Up_Time is measured from power on, and printed as
DDd+hh:mm:SS.sss where DD=days, hh=hours, mm=minutes,
SS=sec, and sss=millisec. It "wraps" after 49.710 days.

Error 8 [7] occurred at disk power-on lifetime: 9495 hours (395 days + 15 hours)
  When the command that caused the error occurred, the device was active or idle.

  After command completion occurred, registers were:
  ER -- ST COUNT  LBA_48  LH LM LL DV DC
  -- -- -- == -- == == == -- -- -- -- --
  40 -- 51 00 08 00 00 12 ee 5e 98 40 08  Error: WP at LBA = 0x12ee5e98 = 317611672

  Commands leading to the command that caused the error were:
  CR FEATR COUNT  LBA_48  LH LM LL DV DC  Powered_Up_Time  Command/Feature_Name
  -- == -- == -- == == == -- -- -- -- --  ---------------  --------------------
  61 00 00 00 08 00 00 d9 53 fe b8 40 08 47d+ ...          WRITE FPDMA QUEUED
  61 00 00 00 08 00 00 d9 53 fa 50 40 08 47d+ ...          WRITE FPDMA QUEUED
  61 00 00 00 08 00 00 d9 4f e1 28 40 08 47d+ ...          WRITE FPDMA QUEUED
  61 00 00 00 08 00 00 d8 8d e6 00 40 08 47d+ ...          WRITE FPDMA QUEUED
  61 00 00 00 08 00 00 d8 7e 5e a8 40 08 47d+ ...          WRITE FPDMA QUEUED

Error 7 [6] occurred at disk power-on lifetime: 9495 hours (395 days + 15 hours)
  When the command that caused the error occurred, the device was active or idle.

  After command completion occurred, registers were:
  ER -- ST COUNT  LBA_48  LH LM LL DV DC
  -- -- -- == -- == == == -- -- -- -- --
  40 -- 51 00 28 00 00 12 ee 5e 98 40 08  Error: WP at LBA = 0x12ee5e98 = 317611672

  Commands leading to the command that caused the error were:
  CR FEATR COUNT  LBA_48  LH LM LL DV DC  Powered_Up_Time  Command/Feature_Name
  -- == -- == -- == == == -- -- -- -- --  ---------------  --------------------
  61 00 00 00 28 00 00 6c 23 be 40 40 08 47d+ ...          WRITE FPDMA QUEUED
  61 00 00 00 90 00 00 db 95 e7 20 40 08 47d+ ...          WRITE FPDMA QUEUED
  61 00 00 00 08 00 00 d8 8a 33 f8 40 08 47d+ ...          WRITE FPDMA QUEUED
  60 00 00 00 08 00 00 12 ee 5e 98 40 08 47d+ ...          READ FPDMA QUEUED
  61 00 10 00 08 00 00 d9 53 fe 68 40 00 47d+ ...          WRITE FPDMA QUEUED

Error 6 [5] occurred at disk power-on lifetime: 9495 hours (395 days + 15 hours)
  When the command that caused the error occurred, the device was active or idle.

  After command completion occurred, registers were:
  ER -- ST COUNT  LBA_48  LH LM LL DV DC
  -- -- -- == -- == == == -- -- -- -- --
  40 -- 51 00 08 00 00 12 ee 5e 98 40 08  Error: UNC at LBA = 0x12ee5e98 = 317611672

  Commands leading to the command that caused the error were:
  CR FEATR COUNT  LBA_48  LH LM LL DV DC  Powered_Up_Time  Command/Feature_Name
  -- == -- == -- == == == -- -- -- -- --  ---------------  --------------------
  60 00 00 00 08 00 00 12 ee 5e 98 40 08 47d+ ...          READ FPDMA QUEUED
  61 00 00 00 08 00 00 d9 53 f5 f0 40 08 47d+ ...          WRITE FPDMA QUEUED
  60 00 00 00 68 00 00 12 ee 5f 98 40 08 47d+ ...          READ FPDMA QUEUED
  60 00 00 00 98 00 00 12 fc f8 00 40 08 47d+ ...          READ FPDMA QUEUED
  ef 00 10 00 02 00 00 00 00 00 00 a0 08 47d+ ...          SET FEATURES [Enable SATA feature]

Error 5 [4] occurred at disk power-on lifetime: 9495 hours (395 days + 15 hours)
  When the command that caused the error occurred, the device was active or idle.

  After command completion occurred, registers were:
  ER -- ST COUNT  LBA_48  LH LM LL DV DC
  -- -- -- == -- == == == -- -- -- -- --
  40 -- 51 01 00 00 00 12 ee 5e 98 40 08  Error: UNC at LBA = 0x12ee5e98 = 317611672

  Commands leading to the command that caused the error were:
  CR FEATR COUNT  LBA_48  LH LM LL DV DC  Powered_Up_Time  Command/Feature_Name
  -- == -- == -- == == == -- -- -- -- --  ---------------  --------------------
  60 00 00 01 00 00 00 12 ee 5e 98 40 08 47d+ ...          READ FPDMA QUEUED
  60 00 00 00 08 00 00 12 fd 15 d8 40 08 47d+ ...          READ FPDMA QUEUED
  60 00 00 01 00 00 00 12 ee 5d 98 40 08 47d+ ...          READ FPDMA QUEUED
  60 00 00 01 00 00 00 12 ee 5c 98 40 08 47d+ ...          READ FPDMA QUEUED
  60 00 00 01 00 00 00 12 ee 5b 98 40 08 47d+ ...          READ FPDMA QUEUED

Error 4 [3] occurred at disk power-on lifetime: 9495 hours (395 days + 15 hours)
  When the command that caused the error occurred, the device was active or idle.

  After command completion occurred, registers were:
  ER -- ST COUNT  LBA_48  LH LM LL DV DC
  -- -- -- == -- == == == -- -- -- -- --
  40 -- 51 00 08 00 00 12 ee 5e a0 40 08  Error: WP at LBA = 0x12ee5ea0 = 317611680

  Commands leading to the command that caused the error were:
  CR FEATR COUNT  LBA_48  LH LM LL DV DC  Powered_Up_Time  Command/Feature_Name
  -- == -- == -- == == == -- -- -- -- --  ---------------  --------------------
  61 00 00 00 08 00 00 d9 53 ff 80 40 08 47d+ ...          WRITE FPDMA QUEUED
  60 00 00 00 08 00 00 12 ee 5e a0 40 08 47d+ ...          READ FPDMA QUEUED
  ef 00 10 00 02 00 00 00 00 00 00 a0 08 47d+ ...          SET FEATURES [Enable SATA feature]
  ec 00 00 00 00 00 00 00 00 00 00 a0 08 47d+ ...          IDENTIFY DEVICE
  ef 00 03 00 46 00 00 00 00 00 00 a0 08 47d+ ...          SET FEATURES [Set transfer mode]

Error 3 [2] occurred at disk power-on lifetime: 9495 hours (395 days + 15 hours)
  When the command that caused the error occurred, the device was active or idle.

  After command completion occurred, registers were:
  ER -- ST COUNT  LBA_48  LH LM LL DV DC
  -- -- -- == -- == == == -- -- -- -- --
  40 -- 51 00 08 00 00 12 ee 5e 98 40 08  Error: UNC at LBA = 0x12ee5e98 = 317611672

  Commands leading to the command that caused the error were:
  CR FEATR COUNT  LBA_48  LH LM LL DV DC  Powered_Up_Time  Command/Feature_Name
  -- == -- == -- == == == -- -- -- -- --  ---------------  --------------------
  60 00 00 00 08 00 00 12 ee 5e a0 40 08 47d+ ...          READ FPDMA QUEUED
  60 00 00 00 08 00 00 12 ee 5e 98 40 08 47d+ ...          READ FPDMA QUEUED
  60 00 00 00 08 00 00 12 fd 1d b8 40 08 47d+ ...          READ FPDMA QUEUED
  60 00 00 00 08 00 00 12 fd 1a 08 40 08 47d+ ...          READ FPDMA QUEUED
  60 00 00 00 08 00 00 12 fd 1e e8 40 08 47d+ ...          READ FPDMA QUEUED

Error 2 [1] occurred at disk power-on lifetime: 9495 hours (395 days + 15 hours)
  When the command that caused the error occurred, the device was active or idle.

  After command completion occurred, registers were:
  ER -- ST COUNT  LBA_48  LH LM LL DV DC
  -- -- -- == -- == == == -- -- -- -- --
  40 -- 51 00 08 00 00 12 ee 5e a0 40 08  Error: UNC at LBA = 0x12ee5ea0 = 317611680

  Commands leading to the command that caused the error were:
  CR FEATR COUNT  LBA_48  LH LM LL DV DC  Powered_Up_Time  Command/Feature_Name
  -- == -- == -- == == == -- -- -- -- --  ---------------  --------------------
  60 00 00 00 08 00 00 12 fd 1a 20 40 08 47d+ ...          READ FPDMA QUEUED
  60 00 00 00 08 00 00 12 ee 5e a0 40 08 47d+ ...          READ FPDMA QUEUED
  60 00 00 00 08 00 00 12 ee 5e a8 40 08 47d+ ...          READ FPDMA QUEUED
  60 00 00 00 08 00 00 12 ee 5e b0 40 08 47d+ ...          READ FPDMA QUEUED
  60 00 00 00 08 00 00 12 ee 5e b8 40 08 47d+ ...          READ FPDMA QUEUED

Error 1 [0] occurred at disk power-on lifetime: 9495 hours (395 days + 15 hours)
  When the command that caused the error occurred, the device was active or idle.

  After command completion occurred, registers were:
  ER -- ST COUNT  LBA_48  LH LM LL DV DC
  -- -- -- == -- == == == -- -- -- -- --
  40 -- 51 00 08 00 00 12 ee 5e 98 40 08  Error: UNC at LBA = 0x12ee5e98 = 317611672

  Commands leading to the command that caused the error were:
  CR FEATR COUNT  LBA_48  LH LM LL DV DC  Powered_Up_Time  Command/Feature_Name
  -- == -- == -- == == == -- -- -- -- --  ---------------  --------------------
  60 00 00 00 08 00 00 12 ee 5e 78 40 08 47d+ ...          READ FPDMA QUEUED
  60 00 00 00 08 00 00 12 ee 5e f8 40 08 47d+ ...          READ FPDMA QUEUED
  60 00 00 00 08 00 00 12 ee 5e f0 40 08 47d+ ...          READ FPDMA QUEUED
  60 00 00 00 08 00 00 12 ee 5e e8 40 08 47d+ ...          READ FPDMA QUEUED
  60 00 00 00 08 00 00 12 ee 5e e0 40 08 47d+ ...          READ FPDMA QUEUED

SMART Extended Self-test Log Version: 1 (1 sectors)
Num  Test_Description    Status                  Remaining  LifeTime(hours)  LBA_of_first_error
# 1  Vendor (0xff)       Completed without error       00%      9641         -
# 2  Short offline       Completed without error       00%      9545         -
# 3  Extended offline    Completed: read failure       70%      9544         317611672
# 4  Extended offline    Completed: read failure       70%      9495         317611672
# 5  Vendor (0xff)       Completed without error       00%       794         -
# 6  Vendor (0xff)       Completed without error       00%       502         -
# 7  Vendor (0xff)       Completed without error       00%       229         -

SMART Selective self-test log data structure revision number 1
 SPAN  MIN_LBA  MAX_LBA  CURRENT_TEST_STATUS
    1        0        0  Not_testing
    2        0        0  Not_testing
    3        0        0  Not_testing
    4        0        0  Not_testing
    5        0        0  Not_testing
Selective self-test flags (0x0):
  After scanning selected spans, do NOT read-scan remainder of disk.
If Selective self-test is pending on power-up, resume after 0 minute delay.

SCT Status Version:                  3
SCT Version (vendor specific):       1 (0x0001)
Device State:                        SMART Off-line Data Collection executing in background (4)
Current Temperature:                    20 Celsius
Power Cycle Min/Max Temperature:     12/28 Celsius
Lifetime    Min/Max Temperature:     12/30 Celsius
Under/Over Temperature Limit Count:   0/0

SCT Temperature History Version:     2
Temperature Sampling Period:         1 minute
Temperature Logging Interval:        1 minute
Min/Max recommended Temperature:      0/70 Celsius
Min/Max Temperature Limit:           -5/75 Celsius
Temperature History Size (Index):    478 (216)

Device Statistics (GP Log 0x04)
Page  Offset Size        Value Flags Description
0x01  =====  =               =  ===  == General Statistics (rev 1) ==
0x01  0x008  4               1  ---  Lifetime Power-On Resets
0x01  0x010  4           26842  ---  Power-on Hours
0x01  0x018  6     27321119997  ---  Logical Sectors Written
0x01  0x020  6       732013341  ---  Number of Write Commands
0x01  0x028  6      6039570626  ---  Logical Sectors Read
0x01  0x030  6       193941101  ---  Number of Read Commands
0x01  0x038  6     96631500000  ---  Date and Time TimeStamp
0x04  =====  =               =  ===  == General Errors Statistics (rev 1) ==
0x04  0x008  4               8  ---  Number of Reported Uncorrectable Errors
0x04  0x010  4               1  ---  Resets Between Cmd Acceptance and Completion
0x05  =====  =               =  ===  == Temperature Statistics (rev 1) ==
0x05  0x008  1              20  ---  Current Temperature
0x05  0x010  1              19  ---  Average Short Term Temperature
0x05  0x018  1              19  ---  Average Long Term Temperature
0x05  0x020  1              30  ---  Highest Temperature
0x05  0x028  1              12  ---  Lowest Temperature
0x05  0x030  1              26  ---  Highest Average Short Term Temperature
0x05  0x038  1              17  ---  Lowest Average Short Term Temperature
0x05  0x040  1              21  ---  Highest Average Long Term Temperature
0x05  0x048  1              17  ---  Lowest Average Long Term Temperature
0x05  0x050  4               0  ---  Time in Over-Temperature
0x05  0x058  1              70  ---  Specified Maximum Operating Temperature
0x05  0x060  4               0  ---  Time in Under-Temperature
0x05  0x068  1               0  ---  Specified Minimum Operating Temperature
0x06  =====  =               =  ===  == Transport Statistics (rev 1) ==
0x06  0x008  4              42  ---  Number of Hardware Resets
0x06  0x010  4              12  ---  Number of ASR Events
0x06  0x018  4               0  ---  Number of Interface CRC Errors
0x07  =====  =               =  ===  == Solid State Device Statistics (rev 1) ==
0x07  0x008  1               0  N--  Percentage Used Endurance Indicator
                                |||_ C monitored condition met
                                ||__ D supports DSN
                                |___ N normalized value

SATA Phy Event Counters (GP Log 0x11)
ID      Size     Value  Description
0x0001  4            0  Command failed due to ICRC error
0x0003  4            0  R_ERR response for device-to-host data FIS
0x0004  4            0  R_ERR response for host-to-device data FIS
0x0006  4            0  R_ERR response for device-to-host non-data FIS
0x000a  4           42  Device-to-host register FISes sent due to a COMRESET
0x000b  4            0  CRC errors within host-to-device FIS
0x000d  4            0  Non-CRC errors within host-to-device FIS

