smartctl 7.1 2019-12-30 r5022 [x86_64-linux-3.10.0-1062...] (local build)
Copyright (C) 2002-19, Bruce Allen, Christian Franke, www.smartmontools.org

=== START OF INFORMATION SECTION ===
Model Number:                       INTEL SSDPED1D280GA
Serial Number:                      --
Firmware Version:                   E2010325
PCI Vendor/Subsystem ID:            0x8086
IEEE OUI Identifier:                0x5cd2e4
Controller ID:                      0
Number of Namespaces:               1
Namespace 1 Size/Capacity:          280,065,171,456 [280 GB]
Namespace 1 Formatted LBA Size:     512
Local Time is:                      --

=== START OF READ SMART DATA SECTION ===
SMART overall-health self-assessment test result: FAILED!
- media has been placed in read only mode

SMART/Health Information (NVMe Log 0x02)
Critical Warning:                   0x08
Temperature:                        44 Celsius
Available Spare:                    100%
Available Spare Threshold:          0%
Percentage Used:                    112%
Data Units Read:                    1,087,379,127 [556 TB]
Data Units Written:                 10,083,060,088 [5.16 PB]
Host Read Commands:                 19,416,922,546
Host Write Commands:                216,213,294,091
Controller Busy Time:               58,440
Power Cycles:                       16
Power On Hours:                     22,813
Unsafe Shutdowns:                   7
Media and Data Integrity Errors:    9
Error Information Log Entries:      9

