smartctl 7.1 2019-12-30 r5022 [x86_64-linux-3.10.0-1062...] (local build)
Copyright (C) 2002-19, Bruce Allen, Christian Franke, www.smartmontools.org

=== START OF INFORMATION SECTION ===
Model Number:                       INTEL SSDPED1D280GA
Serial Number:                      --
Firmware Version:                   E2010325
PCI Vendor/Subsystem ID:            0x8086
IEEE OUI Identifier:                0x5cd2e4
Controller ID:                      0
Number of Namespaces:               1
Namespace 1 Size/Capacity:          280,065,171,456 [280 GB]
Namespace 1 Formatted LBA Size:     512
Local Time is:                      --

=== START OF READ SMART DATA SECTION ===
SMART overall-health self-assessment test result: PASSED

SMART/Health Information (NVMe Log 0x02)
Critical Warning:                   0x00
Temperature:                        41 Celsius
Available Spare:                    100%
Available Spare Threshold:          0%
Percentage Used:                    103%
Data Units Read:                    1,512,149,771 [774 TB]
Data Units Written:                 9,048,039,195 [4.63 PB]
Host Read Commands:                 44,759,257,013
Host Write Commands:                188,126,959,645
Controller Busy Time:               55,448
Power Cycles:                       26
Power On Hours:                     18,390
Unsafe Shutdowns:                   9
Media and Data Integrity Errors:    0
Error Information Log Entries:      0

