smartctl 7.1 2020-06-20 r5066 [x86_64-linux-3.10.0-1160...] (local build)
Copyright (C) 2002-19, Bruce Allen, Christian Franke, www.smartmontools.org

=== START OF INFORMATION SECTION ===
Model Family:     Western Digital Caviar Blue (SATA)
Device Model:     WDC WD3200AAKS-00SBA0
Serial Number:    --
LU WWN Device Id: 5 0014ee ...
Firmware Version: 12.01B01
User Capacity:    320,072,933,376 bytes [320 GB]
Sector Size:      512 bytes logical/physical
Device is:        In smartctl database [for details use: -P show]
ATA Version is:   ATA/ATAPI-7 (minor revision not indicated)
Local Time is:    Fri Dec ... 2021 EET

AAM level is:     128 (quiet), recommended: 128
Rd look-ahead is: Enabled
Write cache is:   Enabled
ATA Security is:  Disabled, NOT FROZEN [SEC1]

=== START OF READ SMART DATA SECTION ===
SMART overall-health self-assessment test result: PASSED

General SMART Values:
Offline data collection status:  (0x82)	Offline data collection activity
					was completed without error.

Self-test execution status:      (   0)	The previous self-test routine completed
					without error or no self-test has ever 
					been run.
Total time to complete Offline 
data collection: 		( 7980) seconds.
Offline data collection
capabilities: 			 (0x5b) SMART execute Offline immediate.

					Suspend Offline collection upon new
					command.
					Offline surface scan supported.
					Self-test supported.
					No Conveyance Self-test supported.
					Selective Self-test supported.
SMART capabilities:            (0x0003)	Saves SMART data before entering
					power-saving mode.

Error logging capability:        (0x01)	Error logging supported.
					General Purpose Logging supported.
Short self-test routine 
recommended polling time: 	 (   2) minutes.
Extended self-test routine
recommended polling time: 	 ( 102) minutes.
SCT capabilities: 	       (0x103f)	SCT Status supported.
					SCT Error Recovery Control supported.
					SCT Feature Control supported.
					SCT Data Table supported.

SMART Attributes Data Structure revision number: 16
Vendor Specific SMART Attributes with Thresholds:
ID# ATTRIBUTE_NAME          FLAGS    VALUE WORST THRESH FAIL RAW_VALUE
  1 Raw_Read_Error_Rate     POSR--   200   200   051    -    0
  3 Spin_Up_Time            PO----   157   149   021    -    5116
  4 Start_Stop_Count        -O--CK   095   095   000    -    5575
  5 Reallocated_Sector_Ct   PO--CK   200   200   140    -    0
  7 Seek_Error_Rate         -OSR--   200   200   051    -    0
  9 Power_On_Hours          -O--CK   009   009   000    -    67054
 10 Spin_Retry_Count        -O--C-   100   100   051    -    0
 11 Calibration_Retry_Count -O--C-   100   100   051    -    0
 12 Power_Cycle_Count       -O--CK   095   095   000    -    5350
192 Power-Off_Retract_Count -O--CK   200   200   000    -    530
193 Load_Cycle_Count        -O--CK   199   199   000    -    5599
194 Temperature_Celsius     -O---K   108   091   000    -    39
196 Reallocated_Event_Count -O--CK   200   200   000    -    0
197 Current_Pending_Sector  -O--C-   200   200   000    -    4
198 Offline_Uncorrectable   ----C-   200   200   000    -    1
199 UDMA_CRC_Error_Count    -OSRCK   200   200   000    -    0
200 Multi_Zone_Error_Rate   ---R--   194   183   051    -    387
                            ||||||_ K auto-keep
                            |||||__ C event count
                            ||||___ R error rate
                            |||____ S speed/performance
                            ||_____ O updated online
                            |______ P prefailure warning

General Purpose Log Directory Version 1
SMART           Log Directory Version 1 [multi-sector log support]
Address    Access  R/W   Size  Description
0x00       GPL,SL  R/O      1  Log Directory
0x01           SL  R/O      1  Summary SMART error log
0x02           SL  R/O      5  Comprehensive SMART error log
0x03       GPL     R/O      6  Ext. Comprehensive SMART error log
0x06           SL  R/O      1  SMART self-test log
0x07       GPL     R/O      1  Extended self-test log
0x09           SL  R/W      1  Selective self-test log
0x10       GPL     R/O      1  NCQ Command Error log
0x11       GPL     R/O      1  SATA Phy Event Counters log
0x80-0x9f  GPL,SL  R/W     16  Host vendor specific log
0xa0-0xa7  GPL,SL  VS      16  Device vendor specific log
0xa8-0xb7  GPL,SL  VS       1  Device vendor specific log
0xc0       GPL,SL  VS       1  Device vendor specific log
0xe0       GPL,SL  R/W      1  SCT Command/Status
0xe1       GPL,SL  R/W      1  SCT Data Transfer

SMART Extended Comprehensive Error Log Version: 1 (6 sectors)
Device Error Count: 570 (device log contains only the most recent 24 errors)
	CR     = Command Register
	FEATR  = Features Register
	COUNT  = Count (was: Sector Count) Register
	LBA_48 = Upper bytes of LBA High/Mid/Low Registers ]  ATA-8
	LH     = LBA High (was: Cylinder High) Register    ]   LBA
	LM     = LBA Mid (was: Cylinder Low) Register      ] Register
	LL     = LBA Low (was: Sector Number) Register     ]
	DV     = Device (was: Device/Head) Register
	DC     = Device Control Register
	ER     = Error register
	ST     = Status register
Powered_Up_Time is measured from power on, and printed as
DDd+hh:mm:SS.sss where DD=days, hh=hours, mm=minutes,
SS=sec, and sss=millisec. It "wraps" after 49.710 days.

Error 570 [17] occurred at disk power-on lifetime: 0 hours (0 days + 0 hours)
  When the command that caused the error occurred, the device was in an unknown state.

  After command completion occurred, registers were:
  ER -- ST COUNT  LBA_48  LH LM LL DV DC
  -- -- -- == -- == == == -- -- -- -- --
  40 -- 00 01 08 00 51 00 00 e0 01 00 00

  Commands leading to the command that caused the error were:
  CR FEATR COUNT  LBA_48  LH LM LL DV DC  Powered_Up_Time  Command/Feature_Name
  -- == -- == -- == == == -- -- -- -- --  ---------------  --------------------
  00 f8 25 17 46 00 00 00 00 00 00 00 1d     00:00:00.000  NOP [Reserved subcommand] [OBS-ACS-2]
  00 00 00 00 00 17 f8 00 46 27 00 00 00     00:00:14.344  NOP [Abort queued commands]
  00 e8 ef 17 46 00 00 00 00 00 00 00 00     00:25:25.487  NOP [Reserved subcommand] [OBS-ACS-2]
  00 00 00 00 00 17 e8 00 46 27 00 00 00     00:00:00.070  NOP [Abort queued commands]

Error 569 [16] occurred at disk power-on lifetime: 0 hours (0 days + 0 hours)
  When the command that caused the error occurred, the device was in an unknown state.

  After command completion occurred, registers were:
  ER -- ST COUNT  LBA_48  LH LM LL DV DC
  -- -- -- == -- == == == -- -- -- -- --
  40 -- 00 01 08 00 51 00 00 e0 01 00 00

  Commands leading to the command that caused the error were:
  CR FEATR COUNT  LBA_48  LH LM LL DV DC  Powered_Up_Time  Command/Feature_Name
  -- == -- == -- == == == -- -- -- -- --  ---------------  --------------------
  00 d3 25 17 3a 00 00 00 00 00 00 00 1d     00:00:00.000  NOP [Reserved subcommand] [OBS-ACS-2]
  00 00 00 00 00 17 d3 00 3a 27 00 00 00     00:00:14.344  NOP [Abort queued commands]
  00 c3 ef 17 3a 00 00 00 00 00 00 00 00     00:25:22.378  NOP [Reserved subcommand] [OBS-ACS-2]
  00 00 00 00 00 17 c3 00 3a 27 00 00 00     00:00:00.070  NOP [Abort queued commands]

Error 568 [15] occurred at disk power-on lifetime: 0 hours (0 days + 0 hours)
  When the command that caused the error occurred, the device was in an unknown state.

  After command completion occurred, registers were:
  ER -- ST COUNT  LBA_48  LH LM LL DV DC
  -- -- -- == -- == == == -- -- -- -- --
  40 -- 00 01 08 00 51 00 00 e0 01 00 00

  Commands leading to the command that caused the error were:
  CR FEATR COUNT  LBA_48  LH LM LL DV DC  Powered_Up_Time  Command/Feature_Name
  -- == -- == -- == == == -- -- -- -- --  ---------------  --------------------
  00 42 25 17 30 00 00 00 00 00 00 00 1d     00:00:00.000  NOP [Reserved subcommand] [OBS-ACS-2]
  00 00 00 00 00 17 42 00 30 27 00 00 00     00:00:14.344  NOP [Abort queued commands]
  00 32 ef 17 30 00 00 00 00 00 00 00 00     00:25:19.673  NOP [Reserved subcommand] [OBS-ACS-2]
  00 00 00 00 00 17 32 00 30 27 00 00 00     00:00:00.070  NOP [Abort queued commands]

Error 567 [14] occurred at disk power-on lifetime: 0 hours (0 days + 0 hours)
  When the command that caused the error occurred, the device was in an unknown state.

  After command completion occurred, registers were:
  ER -- ST COUNT  LBA_48  LH LM LL DV DC
  -- -- -- == -- == == == -- -- -- -- --
  40 -- 00 01 08 00 51 00 00 e0 01 00 00

  Commands leading to the command that caused the error were:
  CR FEATR COUNT  LBA_48  LH LM LL DV DC  Powered_Up_Time  Command/Feature_Name
  -- == -- == -- == == == -- -- -- -- --  ---------------  --------------------
  00 2d 25 17 25 00 00 00 00 00 00 00 1d     00:00:00.000  NOP [Reserved subcommand] [OBS-ACS-2]
  00 00 00 00 00 17 2d 00 25 27 00 00 00     00:00:14.344  NOP [Abort queued commands]
  00 1d ef 17 25 00 00 00 00 00 00 00 00     00:25:16.836  NOP [Reserved subcommand] [OBS-ACS-2]
  00 00 00 00 00 17 1d 00 25 27 00 00 00     00:00:00.070  NOP [Abort queued commands]

Error 566 [13] occurred at disk power-on lifetime: 0 hours (0 days + 0 hours)
  When the command that caused the error occurred, the device was in an unknown state.

  After command completion occurred, registers were:
  ER -- ST COUNT  LBA_48  LH LM LL DV DC
  -- -- -- == -- == == == -- -- -- -- --
  40 -- 00 01 08 00 51 00 00 e0 01 00 00

  Commands leading to the command that caused the error were:
  CR FEATR COUNT  LBA_48  LH LM LL DV DC  Powered_Up_Time  Command/Feature_Name
  -- == -- == -- == == == -- -- -- -- --  ---------------  --------------------
  00 6f 25 17 1a 00 00 00 00 00 00 00 1d     00:00:00.000  NOP [Reserved subcommand] [OBS-ACS-2]
  00 00 00 00 00 17 6f 00 1a 27 00 00 00     00:00:14.344  NOP [Abort queued commands]
  00 60 ef 17 1a 00 00 00 00 00 00 00 00     00:25:14.087  NOP [Reserved subcommand] [OBS-ACS-2]
  00 00 00 00 00 17 60 00 1a 27 00 00 00     00:00:00.070  NOP [Abort queued commands]

Error 565 [12] occurred at disk power-on lifetime: 0 hours (0 days + 0 hours)
  When the command that caused the error occurred, the device was in an unknown state.

  After command completion occurred, registers were:
  ER -- ST COUNT  LBA_48  LH LM LL DV DC
  -- -- -- == -- == == == -- -- -- -- --
  40 -- 00 01 08 00 51 00 00 e0 01 00 00

  Commands leading to the command that caused the error were:
  CR FEATR COUNT  LBA_48  LH LM LL DV DC  Powered_Up_Time  Command/Feature_Name
  -- == -- == -- == == == -- -- -- -- --  ---------------  --------------------
  00 5c 25 17 0f 00 00 00 00 00 00 00 1d     00:00:00.000  NOP [Reserved subcommand] [OBS-ACS-2]
  00 00 00 00 00 17 5b 00 0f 35 00 00 00     00:00:14.344  NOP [Abort queued commands]
  00 52 ec 17 0f 00 00 00 00 00 00 00 00     00:25:11.259  NOP [Reserved subcommand] [OBS-ACS-2]
  00 46 03 00 00 17 4b 00 0f ef 00 00 00     00:00:00.000  NOP [Reserved subcommand] [OBS-ACS-2]

Error 564 [11] occurred at disk power-on lifetime: 0 hours (0 days + 0 hours)
  When the command that caused the error occurred, the device was in an unknown state.

  After command completion occurred, registers were:
  ER -- ST COUNT  LBA_48  LH LM LL DV DC
  -- -- -- == -- == == == -- -- -- -- --
  40 -- 00 01 08 00 51 00 00 e0 01 00 00

  Commands leading to the command that caused the error were:
  CR FEATR COUNT  LBA_48  LH LM LL DV DC  Powered_Up_Time  Command/Feature_Name
  -- == -- == -- == == == -- -- -- -- --  ---------------  --------------------
  00 45 25 17 04 00 00 00 00 00 00 00 1d     00:00:00.000  NOP [Reserved subcommand] [OBS-ACS-2]
  00 00 00 00 00 17 45 00 04 27 00 00 00     00:00:14.344  NOP [Abort queued commands]
  00 35 ef 17 04 00 00 00 00 00 00 00 00     00:25:08.412  NOP [Reserved subcommand] [OBS-ACS-2]
  00 00 00 00 00 17 35 00 04 27 00 00 00     00:00:00.070  NOP [Abort queued commands]

Error 563 [10] occurred at disk power-on lifetime: 0 hours (0 days + 0 hours)
  When the command that caused the error occurred, the device was in an unknown state.

  After command completion occurred, registers were:
  ER -- ST COUNT  LBA_48  LH LM LL DV DC
  -- -- -- == -- == == == -- -- -- -- --
  40 -- 00 01 08 00 51 00 00 e0 01 00 00

  Commands leading to the command that caused the error were:
  CR FEATR COUNT  LBA_48  LH LM LL DV DC  Powered_Up_Time  Command/Feature_Name
  -- == -- == -- == == == -- -- -- -- --  ---------------  --------------------
  00 2c 25 16 f9 00 00 00 00 00 00 00 1d     00:00:00.000  NOP [Reserved subcommand] [OBS-ACS-2]
  00 00 00 00 00 16 2b 00 f9 27 00 00 00     00:00:14.344  NOP [Abort queued commands]
  00 1c ef 16 f9 00 00 00 00 00 00 00 00     00:25:05.571  NOP [Reserved subcommand] [OBS-ACS-2]
  00 00 00 00 00 16 1b 00 f9 27 00 00 00     00:00:00.070  NOP [Abort queued commands]

SMART Extended Self-test Log Version: 1 (1 sectors)
No self-tests have been logged.  [To run self-tests, use: smartctl -t]

SMART Selective self-test log data structure revision number 1
 SPAN  MIN_LBA  MAX_LBA  CURRENT_TEST_STATUS
    1        0        0  Not_testing
    2        0        0  Not_testing
    3        0        0  Not_testing
    4        0        0  Not_testing
    5        0        0  Not_testing
Selective self-test flags (0x0):
  After scanning selected spans, do NOT read-scan remainder of disk.
If Selective self-test is pending on power-up, resume after 0 minute delay.

SCT Status Version:                  2
SCT Version (vendor specific):       258 (0x0102)
Device State:                        Active (0)
Current Temperature:                    39 Celsius
Power Cycle Min/Max Temperature:     --/44 Celsius
Lifetime    Min/Max Temperature:     --/55 Celsius

SCT Temperature History Version:     2
Temperature Sampling Period:         1 minute
Temperature Logging Interval:        1 minute
Min/Max recommended Temperature:      0/60 Celsius
Min/Max Temperature Limit:           -40/85 Celsius
Temperature History Size (Index):    128 (120)

SCT Error Recovery Control:
           Read: Disabled
          Write: Disabled

SATA Phy Event Counters (GP Log 0x11)
ID      Size     Value  Description
0x0001  2            0  Command failed due to ICRC error
0x0002  2            0  R_ERR response for data FIS
0x0003  2            0  R_ERR response for device-to-host data FIS
0x0004  2            0  R_ERR response for host-to-device data FIS
0x0005  2            0  R_ERR response for non-data FIS
0x0006  2            0  R_ERR response for device-to-host non-data FIS
0x0007  2            0  R_ERR response for host-to-device non-data FIS
0x000a  2            2  Device-to-host register FISes sent due to a COMRESET
0x8000  4      4765765  Vendor specific

