smartctl 7.1 2020-06-20 r5066 [x86_64-linux-3.10.0-1127...] (local build)
Copyright (C) 2002-19, Bruce Allen, Christian Franke, www.smartmontools.org

=== START OF INFORMATION SECTION ===
Model Family:     Seagate IronWolf Pro
Device Model:     ST10000NE0004-1ZF101
Serial Number:    --
LU WWN Device Id: 5 000c50 ...
Firmware Version: EN01
User Capacity:    10,000,831,348,736 bytes [10.0 TB]
Sector Sizes:     512 bytes logical, 4096 bytes physical
Rotation Rate:    7200 rpm
Form Factor:      3.5 inches
Device is:        In smartctl database [for details use: -P show]
ATA Version is:   ACS-3 T13/2161-D revision 5
SATA Version is:  SATA 3.1, 6.0 Gb/s (current: 6.0 Gb/s)
Local Time is:    --
Rd look-ahead is: Enabled
Write cache is:   Enabled
ATA Security is:  Disabled, NOT FROZEN [SEC1]

=== START OF READ SMART DATA SECTION ===
SMART overall-health self-assessment test result: FAILED!
Drive failure expected in less than 24 hours. SAVE ALL DATA.

General SMART Values:
Offline data collection status:  (0x82)	Offline data collection activity
					was completed without error.

Self-test execution status:      (   0)	The previous self-test routine completed
					without error or no self-test has ever 
					been run.
Total time to complete Offline 
data collection: 		(  575) seconds.
Offline data collection
capabilities: 			 (0x7b) SMART execute Offline immediate.

					Suspend Offline collection upon new
					command.
					Offline surface scan supported.
					Self-test supported.
					Conveyance Self-test supported.
					Selective Self-test supported.
SMART capabilities:            (0x0003)	Saves SMART data before entering
					power-saving mode.

Error logging capability:        (0x01)	Error logging supported.
					General Purpose Logging supported.
Short self-test routine 
recommended polling time: 	 (   1) minutes.
Extended self-test routine
recommended polling time: 	 ( 919) minutes.
Conveyance self-test routine
recommended polling time: 	 (   2) minutes.
SCT capabilities: 	       (0x70bd)	SCT Status supported.
					SCT Error Recovery Control supported.
					SCT Feature Control supported.
					SCT Data Table supported.

SMART Attributes Data Structure revision number: 10
Vendor Specific SMART Attributes with Thresholds:
ID# ATTRIBUTE_NAME          FLAGS    VALUE WORST THRESH FAIL RAW_VALUE
  1 Raw_Read_Error_Rate     POSR--   080   045   044    -    104717637
  3 Spin_Up_Time            PO----   093   089   000    -    0
  4 Start_Stop_Count        -O--CK   100   100   020    -    55
  5 Reallocated_Sector_Ct   PO--CK   001   001   010    NOW  53045 (0 5)
  7 Seek_Error_Rate         POSR--   096   060   045    -    4260371937
  9 Power_On_Hours          -O--CK   077   077   000    -    20188 (88 103 0)
 10 Spin_Retry_Count        PO--C-   100   100   097    -    0
 12 Power_Cycle_Count       -O--CK   100   100   020    -    54
184 End-to-End_Error        -O--CK   100   100   099    -    0
187 Reported_Uncorrect      -O--CK   001   001   000    -    3367
188 Command_Timeout         -O--CK   100   011   000    -    197573214335
189 High_Fly_Writes         -O-RCK   036   036   000    -    64
190 Airflow_Temperature_Cel -O---K   061   057   040    -    39 (Min/Max 33/39)
191 G-Sense_Error_Rate      -O--CK   061   061   000    -    78059
192 Power-Off_Retract_Count -O--CK   100   100   000    -    147
193 Load_Cycle_Count        -O--CK   100   100   000    -    850
194 Temperature_Celsius     -O---K   039   043   000    -    39 (0 16 0 0 0)
195 Hardware_ECC_Recovered  -O-RC-   080   064   000    -    104717637
197 Current_Pending_Sector  -O--C-   100   100   000    -    152
198 Offline_Uncorrectable   ----C-   100   100   000    -    152
199 UDMA_CRC_Error_Count    -OSRCK   200   200   000    -    0
200 Multi_Zone_Error_Rate   PO---K   100   100   001    -    0
240 Head_Flying_Hours       ------   100   253   000    -    17076h+08m+10.439s
241 Total_LBAs_Written      ------   100   253   000    -    259984786641
242 Total_LBAs_Read         ------   100   253   000    -    2115241205075
                            ||||||_ K auto-keep
                            |||||__ C event count
                            ||||___ R error rate
                            |||____ S speed/performance
                            ||_____ O updated online
                            |______ P prefailure warning

General Purpose Log Directory Version 1
SMART           Log Directory Version 1 [multi-sector log support]
Address    Access  R/W   Size  Description
0x00       GPL,SL  R/O      1  Log Directory
0x01           SL  R/O      1  Summary SMART error log
0x02           SL  R/O      5  Comprehensive SMART error log
0x03       GPL     R/O      5  Ext. Comprehensive SMART error log
0x04       GPL     R/O    256  Device Statistics log
0x04       SL      R/O      8  Device Statistics log
0x06           SL  R/O      1  SMART self-test log
0x07       GPL     R/O      1  Extended self-test log
0x08       GPL     R/O      2  Power Conditions log
0x09           SL  R/W      1  Selective self-test log
0x0c       GPL     R/O   2048  Pending Defects log
0x10       GPL     R/O      1  NCQ Command Error log
0x11       GPL     R/O      1  SATA Phy Event Counters log
0x13       GPL     R/O      1  SATA NCQ Send and Receive log
0x15       GPL     R/W      1  Rebuild Assist log
0x21       GPL     R/O      1  Write stream error log
0x22       GPL     R/O      1  Read stream error log
0x24       GPL     R/O    768  Current Device Internal Status Data log
0x30       GPL,SL  R/O      9  IDENTIFY DEVICE data log
0x80-0x9f  GPL,SL  R/W     16  Host vendor specific log
0xa1       GPL,SL  VS      24  Device vendor specific log
0xa2       GPL     VS   16320  Device vendor specific log
0xa6       GPL     VS     192  Device vendor specific log
0xa8-0xa9  GPL,SL  VS     136  Device vendor specific log
0xab       GPL     VS       1  Device vendor specific log
0xad       GPL     VS      16  Device vendor specific log
0xb0       GPL     VS   17208  Device vendor specific log
0xbe-0xbf  GPL     VS   65535  Device vendor specific log
0xc1       GPL,SL  VS      16  Device vendor specific log
0xc3       GPL,SL  VS      56  Device vendor specific log
0xc9       GPL,SL  VS       8  Device vendor specific log
0xca       GPL,SL  VS      16  Device vendor specific log
0xd1       GPL     VS     304  Device vendor specific log
0xd2       GPL     VS   10000  Device vendor specific log
0xd4       GPL     VS    2048  Device vendor specific log
0xe0       GPL,SL  R/W      1  SCT Command/Status
0xe1       GPL,SL  R/W      1  SCT Data Transfer

SMART Extended Comprehensive Error Log Version: 1 (5 sectors)
Device Error Count: 3368 (device log contains only the most recent 20 errors)
	CR     = Command Register
	FEATR  = Features Register
	COUNT  = Count (was: Sector Count) Register
	LBA_48 = Upper bytes of LBA High/Mid/Low Registers ]  ATA-8
	LH     = LBA High (was: Cylinder High) Register    ]   LBA
	LM     = LBA Mid (was: Cylinder Low) Register      ] Register
	LL     = LBA Low (was: Sector Number) Register     ]
	DV     = Device (was: Device/Head) Register
	DC     = Device Control Register
	ER     = Error register
	ST     = Status register
Powered_Up_Time is measured from power on, and printed as
DDd+hh:mm:SS.sss where DD=days, hh=hours, mm=minutes,
SS=sec, and sss=millisec. It "wraps" after 49.710 days.

Error 3368 [7] log entry is empty
Error 3367 [6] log entry is empty
Error 3366 [5] log entry is empty
Error 3365 [4] log entry is empty
Error 3364 [3] occurred at disk power-on lifetime: 18880 hours (786 days + 16 hours)
  When the command that caused the error occurred, the device was active or idle.

  After command completion occurred, registers were:
  ER -- ST COUNT  LBA_48  LH LM LL DV DC
  -- -- -- == -- == == == -- -- -- -- --
  40 -- 51 00 00 00 03 1a ef 90 40 00 00  Error: UNC at LBA = 0x31aef9040 = 13336809536

  Commands leading to the command that caused the error were:
  CR FEATR COUNT  LBA_48  LH LM LL DV DC  Powered_Up_Time  Command/Feature_Name
  -- == -- == -- == == == -- -- -- -- --  ---------------  --------------------
  60 00 00 02 00 00 03 1a ef a2 70 40 00 20d+ ...          READ FPDMA QUEUED
  60 00 00 02 00 00 03 1a ef a0 70 40 00 20d+ ...          READ FPDMA QUEUED
  60 00 00 02 00 00 03 1a ef 9e 70 40 00 20d+ ...          READ FPDMA QUEUED
  60 00 00 02 00 00 03 1a ef 9c 70 40 00 20d+ ...          READ FPDMA QUEUED
  61 00 00 00 08 00 00 00 00 00 20 40 00 20d+ ...          WRITE FPDMA QUEUED

Error 3363 [2] occurred at disk power-on lifetime: 18880 hours (786 days + 16 hours)
  When the command that caused the error occurred, the device was active or idle.

  After command completion occurred, registers were:
  ER -- ST COUNT  LBA_48  LH LM LL DV DC
  -- -- -- == -- == == == -- -- -- -- --
  40 -- 51 00 00 00 03 1a ef 8c 40 00 00  Error: UNC at LBA = 0x31aef8c40 = 13336808512

  Commands leading to the command that caused the error were:
  CR FEATR COUNT  LBA_48  LH LM LL DV DC  Powered_Up_Time  Command/Feature_Name
  -- == -- == -- == == == -- -- -- -- --  ---------------  --------------------
  60 00 00 02 00 00 03 1a ef 8e 70 40 00 20d+ ...          READ FPDMA QUEUED
  60 00 00 02 00 00 03 1a ef 8c 70 40 00 20d+ ...          READ FPDMA QUEUED
  60 00 00 02 00 00 03 1a ef 8a 70 40 00 20d+ ...          READ FPDMA QUEUED
  60 00 00 02 00 00 03 1a ef 88 70 40 00 20d+ ...          READ FPDMA QUEUED
  b0 00 da 00 00 00 00 00 c2 4f 00 00 00 20d+ ...          SMART RETURN STATUS

Error 3362 [1] occurred at disk power-on lifetime: 18880 hours (786 days + 16 hours)
  When the command that caused the error occurred, the device was active or idle.

  After command completion occurred, registers were:
  ER -- ST COUNT  LBA_48  LH LM LL DV DC
  -- -- -- == -- == == == -- -- -- -- --
  40 -- 51 00 00 00 03 1a ef 42 58 00 00  Error: UNC at LBA = 0x31aef4258 = 13336789592

  Commands leading to the command that caused the error were:
  CR FEATR COUNT  LBA_48  LH LM LL DV DC  Powered_Up_Time  Command/Feature_Name
  -- == -- == -- == == == -- -- -- -- --  ---------------  --------------------
  60 00 00 02 00 00 03 1a ef 6a 70 40 00 20d+ ...          READ FPDMA QUEUED
  60 00 00 02 00 00 03 1a ef 68 70 40 00 20d+ ...          READ FPDMA QUEUED
  60 00 00 02 00 00 03 1a ef 66 70 40 00 20d+ ...          READ FPDMA QUEUED
  60 00 00 02 00 00 03 1a ef 64 70 40 00 20d+ ...          READ FPDMA QUEUED
  60 00 00 02 00 00 03 1a ef 62 70 40 00 20d+ ...          READ FPDMA QUEUED

Error 3361 [0] occurred at disk power-on lifetime: 18880 hours (786 days + 16 hours)
  When the command that caused the error occurred, the device was active or idle.

  After command completion occurred, registers were:
  ER -- ST COUNT  LBA_48  LH LM LL DV DC
  -- -- -- == -- == == == -- -- -- -- --
  40 -- 51 00 00 00 03 1a ef 43 30 00 00  Error: UNC at LBA = 0x31aef4330 = 13336789808

  Commands leading to the command that caused the error were:
  CR FEATR COUNT  LBA_48  LH LM LL DV DC  Powered_Up_Time  Command/Feature_Name
  -- == -- == -- == == == -- -- -- -- --  ---------------  --------------------
  60 00 00 02 00 00 03 1a ef 4c 70 40 00 20d+ ...          READ FPDMA QUEUED
  60 00 00 02 00 00 03 1a ef 42 70 40 00 20d+ ...          READ FPDMA QUEUED
  60 00 00 02 00 00 03 1a ef 4a 70 40 00 20d+ ...          READ FPDMA QUEUED
  60 00 00 02 00 00 03 1a ef 48 70 40 00 20d+ ...          READ FPDMA QUEUED
  60 00 00 02 00 00 03 1a ef 1a 70 40 00 20d+ ...          READ FPDMA QUEUED

SMART Extended Self-test Log Version: 1 (1 sectors)
No self-tests have been logged.  [To run self-tests, use: smartctl -t]

SMART Selective self-test log data structure revision number 1
 SPAN  MIN_LBA  MAX_LBA  CURRENT_TEST_STATUS
    1        0        0  Not_testing
    2        0        0  Not_testing
    3        0        0  Not_testing
    4        0        0  Not_testing
    5        0        0  Not_testing
Selective self-test flags (0x0):
  After scanning selected spans, do NOT read-scan remainder of disk.
If Selective self-test is pending on power-up, resume after 0 minute delay.

SCT Status Version:                  3
SCT Version (vendor specific):       522 (0x020a)
Device State:                        Active (0)
Current Temperature:                    39 Celsius
Power Cycle Min/Max Temperature:     32/40 Celsius
Lifetime    Min/Max Temperature:     12/42 Celsius
Under/Over Temperature Limit Count:   0/331

SCT Temperature History Version:     2
Temperature Sampling Period:         3 minutes
Temperature Logging Interval:        59 minutes
Min/Max recommended Temperature:      0/ 0 Celsius
Min/Max Temperature Limit:            0/ 0 Celsius
Temperature History Size (Index):    128 (115)

SCT Error Recovery Control:
           Read:    100 (10.0 seconds)
          Write:    100 (10.0 seconds)

Device Statistics (GP Log 0x04)
Page  Offset Size        Value Flags Description
0x01  =====  =               =  ===  == General Statistics (rev 1) ==
0x01  0x008  4              54  ---  Lifetime Power-On Resets
0x01  0x010  4           20188  ---  Power-on Hours
0x01  0x018  6    259980128581  ---  Logical Sectors Written
0x01  0x020  6      1656563943  ---  Number of Write Commands
0x01  0x028  6   2115218242143  ---  Logical Sectors Read
0x01  0x030  6      4948284560  ---  Number of Read Commands
0x01  0x038  6               -  ---  Date and Time TimeStamp
0x03  =====  =               =  ===  == Rotating Media Statistics (rev 1) ==
0x03  0x008  4      3023872103  N--  Spindle Motor Power-on Hours
0x03  0x010  4      3023853494  N--  Head Flying Hours
0x03  0x018  4             850  ---  Head Load Events
0x03  0x020  4           53045  ---  Number of Reallocated Logical Sectors
0x03  0x028  4               0  ---  Read Recovery Attempts
0x03  0x030  4               0  ---  Number of Mechanical Start Failures
0x03  0x038  4             152  ---  Number of Realloc. Candidate Logical Sectors
0x03  0x040  4             147  ---  Number of High Priority Unload Events
0x04  =====  =               =  ===  == General Errors Statistics (rev 1) ==
0x04  0x008  4            5185  ---  Number of Reported Uncorrectable Errors
0x04  0x010  4             127  ---  Resets Between Cmd Acceptance and Completion
0x05  =====  =               =  ===  == Temperature Statistics (rev 1) ==
0x05  0x008  1              39  ---  Current Temperature
0x05  0x010  1              38  ---  Average Short Term Temperature
0x05  0x018  1              37  ---  Average Long Term Temperature
0x05  0x020  1              42  ---  Highest Temperature
0x05  0x028  1               0  ---  Lowest Temperature
0x05  0x030  1              40  ---  Highest Average Short Term Temperature
0x05  0x038  1              33  ---  Lowest Average Short Term Temperature
0x05  0x040  1              39  ---  Highest Average Long Term Temperature
0x05  0x048  1              34  ---  Lowest Average Long Term Temperature
0x05  0x050  4               0  ---  Time in Over-Temperature
0x05  0x058  1              60  ---  Specified Maximum Operating Temperature
0x05  0x060  4              42  ---  Time in Under-Temperature
0x05  0x068  1               5  ---  Specified Minimum Operating Temperature
0x06  =====  =               =  ===  == Transport Statistics (rev 1) ==
0x06  0x008  4             513  ---  Number of Hardware Resets
0x06  0x010  4               0  ---  Number of ASR Events
0x06  0x018  4               0  ---  Number of Interface CRC Errors
0xff  =====  =               =  ===  == Vendor Specific Statistics (rev 1) ==
0xff  0x008  7               0  ---  Vendor Specific
                                |||_ C monitored condition met
                                ||__ D supports DSN
                                |___ N normalized value

Pending Defects log (GP Log 0x0c)
Index                LBA    Hours
    0        13778227224    18764
    1        13778227225    18764
    2        13778227226    18764
    3        13778227227    18764
    4        13778227228    18764
    5        13778227229    18764
    6        13778227230    18764
    7        13778227231    18764
    8        13824299032    18849
    9        13824299033    18849
   10        13824299034    18849
   11        13824299035    18849
   12        13824299036    18849
   13        13824299037    18849
   14        13824299038    18849
   15        13824299039    18849
   16        17022022464    18750
   17        17022022465    18750
   18        17022022466    18750
   19        17022022467    18750
   20        17022022468    18750
   21        17022022469    18750
   22        17022022470    18750
   23        17022022471    18750
   24        17022057336    18750
   25        17022057337    18750
   26        17022057338    18750
   27        17022057339    18750
   28        17022057340    18750
   29        17022057341    18750
   30        17022057342    18750

SATA Phy Event Counters (GP Log 0x11)
ID      Size     Value  Description
0x000a  2            6  Device-to-host register FISes sent due to a COMRESET
0x0001  2            0  Command failed due to ICRC error
0x0003  2            0  R_ERR response for device-to-host data FIS
0x0004  2            0  R_ERR response for host-to-device data FIS
0x0006  2            0  R_ERR response for device-to-host non-data FIS
0x0007  2            0  R_ERR response for host-to-device non-data FIS

