smartctl 7.1 2020-06-20 r5066 [x86_64-linux-3.10.0-1127...] (local build)
Copyright (C) 2002-19, Bruce Allen, Christian Franke, www.smartmontools.org

=== START OF INFORMATION SECTION ===
Model Number:                       KXG50ZNV512G TOSHIBA
Serial Number:                      --
Firmware Version:                   AAGA4103
PCI Vendor/Subsystem ID:            0x1179
IEEE OUI Identifier:                0x00080d
Total NVM Capacity:                 512,110,190,592 [512 GB]
Unallocated NVM Capacity:           0
Controller ID:                      0
Number of Namespaces:               1
Namespace 1 Size/Capacity:          512,110,190,592 [512 GB]
Namespace 1 Formatted LBA Size:     512
Namespace 1 IEEE EUI-64:            00080d ...
Local Time is:                      Mon Aug ... 2021 GMT

=== START OF READ SMART DATA SECTION ===
SMART overall-health self-assessment test result: PASSED

SMART/Health Information (NVMe Log 0x02)
Critical Warning:                   0x00
Temperature:                        41 Celsius
Available Spare:                    100%
Available Spare Threshold:          10%
Percentage Used:                    165%
Data Units Read:                    72,089,110 [36.9 TB]
Data Units Written:                 1,448,508,412 [741 TB]
Host Read Commands:                 3,042,570,821
Host Write Commands:                100,484,394,823
Controller Busy Time:               72,364
Power Cycles:                       18
Power On Hours:                     19,374
Unsafe Shutdowns:                   2
Media and Data Integrity Errors:    0
Error Information Log Entries:      0
Warning  Comp. Temperature Time:    0
Critical Comp. Temperature Time:    0
Temperature Sensor 1:               41 Celsius

