smartctl 7.1 2020-06-20 r5066 [x86_64-linux-3.10.0-957...] (local build)
Copyright (C) 2002-19, Bruce Allen, Christian Franke, www.smartmontools.org

=== START OF INFORMATION SECTION ===
Model Number:                       SAMSUNG MZQLB3T8HALS-000AZ
Serial Number:                      --
Firmware Version:                   EDA53W0Q
PCI Vendor/Subsystem ID:            0x144d
IEEE OUI Identifier:                0x002538
Total NVM Capacity:                 3,840,755,982,336 [3.84 TB]
Unallocated NVM Capacity:           0
Controller ID:                      4
Number of Namespaces:               1
Namespace 1 Size/Capacity:          3,840,755,982,336 [3.84 TB]
Namespace 1 Utilization:            3,824,912,994,304 [3.82 TB]
Namespace 1 Formatted LBA Size:     512
Local Time is:                      --

=== START OF READ SMART DATA SECTION ===
SMART overall-health self-assessment test result: PASSED

SMART/Health Information (NVMe Log 0x02)
Critical Warning:                   0x00
Temperature:                        35 Celsius
Available Spare:                    100%
Available Spare Threshold:          10%
Percentage Used:                    0%
Data Units Read:                    1,698,131,639 [869 TB]
Data Units Written:                 206,196,024 [105 TB]
Host Read Commands:                 9,703,804,914
Host Write Commands:                3,051,408,589
Controller Busy Time:               31,300
Power Cycles:                       25
Power On Hours:                     11,869
Unsafe Shutdowns:                   22
Media and Data Integrity Errors:    0
Error Information Log Entries:      43
Warning  Comp. Temperature Time:    0
Critical Comp. Temperature Time:    0
Temperature Sensor 1:               35 Celsius
Temperature Sensor 2:               40 Celsius
Temperature Sensor 3:               46 Celsius

