smartctl 7.1 2020-06-20 r5066 [x86_64-linux-3.10.0-1127...] (local build)
Copyright (C) 2002-19, Bruce Allen, Christian Franke, www.smartmontools.org

=== START OF INFORMATION SECTION ===
Model Number:                       SAMSUNG MZQLB3T8HALS-000AZ
Serial Number:                      --
Firmware Version:                   EDA53W0Q
PCI Vendor/Subsystem ID:            0x144d
IEEE OUI Identifier:                0x002538
Total NVM Capacity:                 3,840,755,982,336 [3.84 TB]
Unallocated NVM Capacity:           0
Controller ID:                      4
Number of Namespaces:               1
Namespace 1 Size/Capacity:          3,840,755,982,336 [3.84 TB]
Namespace 1 Utilization:            3,631,741,153,280 [3.63 TB]
Namespace 1 Formatted LBA Size:     512
Local Time is:                      --

=== START OF READ SMART DATA SECTION ===
SMART overall-health self-assessment test result: PASSED

SMART/Health Information (NVMe Log 0x02)
Critical Warning:                   0x00
Temperature:                        31 Celsius
Available Spare:                    100%
Available Spare Threshold:          10%
Percentage Used:                    0%
Data Units Read:                    171,711,270 [87.9 TB]
Data Units Written:                 122,726,047 [62.8 TB]
Host Read Commands:                 891,416,389
Host Write Commands:                804,491,771
Controller Busy Time:               2,046
Power Cycles:                       8
Power On Hours:                     10,160
Unsafe Shutdowns:                   6
Media and Data Integrity Errors:    0
Error Information Log Entries:      22
Warning  Comp. Temperature Time:    0
Critical Comp. Temperature Time:    0
Temperature Sensor 1:               31 Celsius
Temperature Sensor 2:               36 Celsius
Temperature Sensor 3:               41 Celsius

