smartctl 7.1 2020-06-20 r5066 [x86_64-linux-3.10.0-1127...] (local build)
Copyright (C) 2002-19, Bruce Allen, Christian Franke, www.smartmontools.org

=== START OF INFORMATION SECTION ===
Model Number:                       INTEL SSDPE2MX450G7
Serial Number:                      --
Firmware Version:                   MDV10271
PCI Vendor/Subsystem ID:            0x8086
IEEE OUI Identifier:                0x5cd2e4
Controller ID:                      0
Number of Namespaces:               1
Namespace 1 Size/Capacity:          450,098,159,616 [450 GB]
Namespace 1 Formatted LBA Size:     512
Local Time is:                      Mon Mar ... 2022 UTC

=== START OF READ SMART DATA SECTION ===
SMART overall-health self-assessment test result: PASSED

SMART/Health Information (NVMe Log 0x02)
Critical Warning:                   0x00
Temperature:                        17 Celsius
Available Spare:                    98%
Available Spare Threshold:          10%
Percentage Used:                    4%
Data Units Read:                    18,911,302 [9.68 TB]
Data Units Written:                 197,071,970 [100 TB]
Host Read Commands:                 795,022,981
Host Write Commands:                7,290,805,398
Controller Busy Time:               900
Power Cycles:                       22
Power On Hours:                     38,261
Unsafe Shutdowns:                   1
Media and Data Integrity Errors:    0
Error Information Log Entries:      0

