smartctl 7.1 2020-06-20 r5066 [x86_64-linux-3.10.0-1160...] (local build)
Copyright (C) 2002-19, Bruce Allen, Christian Franke, www.smartmontools.org

=== START OF INFORMATION SECTION ===
Model Number:                       INTEL SSDPE2MX450G7
Serial Number:                      --
Firmware Version:                   MDV10290
PCI Vendor/Subsystem ID:            0x8086
IEEE OUI Identifier:                0x5cd2e4
Controller ID:                      0
Number of Namespaces:               1
Namespace 1 Size/Capacity:          450,098,159,616 [450 GB]
Namespace 1 Formatted LBA Size:     512
Local Time is:                      --

=== START OF READ SMART DATA SECTION ===
SMART overall-health self-assessment test result: PASSED

SMART/Health Information (NVMe Log 0x02)
Critical Warning:                   0x00
Temperature:                        23 Celsius
Available Spare:                    98%
Available Spare Threshold:          10%
Percentage Used:                    3%
Data Units Read:                    46,515,132 [23.8 TB]
Data Units Written:                 72,449,628 [37.0 TB]
Host Read Commands:                 1,370,782,676
Host Write Commands:                3,259,855,808
Controller Busy Time:               0
Power Cycles:                       76
Power On Hours:                     19,881
Unsafe Shutdowns:                   5
Media and Data Integrity Errors:    0
Error Information Log Entries:      0

