smartctl 7.1 2020-06-20 r5066 [x86_64-linux-3.10.0-862...] (local build)
Copyright (C) 2002-19, Bruce Allen, Christian Franke, www.smartmontools.org

=== START OF INFORMATION SECTION ===
Model Number:                       INTEL SSDPE2MX450G7
Serial Number:                      --
Firmware Version:                   MDV10290
PCI Vendor/Subsystem ID:            0x8086
IEEE OUI Identifier:                0x5cd2e4
Controller ID:                      0
Number of Namespaces:               1
Namespace 1 Size/Capacity:          450,098,159,616 [450 GB]
Namespace 1 Formatted LBA Size:     512
Local Time is:                      Sat Oct ... 2020 MDT

=== START OF READ SMART DATA SECTION ===
SMART overall-health self-assessment test result: PASSED

SMART/Health Information (NVMe Log 0x02)
Critical Warning:                   0x00
Temperature:                        18 Celsius
Available Spare:                    98%
Available Spare Threshold:          10%
Percentage Used:                    1%
Data Units Read:                    76,328,979 [39.0 TB]
Data Units Written:                 48,443,185 [24.8 TB]
Host Read Commands:                 1,011,361,577
Host Write Commands:                1,919,225,618
Controller Busy Time:               190
Power Cycles:                       15
Power On Hours:                     15,565
Unsafe Shutdowns:                   1
Media and Data Integrity Errors:    0
Error Information Log Entries:      0

