smartctl 7.1 2020-06-20 r5066 [x86_64-linux-3.10.0-1160...] (local build)
Copyright (C) 2002-19, Bruce Allen, Christian Franke, www.smartmontools.org

=== START OF INFORMATION SECTION ===
Model Number:                       INTEL SSDPE2MX450G7
Serial Number:                      --
Firmware Version:                   MDV10290
PCI Vendor/Subsystem ID:            0x8086
IEEE OUI Identifier:                0x5cd2e4
Controller ID:                      0
Number of Namespaces:               1
Namespace 1 Size/Capacity:          450,098,159,616 [450 GB]
Namespace 1 Formatted LBA Size:     512
Local Time is:                      Thu Oct ... 2021 NZDT

=== START OF READ SMART DATA SECTION ===
SMART overall-health self-assessment test result: PASSED

SMART/Health Information (NVMe Log 0x02)
Critical Warning:                   0x00
Temperature:                        16 Celsius
Available Spare:                    98%
Available Spare Threshold:          10%
Percentage Used:                    0%
Data Units Read:                    27,702,323 [14.1 TB]
Data Units Written:                 15,766,681 [8.07 TB]
Host Read Commands:                 275,648,225
Host Write Commands:                759,131,141
Controller Busy Time:               10
Power Cycles:                       78
Power On Hours:                     15,205
Unsafe Shutdowns:                   2
Media and Data Integrity Errors:    0
Error Information Log Entries:      0

