smartctl 7.1 2020-06-20 r5066 [x86_64-linux-3.10.0-1127...] (local build)
Copyright (C) 2002-19, Bruce Allen, Christian Franke, www.smartmontools.org

=== START OF INFORMATION SECTION ===
Model Number:                       INTEL SSDPE2MX450G7
Serial Number:                      --
Firmware Version:                   MDV10271
PCI Vendor/Subsystem ID:            0x8086
IEEE OUI Identifier:                0x5cd2e4
Controller ID:                      0
Number of Namespaces:               1
Namespace 1 Size/Capacity:          450,098,159,616 [450 GB]
Namespace 1 Formatted LBA Size:     512
Local Time is:                      --

=== START OF READ SMART DATA SECTION ===
SMART overall-health self-assessment test result: PASSED

SMART/Health Information (NVMe Log 0x02)
Critical Warning:                   0x00
Temperature:                        22 Celsius
Available Spare:                    98%
Available Spare Threshold:          10%
Percentage Used:                    1%
Data Units Read:                    5,749,849 [2.94 TB]
Data Units Written:                 51,473,677 [26.3 TB]
Host Read Commands:                 453,256,602
Host Write Commands:                4,052,162,641
Controller Busy Time:               15
Power Cycles:                       14
Power On Hours:                     27,643
Unsafe Shutdowns:                   1
Media and Data Integrity Errors:    0
Error Information Log Entries:      0

