smartctl 7.1 2020-06-20 r5066 [x86_64-linux-3.10.0-1160...] (local build)
Copyright (C) 2002-19, Bruce Allen, Christian Franke, www.smartmontools.org

=== START OF INFORMATION SECTION ===
Model Number:                       INTEL SSDPE2MX450G7
Serial Number:                      --
Firmware Version:                   MDV10290
PCI Vendor/Subsystem ID:            0x8086
IEEE OUI Identifier:                0x5cd2e4
Controller ID:                      0
Number of Namespaces:               1
Namespace 1 Size/Capacity:          450,098,159,616 [450 GB]
Namespace 1 Formatted LBA Size:     512
Local Time is:                      Sun Feb ... 2022 PST

=== START OF READ SMART DATA SECTION ===
SMART overall-health self-assessment test result: PASSED

SMART/Health Information (NVMe Log 0x02)
Critical Warning:                   0x00
Temperature:                        21 Celsius
Available Spare:                    98%
Available Spare Threshold:          10%
Percentage Used:                    0%
Data Units Read:                    8,098,028 [4.14 TB]
Data Units Written:                 12,569,736 [6.43 TB]
Host Read Commands:                 124,100,581
Host Write Commands:                751,046,235
Controller Busy Time:               1
Power Cycles:                       45
Power On Hours:                     10,770
Unsafe Shutdowns:                   2
Media and Data Integrity Errors:    0
Error Information Log Entries:      0

