smartctl 7.1 2020-06-20 r5066 [x86_64-linux-3.10.0-1160...] (local build)
Copyright (C) 2002-19, Bruce Allen, Christian Franke, www.smartmontools.org

=== START OF INFORMATION SECTION ===
Model Number:                       SAMSUNG MZQL23T8HCLS-00A07
Serial Number:                      --
Firmware Version:                   GDC5A02Q
PCI Vendor/Subsystem ID:            0x144d
IEEE OUI Identifier:                0x002538
Total NVM Capacity:                 3,840,755,982,336 [3.84 TB]
Unallocated NVM Capacity:           0
Controller ID:                      6
Number of Namespaces:               32
Namespace 1 Size/Capacity:          3,840,755,982,336 [3.84 TB]
Namespace 1 Utilization:            232,266,276,864 [232 GB]
Namespace 1 Formatted LBA Size:     512
Local Time is:                      Thu Feb ... 2025 MSK

=== START OF READ SMART DATA SECTION ===
SMART overall-health self-assessment test result: PASSED

SMART/Health Information (NVMe Log 0x02)
Critical Warning:                   0x00
Temperature:                        25 Celsius
Available Spare:                    100%
Available Spare Threshold:          10%
Percentage Used:                    0%
Data Units Read:                    37,198,240 [19.0 TB]
Data Units Written:                 14,304,785 [7.32 TB]
Host Read Commands:                 115,740,318
Host Write Commands:                463,726,739
Controller Busy Time:               211
Power Cycles:                       48
Power On Hours:                     3,615
Unsafe Shutdowns:                   26
Media and Data Integrity Errors:    0
Error Information Log Entries:      3
Warning  Comp. Temperature Time:    0
Critical Comp. Temperature Time:    0
Temperature Sensor 1:               25 Celsius
Temperature Sensor 2:               34 Celsius

