smartctl 7.4 2023-08-01 r5530 [x86_64-linux-3.10.0-1160...] (local build)
Copyright (C) 2002-23, Bruce Allen, Christian Franke, www.smartmontools.org

=== START OF INFORMATION SECTION ===
Model Number:                       SAMSUNG MZQL23T8HCLS-00A07
Serial Number:                      --
Firmware Version:                   GDC5A02Q
PCI Vendor/Subsystem ID:            0x144d
IEEE OUI Identifier:                0x002538
Total NVM Capacity:                 3,840,755,982,336 [3.84 TB]
Unallocated NVM Capacity:           0
Controller ID:                      6
NVMe Version:                       1.4
Number of Namespaces:               32
Namespace 1 Size/Capacity:          3,840,755,982,336 [3.84 TB]
Namespace 1 Utilization:            61,953,912,832 [61.9 GB]
Namespace 1 Formatted LBA Size:     512
Local Time is:                      Thu Oct ... 2025 +07

=== START OF READ SMART DATA SECTION ===
SMART overall-health self-assessment test result: PASSED

SMART/Health Information (NVMe Log 0x02)
Critical Warning:                   0x00
Temperature:                        26 Celsius
Available Spare:                    100%
Available Spare Threshold:          10%
Percentage Used:                    0%
Data Units Read:                    10,380,167 [5.31 TB]
Data Units Written:                 721,690 [369 GB]
Host Read Commands:                 21,725,702
Host Write Commands:                1,329,794
Controller Busy Time:               27
Power Cycles:                       25
Power On Hours:                     3,767
Unsafe Shutdowns:                   15
Media and Data Integrity Errors:    0
Error Information Log Entries:      0
Warning  Comp. Temperature Time:    0
Critical Comp. Temperature Time:    0
Temperature Sensor 1:               26 Celsius
Temperature Sensor 2:               35 Celsius

Error Information (NVMe Log 0x01, 16 of 64 entries)
No Errors Logged

Read Self-test Log failed: Invalid Field in Command (0x002)

