smartctl 7.1 2020-06-20 r5066 [x86_64-linux-3.10.0-1160...] (local build)
Copyright (C) 2002-19, Bruce Allen, Christian Franke, www.smartmontools.org

=== START OF INFORMATION SECTION ===
Model Number:                       Viper M.2 VPN100
Serial Number:                      --
Firmware Version:                   ECFM22.6
PCI Vendor/Subsystem ID:            0x1987
IEEE OUI Identifier:                0x6479a7
Total NVM Capacity:                 256,060,514,304 [256 GB]
Unallocated NVM Capacity:           0
Controller ID:                      1
Number of Namespaces:               1
Namespace 1 Size/Capacity:          256,060,514,304 [256 GB]
Namespace 1 Formatted LBA Size:     512
Namespace 1 IEEE EUI-64:            6479a7 ...
Local Time is:                      --

=== START OF READ SMART DATA SECTION ===
SMART overall-health self-assessment test result: PASSED

SMART/Health Information (NVMe Log 0x02)
Critical Warning:                   0x00
Temperature:                        44 Celsius
Available Spare:                    100%
Available Spare Threshold:          5%
Percentage Used:                    10%
Data Units Read:                    33,971,148 [17.3 TB]
Data Units Written:                 35,851,125 [18.3 TB]
Host Read Commands:                 294,585,432
Host Write Commands:                474,889,488
Controller Busy Time:               17,166
Power Cycles:                       6
Power On Hours:                     7,298
Unsafe Shutdowns:                   3
Media and Data Integrity Errors:    0
Error Information Log Entries:      50
Warning  Comp. Temperature Time:    0
Critical Comp. Temperature Time:    0

