smartctl 7.1 2020-06-20 r5066 [x86_64-linux-3.10.0-1160...] (local build)
Copyright (C) 2002-19, Bruce Allen, Christian Franke, www.smartmontools.org

=== START OF INFORMATION SECTION ===
Model Number:                       SAMSUNG MZ1LB3T8HMLA-00007
Serial Number:                      --
Firmware Version:                   EDB7602Q
PCI Vendor/Subsystem ID:            0x144d
IEEE OUI Identifier:                0x002538
Total NVM Capacity:                 3,840,755,982,336 [3.84 TB]
Unallocated NVM Capacity:           0
Controller ID:                      4
Number of Namespaces:               1
Namespace 1 Size/Capacity:          3,840,755,982,336 [3.84 TB]
Namespace 1 Utilization:            1,756,222,341,120 [1.75 TB]
Namespace 1 Formatted LBA Size:     512
Local Time is:                      --

=== START OF READ SMART DATA SECTION ===
SMART overall-health self-assessment test result: PASSED

SMART/Health Information (NVMe Log 0x02)
Critical Warning:                   0x00
Temperature:                        19 Celsius
Available Spare:                    100%
Available Spare Threshold:          10%
Percentage Used:                    0%
Data Units Read:                    247,035,657 [126 TB]
Data Units Written:                 136,470,597 [69.8 TB]
Host Read Commands:                 1,053,676,143
Host Write Commands:                3,196,562,116
Controller Busy Time:               3,115
Power Cycles:                       4
Power On Hours:                     10,066
Unsafe Shutdowns:                   2
Media and Data Integrity Errors:    0
Error Information Log Entries:      15
Warning  Comp. Temperature Time:    0
Critical Comp. Temperature Time:    0
Temperature Sensor 1:               19 Celsius
Temperature Sensor 2:               26 Celsius
Temperature Sensor 3:               33 Celsius

