smartctl 7.1 2019-12-30 r5022 [x86_64-linux-3.10.0-1062...] (local build)
Copyright (C) 2002-19, Bruce Allen, Christian Franke, www.smartmontools.org

=== START OF INFORMATION SECTION ===
Model Number:                       INTEL SSDPEDMD020T4D HHHL NVMe 2000GB
Serial Number:                      --
Firmware Version:                   8DV1DP01
PCI Vendor/Subsystem ID:            0x8086
IEEE OUI Identifier:                0x5cd2e4
Controller ID:                      0
Number of Namespaces:               1
Namespace 1 Size/Capacity:          2,000,398,934,016 [2.00 TB]
Namespace 1 Formatted LBA Size:     512
Local Time is:                      --

=== START OF READ SMART DATA SECTION ===
SMART overall-health self-assessment test result: PASSED

SMART/Health Information (NVMe Log 0x02)
Critical Warning:                   0x00
Temperature:                        33 Celsius
Available Spare:                    100%
Available Spare Threshold:          10%
Percentage Used:                    8%
Data Units Read:                    9,405,453,294 [4.81 PB]
Data Units Written:                 14,995,347,300 [7.67 PB]
Host Read Commands:                 81,148,504,819
Host Write Commands:                113,350,210,348
Controller Busy Time:               57,187
Power Cycles:                       69
Power On Hours:                     30,325
Unsafe Shutdowns:                   77
Media and Data Integrity Errors:    0
Error Information Log Entries:      0

