smartctl 7.1 2020-06-20 r5066 [x86_64-linux-3.10.0-1127...] (local build)
Copyright (C) 2002-19, Bruce Allen, Christian Franke, www.smartmontools.org

=== START OF INFORMATION SECTION ===
Model Number:                       INTEL SSDPEDMD020T4D HHHL NVMe 2000GB
Serial Number:                      --
Firmware Version:                   8DV10151
PCI Vendor/Subsystem ID:            0x8086
IEEE OUI Identifier:                0x5cd2e4
Controller ID:                      0
Number of Namespaces:               1
Namespace 1 Size/Capacity:          2,000,398,934,016 [2.00 TB]
Namespace 1 Formatted LBA Size:     512
Local Time is:                      --

=== START OF READ SMART DATA SECTION ===
SMART overall-health self-assessment test result: PASSED

SMART/Health Information (NVMe Log 0x02)
Critical Warning:                   0x00
Temperature:                        28 Celsius
Available Spare:                    99%
Available Spare Threshold:          10%
Percentage Used:                    7%
Data Units Read:                    8,846,938,234 [4.52 PB]
Data Units Written:                 14,136,159,915 [7.23 PB]
Host Read Commands:                 87,950,222,765
Host Write Commands:                122,531,659,339
Controller Busy Time:               49,552
Power Cycles:                       189
Power On Hours:                     26,754
Unsafe Shutdowns:                   192
Media and Data Integrity Errors:    0
Error Information Log Entries:      0

