smartctl 7.1 2020-06-20 r5066 [x86_64-linux-3.10.0-1160...] (local build)
Copyright (C) 2002-19, Bruce Allen, Christian Franke, www.smartmontools.org

=== START OF INFORMATION SECTION ===
Model Family:     Intel S4510/S4610/S4500/S4600 Series SSDs
Device Model:     INTEL SSDSC2KG960G8
Serial Number:    --
LU WWN Device Id: 5 5cd2e4 ...
Firmware Version: XCV10100
User Capacity:    960,197,124,096 bytes [960 GB]
Sector Sizes:     512 bytes logical, 4096 bytes physical
Rotation Rate:    Solid State Device
Form Factor:      2.5 inches
Device is:        In smartctl database [for details use: -P show]
ATA Version is:   ACS-3 T13/2161-D revision 5
SATA Version is:  SATA 3.2, 6.0 Gb/s (current: 6.0 Gb/s)
Local Time is:    --
Rd look-ahead is: Enabled
Write cache is:   Enabled
ATA Security is:  Disabled, NOT FROZEN [SEC1]

=== START OF READ SMART DATA SECTION ===
SMART overall-health self-assessment test result: PASSED
Warning: This result is based on an Attribute check.

General SMART Values:
Offline data collection status:  (0x00)	Offline data collection activity
					was never started.

Self-test execution status:      (   0)	The previous self-test routine completed
					without error or no self-test has ever 
					been run.
Total time to complete Offline 
data collection: 		(    0) seconds.
Offline data collection
capabilities: 			 (0x79) SMART execute Offline immediate.

					Suspend Offline collection upon new
					command.
					Offline surface scan supported.
					Self-test supported.
					Conveyance Self-test supported.
					Selective Self-test supported.
SMART capabilities:            (0x0003)	Saves SMART data before entering
					power-saving mode.

Error logging capability:        (0x01)	Error logging supported.
					General Purpose Logging supported.
Short self-test routine 
recommended polling time: 	 (   1) minutes.
Extended self-test routine
recommended polling time: 	 (   2) minutes.
Conveyance self-test routine
recommended polling time: 	 (   2) minutes.
SCT capabilities: 	       (0x003d)	SCT Status supported.
					SCT Error Recovery Control supported.
					SCT Feature Control supported.
					SCT Data Table supported.

SMART Attributes Data Structure revision number: 1
Vendor Specific SMART Attributes with Thresholds:
ID# ATTRIBUTE_NAME          FLAGS    VALUE WORST THRESH FAIL RAW_VALUE
  5 Reallocated_Sector_Ct   -O--CK   100   100   000    -    0
  9 Power_On_Hours          -O--CK   100   100   000    -    25805
 12 Power_Cycle_Count       -O--CK   100   100   000    -    17
170 Available_Reservd_Space PO--CK   100   100   010    -    0
171 Program_Fail_Count      -O--CK   100   100   000    -    0
172 Erase_Fail_Count        -O--CK   100   100   000    -    0
174 Unsafe_Shutdown_Count   -O--CK   100   100   000    -    11
175 Power_Loss_Cap_Test     PO--CK   100   100   010    -    2371 (17 65535)
183 SATA_Downshift_Count    -O--CK   100   100   000    -    0
184 End-to-End_Error_Count  PO--CK   100   100   090    -    0
187 Uncorrectable_Error_Cnt -O--CK   100   100   000    -    0
190 Drive_Temperature       -O---K   063   057   000    -    37 (Min/Max 22/43)
192 Unsafe_Shutdown_Count   -O--CK   100   100   000    -    11
194 Temperature_Celsius     -O---K   100   100   000    -    37
197 Pending_Sector_Count    -O--C-   100   100   000    -    0
199 CRC_Error_Count         -OSRCK   100   100   000    -    93
225 Host_Writes_32MiB       -O--CK   100   100   000    -    6944945
226 Workld_Media_Wear_Indic -O--CK   100   100   000    -    3317
227 Workld_Host_Reads_Perc  -O--CK   100   100   000    -    54
228 Workload_Minutes        -O--CK   100   100   000    -    1548300
232 Available_Reservd_Space PO--CK   100   100   010    -    0
233 Media_Wearout_Indicator -O--CK   097   097   000    -    0
234 Thermal_Throttle_Status -O--CK   100   100   000    -    0/0
235 Power_Loss_Cap_Test     PO--CK   100   100   010    -    2371 (17 65535)
241 Host_Writes_32MiB       -O--CK   100   100   000    -    6944945
242 Host_Reads_32MiB        -O--CK   100   100   000    -    8275992
243 NAND_Writes_32MiB       -O--CK   100   100   000    -    13507504
                            ||||||_ K auto-keep
                            |||||__ C event count
                            ||||___ R error rate
                            |||____ S speed/performance
                            ||_____ O updated online
                            |______ P prefailure warning

General Purpose Log Directory Version 1
SMART           Log Directory Version 1 [multi-sector log support]
Address    Access  R/W   Size  Description
0x00       GPL,SL  R/O      1  Log Directory
0x01           SL  R/O      1  Summary SMART error log
0x02           SL  R/O      8  Comprehensive SMART error log
0x03       GPL     R/O     20  Ext. Comprehensive SMART error log
0x04       GPL,SL  R/O      8  Device Statistics log
0x06           SL  R/O      1  SMART self-test log
0x07       GPL     R/O      2  Extended self-test log
0x08       GPL     R/O      2  Power Conditions log
0x09           SL  R/W      1  Selective self-test log
0x10       GPL     R/O      1  NCQ Command Error log
0x11       GPL     R/O      1  SATA Phy Event Counters log
0x30       GPL,SL  R/O      9  IDENTIFY DEVICE data log
0x80-0x9f  GPL,SL  R/W     16  Host vendor specific log
0xb8       GPL,SL  VS       1  Device vendor specific log
0xb9       GPL     VS    3336  Device vendor specific log
0xb9       SL      VS       8  Device vendor specific log
0xba       GPL     VS    1280  Device vendor specific log
0xe0       GPL,SL  R/W      1  SCT Command/Status
0xe1       GPL,SL  R/W      8  SCT Data Transfer

SMART Extended Comprehensive Error Log Version: 1 (20 sectors)
Device Error Count: 93 (device log contains only the most recent 80 errors)
	CR     = Command Register
	FEATR  = Features Register
	COUNT  = Count (was: Sector Count) Register
	LBA_48 = Upper bytes of LBA High/Mid/Low Registers ]  ATA-8
	LH     = LBA High (was: Cylinder High) Register    ]   LBA
	LM     = LBA Mid (was: Cylinder Low) Register      ] Register
	LL     = LBA Low (was: Sector Number) Register     ]
	DV     = Device (was: Device/Head) Register
	DC     = Device Control Register
	ER     = Error register
	ST     = Status register
Powered_Up_Time is measured from power on, and printed as
DDd+hh:mm:SS.sss where DD=days, hh=hours, mm=minutes,
SS=sec, and sss=millisec. It "wraps" after 49.710 days.

Error 93 [12] occurred at disk power-on lifetime: 4868 hours (202 days + 20 hours)
  When the command that caused the error occurred, the device was active or idle.

  After command completion occurred, registers were:
  ER -- ST COUNT  LBA_48  LH LM LL DV DC
  -- -- -- == -- == == == -- -- -- -- --
  84 -- 41 00 00 00 00 37 c4 09 38 40 00  Error: ICRC, ABRT at LBA = 0x37c40938 = 935594296

  Commands leading to the command that caused the error were:
  CR FEATR COUNT  LBA_48  LH LM LL DV DC  Powered_Up_Time  Command/Feature_Name
  -- == -- == -- == == == -- -- -- -- --  ---------------  --------------------
  61 00 48 00 00 00 00 37 c4 09 38 40 00     01:08:06.325  WRITE FPDMA QUEUED
  b0 00 da 00 00 00 00 00 c2 4f 00 00 00     01:08:03.213  SMART RETURN STATUS
  2f 00 00 00 01 00 00 00 00 00 e0 40 00     01:08:03.213  READ LOG EXT
  61 00 08 00 00 00 00 37 c4 09 30 c0 00     01:08:00.858  WRITE FPDMA QUEUED
  ea 00 00 00 00 00 00 00 00 00 00 00 00     01:08:00.858  FLUSH CACHE EXT

Error 92 [11] occurred at disk power-on lifetime: 4868 hours (202 days + 20 hours)
  When the command that caused the error occurred, the device was active or idle.

  After command completion occurred, registers were:
  ER -- ST COUNT  LBA_48  LH LM LL DV DC
  -- -- -- == -- == == == -- -- -- -- --
  84 -- 41 00 00 00 00 37 c4 08 c0 40 00  Error: ICRC, ABRT at LBA = 0x37c408c0 = 935594176

  Commands leading to the command that caused the error were:
  CR FEATR COUNT  LBA_48  LH LM LL DV DC  Powered_Up_Time  Command/Feature_Name
  -- == -- == -- == == == -- -- -- -- --  ---------------  --------------------
  61 00 18 00 00 00 00 37 c4 08 c0 40 00     01:07:29.980  WRITE FPDMA QUEUED
  ec 00 00 00 00 00 00 00 00 00 00 00 00     01:07:29.980  IDENTIFY DEVICE
  ec 00 00 00 00 00 00 00 00 00 00 00 00     01:07:29.980  IDENTIFY DEVICE
  ec 00 00 00 00 00 00 00 00 00 00 00 00     01:07:29.980  IDENTIFY DEVICE
  ec 00 00 00 00 00 00 00 00 00 00 00 00     01:07:29.979  IDENTIFY DEVICE

Error 91 [10] occurred at disk power-on lifetime: 4868 hours (202 days + 20 hours)
  When the command that caused the error occurred, the device was active or idle.

  After command completion occurred, registers were:
  ER -- ST COUNT  LBA_48  LH LM LL DV DC
  -- -- -- == -- == == == -- -- -- -- --
  84 -- 41 00 00 00 00 37 c4 08 a0 40 00  Error: ICRC, ABRT at LBA = 0x37c408a0 = 935594144

  Commands leading to the command that caused the error were:
  CR FEATR COUNT  LBA_48  LH LM LL DV DC  Powered_Up_Time  Command/Feature_Name
  -- == -- == -- == == == -- -- -- -- --  ---------------  --------------------
  61 00 18 00 00 00 00 37 c4 08 a0 40 00     01:07:28.005  WRITE FPDMA QUEUED
  ef 00 aa 00 00 00 00 00 00 00 00 00 00     01:07:27.755  SET FEATURES [Enable read look-ahead]
  ef 00 03 00 46 00 00 00 00 00 00 00 00     01:07:27.755  SET FEATURES [Set transfer mode]
  ef 00 03 00 0c 00 00 00 00 00 00 00 00     01:07:27.755  SET FEATURES [Set transfer mode]
  e5 00 00 00 00 00 00 00 00 00 00 00 00     01:07:27.755  CHECK POWER MODE

Error 90 [9] occurred at disk power-on lifetime: 4868 hours (202 days + 20 hours)
  When the command that caused the error occurred, the device was active or idle.

  After command completion occurred, registers were:
  ER -- ST COUNT  LBA_48  LH LM LL DV DC
  -- -- -- == -- == == == -- -- -- -- --
  84 -- 41 00 00 00 00 37 c4 08 a0 40 00  Error: ICRC, ABRT at LBA = 0x37c408a0 = 935594144

  Commands leading to the command that caused the error were:
  CR FEATR COUNT  LBA_48  LH LM LL DV DC  Powered_Up_Time  Command/Feature_Name
  -- == -- == -- == == == -- -- -- -- --  ---------------  --------------------
  61 00 18 00 00 00 00 37 c4 08 a0 40 00     01:07:27.146  WRITE FPDMA QUEUED
  61 00 08 00 00 00 00 06 84 18 18 40 00     01:07:27.146  WRITE FPDMA QUEUED
  60 00 08 00 00 00 00 06 84 18 18 40 00     01:07:27.146  READ FPDMA QUEUED
  61 00 08 00 10 00 00 06 81 11 90 40 00     01:07:27.146  WRITE FPDMA QUEUED
  61 00 08 00 28 00 00 06 81 09 80 40 00     01:07:27.146  WRITE FPDMA QUEUED

Error 89 [8] occurred at disk power-on lifetime: 4868 hours (202 days + 20 hours)
  When the command that caused the error occurred, the device was active or idle.

  After command completion occurred, registers were:
  ER -- ST COUNT  LBA_48  LH LM LL DV DC
  -- -- -- == -- == == == -- -- -- -- --
  84 -- 41 00 08 00 00 06 81 11 90 40 00  Error: ICRC, ABRT at LBA = 0x06811190 = 109121936

  Commands leading to the command that caused the error were:
  CR FEATR COUNT  LBA_48  LH LM LL DV DC  Powered_Up_Time  Command/Feature_Name
  -- == -- == -- == == == -- -- -- -- --  ---------------  --------------------
  61 00 08 00 08 00 00 06 81 11 90 40 00     01:07:13.474  WRITE FPDMA QUEUED
  61 00 08 00 30 00 00 06 81 09 80 40 00     01:07:13.474  WRITE FPDMA QUEUED
  61 00 08 00 00 00 00 06 80 0f 30 40 00     01:07:13.474  WRITE FPDMA QUEUED
  61 00 10 00 28 00 00 06 80 09 80 40 00     01:07:13.474  WRITE FPDMA QUEUED
  61 00 08 00 20 00 00 06 80 09 00 40 00     01:07:13.474  WRITE FPDMA QUEUED

Error 88 [7] occurred at disk power-on lifetime: 4867 hours (202 days + 19 hours)
  When the command that caused the error occurred, the device was active or idle.

  After command completion occurred, registers were:
  ER -- ST COUNT  LBA_48  LH LM LL DV DC
  -- -- -- == -- == == == -- -- -- -- --
  84 -- 41 00 00 00 00 37 c4 09 50 40 00  Error: ICRC, ABRT at LBA = 0x37c40950 = 935594320

  Commands leading to the command that caused the error were:
  CR FEATR COUNT  LBA_48  LH LM LL DV DC  Powered_Up_Time  Command/Feature_Name
  -- == -- == -- == == == -- -- -- -- --  ---------------  --------------------
  61 02 00 00 00 00 00 37 c4 09 50 40 00     00:16:12.266  WRITE FPDMA QUEUED
  ef 00 aa 00 00 00 00 00 00 00 00 00 00     00:16:12.018  SET FEATURES [Enable read look-ahead]
  ef 00 03 00 46 00 00 00 00 00 00 00 00     00:16:12.018  SET FEATURES [Set transfer mode]
  ef 00 03 00 0c 00 00 00 00 00 00 00 00     00:16:12.018  SET FEATURES [Set transfer mode]
  e5 00 00 00 00 00 00 00 00 00 00 00 00     00:16:12.018  CHECK POWER MODE

Error 87 [6] occurred at disk power-on lifetime: 4867 hours (202 days + 19 hours)
  When the command that caused the error occurred, the device was active or idle.

  After command completion occurred, registers were:
  ER -- ST COUNT  LBA_48  LH LM LL DV DC
  -- -- -- == -- == == == -- -- -- -- --
  84 -- 41 00 00 00 00 37 c4 13 50 40 00  Error: ICRC, ABRT at LBA = 0x37c41350 = 935596880

  Commands leading to the command that caused the error were:
  CR FEATR COUNT  LBA_48  LH LM LL DV DC  Powered_Up_Time  Command/Feature_Name
  -- == -- == -- == == == -- -- -- -- --  ---------------  --------------------
  61 02 00 00 00 00 00 37 c4 13 50 40 00     00:16:11.279  WRITE FPDMA QUEUED
  60 00 08 00 00 00 00 06 81 0f 90 40 00     00:16:10.283  READ FPDMA QUEUED
  ef 00 aa 00 00 00 00 00 00 00 00 00 00     00:16:10.041  SET FEATURES [Enable read look-ahead]
  ef 00 03 00 46 00 00 00 00 00 00 00 00     00:16:10.041  SET FEATURES [Set transfer mode]
  ef 00 03 00 0c 00 00 00 00 00 00 00 00     00:16:10.041  SET FEATURES [Set transfer mode]

Error 86 [5] occurred at disk power-on lifetime: 4867 hours (202 days + 19 hours)
  When the command that caused the error occurred, the device was active or idle.

  After command completion occurred, registers were:
  ER -- ST COUNT  LBA_48  LH LM LL DV DC
  -- -- -- == -- == == == -- -- -- -- --
  84 -- 41 00 00 00 00 37 c4 09 50 40 00  Error: ICRC, ABRT at LBA = 0x37c40950 = 935594320

  Commands leading to the command that caused the error were:
  CR FEATR COUNT  LBA_48  LH LM LL DV DC  Powered_Up_Time  Command/Feature_Name
  -- == -- == -- == == == -- -- -- -- --  ---------------  --------------------
  61 02 00 00 00 00 00 37 c4 09 50 40 00     00:16:09.311  WRITE FPDMA QUEUED
  60 00 08 00 00 00 00 06 81 0f e8 40 00     00:16:09.310  READ FPDMA QUEUED
  b0 00 da 00 00 00 00 00 c2 4f 00 00 00     00:16:09.304  SMART RETURN STATUS
  2f 00 00 00 01 00 00 00 00 00 e0 40 00     00:16:09.300  READ LOG EXT
  60 00 08 00 00 00 00 06 81 0f e8 40 00     00:16:07.314  READ FPDMA QUEUED

SMART Extended Self-test Log Version: 1 (2 sectors)
No self-tests have been logged.  [To run self-tests, use: smartctl -t]

SMART Selective self-test log data structure revision number 1
 SPAN  MIN_LBA  MAX_LBA  CURRENT_TEST_STATUS
    1        0        0  Not_testing
    2        0        0  Not_testing
    3        0        0  Not_testing
    4        0        0  Not_testing
    5        0        0  Not_testing
Selective self-test flags (0x0):
  After scanning selected spans, do NOT read-scan remainder of disk.
If Selective self-test is pending on power-up, resume after 0 minute delay.

SCT Status Version:                  3
SCT Version (vendor specific):       1 (0x0001)
Device State:                        Active (0)
Current Temperature:                    37 Celsius
Power Cycle Min/Max Temperature:     22/43 Celsius
Lifetime    Min/Max Temperature:     13/43 Celsius
Specified Max Operating Temperature:    73 Celsius
Under/Over Temperature Limit Count:   0/0
Vendor specific:
00 00 2c 01 00 00 00 00 00 00 00 00 00 00 00 00
00 00 00 00 00 00 00 00 00 00 00 00 00 00 00 00

SCT Temperature History Version:     2
Temperature Sampling Period:         1 minute
Temperature Logging Interval:        1 minute
Min/Max recommended Temperature:      0/73 Celsius
Min/Max Temperature Limit:            0/73 Celsius
Temperature History Size (Index):    478 (146)

Device Statistics (GP Log 0x04)
Page  Offset Size        Value Flags Description
0x01  =====  =               =  ===  == General Statistics (rev 2) ==
0x01  0x008  4              17  ---  Lifetime Power-On Resets
0x01  0x018  6    455143935061  ---  Logical Sectors Written
0x01  0x020  6     10989714734  ---  Number of Write Commands
0x01  0x028  6    542375462410  ---  Logical Sectors Read
0x01  0x030  6      4201221303  ---  Number of Read Commands
0x01  0x038  6      2706413377  ---  Date and Time TimeStamp
0x04  =====  =               =  ===  == General Errors Statistics (rev 1) ==
0x04  0x008  4               0  ---  Number of Reported Uncorrectable Errors
0x04  0x010  4               0  ---  Resets Between Cmd Acceptance and Completion
0x05  =====  =               =  ===  == Temperature Statistics (rev 1) ==
0x05  0x008  1              37  ---  Current Temperature
0x05  0x010  1              37  ---  Average Short Term Temperature
0x05  0x018  1              37  ---  Average Long Term Temperature
0x05  0x020  1              42  ---  Highest Temperature
0x05  0x028  1              15  ---  Lowest Temperature
0x05  0x030  1              39  ---  Highest Average Short Term Temperature
0x05  0x038  1              18  ---  Lowest Average Short Term Temperature
0x05  0x040  1              37  ---  Highest Average Long Term Temperature
0x05  0x048  1              19  ---  Lowest Average Long Term Temperature
0x05  0x050  4               0  ---  Time in Over-Temperature
0x05  0x058  1              73  ---  Specified Maximum Operating Temperature
0x05  0x060  4               0  ---  Time in Under-Temperature
0x05  0x068  1               0  ---  Specified Minimum Operating Temperature
0x06  =====  =               =  ===  == Transport Statistics (rev 1) ==
0x06  0x008  4             277  ---  Number of Hardware Resets
0x06  0x010  4             232  ---  Number of ASR Events
0x06  0x018  4              93  ---  Number of Interface CRC Errors
0x07  =====  =               =  ===  == Solid State Device Statistics (rev 1) ==
0x07  0x008  1               3  ---  Percentage Used Endurance Indicator
                                |||_ C monitored condition met
                                ||__ D supports DSN
                                |___ N normalized value

SATA Phy Event Counters (GP Log 0x11)
ID      Size     Value  Description
0x0001  4            0  Command failed due to ICRC error
0x0002  4            0  R_ERR response for data FIS
0x0003  4            0  R_ERR response for device-to-host data FIS
0x0004  4            0  R_ERR response for host-to-device data FIS
0x0005  4            0  R_ERR response for non-data FIS
0x0006  4            0  R_ERR response for device-to-host non-data FIS
0x0007  4            0  R_ERR response for host-to-device non-data FIS
0x000a  4           22  Device-to-host register FISes sent due to a COMRESET
0x000b  4            0  CRC errors within host-to-device FIS
0x000d  4            0  Non-CRC errors within host-to-device FIS

