smartctl 7.1 2020-06-20 r5066 [x86_64-linux-3.10.0-1160...] (local build)
Copyright (C) 2002-19, Bruce Allen, Christian Franke, www.smartmontools.org

=== START OF INFORMATION SECTION ===
Model Family:     Intel 730 and DC S35x0/3610/3700 Series SSDs
Device Model:     INTEL SSDSC2BB240G7
Serial Number:    --
LU WWN Device Id: 5 5cd2e4 ...
Firmware Version: N2010112
User Capacity:    240,057,409,536 bytes [240 GB]
Sector Sizes:     512 bytes logical, 4096 bytes physical
Rotation Rate:    Solid State Device
Form Factor:      2.5 inches
Device is:        In smartctl database [for details use: -P show]
ATA Version is:   ACS-3 T13/2161-D revision 5
SATA Version is:  SATA 3.1, 6.0 Gb/s (current: 6.0 Gb/s)
Local Time is:    Thu May ... 2022 CEST
Rd look-ahead is: Enabled
Write cache is:   Enabled
ATA Security is:  Disabled, frozen [SEC2]

=== START OF READ SMART DATA SECTION ===
SMART overall-health self-assessment test result: PASSED

General SMART Values:
Offline data collection status:  (0x02)	Offline data collection activity
					was completed without error.

Self-test execution status:      (   0)	The previous self-test routine completed
					without error or no self-test has ever 
					been run.
Total time to complete Offline 
data collection: 		(    2) seconds.
Offline data collection
capabilities: 			 (0x79) SMART execute Offline immediate.

					Suspend Offline collection upon new
					command.
					Offline surface scan supported.
					Self-test supported.
					Conveyance Self-test supported.
					Selective Self-test supported.
SMART capabilities:            (0x0003)	Saves SMART data before entering
					power-saving mode.

Error logging capability:        (0x01)	Error logging supported.
					General Purpose Logging supported.
Short self-test routine 
recommended polling time: 	 (   1) minutes.
Extended self-test routine
recommended polling time: 	 (   2) minutes.
Conveyance self-test routine
recommended polling time: 	 (   2) minutes.
SCT capabilities: 	       (0x003d)	SCT Status supported.
					SCT Error Recovery Control supported.
					SCT Feature Control supported.
					SCT Data Table supported.

SMART Attributes Data Structure revision number: 1
Vendor Specific SMART Attributes with Thresholds:
ID# ATTRIBUTE_NAME          FLAGS    VALUE WORST THRESH FAIL RAW_VALUE
  5 Reallocated_Sector_Ct   -O--CK   100   100   000    -    0
  9 Power_On_Hours          -O--CK   100   100   000    -    31393
 12 Power_Cycle_Count       -O--CK   100   100   000    -    1123
170 Available_Reservd_Space PO--CK   100   100   010    -    0
171 Program_Fail_Count      -O--CK   100   100   000    -    0
172 Erase_Fail_Count        -O--CK   100   100   000    -    0
174 Unsafe_Shutdown_Count   -O--CK   100   100   000    -    312
175 Power_Loss_Cap_Test     PO--CK   100   100   010    -    16070 (1289 6744)
183 SATA_Downshift_Count    -O--CK   100   100   000    -    3
184 End-to-End_Error        PO--CK   100   100   090    -    0
187 Reported_Uncorrect      -O--CK   100   100   000    -    0
190 Temperature_Case        -O---K   072   071   000    -    28 (Min/Max 19/29)
192 Unsafe_Shutdown_Count   -O--CK   100   100   000    -    312
194 Temperature_Internal    -O---K   100   100   000    -    28
197 Current_Pending_Sector  -O--C-   100   100   000    -    0
199 CRC_Error_Count         -OSRCK   100   100   000    -    11521
225 Host_Writes_32MiB       -O--CK   100   100   000    -    251882
226 Workld_Media_Wear_Indic -O--CK   100   100   000    -    102400
227 Workld_Host_Reads_Perc  -O--CK   100   100   000    -    0
228 Workload_Minutes        -O--CK   100   100   000    -    719991937
232 Available_Reservd_Space PO--CK   100   100   010    -    0
233 Media_Wearout_Indicator -O--CK   099   099   000    -    0
234 Thermal_Throttle        -O--CK   100   100   000    -    0/0
241 Host_Writes_32MiB       -O--CK   100   100   000    -    251882
242 Host_Reads_32MiB        -O--CK   100   100   000    -    1241949
243 NAND_Writes_32MiB       -O--CK   100   100   000    -    964022
                            ||||||_ K auto-keep
                            |||||__ C event count
                            ||||___ R error rate
                            |||____ S speed/performance
                            ||_____ O updated online
                            |______ P prefailure warning

General Purpose Log Directory Version 1
SMART           Log Directory Version 1 [multi-sector log support]
Address    Access  R/W   Size  Description
0x00       GPL,SL  R/O      1  Log Directory
0x01           SL  R/O      1  Summary SMART error log
0x02           SL  R/O      8  Comprehensive SMART error log
0x03       GPL     R/O     20  Ext. Comprehensive SMART error log
0x04       GPL,SL  R/O      8  Device Statistics log
0x06           SL  R/O      1  SMART self-test log
0x07       GPL     R/O      2  Extended self-test log
0x08       GPL     R/O      2  Power Conditions log
0x09           SL  R/W      1  Selective self-test log
0x10       GPL     R/O      1  NCQ Command Error log
0x11       GPL     R/O      1  SATA Phy Event Counters log
0x30       GPL,SL  R/O      9  IDENTIFY DEVICE data log
0x80-0x98  GPL,SL  R/W     16  Host vendor specific log
0x9b-0x9f  GPL,SL  R/W     16  Host vendor specific log
0xb8       GPL,SL  VS       1  Device vendor specific log
0xb9       GPL     VS    1704  Device vendor specific log
0xb9       SL      VS     168  Device vendor specific log
0xba       GPL     VS    1280  Device vendor specific log
0xe0       GPL,SL  R/W      1  SCT Command/Status
0xe1       GPL,SL  R/W      8  SCT Data Transfer

SMART Extended Comprehensive Error Log Version: 1 (20 sectors)
Device Error Count: 1372 (device log contains only the most recent 80 errors)
	CR     = Command Register
	FEATR  = Features Register
	COUNT  = Count (was: Sector Count) Register
	LBA_48 = Upper bytes of LBA High/Mid/Low Registers ]  ATA-8
	LH     = LBA High (was: Cylinder High) Register    ]   LBA
	LM     = LBA Mid (was: Cylinder Low) Register      ] Register
	LL     = LBA Low (was: Sector Number) Register     ]
	DV     = Device (was: Device/Head) Register
	DC     = Device Control Register
	ER     = Error register
	ST     = Status register
Powered_Up_Time is measured from power on, and printed as
DDd+hh:mm:SS.sss where DD=days, hh=hours, mm=minutes,
SS=sec, and sss=millisec. It "wraps" after 49.710 days.

Error 1372 [11] occurred at disk power-on lifetime: 30196 hours (1258 days + 4 hours)
  When the command that caused the error occurred, the device was active or idle.

  After command completion occurred, registers were:
  ER -- ST COUNT  LBA_48  LH LM LL DV DC
  -- -- -- == -- == == == -- -- -- -- --
  84 -- 41 02 00 00 92 00 36 18 08 40 00  Error: ICRC, ABRT at LBA = 0x9200361808 = 627068770312

  Commands leading to the command that caused the error were:
  CR FEATR COUNT  LBA_48  LH LM LL DV DC  Powered_Up_Time  Command/Feature_Name
  -- == -- == -- == == == -- -- -- -- --  ---------------  --------------------
  60 00 00 02 00 00 92 00 36 18 08 40 00     00:39:44.125  READ FPDMA QUEUED
  60 00 00 02 00 00 92 00 34 18 08 40 00     00:39:44.124  READ FPDMA QUEUED
  60 00 00 02 00 00 92 00 32 18 08 40 00     00:39:44.122  READ FPDMA QUEUED
  60 00 00 02 00 00 92 00 30 18 08 40 00     00:39:44.120  READ FPDMA QUEUED
  60 00 00 02 00 00 92 00 2e 18 08 40 00     00:39:44.117  READ FPDMA QUEUED

Error 1371 [10] occurred at disk power-on lifetime: 30196 hours (1258 days + 4 hours)
  When the command that caused the error occurred, the device was active or idle.

  After command completion occurred, registers were:
  ER -- ST COUNT  LBA_48  LH LM LL DV DC
  -- -- -- == -- == == == -- -- -- -- --
  84 -- 41 02 00 00 15 00 f4 18 18 40 00  Error: ICRC, ABRT at LBA = 0x1500f41818 = 90210310168

  Commands leading to the command that caused the error were:
  CR FEATR COUNT  LBA_48  LH LM LL DV DC  Powered_Up_Time  Command/Feature_Name
  -- == -- == -- == == == -- -- -- -- --  ---------------  --------------------
  60 00 00 02 00 00 15 00 f4 18 18 40 00     00:39:40.032  READ FPDMA QUEUED
  60 00 00 02 00 00 15 00 f2 18 18 40 00     00:39:40.030  READ FPDMA QUEUED
  60 00 00 02 00 00 15 00 f0 18 18 40 00     00:39:40.027  READ FPDMA QUEUED
  60 00 00 02 00 00 15 00 ee 18 18 40 00     00:39:40.023  READ FPDMA QUEUED
  60 00 00 02 00 00 15 00 ec 18 18 40 00     00:39:40.019  READ FPDMA QUEUED

Error 1370 [9] occurred at disk power-on lifetime: 30196 hours (1258 days + 4 hours)
  When the command that caused the error occurred, the device was active or idle.

  After command completion occurred, registers were:
  ER -- ST COUNT  LBA_48  LH LM LL DV DC
  -- -- -- == -- == == == -- -- -- -- --
  84 -- 41 02 00 00 45 00 ae 14 78 40 00  Error: ICRC, ABRT at LBA = 0x4500ae1478 = 296364151928

  Commands leading to the command that caused the error were:
  CR FEATR COUNT  LBA_48  LH LM LL DV DC  Powered_Up_Time  Command/Feature_Name
  -- == -- == -- == == == -- -- -- -- --  ---------------  --------------------
  60 00 00 02 00 00 45 00 ae 14 78 40 00     00:39:05.729  READ FPDMA QUEUED
  60 00 00 02 00 00 45 00 ac 14 78 40 00     00:39:05.727  READ FPDMA QUEUED
  60 00 00 02 00 00 45 00 aa 14 78 40 00     00:39:05.723  READ FPDMA QUEUED
  60 00 00 02 00 00 45 00 a8 14 78 40 00     00:39:05.721  READ FPDMA QUEUED
  60 00 00 02 00 00 45 00 a6 14 78 40 00     00:39:05.719  READ FPDMA QUEUED

Error 1369 [8] occurred at disk power-on lifetime: 30196 hours (1258 days + 4 hours)
  When the command that caused the error occurred, the device was active or idle.

  After command completion occurred, registers were:
  ER -- ST COUNT  LBA_48  LH LM LL DV DC
  -- -- -- == -- == == == -- -- -- -- --
  84 -- 41 02 00 00 d6 00 9b 10 c8 40 00  Error: ICRC, ABRT at LBA = 0xd6009b10c8 = 919133163720

  Commands leading to the command that caused the error were:
  CR FEATR COUNT  LBA_48  LH LM LL DV DC  Powered_Up_Time  Command/Feature_Name
  -- == -- == -- == == == -- -- -- -- --  ---------------  --------------------
  60 00 00 02 00 00 d6 00 9b 10 c8 40 00     00:38:34.125  READ FPDMA QUEUED
  60 00 00 02 00 00 d6 00 99 10 c8 40 00     00:38:34.123  READ FPDMA QUEUED
  60 00 00 02 00 00 d6 00 97 10 c8 40 00     00:38:34.120  READ FPDMA QUEUED
  60 00 00 02 00 00 d6 00 95 10 c8 40 00     00:38:34.118  READ FPDMA QUEUED
  60 00 00 02 00 00 d6 00 93 10 c8 40 00     00:38:34.116  READ FPDMA QUEUED

Error 1368 [7] occurred at disk power-on lifetime: 30196 hours (1258 days + 4 hours)
  When the command that caused the error occurred, the device was active or idle.

  After command completion occurred, registers were:
  ER -- ST COUNT  LBA_48  LH LM LL DV DC
  -- -- -- == -- == == == -- -- -- -- --
  84 -- 41 02 00 00 81 00 20 10 08 40 00  Error: ICRC, ABRT at LBA = 0x8100201008 = 554052882440

  Commands leading to the command that caused the error were:
  CR FEATR COUNT  LBA_48  LH LM LL DV DC  Powered_Up_Time  Command/Feature_Name
  -- == -- == -- == == == -- -- -- -- --  ---------------  --------------------
  60 00 00 02 00 00 81 00 20 10 08 40 00     00:38:31.426  READ FPDMA QUEUED
  60 00 00 02 00 00 81 00 1e 10 08 40 00     00:38:31.424  READ FPDMA QUEUED
  60 00 00 02 00 00 81 00 1c 10 08 40 00     00:38:31.422  READ FPDMA QUEUED
  60 00 00 01 98 00 7e 00 4b 10 a0 40 00     00:38:31.419  READ FPDMA QUEUED
  60 00 00 02 00 00 7e 00 49 10 a0 40 00     00:38:31.417  READ FPDMA QUEUED

Error 1367 [6] occurred at disk power-on lifetime: 30196 hours (1258 days + 4 hours)
  When the command that caused the error occurred, the device was active or idle.

  After command completion occurred, registers were:
  ER -- ST COUNT  LBA_48  LH LM LL DV DC
  -- -- -- == -- == == == -- -- -- -- --
  84 -- 41 02 00 00 13 00 08 0f d0 40 00  Error: ICRC, ABRT at LBA = 0x1300080fd0 = 81604906960

  Commands leading to the command that caused the error were:
  CR FEATR COUNT  LBA_48  LH LM LL DV DC  Powered_Up_Time  Command/Feature_Name
  -- == -- == -- == == == -- -- -- -- --  ---------------  --------------------
  60 00 00 02 00 00 13 00 08 0f d0 40 00     00:37:46.376  READ FPDMA QUEUED
  60 00 00 02 00 00 13 00 06 0f d0 40 00     00:37:46.375  READ FPDMA QUEUED
  60 00 00 02 00 00 13 00 04 0f d0 40 00     00:37:46.373  READ FPDMA QUEUED
  60 00 00 02 00 00 13 00 02 0f d0 40 00     00:37:46.371  READ FPDMA QUEUED
  60 00 00 02 00 00 13 00 00 0f d0 40 00     00:37:46.369  READ FPDMA QUEUED

Error 1366 [5] occurred at disk power-on lifetime: 30196 hours (1258 days + 4 hours)
  When the command that caused the error occurred, the device was active or idle.

  After command completion occurred, registers were:
  ER -- ST COUNT  LBA_48  LH LM LL DV DC
  -- -- -- == -- == == == -- -- -- -- --
  84 -- 41 02 00 00 f2 00 b8 0e 48 40 00  Error: ICRC, ABRT at LBA = 0xf200b80e48 = 1039394147912

  Commands leading to the command that caused the error were:
  CR FEATR COUNT  LBA_48  LH LM LL DV DC  Powered_Up_Time  Command/Feature_Name
  -- == -- == -- == == == -- -- -- -- --  ---------------  --------------------
  60 00 00 02 00 00 f2 00 b8 0e 48 40 00     00:37:45.626  READ FPDMA QUEUED
  60 00 00 02 00 00 f2 00 b6 0e 48 40 00     00:37:45.624  READ FPDMA QUEUED
  60 00 00 02 00 00 f2 00 b4 0e 48 40 00     00:37:45.623  READ FPDMA QUEUED
  60 00 00 02 00 00 f2 00 b2 0e 48 40 00     00:37:45.622  READ FPDMA QUEUED
  60 00 00 02 00 00 f2 00 b0 0e 48 40 00     00:37:45.619  READ FPDMA QUEUED

Error 1365 [4] occurred at disk power-on lifetime: 30196 hours (1258 days + 4 hours)
  When the command that caused the error occurred, the device was active or idle.

  After command completion occurred, registers were:
  ER -- ST COUNT  LBA_48  LH LM LL DV DC
  -- -- -- == -- == == == -- -- -- -- --
  84 -- 41 02 00 00 b5 00 c1 0e 08 40 00  Error: ICRC, ABRT at LBA = 0xb500c10e08 = 777401732616

  Commands leading to the command that caused the error were:
  CR FEATR COUNT  LBA_48  LH LM LL DV DC  Powered_Up_Time  Command/Feature_Name
  -- == -- == -- == == == -- -- -- -- --  ---------------  --------------------
  60 00 00 02 00 00 b5 00 c1 0e 08 40 00     00:37:43.125  READ FPDMA QUEUED
  60 00 00 02 00 00 b5 00 bf 0e 08 40 00     00:37:43.124  READ FPDMA QUEUED
  60 00 00 02 00 00 b5 00 bd 0e 08 40 00     00:37:43.122  READ FPDMA QUEUED
  60 00 00 02 00 00 b5 00 bb 0e 08 40 00     00:37:43.121  READ FPDMA QUEUED
  60 00 00 02 00 00 b5 00 b9 0e 08 40 00     00:37:43.119  READ FPDMA QUEUED

SMART Extended Self-test Log Version: 1 (2 sectors)
Num  Test_Description    Status                  Remaining  LifeTime(hours)  LBA_of_first_error
# 1  Short offline       Completed without error       00%       158         -
# 2  Selective offline   Completed without error       00%       158         -

SMART Selective self-test log data structure revision number 1
 SPAN    MIN_LBA    MAX_LBA  CURRENT_TEST_STATUS
    1          0    2813101  Not_testing
    2  116512256  119325357  Not_testing
    3  233024512  235837613  Not_testing
    4  349536768  352349869  Not_testing
    5  466049026  468862127  Not_testing
Selective self-test flags (0x0):
  After scanning selected spans, do NOT read-scan remainder of disk.
If Selective self-test is pending on power-up, resume after 0 minute delay.

SCT Status Version:                  3
SCT Version (vendor specific):       1 (0x0001)
Device State:                        Active (0)
Current Temperature:                    28 Celsius
Power Cycle Min/Max Temperature:     19/29 Celsius
Lifetime    Min/Max Temperature:     14/44 Celsius
Specified Max Operating Temperature:    70 Celsius
Under/Over Temperature Limit Count:   0/0
Vendor specific:
00 00 2c 01 00 00 00 00 00 00 00 00 00 00 00 00
00 00 00 00 00 00 00 00 00 00 00 00 00 00 00 00

SCT Temperature History Version:     2
Temperature Sampling Period:         1 minute
Temperature Logging Interval:        1 minute
Min/Max recommended Temperature:      0/70 Celsius
Min/Max Temperature Limit:            0/70 Celsius
Temperature History Size (Index):    478 (209)

SCT Error Recovery Control:
           Read: Disabled
          Write: Disabled

Device Statistics (GP Log 0x04)
Page  Offset Size        Value Flags Description
0x01  =====  =               =  ===  == General Statistics (rev 2) ==
0x01  0x008  4            1123  ---  Lifetime Power-On Resets
0x01  0x018  6     16507387453  ---  Logical Sectors Written
0x01  0x020  6       226662796  ---  Number of Write Commands
0x01  0x028  6     81392401719  ---  Logical Sectors Read
0x01  0x030  6       550296104  ---  Number of Read Commands
0x04  =====  =               =  ===  == General Errors Statistics (rev 1) ==
0x04  0x008  4               0  ---  Number of Reported Uncorrectable Errors
0x04  0x010  4               0  ---  Resets Between Cmd Acceptance and Completion
0x05  =====  =               =  ===  == Temperature Statistics (rev 1) ==
0x05  0x008  1              28  ---  Current Temperature
0x05  0x010  1              26  ---  Average Short Term Temperature
0x05  0x018  1              25  ---  Average Long Term Temperature
0x05  0x020  1              44  ---  Highest Temperature
0x05  0x028  1              22  ---  Lowest Temperature
0x05  0x030  1              39  ---  Highest Average Short Term Temperature
0x05  0x038  1              23  ---  Lowest Average Short Term Temperature
0x05  0x040  1              34  ---  Highest Average Long Term Temperature
0x05  0x048  1              24  ---  Lowest Average Long Term Temperature
0x05  0x050  4               0  ---  Time in Over-Temperature
0x05  0x058  1              70  ---  Specified Maximum Operating Temperature
0x05  0x060  4               0  ---  Time in Under-Temperature
0x05  0x068  1               0  ---  Specified Minimum Operating Temperature
0x06  =====  =               =  ===  == Transport Statistics (rev 1) ==
0x06  0x008  4            7042  ---  Number of Hardware Resets
0x06  0x010  4            3451  ---  Number of ASR Events
0x06  0x018  4           11521  ---  Number of Interface CRC Errors
0x07  =====  =               =  ===  == Solid State Device Statistics (rev 1) ==
0x07  0x008  1               1  ---  Percentage Used Endurance Indicator
                                |||_ C monitored condition met
                                ||__ D supports DSN
                                |___ N normalized value

SATA Phy Event Counters (GP Log 0x11)
ID      Size     Value  Description
0x0001  4            0  Command failed due to ICRC error
0x0003  4            0  R_ERR response for device-to-host data FIS
0x0004  4            0  R_ERR response for host-to-device data FIS
0x0006  4            0  R_ERR response for device-to-host non-data FIS
0x000a  4           15  Device-to-host register FISes sent due to a COMRESET
0x000b  4            0  CRC errors within host-to-device FIS
0x000d  4            0  Non-CRC errors within host-to-device FIS

