smartctl 7.1 2020-06-20 r5066 [x86_64-linux-3.10.0-1127...] (local build)
Copyright (C) 2002-19, Bruce Allen, Christian Franke, www.smartmontools.org

=== START OF INFORMATION SECTION ===
Device Model:     SEAGATE ST31000340NS
Serial Number:    --
LU WWN Device Id: 5 000c50 ...
Firmware Version: NA01
User Capacity:    1,000,204,886,016 bytes [1.00 TB]
Sector Size:      512 bytes logical/physical
Rotation Rate:    7200 rpm
Device is:        Not in smartctl database [for details use: -P showall]
ATA Version is:   ATA8-ACS T13/1699-D revision 4
SATA Version is:  SATA 2.6, 1.5 Gb/s
Local Time is:    Sat Nov ... 2021 EST
Rd look-ahead is: Enabled
Write cache is:   Enabled
ATA Security is:  Disabled, frozen [SEC2]

=== START OF READ SMART DATA SECTION ===
SMART overall-health self-assessment test result: FAILED!
Drive failure expected in less than 24 hours. SAVE ALL DATA.

General SMART Values:
Offline data collection status:  (0x82)	Offline data collection activity
					was completed without error.

Self-test execution status:      (   0)	The previous self-test routine completed
					without error or no self-test has ever 
					been run.
Total time to complete Offline 
data collection: 		(  642) seconds.
Offline data collection
capabilities: 			 (0x7b) SMART execute Offline immediate.

					Suspend Offline collection upon new
					command.
					Offline surface scan supported.
					Self-test supported.
					Conveyance Self-test supported.
					Selective Self-test supported.
SMART capabilities:            (0x0003)	Saves SMART data before entering
					power-saving mode.

Error logging capability:        (0x01)	Error logging supported.
					General Purpose Logging supported.
Short self-test routine 
recommended polling time: 	 (   1) minutes.
Extended self-test routine
recommended polling time: 	 ( 237) minutes.
Conveyance self-test routine
recommended polling time: 	 (   2) minutes.
SCT capabilities: 	       (0x103f)	SCT Status supported.
					SCT Error Recovery Control supported.
					SCT Feature Control supported.
					SCT Data Table supported.

SMART Attributes Data Structure revision number: 10
Vendor Specific SMART Attributes with Thresholds:
ID# ATTRIBUTE_NAME          FLAGS    VALUE WORST THRESH FAIL RAW_VALUE
  1 Raw_Read_Error_Rate     POSR--   041   041   044    NOW  129804678
  3 Spin_Up_Time            PO----   099   091   000    -    0
  4 Start_Stop_Count        -O--CK   100   100   020    -    49
  5 Reallocated_Sector_Ct   PO--CK   001   001   036    NOW  2047
  7 Seek_Error_Rate         POSR--   076   060   030    -    47651743866
  9 Power_On_Hours          -O--CK   092   011   000    -    7043
 10 Spin_Retry_Count        PO--C-   100   100   097    -    0
 12 Power_Cycle_Count       -O--CK   100   037   020    -    31
184 End-to-End_Error        -O--CK   100   100   099    -    0
187 Reported_Uncorrect      -O--CK   001   001   000    -    12153
188 Command_Timeout         -O--CK   100   094   000    -    4295294999
189 High_Fly_Writes         -O-RCK   100   100   000    -    0
190 Airflow_Temperature_Cel -O---K   072   041   045    Past 28 (6 31 35 23 0)
194 Temperature_Celsius     -O---K   028   059   000    -    28 (0 17 0 0 0)
195 Hardware_ECC_Recovered  -O-RC-   044   038   000    -    129804678
197 Current_Pending_Sector  -O--C-   100   100   000    -    0
198 Offline_Uncorrectable   ----C-   100   100   000    -    0
199 UDMA_CRC_Error_Count    -OSRCK   200   200   000    -    0
                            ||||||_ K auto-keep
                            |||||__ C event count
                            ||||___ R error rate
                            |||____ S speed/performance
                            ||_____ O updated online
                            |______ P prefailure warning

General Purpose Log Directory Version 1
SMART           Log Directory Version 1 [multi-sector log support]
Address    Access  R/W   Size  Description
0x00       GPL,SL  R/O      1  Log Directory
0x01       GPL,SL  R/O      1  Summary SMART error log
0x02       GPL,SL  R/O      5  Comprehensive SMART error log
0x03       GPL,SL  R/O      5  Ext. Comprehensive SMART error log
0x06       GPL,SL  R/O      1  SMART self-test log
0x07       GPL,SL  R/O      1  Extended self-test log
0x09       GPL,SL  R/W      1  Selective self-test log
0x10       GPL,SL  R/O      1  NCQ Command Error log
0x11       GPL,SL  R/O      1  SATA Phy Event Counters log
0x21       GPL,SL  R/O      1  Write stream error log
0x22       GPL,SL  R/O      1  Read stream error log
0x80-0x9f  GPL,SL  R/W     16  Host vendor specific log
0xa1       GPL,SL  VS      20  Device vendor specific log
0xa2       GPL     VS    2248  Device vendor specific log
0xa8       GPL,SL  VS      65  Device vendor specific log
0xa9       GPL,SL  VS       1  Device vendor specific log
0xb0       GPL     VS    2864  Device vendor specific log
0xbe-0xbf  GPL     VS   65535  Device vendor specific log
0xe0       GPL,SL  R/W      1  SCT Command/Status
0xe1       GPL,SL  R/W      1  SCT Data Transfer

SMART Extended Comprehensive Error Log Version: 1 (5 sectors)
Device Error Count: 125 (device log contains only the most recent 20 errors)
	CR     = Command Register
	FEATR  = Features Register
	COUNT  = Count (was: Sector Count) Register
	LBA_48 = Upper bytes of LBA High/Mid/Low Registers ]  ATA-8
	LH     = LBA High (was: Cylinder High) Register    ]   LBA
	LM     = LBA Mid (was: Cylinder Low) Register      ] Register
	LL     = LBA Low (was: Sector Number) Register     ]
	DV     = Device (was: Device/Head) Register
	DC     = Device Control Register
	ER     = Error register
	ST     = Status register
Powered_Up_Time is measured from power on, and printed as
DDd+hh:mm:SS.sss where DD=days, hh=hours, mm=minutes,
SS=sec, and sss=millisec. It "wraps" after 49.710 days.

Error 125 [4] occurred at disk power-on lifetime: 6569 hours (273 days + 17 hours)
  When the command that caused the error occurred, the device was active or idle.

  After command completion occurred, registers were:
  ER -- ST COUNT  LBA_48  LH LM LL DV DC
  -- -- -- == -- == == == -- -- -- -- --
  40 -- 51 00 00 00 62 e9 00 8f fa 00 00  Error: UNC at LBA = 0x62e9008ffa = 424815923194

  Commands leading to the command that caused the error were:
  CR FEATR COUNT  LBA_48  LH LM LL DV DC  Powered_Up_Time  Command/Feature_Name
  -- == -- == -- == == == -- -- -- -- --  ---------------  --------------------
  60 00 00 01 00 00 62 e5 00 8f 00 40 00 36d+ ...          READ FPDMA QUEUED
  60 00 00 01 00 00 62 d9 00 8f 00 40 00 36d+ ...          READ FPDMA QUEUED
  60 00 00 01 00 00 62 d6 00 8f 00 40 00 36d+ ...          READ FPDMA QUEUED
  60 00 00 01 00 00 62 d5 00 8f 00 40 00 36d+ ...          READ FPDMA QUEUED
  60 00 00 01 00 00 62 d4 00 8f 00 40 00 36d+ ...          READ FPDMA QUEUED

Error 124 [3] occurred at disk power-on lifetime: 6569 hours (273 days + 17 hours)
  When the command that caused the error occurred, the device was active or idle.

  After command completion occurred, registers were:
  ER -- ST COUNT  LBA_48  LH LM LL DV DC
  -- -- -- == -- == == == -- -- -- -- --
  40 -- 51 00 00 00 62 b1 00 8f 2e 00 00  Error: UNC at LBA = 0x62b1008f2e = 423876398894

  Commands leading to the command that caused the error were:
  CR FEATR COUNT  LBA_48  LH LM LL DV DC  Powered_Up_Time  Command/Feature_Name
  -- == -- == -- == == == -- -- -- -- --  ---------------  --------------------
  60 00 00 01 00 00 62 b1 00 8f 00 40 00 36d+ ...          READ FPDMA QUEUED
  ea 00 00 00 00 00 00 00 00 00 00 a0 00 36d+ ...          FLUSH CACHE EXT
  61 00 00 00 01 00 00 10 00 19 08 40 00 36d+ ...          WRITE FPDMA QUEUED
  ea 00 00 00 00 00 00 00 00 00 00 a0 00 36d+ ...          FLUSH CACHE EXT
  ea 00 00 00 00 00 00 00 00 00 00 a0 00 36d+ ...          FLUSH CACHE EXT

Error 123 [2] occurred at disk power-on lifetime: 6569 hours (273 days + 17 hours)
  When the command that caused the error occurred, the device was active or idle.

  After command completion occurred, registers were:
  ER -- ST COUNT  LBA_48  LH LM LL DV DC
  -- -- -- == -- == == == -- -- -- -- --
  40 -- 51 00 00 00 62 ad 00 8f 4e 00 00  Error: UNC at LBA = 0x62ad008f4e = 423809290062

  Commands leading to the command that caused the error were:
  CR FEATR COUNT  LBA_48  LH LM LL DV DC  Powered_Up_Time  Command/Feature_Name
  -- == -- == -- == == == -- -- -- -- --  ---------------  --------------------
  60 00 00 01 00 00 62 ad 00 8f 00 40 00 36d+ ...          READ FPDMA QUEUED
  ea 00 00 00 00 00 00 00 00 00 00 a0 00 36d+ ...          FLUSH CACHE EXT
  61 00 00 00 01 00 00 10 00 19 08 40 00 36d+ ...          WRITE FPDMA QUEUED
  ea 00 00 00 00 00 00 00 00 00 00 a0 00 36d+ ...          FLUSH CACHE EXT
  ea 00 00 00 00 00 00 00 00 00 00 a0 00 36d+ ...          FLUSH CACHE EXT

Error 122 [1] occurred at disk power-on lifetime: 6569 hours (273 days + 17 hours)
  When the command that caused the error occurred, the device was active or idle.

  After command completion occurred, registers were:
  ER -- ST COUNT  LBA_48  LH LM LL DV DC
  -- -- -- == -- == == == -- -- -- -- --
  40 -- 51 00 00 00 62 5b 00 67 1f 00 00  Error: UNC at LBA = 0x625b00671f = 422433548063

  Commands leading to the command that caused the error were:
  CR FEATR COUNT  LBA_48  LH LM LL DV DC  Powered_Up_Time  Command/Feature_Name
  -- == -- == -- == == == -- -- -- -- --  ---------------  --------------------
  60 00 00 01 00 00 62 5b 00 67 00 40 00 36d+ ...          READ FPDMA QUEUED
  ea 00 00 00 00 00 00 00 00 00 00 a0 00 36d+ ...          FLUSH CACHE EXT
  60 00 00 01 00 00 62 5a 00 67 00 40 00 36d+ ...          READ FPDMA QUEUED
  61 00 00 00 05 00 00 10 00 19 10 40 00 36d+ ...          WRITE FPDMA QUEUED
  ea 00 00 00 00 00 00 00 00 00 00 a0 00 36d+ ...          FLUSH CACHE EXT

Error 121 [0] occurred at disk power-on lifetime: 6569 hours (273 days + 17 hours)
  When the command that caused the error occurred, the device was active or idle.

  After command completion occurred, registers were:
  ER -- ST COUNT  LBA_48  LH LM LL DV DC
  -- -- -- == -- == == == -- -- -- -- --
  40 -- 51 00 00 00 62 55 00 67 d7 00 00  Error: UNC at LBA = 0x62550067d7 = 422332884951

  Commands leading to the command that caused the error were:
  CR FEATR COUNT  LBA_48  LH LM LL DV DC  Powered_Up_Time  Command/Feature_Name
  -- == -- == -- == == == -- -- -- -- --  ---------------  --------------------
  60 00 00 01 00 00 62 55 00 67 00 40 00 36d+ ...          READ FPDMA QUEUED
  ea 00 00 00 00 00 00 00 00 00 00 a0 00 36d+ ...          FLUSH CACHE EXT
  61 00 00 00 01 00 00 10 00 19 08 40 00 36d+ ...          WRITE FPDMA QUEUED
  ea 00 00 00 00 00 00 00 00 00 00 a0 00 36d+ ...          FLUSH CACHE EXT
  ea 00 00 00 00 00 00 00 00 00 00 a0 00 36d+ ...          FLUSH CACHE EXT

Error 120 [19] occurred at disk power-on lifetime: 6569 hours (273 days + 17 hours)
  When the command that caused the error occurred, the device was active or idle.

  After command completion occurred, registers were:
  ER -- ST COUNT  LBA_48  LH LM LL DV DC
  -- -- -- == -- == == == -- -- -- -- --
  40 -- 51 00 00 00 5e f5 00 f7 2a 00 00  Error: WP at LBA = 0x5ef500f72a = 407837407018

  Commands leading to the command that caused the error were:
  CR FEATR COUNT  LBA_48  LH LM LL DV DC  Powered_Up_Time  Command/Feature_Name
  -- == -- == -- == == == -- -- -- -- --  ---------------  --------------------
  61 00 00 00 08 00 0c 05 00 49 80 40 00 36d+ ...          WRITE FPDMA QUEUED
  61 00 00 00 08 00 0c 04 00 49 f0 40 00 36d+ ...          WRITE FPDMA QUEUED
  61 00 00 00 08 00 0c 03 00 49 78 40 00 36d+ ...          WRITE FPDMA QUEUED
  61 00 00 00 10 00 0c 02 00 49 08 40 00 36d+ ...          WRITE FPDMA QUEUED
  61 00 00 00 08 00 0c 01 00 49 a0 40 00 36d+ ...          WRITE FPDMA QUEUED

Error 119 [18] occurred at disk power-on lifetime: 6569 hours (273 days + 17 hours)
  When the command that caused the error occurred, the device was active or idle.

  After command completion occurred, registers were:
  ER -- ST COUNT  LBA_48  LH LM LL DV DC
  -- -- -- == -- == == == -- -- -- -- --
  40 -- 51 00 00 00 5e f1 00 f7 1d 00 00  Error: UNC at LBA = 0x5ef100f71d = 407770298141

  Commands leading to the command that caused the error were:
  CR FEATR COUNT  LBA_48  LH LM LL DV DC  Powered_Up_Time  Command/Feature_Name
  -- == -- == -- == == == -- -- -- -- --  ---------------  --------------------
  60 00 00 01 00 00 5e df 00 f7 00 40 00 36d+ ...          READ FPDMA QUEUED
  60 00 00 01 00 00 5e de 00 f7 00 40 00 36d+ ...          READ FPDMA QUEUED
  60 00 00 01 00 00 5e dd 00 f7 00 40 00 36d+ ...          READ FPDMA QUEUED
  60 00 00 01 00 00 5e dc 00 f7 00 40 00 36d+ ...          READ FPDMA QUEUED
  60 00 00 01 00 00 5e db 00 f7 00 40 00 36d+ ...          READ FPDMA QUEUED

Error 118 [17] occurred at disk power-on lifetime: 6568 hours (273 days + 16 hours)
  When the command that caused the error occurred, the device was active or idle.

  After command completion occurred, registers were:
  ER -- ST COUNT  LBA_48  LH LM LL DV DC
  -- -- -- == -- == == == -- -- -- -- --
  40 -- 51 00 00 00 4c e1 00 cd 54 00 00  Error: UNC at LBA = 0x4ce100cd54 = 330192440660

  Commands leading to the command that caused the error were:
  CR FEATR COUNT  LBA_48  LH LM LL DV DC  Powered_Up_Time  Command/Feature_Name
  -- == -- == -- == == == -- -- -- -- --  ---------------  --------------------
  60 00 00 01 00 00 4c e1 00 cd 00 40 00 36d+ ...          READ FPDMA QUEUED
  60 00 00 01 00 00 4c e0 00 cd 00 40 00 36d+ ...          READ FPDMA QUEUED
  60 00 00 01 00 00 4c df 00 cd 00 40 00 36d+ ...          READ FPDMA QUEUED
  ea 00 00 00 00 00 00 00 00 00 00 a0 00 36d+ ...          FLUSH CACHE EXT
  61 00 00 00 01 00 00 10 00 19 08 40 00 36d+ ...          WRITE FPDMA QUEUED

SMART Extended Self-test Log Version: 1 (1 sectors)
No self-tests have been logged.  [To run self-tests, use: smartctl -t]

SMART Selective self-test log data structure revision number 1
 SPAN  MIN_LBA  MAX_LBA  CURRENT_TEST_STATUS
    1        0        0  Not_testing
    2        0        0  Not_testing
    3        0        0  Not_testing
    4        0        0  Not_testing
    5        0        0  Not_testing
Selective self-test flags (0x0):
  After scanning selected spans, do NOT read-scan remainder of disk.
If Selective self-test is pending on power-up, resume after 0 minute delay.

SCT Status Version:                  3
SCT Version (vendor specific):       522 (0x020a)
Device State:                        Active (0)
Current Temperature:                    28 Celsius
Power Cycle Min/Max Temperature:     23/35 Celsius
Lifetime    Min/Max Temperature:     17/59 Celsius
Under/Over Temperature Limit Count:   0/179861

SCT Temperature History Version:     2
Temperature Sampling Period:         10 minutes
Temperature Logging Interval:        10 minutes
Min/Max recommended Temperature:      0/ 0 Celsius
Min/Max Temperature Limit:            0/ 0 Celsius
Temperature History Size (Index):    128 (83)

SCT Error Recovery Control:
           Read:     70 (7.0 seconds)
          Write:     70 (7.0 seconds)

SATA Phy Event Counters (GP Log 0x11)
ID      Size     Value  Description
0x000a  2          142  Device-to-host register FISes sent due to a COMRESET
0x0001  2            0  Command failed due to ICRC error
0x0003  2            0  R_ERR response for device-to-host data FIS
0x0004  2            0  R_ERR response for host-to-device data FIS
0x0006  2            0  R_ERR response for device-to-host non-data FIS
0x0007  2            0  R_ERR response for host-to-device non-data FIS

