smartctl 7.1 2020-06-20 r5066 [x86_64-linux-3.10.0-1160...] (local build)
Copyright (C) 2002-19, Bruce Allen, Christian Franke, www.smartmontools.org

=== START OF INFORMATION SECTION ===
Model Number:                       INTEL SSDPEDME016T4S
Serial Number:                      --
Firmware Version:                   8DV1RA13
PCI Vendor ID:                      0x8086
PCI Vendor Subsystem ID:            0x108e
IEEE OUI Identifier:                0x5cd2e4
Controller ID:                      0
Number of Namespaces:               1
Namespace 1 Size/Capacity:          1,600,321,314,816 [1.60 TB]
Namespace 1 Formatted LBA Size:     512
Local Time is:                      Tue Apr ... 2022 CEST

=== START OF READ SMART DATA SECTION ===
SMART overall-health self-assessment test result: PASSED

SMART/Health Information (NVMe Log 0x02)
Critical Warning:                   0x00
Temperature:                        27 Celsius
Available Spare:                    100%
Available Spare Threshold:          10%
Percentage Used:                    1%
Data Units Read:                    1,704,435 [872 GB]
Data Units Written:                 476,151 [243 GB]
Host Read Commands:                 53,355,629,175
Host Write Commands:                11,618,728,252
Controller Busy Time:               3,910
Power Cycles:                       57
Power On Hours:                     47,752
Unsafe Shutdowns:                   43
Media and Data Integrity Errors:    0
Error Information Log Entries:      0

