smartctl 7.1 2020-06-20 r5066 [x86_64-linux-3.10.0-1160...] (local build)
Copyright (C) 2002-19, Bruce Allen, Christian Franke, www.smartmontools.org

=== START OF INFORMATION SECTION ===
Model Number:                       KINGSTON SEDC1000BM8240G
Serial Number:                      --
Firmware Version:                   ECEK22.3
PCI Vendor/Subsystem ID:            0x2646
IEEE OUI Identifier:                0x0026b7
Total NVM Capacity:                 240,057,409,536 [240 GB]
Unallocated NVM Capacity:           0
Controller ID:                      1
Number of Namespaces:               1
Namespace 1 Size/Capacity:          240,057,409,536 [240 GB]
Namespace 1 Formatted LBA Size:     512
Namespace 1 IEEE EUI-64:            0026b7 ...
Local Time is:                      Sun May ... 2022 CEST

=== START OF READ SMART DATA SECTION ===
SMART overall-health self-assessment test result: PASSED

SMART/Health Information (NVMe Log 0x02)
Critical Warning:                   0x00
Temperature:                        44 Celsius
Available Spare:                    100%
Available Spare Threshold:          10%
Percentage Used:                    1%
Data Units Read:                    2,059,580 [1.05 TB]
Data Units Written:                 20,165,922 [10.3 TB]
Host Read Commands:                 9,376,703
Host Write Commands:                719,433,505
Controller Busy Time:               272
Power Cycles:                       17
Power On Hours:                     8,122
Unsafe Shutdowns:                   7
Media and Data Integrity Errors:    0
Error Information Log Entries:      36
Warning  Comp. Temperature Time:    0
Critical Comp. Temperature Time:    0

