smartctl 7.1 2020-06-20 r5066 [x86_64-linux-3.10.0-1160...] (local build)
Copyright (C) 2002-19, Bruce Allen, Christian Franke, www.smartmontools.org

=== START OF INFORMATION SECTION ===
Model Number:                       KINGSTON SEDC1000BM8240G
Serial Number:                      --
Firmware Version:                   ECEK22.3
PCI Vendor/Subsystem ID:            0x2646
IEEE OUI Identifier:                0x0026b7
Total NVM Capacity:                 240,057,409,536 [240 GB]
Unallocated NVM Capacity:           0
Controller ID:                      1
Number of Namespaces:               1
Namespace 1 Size/Capacity:          240,057,409,536 [240 GB]
Namespace 1 Formatted LBA Size:     512
Namespace 1 IEEE EUI-64:            0026b7 ...
Local Time is:                      Sun Jun ... 2023 MSK

=== START OF READ SMART DATA SECTION ===
SMART overall-health self-assessment test result: PASSED

SMART/Health Information (NVMe Log 0x02)
Critical Warning:                   0x00
Temperature:                        27 Celsius
Available Spare:                    100%
Available Spare Threshold:          10%
Percentage Used:                    0%
Data Units Read:                    1,060,612 [543 GB]
Data Units Written:                 1,546,140 [791 GB]
Host Read Commands:                 2,926,488
Host Write Commands:                10,140,466
Controller Busy Time:               48
Power Cycles:                       11
Power On Hours:                     207
Unsafe Shutdowns:                   4
Media and Data Integrity Errors:    0
Error Information Log Entries:      22
Warning  Comp. Temperature Time:    0
Critical Comp. Temperature Time:    0

