smartctl 7.1 2020-06-20 r5066 [x86_64-linux-3.10.0-1160...] (local build)
Copyright (C) 2002-19, Bruce Allen, Christian Franke, www.smartmontools.org

=== START OF INFORMATION SECTION ===
Model Family:     Intel 730 and DC S35x0/3610/3700 Series SSDs
Device Model:     INTEL SSDSC2BB300G4T
Serial Number:    --
LU WWN Device Id: 5 5cd2e4 ...
Add. Product Id:  DELL(tm)
Firmware Version: D201DL12
User Capacity:    300,069,052,416 bytes [300 GB]
Sector Sizes:     512 bytes logical, 4096 bytes physical
Rotation Rate:    Solid State Device
Form Factor:      2.5 inches
Device is:        In smartctl database [for details use: -P show]
ATA Version is:   ACS-2 T13/2015-D revision 3
SATA Version is:  SATA 2.6, 6.0 Gb/s (current: 3.0 Gb/s)
Local Time is:    --
Rd look-ahead is: Enabled
Write cache is:   Enabled
ATA Security is:  Disabled, frozen [SEC2]

=== START OF READ SMART DATA SECTION ===
SMART overall-health self-assessment test result: PASSED

General SMART Values:
Offline data collection status:  (0x02)	Offline data collection activity
					was completed without error.

Self-test execution status:      (   0)	The previous self-test routine completed
					without error or no self-test has ever 
					been run.
Total time to complete Offline 
data collection: 		(    2) seconds.
Offline data collection
capabilities: 			 (0x79) SMART execute Offline immediate.

					Suspend Offline collection upon new
					command.
					Offline surface scan supported.
					Self-test supported.
					Conveyance Self-test supported.
					Selective Self-test supported.
SMART capabilities:            (0x0003)	Saves SMART data before entering
					power-saving mode.

Error logging capability:        (0x01)	Error logging supported.
					General Purpose Logging supported.
Short self-test routine 
recommended polling time: 	 (   1) minutes.
Extended self-test routine
recommended polling time: 	 (  60) minutes.
Conveyance self-test routine
recommended polling time: 	 (  60) minutes.
SCT capabilities: 	       (0x003d)	SCT Status supported.
					SCT Error Recovery Control supported.
					SCT Feature Control supported.
					SCT Data Table supported.

SMART Attributes Data Structure revision number: 1
Vendor Specific SMART Attributes with Thresholds:
ID# ATTRIBUTE_NAME          FLAGS    VALUE WORST THRESH FAIL RAW_VALUE
  1 Raw_Read_Error_Rate     POSR--   130   130   039    -    29578855
  5 Reallocated_Sector_Ct   PO--CK   100   100   001    -    0
  9 Power_On_Hours          -O--CK   100   100   000    -    35632
 12 Power_Cycle_Count       -O--CK   100   100   000    -    163
 13 Read_Soft_Error_Rate    -O--CK   070   070   000    -    281470711322215
179 Used_Rsvd_Blk_Cnt_Tot   PO--CK   100   100   010    -    0
180 Unused_Rsvd_Blk_Cnt_Tot -O--CK   100   100   000    -    3201
181 Program_Fail_Cnt_Total  -O-RCK   100   100   ---    -    0
182 Erase_Fail_Count_Total  -O-RCK   100   100   ---    -    0
184 End-to-End_Error        -O--CK   100   100   000    -    0
194 Temperature_Internal    -O---K   100   100   000    -    21
195 Hardware_ECC_Recovered  -O--CK   100   100   000    -    0
198 Offline_Uncorrectable   ----C-   100   100   000    -    0
199 CRC_Error_Count         -OSRCK   100   100   000    -    0
201 Unknown_SSD_Attribute   PO--CK   100   100   010    -    957958062700
226 Workld_Media_Wear_Indic -O--CK   100   100   000    -    1433
227 Workld_Host_Reads_Perc  -O--CK   100   100   000    -    44
228 Workload_Minutes        -O--CK   100   100   000    -    2136597
233 Media_Wearout_Indicator -O--CK   100   100   000    -    181991
245 Unknown_Attribute       -O--CK   099   099   000    -    0
                            ||||||_ K auto-keep
                            |||||__ C event count
                            ||||___ R error rate
                            |||____ S speed/performance
                            ||_____ O updated online
                            |______ P prefailure warning

General Purpose Log Directory Version 1
SMART           Log Directory Version 1 [multi-sector log support]
Address    Access  R/W   Size  Description
0x00       GPL,SL  R/O      1  Log Directory
0x01       GPL,SL  R/O      1  Summary SMART error log
0x02       GPL,SL  R/O      8  Comprehensive SMART error log
0x03       GPL,SL  R/O     20  Ext. Comprehensive SMART error log
0x04       GPL,SL  R/O      8  Device Statistics log
0x06       GPL,SL  R/O      1  SMART self-test log
0x07       GPL,SL  R/O      2  Extended self-test log
0x09       GPL,SL  R/W      1  Selective self-test log
0x10       GPL,SL  R/O      1  NCQ Command Error log
0x11       GPL,SL  R/O      1  SATA Phy Event Counters log
0x80-0x9f  GPL,SL  R/W     16  Host vendor specific log
0xb0       GPL,SL  VS       1  Device vendor specific log
0xb1       GPL,SL  VS      33  Device vendor specific log
0xdd       GPL,SL  VS       1  Device vendor specific log
0xde       GPL     VS     768  Device vendor specific log
0xdf       GPL     VS    1152  Device vendor specific log
0xdf       SL      VS     128  Device vendor specific log
0xe0       GPL,SL  R/W      1  SCT Command/Status
0xe1       GPL,SL  R/W      1  SCT Data Transfer

SMART Extended Comprehensive Error Log Version: 1 (20 sectors)
Device Error Count: 6
	CR     = Command Register
	FEATR  = Features Register
	COUNT  = Count (was: Sector Count) Register
	LBA_48 = Upper bytes of LBA High/Mid/Low Registers ]  ATA-8
	LH     = LBA High (was: Cylinder High) Register    ]   LBA
	LM     = LBA Mid (was: Cylinder Low) Register      ] Register
	LL     = LBA Low (was: Sector Number) Register     ]
	DV     = Device (was: Device/Head) Register
	DC     = Device Control Register
	ER     = Error register
	ST     = Status register
Powered_Up_Time is measured from power on, and printed as
DDd+hh:mm:SS.sss where DD=days, hh=hours, mm=minutes,
SS=sec, and sss=millisec. It "wraps" after 49.710 days.

Error 6 [5] occurred at disk power-on lifetime: 1577 hours (65 days + 17 hours)
  When the command that caused the error occurred, the device was active or idle.

  After command completion occurred, registers were:
  ER -- ST COUNT  LBA_48  LH LM LL DV DC
  -- -- -- == -- == == == -- -- -- -- --
  84 -- 41 00 80 00 00 01 49 1a 80 40 00  Error: ICRC, ABRT at LBA = 0x01491a80 = 21568128

  Commands leading to the command that caused the error were:
  CR FEATR COUNT  LBA_48  LH LM LL DV DC  Powered_Up_Time  Command/Feature_Name
  -- == -- == -- == == == -- -- -- -- --  ---------------  --------------------
  60 00 00 00 80 00 00 01 49 1a 80 40 00     00:19:10.909  READ FPDMA QUEUED
  60 00 00 00 80 00 00 01 49 1a 00 40 00     00:19:10.906  READ FPDMA QUEUED
  60 00 00 00 80 00 00 01 49 19 80 40 00     00:19:10.905  READ FPDMA QUEUED
  60 00 00 00 80 00 00 01 49 19 00 40 00     00:19:10.903  READ FPDMA QUEUED
  60 00 00 00 80 00 00 01 49 18 80 40 00     00:19:10.902  READ FPDMA QUEUED

Error 5 [4] occurred at disk power-on lifetime: 1555 hours (64 days + 19 hours)
  When the command that caused the error occurred, the device was active or idle.

  After command completion occurred, registers were:
  ER -- ST COUNT  LBA_48  LH LM LL DV DC
  -- -- -- == -- == == == -- -- -- -- --
  84 -- 41 00 80 00 00 00 58 5f 00 40 00  Error: ICRC, ABRT at LBA = 0x00585f00 = 5791488

  Commands leading to the command that caused the error were:
  CR FEATR COUNT  LBA_48  LH LM LL DV DC  Powered_Up_Time  Command/Feature_Name
  -- == -- == -- == == == -- -- -- -- --  ---------------  --------------------
  60 00 00 00 80 00 00 00 58 5f 00 40 00     00:11:18.783  READ FPDMA QUEUED
  60 00 00 00 80 00 00 00 58 5e 80 40 00     00:11:18.780  READ FPDMA QUEUED
  60 00 00 00 80 00 00 00 58 5e 00 40 00     00:11:18.779  READ FPDMA QUEUED
  60 00 00 00 80 00 00 00 58 5d 80 40 00     00:11:18.778  READ FPDMA QUEUED
  60 00 00 00 80 00 00 00 58 5d 00 40 00     00:11:18.776  READ FPDMA QUEUED

Error 4 [3] occurred at disk power-on lifetime: 1554 hours (64 days + 18 hours)
  When the command that caused the error occurred, the device was active or idle.

  After command completion occurred, registers were:
  ER -- ST COUNT  LBA_48  LH LM LL DV DC
  -- -- -- == -- == == == -- -- -- -- --
  84 -- 41 00 80 00 00 00 84 11 00 40 00  Error: ICRC, ABRT at LBA = 0x00841100 = 8655104

  Commands leading to the command that caused the error were:
  CR FEATR COUNT  LBA_48  LH LM LL DV DC  Powered_Up_Time  Command/Feature_Name
  -- == -- == -- == == == -- -- -- -- --  ---------------  --------------------
  60 00 00 00 80 00 00 00 84 11 00 40 00     00:11:52.365  READ FPDMA QUEUED
  60 00 00 00 80 00 00 00 84 10 80 40 00     00:11:52.362  READ FPDMA QUEUED
  60 00 00 00 80 00 00 00 84 10 00 40 00     00:11:52.360  READ FPDMA QUEUED
  60 00 00 00 80 00 00 00 84 0f 80 40 00     00:11:52.359  READ FPDMA QUEUED
  60 00 00 00 80 00 00 00 84 0f 00 40 00     00:11:52.358  READ FPDMA QUEUED

Error 3 [2] occurred at disk power-on lifetime: 1553 hours (64 days + 17 hours)
  When the command that caused the error occurred, the device was active or idle.

  After command completion occurred, registers were:
  ER -- ST COUNT  LBA_48  LH LM LL DV DC
  -- -- -- == -- == == == -- -- -- -- --
  84 -- 41 00 80 00 00 02 fa a4 80 40 00  Error: ICRC, ABRT at LBA = 0x02faa480 = 49980544

  Commands leading to the command that caused the error were:
  CR FEATR COUNT  LBA_48  LH LM LL DV DC  Powered_Up_Time  Command/Feature_Name
  -- == -- == -- == == == -- -- -- -- --  ---------------  --------------------
  60 00 00 00 80 00 00 02 fa a4 80 40 00     00:11:23.830  READ FPDMA QUEUED
  60 00 00 00 80 00 00 02 fa a4 00 40 00     00:11:23.827  READ FPDMA QUEUED
  60 00 00 00 80 00 00 02 fa a3 80 40 00     00:11:23.826  READ FPDMA QUEUED
  60 00 00 00 80 00 00 02 fa a3 00 40 00     00:11:23.824  READ FPDMA QUEUED
  60 00 00 00 80 00 00 02 fa a2 80 40 00     00:11:23.823  READ FPDMA QUEUED

Error 2 [1] occurred at disk power-on lifetime: 1553 hours (64 days + 17 hours)
  When the command that caused the error occurred, the device was active or idle.

  After command completion occurred, registers were:
  ER -- ST COUNT  LBA_48  LH LM LL DV DC
  -- -- -- == -- == == == -- -- -- -- --
  84 -- 41 00 80 00 00 00 64 44 80 40 00  Error: ICRC, ABRT at LBA = 0x00644480 = 6571136

  Commands leading to the command that caused the error were:
  CR FEATR COUNT  LBA_48  LH LM LL DV DC  Powered_Up_Time  Command/Feature_Name
  -- == -- == -- == == == -- -- -- -- --  ---------------  --------------------
  60 00 00 00 80 00 00 00 64 44 80 40 00     00:11:24.423  READ FPDMA QUEUED
  60 00 00 00 80 00 00 00 64 44 00 40 00     00:11:24.421  READ FPDMA QUEUED
  60 00 00 00 80 00 00 00 64 43 80 40 00     00:11:24.420  READ FPDMA QUEUED
  60 00 00 00 80 00 00 00 64 43 00 40 00     00:11:24.418  READ FPDMA QUEUED
  60 00 00 00 80 00 00 00 64 42 80 40 00     00:11:24.417  READ FPDMA QUEUED

Error 1 [0] occurred at disk power-on lifetime: 118 hours (4 days + 22 hours)
  When the command that caused the error occurred, the device was active or idle.

  After command completion occurred, registers were:
  ER -- ST COUNT  LBA_48  LH LM LL DV DC
  -- -- -- == -- == == == -- -- -- -- --
  84 -- 41 00 80 00 00 03 54 f4 00 40 00  Error: ICRC, ABRT at LBA = 0x0354f400 = 55899136

  Commands leading to the command that caused the error were:
  CR FEATR COUNT  LBA_48  LH LM LL DV DC  Powered_Up_Time  Command/Feature_Name
  -- == -- == -- == == == -- -- -- -- --  ---------------  --------------------
  60 00 00 00 80 00 00 03 54 f4 00 40 00     00:27:31.505  READ FPDMA QUEUED
  60 00 00 00 80 00 00 03 54 f3 80 40 00     00:27:31.502  READ FPDMA QUEUED
  60 00 00 00 80 00 00 03 54 f3 00 40 00     00:27:31.501  READ FPDMA QUEUED
  60 00 00 00 80 00 00 03 54 f2 80 40 00     00:27:31.499  READ FPDMA QUEUED
  60 00 00 00 80 00 00 03 54 f2 00 40 00     00:27:31.497  READ FPDMA QUEUED

SMART Extended Self-test Log Version: 1 (2 sectors)
Num  Test_Description    Status                  Remaining  LifeTime(hours)  LBA_of_first_error
# 1  Short offline       Completed without error       00%     35250         -
# 2  Short offline       Completed without error       00%     35250         -
# 3  Short offline       Completed without error       00%     34753         -
# 4  Short offline       Completed without error       00%     34752         -
# 5  Short offline       Completed without error       00%     34743         -
# 6  Short offline       Completed without error       00%     33290         -
# 7  Short offline       Completed without error       00%     28751         -
# 8  Short offline       Completed without error       00%      9509         -
# 9  Short offline       Completed without error       00%         2         -
#10  Extended offline    Completed without error       00%         1         -
#11  Short offline       Completed without error       00%         1         -

SMART Selective self-test log data structure revision number 1
 SPAN  MIN_LBA  MAX_LBA  CURRENT_TEST_STATUS
    1        0        0  Not_testing
    2        0        0  Not_testing
    3        0        0  Not_testing
    4        0        0  Not_testing
    5        0        0  Not_testing
Selective self-test flags (0x0):
  After scanning selected spans, do NOT read-scan remainder of disk.
If Selective self-test is pending on power-up, resume after 0 minute delay.

SCT Status Version:                  3
SCT Version (vendor specific):       1 (0x0001)
Device State:                        Active (0)
Current Temperature:                    12 Celsius
Power Cycle Min/Max Temperature:      7/19 Celsius
Lifetime    Min/Max Temperature:      7/39 Celsius
Specified Max Operating Temperature:    70 Celsius
Under/Over Temperature Limit Count:   0/0
Vendor specific:
00 00 63 00 00 00 00 00 00 00 00 00 00 00 00 00
00 00 00 00 00 00 00 00 00 00 00 00 00 00 00 00

SCT Temperature History Version:     2
Temperature Sampling Period:         1 minute
Temperature Logging Interval:        1 minute
Min/Max recommended Temperature:      0/70 Celsius
Min/Max Temperature Limit:            0/70 Celsius
Temperature History Size (Index):    478 (357)

SCT Error Recovery Control:
           Read:     80 (8.0 seconds)
          Write:     80 (8.0 seconds)

Device Statistics (GP Log 0x04)
Page  Offset Size        Value Flags Description
0x01  =====  =               =  ===  == General Statistics (rev 2) ==
0x01  0x008  4             163  ---  Lifetime Power-On Resets
0x01  0x018  6     11927008310  ---  Logical Sectors Written
0x01  0x020  6       250660966  ---  Number of Write Commands
0x01  0x028  6     11811342319  ---  Logical Sectors Read
0x01  0x030  6       120588536  ---  Number of Read Commands
0x04  =====  =               =  ===  == General Errors Statistics (rev 1) ==
0x04  0x008  4               0  ---  Number of Reported Uncorrectable Errors
0x04  0x010  4               1  ---  Resets Between Cmd Acceptance and Completion
0x05  =====  =               =  ===  == Temperature Statistics (rev 1) ==
0x05  0x008  1              12  ---  Current Temperature
0x05  0x010  1              11  ---  Average Short Term Temperature
0x05  0x018  1              15  ---  Average Long Term Temperature
0x05  0x020  1              38  ---  Highest Temperature
0x05  0x028  1               8  ---  Lowest Temperature
0x05  0x030  1              28  ---  Highest Average Short Term Temperature
0x05  0x038  1               9  ---  Lowest Average Short Term Temperature
0x05  0x040  1              19  ---  Highest Average Long Term Temperature
0x05  0x048  1              11  ---  Lowest Average Long Term Temperature
0x05  0x050  4               0  ---  Time in Over-Temperature
0x05  0x058  1              70  ---  Specified Maximum Operating Temperature
0x05  0x060  4               0  ---  Time in Under-Temperature
0x05  0x068  1               0  ---  Specified Minimum Operating Temperature
0x06  =====  =               =  ===  == Transport Statistics (rev 1) ==
0x06  0x008  4            3313  ---  Number of Hardware Resets
0x06  0x010  4            1897  ---  Number of ASR Events
0x06  0x018  4               0  ---  Number of Interface CRC Errors
0x07  =====  =               =  ===  == Solid State Device Statistics (rev 1) ==
0x07  0x008  1               1  ---  Percentage Used Endurance Indicator
                                |||_ C monitored condition met
                                ||__ D supports DSN
                                |___ N normalized value

SATA Phy Event Counters (GP Log 0x11)
ID      Size     Value  Description
0x0001  4            0  Command failed due to ICRC error
0x0003  4            0  R_ERR response for device-to-host data FIS
0x0004  4            0  R_ERR response for host-to-device data FIS
0x0006  4            0  R_ERR response for device-to-host non-data FIS
0x000a  4           24  Device-to-host register FISes sent due to a COMRESET
0x000b  4            0  CRC errors within host-to-device FIS
0x000d  4            0  Non-CRC errors within host-to-device FIS

