smartctl 6.6 2017-11-05 r4594 [x86_64-linux-3.10.0-862...] (local build)
Copyright (C) 2002-17, Bruce Allen, Christian Franke, www.smartmontools.org

=== START OF INFORMATION SECTION ===
Device Model:     MZ7LM1T9HMJP0D3
Serial Number:    --
LU WWN Device Id: 5 002538 ...
Add. Product Id:  DELL(tm)
Firmware Version: GC5B
User Capacity:    1,920,383,410,176 bytes [1.92 TB]
Sector Size:      512 bytes logical/physical
Rotation Rate:    Solid State Device
Form Factor:      2.5 inches
Device is:        Not in smartctl database [for details use: -P showall]
ATA Version is:   ACS-3 T13/2161-D revision 5
SATA Version is:  SATA 3.2, 6.0 Gb/s (current: 6.0 Gb/s)
Local Time is:    Sun Apr ... 2019 MST

=== START OF READ SMART DATA SECTION ===
SMART overall-health self-assessment test result: PASSED
Warning: This result is based on an Attribute check.

SMART Attributes Data Structure revision number: 1
Vendor Specific SMART Attributes with Thresholds:
ID# ATTRIBUTE_NAME          FLAGS    VALUE WORST THRESH FAIL RAW_VALUE
  1 Raw_Read_Error_Rate     -O-RC-   200   200   000    -    0
  5 Reallocated_Sector_Ct   PO--CK   100   100   010    -    0
  9 Power_On_Hours          -O--CK   099   099   000    -    625
 12 Power_Cycle_Count       -O--CK   099   099   000    -    25
 13 Read_Soft_Error_Rate    -O-RC-   200   200   000    -    0
177 Wear_Leveling_Count     PO--C-   100   099   005    -    0
179 Used_Rsvd_Blk_Cnt_Tot   PO--C-   100   100   010    -    0
180 Unused_Rsvd_Blk_Cnt_Tot -O--C-   100   100   000    -    6535
181 Program_Fail_Cnt_Total  -O--CK   100   100   000    -    0
182 Erase_Fail_Count_Total  -O--CK   100   100   000    -    0
184 End-to-End_Error        PO--CK   100   100   097    -    0
194 Temperature_Celsius     -O---K   063   060   000    -    37
195 Hardware_ECC_Recovered  -O-RC-   100   100   000    -    0
198 Offline_Uncorrectable   ----CK   100   100   000    -    0
199 UDMA_CRC_Error_Count    -OSRCK   100   100   000    -    0
201 Unknown_SSD_Attribute   PO--CK   100   100   001    -    0
202 Unknown_SSD_Attribute   PO--CK   100   100   010    -    0
233 Media_Wearout_Indicator -O--CK   099   099   000    -    2694264
235 Unknown_Attribute       -O--C-   099   099   000    -    14
242 Total_LBAs_Read         -O--CK   099   099   000    -    7194593
243 Unknown_Attribute       -O--CK   100   100   000    -    0
244 Unknown_Attribute       -O--CK   100   100   000    -    0
245 Unknown_Attribute       -O-RCK   100   100   000    -    100
246 Unknown_Attribute       -O--CK   100   100   000    -    65535
247 Unknown_Attribute       -O--CK   100   100   000    -    65535
248 Unknown_Attribute       -O--CK   100   100   000    -    65535
251 Unknown_Attribute       -O--CK   100   100   000    -    109821952
                            ||||||_ K auto-keep
                            |||||__ C event count
                            ||||___ R error rate
                            |||____ S speed/performance
                            ||_____ O updated online
                            |______ P prefailure warning

SMART Extended Comprehensive Error Log Version: 1 (1 sectors)
No Errors Logged

Current Temperature:                    37 Celsius

