smartctl 7.1 2020-06-20 r5066 [x86_64-linux-3.10.0-1127...] (local build)
Copyright (C) 2002-19, Bruce Allen, Christian Franke, www.smartmontools.org

=== START OF INFORMATION SECTION ===
Model Number:                       SAMSUNG MZ1LV480HCHP-00003
Serial Number:                      --
Firmware Version:                   BXV7301Q
PCI Vendor/Subsystem ID:            0x144d
IEEE OUI Identifier:                0x382500
Controller ID:                      1
Number of Namespaces:               1
Namespace 1 Size/Capacity:          480,103,981,056 [480 GB]
Namespace 1 Utilization:            469,568,294,912 [469 GB]
Namespace 1 Formatted LBA Size:     512
Namespace 1 IEEE EUI-64:            002538 ...
Local Time is:                      Sat Jan ... 2022 WIB

=== START OF READ SMART DATA SECTION ===
SMART overall-health self-assessment test result: PASSED

SMART/Health Information (NVMe Log 0x02)
Critical Warning:                   0x00
Temperature:                        41 Celsius
Available Spare:                    100%
Available Spare Threshold:          10%
Percentage Used:                    2%
Data Units Read:                    101,418,879 [51.9 TB]
Data Units Written:                 84,479,206 [43.2 TB]
Host Read Commands:                 798,380,098
Host Write Commands:                1,927,298,454
Controller Busy Time:               3,782
Power Cycles:                       60
Power On Hours:                     36,939
Unsafe Shutdowns:                   56
Media and Data Integrity Errors:    0
Error Information Log Entries:      4

