smartctl 7.1 2020-06-20 r5066 [x86_64-linux-3.10.0-1160...] (local build)
Copyright (C) 2002-19, Bruce Allen, Christian Franke, www.smartmontools.org

=== START OF INFORMATION SECTION ===
Model Family:     Intel 730 and DC S35x0/3610/3700 Series SSDs
Device Model:     INTEL SSDSC2BA200G4R
Serial Number:    --
LU WWN Device Id: 5 5cd2e4 ...
Add. Product Id:  DELL(tm)
Firmware Version: G201DL27
User Capacity:    200,049,647,616 bytes [200 GB]
Sector Sizes:     512 bytes logical, 4096 bytes physical
Rotation Rate:    Solid State Device
Form Factor:      2.5 inches
Device is:        In smartctl database [for details use: -P show]
ATA Version is:   ACS-3 T13/2161-D revision 5
SATA Version is:  SATA 3.1, 6.0 Gb/s (current: 3.0 Gb/s)
Local Time is:    --
Rd look-ahead is: Enabled
Write cache is:   Enabled
ATA Security is:  Disabled, frozen [SEC2]

=== START OF READ SMART DATA SECTION ===
SMART overall-health self-assessment test result: PASSED

General SMART Values:
Offline data collection status:  (0x00)	Offline data collection activity
					was never started.

Self-test execution status:      (   0)	The previous self-test routine completed
					without error or no self-test has ever 
					been run.
Total time to complete Offline 
data collection: 		(    0) seconds.
Offline data collection
capabilities: 			 (0x79) SMART execute Offline immediate.

					Suspend Offline collection upon new
					command.
					Offline surface scan supported.
					Self-test supported.
					Conveyance Self-test supported.
					Selective Self-test supported.
SMART capabilities:            (0x0003)	Saves SMART data before entering
					power-saving mode.

Error logging capability:        (0x01)	Error logging supported.
					General Purpose Logging supported.
Short self-test routine 
recommended polling time: 	 (   1) minutes.
Extended self-test routine
recommended polling time: 	 (  60) minutes.
Conveyance self-test routine
recommended polling time: 	 (  60) minutes.
SCT capabilities: 	       (0x003d)	SCT Status supported.
					SCT Error Recovery Control supported.
					SCT Feature Control supported.
					SCT Data Table supported.

SMART Attributes Data Structure revision number: 1
Vendor Specific SMART Attributes with Thresholds:
ID# ATTRIBUTE_NAME          FLAGS    VALUE WORST THRESH FAIL RAW_VALUE
  1 Raw_Read_Error_Rate     -OSR--   130   130   039    -    378004
  5 Reallocated_Sector_Ct   PO--CK   100   100   001    -    0
  9 Power_On_Hours          -O--CK   100   100   000    -    47709
 12 Power_Cycle_Count       -O--CK   100   100   000    -    8
 13 Read_Soft_Error_Rate    -OSRC-   130   100   000    -    4295345300
179 Used_Rsvd_Blk_Cnt_Tot   PO--CK   100   100   010    -    0
180 Unused_Rsvd_Blk_Cnt_Tot -O--CK   100   100   000    -    17170
181 Program_Fail_Cnt_Total  -O-RCK   100   100   000    -    0
182 Erase_Fail_Count_Total  -O-RCK   100   100   000    -    0
184 End-to-End_Error        -O--CK   100   100   000    -    0
194 Temperature_Internal    -O---K   100   100   000    -    26
195 Hardware_ECC_Recovered  -O--CK   100   100   000    -    0
198 Offline_Uncorrectable   ----C-   100   100   000    -    0
199 CRC_Error_Count         -OSRCK   100   100   000    -    196
201 Unknown_SSD_Attribute   PO--CK   100   100   010    -    1039618413318
202 Unknown_SSD_Attribute   POS--K   100   100   000    -    0
226 Workld_Media_Wear_Indic -O--CK   100   100   000    -    102400
227 Workld_Host_Reads_Perc  -O--CK   100   100   000    -    0
228 Workload_Minutes        -O--CK   100   100   000    -    3786128799
233 Media_Wearout_Indicator -O--CK   100   100   000    -    151949755
245 Unknown_Attribute       -O--CK   022   022   000    -    0
                            ||||||_ K auto-keep
                            |||||__ C event count
                            ||||___ R error rate
                            |||____ S speed/performance
                            ||_____ O updated online
                            |______ P prefailure warning

General Purpose Log Directory Version 1
SMART           Log Directory Version 1 [multi-sector log support]
Address    Access  R/W   Size  Description
0x00       GPL,SL  R/O      1  Log Directory
0x01       GPL,SL  R/O      1  Summary SMART error log
0x02       GPL,SL  R/O      8  Comprehensive SMART error log
0x03       GPL,SL  R/O     20  Ext. Comprehensive SMART error log
0x04       GPL,SL  R/O      8  Device Statistics log
0x06       GPL,SL  R/O      1  SMART self-test log
0x07       GPL,SL  R/O      2  Extended self-test log
0x08       GPL,SL  R/O      2  Power Conditions log
0x09       GPL,SL  R/W      1  Selective self-test log
0x10       GPL,SL  R/O      1  NCQ Command Error log
0x11       GPL,SL  R/O      1  SATA Phy Event Counters log
0x30       GPL,SL  R/O      9  IDENTIFY DEVICE data log
0x80-0x9f  GPL,SL  R/W     16  Host vendor specific log
0xb0       GPL,SL  VS       1  Device vendor specific log
0xb1       GPL,SL  VS      33  Device vendor specific log
0xb8       GPL,SL  VS       1  Device vendor specific log
0xb9       GPL     VS    1544  Device vendor specific log
0xb9       SL      VS       8  Device vendor specific log
0xba       GPL     VS    1280  Device vendor specific log
0xdf       GPL,SL  VS       1  Device vendor specific log
0xe0       GPL,SL  R/W      1  SCT Command/Status
0xe1       GPL,SL  R/W      1  SCT Data Transfer

SMART Extended Comprehensive Error Log Version: 1 (20 sectors)
Device Error Count: 124 (device log contains only the most recent 80 errors)
	CR     = Command Register
	FEATR  = Features Register
	COUNT  = Count (was: Sector Count) Register
	LBA_48 = Upper bytes of LBA High/Mid/Low Registers ]  ATA-8
	LH     = LBA High (was: Cylinder High) Register    ]   LBA
	LM     = LBA Mid (was: Cylinder Low) Register      ] Register
	LL     = LBA Low (was: Sector Number) Register     ]
	DV     = Device (was: Device/Head) Register
	DC     = Device Control Register
	ER     = Error register
	ST     = Status register
Powered_Up_Time is measured from power on, and printed as
DDd+hh:mm:SS.sss where DD=days, hh=hours, mm=minutes,
SS=sec, and sss=millisec. It "wraps" after 49.710 days.

Error 124 [43] occurred at disk power-on lifetime: 26961 hours (1123 days + 9 hours)
  When the command that caused the error occurred, the device was active or idle.

  After command completion occurred, registers were:
  ER -- ST COUNT  LBA_48  LH LM LL DV DC
  -- -- -- == -- == == == -- -- -- -- --
  84 -- 41 04 00 00 3a 00 9a 0d 38 40 00  Error: ICRC, ABRT at LBA = 0x3a009a0d38 = 249118199096

  Commands leading to the command that caused the error were:
  CR FEATR COUNT  LBA_48  LH LM LL DV DC  Powered_Up_Time  Command/Feature_Name
  -- == -- == -- == == == -- -- -- -- --  ---------------  --------------------
  61 00 00 04 00 00 3a 00 9a 0d 38 40 00  7d+ ...          WRITE FPDMA QUEUED
  61 00 00 03 40 00 3a 00 96 0d f8 40 00  7d+ ...          WRITE FPDMA QUEUED
  60 00 00 00 80 00 2a 00 c4 03 00 40 00  7d+ ...          READ FPDMA QUEUED
  61 00 00 02 d0 00 60 00 21 07 38 40 00  7d+ ...          WRITE FPDMA QUEUED
  61 00 00 03 10 00 3b 00 d3 01 58 40 00  7d+ ...          WRITE FPDMA QUEUED

Error 123 [42] occurred at disk power-on lifetime: 26049 hours (1085 days + 9 hours)
  When the command that caused the error occurred, the device was active or idle.

  After command completion occurred, registers were:
  ER -- ST COUNT  LBA_48  LH LM LL DV DC
  -- -- -- == -- == == == -- -- -- -- --
  84 -- 41 00 08 00 84 00 2b 07 40 40 00  Error: ICRC, ABRT at LBA = 0x84002b0740 = 566938502976

  Commands leading to the command that caused the error were:
  CR FEATR COUNT  LBA_48  LH LM LL DV DC  Powered_Up_Time  Command/Feature_Name
  -- == -- == -- == == == -- -- -- -- --  ---------------  --------------------
  61 00 00 00 08 00 84 00 2b 07 40 40 00 31d+ ...          WRITE FPDMA QUEUED
  61 00 00 04 00 00 a6 00 c0 06 08 40 00 31d+ ...          WRITE FPDMA QUEUED
  60 00 00 00 08 00 9f 00 43 06 e0 40 00 31d+ ...          READ FPDMA QUEUED
  61 00 00 00 80 00 a9 00 fb 0c c0 40 00 31d+ ...          WRITE FPDMA QUEUED
  61 00 00 00 40 00 41 00 63 08 a8 40 00 31d+ ...          WRITE FPDMA QUEUED

Error 122 [41] occurred at disk power-on lifetime: 26015 hours (1083 days + 23 hours)
  When the command that caused the error occurred, the device was active or idle.

  After command completion occurred, registers were:
  ER -- ST COUNT  LBA_48  LH LM LL DV DC
  -- -- -- == -- == == == -- -- -- -- --
  84 -- 41 00 08 00 00 00 22 0b 50 40 00  Error: ICRC, ABRT at LBA = 0x00220b50 = 2231120

  Commands leading to the command that caused the error were:
  CR FEATR COUNT  LBA_48  LH LM LL DV DC  Powered_Up_Time  Command/Feature_Name
  -- == -- == -- == == == -- -- -- -- --  ---------------  --------------------
  61 00 00 00 08 00 00 00 22 0b 50 40 00 30d+ ...          WRITE FPDMA QUEUED
  61 00 00 00 08 00 00 00 22 0b 40 40 00 30d+ ...          WRITE FPDMA QUEUED
  61 00 00 00 08 00 00 00 22 0b 20 40 00 30d+ ...          WRITE FPDMA QUEUED
  61 00 00 00 08 00 00 00 21 0b 70 40 00 30d+ ...          WRITE FPDMA QUEUED
  61 00 00 00 08 00 00 00 20 0b f8 40 00 30d+ ...          WRITE FPDMA QUEUED

Error 121 [40] occurred at disk power-on lifetime: 25444 hours (1060 days + 4 hours)
  When the command that caused the error occurred, the device was active or idle.

  After command completion occurred, registers were:
  ER -- ST COUNT  LBA_48  LH LM LL DV DC
  -- -- -- == -- == == == -- -- -- -- --
  84 -- 41 00 40 00 03 00 eb 0a 10 40 00  Error: ICRC, ABRT at LBA = 0x300eb0a10 = 12900305424

  Commands leading to the command that caused the error were:
  CR FEATR COUNT  LBA_48  LH LM LL DV DC  Powered_Up_Time  Command/Feature_Name
  -- == -- == -- == == == -- -- -- -- --  ---------------  --------------------
  61 00 00 00 40 00 03 00 eb 0a 10 40 00 13d+ ...          WRITE FPDMA QUEUED
  61 00 00 00 28 00 42 00 52 0a 60 40 00 13d+ ...          WRITE FPDMA QUEUED
  61 00 00 00 10 00 03 00 c7 0a 60 40 00 13d+ ...          WRITE FPDMA QUEUED
  61 00 00 00 10 00 03 00 9f 0a a8 40 00 13d+ ...          WRITE FPDMA QUEUED
  ea 00 00 00 00 00 00 00 00 00 00 a0 08 13d+ ...          FLUSH CACHE EXT

Error 120 [39] occurred at disk power-on lifetime: 25196 hours (1049 days + 20 hours)
  When the command that caused the error occurred, the device was active or idle.

  After command completion occurred, registers were:
  ER -- ST COUNT  LBA_48  LH LM LL DV DC
  -- -- -- == -- == == == -- -- -- -- --
  84 -- 41 00 08 00 80 00 31 0f 50 40 00  Error: ICRC, ABRT at LBA = 0x8000310f50 = 549759029072

  Commands leading to the command that caused the error were:
  CR FEATR COUNT  LBA_48  LH LM LL DV DC  Powered_Up_Time  Command/Feature_Name
  -- == -- == -- == == == -- -- -- -- --  ---------------  --------------------
  61 00 00 00 08 00 80 00 31 0f 50 40 00  6d+ ...          WRITE FPDMA QUEUED
  61 00 00 00 08 00 80 00 31 0f 40 40 00  6d+ ...          WRITE FPDMA QUEUED
  61 00 00 00 08 00 80 00 31 0f 08 40 00  6d+ ...          WRITE FPDMA QUEUED
  61 00 00 00 08 00 80 00 30 0f e8 40 00  6d+ ...          WRITE FPDMA QUEUED
  61 00 00 00 08 00 80 00 30 0f a0 40 00  6d+ ...          WRITE FPDMA QUEUED

Error 119 [38] occurred at disk power-on lifetime: 25023 hours (1042 days + 15 hours)
  When the command that caused the error occurred, the device was active or idle.

  After command completion occurred, registers were:
  ER -- ST COUNT  LBA_48  LH LM LL DV DC
  -- -- -- == -- == == == -- -- -- -- --
  84 -- 41 00 10 00 33 00 1f 0f 18 40 00  Error: ICRC, ABRT at LBA = 0x33001f0f18 = 219045367576

  Commands leading to the command that caused the error were:
  CR FEATR COUNT  LBA_48  LH LM LL DV DC  Powered_Up_Time  Command/Feature_Name
  -- == -- == -- == == == -- -- -- -- --  ---------------  --------------------
  60 00 00 00 10 00 33 00 1f 0f 18 40 00     16:27:11.271  READ FPDMA QUEUED
  60 00 00 00 30 00 32 00 eb 0f 80 40 00     16:27:11.271  READ FPDMA QUEUED
  60 00 00 00 10 00 33 00 1f 0f 00 40 00     16:27:11.271  READ FPDMA QUEUED
  60 00 00 00 20 00 31 00 3c 0f a0 40 00     16:27:11.271  READ FPDMA QUEUED
  61 00 00 00 08 00 b8 00 ce 0f 00 40 00     16:27:11.271  WRITE FPDMA QUEUED

Error 118 [37] occurred at disk power-on lifetime: 24449 hours (1018 days + 17 hours)
  When the command that caused the error occurred, the device was active or idle.

  After command completion occurred, registers were:
  ER -- ST COUNT  LBA_48  LH LM LL DV DC
  -- -- -- == -- == == == -- -- -- -- --
  84 -- 41 00 50 00 41 00 f7 09 d0 40 00  Error: ICRC, ABRT at LBA = 0x4100f709d0 = 279189064144

  Commands leading to the command that caused the error were:
  CR FEATR COUNT  LBA_48  LH LM LL DV DC  Powered_Up_Time  Command/Feature_Name
  -- == -- == -- == == == -- -- -- -- --  ---------------  --------------------
  61 00 00 00 50 00 41 00 f7 09 d0 40 00 32d+ ...          WRITE FPDMA QUEUED
  61 00 00 00 30 00 41 00 43 09 d0 40 00 32d+ ...          WRITE FPDMA QUEUED
  61 00 00 00 28 00 42 00 b1 08 80 40 00 32d+ ...          WRITE FPDMA QUEUED
  61 00 00 00 18 00 42 00 af 08 88 40 00 32d+ ...          WRITE FPDMA QUEUED
  61 00 00 00 20 00 42 00 af 08 20 40 00 32d+ ...          WRITE FPDMA QUEUED

Error 117 [36] occurred at disk power-on lifetime: 24278 hours (1011 days + 14 hours)
  When the command that caused the error occurred, the device was active or idle.

  After command completion occurred, registers were:
  ER -- ST COUNT  LBA_48  LH LM LL DV DC
  -- -- -- == -- == == == -- -- -- -- --
  84 -- 41 00 40 00 99 00 c4 00 78 40 00  Error: ICRC, ABRT at LBA = 0x9900c40078 = 657142841464

  Commands leading to the command that caused the error were:
  CR FEATR COUNT  LBA_48  LH LM LL DV DC  Powered_Up_Time  Command/Feature_Name
  -- == -- == -- == == == -- -- -- -- --  ---------------  --------------------
  61 00 00 00 40 00 99 00 c4 00 78 40 00 26d+ ...          WRITE FPDMA QUEUED
  61 00 00 00 40 00 99 00 c3 00 48 40 00 26d+ ...          WRITE FPDMA QUEUED
  61 00 00 00 80 00 18 00 3f 10 00 40 00 26d+ ...          WRITE FPDMA QUEUED
  61 00 00 00 28 00 99 00 9c 00 58 40 00 26d+ ...          WRITE FPDMA QUEUED
  61 00 00 00 28 00 98 00 20 00 18 40 00 26d+ ...          WRITE FPDMA QUEUED

SMART Extended Self-test Log Version: 1 (2 sectors)
No self-tests have been logged.  [To run self-tests, use: smartctl -t]

SMART Selective self-test log data structure revision number 1
 SPAN  MIN_LBA  MAX_LBA  CURRENT_TEST_STATUS
    1        0        0  Not_testing
    2        0        0  Not_testing
    3        0        0  Not_testing
    4        0        0  Not_testing
    5        0        0  Not_testing
Selective self-test flags (0x0):
  After scanning selected spans, do NOT read-scan remainder of disk.
If Selective self-test is pending on power-up, resume after 0 minute delay.

SCT Status Version:                  3
SCT Version (vendor specific):       1 (0x0001)
Device State:                        Active (0)
Current Temperature:                    26 Celsius
Power Cycle Min/Max Temperature:     25/33 Celsius
Lifetime    Min/Max Temperature:     16/46 Celsius
Specified Max Operating Temperature:    70 Celsius
Under/Over Temperature Limit Count:   0/0
Vendor specific:
00 00 64 00 00 00 00 00 00 00 00 00 00 00 00 00
00 00 00 00 00 00 00 00 00 00 00 00 00 00 00 00

SCT Temperature History Version:     2
Temperature Sampling Period:         1 minute
Temperature Logging Interval:        1 minute
Min/Max recommended Temperature:      0/70 Celsius
Min/Max Temperature Limit:            0/70 Celsius
Temperature History Size (Index):    478 (1)

SCT Error Recovery Control:
           Read:     70 (7.0 seconds)
          Write:     70 (7.0 seconds)

Device Statistics (GP Log 0x04)
Page  Offset Size        Value Flags Description
0x01  =====  =               =  ===  == General Statistics (rev 2) ==
0x01  0x008  4               8  ---  Lifetime Power-On Resets
0x01  0x018  6   9958179150472  ---  Logical Sectors Written
0x01  0x020  6    261811682084  ---  Number of Write Commands
0x01  0x028  6    151243762609  ---  Logical Sectors Read
0x01  0x030  6      3758007294  ---  Number of Read Commands
0x04  =====  =               =  ===  == General Errors Statistics (rev 1) ==
0x04  0x008  4               0  ---  Number of Reported Uncorrectable Errors
0x04  0x010  4               0  ---  Resets Between Cmd Acceptance and Completion
0x05  =====  =               =  ===  == Temperature Statistics (rev 1) ==
0x05  0x008  1              26  ---  Current Temperature
0x05  0x010  1              27  ---  Average Short Term Temperature
0x05  0x018  1              27  ---  Average Long Term Temperature
0x05  0x020  1              46  ---  Highest Temperature
0x05  0x028  1              26  ---  Lowest Temperature
0x05  0x030  1              41  ---  Highest Average Short Term Temperature
0x05  0x038  1              26  ---  Lowest Average Short Term Temperature
0x05  0x040  1              39  ---  Highest Average Long Term Temperature
0x05  0x048  1              27  ---  Lowest Average Long Term Temperature
0x05  0x050  4               0  ---  Time in Over-Temperature
0x05  0x058  1              70  ---  Specified Maximum Operating Temperature
0x05  0x060  4               0  ---  Time in Under-Temperature
0x05  0x068  1               0  ---  Specified Minimum Operating Temperature
0x06  =====  =               =  ===  == Transport Statistics (rev 1) ==
0x06  0x008  4             389  ---  Number of Hardware Resets
0x06  0x010  4             196  ---  Number of ASR Events
0x06  0x018  4             196  ---  Number of Interface CRC Errors
0x07  =====  =               =  ===  == Solid State Device Statistics (rev 1) ==
0x07  0x008  1              78  ---  Percentage Used Endurance Indicator
                                |||_ C monitored condition met
                                ||__ D supports DSN
                                |___ N normalized value

SATA Phy Event Counters (GP Log 0x11)
ID      Size     Value  Description
0x0001  4            0  Command failed due to ICRC error
0x0003  4            0  R_ERR response for device-to-host data FIS
0x0004  4            0  R_ERR response for host-to-device data FIS
0x0006  4            0  R_ERR response for device-to-host non-data FIS
0x000a  4           17  Device-to-host register FISes sent due to a COMRESET
0x000b  4            0  CRC errors within host-to-device FIS
0x000d  4            0  Non-CRC errors within host-to-device FIS

