smartctl 7.1 2020-06-20 r5066 [x86_64-linux-3.10.0-1160...] (local build)
Copyright (C) 2002-19, Bruce Allen, Christian Franke, www.smartmontools.org

=== START OF INFORMATION SECTION ===
Model Family:     SAMSUNG SpinPoint MP5
Device Model:     SAMSUNG HM640JJ
Serial Number:    --
LU WWN Device Id: 5 0024e9 ...
Firmware Version: 2AK10001
User Capacity:    640,135,028,736 bytes [640 GB]
Sector Size:      512 bytes logical/physical
Rotation Rate:    7200 rpm
Form Factor:      2.5 inches
Device is:        In smartctl database [for details use: -P show]
ATA Version is:   ATA8-ACS T13/1699-D revision 6
SATA Version is:  SATA 2.6, 3.0 Gb/s
Local Time is:    Tue Jan ... 2022 CET
AAM feature is:   Disabled
APM feature is:   Disabled
Rd look-ahead is: Enabled
Write cache is:   Enabled
ATA Security is:  Disabled, frozen [SEC2]

=== START OF READ SMART DATA SECTION ===
SMART overall-health self-assessment test result: FAILED!
Drive failure expected in less than 24 hours. SAVE ALL DATA.

General SMART Values:
Offline data collection status:  (0x00)	Offline data collection activity
					was never started.

Self-test execution status:      ( 137)	The previous self-test completed having
					a test element that failed and the
					device is suspected of having handling
					damage.
Total time to complete Offline 
data collection: 		( 7680) seconds.
Offline data collection
capabilities: 			 (0x5b) SMART execute Offline immediate.

					Suspend Offline collection upon new
					command.
					Offline surface scan supported.
					Self-test supported.
					No Conveyance Self-test supported.
					Selective Self-test supported.
SMART capabilities:            (0x0003)	Saves SMART data before entering
					power-saving mode.

Error logging capability:        (0x01)	Error logging supported.
					General Purpose Logging supported.
Short self-test routine 
recommended polling time: 	 (   2) minutes.
Extended self-test routine
recommended polling time: 	 ( 128) minutes.
SCT capabilities: 	       (0x003f)	SCT Status supported.
					SCT Error Recovery Control supported.
					SCT Feature Control supported.
					SCT Data Table supported.

SMART Attributes Data Structure revision number: 16
Vendor Specific SMART Attributes with Thresholds:
ID# ATTRIBUTE_NAME          FLAGS    VALUE WORST THRESH FAIL RAW_VALUE
  1 Raw_Read_Error_Rate     POSR-K   001   001   051    NOW  64896
  2 Throughput_Performance  -OS--K   252   252   000    -    0
  3 Spin_Up_Time            PO---K   090   086   025    -    3216
  4 Start_Stop_Count        -O--CK   099   099   000    -    1823
  5 Reallocated_Sector_Ct   PO--CK   252   252   010    -    0
  7 Seek_Error_Rate         -OSR-K   252   252   051    -    0
  8 Seek_Time_Performance   --S--K   252   252   015    -    0
  9 Power_On_Hours          -O--CK   100   100   000    -    8955
 10 Spin_Retry_Count        -O--CK   252   252   051    -    0
 11 Calibration_Retry_Count -O--CK   100   100   000    -    777
 12 Power_Cycle_Count       -O--CK   099   099   000    -    1608
 13 Read_Soft_Error_Rate    -O-RCK   100   100   000    -    0
191 G-Sense_Error_Rate      -O---K   100   100   000    -    2629
192 Power-Off_Retract_Count -O---K   252   252   000    -    0
193 Load_Cycle_Count        -O--CK   085   085   000    -    153466
194 Temperature_Celsius     -O----   064   041   000    -    27 (Min/Max 5/60)
195 Hardware_ECC_Recovered  -O-RCK   100   100   000    -    0
196 Reallocated_Event_Count -O--CK   252   252   000    -    0
197 Current_Pending_Sector  -O--CK   252   100   000    -    0
198 Offline_Uncorrectable   ----CK   252   252   000    -    0
199 UDMA_CRC_Error_Count    -OS-CK   200   200   000    -    0
200 Multi_Zone_Error_Rate   -O-R-K   100   100   000    -    4433
240 Head_Flying_Hours       -O--CK   100   100   000    -    6812
241 Total_LBAs_Written      -O--CK   097   088   000    -    4174084
242 Total_LBAs_Read         -O--CK   095   087   000    -    8062001
254 Free_Fall_Sensor        -O--CK   100   100   000    -    1
                            ||||||_ K auto-keep
                            |||||__ C event count
                            ||||___ R error rate
                            |||____ S speed/performance
                            ||_____ O updated online
                            |______ P prefailure warning

General Purpose Log Directory Version 1
SMART           Log Directory Version 1 [multi-sector log support]
Address    Access  R/W   Size  Description
0x00       GPL,SL  R/O      1  Log Directory
0x01           SL  R/O      1  Summary SMART error log
0x02           SL  R/O      2  Comprehensive SMART error log
0x03       GPL     R/O      2  Ext. Comprehensive SMART error log
0x06           SL  R/O      1  SMART self-test log
0x07       GPL     R/O      2  Extended self-test log
0x08       GPL     R/O      2  Power Conditions log
0x09           SL  R/W      1  Selective self-test log
0x10       GPL     R/O      1  NCQ Command Error log
0x11       GPL     R/O      1  SATA Phy Event Counters log
0x80-0x9f  GPL,SL  R/W     16  Host vendor specific log
0xe0       GPL,SL  R/W      1  SCT Command/Status
0xe1       GPL,SL  R/W      1  SCT Data Transfer

SMART Extended Comprehensive Error Log Version: 1 (2 sectors)
Device Error Count: 62653 (device log contains only the most recent 8 errors)
	CR     = Command Register
	FEATR  = Features Register
	COUNT  = Count (was: Sector Count) Register
	LBA_48 = Upper bytes of LBA High/Mid/Low Registers ]  ATA-8
	LH     = LBA High (was: Cylinder High) Register    ]   LBA
	LM     = LBA Mid (was: Cylinder Low) Register      ] Register
	LL     = LBA Low (was: Sector Number) Register     ]
	DV     = Device (was: Device/Head) Register
	DC     = Device Control Register
	ER     = Error register
	ST     = Status register
Powered_Up_Time is measured from power on, and printed as
DDd+hh:mm:SS.sss where DD=days, hh=hours, mm=minutes,
SS=sec, and sss=millisec. It "wraps" after 49.710 days.

Error 62653 [4] occurred at disk power-on lifetime: 6974 hours (290 days + 14 hours)
  When the command that caused the error occurred, the device was active or idle.

  After command completion occurred, registers were:
  ER -- ST COUNT  LBA_48  LH LM LL DV DC
  -- -- -- == -- == == == -- -- -- -- --
  40 -- 51 00 08 00 00 0b 64 10 00 40 00  Error: UNC at LBA = 0x0b641000 = 191107072

  Commands leading to the command that caused the error were:
  CR FEATR COUNT  LBA_48  LH LM LL DV DC  Powered_Up_Time  Command/Feature_Name
  -- == -- == -- == == == -- -- -- -- --  ---------------  --------------------
  60 00 00 00 08 00 00 0b 64 10 00 40 08     00:00:02.963  READ FPDMA QUEUED
  60 00 00 00 08 00 00 0b 64 10 00 40 08     00:00:02.965  READ FPDMA QUEUED
  60 00 00 00 08 00 00 09 c4 10 00 40 08     00:00:02.965  READ FPDMA QUEUED
  60 00 00 00 08 00 00 05 5c 10 00 40 08     00:00:02.965  READ FPDMA QUEUED
  60 00 00 00 08 00 00 03 cc 10 00 40 08     00:00:02.964  READ FPDMA QUEUED

Error 62652 [3] occurred at disk power-on lifetime: 6974 hours (290 days + 14 hours)
  When the command that caused the error occurred, the device was active or idle.

  After command completion occurred, registers were:
  ER -- ST COUNT  LBA_48  LH LM LL DV DC
  -- -- -- == -- == == == -- -- -- -- --
  40 -- 51 00 08 00 00 0b 64 10 00 40 00  Error: UNC at LBA = 0x0b641000 = 191107072

  Commands leading to the command that caused the error were:
  CR FEATR COUNT  LBA_48  LH LM LL DV DC  Powered_Up_Time  Command/Feature_Name
  -- == -- == -- == == == -- -- -- -- --  ---------------  --------------------
  60 00 00 00 08 00 00 0b 64 10 00 40 08     00:00:02.768  READ FPDMA QUEUED
  60 00 00 00 08 00 00 0b 64 10 00 40 08     00:00:02.773  READ FPDMA QUEUED
  60 00 00 00 08 00 00 09 c4 10 00 40 08     00:00:02.773  READ FPDMA QUEUED
  60 00 00 00 08 00 00 05 5c 10 00 40 08     00:00:02.773  READ FPDMA QUEUED
  60 00 00 00 08 00 00 03 cc 10 00 40 08     00:00:02.773  READ FPDMA QUEUED

Error 62651 [2] occurred at disk power-on lifetime: 6974 hours (290 days + 14 hours)
  When the command that caused the error occurred, the device was active or idle.

  After command completion occurred, registers were:
  ER -- ST COUNT  LBA_48  LH LM LL DV DC
  -- -- -- == -- == == == -- -- -- -- --
  40 -- 51 00 08 00 00 0b 64 10 00 40 00  Error: UNC at LBA = 0x0b641000 = 191107072

  Commands leading to the command that caused the error were:
  CR FEATR COUNT  LBA_48  LH LM LL DV DC  Powered_Up_Time  Command/Feature_Name
  -- == -- == -- == == == -- -- -- -- --  ---------------  --------------------
  60 00 00 00 08 00 00 0b 64 10 00 40 08     00:00:02.656  READ FPDMA QUEUED
  60 00 00 00 08 00 00 0b 64 10 00 40 08     00:00:02.660  READ FPDMA QUEUED
  60 00 00 00 08 00 00 09 c4 10 00 40 08     00:00:02.660  READ FPDMA QUEUED
  60 00 00 00 08 00 00 05 5c 10 00 40 08     00:00:02.660  READ FPDMA QUEUED
  60 00 00 00 08 00 00 03 cc 10 00 40 08     00:00:02.660  READ FPDMA QUEUED

Error 62650 [1] occurred at disk power-on lifetime: 6974 hours (290 days + 14 hours)
  When the command that caused the error occurred, the device was active or idle.

  After command completion occurred, registers were:
  ER -- ST COUNT  LBA_48  LH LM LL DV DC
  -- -- -- == -- == == == -- -- -- -- --
  40 -- 51 00 30 00 00 32 04 40 b8 40 00  Error: UNC at LBA = 0x320440b8 = 839139512

  Commands leading to the command that caused the error were:
  CR FEATR COUNT  LBA_48  LH LM LL DV DC  Powered_Up_Time  Command/Feature_Name
  -- == -- == -- == == == -- -- -- -- --  ---------------  --------------------
  60 00 10 01 00 00 00 32 04 3f e8 40 08     00:00:00.189  READ FPDMA QUEUED
  60 00 10 01 00 00 00 32 04 3f e8 40 08     00:00:00.198  READ FPDMA QUEUED
  60 00 10 00 80 00 00 32 04 3f 68 40 08     00:00:00.198  READ FPDMA QUEUED
  60 00 10 00 40 00 00 32 04 3f 28 40 08     00:00:00.198  READ FPDMA QUEUED
  60 00 10 00 20 00 00 32 04 3f 08 40 08     00:00:00.198  READ FPDMA QUEUED

Error 62649 [0] occurred at disk power-on lifetime: 6974 hours (290 days + 14 hours)
  When the command that caused the error occurred, the device was active or idle.

  After command completion occurred, registers were:
  ER -- ST COUNT  LBA_48  LH LM LL DV DC
  -- -- -- == -- == == == -- -- -- -- --
  40 -- 51 00 70 00 00 32 04 1e e8 40 00  Error: UNC at LBA = 0x32041ee8 = 839130856

  Commands leading to the command that caused the error were:
  CR FEATR COUNT  LBA_48  LH LM LL DV DC  Powered_Up_Time  Command/Feature_Name
  -- == -- == -- == == == -- -- -- -- --  ---------------  --------------------
  60 00 00 00 80 00 00 32 04 1e d8 40 08     00:00:00.186  READ FPDMA QUEUED
  60 00 00 00 80 00 00 32 04 1e d8 40 08     00:00:00.190  READ FPDMA QUEUED
  60 00 10 00 40 00 00 32 04 1e 98 40 08     00:00:00.190  READ FPDMA QUEUED
  60 00 10 00 20 00 00 32 04 1e 78 40 08     00:00:00.190  READ FPDMA QUEUED
  60 00 10 00 08 00 00 32 04 1e 70 40 08     00:00:00.190  READ FPDMA QUEUED

Error 62648 [7] occurred at disk power-on lifetime: 6974 hours (290 days + 14 hours)
  When the command that caused the error occurred, the device was active or idle.

  After command completion occurred, registers were:
  ER -- ST COUNT  LBA_48  LH LM LL DV DC
  -- -- -- == -- == == == -- -- -- -- --
  40 -- 51 01 90 00 00 32 04 16 50 40 00  Error: UNC at LBA = 0x32041650 = 839128656

  Commands leading to the command that caused the error were:
  CR FEATR COUNT  LBA_48  LH LM LL DV DC  Powered_Up_Time  Command/Feature_Name
  -- == -- == -- == == == -- -- -- -- --  ---------------  --------------------
  60 00 00 02 00 00 00 32 04 15 e0 40 08     00:00:00.055  READ FPDMA QUEUED
  60 00 00 02 00 00 00 32 04 15 e0 40 08     00:00:00.187  READ FPDMA QUEUED
  60 00 00 01 00 00 00 32 04 14 e0 40 08     00:00:00.187  READ FPDMA QUEUED
  60 00 00 00 80 00 00 32 04 14 60 40 08     00:00:00.187  READ FPDMA QUEUED
  60 00 00 00 40 00 00 32 04 14 20 40 08     00:00:00.187  READ FPDMA QUEUED

Error 62647 [6] occurred at disk power-on lifetime: 6973 hours (290 days + 13 hours)
  When the command that caused the error occurred, the device was active or idle.

  After command completion occurred, registers were:
  ER -- ST COUNT  LBA_48  LH LM LL DV DC
  -- -- -- == -- == == == -- -- -- -- --
  40 -- 51 00 07 00 00 32 40 10 01 40 00  Error: UNC at LBA = 0x32401001 = 843059201

  Commands leading to the command that caused the error were:
  CR FEATR COUNT  LBA_48  LH LM LL DV DC  Powered_Up_Time  Command/Feature_Name
  -- == -- == -- == == == -- -- -- -- --  ---------------  --------------------
  60 00 10 00 08 00 00 32 40 10 00 40 08     00:00:00.049  READ FPDMA QUEUED
  60 00 10 00 08 00 00 32 40 10 00 40 08     00:00:00.053  READ FPDMA QUEUED
  ef 00 10 00 02 00 00 00 00 00 00 a0 08     00:00:00.053  SET FEATURES [Enable SATA feature]
  27 00 00 00 00 00 00 00 00 00 00 e0 08     00:00:00.053  READ NATIVE MAX ADDRESS EXT [OBS-ACS-3]
  ec 00 00 00 00 00 00 00 00 00 00 a0 08     00:00:00.053  IDENTIFY DEVICE

Error 62646 [5] occurred at disk power-on lifetime: 6973 hours (290 days + 13 hours)
  When the command that caused the error occurred, the device was active or idle.

  After command completion occurred, registers were:
  ER -- ST COUNT  LBA_48  LH LM LL DV DC
  -- -- -- == -- == == == -- -- -- -- --
  40 -- 51 00 07 00 00 32 40 10 01 40 00  Error: UNC at LBA = 0x32401001 = 843059201

  Commands leading to the command that caused the error were:
  CR FEATR COUNT  LBA_48  LH LM LL DV DC  Powered_Up_Time  Command/Feature_Name
  -- == -- == -- == == == -- -- -- -- --  ---------------  --------------------
  60 00 10 00 08 00 00 32 40 10 00 40 08     00:00:00.049  READ FPDMA QUEUED
  60 00 10 00 08 00 00 32 40 10 00 40 08     00:00:00.051  READ FPDMA QUEUED
  60 00 10 00 60 00 00 32 00 10 08 40 08     00:00:00.051  READ FPDMA QUEUED
  60 00 10 00 08 00 00 32 00 10 80 40 08     00:00:00.051  READ FPDMA QUEUED
  60 00 10 00 08 00 00 32 00 10 00 40 08     00:00:00.050  READ FPDMA QUEUED

SMART Extended Self-test Log Version: 1 (2 sectors)
Num  Test_Description    Status                  Remaining  LifeTime(hours)  LBA_of_first_error
# 1  Short offline       Completed: handling damage??  90%      6736         0
# 2  Short offline       Completed: read failure       90%      4897         170942526
# 3  Short offline       Completed without error       00%      4605         -
# 4  Short offline       Completed without error       00%      4467         -
# 5  Short offline       Completed without error       00%      4107         -
# 6  Short offline       Completed without error       00%      3823         -
# 7  Short offline       Completed without error       00%      3621         -
# 8  Short offline       Completed without error       00%      3433         -
# 9  Short offline       Completed without error       00%      3225         -
#10  Short offline       Completed without error       00%      3163         -
#11  Short offline       Completed without error       00%      2950         -
#12  Short offline       Completed without error       00%      2787         -
#13  Short offline       Completed without error       00%      2480         -
#14  Short offline       Completed without error       00%      2345         -
#15  Short offline       Aborted by host               30%      1953         -
#16  Short offline       Completed without error       00%      1848         -
#17  Short offline       Completed without error       00%      1765         -
#18  Short offline       Completed without error       00%      1603         -
#19  Short offline       Completed without error       00%      1536         -
#20  Extended offline    Interrupted (host reset)      20%      1511         -
#21  Extended offline    Interrupted (host reset)      90%      1502         -

SMART Selective self-test log data structure revision number 0

 SPAN  MIN_LBA  MAX_LBA  CURRENT_TEST_STATUS
    1        0        0  Completed_handling_damage?? [90% left] (0-65535)
    2        0        0  Not_testing
    3        0        0  Not_testing
    4        0        0  Not_testing
    5        0        0  Not_testing
Selective self-test flags (0x0):
  After scanning selected spans, do NOT read-scan remainder of disk.
If Selective self-test is pending on power-up, resume after 0 minute delay.

SCT Status Version:                  2
SCT Version (vendor specific):       256 (0x0100)
Device State:                        Active (0)
Current Temperature:                    27 Celsius
Power Cycle Min/Max Temperature:     20/33 Celsius
Lifetime    Min/Max Temperature:     20/63 Celsius
Specified Max Operating Temperature:    80 Celsius
Under/Over Temperature Limit Count:   0/0

SCT Temperature History Version:     2
Temperature Sampling Period:         5 minutes
Temperature Logging Interval:        5 minutes
Min/Max recommended Temperature:     -5/80 Celsius
Min/Max Temperature Limit:           -10/85 Celsius
Temperature History Size (Index):    128 (54)

SCT Error Recovery Control:
           Read: Disabled
          Write: Disabled

SATA Phy Event Counters (GP Log 0x11)
ID      Size     Value  Description
0x0001  4            0  Command failed due to ICRC error
0x0002  4            0  R_ERR response for data FIS
0x0003  4            0  R_ERR response for device-to-host data FIS
0x0004  4            0  R_ERR response for host-to-device data FIS
0x0005  4            0  R_ERR response for non-data FIS
0x0006  4            0  R_ERR response for device-to-host non-data FIS
0x0007  4            0  R_ERR response for host-to-device non-data FIS
0x0008  4            0  Device-to-host non-data FIS retries
0x0009  4       586781  Transition from drive PhyRdy to drive PhyNRdy
0x000a  4            5  Device-to-host register FISes sent due to a COMRESET
0x000b  4            0  CRC errors within host-to-device FIS
0x000d  4            0  Non-CRC errors within host-to-device FIS
0x000f  4            0  R_ERR response for host-to-device data FIS, CRC
0x0010  4            0  R_ERR response for host-to-device data FIS, non-CRC
0x0012  4            0  R_ERR response for host-to-device non-data FIS, CRC
0x0013  4            0  R_ERR response for host-to-device non-data FIS, non-CRC
0x8e00  4            0  Vendor specific
0x8e01  4            0  Vendor specific
0x8e02  4            0  Vendor specific
0x8e03  4            0  Vendor specific
0x8e04  4            0  Vendor specific
0x8e05  4            0  Vendor specific
0x8e06  4            0  Vendor specific
0x8e07  4            0  Vendor specific
0x8e08  4            0  Vendor specific
0x8e09  4            0  Vendor specific
0x8e0a  4            0  Vendor specific
0x8e0b  4            0  Vendor specific
0x8e0c  4            0  Vendor specific
0x8e0d  4            0  Vendor specific
0x8e0e  4            0  Vendor specific
0x8e0f  4            0  Vendor specific
0x8e10  4            0  Vendor specific
0x8e11  4            0  Vendor specific

