smartctl 7.1 2020-06-20 r5066 [x86_64-linux-3.10.0-1127...] (local build)
Copyright (C) 2002-19, Bruce Allen, Christian Franke, www.smartmontools.org

=== START OF INFORMATION SECTION ===
Model Family:     Dell Certified Intel S4x00/D3-S4x10 Series SSDs
Device Model:     SSDSC2KG960G8R
Serial Number:    --
LU WWN Device Id: 5 5cd2e4 ...
Add. Product Id:  DELL(tm)
Firmware Version: XCV1DL65
User Capacity:    960,197,124,096 bytes [960 GB]
Sector Sizes:     512 bytes logical, 4096 bytes physical
Rotation Rate:    Solid State Device
Form Factor:      2.5 inches
Device is:        In smartctl database [for details use: -P show]
ATA Version is:   ACS-3 T13/2161-D revision 5
SATA Version is:  SATA 3.2, 6.0 Gb/s (current: 6.0 Gb/s)
Local Time is:    --
Rd look-ahead is: Enabled
Write cache is:   Enabled

=== START OF READ SMART DATA SECTION ===
SMART overall-health self-assessment test result: PASSED

General SMART Values:
Offline data collection status:  (0x02)	Offline data collection activity
					was completed without error.

Self-test execution status:      (   0)	The previous self-test routine completed
					without error or no self-test has ever 
					been run.
Total time to complete Offline 
data collection: 		(  144) seconds.
Offline data collection
capabilities: 			 (0x79) SMART execute Offline immediate.

					Suspend Offline collection upon new
					command.
					Offline surface scan supported.
					Self-test supported.
					Conveyance Self-test supported.
					Selective Self-test supported.
SMART capabilities:            (0x0003)	Saves SMART data before entering
					power-saving mode.

Error logging capability:        (0x01)	Error logging supported.
					General Purpose Logging supported.
Short self-test routine 
recommended polling time: 	 (   1) minutes.
Extended self-test routine
recommended polling time: 	 (  60) minutes.
Conveyance self-test routine
recommended polling time: 	 (  60) minutes.
SCT capabilities: 	       (0x003d)	SCT Status supported.
					SCT Error Recovery Control supported.
					SCT Feature Control supported.
					SCT Data Table supported.

SMART Attributes Data Structure revision number: 1
Vendor Specific SMART Attributes with Thresholds:
ID# ATTRIBUTE_NAME          FLAGS    VALUE WORST THRESH FAIL RAW_VALUE
  1 Raw_Read_Error_Rate     -OSR--   130   130   039    -    4294967295
  5 Reallocated_Sector_Ct   PO--CK   100   100   001    -    1
  9 Power_On_Hours          -O--CK   100   100   000    -    11630
 12 Power_Cycle_Count       -O--CK   100   100   000    -    7
 13 Read_Soft_Error_Rate    -OSRC-   088   085   000    -    281474976710655
170 Available_Reservd_Space PO--CK   099   099   010    -    0
174 Unsafe_Shutdown_Count   -O--CK   100   100   000    -    6
179 Used_Rsvd_Blk_Cnt_Tot   PO--CK   099   099   010    -    0
180 Unused_Rsvd_Blk_Cnt_Tot -O--CK   100   100   000    -    12300
181 Program_Fail_Cnt_Total  -O-RCK   100   100   000    -    0
182 Erase_Fail_Count_Total  -O-RCK   100   100   000    -    0
184 End-to-End_Error        -O--CK   100   100   000    -    0
194 Temperature_Celsius     -O---K   100   100   000    -    22
195 Uncorrectable_Error_Cnt -O--CK   100   100   000    -    0
197 Current_Pending_Sector  -O--C-   100   100   000    -    0
198 Offline_Uncorrectable   ----C-   100   100   000    -    0
199 CRC_Error_Count         -OSRCK   100   100   000    -    4
201 Power_Loss_Cap_Test     PO--CK   100   100   010    -    2505 (11 65535)
202 End_of_Life             POS--K   100   100   000    -    0
225 Host_Writes_32MiB       -O--CK   100   100   000    -    5731735
226 Workld_Media_Wear_Indic -O--CK   100   100   000    -    2201
227 Workld_Host_Reads_Perc  -O--CK   100   100   000    -    38
228 Workload_Minutes        -O--CK   100   100   000    -    697773
232 Available_Reservd_Space PO--CK   099   099   010    -    0
233 Total_LBAs_Written      -O--CK   100   100   000    -    5731735
234 Thermal_Throttle_Status -O--CK   100   100   000    -    0/0
241 Total_LBAs_Written      -O--CK   100   100   000    -    5731735
242 Total_LBAs_Read         -O--CK   100   100   000    -    3554061
245 Percent_Life_Remaining  -O--CK   098   098   000    -    98
                            ||||||_ K auto-keep
                            |||||__ C event count
                            ||||___ R error rate
                            |||____ S speed/performance
                            ||_____ O updated online
                            |______ P prefailure warning

General Purpose Log Directory Version 1
SMART           Log Directory Version 1 [multi-sector log support]
Address    Access  R/W   Size  Description
0x00       GPL,SL  R/O      1  Log Directory
0x02           SL  R/O      8  Comprehensive SMART error log
0x03       GPL     R/O     20  Ext. Comprehensive SMART error log
0x04       GPL,SL  R/O      8  Device Statistics log
0x06           SL  R/O      1  SMART self-test log
0x07       GPL     R/O      2  Extended self-test log
0x08       GPL     R/O      2  Power Conditions log
0x10       GPL     R/O      1  NCQ Command Error log
0x11       GPL     R/O      1  SATA Phy Event Counters log
0x24       GPL     R/O    512  Current Device Internal Status Data log
0x25       GPL     R/O    512  Saved Device Internal Status Data log
0x30       GPL,SL  R/O      9  IDENTIFY DEVICE data log
0x99-0x9a  GPL,SL  R/W      1  Host vendor specific log
0xb8           SL  VS       1  Device vendor specific log
0xb9           SL  VS       8  Device vendor specific log
0xba       GPL     VS    1280  Device vendor specific log
0xc8       GPL     VS       1  Device vendor specific log
0xe0       GPL,SL  R/W      1  SCT Command/Status
0xe1       GPL,SL  R/W      8  SCT Data Transfer

SMART Extended Comprehensive Error Log Version: 1 (20 sectors)
Device Error Count: 4
	CR     = Command Register
	FEATR  = Features Register
	COUNT  = Count (was: Sector Count) Register
	LBA_48 = Upper bytes of LBA High/Mid/Low Registers ]  ATA-8
	LH     = LBA High (was: Cylinder High) Register    ]   LBA
	LM     = LBA Mid (was: Cylinder Low) Register      ] Register
	LL     = LBA Low (was: Sector Number) Register     ]
	DV     = Device (was: Device/Head) Register
	DC     = Device Control Register
	ER     = Error register
	ST     = Status register
Powered_Up_Time is measured from power on, and printed as
DDd+hh:mm:SS.sss where DD=days, hh=hours, mm=minutes,
SS=sec, and sss=millisec. It "wraps" after 49.710 days.

Error 4 [3] occurred at disk power-on lifetime: 9360 hours (390 days + 0 hours)
  When the command that caused the error occurred, the device was active or idle.

  After command completion occurred, registers were:
  ER -- ST COUNT  LBA_48  LH LM LL DV DC
  -- -- -- == -- == == == -- -- -- -- --
  84 -- 41 00 00 00 00 00 44 fc 08 40 00  Error: ICRC, ABRT at LBA = 0x0044fc08 = 4520968

  Commands leading to the command that caused the error were:
  CR FEATR COUNT  LBA_48  LH LM LL DV DC  Powered_Up_Time  Command/Feature_Name
  -- == -- == -- == == == -- -- -- -- --  ---------------  --------------------
  61 02 00 00 00 00 00 00 44 fc 08 40 00 39d+ ...          WRITE FPDMA QUEUED
  61 02 00 00 08 00 00 00 44 fe 08 40 00 39d+ ...          WRITE FPDMA QUEUED
  61 02 00 00 08 00 00 00 44 fa 08 40 00 39d+ ...          WRITE FPDMA QUEUED
  61 02 00 00 00 00 00 00 44 f8 08 40 00 39d+ ...          WRITE FPDMA QUEUED
  61 02 00 00 08 00 00 00 44 f6 08 40 00 39d+ ...          WRITE FPDMA QUEUED

Error 3 [2] occurred at disk power-on lifetime: 8760 hours (365 days + 0 hours)
  When the command that caused the error occurred, the device was active or idle.

  After command completion occurred, registers were:
  ER -- ST COUNT  LBA_48  LH LM LL DV DC
  -- -- -- == -- == == == -- -- -- -- --
  84 -- 41 00 28 00 00 00 05 7a 08 40 00  Error: ICRC, ABRT at LBA = 0x00057a08 = 358920

  Commands leading to the command that caused the error were:
  CR FEATR COUNT  LBA_48  LH LM LL DV DC  Powered_Up_Time  Command/Feature_Name
  -- == -- == -- == == == -- -- -- -- --  ---------------  --------------------
  61 02 00 00 28 00 00 00 05 7a 08 40 00 14d+ ...          WRITE FPDMA QUEUED
  61 02 00 00 10 00 00 00 05 78 08 40 00 14d+ ...          WRITE FPDMA QUEUED
  61 02 00 00 20 00 00 00 05 76 08 40 00 14d+ ...          WRITE FPDMA QUEUED
  61 02 00 00 08 00 00 00 05 74 08 40 00 14d+ ...          WRITE FPDMA QUEUED
  60 00 08 00 00 00 00 20 1a 95 58 40 00 14d+ ...          READ FPDMA QUEUED

Error 2 [1] occurred at disk power-on lifetime: 8127 hours (338 days + 15 hours)
  When the command that caused the error occurred, the device was active or idle.

  After command completion occurred, registers were:
  ER -- ST COUNT  LBA_48  LH LM LL DV DC
  -- -- -- == -- == == == -- -- -- -- --
  84 -- 41 00 00 00 00 17 20 a6 00 40 00  Error: ICRC, ABRT at LBA = 0x1720a600 = 388015616

  Commands leading to the command that caused the error were:
  CR FEATR COUNT  LBA_48  LH LM LL DV DC  Powered_Up_Time  Command/Feature_Name
  -- == -- == -- == == == -- -- -- -- --  ---------------  --------------------
  61 02 00 00 00 00 00 17 20 a6 00 40 00 37d+ ...          WRITE FPDMA QUEUED
  61 02 00 00 a0 00 00 17 20 a4 00 40 00 37d+ ...          WRITE FPDMA QUEUED
  61 02 00 00 98 00 00 17 20 a2 00 40 00 37d+ ...          WRITE FPDMA QUEUED
  61 02 00 00 90 00 00 17 20 a0 00 40 00 37d+ ...          WRITE FPDMA QUEUED
  61 02 00 00 28 00 00 17 20 8e 00 40 00 37d+ ...          WRITE FPDMA QUEUED

Error 1 [0] occurred at disk power-on lifetime: 6445 hours (268 days + 13 hours)
  When the command that caused the error occurred, the device was active or idle.

  After command completion occurred, registers were:
  ER -- ST COUNT  LBA_48  LH LM LL DV DC
  -- -- -- == -- == == == -- -- -- -- --
  84 -- 41 00 18 00 00 00 24 c6 08 40 00  Error: ICRC, ABRT at LBA = 0x0024c608 = 2409992

  Commands leading to the command that caused the error were:
  CR FEATR COUNT  LBA_48  LH LM LL DV DC  Powered_Up_Time  Command/Feature_Name
  -- == -- == -- == == == -- -- -- -- --  ---------------  --------------------
  61 00 68 00 18 00 00 00 24 c6 08 40 00 17d+ ...          WRITE FPDMA QUEUED
  61 02 00 00 10 00 00 00 24 c4 08 40 00 17d+ ...          WRITE FPDMA QUEUED
  61 02 00 00 30 00 00 00 24 c2 08 40 00 17d+ ...          WRITE FPDMA QUEUED
  61 02 00 00 00 00 00 00 24 c0 08 40 00 17d+ ...          WRITE FPDMA QUEUED
  60 01 80 00 28 00 00 00 23 28 c8 40 00 17d+ ...          READ FPDMA QUEUED

SMART Extended Self-test Log Version: 1 (2 sectors)
Num  Test_Description    Status                  Remaining  LifeTime(hours)  LBA_of_first_error
# 1  Extended offline    Completed without error       00%         0         -
# 2  Short offline       Completed without error       00%         0         -

SCT Status Version:                  3
SCT Version (vendor specific):       1 (0x0001)
Device State:                        Active (0)
Current Temperature:                    22 Celsius
Power Cycle Min/Max Temperature:     15/25 Celsius
Lifetime    Min/Max Temperature:     15/39 Celsius
Specified Max Operating Temperature:    73 Celsius
Under/Over Temperature Limit Count:   0/0
Vendor specific:
00 00 2c 01 00 00 00 00 00 00 00 00 00 00 00 00
00 00 00 00 00 00 00 00 00 00 00 00 00 00 00 00

SCT Temperature History Version:     2
Temperature Sampling Period:         1 minute
Temperature Logging Interval:        1 minute
Min/Max recommended Temperature:      0/73 Celsius
Min/Max Temperature Limit:            0/73 Celsius
Temperature History Size (Index):    478 (367)

SCT Error Recovery Control:
           Read:     80 (8.0 seconds)
          Write:     80 (8.0 seconds)

Device Statistics (GP Log 0x04)
Page  Offset Size        Value Flags Description
0x01  =====  =               =  ===  == General Statistics (rev 2) ==
0x01  0x008  4               7  ---  Lifetime Power-On Resets
0x01  0x018  6    375634985514  ---  Logical Sectors Written
0x01  0x020  6      6536568263  ---  Number of Write Commands
0x01  0x028  6    232919000624  ---  Logical Sectors Read
0x01  0x030  6      3014127749  ---  Number of Read Commands
0x01  0x038  6      3214348743  ---  Date and Time TimeStamp
0x04  =====  =               =  ===  == General Errors Statistics (rev 1) ==
0x04  0x008  4               0  ---  Number of Reported Uncorrectable Errors
0x04  0x010  4               0  ---  Resets Between Cmd Acceptance and Completion
0x05  =====  =               =  ===  == Temperature Statistics (rev 1) ==
0x05  0x008  1              22  ---  Current Temperature
0x05  0x010  1              21  ---  Average Short Term Temperature
0x05  0x018  1              21  ---  Average Long Term Temperature
0x05  0x020  1              38  ---  Highest Temperature
0x05  0x028  1              19  ---  Lowest Temperature
0x05  0x030  1              28  ---  Highest Average Short Term Temperature
0x05  0x038  1              20  ---  Lowest Average Short Term Temperature
0x05  0x040  1              22  ---  Highest Average Long Term Temperature
0x05  0x048  1              20  ---  Lowest Average Long Term Temperature
0x05  0x050  4               0  ---  Time in Over-Temperature
0x05  0x058  1              73  ---  Specified Maximum Operating Temperature
0x05  0x060  4               0  ---  Time in Under-Temperature
0x05  0x068  1               0  ---  Specified Minimum Operating Temperature
0x06  =====  =               =  ===  == Transport Statistics (rev 1) ==
0x06  0x008  4             703  ---  Number of Hardware Resets
0x06  0x010  4             667  ---  Number of ASR Events
0x06  0x018  4               4  ---  Number of Interface CRC Errors
0x07  =====  =               =  ===  == Solid State Device Statistics (rev 1) ==
0x07  0x008  1               2  ---  Percentage Used Endurance Indicator
                                |||_ C monitored condition met
                                ||__ D supports DSN
                                |___ N normalized value

SATA Phy Event Counters (GP Log 0x11)
ID      Size     Value  Description
0x0001  4            4  Command failed due to ICRC error
0x0002  4            8  R_ERR response for data FIS
0x0003  4            0  R_ERR response for device-to-host data FIS
0x0004  4            8  R_ERR response for host-to-device data FIS
0x0005  4            0  R_ERR response for non-data FIS
0x0006  4            0  R_ERR response for device-to-host non-data FIS
0x0007  4            0  R_ERR response for host-to-device non-data FIS
0x000a  4            9  Device-to-host register FISes sent due to a COMRESET
0x000b  4            0  CRC errors within host-to-device FIS
0x000d  4            0  Non-CRC errors within host-to-device FIS

