smartctl 7.1 2020-06-20 r5066 [x86_64-linux-3.10.0-1160...] (local build)
Copyright (C) 2002-19, Bruce Allen, Christian Franke, www.smartmontools.org

=== START OF INFORMATION SECTION ===
Model Number:                       HUSMR7638BDP3Y1
Serial Number:                      --
Firmware Version:                   KNGND110
PCI Vendor/Subsystem ID:            0x1c58
IEEE OUI Identifier:                0x000cca
Total NVM Capacity:                 3,843,995,729,920 [3.84 TB]
Unallocated NVM Capacity:           0
Controller ID:                      35
Number of Namespaces:               128
Namespace 1 Size/Capacity:          3,840,755,982,336 [3.84 TB]
Namespace 1 Formatted LBA Size:     4096
Namespace 1 IEEE EUI-64:            000cca ...
Local Time is:                      --

=== START OF READ SMART DATA SECTION ===
SMART overall-health self-assessment test result: PASSED

SMART/Health Information (NVMe Log 0x02)
Critical Warning:                   0x00
Temperature:                        37 Celsius
Available Spare:                    100%
Available Spare Threshold:          10%
Percentage Used:                    0%
Data Units Read:                    241,266,865 [123 TB]
Data Units Written:                 436,501,514 [223 TB]
Host Read Commands:                 3,361,056,548
Host Write Commands:                5,842,316,616
Controller Busy Time:               148,338
Power Cycles:                       4
Power On Hours:                     10,016
Unsafe Shutdowns:                   1
Media and Data Integrity Errors:    0
Error Information Log Entries:      0
Warning  Comp. Temperature Time:    0
Critical Comp. Temperature Time:    0
Temperature Sensor 1:               37 Celsius
Temperature Sensor 2:               33 Celsius
Temperature Sensor 3:               29 Celsius

