smartctl 7.1 2020-06-20 r5066 [x86_64-linux-3.10.0-1127...] (local build)
Copyright (C) 2002-19, Bruce Allen, Christian Franke, www.smartmontools.org

=== START OF INFORMATION SECTION ===
Model Number:                       INTEL SSDPE21K375GA
Serial Number:                      --
Firmware Version:                   E2010485
PCI Vendor/Subsystem ID:            0x8086
IEEE OUI Identifier:                0x5cd2e4
Controller ID:                      0
Number of Namespaces:               1
Namespace 1 Size/Capacity:          375,083,606,016 [375 GB]
Namespace 1 Formatted LBA Size:     4096
Namespace 1 IEEE EUI-64:            5cd2e4 ...
Local Time is:                      Fri Nov ... 2020 CET

=== START OF READ SMART DATA SECTION ===
SMART overall-health self-assessment test result: PASSED

SMART/Health Information (NVMe Log 0x02)
Critical Warning:                   0x00
Temperature:                        31 Celsius
Available Spare:                    100%
Available Spare Threshold:          0%
Percentage Used:                    0%
Data Units Read:                    11,310,309 [5.79 TB]
Data Units Written:                 42,612,837 [21.8 TB]
Host Read Commands:                 1,122,261,583
Host Write Commands:                2,152,329,594
Controller Busy Time:               290
Power Cycles:                       34
Power On Hours:                     2,471
Unsafe Shutdowns:                   12
Media and Data Integrity Errors:    0
Error Information Log Entries:      0

