smartctl 7.1 2020-06-20 r5066 [x86_64-linux-3.10.0-1160...] (local build)
Copyright (C) 2002-19, Bruce Allen, Christian Franke, www.smartmontools.org

=== START OF INFORMATION SECTION ===
Model Number:                       Micron_9300_MTFDHAL3T2TDR
Serial Number:                      --
Firmware Version:                   11300DG0
PCI Vendor/Subsystem ID:            0x1344
IEEE OUI Identifier:                0x00a075
Total NVM Capacity:                 3,200,631,791,616 [3.20 TB]
Unallocated NVM Capacity:           0
Controller ID:                      1
Number of Namespaces:               32
Namespace 1 Size/Capacity:          3,200,631,791,616 [3.20 TB]
Namespace 1 Formatted LBA Size:     512
Namespace 1 IEEE EUI-64:            00a075 ...
Local Time is:                      Sat Apr ... 2022 WEST

=== START OF READ SMART DATA SECTION ===
SMART overall-health self-assessment test result: PASSED

SMART/Health Information (NVMe Log 0x02)
Critical Warning:                   0x00
Temperature:                        27 Celsius
Available Spare:                    100%
Available Spare Threshold:          5%
Percentage Used:                    0%
Data Units Read:                    204,737,038 [104 TB]
Data Units Written:                 491,245,967 [251 TB]
Host Read Commands:                 1,634,019,289
Host Write Commands:                3,382,717,864
Controller Busy Time:               182,232
Power Cycles:                       4
Power On Hours:                     12,688
Unsafe Shutdowns:                   2
Media and Data Integrity Errors:    0
Error Information Log Entries:      0
Warning  Comp. Temperature Time:    0
Critical Comp. Temperature Time:    0
Temperature Sensor 1:               29 Celsius
Temperature Sensor 2:               27 Celsius
Temperature Sensor 3:               25 Celsius
Temperature Sensor 4:               23 Celsius

