smartctl 7.1 2019-12-30 r5022 [x86_64-linux-3.10.0-1062...] (local build)
Copyright (C) 2002-19, Bruce Allen, Christian Franke, www.smartmontools.org

=== START OF INFORMATION SECTION ===
Model Number:                       INTEL SSDPEDMD800G4
Serial Number:                      --
Firmware Version:                   8DV10171
PCI Vendor/Subsystem ID:            0x8086
IEEE OUI Identifier:                0x5cd2e4
Controller ID:                      0
Number of Namespaces:               1
Namespace 1 Size/Capacity:          800,166,076,416 [800 GB]
Namespace 1 Formatted LBA Size:     512
Local Time is:                      --

=== START OF READ SMART DATA SECTION ===
SMART overall-health self-assessment test result: PASSED

SMART/Health Information (NVMe Log 0x02)
Critical Warning:                   0x00
Temperature:                        24 Celsius
Available Spare:                    100%
Available Spare Threshold:          10%
Percentage Used:                    13%
Data Units Read:                    486,451,819 [249 TB]
Data Units Written:                 7,491,039,589 [3.83 PB]
Host Read Commands:                 13,441,418,999
Host Write Commands:                46,357,390,717
Controller Busy Time:               1,008
Power Cycles:                       8
Power On Hours:                     24,096
Unsafe Shutdowns:                   3
Media and Data Integrity Errors:    0
Error Information Log Entries:      0

