smartctl 7.1 2020-06-20 r5066 [x86_64-linux-3.10.0-1127...] (local build)
Copyright (C) 2002-19, Bruce Allen, Christian Franke, www.smartmontools.org

=== START OF INFORMATION SECTION ===
Model Number:                       INTEL SSDPEDMD800G4
Serial Number:                      --
Firmware Version:                   8DV10171
PCI Vendor/Subsystem ID:            0x8086
IEEE OUI Identifier:                0x5cd2e4
Controller ID:                      0
Number of Namespaces:               1
Namespace 1 Size/Capacity:          800,166,076,416 [800 GB]
Namespace 1 Formatted LBA Size:     512
Local Time is:                      Wed Sep ... 2021 UTC

=== START OF READ SMART DATA SECTION ===
SMART overall-health self-assessment test result: PASSED

SMART/Health Information (NVMe Log 0x02)
Critical Warning:                   0x00
Temperature:                        35 Celsius
Available Spare:                    93%
Available Spare Threshold:          10%
Percentage Used:                    12%
Data Units Read:                    448,889,757 [229 TB]
Data Units Written:                 6,335,142,126 [3.24 PB]
Host Read Commands:                 8,190,292,019
Host Write Commands:                124,097,317,860
Controller Busy Time:               126
Power Cycles:                       13
Power On Hours:                     41,426
Unsafe Shutdowns:                   0
Media and Data Integrity Errors:    0
Error Information Log Entries:      3

