smartctl 7.1 2020-06-20 r5066 [x86_64-linux-3.10.0-1160...] (local build)
Copyright (C) 2002-19, Bruce Allen, Christian Franke, www.smartmontools.org

=== START OF INFORMATION SECTION ===
Model Number:                       INTEL SSDPEDMD800G4
Serial Number:                      --
Firmware Version:                   8DV10171
PCI Vendor/Subsystem ID:            0x8086
IEEE OUI Identifier:                0x5cd2e4
Controller ID:                      0
Number of Namespaces:               1
Namespace 1 Size/Capacity:          800,166,076,416 [800 GB]
Namespace 1 Formatted LBA Size:     512
Local Time is:                      Tue Dec ... 2021 UTC

=== START OF READ SMART DATA SECTION ===
SMART overall-health self-assessment test result: PASSED

SMART/Health Information (NVMe Log 0x02)
Critical Warning:                   0x00
Temperature:                        39 Celsius
Available Spare:                    100%
Available Spare Threshold:          10%
Percentage Used:                    5%
Data Units Read:                    214,543,212 [109 TB]
Data Units Written:                 2,636,636,017 [1.34 PB]
Host Read Commands:                 5,477,578,082
Host Write Commands:                40,865,836,231
Controller Busy Time:               10
Power Cycles:                       8
Power On Hours:                     36,387
Unsafe Shutdowns:                   1
Media and Data Integrity Errors:    0
Error Information Log Entries:      0

