smartctl 7.1 2020-06-20 r5066 [x86_64-linux-3.10.0-1127...] (local build)
Copyright (C) 2002-19, Bruce Allen, Christian Franke, www.smartmontools.org

=== START OF INFORMATION SECTION ===
Model Number:                       SAMSUNG MZQLB960HAJR-00007
Serial Number:                      --
Firmware Version:                   EDA5202Q
PCI Vendor/Subsystem ID:            0x144d
IEEE OUI Identifier:                0x002538
Total NVM Capacity:                 960,197,124,096 [960 GB]
Unallocated NVM Capacity:           0
Controller ID:                      4
Number of Namespaces:               1
Namespace 1 Size/Capacity:          960,197,124,096 [960 GB]
Namespace 1 Utilization:            904,515,395,584 [904 GB]
Namespace 1 Formatted LBA Size:     512
Local Time is:                      --

=== START OF READ SMART DATA SECTION ===
SMART overall-health self-assessment test result: PASSED

SMART/Health Information (NVMe Log 0x02)
Critical Warning:                   0x00
Temperature:                        53 Celsius
Available Spare:                    100%
Available Spare Threshold:          10%
Percentage Used:                    3%
Data Units Read:                    114,900,412 [58.8 TB]
Data Units Written:                 400,329,923 [204 TB]
Host Read Commands:                 2,707,676,404
Host Write Commands:                3,043,560,509
Controller Busy Time:               4,121
Power Cycles:                       10
Power On Hours:                     13,613
Unsafe Shutdowns:                   1
Media and Data Integrity Errors:    0
Error Information Log Entries:      10
Warning  Comp. Temperature Time:    0
Critical Comp. Temperature Time:    0
Temperature Sensor 1:               53 Celsius
Temperature Sensor 2:               58 Celsius
Temperature Sensor 3:               64 Celsius

