smartctl 7.1 2020-06-20 r5066 [x86_64-linux-3.10.0-1160...] (local build)
Copyright (C) 2002-19, Bruce Allen, Christian Franke, www.smartmontools.org

=== START OF INFORMATION SECTION ===
Model Number:                       SAMSUNG MZQLB960HAJR-00007
Serial Number:                      --
Firmware Version:                   EDA5302Q
PCI Vendor/Subsystem ID:            0x144d
IEEE OUI Identifier:                0x002538
Total NVM Capacity:                 960,197,124,096 [960 GB]
Unallocated NVM Capacity:           0
Controller ID:                      4
Number of Namespaces:               1
Namespace 1 Size/Capacity:          960,197,124,096 [960 GB]
Namespace 1 Utilization:            24,968,327,168 [24.9 GB]
Namespace 1 Formatted LBA Size:     512
Local Time is:                      Tue Apr ... 2022 MSK

=== START OF READ SMART DATA SECTION ===
SMART overall-health self-assessment test result: PASSED

SMART/Health Information (NVMe Log 0x02)
Critical Warning:                   0x00
Temperature:                        37 Celsius
Available Spare:                    100%
Available Spare Threshold:          10%
Percentage Used:                    0%
Data Units Read:                    49,355,309 [25.2 TB]
Data Units Written:                 19,403,200 [9.93 TB]
Host Read Commands:                 274,493,920
Host Write Commands:                192,049,577
Controller Busy Time:               328
Power Cycles:                       14
Power On Hours:                     15,366
Unsafe Shutdowns:                   11
Media and Data Integrity Errors:    0
Error Information Log Entries:      0
Warning  Comp. Temperature Time:    0
Critical Comp. Temperature Time:    0
Temperature Sensor 1:               37 Celsius
Temperature Sensor 2:               41 Celsius
Temperature Sensor 3:               45 Celsius

