smartctl 7.1 2020-06-20 r5066 [x86_64-linux-3.10.0-1160...] (local build)
Copyright (C) 2002-19, Bruce Allen, Christian Franke, www.smartmontools.org

=== START OF INFORMATION SECTION ===
Model Number:                       SAMSUNG MZQLB960HAJR-00007
Serial Number:                      --
Firmware Version:                   EDA5202Q
PCI Vendor/Subsystem ID:            0x144d
IEEE OUI Identifier:                0x002538
Total NVM Capacity:                 960,197,124,096 [960 GB]
Unallocated NVM Capacity:           0
Controller ID:                      4
Number of Namespaces:               1
Namespace 1 Size/Capacity:          960,197,124,096 [960 GB]
Namespace 1 Utilization:            899,833,733,120 [899 GB]
Namespace 1 Formatted LBA Size:     512
Local Time is:                      Sun Sep ... 2021 EDT

=== START OF READ SMART DATA SECTION ===
SMART overall-health self-assessment test result: PASSED

SMART/Health Information (NVMe Log 0x02)
Critical Warning:                   0x00
Temperature:                        32 Celsius
Available Spare:                    100%
Available Spare Threshold:          10%
Percentage Used:                    1%
Data Units Read:                    266,164,047 [136 TB]
Data Units Written:                 102,971,735 [52.7 TB]
Host Read Commands:                 7,186,070,381
Host Write Commands:                3,027,725,231
Controller Busy Time:               11,086
Power Cycles:                       88
Power On Hours:                     10,715
Unsafe Shutdowns:                   61
Media and Data Integrity Errors:    0
Error Information Log Entries:      6
Warning  Comp. Temperature Time:    0
Critical Comp. Temperature Time:    0
Temperature Sensor 1:               32 Celsius
Temperature Sensor 2:               35 Celsius
Temperature Sensor 3:               39 Celsius

