smartctl 7.1 2020-06-20 r5066 [x86_64-linux-3.10.0-1160...] (local build)
Copyright (C) 2002-19, Bruce Allen, Christian Franke, www.smartmontools.org

=== START OF INFORMATION SECTION ===
Model Number:                       Dell Express Flash NVMe PM1725 1.6TB AIC
Serial Number:                      --
Firmware Version:                   KPYABD3Q
PCI Vendor ID:                      0x144d
PCI Vendor Subsystem ID:            0x1028
IEEE OUI Identifier:                0x002538
Controller ID:                      0
Number of Namespaces:               1
Namespace 1 Size/Capacity:          1,600,321,314,816 [1.60 TB]
Namespace 1 Formatted LBA Size:     512
Namespace 1 IEEE EUI-64:            002538 ...
Local Time is:                      --

=== START OF READ SMART DATA SECTION ===
SMART overall-health self-assessment test result: PASSED

SMART/Health Information (NVMe Log 0x02)
Critical Warning:                   0x00
Temperature:                        52 Celsius
Available Spare:                    97%
Available Spare Threshold:          10%
Percentage Used:                    13%
Data Units Read:                    822,164,330 [420 TB]
Data Units Written:                 8,255,862,605 [4.22 PB]
Host Read Commands:                 15,014,533,977
Host Write Commands:                100,499,057,023
Controller Busy Time:               59,076
Power Cycles:                       11
Power On Hours:                     30,679
Unsafe Shutdowns:                   6
Media and Data Integrity Errors:    0
Error Information Log Entries:      0

