smartctl 7.1 2019-12-30 r5022 [x86_64-linux-3.10.0-1062...] (local build)
Copyright (C) 2002-19, Bruce Allen, Christian Franke, www.smartmontools.org

=== START OF INFORMATION SECTION ===
Model Number:                       KXG60ZNV512G TOSHIBA
Serial Number:                      --
Firmware Version:                   AGGA4104
PCI Vendor/Subsystem ID:            0x1179
IEEE OUI Identifier:                0x8ce38e
Total NVM Capacity:                 512,110,190,592 [512 GB]
Unallocated NVM Capacity:           0
Controller ID:                      0
Number of Namespaces:               1
Namespace 1 Size/Capacity:          512,110,190,592 [512 GB]
Namespace 1 Formatted LBA Size:     512
Namespace 1 IEEE EUI-64:            8ce38e ...
Local Time is:                      --

=== START OF READ SMART DATA SECTION ===
SMART overall-health self-assessment test result: PASSED

SMART/Health Information (NVMe Log 0x02)
Critical Warning:                   0x00
Temperature:                        31 Celsius
Available Spare:                    100%
Available Spare Threshold:          10%
Percentage Used:                    10%
Data Units Read:                    740,625 [379 GB]
Data Units Written:                 9,539,744 [4.88 TB]
Host Read Commands:                 76,471,638
Host Write Commands:                528,972,636
Controller Busy Time:               3,805
Power Cycles:                       10
Power On Hours:                     13,992
Unsafe Shutdowns:                   7
Media and Data Integrity Errors:    0
Error Information Log Entries:      0
Warning  Comp. Temperature Time:    0
Critical Comp. Temperature Time:    0
Temperature Sensor 1:               31 Celsius

