smartctl 7.4 2023-08-01 r5530 [x86_64-linux-3.10.0-1160...] (local build)
Copyright (C) 2002-23, Bruce Allen, Christian Franke, www.smartmontools.org

=== START OF INFORMATION SECTION ===
Model Number:                       SSDPE21K375GAL
Serial Number:                      --
Firmware Version:                   E201LW39
PCI Vendor ID:                      0x8086
PCI Vendor Subsystem ID:            0x1d49
IEEE OUI Identifier:                0x5cd2e4
Controller ID:                      0
NVMe Version:                       <1.2
Number of Namespaces:               1
Namespace 1 Size/Capacity:          375,083,606,016 [375 GB]
Namespace 1 Formatted LBA Size:     512
Namespace 1 IEEE EUI-64:            5cd2e4 ...
Local Time is:                      Thu Nov ... 2024 MSK

=== START OF READ SMART DATA SECTION ===
SMART overall-health self-assessment test result: PASSED

SMART/Health Information (NVMe Log 0x02)
Critical Warning:                   0x00
Temperature:                        30 Celsius
Available Spare:                    100%
Available Spare Threshold:          0%
Percentage Used:                    16%
Data Units Read:                    2,602,165,038 [1.33 PB]
Data Units Written:                 5,142,796,872 [2.63 PB]
Host Read Commands:                 55,919,263,743
Host Write Commands:                186,454,853,241
Controller Busy Time:               43,383
Power Cycles:                       119
Power On Hours:                     38,020
Unsafe Shutdowns:                   76
Media and Data Integrity Errors:    0
Error Information Log Entries:      0

Error Information (NVMe Log 0x01, 16 of 64 entries)
No Errors Logged

