smartctl 7.1 2020-06-20 r5066 [x86_64-linux-3.10.0-1127...] (local build)
Copyright (C) 2002-19, Bruce Allen, Christian Franke, www.smartmontools.org

=== START OF INFORMATION SECTION ===
Model Family:     Seagate Enterprise Capacity 3.5 HDD
Device Model:     ST6000NM0024-1HT17Z
Serial Number:    --
LU WWN Device Id: 5 000c50 ...
Firmware Version: SN02
User Capacity:    6,001,175,126,016 bytes [6.00 TB]
Sector Sizes:     512 bytes logical, 4096 bytes physical
Rotation Rate:    7200 rpm
Form Factor:      3.5 inches
Device is:        In smartctl database [for details use: -P show]
ATA Version is:   ACS-3 (minor revision not indicated)
SATA Version is:  SATA 3.1, 6.0 Gb/s (current: 6.0 Gb/s)
Local Time is:    --
Rd look-ahead is: Enabled
Write cache is:   Enabled
ATA Security is:  Disabled, NOT FROZEN [SEC1]

=== START OF READ SMART DATA SECTION ===
SMART overall-health self-assessment test result: PASSED

General SMART Values:
Offline data collection status:  (0x82)	Offline data collection activity
					was completed without error.

Self-test execution status:      (   0)	The previous self-test routine completed
					without error or no self-test has ever 
					been run.
Total time to complete Offline 
data collection: 		(   89) seconds.
Offline data collection
capabilities: 			 (0x7b) SMART execute Offline immediate.

					Suspend Offline collection upon new
					command.
					Offline surface scan supported.
					Self-test supported.
					Conveyance Self-test supported.
					Selective Self-test supported.
SMART capabilities:            (0x0003)	Saves SMART data before entering
					power-saving mode.

Error logging capability:        (0x01)	Error logging supported.
					General Purpose Logging supported.
Short self-test routine 
recommended polling time: 	 (   1) minutes.
Extended self-test routine
recommended polling time: 	 ( 653) minutes.
Conveyance self-test routine
recommended polling time: 	 (   2) minutes.
SCT capabilities: 	       (0x50bd)	SCT Status supported.
					SCT Error Recovery Control supported.
					SCT Feature Control supported.
					SCT Data Table supported.

SMART Attributes Data Structure revision number: 10
Vendor Specific SMART Attributes with Thresholds:
ID# ATTRIBUTE_NAME          FLAGS    VALUE WORST THRESH FAIL RAW_VALUE
  1 Raw_Read_Error_Rate     POSR--   073   063   044    -    138366398
  3 Spin_Up_Time            PO----   094   091   000    -    0
  4 Start_Stop_Count        -O--CK   100   100   020    -    27
  5 Reallocated_Sector_Ct   PO--CK   100   100   010    -    8
  7 Seek_Error_Rate         POSR--   094   060   030    -    2799483861
  9 Power_On_Hours          -O--CK   043   043   000    -    49997
 10 Spin_Retry_Count        PO--C-   100   100   097    -    0
 12 Power_Cycle_Count       -O--CK   100   100   020    -    27
184 End-to-End_Error        -O--CK   100   100   099    -    0
187 Reported_Uncorrect      -O--CK   094   094   000    -    6
188 Command_Timeout         -O--CK   100   100   000    -    0 0 0
189 High_Fly_Writes         -O-RCK   100   100   000    -    0
190 Airflow_Temperature_Cel -O---K   055   043   045    Past 45 (Min/Max 39/46 #12844)
191 G-Sense_Error_Rate      -O--CK   081   081   000    -    38868
192 Power-Off_Retract_Count -O--CK   100   100   000    -    0
193 Load_Cycle_Count        -O--CK   093   093   000    -    15147
194 Temperature_Celsius     -O---K   045   057   000    -    45 (0 23 0 0 0)
195 Hardware_ECC_Recovered  -O-RC-   070   053   000    -    138366398
197 Current_Pending_Sector  -O--C-   100   100   000    -    16
198 Offline_Uncorrectable   ----C-   100   100   000    -    16
199 UDMA_CRC_Error_Count    -OSRCK   200   200   000    -    0
                            ||||||_ K auto-keep
                            |||||__ C event count
                            ||||___ R error rate
                            |||____ S speed/performance
                            ||_____ O updated online
                            |______ P prefailure warning

General Purpose Log Directory Version 1
SMART           Log Directory Version 1 [multi-sector log support]
Address    Access  R/W   Size  Description
0x00       GPL,SL  R/O      1  Log Directory
0x01           SL  R/O      1  Summary SMART error log
0x02           SL  R/O      5  Comprehensive SMART error log
0x03       GPL     R/O      5  Ext. Comprehensive SMART error log
0x04       GPL,SL  R/O      8  Device Statistics log
0x06           SL  R/O      1  SMART self-test log
0x07       GPL     R/O      1  Extended self-test log
0x08       GPL,SL  R/O      2  Power Conditions log
0x09           SL  R/W      1  Selective self-test log
0x10       GPL     R/O      1  NCQ Command Error log
0x11       GPL     R/O      1  SATA Phy Event Counters log
0x13       GPL     R/O      1  SATA NCQ Send and Receive log
0x15       GPL     R/W      1  Rebuild Assist log
0x21       GPL     R/O      1  Write stream error log
0x22       GPL     R/O      1  Read stream error log
0x24       GPL     R/O    512  Current Device Internal Status Data log
0x30       GPL,SL  R/O      9  IDENTIFY DEVICE data log
0x80-0x9f  GPL,SL  R/W     16  Host vendor specific log
0xa1       GPL,SL  VS      20  Device vendor specific log
0xa2       GPL     VS    8160  Device vendor specific log
0xa8-0xa9  GPL,SL  VS     136  Device vendor specific log
0xab       GPL     VS       1  Device vendor specific log
0xb0       GPL     VS    8982  Device vendor specific log
0xbe-0xbf  GPL     VS   65535  Device vendor specific log
0xc1       GPL,SL  VS      10  Device vendor specific log
0xc3       GPL,SL  VS       8  Device vendor specific log
0xc7       GPL,SL  VS       1  Device vendor specific log
0xd1       GPL,SL  VS       8  Device vendor specific log
0xe0       GPL,SL  R/W      1  SCT Command/Status
0xe1       GPL,SL  R/W      1  SCT Data Transfer

SMART Extended Comprehensive Error Log Version: 1 (5 sectors)
Device Error Count: 6
	CR     = Command Register
	FEATR  = Features Register
	COUNT  = Count (was: Sector Count) Register
	LBA_48 = Upper bytes of LBA High/Mid/Low Registers ]  ATA-8
	LH     = LBA High (was: Cylinder High) Register    ]   LBA
	LM     = LBA Mid (was: Cylinder Low) Register      ] Register
	LL     = LBA Low (was: Sector Number) Register     ]
	DV     = Device (was: Device/Head) Register
	DC     = Device Control Register
	ER     = Error register
	ST     = Status register
Powered_Up_Time is measured from power on, and printed as
DDd+hh:mm:SS.sss where DD=days, hh=hours, mm=minutes,
SS=sec, and sss=millisec. It "wraps" after 49.710 days.

Error 6 [5] occurred at disk power-on lifetime: 49613 hours (2067 days + 5 hours)
  When the command that caused the error occurred, the device was active or idle.

  After command completion occurred, registers were:
  ER -- ST COUNT  LBA_48  LH LM LL DV DC
  -- -- -- == -- == == == -- -- -- -- --
  40 -- 51 00 00 00 00 0b fd 8f 80 00 00  Error: WP at LBA = 0x0bfd8f80 = 201166720

  Commands leading to the command that caused the error were:
  CR FEATR COUNT  LBA_48  LH LM LL DV DC  Powered_Up_Time  Command/Feature_Name
  -- == -- == -- == == == -- -- -- -- --  ---------------  --------------------
  61 00 00 00 08 00 00 00 06 8d d8 40 00 46d+ ...          WRITE FPDMA QUEUED
  60 00 00 00 08 00 00 0b fd 8f 80 40 00 46d+ ...          READ FPDMA QUEUED
  ea 00 00 00 00 00 00 00 00 00 00 00 00 46d+ ...          FLUSH CACHE EXT
  2f 00 00 00 01 00 00 00 00 00 10 00 00 46d+ ...          READ LOG EXT
  60 00 00 00 08 00 00 0b fd 8f 80 40 00 46d+ ...          READ FPDMA QUEUED

Error 5 [4] occurred at disk power-on lifetime: 49613 hours (2067 days + 5 hours)
  When the command that caused the error occurred, the device was active or idle.

  After command completion occurred, registers were:
  ER -- ST COUNT  LBA_48  LH LM LL DV DC
  -- -- -- == -- == == == -- -- -- -- --
  40 -- 51 00 00 00 00 0b fd 8f 80 00 00  Error: UNC at LBA = 0x0bfd8f80 = 201166720

  Commands leading to the command that caused the error were:
  CR FEATR COUNT  LBA_48  LH LM LL DV DC  Powered_Up_Time  Command/Feature_Name
  -- == -- == -- == == == -- -- -- -- --  ---------------  --------------------
  60 00 00 00 08 00 00 0b fd 8f 80 40 00 46d+ ...          READ FPDMA QUEUED
  60 00 00 00 08 00 00 0b fd 8f 78 40 00 46d+ ...          READ FPDMA QUEUED
  60 00 00 00 08 00 00 0b fd 8f 70 40 00 46d+ ...          READ FPDMA QUEUED
  60 00 00 00 08 00 00 0b fd 8f 68 40 00 46d+ ...          READ FPDMA QUEUED
  60 00 00 00 08 00 00 0b fd 8f 60 40 00 46d+ ...          READ FPDMA QUEUED

Error 4 [3] occurred at disk power-on lifetime: 49613 hours (2067 days + 5 hours)
  When the command that caused the error occurred, the device was active or idle.

  After command completion occurred, registers were:
  ER -- ST COUNT  LBA_48  LH LM LL DV DC
  -- -- -- == -- == == == -- -- -- -- --
  40 -- 51 00 00 00 00 0b fd 8c f8 00 00  Error: UNC at LBA = 0x0bfd8cf8 = 201166072

  Commands leading to the command that caused the error were:
  CR FEATR COUNT  LBA_48  LH LM LL DV DC  Powered_Up_Time  Command/Feature_Name
  -- == -- == -- == == == -- -- -- -- --  ---------------  --------------------
  60 00 00 00 08 00 00 0b fd 8c f8 40 00 46d+ ...          READ FPDMA QUEUED
  2f 00 00 00 01 00 00 00 00 00 10 00 00 46d+ ...          READ LOG EXT
  60 00 00 00 08 00 00 0b fd 8c f8 40 00 46d+ ...          READ FPDMA QUEUED
  60 00 00 00 08 00 00 0b fd 8c f0 40 00 46d+ ...          READ FPDMA QUEUED
  60 00 00 00 08 00 00 0b fd 8c e8 40 00 46d+ ...          READ FPDMA QUEUED

Error 3 [2] occurred at disk power-on lifetime: 49613 hours (2067 days + 5 hours)
  When the command that caused the error occurred, the device was active or idle.

  After command completion occurred, registers were:
  ER -- ST COUNT  LBA_48  LH LM LL DV DC
  -- -- -- == -- == == == -- -- -- -- --
  40 -- 51 00 00 00 00 0b fd 8c f8 00 00  Error: UNC at LBA = 0x0bfd8cf8 = 201166072

  Commands leading to the command that caused the error were:
  CR FEATR COUNT  LBA_48  LH LM LL DV DC  Powered_Up_Time  Command/Feature_Name
  -- == -- == -- == == == -- -- -- -- --  ---------------  --------------------
  60 00 00 00 08 00 00 0b fd 8c f8 40 00 46d+ ...          READ FPDMA QUEUED
  60 00 00 00 08 00 00 0b fd 8c f0 40 00 46d+ ...          READ FPDMA QUEUED
  60 00 00 00 08 00 00 0b fd 8c e8 40 00 46d+ ...          READ FPDMA QUEUED
  60 00 00 00 08 00 00 0b fd 8c e0 40 00 46d+ ...          READ FPDMA QUEUED
  60 00 00 00 08 00 00 0b fd 8c d8 40 00 46d+ ...          READ FPDMA QUEUED

Error 2 [1] occurred at disk power-on lifetime: 49613 hours (2067 days + 5 hours)
  When the command that caused the error occurred, the device was active or idle.

  After command completion occurred, registers were:
  ER -- ST COUNT  LBA_48  LH LM LL DV DC
  -- -- -- == -- == == == -- -- -- -- --
  40 -- 51 00 00 00 00 0b fd 8f 80 00 00  Error: UNC at LBA = 0x0bfd8f80 = 201166720

  Commands leading to the command that caused the error were:
  CR FEATR COUNT  LBA_48  LH LM LL DV DC  Powered_Up_Time  Command/Feature_Name
  -- == -- == -- == == == -- -- -- -- --  ---------------  --------------------
  60 00 00 00 08 00 00 0b fd 8c 40 40 00 46d+ ...          READ FPDMA QUEUED
  60 00 00 00 08 00 02 19 86 5d 08 40 00 46d+ ...          READ FPDMA QUEUED
  60 00 00 00 08 00 02 19 86 5d 00 40 00 46d+ ...          READ FPDMA QUEUED
  60 00 00 00 08 00 02 1b 8a 37 20 40 00 46d+ ...          READ FPDMA QUEUED
  61 00 00 00 08 00 00 01 19 8b 70 40 00 46d+ ...          WRITE FPDMA QUEUED

Error 1 [0] occurred at disk power-on lifetime: 49613 hours (2067 days + 5 hours)
  When the command that caused the error occurred, the device was active or idle.

  After command completion occurred, registers were:
  ER -- ST COUNT  LBA_48  LH LM LL DV DC
  -- -- -- == -- == == == -- -- -- -- --
  40 -- 51 00 00 00 00 0b fd 8c f8 00 00  Error: UNC at LBA = 0x0bfd8cf8 = 201166072

  Commands leading to the command that caused the error were:
  CR FEATR COUNT  LBA_48  LH LM LL DV DC  Powered_Up_Time  Command/Feature_Name
  -- == -- == -- == == == -- -- -- -- --  ---------------  --------------------
  60 00 00 01 00 00 00 0b fd 90 40 40 00 46d+ ...          READ FPDMA QUEUED
  60 00 00 01 00 00 00 0b fd 8f 40 40 00 46d+ ...          READ FPDMA QUEUED
  60 00 00 01 00 00 00 0b fd 8e 40 40 00 46d+ ...          READ FPDMA QUEUED
  60 00 00 01 00 00 00 0b fd 8d 40 40 00 46d+ ...          READ FPDMA QUEUED
  60 00 00 01 00 00 00 0b fd 8c 40 40 00 46d+ ...          READ FPDMA QUEUED

SMART Extended Self-test Log Version: 1 (1 sectors)
Num  Test_Description    Status                  Remaining  LifeTime(hours)  LBA_of_first_error
# 1  Extended offline    Completed without error       00%     35204         -
# 2  Extended offline    Completed without error       00%     34816         -

SMART Selective self-test log data structure revision number 1
 SPAN  MIN_LBA  MAX_LBA  CURRENT_TEST_STATUS
    1        0        0  Not_testing
    2        0        0  Not_testing
    3        0        0  Not_testing
    4        0        0  Not_testing
    5        0        0  Not_testing
Selective self-test flags (0x0):
  After scanning selected spans, do NOT read-scan remainder of disk.
If Selective self-test is pending on power-up, resume after 0 minute delay.

SCT Status Version:                  3
SCT Version (vendor specific):       522 (0x020a)
Device State:                        Active (0)
Current Temperature:                    45 Celsius
Power Cycle Min/Max Temperature:     39/46 Celsius
Lifetime    Min/Max Temperature:     23/57 Celsius
Under/Over Temperature Limit Count:   0/114

SCT Temperature History Version:     2
Temperature Sampling Period:         3 minutes
Temperature Logging Interval:        59 minutes
Min/Max recommended Temperature:      0/ 0 Celsius
Min/Max Temperature Limit:            0/ 0 Celsius
Temperature History Size (Index):    128 (11)

SCT Error Recovery Control:
           Read:    100 (10.0 seconds)
          Write:    100 (10.0 seconds)

Device Statistics (GP Log 0x04)
Page  Offset Size        Value Flags Description
0x01  =====  =               =  ===  == General Statistics (rev 2) ==
0x01  0x008  4              27  ---  Lifetime Power-On Resets
0x01  0x010  4           49997  ---  Power-on Hours
0x01  0x018  6    406424662240  ---  Logical Sectors Written
0x01  0x020  6      1309253107  ---  Number of Write Commands
0x01  0x028  6 105572778344524  ---  Logical Sectors Read
0x01  0x030  6      6363374934  ---  Number of Read Commands
0x01  0x038  6               -  ---  Date and Time TimeStamp
0x03  =====  =               =  ===  == Rotating Media Statistics (rev 1) ==
0x03  0x008  4           49894  ---  Spindle Motor Power-on Hours
0x03  0x010  4             953  ---  Head Flying Hours
0x03  0x018  4           15147  ---  Head Load Events
0x03  0x020  4               8  ---  Number of Reallocated Logical Sectors
0x03  0x028  4               6  ---  Read Recovery Attempts
0x03  0x030  4               0  ---  Number of Mechanical Start Failures
0x04  =====  =               =  ===  == General Errors Statistics (rev 1) ==
0x04  0x008  4               7  ---  Number of Reported Uncorrectable Errors
0x04  0x010  4               0  ---  Resets Between Cmd Acceptance and Completion
0x05  =====  =               =  ===  == Temperature Statistics (rev 1) ==
0x05  0x008  1              45  N--  Current Temperature
0x05  0x010  1              42  N--  Average Short Term Temperature
0x05  0x018  1              42  N--  Average Long Term Temperature
0x05  0x020  1              57  N--  Highest Temperature
0x05  0x028  1              23  N--  Lowest Temperature
0x05  0x030  1              57  N--  Highest Average Short Term Temperature
0x05  0x038  1              42  N--  Lowest Average Short Term Temperature
0x05  0x040  1              57  N--  Highest Average Long Term Temperature
0x05  0x048  1               1  N--  Lowest Average Long Term Temperature
0x05  0x050  4            5222  ---  Time in Over-Temperature
0x05  0x058  1              55  ---  Specified Maximum Operating Temperature
0x05  0x060  4               0  ---  Time in Under-Temperature
0x05  0x068  1              13  ---  Specified Minimum Operating Temperature
0x06  =====  =               =  ===  == Transport Statistics (rev 1) ==
                                |||_ C monitored condition met
                                ||__ D supports DSN
                                |___ N normalized value

SATA Phy Event Counters (GP Log 0x11)
ID      Size     Value  Description
0x000a  2            2  Device-to-host register FISes sent due to a COMRESET
0x0001  2            0  Command failed due to ICRC error
0x0003  2            0  R_ERR response for device-to-host data FIS
0x0004  2            0  R_ERR response for host-to-device data FIS
0x0006  2            0  R_ERR response for device-to-host non-data FIS
0x0007  2            0  R_ERR response for host-to-device non-data FIS

