smartctl 7.0 2019-05-21 r4916 [x86_64-linux-3.10.0-957...] (local build)
Copyright (C) 2002-18, Bruce Allen, Christian Franke, www.smartmontools.org

=== START OF INFORMATION SECTION ===
Model Family:     SAMSUNG SpinPoint F3
Device Model:     SAMSUNG HD103SJ
Serial Number:    --
LU WWN Device Id: 5 0024e9 ...
Firmware Version: 1AJ10001
User Capacity:    1,000,204,886,016 bytes [1.00 TB]
Sector Size:      512 bytes logical/physical
Rotation Rate:    7200 rpm
Form Factor:      3.5 inches
Device is:        In smartctl database [for details use: -P show]
ATA Version is:   ATA8-ACS T13/1699-D revision 6
SATA Version is:  SATA 2.6, 3.0 Gb/s
Local Time is:    Fri Jul ... 2020 +07

AAM level is:     254 (maximum performance), recommended: 254
APM level is:     224 (intermediate level without standby)
Rd look-ahead is: Enabled
Write cache is:   Enabled
ATA Security is:  Disabled, NOT FROZEN [SEC1]

=== START OF READ SMART DATA SECTION ===
SMART overall-health self-assessment test result: PASSED

General SMART Values:
Offline data collection status:  (0x00)	Offline data collection activity
					was never started.

Self-test execution status:      (   0)	The previous self-test routine completed
					without error or no self-test has ever 
					been run.
Total time to complete Offline 
data collection: 		( 9420) seconds.
Offline data collection
capabilities: 			 (0x5b) SMART execute Offline immediate.

					Suspend Offline collection upon new
					command.
					Offline surface scan supported.
					Self-test supported.
					No Conveyance Self-test supported.
					Selective Self-test supported.
SMART capabilities:            (0x0003)	Saves SMART data before entering
					power-saving mode.

Error logging capability:        (0x01)	Error logging supported.
					General Purpose Logging supported.
Short self-test routine 
recommended polling time: 	 (   2) minutes.
Extended self-test routine
recommended polling time: 	 ( 157) minutes.
SCT capabilities: 	       (0x003f)	SCT Status supported.
					SCT Error Recovery Control supported.
					SCT Feature Control supported.
					SCT Data Table supported.

SMART Attributes Data Structure revision number: 16
Vendor Specific SMART Attributes with Thresholds:
ID# ATTRIBUTE_NAME          FLAGS    VALUE WORST THRESH FAIL RAW_VALUE
  1 Raw_Read_Error_Rate     POSR-K   100   100   051    -    2084
  2 Throughput_Performance  -OS--K   252   252   000    -    0
  3 Spin_Up_Time            PO---K   070   069   025    -    9206
  4 Start_Stop_Count        -O--CK   100   100   000    -    66
  5 Reallocated_Sector_Ct   PO--CK   252   252   010    -    0
  7 Seek_Error_Rate         -OSR-K   252   252   051    -    0
  8 Seek_Time_Performance   --S--K   252   252   015    -    0
  9 Power_On_Hours          -O--CK   100   100   000    -    66566
 10 Spin_Retry_Count        -O--CK   252   252   051    -    0
 11 Calibration_Retry_Count -O--CK   252   252   000    -    0
 12 Power_Cycle_Count       -O--CK   100   100   000    -    72
191 G-Sense_Error_Rate      -O---K   100   100   000    -    376
192 Power-Off_Retract_Count -O---K   252   252   000    -    0
194 Temperature_Celsius     -O----   064   064   000    -    24 (Min/Max 15/55)
195 Hardware_ECC_Recovered  -O-RCK   100   100   000    -    0
196 Reallocated_Event_Count -O--CK   252   252   000    -    0
197 Current_Pending_Sector  -O--CK   100   100   000    -    4
198 Offline_Uncorrectable   ----CK   252   252   000    -    0
199 UDMA_CRC_Error_Count    -OS-CK   100   100   000    -    8
200 Multi_Zone_Error_Rate   -O-R-K   100   100   000    -    13912
223 Load_Retry_Count        -O--CK   252   252   000    -    0
225 Load_Cycle_Count        -O--CK   100   100   000    -    1880
                            ||||||_ K auto-keep
                            |||||__ C event count
                            ||||___ R error rate
                            |||____ S speed/performance
                            ||_____ O updated online
                            |______ P prefailure warning

General Purpose Log Directory Version 1
SMART           Log Directory Version 1 [multi-sector log support]
Address    Access  R/W   Size  Description
0x00       GPL,SL  R/O      1  Log Directory
0x01           SL  R/O      1  Summary SMART error log
0x02           SL  R/O      2  Comprehensive SMART error log
0x03       GPL     R/O      2  Ext. Comprehensive SMART error log
0x06           SL  R/O      1  SMART self-test log
0x07       GPL     R/O      2  Extended self-test log
0x08       GPL     R/O      2  Power Conditions log
0x09           SL  R/W      1  Selective self-test log
0x10       GPL     R/O      1  NCQ Command Error log
0x11       GPL     R/O      1  SATA Phy Event Counters log
0x80-0x9f  GPL,SL  R/W     16  Host vendor specific log
0xe0       GPL,SL  R/W      1  SCT Command/Status
0xe1       GPL,SL  R/W      1  SCT Data Transfer

SMART Extended Comprehensive Error Log Version: 1 (2 sectors)
Device Error Count: 180 (device log contains only the most recent 8 errors)
	CR     = Command Register
	FEATR  = Features Register
	COUNT  = Count (was: Sector Count) Register
	LBA_48 = Upper bytes of LBA High/Mid/Low Registers ]  ATA-8
	LH     = LBA High (was: Cylinder High) Register    ]   LBA
	LM     = LBA Mid (was: Cylinder Low) Register      ] Register
	LL     = LBA Low (was: Sector Number) Register     ]
	DV     = Device (was: Device/Head) Register
	DC     = Device Control Register
	ER     = Error register
	ST     = Status register
Powered_Up_Time is measured from power on, and printed as
DDd+hh:mm:SS.sss where DD=days, hh=hours, mm=minutes,
SS=sec, and sss=millisec. It "wraps" after 49.710 days.

Error 180 [3] occurred at disk power-on lifetime: 822 hours (34 days + 6 hours)
  When the command that caused the error occurred, the device was active or idle.

  After command completion occurred, registers were:
  ER -- ST COUNT  LBA_48  LH LM LL DV DC
  -- -- -- == -- == == == -- -- -- -- --
  40 -- 51 00 08 00 00 2c d7 e6 00 40 00  Error: UNC at LBA = 0x2cd7e600 = 752346624

  Commands leading to the command that caused the error were:
  CR FEATR COUNT  LBA_48  LH LM LL DV DC  Powered_Up_Time  Command/Feature_Name
  -- == -- == -- == == == -- -- -- -- --  ---------------  --------------------
  60 00 90 00 08 00 00 2c d7 e6 00 40 00     00:02:43.579  READ FPDMA QUEUED
  60 00 90 00 08 00 00 2c d7 e6 00 40 00     00:02:43.591  READ FPDMA QUEUED
  ef 00 90 00 03 00 00 00 00 00 00 a0 00     00:02:43.591  SET FEATURES [Disable SATA feature]
  ef 00 10 00 02 00 00 00 00 00 00 a0 00     00:02:43.591  SET FEATURES [Enable SATA feature]
  27 00 00 00 00 00 00 00 00 00 00 e0 00     00:02:43.591  READ NATIVE MAX ADDRESS EXT [OBS-ACS-3]

Error 179 [2] occurred at disk power-on lifetime: 822 hours (34 days + 6 hours)
  When the command that caused the error occurred, the device was active or idle.

  After command completion occurred, registers were:
  ER -- ST COUNT  LBA_48  LH LM LL DV DC
  -- -- -- == -- == == == -- -- -- -- --
  40 -- 51 00 08 00 00 2c d7 e6 00 40 00  Error: UNC at LBA = 0x2cd7e600 = 752346624

  Commands leading to the command that caused the error were:
  CR FEATR COUNT  LBA_48  LH LM LL DV DC  Powered_Up_Time  Command/Feature_Name
  -- == -- == -- == == == -- -- -- -- --  ---------------  --------------------
  60 00 90 00 08 00 00 2c d7 e6 00 40 00     00:02:43.579  READ FPDMA QUEUED
  60 00 90 00 08 00 00 2c d7 e6 00 40 00     00:02:43.590  READ FPDMA QUEUED
  ef 00 90 00 03 00 00 00 00 00 00 a0 00     00:02:43.590  SET FEATURES [Disable SATA feature]
  ef 00 10 00 02 00 00 00 00 00 00 a0 00     00:02:43.590  SET FEATURES [Enable SATA feature]
  27 00 00 00 00 00 00 00 00 00 00 e0 00     00:02:43.590  READ NATIVE MAX ADDRESS EXT [OBS-ACS-3]

Error 178 [1] occurred at disk power-on lifetime: 822 hours (34 days + 6 hours)
  When the command that caused the error occurred, the device was active or idle.

  After command completion occurred, registers were:
  ER -- ST COUNT  LBA_48  LH LM LL DV DC
  -- -- -- == -- == == == -- -- -- -- --
  40 -- 51 00 07 00 00 2c d7 e6 01 40 00  Error: UNC at LBA = 0x2cd7e601 = 752346625

  Commands leading to the command that caused the error were:
  CR FEATR COUNT  LBA_48  LH LM LL DV DC  Powered_Up_Time  Command/Feature_Name
  -- == -- == -- == == == -- -- -- -- --  ---------------  --------------------
  60 00 90 00 08 00 00 2c d7 e6 00 40 00     00:02:43.579  READ FPDMA QUEUED
  60 00 90 00 08 00 00 2c d7 e6 00 40 00     00:02:43.588  READ FPDMA QUEUED
  ef 00 90 00 03 00 00 00 00 00 00 a0 00     00:02:43.588  SET FEATURES [Disable SATA feature]
  ef 00 10 00 02 00 00 00 00 00 00 a0 00     00:02:43.588  SET FEATURES [Enable SATA feature]
  27 00 00 00 00 00 00 00 00 00 00 e0 00     00:02:43.588  READ NATIVE MAX ADDRESS EXT [OBS-ACS-3]

Error 177 [0] occurred at disk power-on lifetime: 822 hours (34 days + 6 hours)
  When the command that caused the error occurred, the device was active or idle.

  After command completion occurred, registers were:
  ER -- ST COUNT  LBA_48  LH LM LL DV DC
  -- -- -- == -- == == == -- -- -- -- --
  40 -- 51 00 08 00 00 2c d7 e6 00 40 00  Error: UNC at LBA = 0x2cd7e600 = 752346624

  Commands leading to the command that caused the error were:
  CR FEATR COUNT  LBA_48  LH LM LL DV DC  Powered_Up_Time  Command/Feature_Name
  -- == -- == -- == == == -- -- -- -- --  ---------------  --------------------
  60 00 90 00 08 00 00 2c d7 e6 00 40 00     00:02:43.579  READ FPDMA QUEUED
  60 00 00 00 08 00 00 2c d7 e6 00 40 08     00:02:43.586  READ FPDMA QUEUED
  61 00 90 00 08 00 00 3c a3 f1 00 40 00     00:02:43.580  WRITE FPDMA QUEUED
  61 00 90 00 08 00 00 3c 3f d5 98 40 00     00:02:43.580  WRITE FPDMA QUEUED
  61 00 90 00 10 00 00 2c b3 4f 90 40 00     00:02:43.580  WRITE FPDMA QUEUED

Error 176 [7] occurred at disk power-on lifetime: 822 hours (34 days + 6 hours)
  When the command that caused the error occurred, the device was active or idle.

  After command completion occurred, registers were:
  ER -- ST COUNT  LBA_48  LH LM LL DV DC
  -- -- -- == -- == == == -- -- -- -- --
  40 -- 51 00 08 00 00 2c d7 e6 00 40 00  Error: UNC at LBA = 0x2cd7e600 = 752346624

  Commands leading to the command that caused the error were:
  CR FEATR COUNT  LBA_48  LH LM LL DV DC  Powered_Up_Time  Command/Feature_Name
  -- == -- == -- == == == -- -- -- -- --  ---------------  --------------------
  60 00 00 00 08 00 00 2c d7 e6 00 40 08     00:02:43.553  READ FPDMA QUEUED
  60 00 90 00 08 00 00 2c d7 e6 00 40 00     00:02:43.555  READ FPDMA QUEUED
  ef 00 90 00 03 00 00 00 00 00 00 a0 00     00:02:43.555  SET FEATURES [Disable SATA feature]
  ef 00 10 00 02 00 00 00 00 00 00 a0 00     00:02:43.555  SET FEATURES [Enable SATA feature]
  27 00 00 00 00 00 00 00 00 00 00 e0 00     00:02:43.555  READ NATIVE MAX ADDRESS EXT [OBS-ACS-3]

Error 175 [6] occurred at disk power-on lifetime: 822 hours (34 days + 6 hours)
  When the command that caused the error occurred, the device was active or idle.

  After command completion occurred, registers were:
  ER -- ST COUNT  LBA_48  LH LM LL DV DC
  -- -- -- == -- == == == -- -- -- -- --
  40 -- 51 00 08 00 00 2c d7 e6 00 40 00  Error: UNC at LBA = 0x2cd7e600 = 752346624

  Commands leading to the command that caused the error were:
  CR FEATR COUNT  LBA_48  LH LM LL DV DC  Powered_Up_Time  Command/Feature_Name
  -- == -- == -- == == == -- -- -- -- --  ---------------  --------------------
  60 00 00 00 08 00 00 2c d7 e6 00 40 08     00:02:43.553  READ FPDMA QUEUED
  60 00 00 00 08 00 00 2c d7 e6 00 40 08     00:02:43.554  READ FPDMA QUEUED
  60 00 00 00 f8 00 00 3a 72 ec 28 40 08     00:02:43.554  READ FPDMA QUEUED
  60 00 00 01 00 00 00 3a 72 eb 28 40 08     00:02:43.554  READ FPDMA QUEUED
  60 00 00 01 00 00 00 3a 72 ea 28 40 08     00:02:43.554  READ FPDMA QUEUED

Error 174 [5] occurred at disk power-on lifetime: 822 hours (34 days + 6 hours)
  When the command that caused the error occurred, the device was active or idle.

  After command completion occurred, registers were:
  ER -- ST COUNT  LBA_48  LH LM LL DV DC
  -- -- -- == -- == == == -- -- -- -- --
  40 -- 51 00 08 00 00 2c d7 e6 00 40 00  Error: UNC at LBA = 0x2cd7e600 = 752346624

  Commands leading to the command that caused the error were:
  CR FEATR COUNT  LBA_48  LH LM LL DV DC  Powered_Up_Time  Command/Feature_Name
  -- == -- == -- == == == -- -- -- -- --  ---------------  --------------------
  60 00 00 00 08 00 00 2c d7 e6 00 40 08     00:02:43.536  READ FPDMA QUEUED
  60 00 00 00 08 00 00 2c d7 e6 00 40 08     00:02:43.541  READ FPDMA QUEUED
  61 00 00 00 08 00 00 00 20 60 00 40 08     00:02:43.541  WRITE FPDMA QUEUED
  61 00 00 00 08 00 00 00 25 14 c8 40 08     00:02:43.541  WRITE FPDMA QUEUED
  61 00 00 00 08 00 00 00 25 18 48 40 08     00:02:43.541  WRITE FPDMA QUEUED

Error 173 [4] occurred at disk power-on lifetime: 822 hours (34 days + 6 hours)
  When the command that caused the error occurred, the device was active or idle.

  After command completion occurred, registers were:
  ER -- ST COUNT  LBA_48  LH LM LL DV DC
  -- -- -- == -- == == == -- -- -- -- --
  40 -- 51 00 08 00 00 2c d7 e6 00 40 00  Error: WP at LBA = 0x2cd7e600 = 752346624

  Commands leading to the command that caused the error were:
  CR FEATR COUNT  LBA_48  LH LM LL DV DC  Powered_Up_Time  Command/Feature_Name
  -- == -- == -- == == == -- -- -- -- --  ---------------  --------------------
  61 00 90 00 08 00 00 00 20 60 00 40 00     00:02:43.540  WRITE FPDMA QUEUED
  60 00 00 00 08 00 00 2c d7 e6 00 40 08     00:02:43.536  READ FPDMA QUEUED
  60 00 90 00 08 00 00 2c d7 e6 00 40 00     00:02:43.539  READ FPDMA QUEUED
  60 00 90 01 00 00 00 2c d7 e7 00 40 00     00:02:43.539  READ FPDMA QUEUED
  ef 00 90 00 03 00 00 00 00 00 00 a0 00     00:02:43.539  SET FEATURES [Disable SATA feature]

SMART Extended Self-test Log Version: 1 (2 sectors)
No self-tests have been logged.  [To run self-tests, use: smartctl -t]

SMART Selective self-test log data structure revision number 0

 SPAN  MIN_LBA  MAX_LBA  CURRENT_TEST_STATUS
    1        0        0  Completed [00% left] (0-65535)
    2        0        0  Not_testing
    3        0        0  Not_testing
    4        0        0  Not_testing
    5        0        0  Not_testing
Selective self-test flags (0x0):
  After scanning selected spans, do NOT read-scan remainder of disk.
If Selective self-test is pending on power-up, resume after 0 minute delay.

SCT Status Version:                  2
SCT Version (vendor specific):       256 (0x0100)
Device State:                        Active (0)
Current Temperature:                    24 Celsius
Power Cycle Min/Max Temperature:     23/26 Celsius
Lifetime    Min/Max Temperature:     15/72 Celsius
Specified Max Operating Temperature:    80 Celsius
Under/Over Temperature Limit Count:   0/0

SCT Temperature History Version:     2
Temperature Sampling Period:         5 minutes
Temperature Logging Interval:        5 minutes
Min/Max recommended Temperature:     -5/80 Celsius
Min/Max Temperature Limit:           -10/85 Celsius
Temperature History Size (Index):    128 (81)

SCT Error Recovery Control:
           Read: Disabled
          Write: Disabled

SATA Phy Event Counters (GP Log 0x11)
ID      Size     Value  Description
0x0001  4            1  Command failed due to ICRC error
0x0002  4            1  R_ERR response for data FIS
0x0003  4            1  R_ERR response for device-to-host data FIS
0x0004  4            0  R_ERR response for host-to-device data FIS
0x0005  4            0  R_ERR response for non-data FIS
0x0006  4            0  R_ERR response for device-to-host non-data FIS
0x0007  4            0  R_ERR response for host-to-device non-data FIS
0x0008  4            0  Device-to-host non-data FIS retries
0x0009  4      2548936  Transition from drive PhyRdy to drive PhyNRdy
0x000a  4           65  Device-to-host register FISes sent due to a COMRESET
0x000b  4            0  CRC errors within host-to-device FIS
0x000d  4            0  Non-CRC errors within host-to-device FIS
0x000f  4            0  R_ERR response for host-to-device data FIS, CRC
0x0010  4            0  R_ERR response for host-to-device data FIS, non-CRC
0x0012  4            0  R_ERR response for host-to-device non-data FIS, CRC
0x0013  4            0  R_ERR response for host-to-device non-data FIS, non-CRC
0x8e00  4            0  Vendor specific
0x8e01  4            1  Vendor specific
0x8e02  4            0  Vendor specific
0x8e03  4            0  Vendor specific
0x8e04  4            0  Vendor specific
0x8e05  4            0  Vendor specific
0x8e06  4        10914  Vendor specific
0x8e07  4      2358823  Vendor specific
0x8e08  4           49  Vendor specific
0x8e09  4      4772591  Vendor specific
0x8e0a  4     12332226  Vendor specific
0x8e0b  4    319369088  Vendor specific
0x8e0c  4     27802782  Vendor specific
0x8e0d  4      6843697  Vendor specific
0x8e0e  4      2688129  Vendor specific
0x8e0f  4            0  Vendor specific
0x8e10  4     10752516  Vendor specific
0x8e11  4            1  Vendor specific

