smartctl 6.6 2017-11-05 r4594 [x86_64-linux-3.10.0-862...] (local build)
Copyright (C) 2002-17, Bruce Allen, Christian Franke, www.smartmontools.org

=== START OF INFORMATION SECTION ===
Model Family:     Hitachi Deskstar 7K1000
Device Model:     HDS721010KLA330
Serial Number:    --
LU WWN Device Id: 5 000cca ...
Firmware Version: GKAOAB0A
User Capacity:    1,000,204,886,016 bytes [1.00 TB]
Sector Size:      512 bytes logical/physical
Device is:        In smartctl database [for details use: -P show]
ATA Version is:   ATA/ATAPI-7 T13/1532D revision 1
Local Time is:    --

=== START OF READ SMART DATA SECTION ===
SMART overall-health self-assessment test result: PASSED

SMART Attributes Data Structure revision number: 16
Vendor Specific SMART Attributes with Thresholds:
ID# ATTRIBUTE_NAME          FLAGS    VALUE WORST THRESH FAIL RAW_VALUE
  1 Raw_Read_Error_Rate     PO-R--   100   100   016    -    0
  2 Throughput_Performance  P-S---   100   100   054    -    0
  3 Spin_Up_Time            POS---   108   108   024    -    664 (Average 631)
  4 Start_Stop_Count        -O--C-   100   100   000    -    36
  5 Reallocated_Sector_Ct   PO--CK   100   100   005    -    1
  7 Seek_Error_Rate         PO-R--   100   100   067    -    0
  8 Seek_Time_Performance   P-S---   136   136   020    -    31
  9 Power_On_Hours          -O--C-   090   090   000    -    76051
 10 Spin_Retry_Count        PO--C-   100   100   060    -    0
 12 Power_Cycle_Count       -O--CK   100   100   000    -    34
192 Power-Off_Retract_Count -O--CK   100   100   000    -    805
193 Load_Cycle_Count        -O--C-   100   100   000    -    805
194 Temperature_Celsius     -O----   240   240   000    -    25 (Min/Max 17/47)
196 Reallocated_Event_Count -O--CK   100   100   000    -    1
197 Current_Pending_Sector  -O---K   100   100   000    -    2
198 Offline_Uncorrectable   ---R--   100   100   000    -    0
199 UDMA_CRC_Error_Count    -O-R--   200   200   000    -    0
                            ||||||_ K auto-keep
                            |||||__ C event count
                            ||||___ R error rate
                            |||____ S speed/performance
                            ||_____ O updated online
                            |______ P prefailure warning

SMART Extended Comprehensive Error Log Version: 1 (1 sectors)
No Errors Logged

