smartctl 7.1 2020-06-20 r5066 [x86_64-linux-3.10.0-1160...] (local build)
Copyright (C) 2002-19, Bruce Allen, Christian Franke, www.smartmontools.org

=== START OF INFORMATION SECTION ===
Model Number:                       INTEL SSDPEKKW512G8
Serial Number:                      --
Firmware Version:                   004C
PCI Vendor/Subsystem ID:            0x8086
IEEE OUI Identifier:                0x5cd2e4
Controller ID:                      1
Number of Namespaces:               1
Namespace 1 Size/Capacity:          512,110,190,592 [512 GB]
Namespace 1 Formatted LBA Size:     512
Local Time is:                      Mon May ... 2022 CEST

=== START OF READ SMART DATA SECTION ===
SMART overall-health self-assessment test result: PASSED

SMART/Health Information (NVMe Log 0x02)
Critical Warning:                   0x00
Temperature:                        35 Celsius
Available Spare:                    100%
Available Spare Threshold:          12%
Percentage Used:                    0%
Data Units Read:                    1,115,773 [571 GB]
Data Units Written:                 1,098,985 [562 GB]
Host Read Commands:                 26,374,294
Host Write Commands:                21,172,266
Controller Busy Time:               54
Power Cycles:                       3
Power On Hours:                     1,147
Unsafe Shutdowns:                   0
Media and Data Integrity Errors:    0
Error Information Log Entries:      0
Warning  Comp. Temperature Time:    0
Critical Comp. Temperature Time:    0

