smartctl 7.1 2020-06-20 r5066 [x86_64-linux-3.10.0-1160...] (local build)
Copyright (C) 2002-19, Bruce Allen, Christian Franke, www.smartmontools.org

=== START OF INFORMATION SECTION ===
Model Number:                       WUS4BB019D7P3E1
Serial Number:                      --
Firmware Version:                   R1110012
PCI Vendor/Subsystem ID:            0x1b96
IEEE OUI Identifier:                0x0014ee
Total NVM Capacity:                 1,920,383,410,176 [1.92 TB]
Unallocated NVM Capacity:           0
Controller ID:                      0
Number of Namespaces:               1
Namespace 1 Size/Capacity:          1,920,383,410,176 [1.92 TB]
Namespace 1 Formatted LBA Size:     4096
Namespace 1 IEEE EUI-64:            0014ee ...
Local Time is:                      Wed Apr ... 2022 UTC

=== START OF READ SMART DATA SECTION ===
SMART overall-health self-assessment test result: PASSED

SMART/Health Information (NVMe Log 0x02)
Critical Warning:                   0x00
Temperature:                        49 Celsius
Available Spare:                    100%
Available Spare Threshold:          10%
Percentage Used:                    1%
Data Units Read:                    179,589,777 [91.9 TB]
Data Units Written:                 238,194,382 [121 TB]
Host Read Commands:                 2,557,467,387
Host Write Commands:                5,934,681,206
Controller Busy Time:               572,666
Power Cycles:                       8
Power On Hours:                     10,122
Unsafe Shutdowns:                   3
Media and Data Integrity Errors:    0
Error Information Log Entries:      3
Warning  Comp. Temperature Time:    0
Critical Comp. Temperature Time:    0
Temperature Sensor 1:               46 Celsius

