smartctl 7.1 2019-12-30 r5022 [x86_64-linux-3.10.0-1062...] (local build)
Copyright (C) 2002-19, Bruce Allen, Christian Franke, www.smartmontools.org

=== START OF INFORMATION SECTION ===
Model Number:                       WUS4BB019D7P3E1
Serial Number:                      --
Firmware Version:                   R1110012
PCI Vendor/Subsystem ID:            0x1b96
IEEE OUI Identifier:                0x0014ee
Total NVM Capacity:                 1,920,383,410,176 [1.92 TB]
Unallocated NVM Capacity:           0
Controller ID:                      0
Number of Namespaces:               1
Namespace 1 Size/Capacity:          1,920,383,410,176 [1.92 TB]
Namespace 1 Formatted LBA Size:     4096
Namespace 1 IEEE EUI-64:            0014ee ...
Local Time is:                      --

=== START OF READ SMART DATA SECTION ===
SMART overall-health self-assessment test result: PASSED

SMART/Health Information (NVMe Log 0x02)
Critical Warning:                   0x00
Temperature:                        40 Celsius
Available Spare:                    100%
Available Spare Threshold:          10%
Percentage Used:                    0%
Data Units Read:                    102,201,077 [52.3 TB]
Data Units Written:                 112,632,653 [57.6 TB]
Host Read Commands:                 1,463,862,459
Host Write Commands:                2,848,899,165
Controller Busy Time:               339,022
Power Cycles:                       12
Power On Hours:                     6,004
Unsafe Shutdowns:                   7
Media and Data Integrity Errors:    0
Error Information Log Entries:      5
Warning  Comp. Temperature Time:    0
Critical Comp. Temperature Time:    0
Temperature Sensor 1:               40 Celsius

