smartctl 7.1 2020-06-20 r5066 [x86_64-linux-3.10.0-1127...] (local build)
Copyright (C) 2002-19, Bruce Allen, Christian Franke, www.smartmontools.org

=== START OF INFORMATION SECTION ===
Model Number:                       Force MP510
Serial Number:                      --
Firmware Version:                   ECFM22.5
PCI Vendor/Subsystem ID:            0x1987
IEEE OUI Identifier:                0x6479a7
Total NVM Capacity:                 1,920,383,410,176 [1.92 TB]
Unallocated NVM Capacity:           0
Controller ID:                      1
Number of Namespaces:               1
Namespace 1 Size/Capacity:          1,920,383,410,176 [1.92 TB]
Namespace 1 Formatted LBA Size:     512
Namespace 1 IEEE EUI-64:            6479a7 ...
Local Time is:                      --

=== START OF READ SMART DATA SECTION ===
SMART overall-health self-assessment test result: PASSED

SMART/Health Information (NVMe Log 0x02)
Critical Warning:                   0x00
Temperature:                        38 Celsius
Available Spare:                    100%
Available Spare Threshold:          5%
Percentage Used:                    9%
Data Units Read:                    875,211,030 [448 TB]
Data Units Written:                 216,967,605 [111 TB]
Host Read Commands:                 10,059,903,732
Host Write Commands:                6,147,337,217
Controller Busy Time:               40,394
Power Cycles:                       4
Power On Hours:                     10,823
Unsafe Shutdowns:                   2
Media and Data Integrity Errors:    0
Error Information Log Entries:      12
Warning  Comp. Temperature Time:    0
Critical Comp. Temperature Time:    0

