smartctl 7.0 2019-05-21 r4916 [x86_64-linux-3.10.0-957...] (local build)
Copyright (C) 2002-18, Bruce Allen, Christian Franke, www.smartmontools.org

=== START OF INFORMATION SECTION ===
Model Family:     Western Digital RE4
Device Model:     WDC WD2003FYYS-02W0B1
Serial Number:    --
LU WWN Device Id: 5 0014ee ...
Firmware Version: 01.01D02
User Capacity:    2,000,398,934,016 bytes [2.00 TB]
Sector Size:      512 bytes logical/physical
Rotation Rate:    7200 rpm
Device is:        In smartctl database [for details use: -P show]
ATA Version is:   ATA8-ACS (minor revision not indicated)
SATA Version is:  SATA 3.0, 3.0 Gb/s (current: 3.0 Gb/s)
Local Time is:    --
APM level is:     128 (minimum power consumption without standby)
Rd look-ahead is: Enabled
Write cache is:   Enabled
ATA Security is:  Disabled, NOT FROZEN [SEC1]

=== START OF READ SMART DATA SECTION ===
SMART overall-health self-assessment test result: PASSED
Warning: This result is based on an Attribute check.

General SMART Values:
Offline data collection status:  (0x82)	Offline data collection activity
					was completed without error.

Self-test execution status:      (   0)	The previous self-test routine completed
					without error or no self-test has ever 
					been run.
Total time to complete Offline 
data collection: 		(30000) seconds.
Offline data collection
capabilities: 			 (0x7b) SMART execute Offline immediate.

					Suspend Offline collection upon new
					command.
					Offline surface scan supported.
					Self-test supported.
					Conveyance Self-test supported.
					Selective Self-test supported.
SMART capabilities:            (0x0003)	Saves SMART data before entering
					power-saving mode.

Error logging capability:        (0x01)	Error logging supported.
					General Purpose Logging supported.
Short self-test routine 
recommended polling time: 	 (   2) minutes.
Extended self-test routine
recommended polling time: 	 ( 290) minutes.
Conveyance self-test routine
recommended polling time: 	 (   5) minutes.
SCT capabilities: 	       (0x303f)	SCT Status supported.
					SCT Error Recovery Control supported.
					SCT Feature Control supported.
					SCT Data Table supported.

SMART Attributes Data Structure revision number: 16
Vendor Specific SMART Attributes with Thresholds:
ID# ATTRIBUTE_NAME          FLAGS    VALUE WORST THRESH FAIL RAW_VALUE
  1 Raw_Read_Error_Rate     POSR-K   200   200   051    -    0
  3 Spin_Up_Time            POS--K   253   253   021    -    7216
  4 Start_Stop_Count        -O--CK   100   100   000    -    93
  5 Reallocated_Sector_Ct   PO--CK   200   200   140    -    0
  7 Seek_Error_Rate         -OSR-K   200   200   000    -    0
  9 Power_On_Hours          -O--CK   084   084   000    -    12033
 10 Spin_Retry_Count        -O--CK   100   253   000    -    0
 11 Calibration_Retry_Count -O--CK   100   253   000    -    0
 12 Power_Cycle_Count       -O--CK   100   100   000    -    93
192 Power-Off_Retract_Count -O--CK   200   200   000    -    83
193 Load_Cycle_Count        -O--CK   200   200   000    -    9
194 Temperature_Celsius     -O---K   105   098   000    -    47
196 Reallocated_Event_Count -O--CK   200   200   000    -    0
197 Current_Pending_Sector  -O--CK   200   200   000    -    0
198 Offline_Uncorrectable   ----CK   200   200   000    -    0
199 UDMA_CRC_Error_Count    -O--CK   200   200   000    -    0
200 Multi_Zone_Error_Rate   ---R--   200   200   000    -    3
                            ||||||_ K auto-keep
                            |||||__ C event count
                            ||||___ R error rate
                            |||____ S speed/performance
                            ||_____ O updated online
                            |______ P prefailure warning

SMART Log Directory Version 1 [multi-sector log support]
Address    Access  R/W   Size  Description
0x00           SL  R/O      1  Log Directory
0x01           SL  R/O      1  Summary SMART error log
0x02           SL  R/O      5  Comprehensive SMART error log
0x06           SL  R/O      1  SMART self-test log
0x09           SL  R/W      1  Selective self-test log
0x80-0x9f      SL  R/W     16  Host vendor specific log
0xa0-0xa7      SL  VS      16  Device vendor specific log
0xa8-0xb5      SL  VS       1  Device vendor specific log
0xb7           SL  VS       1  Device vendor specific log
0xbd           SL  VS       1  Device vendor specific log
0xc0           SL  VS       1  Device vendor specific log
0xe0           SL  R/W      1  SCT Command/Status
0xe1           SL  R/W      1  SCT Data Transfer

SMART Error Log Version: 1
No Errors Logged

SMART Self-test log structure revision number 1
No self-tests have been logged.  [To run self-tests, use: smartctl -t]

SMART Selective self-test log data structure revision number 1
 SPAN  MIN_LBA  MAX_LBA  CURRENT_TEST_STATUS
    1        0        0  Not_testing
    2        0        0  Not_testing
    3        0        0  Not_testing
    4        0        0  Not_testing
    5        0        0  Not_testing
Selective self-test flags (0x0):
  After scanning selected spans, do NOT read-scan remainder of disk.
If Selective self-test is pending on power-up, resume after 0 minute delay.

SCT Status Version:                  3
SCT Version (vendor specific):       258 (0x0102)
Device State:                        Active (0)
Current Temperature:                    47 Celsius
Power Cycle Min/Max Temperature:     27/52 Celsius
Lifetime    Min/Max Temperature:     27/54 Celsius
Under/Over Temperature Limit Count:   0/0

SCT Temperature History Version:     2
Temperature Sampling Period:         1 minute
Temperature Logging Interval:        1 minute
Min/Max recommended Temperature:      0/60 Celsius
Min/Max Temperature Limit:           -41/85 Celsius
Temperature History Size (Index):    478 (456)

Index    Estimated Time   Temperature Celsius
 457    2021-05-08 12:51    47  ****************************
 ...    ..( 70 skipped).    ..  ****************************
  50    2021-05-08 14:02    47  ****************************
  51    2021-05-08 14:03    48  *****************************
  52    2021-05-08 14:04    47  ****************************
  53    2021-05-08 14:05    47  ****************************
  54    2021-05-08 14:06    47  ****************************
  55    2021-05-08 14:07    48  *****************************
 ...    ..(  2 skipped).    ..  *****************************
  58    2021-05-08 14:10    48  *****************************
  59    2021-05-08 14:11    47  ****************************
  60    2021-05-08 14:12    48  *****************************
 ...    ..(  3 skipped).    ..  *****************************
  64    2021-05-08 14:16    48  *****************************
  65    2021-05-08 14:17    47  ****************************
  66    2021-05-08 14:18    47  ****************************
  67    2021-05-08 14:19    47  ****************************
  68    2021-05-08 14:20    48  *****************************
  69    2021-05-08 14:21    48  *****************************
  70    2021-05-08 14:22    48  *****************************
  71    2021-05-08 14:23    47  ****************************
  72    2021-05-08 14:24    47  ****************************
  73    2021-05-08 14:25    48  *****************************
 ...    ..(  2 skipped).    ..  *****************************
  76    2021-05-08 14:28    48  *****************************
  77    2021-05-08 14:29    47  ****************************
  78    2021-05-08 14:30    47  ****************************
  79    2021-05-08 14:31    48  *****************************
  80    2021-05-08 14:32    48  *****************************
  81    2021-05-08 14:33    47  ****************************
  82    2021-05-08 14:34    48  *****************************
  83    2021-05-08 14:35    48  *****************************
  84    2021-05-08 14:36    47  ****************************
  85    2021-05-08 14:37    48  *****************************
  86    2021-05-08 14:38    47  ****************************
  87    2021-05-08 14:39    48  *****************************
  88    2021-05-08 14:40    47  ****************************
  89    2021-05-08 14:41    48  *****************************
 ...    ..(169 skipped).    ..  *****************************
 259    2021-05-08 17:31    48  *****************************
 260    2021-05-08 17:32    47  ****************************
 261    2021-05-08 17:33    48  *****************************
 262    2021-05-08 17:34    48  *****************************
 263    2021-05-08 17:35    48  *****************************
 264    2021-05-08 17:36    47  ****************************
 265    2021-05-08 17:37    48  *****************************
 266    2021-05-08 17:38    47  ****************************
 267    2021-05-08 17:39    47  ****************************
 268    2021-05-08 17:40    47  ****************************
 269    2021-05-08 17:41    48  *****************************
 270    2021-05-08 17:42    48  *****************************
 271    2021-05-08 17:43    47  ****************************
 272    2021-05-08 17:44    48  *****************************
 ...    ..( 47 skipped).    ..  *****************************
 320    2021-05-08 18:32    48  *****************************
 321    2021-05-08 18:33    47  ****************************
 322    2021-05-08 18:34    48  *****************************
 ...    ..(  2 skipped).    ..  *****************************
 325    2021-05-08 18:37    48  *****************************
 326    2021-05-08 18:38    47  ****************************
 327    2021-05-08 18:39    47  ****************************
 328    2021-05-08 18:40    48  *****************************
 329    2021-05-08 18:41    47  ****************************
 ...    ..(  6 skipped).    ..  ****************************
 336    2021-05-08 18:48    47  ****************************
 337    2021-05-08 18:49    48  *****************************
 338    2021-05-08 18:50    47  ****************************
 339    2021-05-08 18:51    47  ****************************
 340    2021-05-08 18:52    48  *****************************
 341    2021-05-08 18:53    47  ****************************
 342    2021-05-08 18:54    47  ****************************
 343    2021-05-08 18:55    48  *****************************
 344    2021-05-08 18:56    47  ****************************
 345    2021-05-08 18:57    48  *****************************
 346    2021-05-08 18:58    48  *****************************
 347    2021-05-08 18:59    47  ****************************
 348    2021-05-08 19:00    48  *****************************
 349    2021-05-08 19:01    47  ****************************
 ...    ..( 82 skipped).    ..  ****************************
 432    2021-05-08 20:24    47  ****************************
 433    2021-05-08 20:25    46  ***************************
 434    2021-05-08 20:26    47  ****************************
 435    2021-05-08 20:27    47  ****************************
 436    2021-05-08 20:28    46  ***************************
 437    2021-05-08 20:29    47  ****************************
 ...    ..(  4 skipped).    ..  ****************************
 442    2021-05-08 20:34    47  ****************************
 443    2021-05-08 20:35    46  ***************************
 444    2021-05-08 20:36    47  ****************************
 445    2021-05-08 20:37    47  ****************************
 446    2021-05-08 20:38    46  ***************************
 447    2021-05-08 20:39    47  ****************************
 ...    ..(  2 skipped).    ..  ****************************
 450    2021-05-08 20:42    47  ****************************
 451    2021-05-08 20:43    46  ***************************
 452    2021-05-08 20:44    47  ****************************
 ...    ..(  3 skipped).    ..  ****************************
 456    2021-05-08 20:48    47  ****************************

