smartctl 7.0 2019-05-21 r4916 [x86_64-linux-3.10.0-957...] (local build)
Copyright (C) 2002-18, Bruce Allen, Christian Franke, www.smartmontools.org

=== START OF INFORMATION SECTION ===
Model Family:     Hitachi Ultrastar A7K2000
Device Model:     HUA722020ALA331
Serial Number:    --
LU WWN Device Id: 5 000cca ...
Firmware Version: JKAOA3NH
User Capacity:    2,000,398,934,016 bytes [2.00 TB]
Sector Size:      512 bytes logical/physical
Rotation Rate:    7200 rpm
Form Factor:      3.5 inches
Device is:        In smartctl database [for details use: -P show]
ATA Version is:   ATA8-ACS T13/1699-D revision 4
SATA Version is:  SATA 2.6, 3.0 Gb/s
Local Time is:    --
APM feature is:   Disabled
Rd look-ahead is: Enabled
Write cache is:   Disabled
ATA Security is:  Disabled, NOT FROZEN [SEC1]

=== START OF READ SMART DATA SECTION ===
SMART overall-health self-assessment test result: FAILED!
Drive failure expected in less than 24 hours. SAVE ALL DATA.
Warning: This result is based on an Attribute check.

General SMART Values:
Offline data collection status:  (0x84)	Offline data collection activity
					was suspended by an interrupting command from host.

Self-test execution status:      (   0)	The previous self-test routine completed
					without error or no self-test has ever 
					been run.
Total time to complete Offline 
data collection: 		(22477) seconds.
Offline data collection
capabilities: 			 (0x5b) SMART execute Offline immediate.

					Suspend Offline collection upon new
					command.
					Offline surface scan supported.
					Self-test supported.
					No Conveyance Self-test supported.
					Selective Self-test supported.
SMART capabilities:            (0x0003)	Saves SMART data before entering
					power-saving mode.

Error logging capability:        (0x01)	Error logging supported.
					General Purpose Logging supported.
Short self-test routine 
recommended polling time: 	 (   1) minutes.
Extended self-test routine
recommended polling time: 	 ( 375) minutes.
SCT capabilities: 	       (0x003d)	SCT Status supported.
					SCT Error Recovery Control supported.
					SCT Feature Control supported.
					SCT Data Table supported.

SMART Attributes Data Structure revision number: 16
Vendor Specific SMART Attributes with Thresholds:
ID# ATTRIBUTE_NAME          FLAGS    VALUE WORST THRESH FAIL RAW_VALUE
  1 Raw_Read_Error_Rate     PO-R--   085   085   016    -    13369360
  2 Throughput_Performance  P-S---   132   132   054    -    106
  3 Spin_Up_Time            POS---   179   179   024    -    355 (Average 455)
  4 Start_Stop_Count        -O--C-   066   066   000    -    137890
  5 Reallocated_Sector_Ct   PO--CK   001   001   005    NOW  2015
  7 Seek_Error_Rate         PO-R--   100   100   067    -    0
  8 Seek_Time_Performance   P-S---   123   123   020    -    34
  9 Power_On_Hours          -O--C-   090   090   000    -    74867
 10 Spin_Retry_Count        PO--C-   100   100   060    -    0
 12 Power_Cycle_Count       -O--CK   100   100   000    -    82
192 Power-Off_Retract_Count -O--CK   001   001   000    -    137915
193 Load_Cycle_Count        -O--C-   001   001   000    -    137915
194 Temperature_Celsius     -O----   125   125   000    -    48 (Min/Max 19/61)
196 Reallocated_Event_Count -O--CK   001   001   000    -    2171
197 Current_Pending_Sector  -O---K   100   100   000    -    0
198 Offline_Uncorrectable   ---R--   100   100   000    -    0
199 UDMA_CRC_Error_Count    -O-R--   200   200   000    -    0
                            ||||||_ K auto-keep
                            |||||__ C event count
                            ||||___ R error rate
                            |||____ S speed/performance
                            ||_____ O updated online
                            |______ P prefailure warning

General Purpose Log Directory Version 1
SMART           Log Directory Version 1 [multi-sector log support]
Address    Access  R/W   Size  Description
0x00       GPL,SL  R/O      1  Log Directory
0x01           SL  R/O      1  Summary SMART error log
0x03       GPL     R/O      1  Ext. Comprehensive SMART error log
0x04       GPL     R/O      7  Device Statistics log
0x06           SL  R/O      1  SMART self-test log
0x07       GPL     R/O      1  Extended self-test log
0x09           SL  R/W      1  Selective self-test log
0x10       GPL     R/O      1  NCQ Command Error log
0x11       GPL     R/O      1  SATA Phy Event Counters log
0x20       GPL     R/O      1  Streaming performance log [OBS-8]
0x21       GPL     R/O      1  Write stream error log
0x22       GPL     R/O      1  Read stream error log
0x24       GPL     R/O     63  Current Device Internal Status Data log
0x80       GPL     R/W     63  Host vendor specific log
0x81-0x9f  GPL,SL  R/W     16  Host vendor specific log
0xe0       GPL,SL  R/W      1  SCT Command/Status
0xe1       GPL,SL  R/W      1  SCT Data Transfer

SMART Extended Comprehensive Error Log Version: 1 (1 sectors)
Device Error Count: 65535 (device log contains only the most recent 4 errors)
	CR     = Command Register
	FEATR  = Features Register
	COUNT  = Count (was: Sector Count) Register
	LBA_48 = Upper bytes of LBA High/Mid/Low Registers ]  ATA-8
	LH     = LBA High (was: Cylinder High) Register    ]   LBA
	LM     = LBA Mid (was: Cylinder Low) Register      ] Register
	LL     = LBA Low (was: Sector Number) Register     ]
	DV     = Device (was: Device/Head) Register
	DC     = Device Control Register
	ER     = Error register
	ST     = Status register
Powered_Up_Time is measured from power on, and printed as
DDd+hh:mm:SS.sss where DD=days, hh=hours, mm=minutes,
SS=sec, and sss=millisec. It "wraps" after 49.710 days.

Error 65535 [0] occurred at disk power-on lifetime: 9331 hours (388 days + 19 hours)
  When the command that caused the error occurred, the device was active or idle.

  After command completion occurred, registers were:
  ER -- ST COUNT  LBA_48  LH LM LL DV DC
  -- -- -- == -- == == == -- -- -- -- --
  40 -- 51 00 05 00 00 85 09 00 03 05 00  Error: WP at LBA = 0x85090003 = 2231959555

  Commands leading to the command that caused the error were:
  CR FEATR COUNT  LBA_48  LH LM LL DV DC  Powered_Up_Time  Command/Feature_Name
  -- == -- == -- == == == -- -- -- -- --  ---------------  --------------------
  61 02 98 00 88 00 00 04 5c 70 f0 40 00     17:47:38.776  WRITE FPDMA QUEUED
  61 03 78 00 80 00 00 04 5c 9c d0 40 00     17:47:38.776  WRITE FPDMA QUEUED
  61 04 00 00 78 00 00 04 5c 98 d0 40 00     17:47:38.674  WRITE FPDMA QUEUED
  61 01 c0 00 70 00 00 04 5c 97 10 40 00     17:47:38.673  WRITE FPDMA QUEUED
  61 04 00 00 68 00 00 04 5c 93 10 40 00     17:47:38.623  WRITE FPDMA QUEUED

Error 65534 [3] occurred at disk power-on lifetime: 9331 hours (388 days + 19 hours)
  When the command that caused the error occurred, the device was active or idle.

  After command completion occurred, registers were:
  ER -- ST COUNT  LBA_48  LH LM LL DV DC
  -- -- -- == -- == == == -- -- -- -- --
  40 -- 51 00 01 00 00 85 09 00 af 05 00  Error: UNC at LBA = 0x850900af = 2231959727

  Commands leading to the command that caused the error were:
  CR FEATR COUNT  LBA_48  LH LM LL DV DC  Powered_Up_Time  Command/Feature_Name
  -- == -- == -- == == == -- -- -- -- --  ---------------  --------------------
  60 00 08 00 58 00 00 85 09 01 00 40 00     17:43:54.485  READ FPDMA QUEUED
  60 00 08 00 50 00 00 85 09 00 f8 40 00     17:43:54.485  READ FPDMA QUEUED
  60 00 08 00 48 00 00 85 09 00 f0 40 00     17:43:54.485  READ FPDMA QUEUED
  60 00 08 00 40 00 00 85 09 00 e8 40 00     17:43:54.485  READ FPDMA QUEUED
  60 00 08 00 38 00 00 85 09 00 e0 40 00     17:43:54.484  READ FPDMA QUEUED

Error 65533 [2] occurred at disk power-on lifetime: 9331 hours (388 days + 19 hours)
  When the command that caused the error occurred, the device was active or idle.

  After command completion occurred, registers were:
  ER -- ST COUNT  LBA_48  LH LM LL DV DC
  -- -- -- == -- == == == -- -- -- -- --
  40 -- 51 00 08 00 00 85 09 00 98 05 00  Error: UNC at LBA = 0x85090098 = 2231959704

  Commands leading to the command that caused the error were:
  CR FEATR COUNT  LBA_48  LH LM LL DV DC  Powered_Up_Time  Command/Feature_Name
  -- == -- == -- == == == -- -- -- -- --  ---------------  --------------------
  60 00 08 00 68 00 00 85 09 01 00 40 00     17:43:24.235  READ FPDMA QUEUED
  60 00 08 00 60 00 00 85 09 00 f8 40 00     17:43:24.234  READ FPDMA QUEUED
  60 00 08 00 58 00 00 85 09 00 f0 40 00     17:43:24.234  READ FPDMA QUEUED
  60 00 08 00 50 00 00 85 09 00 e8 40 00     17:43:24.234  READ FPDMA QUEUED
  60 00 08 00 48 00 00 85 09 00 e0 40 00     17:43:24.234  READ FPDMA QUEUED

Error 65532 [1] occurred at disk power-on lifetime: 9331 hours (388 days + 19 hours)
  When the command that caused the error occurred, the device was active or idle.

  After command completion occurred, registers were:
  ER -- ST COUNT  LBA_48  LH LM LL DV DC
  -- -- -- == -- == == == -- -- -- -- --
  40 -- 51 00 08 00 00 85 09 00 90 05 00  Error: UNC 8 sectors at LBA = 0x85090090 = 2231959696

  Commands leading to the command that caused the error were:
  CR FEATR COUNT  LBA_48  LH LM LL DV DC  Powered_Up_Time  Command/Feature_Name
  -- == -- == -- == == == -- -- -- -- --  ---------------  --------------------
  25 00 00 00 08 00 00 85 09 00 90 40 00     17:43:07.860  READ DMA EXT
  ec 00 00 00 01 00 00 00 00 00 00 00 00     17:43:07.847  IDENTIFY DEVICE
  b0 00 d8 00 00 00 00 00 c2 4f 00 00 00     17:43:07.276  SMART ENABLE OPERATIONS
  ef 00 02 00 00 00 00 00 00 00 00 00 00     17:43:07.274  SET FEATURES [Enable write cache]
  e1 00 00 00 00 00 00 00 00 00 00 00 00     17:43:07.273  IDLE IMMEDIATE

SMART Extended Self-test Log Version: 1 (1 sectors)
Num  Test_Description    Status                  Remaining  LifeTime(hours)  LBA_of_first_error
# 1  Short captive       Completed without error       00%     47131         -
# 2  Short offline       Completed without error       00%     44177         -
# 3  Short offline       Completed without error       00%     38158         -
# 4  Short offline       Completed without error       00%     38156         -
# 5  Short offline       Completed without error       00%     26370         -
# 6  Short offline       Completed without error       00%     26033         -

SMART Selective self-test log data structure revision number 1
 SPAN  MIN_LBA  MAX_LBA  CURRENT_TEST_STATUS
    1        0        0  Not_testing
    2        0        0  Not_testing
    3        0        0  Not_testing
    4        0        0  Not_testing
    5        0        0  Not_testing
Selective self-test flags (0x0):
  After scanning selected spans, do NOT read-scan remainder of disk.
If Selective self-test is pending on power-up, resume after 0 minute delay.

SCT Status Version:                  3
SCT Version (vendor specific):       256 (0x0100)
Device State:                        SMART Off-line Data Collection executing in background (4)
Current Temperature:                    48 Celsius
Power Cycle Min/Max Temperature:     43/50 Celsius
Lifetime    Min/Max Temperature:     19/61 Celsius
Under/Over Temperature Limit Count:   0/0

SCT Temperature History Version:     2
Temperature Sampling Period:         1 minute
Temperature Logging Interval:        1 minute
Min/Max recommended Temperature:      0/60 Celsius
Min/Max Temperature Limit:           -40/70 Celsius
Temperature History Size (Index):    128 (116)

Device Statistics (GP Log 0x04)
Page  Offset Size        Value Flags Description
0x01  =====  =               =  ===  == General Statistics (rev 1) ==
0x01  0x008  4              82  ---  Lifetime Power-On Resets
0x01  0x010  4           74867  ---  Power-on Hours
0x01  0x018  6   1034257111478  ---  Logical Sectors Written
0x01  0x020  6      2315678978  ---  Number of Write Commands
0x01  0x028  6   2070418921384  ---  Logical Sectors Read
0x01  0x030  6      1425486187  ---  Number of Read Commands
0x03  =====  =               =  ===  == Rotating Media Statistics (rev 1) ==
0x03  0x008  4           74124  ---  Spindle Motor Power-on Hours
0x03  0x010  4           74113  ---  Head Flying Hours
0x03  0x018  4          137915  ---  Head Load Events
0x03  0x020  4            2015  ---  Number of Reallocated Logical Sectors
0x03  0x028  4          734737  ---  Read Recovery Attempts
0x03  0x030  4      4294967295  ---  Number of Mechanical Start Failures
0x04  =====  =               =  ===  == General Errors Statistics (rev 1) ==
0x04  0x008  4          604133  ---  Number of Reported Uncorrectable Errors
0x04  0x010  4            1654  ---  Resets Between Cmd Acceptance and Completion
0x05  =====  =               =  ===  == Temperature Statistics (rev 1) ==
0x05  0x008  1              48  ---  Current Temperature
0x05  0x010  1              45  N--  Average Short Term Temperature
0x05  0x018  1              46  N--  Average Long Term Temperature
0x05  0x020  1              61  ---  Highest Temperature
0x05  0x028  1              19  ---  Lowest Temperature
0x05  0x030  1              56  N--  Highest Average Short Term Temperature
0x05  0x038  1               0  N--  Lowest Average Short Term Temperature
0x05  0x040  1              52  N--  Highest Average Long Term Temperature
0x05  0x048  1               0  N--  Lowest Average Long Term Temperature
0x05  0x050  4              60  ---  Time in Over-Temperature
0x05  0x058  1              60  ---  Specified Maximum Operating Temperature
0x05  0x060  4               0  ---  Time in Under-Temperature
0x05  0x068  1               0  ---  Specified Minimum Operating Temperature
0x06  =====  =               =  ===  == Transport Statistics (rev 1) ==
0x06  0x008  4          607643  ---  Number of Hardware Resets
0x06  0x010  4          605243  ---  Number of ASR Events
0x06  0x018  4               0  ---  Number of Interface CRC Errors
                                |||_ C monitored condition met
                                ||__ D supports DSN
                                |___ N normalized value

SATA Phy Event Counters (GP Log 0x11)
ID      Size     Value  Description
0x0001  2            0  Command failed due to ICRC error
0x0002  2            0  R_ERR response for data FIS
0x0005  2            0  R_ERR response for non-data FIS
0x0009  2        57726  Transition from drive PhyRdy to drive PhyNRdy
0x000a  2        57721  Device-to-host register FISes sent due to a COMRESET
0x000b  2            0  CRC errors within host-to-device FIS
0x000d  2            0  Non-CRC errors within host-to-device FIS

