smartctl 7.1 2020-06-20 r5066 [x86_64-linux-3.10.0-1160...] (local build)
Copyright (C) 2002-19, Bruce Allen, Christian Franke, www.smartmontools.org

=== START OF INFORMATION SECTION ===
Model Number:                       SAMSUNG MZVLB512HBJQ-00000
Serial Number:                      --
Firmware Version:                   EXF7201Q
PCI Vendor/Subsystem ID:            0x144d
IEEE OUI Identifier:                0x002538
Total NVM Capacity:                 512,110,190,592 [512 GB]
Unallocated NVM Capacity:           0
Controller ID:                      4
Number of Namespaces:               1
Namespace 1 Size/Capacity:          512,110,190,592 [512 GB]
Namespace 1 Utilization:            436,386,545,664 [436 GB]
Namespace 1 Formatted LBA Size:     512
Namespace 1 IEEE EUI-64:            002538 ...
Local Time is:                      --

=== START OF READ SMART DATA SECTION ===
SMART overall-health self-assessment test result: PASSED

SMART/Health Information (NVMe Log 0x02)
Critical Warning:                   0x00
Temperature:                        48 Celsius
Available Spare:                    100%
Available Spare Threshold:          10%
Percentage Used:                    23%
Data Units Read:                    7,634,745 [3.90 TB]
Data Units Written:                 139,536,517 [71.4 TB]
Host Read Commands:                 422,769,670
Host Write Commands:                822,040,884
Controller Busy Time:               11,454
Power Cycles:                       11
Power On Hours:                     5,523
Unsafe Shutdowns:                   4
Media and Data Integrity Errors:    0
Error Information Log Entries:      1
Warning  Comp. Temperature Time:    0
Critical Comp. Temperature Time:    0
Temperature Sensor 1:               48 Celsius
Temperature Sensor 2:               74 Celsius

