smartctl 7.4 2023-08-01 r5530 [x86_64-linux-3.10.0-1160...] (local build)
Copyright (C) 2002-23, Bruce Allen, Christian Franke, www.smartmontools.org

=== START OF INFORMATION SECTION ===
Model Number:                       Micron_7400_MTFDKCB7T6TDZ
Serial Number:                      --
Firmware Version:                   E1MU23S1
PCI Vendor/Subsystem ID:            0x1344
IEEE OUI Identifier:                0x00a075
Total NVM Capacity:                 7,681,501,126,656 [7.68 TB]
Unallocated NVM Capacity:           0
Controller ID:                      0
NVMe Version:                       1.4
Number of Namespaces:               128
Namespace 1 Size/Capacity:          7,681,501,126,656 [7.68 TB]
Namespace 1 Utilization:            81,208,983,552 [81.2 GB]
Namespace 1 Formatted LBA Size:     512
Namespace 1 IEEE EUI-64:            00a075 ...
Local Time is:                      Wed Mar ... 2025 +05

=== START OF READ SMART DATA SECTION ===
SMART overall-health self-assessment test result: PASSED

SMART/Health Information (NVMe Log 0x02)
Critical Warning:                   0x00
Temperature:                        38 Celsius
Available Spare:                    100%
Available Spare Threshold:          10%
Percentage Used:                    0%
Data Units Read:                    5,038,007 [2.57 TB]
Data Units Written:                 488,111 [249 GB]
Host Read Commands:                 11,117,851
Host Write Commands:                1,534,560
Controller Busy Time:               44
Power Cycles:                       65
Power On Hours:                     7,690
Unsafe Shutdowns:                   63
Media and Data Integrity Errors:    0
Error Information Log Entries:      43
Warning  Comp. Temperature Time:    0
Critical Comp. Temperature Time:    0
Temperature Sensor 1:               48 Celsius
Temperature Sensor 2:               42 Celsius
Temperature Sensor 3:               38 Celsius

Error Information (NVMe Log 0x01, 16 of 256 entries)
Num   ErrCount  SQId   CmdId  Status  PELoc          LBA  NSID    VS  Message
  0         43     0  0x000f  0x8004  0x004            0     1     -  Invalid Field in Command
  1         42     0  0x0007  0x8004  0x004            0     1     -  Invalid Field in Command
  2         41     0  0x0007  0x8004  0x028            0     -     -  Invalid Field in Command

Read Self-test Log failed: Invalid Field in Command (0x6002)

