smartctl 7.1 2020-06-20 r5066 [x86_64-linux-3.10.0-1160...] (local build)
Copyright (C) 2002-19, Bruce Allen, Christian Franke, www.smartmontools.org

=== START OF INFORMATION SECTION ===
Device Model:     ST4000NM0245-1Z2107
Serial Number:    --
LU WWN Device Id: 5 000c50 ...
Firmware Version: SS05
User Capacity:    4,000,787,030,016 bytes [4.00 TB]
Sector Sizes:     512 bytes logical, 4096 bytes physical
Rotation Rate:    7200 rpm
Form Factor:      3.5 inches
Device is:        Not in smartctl database [for details use: -P showall]
ATA Version is:   ACS-3 T13/2161-D revision 5
SATA Version is:  SATA 3.1, 6.0 Gb/s (current: 6.0 Gb/s)
Local Time is:    --
Rd look-ahead is: Enabled
Write cache is:   Enabled
ATA Security is:  Disabled, frozen [SEC2]

=== START OF READ SMART DATA SECTION ===
SMART overall-health self-assessment test result: PASSED

General SMART Values:
Offline data collection status:  (0x82)	Offline data collection activity
					was completed without error.

Self-test execution status:      (   0)	The previous self-test routine completed
					without error or no self-test has ever 
					been run.
Total time to complete Offline 
data collection: 		(  567) seconds.
Offline data collection
capabilities: 			 (0x7b) SMART execute Offline immediate.

					Suspend Offline collection upon new
					command.
					Offline surface scan supported.
					Self-test supported.
					Conveyance Self-test supported.
					Selective Self-test supported.
SMART capabilities:            (0x0003)	Saves SMART data before entering
					power-saving mode.

Error logging capability:        (0x01)	Error logging supported.
					General Purpose Logging supported.
Short self-test routine 
recommended polling time: 	 (   1) minutes.
Extended self-test routine
recommended polling time: 	 ( 358) minutes.
Conveyance self-test routine
recommended polling time: 	 (   2) minutes.
SCT capabilities: 	       (0x50bd)	SCT Status supported.
					SCT Error Recovery Control supported.
					SCT Feature Control supported.
					SCT Data Table supported.

SMART Attributes Data Structure revision number: 10
Vendor Specific SMART Attributes with Thresholds:
ID# ATTRIBUTE_NAME          FLAGS    VALUE WORST THRESH FAIL RAW_VALUE
  1 Raw_Read_Error_Rate     POSR--   083   064   044    -    189098600
  3 Spin_Up_Time            PO----   093   093   000    -    0
  4 Start_Stop_Count        -O--CK   100   100   020    -    24
  5 Reallocated_Sector_Ct   PO--CK   100   100   010    -    32
  7 Seek_Error_Rate         POSR--   089   060   045    -    801026469
  9 Power_On_Hours          -O--CK   062   062   000    -    34015
 10 Spin_Retry_Count        PO--C-   100   100   097    -    0
 12 Power_Cycle_Count       -O--CK   100   100   020    -    23
184 End-to-End_Error        -O--CK   100   100   099    -    0
187 Reported_Uncorrect      -O--CK   091   091   000    -    9
188 Command_Timeout         -O--CK   100   100   000    -    5
189 High_Fly_Writes         -O-RCK   100   100   000    -    0
190 Airflow_Temperature_Cel -O---K   068   058   040    -    32 (Min/Max 24/37)
191 G-Sense_Error_Rate      -O--CK   039   039   000    -    122448
192 Power-Off_Retract_Count -O--CK   100   100   000    -    923
193 Load_Cycle_Count        -O--CK   099   099   000    -    2940
194 Temperature_Celsius     -O---K   032   042   000    -    32 (0 23 0 0 0)
195 Hardware_ECC_Recovered  -O-RC-   006   001   000    -    189098600
197 Current_Pending_Sector  -O--C-   100   100   000    -    0
198 Offline_Uncorrectable   ----C-   100   100   000    -    0
199 UDMA_CRC_Error_Count    -OSRCK   200   200   000    -    0
240 Head_Flying_Hours       ------   100   253   000    -    33619 (248 143 0)
241 Total_LBAs_Written      ------   100   253   000    -    198682485609
242 Total_LBAs_Read         ------   100   253   000    -    267691285835
                            ||||||_ K auto-keep
                            |||||__ C event count
                            ||||___ R error rate
                            |||____ S speed/performance
                            ||_____ O updated online
                            |______ P prefailure warning

General Purpose Log Directory Version 1
SMART           Log Directory Version 1 [multi-sector log support]
Address    Access  R/W   Size  Description
0x00       GPL,SL  R/O      1  Log Directory
0x01           SL  R/O      1  Summary SMART error log
0x02           SL  R/O      5  Comprehensive SMART error log
0x03       GPL     R/O      5  Ext. Comprehensive SMART error log
0x04       GPL,SL  R/O      8  Device Statistics log
0x06           SL  R/O      1  SMART self-test log
0x07       GPL     R/O      1  Extended self-test log
0x08       GPL     R/O      2  Power Conditions log
0x09           SL  R/W      1  Selective self-test log
0x0c       GPL     R/O   2048  Pending Defects log
0x10       GPL     R/O      1  NCQ Command Error log
0x11       GPL     R/O      1  SATA Phy Event Counters log
0x13       GPL     R/O      1  SATA NCQ Send and Receive log
0x15       GPL     R/W      1  Rebuild Assist log
0x21       GPL     R/O      1  Write stream error log
0x22       GPL     R/O      1  Read stream error log
0x24       GPL     R/O    512  Current Device Internal Status Data log
0x30       GPL,SL  R/O      9  IDENTIFY DEVICE data log
0x80-0x9f  GPL,SL  R/W     16  Host vendor specific log
0xa1       GPL,SL  VS      24  Device vendor specific log
0xa2       GPL     VS    8160  Device vendor specific log
0xa6       GPL     VS     192  Device vendor specific log
0xa8-0xa9  GPL,SL  VS     136  Device vendor specific log
0xab       GPL     VS       1  Device vendor specific log
0xad       GPL     VS      16  Device vendor specific log
0xb0       GPL     VS    9048  Device vendor specific log
0xbe-0xbf  GPL     VS   65535  Device vendor specific log
0xc1       GPL,SL  VS      16  Device vendor specific log
0xc3       GPL,SL  VS       8  Device vendor specific log
0xd1       GPL     VS     264  Device vendor specific log
0xd2       GPL     VS   10000  Device vendor specific log
0xd4       GPL     VS    2048  Device vendor specific log
0xda       GPL,SL  VS       1  Device vendor specific log
0xe0       GPL,SL  R/W      1  SCT Command/Status
0xe1       GPL,SL  R/W      1  SCT Data Transfer

SMART Extended Comprehensive Error Log Version: 1 (5 sectors)
Device Error Count: 9
	CR     = Command Register
	FEATR  = Features Register
	COUNT  = Count (was: Sector Count) Register
	LBA_48 = Upper bytes of LBA High/Mid/Low Registers ]  ATA-8
	LH     = LBA High (was: Cylinder High) Register    ]   LBA
	LM     = LBA Mid (was: Cylinder Low) Register      ] Register
	LL     = LBA Low (was: Sector Number) Register     ]
	DV     = Device (was: Device/Head) Register
	DC     = Device Control Register
	ER     = Error register
	ST     = Status register
Powered_Up_Time is measured from power on, and printed as
DDd+hh:mm:SS.sss where DD=days, hh=hours, mm=minutes,
SS=sec, and sss=millisec. It "wraps" after 49.710 days.

Error 9 [8] occurred at disk power-on lifetime: 31957 hours (1331 days + 13 hours)
  When the command that caused the error occurred, the device was active or idle.

  After command completion occurred, registers were:
  ER -- ST COUNT  LBA_48  LH LM LL DV DC
  -- -- -- == -- == == == -- -- -- -- --
  40 -- 53 00 00 00 00 04 d4 a0 88 00 00  Error: UNC at LBA = 0x04d4a088 = 81043592

  Commands leading to the command that caused the error were:
  CR FEATR COUNT  LBA_48  LH LM LL DV DC  Powered_Up_Time  Command/Feature_Name
  -- == -- == -- == == == -- -- -- -- --  ---------------  --------------------
  60 00 00 00 08 00 00 04 d4 a0 88 40 00     00:07:15.930  READ FPDMA QUEUED
  60 00 00 00 80 00 00 04 d4 af 80 40 00     00:07:15.923  READ FPDMA QUEUED
  60 00 00 00 08 00 00 04 d4 a0 80 40 00     00:07:15.922  READ FPDMA QUEUED
  61 00 00 00 08 00 00 04 15 5a d8 40 00     00:07:15.922  WRITE FPDMA QUEUED
  61 00 00 00 08 00 00 04 15 5a b8 40 00     00:07:15.922  WRITE FPDMA QUEUED

Error 8 [7] occurred at disk power-on lifetime: 31957 hours (1331 days + 13 hours)
  When the command that caused the error occurred, the device was active or idle.

  After command completion occurred, registers were:
  ER -- ST COUNT  LBA_48  LH LM LL DV DC
  -- -- -- == -- == == == -- -- -- -- --
  40 -- 53 00 00 00 00 04 d4 a0 88 00 00  Error: UNC at LBA = 0x04d4a088 = 81043592

  Commands leading to the command that caused the error were:
  CR FEATR COUNT  LBA_48  LH LM LL DV DC  Powered_Up_Time  Command/Feature_Name
  -- == -- == -- == == == -- -- -- -- --  ---------------  --------------------
  60 00 00 05 00 00 00 04 d4 aa 80 40 00     00:07:13.274  READ FPDMA QUEUED
  60 00 00 05 00 00 00 04 d4 a5 80 40 00     00:07:10.412  READ FPDMA QUEUED
  60 00 00 00 80 00 00 04 d4 a5 00 40 00     00:07:10.411  READ FPDMA QUEUED
  60 00 00 05 00 00 00 04 d4 a0 00 40 00     00:07:10.410  READ FPDMA QUEUED
  60 00 00 05 00 00 00 04 d4 9b 00 40 00     00:07:10.410  READ FPDMA QUEUED

Error 7 [6] occurred at disk power-on lifetime: 31957 hours (1331 days + 13 hours)
  When the command that caused the error occurred, the device was active or idle.

  After command completion occurred, registers were:
  ER -- ST COUNT  LBA_48  LH LM LL DV DC
  -- -- -- == -- == == == -- -- -- -- --
  40 -- 53 00 00 00 00 04 d4 91 d0 00 00  Error: UNC at LBA = 0x04d491d0 = 81039824

  Commands leading to the command that caused the error were:
  CR FEATR COUNT  LBA_48  LH LM LL DV DC  Powered_Up_Time  Command/Feature_Name
  -- == -- == -- == == == -- -- -- -- --  ---------------  --------------------
  60 00 00 00 08 00 00 04 d4 91 d0 40 00     00:07:06.957  READ FPDMA QUEUED
  60 00 00 00 08 00 00 04 d4 91 c8 40 00     00:07:06.957  READ FPDMA QUEUED
  60 00 00 00 08 00 00 04 d4 91 c0 40 00     00:07:06.957  READ FPDMA QUEUED
  60 00 00 00 08 00 00 04 d4 91 b8 40 00     00:07:06.957  READ FPDMA QUEUED
  60 00 00 00 08 00 00 04 d4 91 b0 40 00     00:07:06.956  READ FPDMA QUEUED

Error 6 [5] occurred at disk power-on lifetime: 31957 hours (1331 days + 13 hours)
  When the command that caused the error occurred, the device was active or idle.

  After command completion occurred, registers were:
  ER -- ST COUNT  LBA_48  LH LM LL DV DC
  -- -- -- == -- == == == -- -- -- -- --
  40 -- 53 00 00 00 00 04 d4 91 d0 00 00  Error: WP at LBA = 0x04d491d0 = 81039824

  Commands leading to the command that caused the error were:
  CR FEATR COUNT  LBA_48  LH LM LL DV DC  Powered_Up_Time  Command/Feature_Name
  -- == -- == -- == == == -- -- -- -- --  ---------------  --------------------
  61 00 00 00 40 00 01 01 d4 c8 c0 40 00     00:07:00.979  WRITE FPDMA QUEUED
  61 00 00 06 00 00 00 04 27 22 00 40 00     00:07:00.979  WRITE FPDMA QUEUED
  61 00 00 05 40 00 01 01 d4 c3 80 40 00     00:07:00.979  WRITE FPDMA QUEUED
  61 00 00 0a 00 00 00 04 27 18 00 40 00     00:07:00.979  WRITE FPDMA QUEUED
  61 00 00 05 40 00 01 01 d4 be 40 40 00     00:07:00.979  WRITE FPDMA QUEUED

Error 5 [4] occurred at disk power-on lifetime: 31957 hours (1331 days + 13 hours)
  When the command that caused the error occurred, the device was active or idle.

  After command completion occurred, registers were:
  ER -- ST COUNT  LBA_48  LH LM LL DV DC
  -- -- -- == -- == == == -- -- -- -- --
  40 -- 53 00 00 00 00 04 d4 83 20 00 00  Error: UNC at LBA = 0x04d48320 = 81036064

  Commands leading to the command that caused the error were:
  CR FEATR COUNT  LBA_48  LH LM LL DV DC  Powered_Up_Time  Command/Feature_Name
  -- == -- == -- == == == -- -- -- -- --  ---------------  --------------------
  60 00 00 00 80 00 00 04 d4 90 00 40 00     00:07:00.692  READ FPDMA QUEUED
  60 00 00 05 00 00 00 04 d4 8b 00 40 00     00:07:00.691  READ FPDMA QUEUED
  60 00 00 05 00 00 00 04 d4 86 00 40 00     00:06:58.008  READ FPDMA QUEUED
  60 00 00 05 00 00 00 04 d4 67 00 40 00     00:06:57.848  READ FPDMA QUEUED
  60 00 00 05 00 00 00 04 d4 62 00 40 00     00:06:57.848  READ FPDMA QUEUED

Error 4 [3] occurred at disk power-on lifetime: 31957 hours (1331 days + 13 hours)
  When the command that caused the error occurred, the device was active or idle.

  After command completion occurred, registers were:
  ER -- ST COUNT  LBA_48  LH LM LL DV DC
  -- -- -- == -- == == == -- -- -- -- --
  40 -- 53 00 00 00 00 04 d4 2a 30 00 00  Error: UNC at LBA = 0x04d42a30 = 81013296

  Commands leading to the command that caused the error were:
  CR FEATR COUNT  LBA_48  LH LM LL DV DC  Powered_Up_Time  Command/Feature_Name
  -- == -- == -- == == == -- -- -- -- --  ---------------  --------------------
  60 00 00 00 08 00 00 04 d4 2a 30 40 00     00:06:45.820  READ FPDMA QUEUED
  60 00 00 00 08 00 00 04 d4 2a 28 40 00     00:06:45.820  READ FPDMA QUEUED
  60 00 00 00 08 00 00 04 d4 2a 20 40 00     00:06:45.820  READ FPDMA QUEUED
  60 00 00 00 08 00 00 04 d4 2a 18 40 00     00:06:45.820  READ FPDMA QUEUED
  60 00 00 00 08 00 00 04 d4 2a 10 40 00     00:06:45.819  READ FPDMA QUEUED

Error 3 [2] occurred at disk power-on lifetime: 31957 hours (1331 days + 13 hours)
  When the command that caused the error occurred, the device was active or idle.

  After command completion occurred, registers were:
  ER -- ST COUNT  LBA_48  LH LM LL DV DC
  -- -- -- == -- == == == -- -- -- -- --
  40 -- 53 00 00 00 00 04 d4 2a 30 00 00  Error: UNC at LBA = 0x04d42a30 = 81013296

  Commands leading to the command that caused the error were:
  CR FEATR COUNT  LBA_48  LH LM LL DV DC  Powered_Up_Time  Command/Feature_Name
  -- == -- == -- == == == -- -- -- -- --  ---------------  --------------------
  60 00 00 01 00 00 00 04 d4 2a 00 40 00     00:06:42.672  READ FPDMA QUEUED
  61 00 00 06 00 00 00 04 20 62 00 40 00     00:06:42.585  WRITE FPDMA QUEUED
  61 00 00 0a 00 00 00 04 20 58 00 40 00     00:06:42.583  WRITE FPDMA QUEUED
  61 00 00 03 50 00 00 04 20 54 00 40 00     00:06:42.583  WRITE FPDMA QUEUED
  61 00 00 06 00 00 00 cd 5b 22 00 40 00     00:06:42.549  WRITE FPDMA QUEUED

Error 2 [1] occurred at disk power-on lifetime: 31957 hours (1331 days + 13 hours)
  When the command that caused the error occurred, the device was active or idle.

  After command completion occurred, registers were:
  ER -- ST COUNT  LBA_48  LH LM LL DV DC
  -- -- -- == -- == == == -- -- -- -- --
  40 -- 53 00 00 00 00 04 d4 1b 78 00 00  Error: UNC at LBA = 0x04d41b78 = 81009528

  Commands leading to the command that caused the error were:
  CR FEATR COUNT  LBA_48  LH LM LL DV DC  Powered_Up_Time  Command/Feature_Name
  -- == -- == -- == == == -- -- -- -- --  ---------------  --------------------
  60 00 00 00 08 00 00 04 d4 1b 78 40 00     00:06:39.032  READ FPDMA QUEUED
  60 00 00 00 08 00 00 04 d4 1b 70 40 00     00:06:39.032  READ FPDMA QUEUED
  60 00 00 00 08 00 00 04 d4 1b 68 40 00     00:06:39.031  READ FPDMA QUEUED
  60 00 00 00 08 00 00 04 d4 1b 60 40 00     00:06:39.031  READ FPDMA QUEUED
  60 00 00 00 08 00 00 04 d4 1b 58 40 00     00:06:39.031  READ FPDMA QUEUED

SMART Extended Self-test Log Version: 1 (1 sectors)
Num  Test_Description    Status                  Remaining  LifeTime(hours)  LBA_of_first_error
# 1  Extended offline    Completed without error       00%     32852         -
# 2  Extended offline    Completed without error       00%     32833         -
# 3  Extended offline    Completed without error       00%     32021         -
# 4  Extended offline    Completed without error       00%     32003         -
# 5  Extended offline    Completed without error       00%     31956         -
# 6  Extended offline    Completed without error       00%     31938         -
# 7  Extended offline    Completed without error       00%     29377         -
# 8  Extended offline    Completed without error       00%     29359         -
# 9  Extended offline    Completed without error       00%     29353         -
#10  Extended offline    Completed without error       00%     29335         -
#11  Extended offline    Completed without error       00%        24         -
#12  Extended offline    Completed without error       00%         6         -

SMART Selective self-test log data structure revision number 1
 SPAN  MIN_LBA  MAX_LBA  CURRENT_TEST_STATUS
    1        0        0  Not_testing
    2        0        0  Not_testing
    3        0        0  Not_testing
    4        0        0  Not_testing
    5        0        0  Not_testing
Selective self-test flags (0x0):
  After scanning selected spans, do NOT read-scan remainder of disk.
If Selective self-test is pending on power-up, resume after 0 minute delay.

SCT Status Version:                  3
SCT Version (vendor specific):       522 (0x020a)
Device State:                        Active (0)
Current Temperature:                    32 Celsius
Power Cycle Min/Max Temperature:     24/37 Celsius
Lifetime    Min/Max Temperature:     23/39 Celsius
Under/Over Temperature Limit Count:   0/0

SCT Temperature History Version:     2
Temperature Sampling Period:         3 minutes
Temperature Logging Interval:        59 minutes
Min/Max recommended Temperature:     10/40 Celsius
Min/Max Temperature Limit:            5/60 Celsius
Temperature History Size (Index):    128 (41)

SCT Error Recovery Control:
           Read:    100 (10.0 seconds)
          Write:    100 (10.0 seconds)

Device Statistics (GP Log 0x04)
Page  Offset Size        Value Flags Description
0x01  =====  =               =  ===  == General Statistics (rev 1) ==
0x01  0x008  4              23  ---  Lifetime Power-On Resets
0x01  0x010  4           34015  ---  Power-on Hours
0x01  0x018  6    198682485609  ---  Logical Sectors Written
0x01  0x020  6      1151353397  ---  Number of Write Commands
0x01  0x028  6    267691285814  ---  Logical Sectors Read
0x01  0x030  6       856052937  ---  Number of Read Commands
0x01  0x038  6               -  ---  Date and Time TimeStamp
0x03  =====  =               =  ===  == Rotating Media Statistics (rev 1) ==
0x03  0x008  4      1140506719  N--  Spindle Motor Power-on Hours
0x03  0x010  4      1140477211  N--  Head Flying Hours
0x03  0x018  4            2940  ---  Head Load Events
0x03  0x020  4              32  ---  Number of Reallocated Logical Sectors
0x03  0x028  4               0  ---  Read Recovery Attempts
0x03  0x030  4               0  ---  Number of Mechanical Start Failures
0x03  0x038  4               0  ---  Number of Realloc. Candidate Logical Sectors
0x03  0x040  4             923  ---  Number of High Priority Unload Events
0x04  =====  =               =  ===  == General Errors Statistics (rev 1) ==
0x04  0x008  4              13  ---  Number of Reported Uncorrectable Errors
0x04  0x010  4               5  ---  Resets Between Cmd Acceptance and Completion
0x05  =====  =               =  ===  == Temperature Statistics (rev 1) ==
0x05  0x008  1              32  ---  Current Temperature
0x05  0x010  1              32  ---  Average Short Term Temperature
0x05  0x018  1              31  ---  Average Long Term Temperature
0x05  0x020  1              42  ---  Highest Temperature
0x05  0x028  1               0  ---  Lowest Temperature
0x05  0x030  1              39  ---  Highest Average Short Term Temperature
0x05  0x038  1              29  ---  Lowest Average Short Term Temperature
0x05  0x040  1              34  ---  Highest Average Long Term Temperature
0x05  0x048  1              30  ---  Lowest Average Long Term Temperature
0x05  0x050  4               0  ---  Time in Over-Temperature
0x05  0x058  1              60  ---  Specified Maximum Operating Temperature
0x05  0x060  4              60  ---  Time in Under-Temperature
0x05  0x068  1               5  ---  Specified Minimum Operating Temperature
0x06  =====  =               =  ===  == Transport Statistics (rev 1) ==
0x06  0x008  4             380  ---  Number of Hardware Resets
0x06  0x010  4             140  ---  Number of ASR Events
0x06  0x018  4               0  ---  Number of Interface CRC Errors
                                |||_ C monitored condition met
                                ||__ D supports DSN
                                |___ N normalized value

Pending Defects log (GP Log 0x0c)
No Defects Logged

SATA Phy Event Counters (GP Log 0x11)
ID      Size     Value  Description
0x000a  2           28  Device-to-host register FISes sent due to a COMRESET
0x0001  2            0  Command failed due to ICRC error
0x0003  2            0  R_ERR response for device-to-host data FIS
0x0004  2            0  R_ERR response for host-to-device data FIS
0x0006  2            0  R_ERR response for device-to-host non-data FIS
0x0007  2            0  R_ERR response for host-to-device non-data FIS

