smartctl 7.1 2019-12-30 r5022 [x86_64-linux-3.10.0-1127...] (local build)
Copyright (C) 2002-19, Bruce Allen, Christian Franke, www.smartmontools.org

=== START OF INFORMATION SECTION ===
Model Number:                       INTEL SSDPED1K375GA
Serial Number:                      --
Firmware Version:                   E2010320
PCI Vendor/Subsystem ID:            0x8086
IEEE OUI Identifier:                0x5cd2e4
Controller ID:                      0
Number of Namespaces:               1
Namespace 1 Size/Capacity:          375,083,606,016 [375 GB]
Namespace 1 Formatted LBA Size:     512
Namespace 1 IEEE EUI-64:            e4d25c ...
Local Time is:                      --

=== START OF READ SMART DATA SECTION ===
SMART overall-health self-assessment test result: PASSED

SMART/Health Information (NVMe Log 0x02)
Critical Warning:                   0x00
Temperature:                        34 Celsius
Available Spare:                    100%
Available Spare Threshold:          0%
Percentage Used:                    0%
Data Units Read:                    54,700,238 [28.0 TB]
Data Units Written:                 167,712,245 [85.8 TB]
Host Read Commands:                 2,763,140,298
Host Write Commands:                4,238,247,285
Controller Busy Time:               1,024
Power Cycles:                       95
Power On Hours:                     16,657
Unsafe Shutdowns:                   89
Media and Data Integrity Errors:    0
Error Information Log Entries:      0

