smartctl 7.1 2019-12-30 r5022 [x86_64-linux-3.10.0-1062...] (local build)
Copyright (C) 2002-19, Bruce Allen, Christian Franke, www.smartmontools.org

=== START OF INFORMATION SECTION ===
Model Number:                       INTEL SSDPED1K375GA
Serial Number:                      --
Firmware Version:                   E2010324
PCI Vendor/Subsystem ID:            0x8086
IEEE OUI Identifier:                0x5cd2e4
Controller ID:                      0
Number of Namespaces:               1
Namespace 1 Size/Capacity:          375,083,606,016 [375 GB]
Namespace 1 Formatted LBA Size:     512
Namespace 1 IEEE EUI-64:            e4d25c ...
Local Time is:                      --

=== START OF READ SMART DATA SECTION ===
SMART overall-health self-assessment test result: PASSED

SMART/Health Information (NVMe Log 0x02)
Critical Warning:                   0x00
Temperature:                        43 Celsius
Available Spare:                    100%
Available Spare Threshold:          0%
Percentage Used:                    0%
Data Units Read:                    212,972,214 [109 TB]
Data Units Written:                 1,263,293,811 [646 TB]
Host Read Commands:                 1,953,251,785
Host Write Commands:                10,780,298,623
Controller Busy Time:               6,006
Power Cycles:                       11
Power On Hours:                     24,715
Unsafe Shutdowns:                   8
Media and Data Integrity Errors:    0
Error Information Log Entries:      0

