smartctl 7.1 2019-12-30 r5022 [x86_64-linux-3.10.0-1062...] (local build)
Copyright (C) 2002-19, Bruce Allen, Christian Franke, www.smartmontools.org

=== START OF INFORMATION SECTION ===
Model Number:                       Micron_9300_MTFDHAL7T6TDP
Serial Number:                      --
Firmware Version:                   11300DG0
PCI Vendor/Subsystem ID:            0x1344
IEEE OUI Identifier:                0x00a075
Total NVM Capacity:                 7,681,501,126,656 [7.68 TB]
Unallocated NVM Capacity:           0
Controller ID:                      1
Number of Namespaces:               32
Namespace 1 Size/Capacity:          7,681,501,126,656 [7.68 TB]
Namespace 1 Formatted LBA Size:     512
Namespace 1 IEEE EUI-64:            00a075 ...
Local Time is:                      --

=== START OF READ SMART DATA SECTION ===
SMART overall-health self-assessment test result: PASSED

SMART/Health Information (NVMe Log 0x02)
Critical Warning:                   0x00
Temperature:                        38 Celsius
Available Spare:                    100%
Available Spare Threshold:          5%
Percentage Used:                    0%
Data Units Read:                    17,148,541 [8.78 TB]
Data Units Written:                 29,028,265 [14.8 TB]
Host Read Commands:                 439,585,480
Host Write Commands:                421,814,126
Controller Busy Time:               14,969
Power Cycles:                       7
Power On Hours:                     2,238
Unsafe Shutdowns:                   3
Media and Data Integrity Errors:    0
Error Information Log Entries:      0
Warning  Comp. Temperature Time:    0
Critical Comp. Temperature Time:    0
Temperature Sensor 1:               42 Celsius
Temperature Sensor 2:               38 Celsius
Temperature Sensor 3:               34 Celsius
Temperature Sensor 4:               33 Celsius

