smartctl 7.1 2020-06-20 r5066 [x86_64-linux-3.10.0-1160...] (local build)
Copyright (C) 2002-19, Bruce Allen, Christian Franke, www.smartmontools.org

=== START OF INFORMATION SECTION ===
Model Family:     Intel 730 and DC S35x0/3610/3700 Series SSDs
Device Model:     INTEL SSDSC2BB600G4
Serial Number:    --
LU WWN Device Id: 5 5cd2e4 ...
Firmware Version: D2010355
User Capacity:    600,127,266,816 bytes [600 GB]
Sector Size:      512 bytes logical/physical
Rotation Rate:    Solid State Device
Form Factor:      2.5 inches
Device is:        In smartctl database [for details use: -P show]
ATA Version is:   ATA8-ACS T13/1699-D revision 4
SATA Version is:  SATA 2.6, 6.0 Gb/s (current: 6.0 Gb/s)
Local Time is:    --
Rd look-ahead is: Enabled
Write cache is:   Enabled
ATA Security is:  Disabled, NOT FROZEN [SEC1]

=== START OF READ SMART DATA SECTION ===
SMART overall-health self-assessment test result: PASSED

General SMART Values:
Offline data collection status:  (0x02)	Offline data collection activity
					was completed without error.

Self-test execution status:      (   0)	The previous self-test routine completed
					without error or no self-test has ever 
					been run.
Total time to complete Offline 
data collection: 		(    2) seconds.
Offline data collection
capabilities: 			 (0x79) SMART execute Offline immediate.

					Suspend Offline collection upon new
					command.
					Offline surface scan supported.
					Self-test supported.
					Conveyance Self-test supported.
					Selective Self-test supported.
SMART capabilities:            (0x0003)	Saves SMART data before entering
					power-saving mode.

Error logging capability:        (0x01)	Error logging supported.
					General Purpose Logging supported.
Short self-test routine 
recommended polling time: 	 (   1) minutes.
Extended self-test routine
recommended polling time: 	 (   2) minutes.
Conveyance self-test routine
recommended polling time: 	 (   2) minutes.
SCT capabilities: 	       (0x003d)	SCT Status supported.
					SCT Error Recovery Control supported.
					SCT Feature Control supported.
					SCT Data Table supported.

SMART Attributes Data Structure revision number: 1
Vendor Specific SMART Attributes with Thresholds:
ID# ATTRIBUTE_NAME          FLAGS    VALUE WORST THRESH FAIL RAW_VALUE
  5 Reallocated_Sector_Ct   -O--CK   098   098   000    -    0
  9 Power_On_Hours          -O--CK   100   100   000    -    51908
 12 Power_Cycle_Count       -O--CK   100   100   000    -    10
170 Available_Reservd_Space PO--CK   100   100   010    -    0
171 Program_Fail_Count      -O--CK   100   100   000    -    0
172 Erase_Fail_Count        -O--CK   100   100   000    -    0
174 Unsafe_Shutdown_Count   -O--CK   100   100   000    -    6
175 Power_Loss_Cap_Test     PO--CK   100   100   010    -    613 (309 729)
183 SATA_Downshift_Count    -O--CK   100   100   000    -    0
184 End-to-End_Error        PO--CK   100   100   090    -    0
187 Reported_Uncorrect      -O--CK   100   100   000    -    0
190 Temperature_Case        -O---K   079   073   000    -    21 (Min/Max 14/27)
192 Unsafe_Shutdown_Count   -O--CK   100   100   000    -    6
194 Temperature_Internal    -O---K   100   100   000    -    21
197 Current_Pending_Sector  -O--CK   100   100   000    -    0
199 CRC_Error_Count         -OSRCK   100   100   000    -    110900
225 Host_Writes_32MiB       -O--CK   100   100   000    -    509923
226 Workld_Media_Wear_Indic -O--CK   100   100   000    -    993
227 Workld_Host_Reads_Perc  -O--CK   100   100   000    -    52
228 Workload_Minutes        -O--CK   100   100   000    -    151926
232 Available_Reservd_Space PO--CK   100   100   010    -    0
233 Media_Wearout_Indicator -O--CK   098   098   000    -    0
234 Thermal_Throttle        -O--CK   100   100   000    -    0/0
241 Host_Writes_32MiB       -O--CK   100   100   000    -    509923
242 Host_Reads_32MiB        -O--CK   100   100   000    -    482727
                            ||||||_ K auto-keep
                            |||||__ C event count
                            ||||___ R error rate
                            |||____ S speed/performance
                            ||_____ O updated online
                            |______ P prefailure warning

General Purpose Log Directory Version 1
SMART           Log Directory Version 1 [multi-sector log support]
Address    Access  R/W   Size  Description
0x00       GPL,SL  R/O      1  Log Directory
0x01       GPL,SL  R/O      1  Summary SMART error log
0x02       GPL,SL  R/O      8  Comprehensive SMART error log
0x03       GPL,SL  R/O     20  Ext. Comprehensive SMART error log
0x04       GPL,SL  R/O      8  Device Statistics log
0x06       GPL,SL  R/O      1  SMART self-test log
0x07       GPL,SL  R/O      2  Extended self-test log
0x09       GPL,SL  R/W      1  Selective self-test log
0x10       GPL,SL  R/O      1  NCQ Command Error log
0x11       GPL,SL  R/O      1  SATA Phy Event Counters log
0x80-0x9f  GPL,SL  R/W     16  Host vendor specific log
0xb0       GPL,SL  VS       1  Device vendor specific log
0xb1       GPL,SL  VS      33  Device vendor specific log
0xd1       GPL     VS   13056  Device vendor specific log
0xdf       GPL     VS    1152  Device vendor specific log
0xdf       SL      VS     128  Device vendor specific log
0xe0       GPL,SL  R/W      1  SCT Command/Status
0xe1       GPL,SL  R/W      1  SCT Data Transfer

SMART Extended Comprehensive Error Log Version: 1 (20 sectors)
Device Error Count: 10544 (device log contains only the most recent 80 errors)
	CR     = Command Register
	FEATR  = Features Register
	COUNT  = Count (was: Sector Count) Register
	LBA_48 = Upper bytes of LBA High/Mid/Low Registers ]  ATA-8
	LH     = LBA High (was: Cylinder High) Register    ]   LBA
	LM     = LBA Mid (was: Cylinder Low) Register      ] Register
	LL     = LBA Low (was: Sector Number) Register     ]
	DV     = Device (was: Device/Head) Register
	DC     = Device Control Register
	ER     = Error register
	ST     = Status register
Powered_Up_Time is measured from power on, and printed as
DDd+hh:mm:SS.sss where DD=days, hh=hours, mm=minutes,
SS=sec, and sss=millisec. It "wraps" after 49.710 days.

Error 10544 [63] occurred at disk power-on lifetime: 51784 hours (2157 days + 16 hours)
  When the command that caused the error occurred, the device was active or idle.

  After command completion occurred, registers were:
  ER -- ST COUNT  LBA_48  LH LM LL DV DC
  -- -- -- == -- == == == -- -- -- -- --
  84 -- 41 04 00 00 00 35 b2 0d 30 40 00  Error: ICRC, ABRT at LBA = 0x35b20d30 = 900861232

  Commands leading to the command that caused the error were:
  CR FEATR COUNT  LBA_48  LH LM LL DV DC  Powered_Up_Time  Command/Feature_Name
  -- == -- == -- == == == -- -- -- -- --  ---------------  --------------------
  61 00 00 04 00 00 00 35 b2 0d 30 40 00     22:26:19.211  WRITE FPDMA QUEUED
  61 00 00 04 00 00 00 35 b2 09 30 40 00     22:26:19.202  WRITE FPDMA QUEUED
  61 00 00 04 00 00 00 35 b2 05 30 40 00     22:26:19.197  WRITE FPDMA QUEUED
  61 00 00 04 00 00 00 35 b2 01 30 40 00     22:26:19.192  WRITE FPDMA QUEUED
  61 00 00 04 00 00 00 35 b1 fd 30 40 00     22:26:19.190  WRITE FPDMA QUEUED

Error 10543 [62] occurred at disk power-on lifetime: 51784 hours (2157 days + 16 hours)
  When the command that caused the error occurred, the device was active or idle.

  After command completion occurred, registers were:
  ER -- ST COUNT  LBA_48  LH LM LL DV DC
  -- -- -- == -- == == == -- -- -- -- --
  84 -- 41 04 00 00 00 08 f9 c0 00 40 00  Error: ICRC, ABRT at LBA = 0x08f9c000 = 150585344

  Commands leading to the command that caused the error were:
  CR FEATR COUNT  LBA_48  LH LM LL DV DC  Powered_Up_Time  Command/Feature_Name
  -- == -- == -- == == == -- -- -- -- --  ---------------  --------------------
  60 00 00 04 00 00 00 08 f9 c0 00 40 00     21:58:54.004  READ FPDMA QUEUED
  60 00 00 04 00 00 00 08 f9 bc 00 40 00     21:58:54.002  READ FPDMA QUEUED
  60 00 00 04 00 00 00 08 f9 b8 00 40 00     21:58:54.001  READ FPDMA QUEUED
  60 00 00 04 00 00 00 08 f9 b4 00 40 00     21:58:53.999  READ FPDMA QUEUED
  60 00 00 04 00 00 00 08 f9 b0 00 40 00     21:58:53.997  READ FPDMA QUEUED

Error 10542 [61] occurred at disk power-on lifetime: 51784 hours (2157 days + 16 hours)
  When the command that caused the error occurred, the device was active or idle.

  After command completion occurred, registers were:
  ER -- ST COUNT  LBA_48  LH LM LL DV DC
  -- -- -- == -- == == == -- -- -- -- --
  84 -- 41 04 00 00 00 08 ea 7c 00 40 00  Error: ICRC, ABRT at LBA = 0x08ea7c00 = 149584896

  Commands leading to the command that caused the error were:
  CR FEATR COUNT  LBA_48  LH LM LL DV DC  Powered_Up_Time  Command/Feature_Name
  -- == -- == -- == == == -- -- -- -- --  ---------------  --------------------
  60 00 00 04 00 00 00 08 ea 7c 00 40 00     21:58:53.391  READ FPDMA QUEUED
  60 00 00 04 00 00 00 08 ea 78 00 40 00     21:58:53.389  READ FPDMA QUEUED
  60 00 00 04 00 00 00 08 ea 74 00 40 00     21:58:53.388  READ FPDMA QUEUED
  60 00 00 04 00 00 00 08 ea 70 00 40 00     21:58:53.386  READ FPDMA QUEUED
  60 00 00 04 00 00 00 08 ea 6c 00 40 00     21:58:53.384  READ FPDMA QUEUED

Error 10541 [60] occurred at disk power-on lifetime: 51784 hours (2157 days + 16 hours)
  When the command that caused the error occurred, the device was active or idle.

  After command completion occurred, registers were:
  ER -- ST COUNT  LBA_48  LH LM LL DV DC
  -- -- -- == -- == == == -- -- -- -- --
  84 -- 41 04 00 00 00 08 e4 c0 00 40 00  Error: ICRC, ABRT at LBA = 0x08e4c000 = 149209088

  Commands leading to the command that caused the error were:
  CR FEATR COUNT  LBA_48  LH LM LL DV DC  Powered_Up_Time  Command/Feature_Name
  -- == -- == -- == == == -- -- -- -- --  ---------------  --------------------
  60 00 00 04 00 00 00 08 e4 c0 00 40 00     21:58:53.304  READ FPDMA QUEUED
  60 00 00 04 00 00 00 08 e4 bc 00 40 00     21:58:53.299  READ FPDMA QUEUED
  60 00 00 04 00 00 00 08 e4 b8 00 40 00     21:58:53.298  READ FPDMA QUEUED
  60 00 00 04 00 00 00 08 e4 b4 00 40 00     21:58:53.296  READ FPDMA QUEUED
  60 00 00 04 00 00 00 08 e4 b0 00 40 00     21:58:53.294  READ FPDMA QUEUED

Error 10540 [59] occurred at disk power-on lifetime: 51784 hours (2157 days + 16 hours)
  When the command that caused the error occurred, the device was active or idle.

  After command completion occurred, registers were:
  ER -- ST COUNT  LBA_48  LH LM LL DV DC
  -- -- -- == -- == == == -- -- -- -- --
  84 -- 41 04 00 00 00 08 e4 8c 00 40 00  Error: ICRC, ABRT at LBA = 0x08e48c00 = 149195776

  Commands leading to the command that caused the error were:
  CR FEATR COUNT  LBA_48  LH LM LL DV DC  Powered_Up_Time  Command/Feature_Name
  -- == -- == -- == == == -- -- -- -- --  ---------------  --------------------
  60 00 00 04 00 00 00 08 e4 8c 00 40 00     21:58:53.270  READ FPDMA QUEUED
  60 00 00 04 00 00 00 08 e4 88 00 40 00     21:58:53.268  READ FPDMA QUEUED
  60 00 00 04 00 00 00 08 e1 84 00 40 00     21:58:53.266  READ FPDMA QUEUED
  60 00 00 04 00 00 00 08 e1 80 00 40 00     21:58:53.265  READ FPDMA QUEUED
  60 00 00 04 00 00 00 08 e1 7c 00 40 00     21:58:53.263  READ FPDMA QUEUED

Error 10539 [58] occurred at disk power-on lifetime: 51784 hours (2157 days + 16 hours)
  When the command that caused the error occurred, the device was active or idle.

  After command completion occurred, registers were:
  ER -- ST COUNT  LBA_48  LH LM LL DV DC
  -- -- -- == -- == == == -- -- -- -- --
  84 -- 41 04 00 00 00 08 db 9c 00 40 00  Error: ICRC, ABRT at LBA = 0x08db9c00 = 148610048

  Commands leading to the command that caused the error were:
  CR FEATR COUNT  LBA_48  LH LM LL DV DC  Powered_Up_Time  Command/Feature_Name
  -- == -- == -- == == == -- -- -- -- --  ---------------  --------------------
  60 00 00 04 00 00 00 08 db 9c 00 40 00     21:58:53.125  READ FPDMA QUEUED
  60 00 00 04 00 00 00 08 db 98 00 40 00     21:58:53.121  READ FPDMA QUEUED
  60 00 00 04 00 00 00 08 db 94 00 40 00     21:58:53.120  READ FPDMA QUEUED
  60 00 00 04 00 00 00 08 db 90 00 40 00     21:58:53.118  READ FPDMA QUEUED
  60 00 00 04 00 00 00 08 db 8c 00 40 00     21:58:53.116  READ FPDMA QUEUED

Error 10538 [57] occurred at disk power-on lifetime: 51784 hours (2157 days + 16 hours)
  When the command that caused the error occurred, the device was active or idle.

  After command completion occurred, registers were:
  ER -- ST COUNT  LBA_48  LH LM LL DV DC
  -- -- -- == -- == == == -- -- -- -- --
  84 -- 41 04 00 00 00 27 e0 95 10 40 00  Error: ICRC, ABRT at LBA = 0x27e09510 = 669029648

  Commands leading to the command that caused the error were:
  CR FEATR COUNT  LBA_48  LH LM LL DV DC  Powered_Up_Time  Command/Feature_Name
  -- == -- == -- == == == -- -- -- -- --  ---------------  --------------------
  61 00 00 04 00 00 00 27 e0 95 10 40 00     21:37:14.056  WRITE FPDMA QUEUED
  61 00 00 04 00 00 00 27 e0 91 10 40 00     21:37:14.051  WRITE FPDMA QUEUED
  61 00 00 04 00 00 00 27 e0 8d 10 40 00     21:37:14.046  WRITE FPDMA QUEUED
  61 00 00 04 00 00 00 27 e0 89 10 40 00     21:37:14.045  WRITE FPDMA QUEUED
  61 00 00 04 00 00 00 27 e0 85 10 40 00     21:37:14.043  WRITE FPDMA QUEUED

Error 10537 [56] occurred at disk power-on lifetime: 51784 hours (2157 days + 16 hours)
  When the command that caused the error occurred, the device was active or idle.

  After command completion occurred, registers were:
  ER -- ST COUNT  LBA_48  LH LM LL DV DC
  -- -- -- == -- == == == -- -- -- -- --
  84 -- 41 04 00 00 00 0d 07 0c 00 40 00  Error: ICRC, ABRT at LBA = 0x0d070c00 = 218565632

  Commands leading to the command that caused the error were:
  CR FEATR COUNT  LBA_48  LH LM LL DV DC  Powered_Up_Time  Command/Feature_Name
  -- == -- == -- == == == -- -- -- -- --  ---------------  --------------------
  60 00 00 04 00 00 00 0d 07 0c 00 40 00     21:35:30.593  READ FPDMA QUEUED
  60 00 00 04 00 00 00 0d 07 08 00 40 00     21:35:30.592  READ FPDMA QUEUED
  60 00 00 04 00 00 00 0d 07 04 00 40 00     21:35:30.590  READ FPDMA QUEUED
  60 00 00 04 00 00 00 0d 07 00 00 40 00     21:35:30.589  READ FPDMA QUEUED
  60 00 00 04 00 00 00 0d 06 fc 00 40 00     21:35:30.587  READ FPDMA QUEUED

SMART Extended Self-test Log Version: 1 (2 sectors)
Num  Test_Description    Status                  Remaining  LifeTime(hours)  LBA_of_first_error
# 1  Short offline       Completed without error       00%     49376         -
# 2  Short offline       Completed without error       00%     47066         -

SMART Selective self-test log data structure revision number 1
 SPAN  MIN_LBA  MAX_LBA  CURRENT_TEST_STATUS
    1        0        0  Not_testing
    2        0        0  Not_testing
    3        0        0  Not_testing
    4        0        0  Not_testing
    5        0        0  Not_testing
Selective self-test flags (0x0):
  After scanning selected spans, do NOT read-scan remainder of disk.
If Selective self-test is pending on power-up, resume after 0 minute delay.

SCT Status Version:                  3
SCT Version (vendor specific):       1 (0x0001)
Device State:                        Active (0)
Current Temperature:                    21 Celsius
Power Cycle Min/Max Temperature:     14/27 Celsius
Lifetime    Min/Max Temperature:     11/40 Celsius
Specified Max Operating Temperature:    70 Celsius
Under/Over Temperature Limit Count:   0/0
Vendor specific:
00 00 59 00 00 00 00 00 00 00 00 00 00 00 00 00
00 00 00 00 00 00 00 00 00 00 00 00 00 00 00 00

SCT Temperature History Version:     2
Temperature Sampling Period:         1 minute
Temperature Logging Interval:        1 minute
Min/Max recommended Temperature:      0/70 Celsius
Min/Max Temperature Limit:            0/70 Celsius
Temperature History Size (Index):    478 (399)

SCT Error Recovery Control:
           Read:     70 (7.0 seconds)
          Write:     70 (7.0 seconds)

Device Statistics (GP Log 0x04)
Page  Offset Size        Value Flags Description
0x01  =====  =               =  ===  == General Statistics (rev 2) ==
0x01  0x008  4              10  ---  Lifetime Power-On Resets
0x01  0x018  6     33418375398  ---  Logical Sectors Written
0x01  0x020  6       485188715  ---  Number of Write Commands
0x01  0x028  6     31636033424  ---  Logical Sectors Read
0x01  0x030  6        56578479  ---  Number of Read Commands
0x04  =====  =               =  ===  == General Errors Statistics (rev 1) ==
0x04  0x008  4               0  ---  Number of Reported Uncorrectable Errors
0x04  0x010  4            2126  ---  Resets Between Cmd Acceptance and Completion
0x05  =====  =               =  ===  == Temperature Statistics (rev 1) ==
0x05  0x008  1              21  ---  Current Temperature
0x05  0x010  1              21  ---  Average Short Term Temperature
0x05  0x018  1              21  ---  Average Long Term Temperature
0x05  0x020  1              40  ---  Highest Temperature
0x05  0x028  1              13  ---  Lowest Temperature
0x05  0x030  1              23  ---  Highest Average Short Term Temperature
0x05  0x038  1              14  ---  Lowest Average Short Term Temperature
0x05  0x040  1              21  ---  Highest Average Long Term Temperature
0x05  0x048  1              14  ---  Lowest Average Long Term Temperature
0x05  0x050  4               0  ---  Time in Over-Temperature
0x05  0x058  1              70  ---  Specified Maximum Operating Temperature
0x05  0x060  4               0  ---  Time in Under-Temperature
0x05  0x068  1               0  ---  Specified Minimum Operating Temperature
0x06  =====  =               =  ===  == Transport Statistics (rev 1) ==
0x06  0x008  4            4680  ---  Number of Hardware Resets
0x06  0x010  4            4651  ---  Number of ASR Events
0x06  0x018  4          110900  ---  Number of Interface CRC Errors
0x07  =====  =               =  ===  == Solid State Device Statistics (rev 1) ==
0x07  0x008  1               2  ---  Percentage Used Endurance Indicator
                                |||_ C monitored condition met
                                ||__ D supports DSN
                                |___ N normalized value

SATA Phy Event Counters (GP Log 0x11)
ID      Size     Value  Description
0x0001  4       110900  Command failed due to ICRC error
0x0003  4         6016  R_ERR response for device-to-host data FIS
0x0004  4         4459  R_ERR response for host-to-device data FIS
0x0006  4            1  R_ERR response for device-to-host non-data FIS
0x000a  4         4559  Device-to-host register FISes sent due to a COMRESET
0x000b  4          161  CRC errors within host-to-device FIS
0x000d  4            0  Non-CRC errors within host-to-device FIS

