smartctl 7.1 2020-06-20 r5066 [x86_64-linux-3.10.0-1127...] (local build)
Copyright (C) 2002-19, Bruce Allen, Christian Franke, www.smartmontools.org

=== START OF INFORMATION SECTION ===
Model Number:                       SAMSUNG MZPLJ6T4HALA-00007
Serial Number:                      --
Firmware Version:                   EPK9AB5Q
PCI Vendor/Subsystem ID:            0x144d
IEEE OUI Identifier:                0x002538
Total NVM Capacity:                 6,401,252,745,216 [6.40 TB]
Unallocated NVM Capacity:           0
Controller ID:                      65
Number of Namespaces:               32
Namespace 1 Size/Capacity:          6,401,252,745,216 [6.40 TB]
Namespace 1 Formatted LBA Size:     512
Local Time is:                      --

=== START OF READ SMART DATA SECTION ===
SMART overall-health self-assessment test result: PASSED

SMART/Health Information (NVMe Log 0x02)
Critical Warning:                   0x00
Temperature:                        33 Celsius
Available Spare:                    100%
Available Spare Threshold:          10%
Percentage Used:                    0%
Data Units Read:                    196,516,708 [100 TB]
Data Units Written:                 794,754,689 [406 TB]
Host Read Commands:                 6,207,769,940
Host Write Commands:                34,538,560,642
Controller Busy Time:               2,339
Power Cycles:                       6
Power On Hours:                     4,645
Unsafe Shutdowns:                   2
Media and Data Integrity Errors:    0
Error Information Log Entries:      0
Warning  Comp. Temperature Time:    0
Critical Comp. Temperature Time:    0
Temperature Sensor 1:               32 Celsius
Temperature Sensor 2:               32 Celsius
Temperature Sensor 3:               33 Celsius

