smartctl 7.1 2020-06-20 r5066 [x86_64-linux-3.10.0-1160...] (local build)
Copyright (C) 2002-19, Bruce Allen, Christian Franke, www.smartmontools.org

=== START OF INFORMATION SECTION ===
Model Family:     SAMSUNG SpinPoint F4 EG (AF)
Device Model:     SAMSUNG HD204UI
Serial Number:    --
LU WWN Device Id: 5 0024e9 ...
Firmware Version: 1AQ10001
User Capacity:    2,000,398,934,016 bytes [2.00 TB]
Sector Size:      512 bytes logical/physical
Rotation Rate:    5400 rpm
Form Factor:      3.5 inches
Device is:        In smartctl database [for details use: -P show]
ATA Version is:   ATA8-ACS T13/1699-D revision 6
SATA Version is:  SATA 2.6, 3.0 Gb/s
Local Time is:    --

AAM level is:     128 (quiet), recommended: 254
APM feature is:   Disabled
Rd look-ahead is: Enabled
Write cache is:   Enabled
ATA Security is:  Disabled, NOT FROZEN [SEC1]

=== START OF READ SMART DATA SECTION ===
SMART overall-health self-assessment test result: PASSED

General SMART Values:
Offline data collection status:  (0x00)	Offline data collection activity
					was never started.

Self-test execution status:      (   0)	The previous self-test routine completed
					without error or no self-test has ever 
					been run.
Total time to complete Offline 
data collection: 		(19740) seconds.
Offline data collection
capabilities: 			 (0x5b) SMART execute Offline immediate.

					Suspend Offline collection upon new
					command.
					Offline surface scan supported.
					Self-test supported.
					No Conveyance Self-test supported.
					Selective Self-test supported.
SMART capabilities:            (0x0003)	Saves SMART data before entering
					power-saving mode.

Error logging capability:        (0x01)	Error logging supported.
					General Purpose Logging supported.
Short self-test routine 
recommended polling time: 	 (   2) minutes.
Extended self-test routine
recommended polling time: 	 ( 329) minutes.
SCT capabilities: 	       (0x003f)	SCT Status supported.
					SCT Error Recovery Control supported.
					SCT Feature Control supported.
					SCT Data Table supported.

SMART Attributes Data Structure revision number: 16
Vendor Specific SMART Attributes with Thresholds:
ID# ATTRIBUTE_NAME          FLAGS    VALUE WORST THRESH FAIL RAW_VALUE
  1 Raw_Read_Error_Rate     POSR-K   100   100   051    -    32736
  2 Throughput_Performance  -OS--K   252   252   000    -    0
  3 Spin_Up_Time            PO---K   067   067   025    -    10015
  4 Start_Stop_Count        -O--CK   097   097   000    -    3506
  5 Reallocated_Sector_Ct   PO--CK   252   252   010    -    0
  7 Seek_Error_Rate         -OSR-K   252   252   051    -    0
  8 Seek_Time_Performance   --S--K   252   252   015    -    0
  9 Power_On_Hours          -O--CK   100   100   000    -    74079
 10 Spin_Retry_Count        -O--CK   252   252   051    -    0
 11 Calibration_Retry_Count -O--CK   100   100   000    -    11
 12 Power_Cycle_Count       -O--CK   098   098   000    -    2025
181 Program_Fail_Cnt_Total  -O---K   048   048   000    -    1133425641
191 G-Sense_Error_Rate      -O---K   001   001   000    -    1709823
192 Power-Off_Retract_Count -O---K   252   252   000    -    0
194 Temperature_Celsius     -O----   046   044   000    -    54 (Min/Max 19/61)
195 Hardware_ECC_Recovered  -O-RCK   100   100   000    -    0
196 Reallocated_Event_Count -O--CK   252   252   000    -    0
197 Current_Pending_Sector  -O--CK   252   100   000    -    0
198 Offline_Uncorrectable   ----CK   252   252   000    -    0
199 UDMA_CRC_Error_Count    -OS-CK   200   200   000    -    0
200 Multi_Zone_Error_Rate   -O-R-K   001   001   000    -    1366127
223 Load_Retry_Count        -O--CK   100   100   000    -    11
225 Load_Cycle_Count        -O--CK   100   100   000    -    3759
                            ||||||_ K auto-keep
                            |||||__ C event count
                            ||||___ R error rate
                            |||____ S speed/performance
                            ||_____ O updated online
                            |______ P prefailure warning

General Purpose Log Directory Version 1
SMART           Log Directory Version 1 [multi-sector log support]
Address    Access  R/W   Size  Description
0x00       GPL,SL  R/O      1  Log Directory
0x01           SL  R/O      1  Summary SMART error log
0x02           SL  R/O      2  Comprehensive SMART error log
0x03       GPL     R/O      2  Ext. Comprehensive SMART error log
0x06           SL  R/O      1  SMART self-test log
0x07       GPL     R/O      2  Extended self-test log
0x08       GPL     R/O      2  Power Conditions log
0x09           SL  R/W      1  Selective self-test log
0x10       GPL     R/O      1  NCQ Command Error log
0x11       GPL     R/O      1  SATA Phy Event Counters log
0x80-0x9f  GPL,SL  R/W     16  Host vendor specific log
0xe0       GPL,SL  R/W      1  SCT Command/Status
0xe1       GPL,SL  R/W      1  SCT Data Transfer

SMART Extended Comprehensive Error Log Version: 1 (2 sectors)
Device Error Count: 608 (device log contains only the most recent 8 errors)
	CR     = Command Register
	FEATR  = Features Register
	COUNT  = Count (was: Sector Count) Register
	LBA_48 = Upper bytes of LBA High/Mid/Low Registers ]  ATA-8
	LH     = LBA High (was: Cylinder High) Register    ]   LBA
	LM     = LBA Mid (was: Cylinder Low) Register      ] Register
	LL     = LBA Low (was: Sector Number) Register     ]
	DV     = Device (was: Device/Head) Register
	DC     = Device Control Register
	ER     = Error register
	ST     = Status register
Powered_Up_Time is measured from power on, and printed as
DDd+hh:mm:SS.sss where DD=days, hh=hours, mm=minutes,
SS=sec, and sss=millisec. It "wraps" after 49.710 days.

Error 608 [7] occurred at disk power-on lifetime: 52722 hours (2196 days + 18 hours)
  When the command that caused the error occurred, the device was active or idle.

  After command completion occurred, registers were:
  ER -- ST COUNT  LBA_48  LH LM LL DV DC
  -- -- -- == -- == == == -- -- -- -- --
  40 -- 51 00 d8 00 00 65 a5 d2 28 40 00  Error: UNC at LBA = 0x65a5d228 = 1705366056

  Commands leading to the command that caused the error were:
  CR FEATR COUNT  LBA_48  LH LM LL DV DC  Powered_Up_Time  Command/Feature_Name
  -- == -- == -- == == == -- -- -- -- --  ---------------  --------------------
  60 00 00 01 00 00 00 65 a5 e4 00 40 00     00:00:00.565  READ FPDMA QUEUED
  60 00 00 01 00 00 00 65 a5 d2 00 40 00     00:00:00.559  READ FPDMA QUEUED
  60 00 00 01 00 00 00 65 a5 e3 00 40 00     00:00:00.559  READ FPDMA QUEUED
  60 00 00 01 00 00 00 65 a5 e2 00 40 00     00:00:00.559  READ FPDMA QUEUED
  60 00 00 01 00 00 00 65 a5 e1 00 40 00     00:00:00.559  READ FPDMA QUEUED

Error 607 [6] occurred at disk power-on lifetime: 46188 hours (1924 days + 12 hours)
  When the command that caused the error occurred, the device was active or idle.

  After command completion occurred, registers were:
  ER -- ST COUNT  LBA_48  LH LM LL DV DC
  -- -- -- == -- == == == -- -- -- -- --
  40 -- 51 00 e8 00 00 94 0d d6 18 40 00  Error: UNC at LBA = 0x940dd618 = 2483934744

  Commands leading to the command that caused the error were:
  CR FEATR COUNT  LBA_48  LH LM LL DV DC  Powered_Up_Time  Command/Feature_Name
  -- == -- == -- == == == -- -- -- -- --  ---------------  --------------------
  60 00 00 01 00 00 00 94 0d e6 00 40 00     00:00:00.497  READ FPDMA QUEUED
  60 00 00 01 00 00 00 94 0d d6 00 40 00     00:00:00.493  READ FPDMA QUEUED
  60 00 00 01 00 00 00 94 0d e5 00 40 00     00:00:00.493  READ FPDMA QUEUED
  60 00 00 01 00 00 00 94 0d e4 00 40 00     00:00:00.493  READ FPDMA QUEUED
  60 00 00 01 00 00 00 94 0d e3 00 40 00     00:00:00.493  READ FPDMA QUEUED

Error 606 [5] occurred at disk power-on lifetime: 44016 hours (1834 days + 0 hours)
  When the command that caused the error occurred, the device was active or idle.

  After command completion occurred, registers were:
  ER -- ST COUNT  LBA_48  LH LM LL DV DC
  -- -- -- == -- == == == -- -- -- -- --
  40 -- 51 00 a8 00 00 6d 43 6c 58 40 00  Error: UNC at LBA = 0x6d436c58 = 1833135192

  Commands leading to the command that caused the error were:
  CR FEATR COUNT  LBA_48  LH LM LL DV DC  Powered_Up_Time  Command/Feature_Name
  -- == -- == -- == == == -- -- -- -- --  ---------------  --------------------
  60 00 00 01 00 00 00 6d 43 6d 00 40 00     00:00:00.492  READ FPDMA QUEUED
  60 00 00 01 00 00 00 6d 43 6c 00 40 00     00:00:00.487  READ FPDMA QUEUED
  60 00 00 01 00 00 00 6d 43 6c 00 40 00     00:00:00.487  READ FPDMA QUEUED
  60 00 00 01 00 00 00 6d 43 6b 00 40 00     00:00:00.487  READ FPDMA QUEUED
  60 00 00 01 00 00 00 6d 43 6a 00 40 00     00:00:00.487  READ FPDMA QUEUED

Error 605 [4] occurred at disk power-on lifetime: 43328 hours (1805 days + 8 hours)
  When the command that caused the error occurred, the device was active or idle.

  After command completion occurred, registers were:
  ER -- ST COUNT  LBA_48  LH LM LL DV DC
  -- -- -- == -- == == == -- -- -- -- --
  40 -- 51 00 d8 00 00 6d b6 3f 28 40 00  Error: UNC at LBA = 0x6db63f28 = 1840660264

  Commands leading to the command that caused the error were:
  CR FEATR COUNT  LBA_48  LH LM LL DV DC  Powered_Up_Time  Command/Feature_Name
  -- == -- == -- == == == -- -- -- -- --  ---------------  --------------------
  60 00 00 01 00 00 00 6d b6 3f 00 40 00     00:00:00.451  READ FPDMA QUEUED
  60 00 00 01 00 00 00 6d b6 55 00 40 00     00:00:00.456  READ FPDMA QUEUED
  60 00 00 01 00 00 00 6d b6 54 00 40 00     00:00:00.456  READ FPDMA QUEUED
  60 00 00 01 00 00 00 6d b6 53 00 40 00     00:00:00.456  READ FPDMA QUEUED
  60 00 00 01 00 00 00 6d b6 52 00 40 00     00:00:00.456  READ FPDMA QUEUED

Error 604 [3] occurred at disk power-on lifetime: 43328 hours (1805 days + 8 hours)
  When the command that caused the error occurred, the device was active or idle.

  After command completion occurred, registers were:
  ER -- ST COUNT  LBA_48  LH LM LL DV DC
  -- -- -- == -- == == == -- -- -- -- --
  40 -- 51 00 40 00 00 6d b6 3e c0 40 00  Error: UNC at LBA = 0x6db63ec0 = 1840660160

  Commands leading to the command that caused the error were:
  CR FEATR COUNT  LBA_48  LH LM LL DV DC  Powered_Up_Time  Command/Feature_Name
  -- == -- == -- == == == -- -- -- -- --  ---------------  --------------------
  60 00 00 01 00 00 00 6d b6 55 00 40 00     00:00:00.456  READ FPDMA QUEUED
  60 00 00 01 00 00 00 6d b6 3e 00 40 00     00:00:00.451  READ FPDMA QUEUED
  60 00 00 01 00 00 00 6d b6 54 00 40 00     00:00:00.451  READ FPDMA QUEUED
  60 00 00 01 00 00 00 6d b6 53 00 40 00     00:00:00.451  READ FPDMA QUEUED
  60 00 00 01 00 00 00 6d b6 52 00 40 00     00:00:00.451  READ FPDMA QUEUED

Error 603 [2] occurred at disk power-on lifetime: 41674 hours (1736 days + 10 hours)
  When the command that caused the error occurred, the device was active or idle.

  After command completion occurred, registers were:
  ER -- ST COUNT  LBA_48  LH LM LL DV DC
  -- -- -- == -- == == == -- -- -- -- --
  40 -- 51 00 20 00 00 6d 43 6c a0 40 00  Error: UNC at LBA = 0x6d436ca0 = 1833135264

  Commands leading to the command that caused the error were:
  CR FEATR COUNT  LBA_48  LH LM LL DV DC  Powered_Up_Time  Command/Feature_Name
  -- == -- == -- == == == -- -- -- -- --  ---------------  --------------------
  60 00 00 00 20 00 00 6d 43 6c a0 40 00     00:00:24.772  READ FPDMA QUEUED
  60 00 00 00 20 00 00 6d 43 6c a0 40 00     00:00:24.788  READ FPDMA QUEUED
  60 00 00 00 08 00 00 74 48 60 40 40 00     00:00:24.788  READ FPDMA QUEUED
  2f 00 00 00 01 00 00 00 00 00 10 e0 00     00:00:24.788  READ LOG EXT
  60 00 00 00 20 00 00 6d 43 6c a0 40 00     00:00:24.772  READ FPDMA QUEUED

Error 602 [1] occurred at disk power-on lifetime: 41674 hours (1736 days + 10 hours)
  When the command that caused the error occurred, the device was active or idle.

  After command completion occurred, registers were:
  ER -- ST COUNT  LBA_48  LH LM LL DV DC
  -- -- -- == -- == == == -- -- -- -- --
  40 -- 51 00 20 00 00 6d 43 6c a0 40 00  Error: UNC at LBA = 0x6d436ca0 = 1833135264

  Commands leading to the command that caused the error were:
  CR FEATR COUNT  LBA_48  LH LM LL DV DC  Powered_Up_Time  Command/Feature_Name
  -- == -- == -- == == == -- -- -- -- --  ---------------  --------------------
  60 00 00 00 20 00 00 6d 43 6c a0 40 00     00:00:24.772  READ FPDMA QUEUED
  60 00 00 00 08 00 00 74 48 60 40 40 00     00:00:24.783  READ FPDMA QUEUED
  60 00 00 00 20 00 00 6d 43 6c a0 40 00     00:00:24.783  READ FPDMA QUEUED
  60 00 00 00 08 00 00 74 48 60 00 40 00     00:00:24.783  READ FPDMA QUEUED
  61 00 00 00 20 00 00 6d 43 6c 80 40 00     00:00:24.783  WRITE FPDMA QUEUED

Error 601 [0] occurred at disk power-on lifetime: 41674 hours (1736 days + 10 hours)
  When the command that caused the error occurred, the device was active or idle.

  After command completion occurred, registers were:
  ER -- ST COUNT  LBA_48  LH LM LL DV DC
  -- -- -- == -- == == == -- -- -- -- --
  40 -- 51 00 08 00 00 6d 43 6c 98 40 00  Error: UNC at LBA = 0x6d436c98 = 1833135256

  Commands leading to the command that caused the error were:
  CR FEATR COUNT  LBA_48  LH LM LL DV DC  Powered_Up_Time  Command/Feature_Name
  -- == -- == -- == == == -- -- -- -- --  ---------------  --------------------
  60 00 00 00 20 00 00 6d 43 6c 80 40 00     00:00:24.772  READ FPDMA QUEUED
  60 00 00 00 08 00 00 74 48 60 00 40 00     00:00:24.777  READ FPDMA QUEUED
  60 00 00 00 20 00 00 6d 43 6c 80 40 00     00:00:24.777  READ FPDMA QUEUED
  2f 00 00 00 01 00 00 00 00 00 10 e0 00     00:00:24.777  READ LOG EXT
  60 00 00 00 20 00 00 6d 43 6c 80 40 00     00:00:24.772  READ FPDMA QUEUED

SMART Extended Self-test Log Version: 1 (2 sectors)
Num  Test_Description    Status                  Remaining  LifeTime(hours)  LBA_of_first_error
# 1  Short offline       Completed without error       00%     53848         -
# 2  Extended offline    Interrupted (host reset)      90%     53845         -
# 3  Offline             Interrupted (host reset)      50%     53845         -
# 4  Short captive       Self-test routine in progress 50%     53845         -
# 5  Offline             Interrupted (host reset)      90%     53788         -
# 6  Extended captive    Self-test routine in progress 90%     53788         -
# 7  Short offline       Completed without error       00%     53788         -
# 8  Short offline       Completed: read failure       90%     32930         58499008
# 9  Extended offline    Completed: read failure       90%     32930         58499008
#10  Short offline       Completed: read failure       90%     32930         58499008

SMART Selective self-test log data structure revision number 0

 SPAN  MIN_LBA  MAX_LBA  CURRENT_TEST_STATUS
    1        0        0  Completed [00% left] (0-65535)
    2        0        0  Not_testing
    3        0        0  Not_testing
    4        0        0  Not_testing
    5        0        0  Not_testing
Selective self-test flags (0x0):
  After scanning selected spans, do NOT read-scan remainder of disk.
If Selective self-test is pending on power-up, resume after 0 minute delay.

SCT Status Version:                  2
SCT Version (vendor specific):       256 (0x0100)
Device State:                        Active (0)
Current Temperature:                    53 Celsius
Power Cycle Min/Max Temperature:     37/59 Celsius
Lifetime    Min/Max Temperature:     18/61 Celsius
Specified Max Operating Temperature:    80 Celsius
Under/Over Temperature Limit Count:   0/0

SCT Temperature History Version:     2
Temperature Sampling Period:         5 minutes
Temperature Logging Interval:        5 minutes
Min/Max recommended Temperature:     -5/80 Celsius
Min/Max Temperature Limit:           -10/85 Celsius
Temperature History Size (Index):    128 (0)

SCT Error Recovery Control:
           Read: Disabled
          Write: Disabled

SATA Phy Event Counters (GP Log 0x11)
ID      Size     Value  Description
0x0001  4            0  Command failed due to ICRC error
0x0002  4            0  R_ERR response for data FIS
0x0003  4            0  R_ERR response for device-to-host data FIS
0x0004  4            0  R_ERR response for host-to-device data FIS
0x0005  4            0  R_ERR response for non-data FIS
0x0006  4            0  R_ERR response for device-to-host non-data FIS
0x0007  4            0  R_ERR response for host-to-device non-data FIS
0x0008  4            0  Device-to-host non-data FIS retries
0x0009  4            1  Transition from drive PhyRdy to drive PhyNRdy
0x000a  4            2  Device-to-host register FISes sent due to a COMRESET
0x000b  4            0  CRC errors within host-to-device FIS
0x000d  4            0  Non-CRC errors within host-to-device FIS
0x000f  4            0  R_ERR response for host-to-device data FIS, CRC
0x0010  4            0  R_ERR response for host-to-device data FIS, non-CRC
0x0012  4            0  R_ERR response for host-to-device non-data FIS, CRC
0x0013  4            0  R_ERR response for host-to-device non-data FIS, non-CRC
0x8e00  4            0  Vendor specific
0x8e01  4            0  Vendor specific
0x8e02  4            0  Vendor specific
0x8e03  4            0  Vendor specific
0x8e04  4            0  Vendor specific
0x8e05  4            0  Vendor specific
0x8e06  4            0  Vendor specific
0x8e07  4            0  Vendor specific
0x8e08  4            0  Vendor specific
0x8e09  4            0  Vendor specific
0x8e0a  4            0  Vendor specific
0x8e0b  4            0  Vendor specific
0x8e0c  4            0  Vendor specific
0x8e0d  4            0  Vendor specific
0x8e0e  4            0  Vendor specific
0x8e0f  4            0  Vendor specific
0x8e10  4            0  Vendor specific
0x8e11  4            0  Vendor specific

