smartctl 7.4 2023-08-01 r5530 [x86_64-linux-3.10.0-1160...] (local build)
Copyright (C) 2002-23, Bruce Allen, Christian Franke, www.smartmontools.org

=== START OF INFORMATION SECTION ===
Model Number:                       INTEL SSDPE2KE016T8
Serial Number:                      --
Firmware Version:                   VDV10152
PCI Vendor/Subsystem ID:            0x8086
IEEE OUI Identifier:                0x5cd2e4
Total NVM Capacity:                 1,600,321,314,816 [1.60 TB]
Unallocated NVM Capacity:           0
Controller ID:                      0
NVMe Version:                       1.2
Number of Namespaces:               128
Namespace 1 Size/Capacity:          1,600,321,314,816 [1.60 TB]
Namespace 1 Formatted LBA Size:     512
Namespace 1 IEEE EUI-64:            5cd2e4 ...
Local Time is:                      Sun Sep ... 2024 +05

=== START OF READ SMART DATA SECTION ===
SMART overall-health self-assessment test result: PASSED

SMART/Health Information (NVMe Log 0x02)
Critical Warning:                   0x00
Temperature:                        33 Celsius
Available Spare:                    100%
Available Spare Threshold:          10%
Percentage Used:                    1%
Data Units Read:                    101,339,685 [51.8 TB]
Data Units Written:                 121,092,758 [61.9 TB]
Host Read Commands:                 1,973,430,939
Host Write Commands:                4,881,005,693
Controller Busy Time:               242
Power Cycles:                       77
Power On Hours:                     38,150
Unsafe Shutdowns:                   49
Media and Data Integrity Errors:    0
Error Information Log Entries:      0
Warning  Comp. Temperature Time:    0
Critical Comp. Temperature Time:    0

Error Information (NVMe Log 0x01, 16 of 64 entries)
No Errors Logged

