smartctl 7.1 2020-06-20 r5066 [x86_64-linux-3.10.0-1160...] (local build)
Copyright (C) 2002-19, Bruce Allen, Christian Franke, www.smartmontools.org

=== START OF INFORMATION SECTION ===
Model Number:                       Micron_7300_MTFDHBE3T8TDF
Serial Number:                      --
Firmware Version:                   95420260
PCI Vendor/Subsystem ID:            0x1344
IEEE OUI Identifier:                0x00a075
Total NVM Capacity:                 3,840,755,982,336 [3.84 TB]
Unallocated NVM Capacity:           0
Controller ID:                      1
Number of Namespaces:               1
Namespace 1 Size/Capacity:          3,840,755,982,336 [3.84 TB]
Namespace 1 Formatted LBA Size:     512
Namespace 1 IEEE EUI-64:            00a075 ...
Local Time is:                      --

=== START OF READ SMART DATA SECTION ===
SMART overall-health self-assessment test result: PASSED

SMART/Health Information (NVMe Log 0x02)
Critical Warning:                   0x00
Temperature:                        34 Celsius
Available Spare:                    100%
Available Spare Threshold:          5%
Percentage Used:                    0%
Data Units Read:                    1,994 [1.02 GB]
Data Units Written:                 117,817 [60.3 GB]
Host Read Commands:                 81,822
Host Write Commands:                462,802
Controller Busy Time:               18
Power Cycles:                       21
Power On Hours:                     3,973
Unsafe Shutdowns:                   11
Media and Data Integrity Errors:    0
Error Information Log Entries:      0
Warning  Comp. Temperature Time:    0
Critical Comp. Temperature Time:    0
Temperature Sensor 1:               42 Celsius
Temperature Sensor 2:               36 Celsius

