smartctl 6.6 2017-11-05 r4594 [x86_64-linux-3.10.0-957...] (local build)
Copyright (C) 2002-17, Bruce Allen, Christian Franke, www.smartmontools.org

=== START OF INFORMATION SECTION ===
Model Family:     Sandisk SATA Cloudspeed Max and GEN2 ESS SSDs
Device Model:     SDLF1CRR-019T-1HA1
Serial Number:    --
LU WWN Device Id: 5 001173 ...
Firmware Version: ZR06RPA1
User Capacity:    1,920,383,410,176 bytes [1.92 TB]
Sector Sizes:     512 bytes logical, 4096 bytes physical
Rotation Rate:    Solid State Device
Device is:        In smartctl database [for details use: -P show]
ATA Version is:   ATA8-ACS T13/1699-D revision 4c
SATA Version is:  SATA 3.1, 6.0 Gb/s (current: 6.0 Gb/s)
Local Time is:    --

=== START OF READ SMART DATA SECTION ===
SMART overall-health self-assessment test result: PASSED

SMART Attributes Data Structure revision number: 16
Vendor Specific SMART Attributes with Thresholds:
ID# ATTRIBUTE_NAME          FLAGS    VALUE WORST THRESH FAIL RAW_VALUE
  5 Reallocated_Sector_Ct   PO--CK   100   100   010    -    0
  9 Power_On_Hours          -O--CK   087   087   000    -    11723 (5 151 0)
 13 Lifetime_UECC_Ct        -O--C-   100   100   001    -    8
 32 Lifetime_Write_AmpFctr  -O----   100   100   000    -    595
 33 Write_AmpFctr           -O----   100   100   000    -    22712
170 Reserve_Erase_BlkCt     -O--CK   100   100   000    -    18099
171 Program_Fail_Ct         -O--CK   100   100   000    -    0
172 Erase_Fail_Ct           -O--CK   100   100   000    -    0
175 Lifetime_Die_Failure_Ct -O--CK   100   100   000    -    0
178 SSD_LifeLeft(0.01%)     -O--C-   100   100   000    -    9834
183 LT_Link_Rate_DwnGrd_Ct  -O--CK   100   100   000    -    3
191 Clean_Shutdown_Ct       -O--CK   100   100   000    -    12
192 Unclean_Shutdown_Ct     -O--CK   100   100   000    -    0
194 Temperature_Celsius     -O---K   062   051   030    -    38 (Min/Max 30/49)
196 Lifetime_Retried_Blk_Ct PO-RC-   100   100   010    -    0
211 Read_Disturb_ReallocEvt -O--CK   100   100   000    -    0
233 Lifetime_Nand_Writes    -O--CK   100   100   000    -    24320
235 Capacitor_Health        -O--CK   100   100   000    -    0
241 Total_LBAs_Written      -O--CK   100   100   000    -    51072
242 Total_LBAs_Read         -O--CK   100   100   000    -    70336
244 Therm_Throt_Activation  -O--CK   100   100   000    -    0
245 Drive_Life_Remaining%   -O--C-   099   099   002    -    99
253 SPI_Test_Remaining      -O--C-   100   100   001    -    0
                            ||||||_ K auto-keep
                            |||||__ C event count
                            ||||___ R error rate
                            |||____ S speed/performance
                            ||_____ O updated online
                            |______ P prefailure warning

SMART Extended Comprehensive Error Log Version: 1 (1 sectors)

Current Temperature:                    38 Celsius

