smartctl 6.6 2017-11-05 r4594 [x86_64-linux-3.10.0-693...] (local build)
Copyright (C) 2002-17, Bruce Allen, Christian Franke, www.smartmontools.org

=== START OF INFORMATION SECTION ===
Model Family:     SiliconMotion based SSDs
Device Model:     CT960BX200SSD1
Serial Number:    --
LU WWN Device Id: 5 00a075 ...
Firmware Version: MU02.6
User Capacity:    960,197,124,096 bytes [960 GB]
Sector Sizes:     512 bytes logical, 4096 bytes physical
Rotation Rate:    Solid State Device
Device is:        In smartctl database [for details use: -P show]
ATA Version is:   ACS-2 (minor revision not indicated)
SATA Version is:  SATA 3.1, 6.0 Gb/s (current: 6.0 Gb/s)
Local Time is:    --

=== START OF READ SMART DATA SECTION ===
SMART overall-health self-assessment test result: PASSED

SMART Attributes Data Structure revision number: 1
Vendor Specific SMART Attributes with Thresholds:
ID# ATTRIBUTE_NAME          FLAGS    VALUE WORST THRESH FAIL RAW_VALUE
  1 Raw_Read_Error_Rate     ------   100   100   000    -    0
  5 Reallocated_Sector_Ct   ------   100   100   000    -    0
  9 Power_On_Hours          ------   100   100   000    -    4350
 12 Power_Cycle_Count       ------   100   100   000    -    9
160 Uncorrectable_Error_Cnt ------   100   100   000    -    0
161 Valid_Spare_Block_Cnt   ------   100   100   000    -    114
163 Initial_Bad_Block_Count ------   100   100   000    -    1180
148 Total_SLC_Erase_Ct      ------   100   100   000    -    69089
149 Max_SLC_Erase_Ct        ------   100   100   000    -    521
150 Min_SLC_Erase_Ct        ------   100   100   000    -    436
151 Average_SLC_Erase_Ct    ------   100   100   000    -    508
164 Total_Erase_Count       ------   100   100   000    -    8631
165 Max_Erase_Count         ------   100   100   000    -    5
166 Min_Erase_Count         ------   100   100   000    -    1
167 Average_Erase_Count     ------   100   100   000    -    3
169 Remaining_Lifetime_Perc ------   100   100   001    -    100
181 Program_Fail_Cnt_Total  ------   100   100   000    -    0
182 Erase_Fail_Count_Total  ------   100   100   000    -    0
192 Power-Off_Retract_Count ------   100   100   000    -    4
194 Temperature_Celsius     ------   100   100   070    -    24 (33 32 32 30 0)
199 UDMA_CRC_Error_Count    ------   100   100   000    -    0
232 Available_Reservd_Space ------   100   100   000    -    100
241 Host_Writes_32MiB       ------   100   100   000    -    192083
242 Host_Reads_32MiB        ------   100   100   000    -    5502
245 TLC_Writes_32MiB        ------   100   100   000    -    101953
246 SLC_Writes_32MiB        ------   100   100   000    -    276356
247 Raid_Recoverty_Ct       ------   100   100   000    -    0
                            ||||||_ K auto-keep
                            |||||__ C event count
                            ||||___ R error rate
                            |||____ S speed/performance
                            ||_____ O updated online
                            |______ P prefailure warning

SMART Extended Comprehensive Error Log Version: 1 (1 sectors)
No Errors Logged

