smartctl 7.1 2020-06-20 r5066 [x86_64-linux-3.10.0-1160...] (local build)
Copyright (C) 2002-19, Bruce Allen, Christian Franke, www.smartmontools.org

=== START OF INFORMATION SECTION ===
Model Family:     Seagate Barracuda 7200.14 (AF)
Device Model:     ST1000DM003-1CH162
Serial Number:    --
LU WWN Device Id: 5 000c50 ...
Firmware Version: CC44
User Capacity:    1,000,204,886,016 bytes [1.00 TB]
Sector Sizes:     512 bytes logical, 4096 bytes physical
Rotation Rate:    7200 rpm
Form Factor:      3.5 inches
Device is:        In smartctl database [for details use: -P show]
ATA Version is:   ATA8-ACS T13/1699-D revision 4
SATA Version is:  SATA 3.0, 6.0 Gb/s (current: 6.0 Gb/s)
Local Time is:    Fri Apr ... 2022 PDT
APM level is:     128 (minimum power consumption without standby)
Rd look-ahead is: Enabled
Write cache is:   Enabled
ATA Security is:  Disabled, frozen [SEC2]

=== START OF READ SMART DATA SECTION ===
SMART overall-health self-assessment test result: PASSED

General SMART Values:
Offline data collection status:  (0x00)	Offline data collection activity
					was never started.

Self-test execution status:      (   0)	The previous self-test routine completed
					without error or no self-test has ever 
					been run.
Total time to complete Offline 
data collection: 		(  584) seconds.
Offline data collection
capabilities: 			 (0x73) SMART execute Offline immediate.

					Suspend Offline collection upon new
					command.
					No Offline surface scan supported.
					Self-test supported.
					Conveyance Self-test supported.
					Selective Self-test supported.
SMART capabilities:            (0x0003)	Saves SMART data before entering
					power-saving mode.

Error logging capability:        (0x01)	Error logging supported.
					General Purpose Logging supported.
Short self-test routine 
recommended polling time: 	 (   1) minutes.
Extended self-test routine
recommended polling time: 	 ( 108) minutes.
Conveyance self-test routine
recommended polling time: 	 (   2) minutes.
SCT capabilities: 	       (0x3085)	SCT Status supported.

SMART Attributes Data Structure revision number: 10
Vendor Specific SMART Attributes with Thresholds:
ID# ATTRIBUTE_NAME          FLAGS    VALUE WORST THRESH FAIL RAW_VALUE
  1 Raw_Read_Error_Rate     POSR--   099   078   006    -    125236836
  3 Spin_Up_Time            PO----   097   097   000    -    0
  4 Start_Stop_Count        -O--CK   100   100   020    -    941
  5 Reallocated_Sector_Ct   PO--CK   100   100   010    -    0
  7 Seek_Error_Rate         POSR--   069   060   030    -    111873276129
  9 Power_On_Hours          -O--CK   077   077   000    -    20190
 10 Spin_Retry_Count        PO--C-   100   100   097    -    0
 12 Power_Cycle_Count       -O--CK   100   100   020    -    938
183 Runtime_Bad_Block       -O--CK   100   100   000    -    0
184 End-to-End_Error        -O--CK   100   100   099    -    0
187 Reported_Uncorrect      -O--CK   001   001   000    -    19906
188 Command_Timeout         -O--CK   100   100   000    -    0 0 0
189 High_Fly_Writes         -O-RCK   100   100   000    -    0
190 Airflow_Temperature_Cel -O---K   055   053   045    -    45 (Min/Max 24/47)
191 G-Sense_Error_Rate      -O--CK   100   100   000    -    0
192 Power-Off_Retract_Count -O--CK   100   100   000    -    35
193 Load_Cycle_Count        -O--CK   001   001   000    -    222632
194 Temperature_Celsius     -O---K   045   047   000    -    45 (0 11 0 0 0)
197 Current_Pending_Sector  -O--C-   091   091   000    -    1512
198 Offline_Uncorrectable   ----C-   091   091   000    -    1512
199 UDMA_CRC_Error_Count    -OSRCK   200   200   000    -    0
240 Head_Flying_Hours       ------   100   253   000    -    18029h+42m+59.583s
241 Total_LBAs_Written      ------   100   253   000    -    17495332767
242 Total_LBAs_Read         ------   100   253   000    -    23615366913
                            ||||||_ K auto-keep
                            |||||__ C event count
                            ||||___ R error rate
                            |||____ S speed/performance
                            ||_____ O updated online
                            |______ P prefailure warning

General Purpose Log Directory Version 1
SMART           Log Directory Version 1 [multi-sector log support]
Address    Access  R/W   Size  Description
0x00       GPL,SL  R/O      1  Log Directory
0x01           SL  R/O      1  Summary SMART error log
0x02           SL  R/O      5  Comprehensive SMART error log
0x03       GPL     R/O      5  Ext. Comprehensive SMART error log
0x06           SL  R/O      1  SMART self-test log
0x07       GPL     R/O      1  Extended self-test log
0x09           SL  R/W      1  Selective self-test log
0x10       GPL     R/O      1  NCQ Command Error log
0x11       GPL     R/O      1  SATA Phy Event Counters log
0x21       GPL     R/O      1  Write stream error log
0x22       GPL     R/O      1  Read stream error log
0x80-0x9f  GPL,SL  R/W     16  Host vendor specific log
0xa1       GPL,SL  VS      20  Device vendor specific log
0xa2       GPL     VS    4496  Device vendor specific log
0xa8       GPL,SL  VS     129  Device vendor specific log
0xa9       GPL,SL  VS       1  Device vendor specific log
0xab       GPL     VS       1  Device vendor specific log
0xb0       GPL     VS    5176  Device vendor specific log
0xbd       GPL     VS     512  Device vendor specific log
0xbe-0xbf  GPL     VS   65535  Device vendor specific log
0xc0       GPL,SL  VS       1  Device vendor specific log
0xc1       GPL,SL  VS      10  Device vendor specific log
0xc4       GPL,SL  VS       5  Device vendor specific log
0xe0       GPL,SL  R/W      1  SCT Command/Status
0xe1       GPL,SL  R/W      1  SCT Data Transfer

SMART Extended Comprehensive Error Log Version: 1 (5 sectors)
Device Error Count: 19992 (device log contains only the most recent 20 errors)
	CR     = Command Register
	FEATR  = Features Register
	COUNT  = Count (was: Sector Count) Register
	LBA_48 = Upper bytes of LBA High/Mid/Low Registers ]  ATA-8
	LH     = LBA High (was: Cylinder High) Register    ]   LBA
	LM     = LBA Mid (was: Cylinder Low) Register      ] Register
	LL     = LBA Low (was: Sector Number) Register     ]
	DV     = Device (was: Device/Head) Register
	DC     = Device Control Register
	ER     = Error register
	ST     = Status register
Powered_Up_Time is measured from power on, and printed as
DDd+hh:mm:SS.sss where DD=days, hh=hours, mm=minutes,
SS=sec, and sss=millisec. It "wraps" after 49.710 days.

Error 19992 [11] occurred at disk power-on lifetime: 20174 hours (840 days + 14 hours)
  When the command that caused the error occurred, the device was active or idle.

  After command completion occurred, registers were:
  ER -- ST COUNT  LBA_48  LH LM LL DV DC
  -- -- -- == -- == == == -- -- -- -- --
  40 -- 51 00 00 00 00 00 18 92 f0 00 00  Error: WP at LBA = 0x001892f0 = 1610480

  Commands leading to the command that caused the error were:
  CR FEATR COUNT  LBA_48  LH LM LL DV DC  Powered_Up_Time  Command/Feature_Name
  -- == -- == -- == == == -- -- -- -- --  ---------------  --------------------
  61 00 00 00 10 00 00 00 59 8b b8 40 00     00:35:15.171  WRITE FPDMA QUEUED
  60 00 00 01 00 00 00 00 18 92 80 40 00     00:35:15.171  READ FPDMA QUEUED
  61 00 00 00 08 00 00 00 62 4e 28 40 00     00:35:15.170  WRITE FPDMA QUEUED
  ef 00 90 00 03 00 00 00 00 00 00 00 00     00:35:15.170  SET FEATURES [Disable SATA feature]
  ef 00 02 00 00 00 00 00 00 00 00 00 00     00:35:15.170  SET FEATURES [Enable write cache]

Error 19991 [10] occurred at disk power-on lifetime: 20174 hours (840 days + 14 hours)
  When the command that caused the error occurred, the device was active or idle.

  After command completion occurred, registers were:
  ER -- ST COUNT  LBA_48  LH LM LL DV DC
  -- -- -- == -- == == == -- -- -- -- --
  40 -- 51 00 00 00 00 00 18 92 f0 00 00  Error: UNC at LBA = 0x001892f0 = 1610480

  Commands leading to the command that caused the error were:
  CR FEATR COUNT  LBA_48  LH LM LL DV DC  Powered_Up_Time  Command/Feature_Name
  -- == -- == -- == == == -- -- -- -- --  ---------------  --------------------
  60 00 00 01 00 00 00 00 18 92 80 40 00     00:35:12.206  READ FPDMA QUEUED
  61 00 00 00 08 00 00 00 59 8b b8 40 00     00:35:12.206  WRITE FPDMA QUEUED
  ef 00 90 00 03 00 00 00 00 00 00 00 00     00:35:12.206  SET FEATURES [Disable SATA feature]
  ef 00 02 00 00 00 00 00 00 00 00 00 00     00:35:12.206  SET FEATURES [Enable write cache]
  00 00 00 00 00 00 00 00 00 00 00 00 ff     00:35:12.096  NOP [Abort queued commands]

Error 19990 [9] occurred at disk power-on lifetime: 20174 hours (840 days + 14 hours)
  When the command that caused the error occurred, the device was active or idle.

  After command completion occurred, registers were:
  ER -- ST COUNT  LBA_48  LH LM LL DV DC
  -- -- -- == -- == == == -- -- -- -- --
  40 -- 51 00 00 00 00 00 18 92 f0 00 00  Error: WP at LBA = 0x001892f0 = 1610480

  Commands leading to the command that caused the error were:
  CR FEATR COUNT  LBA_48  LH LM LL DV DC  Powered_Up_Time  Command/Feature_Name
  -- == -- == -- == == == -- -- -- -- --  ---------------  --------------------
  61 00 00 00 08 00 00 00 5e 3f 10 40 00     00:35:09.248  WRITE FPDMA QUEUED
  61 00 00 00 08 00 00 00 5e 3f 28 40 00     00:35:09.247  WRITE FPDMA QUEUED
  60 00 00 01 00 00 00 00 18 92 80 40 00     00:35:09.247  READ FPDMA QUEUED
  61 00 00 00 10 00 00 00 5f d5 e8 40 00     00:35:09.246  WRITE FPDMA QUEUED
  61 00 00 00 10 00 00 00 59 8b b0 40 00     00:35:09.246  WRITE FPDMA QUEUED

Error 19989 [8] occurred at disk power-on lifetime: 20174 hours (840 days + 14 hours)
  When the command that caused the error occurred, the device was active or idle.

  After command completion occurred, registers were:
  ER -- ST COUNT  LBA_48  LH LM LL DV DC
  -- -- -- == -- == == == -- -- -- -- --
  40 -- 51 00 00 00 00 00 18 92 f0 00 00  Error: WP at LBA = 0x001892f0 = 1610480

  Commands leading to the command that caused the error were:
  CR FEATR COUNT  LBA_48  LH LM LL DV DC  Powered_Up_Time  Command/Feature_Name
  -- == -- == -- == == == -- -- -- -- --  ---------------  --------------------
  61 00 00 00 08 00 00 00 59 8b b0 40 00     00:35:06.218  WRITE FPDMA QUEUED
  60 00 00 01 00 00 00 00 18 92 80 40 00     00:35:06.217  READ FPDMA QUEUED
  ef 00 90 00 03 00 00 00 00 00 00 00 00     00:35:06.217  SET FEATURES [Disable SATA feature]
  ef 00 02 00 00 00 00 00 00 00 00 00 00     00:35:06.215  SET FEATURES [Enable write cache]
  00 00 00 00 00 00 00 00 00 00 00 00 ff     00:35:06.091  NOP [Abort queued commands]

Error 19988 [7] occurred at disk power-on lifetime: 20174 hours (840 days + 14 hours)
  When the command that caused the error occurred, the device was active or idle.

  After command completion occurred, registers were:
  ER -- ST COUNT  LBA_48  LH LM LL DV DC
  -- -- -- == -- == == == -- -- -- -- --
  40 -- 51 00 00 00 00 00 18 92 f0 00 00  Error: WP at LBA = 0x001892f0 = 1610480

  Commands leading to the command that caused the error were:
  CR FEATR COUNT  LBA_48  LH LM LL DV DC  Powered_Up_Time  Command/Feature_Name
  -- == -- == -- == == == -- -- -- -- --  ---------------  --------------------
  61 00 00 00 10 00 00 00 59 8b a8 40 00     00:35:03.242  WRITE FPDMA QUEUED
  60 00 00 01 00 00 00 00 18 92 80 40 00     00:35:03.242  READ FPDMA QUEUED
  61 00 00 00 08 00 00 00 62 4e 20 40 00     00:35:03.241  WRITE FPDMA QUEUED
  ef 00 90 00 03 00 00 00 00 00 00 00 00     00:35:03.209  SET FEATURES [Disable SATA feature]
  ef 00 02 00 00 00 00 00 00 00 00 00 00     00:35:03.173  SET FEATURES [Enable write cache]

Error 19987 [6] occurred at disk power-on lifetime: 20174 hours (840 days + 14 hours)
  When the command that caused the error occurred, the device was active or idle.

  After command completion occurred, registers were:
  ER -- ST COUNT  LBA_48  LH LM LL DV DC
  -- -- -- == -- == == == -- -- -- -- --
  40 -- 51 00 00 00 00 00 18 92 f0 00 00  Error: UNC at LBA = 0x001892f0 = 1610480

  Commands leading to the command that caused the error were:
  CR FEATR COUNT  LBA_48  LH LM LL DV DC  Powered_Up_Time  Command/Feature_Name
  -- == -- == -- == == == -- -- -- -- --  ---------------  --------------------
  60 00 00 01 00 00 00 00 18 92 80 40 00     00:35:00.226  READ FPDMA QUEUED
  61 00 00 00 08 00 00 00 59 8b a8 40 00     00:35:00.225  WRITE FPDMA QUEUED
  ef 00 90 00 03 00 00 00 00 00 00 00 00     00:35:00.225  SET FEATURES [Disable SATA feature]
  ef 00 02 00 00 00 00 00 00 00 00 00 00     00:35:00.225  SET FEATURES [Enable write cache]
  00 00 00 00 00 00 00 00 00 00 00 00 ff     00:35:00.110  NOP [Abort queued commands]

Error 19986 [5] occurred at disk power-on lifetime: 20174 hours (840 days + 14 hours)
  When the command that caused the error occurred, the device was active or idle.

  After command completion occurred, registers were:
  ER -- ST COUNT  LBA_48  LH LM LL DV DC
  -- -- -- == -- == == == -- -- -- -- --
  40 -- 51 00 00 00 00 00 18 92 f0 00 00  Error: WP at LBA = 0x001892f0 = 1610480

  Commands leading to the command that caused the error were:
  CR FEATR COUNT  LBA_48  LH LM LL DV DC  Powered_Up_Time  Command/Feature_Name
  -- == -- == -- == == == -- -- -- -- --  ---------------  --------------------
  61 00 00 00 08 00 00 00 5e 3f 18 40 00     00:34:57.262  WRITE FPDMA QUEUED
  61 00 00 00 08 00 00 00 5e 3f 20 40 00     00:34:57.262  WRITE FPDMA QUEUED
  61 00 00 00 10 00 00 00 59 8b a0 40 00     00:34:57.262  WRITE FPDMA QUEUED
  60 00 00 01 00 00 00 00 18 92 80 40 00     00:34:57.262  READ FPDMA QUEUED
  61 00 00 00 10 00 00 00 5f d5 d8 40 00     00:34:57.262  WRITE FPDMA QUEUED

Error 19985 [4] occurred at disk power-on lifetime: 20174 hours (840 days + 14 hours)
  When the command that caused the error occurred, the device was active or idle.

  After command completion occurred, registers were:
  ER -- ST COUNT  LBA_48  LH LM LL DV DC
  -- -- -- == -- == == == -- -- -- -- --
  40 -- 51 00 00 00 00 00 18 92 f0 00 00  Error: WP at LBA = 0x001892f0 = 1610480

  Commands leading to the command that caused the error were:
  CR FEATR COUNT  LBA_48  LH LM LL DV DC  Powered_Up_Time  Command/Feature_Name
  -- == -- == -- == == == -- -- -- -- --  ---------------  --------------------
  61 00 00 00 08 00 00 00 65 30 90 40 00     00:34:54.287  WRITE FPDMA QUEUED
  61 00 00 00 08 00 00 00 63 28 00 40 00     00:34:54.287  WRITE FPDMA QUEUED
  61 00 00 00 08 00 00 00 03 28 10 40 00     00:34:54.287  WRITE FPDMA QUEUED
  60 00 00 01 00 00 00 00 18 92 80 40 00     00:34:54.286  READ FPDMA QUEUED
  61 00 00 00 08 00 00 00 5e 3f 28 40 00     00:34:54.286  WRITE FPDMA QUEUED

SMART Extended Self-test Log Version: 1 (1 sectors)
Num  Test_Description    Status                  Remaining  LifeTime(hours)  LBA_of_first_error
# 1  Short offline       Completed without error       00%         0         -

SMART Selective self-test log data structure revision number 1
 SPAN  MIN_LBA  MAX_LBA  CURRENT_TEST_STATUS
    1        0        0  Not_testing
    2        0        0  Not_testing
    3        0        0  Not_testing
    4        0        0  Not_testing
    5        0        0  Not_testing
Selective self-test flags (0x0):
  After scanning selected spans, do NOT read-scan remainder of disk.
If Selective self-test is pending on power-up, resume after 0 minute delay.

SCT Status Version:                  3
SCT Version (vendor specific):       522 (0x020a)
Device State:                        Active (0)
Current Temperature:                    44 Celsius
Power Cycle Min/Max Temperature:     24/47 Celsius
Lifetime    Min/Max Temperature:     11/47 Celsius
Under/Over Temperature Limit Count:   0/0

SATA Phy Event Counters (GP Log 0x11)
ID      Size     Value  Description
0x000a  2            7  Device-to-host register FISes sent due to a COMRESET
0x0001  2            0  Command failed due to ICRC error
0x0003  2            0  R_ERR response for device-to-host data FIS
0x0004  2            0  R_ERR response for host-to-device data FIS
0x0006  2            0  R_ERR response for device-to-host non-data FIS
0x0007  2            0  R_ERR response for host-to-device non-data FIS

