smartctl 6.6 2017-11-05 r4594 [x86_64-linux-3.10.0-862...] (local build)
Copyright (C) 2002-17, Bruce Allen, Christian Franke, www.smartmontools.org

=== START OF INFORMATION SECTION ===
Model Family:     Seagate Barracuda 7200.14 (AF)
Device Model:     ST2000DM001-9YN164
Serial Number:    --
LU WWN Device Id: 5 000c50 ...
Firmware Version: CC4C
User Capacity:    2,000,398,934,016 bytes [2.00 TB]
Sector Sizes:     512 bytes logical, 4096 bytes physical
Rotation Rate:    7200 rpm
Device is:        In smartctl database [for details use: -P show]
ATA Version is:   ATA8-ACS T13/1699-D revision 4
SATA Version is:  SATA 3.0, 6.0 Gb/s (current: 6.0 Gb/s)
Local Time is:    --

=== START OF READ SMART DATA SECTION ===
SMART overall-health self-assessment test result: PASSED

SMART Attributes Data Structure revision number: 10
Vendor Specific SMART Attributes with Thresholds:
ID# ATTRIBUTE_NAME          FLAGS    VALUE WORST THRESH FAIL RAW_VALUE
  1 Raw_Read_Error_Rate     POSR--   118   099   006    -    189206168
  3 Spin_Up_Time            PO----   093   092   000    -    0
  4 Start_Stop_Count        -O--CK   100   100   020    -    17
  5 Reallocated_Sector_Ct   PO--CK   092   092   036    -    11152
  7 Seek_Error_Rate         POSR--   068   060   030    -    64534222734
  9 Power_On_Hours          -O--CK   023   023   000    -    67696
 10 Spin_Retry_Count        PO--C-   100   100   097    -    0
 12 Power_Cycle_Count       -O--CK   100   100   020    -    17
183 Runtime_Bad_Block       -O--CK   099   099   000    -    1
184 End-to-End_Error        -O--CK   100   100   099    -    0
187 Reported_Uncorrect      -O--CK   098   098   000    -    2
188 Command_Timeout         -O--CK   100   099   000    -    1 1 1
189 High_Fly_Writes         -O-RCK   092   092   000    -    8
190 Airflow_Temperature_Cel -O---K   075   063   045    -    25 (Min/Max 23/29)
191 G-Sense_Error_Rate      -O--CK   100   100   000    -    0
192 Power-Off_Retract_Count -O--CK   100   100   000    -    14
193 Load_Cycle_Count        -O--CK   100   100   000    -    196
194 Temperature_Celsius     -O---K   025   040   000    -    25 (0 17 0 0 0)
197 Current_Pending_Sector  -O--C-   100   001   000    -    0
198 Offline_Uncorrectable   ----C-   100   001   000    -    0
199 UDMA_CRC_Error_Count    -OSRCK   200   200   000    -    0
240 Head_Flying_Hours       ------   100   253   000    -    67597h+11m+28.585s
241 Total_LBAs_Written      ------   100   253   000    -    272835259171526
242 Total_LBAs_Read         ------   100   253   000    -    175203356211523
                            ||||||_ K auto-keep
                            |||||__ C event count
                            ||||___ R error rate
                            |||____ S speed/performance
                            ||_____ O updated online
                            |______ P prefailure warning

SMART Extended Comprehensive Error Log Version: 1 (5 sectors)
Device Error Count: 2

Current Temperature:                    25 Celsius

