smartctl 7.0 2019-05-21 r4916 [x86_64-linux-3.10.0-957...] (local build)
Copyright (C) 2002-18, Bruce Allen, Christian Franke, www.smartmontools.org

=== START OF INFORMATION SECTION ===
Model Number:                       SAMSUNG MZ1LB960HAJQ-00007
Serial Number:                      --
Firmware Version:                   EDA7002Q
PCI Vendor/Subsystem ID:            0x144d
IEEE OUI Identifier:                0x002538
Total NVM Capacity:                 960,197,124,096 [960 GB]
Unallocated NVM Capacity:           0
Controller ID:                      4
Number of Namespaces:               1
Namespace 1 Size/Capacity:          960,197,124,096 [960 GB]
Namespace 1 Utilization:            207,316,447,232 [207 GB]
Namespace 1 Formatted LBA Size:     512
Local Time is:                      Thu Apr ... 2020 SAST

=== START OF READ SMART DATA SECTION ===
SMART overall-health self-assessment test result: PASSED

SMART/Health Information (NVMe Log 0x02)
Critical Warning:                   0x00
Temperature:                        47 Celsius
Available Spare:                    100%
Available Spare Threshold:          10%
Percentage Used:                    4%
Data Units Read:                    5,154,352 [2.63 TB]
Data Units Written:                 530,610,137 [271 TB]
Host Read Commands:                 150,427,970
Host Write Commands:                26,037,421,284
Controller Busy Time:               6,157
Power Cycles:                       11
Power On Hours:                     16,088
Unsafe Shutdowns:                   7
Media and Data Integrity Errors:    0
Error Information Log Entries:      0
Warning  Comp. Temperature Time:    0
Critical Comp. Temperature Time:    0
Temperature Sensor 1:               47 Celsius
Temperature Sensor 2:               57 Celsius
Temperature Sensor 3:               69 Celsius

