smartctl 7.1 2019-12-30 r5022 [x86_64-linux-3.10.0-1062...] (local build)
Copyright (C) 2002-19, Bruce Allen, Christian Franke, www.smartmontools.org

=== START OF INFORMATION SECTION ===
Model Number:                       SAMSUNG MZ1LB960HAJQ-00007
Serial Number:                      --
Firmware Version:                   EDA7202Q
PCI Vendor/Subsystem ID:            0x144d
IEEE OUI Identifier:                0x002538
Total NVM Capacity:                 960,197,124,096 [960 GB]
Unallocated NVM Capacity:           0
Controller ID:                      4
Number of Namespaces:               1
Namespace 1 Size/Capacity:          960,197,124,096 [960 GB]
Namespace 1 Utilization:            940,080,123,904 [940 GB]
Namespace 1 Formatted LBA Size:     512
Local Time is:                      --

=== START OF READ SMART DATA SECTION ===
SMART overall-health self-assessment test result: PASSED

SMART/Health Information (NVMe Log 0x02)
Critical Warning:                   0x00
Temperature:                        34 Celsius
Available Spare:                    100%
Available Spare Threshold:          10%
Percentage Used:                    14%
Data Units Read:                    157,728,156 [80.7 TB]
Data Units Written:                 1,005,517,531 [514 TB]
Host Read Commands:                 7,484,979,720
Host Write Commands:                15,014,669,455
Controller Busy Time:               14,164
Power Cycles:                       23
Power On Hours:                     19,088
Unsafe Shutdowns:                   14
Media and Data Integrity Errors:    0
Error Information Log Entries:      779
Warning  Comp. Temperature Time:    0
Critical Comp. Temperature Time:    0
Temperature Sensor 1:               34 Celsius
Temperature Sensor 2:               43 Celsius
Temperature Sensor 3:               57 Celsius

