smartctl 7.1 2020-06-20 r5066 [x86_64-linux-3.10.0-1062...] (local build)
Copyright (C) 2002-19, Bruce Allen, Christian Franke, www.smartmontools.org

=== START OF INFORMATION SECTION ===
Model Number:                       INTEL SSDPEL1K100GA
Serial Number:                      --
Firmware Version:                   E2010450
PCI Vendor/Subsystem ID:            0x8086
IEEE OUI Identifier:                0x5cd2e4
Controller ID:                      0
Number of Namespaces:               1
Namespace 1 Size/Capacity:          100,030,242,816 [100 GB]
Namespace 1 Formatted LBA Size:     512
Namespace 1 IEEE EUI-64:            5cd2e4 ...
Local Time is:                      Wed Dec ... 2021 SAST

=== START OF READ SMART DATA SECTION ===
SMART overall-health self-assessment test result: PASSED

SMART/Health Information (NVMe Log 0x02)
Critical Warning:                   0x00
Temperature:                        68 Celsius
Available Spare:                    100%
Available Spare Threshold:          0%
Percentage Used:                    17%
Data Units Read:                    3,987,638,790 [2.04 PB]
Data Units Written:                 5,220,757,982 [2.67 PB]
Host Read Commands:                 116,275,113,814
Host Write Commands:                100,835,632,267
Controller Busy Time:               65,227
Power Cycles:                       20
Power On Hours:                     15,386
Unsafe Shutdowns:                   3
Media and Data Integrity Errors:    0
Error Information Log Entries:      0

