smartctl 7.1 2020-06-20 r5066 [x86_64-linux-3.10.0-1127...] (local build)
Copyright (C) 2002-19, Bruce Allen, Christian Franke, www.smartmontools.org

=== START OF INFORMATION SECTION ===
Model Number:                       INTEL SSDPEL1K100GA
Serial Number:                      --
Firmware Version:                   E2010450
PCI Vendor/Subsystem ID:            0x8086
IEEE OUI Identifier:                0x5cd2e4
Controller ID:                      0
Number of Namespaces:               1
Namespace 1 Size/Capacity:          100,030,242,816 [100 GB]
Namespace 1 Formatted LBA Size:     512
Namespace 1 IEEE EUI-64:            5cd2e4 ...
Local Time is:                      Tue Feb ... 2022 SAST

=== START OF READ SMART DATA SECTION ===
SMART overall-health self-assessment test result: PASSED

SMART/Health Information (NVMe Log 0x02)
Critical Warning:                   0x00
Temperature:                        60 Celsius
Available Spare:                    100%
Available Spare Threshold:          0%
Percentage Used:                    18%
Data Units Read:                    3,799,778,864 [1.94 PB]
Data Units Written:                 5,325,447,171 [2.72 PB]
Host Read Commands:                 135,924,813,060
Host Write Commands:                113,062,330,468
Controller Busy Time:               67,420
Power Cycles:                       15
Power On Hours:                     11,884
Unsafe Shutdowns:                   3
Media and Data Integrity Errors:    0
Error Information Log Entries:      0

