smartctl 7.1 2020-06-20 r5066 [x86_64-linux-3.10.0-1127...] (local build)
Copyright (C) 2002-19, Bruce Allen, Christian Franke, www.smartmontools.org

=== START OF INFORMATION SECTION ===
Model Number:                       INTEL SSDPEL1K100GA
Serial Number:                      --
Firmware Version:                   E2010450
PCI Vendor/Subsystem ID:            0x8086
IEEE OUI Identifier:                0x5cd2e4
Controller ID:                      0
Number of Namespaces:               1
Namespace 1 Size/Capacity:          100,030,242,816 [100 GB]
Namespace 1 Formatted LBA Size:     512
Namespace 1 IEEE EUI-64:            5cd2e4 ...
Local Time is:                      --

=== START OF READ SMART DATA SECTION ===
SMART overall-health self-assessment test result: PASSED

SMART/Health Information (NVMe Log 0x02)
Critical Warning:                   0x00
Temperature:                        58 Celsius
Available Spare:                    100%
Available Spare Threshold:          0%
Percentage Used:                    16%
Data Units Read:                    3,460,443,046 [1.77 PB]
Data Units Written:                 4,815,584,468 [2.46 PB]
Host Read Commands:                 121,543,044,456
Host Write Commands:                101,111,660,081
Controller Busy Time:               60,945
Power Cycles:                       11
Power On Hours:                     10,812
Unsafe Shutdowns:                   4
Media and Data Integrity Errors:    0
Error Information Log Entries:      0

