smartctl 7.1 2020-06-20 r5066 [x86_64-linux-3.10.0-1127...] (local build)
Copyright (C) 2002-19, Bruce Allen, Christian Franke, www.smartmontools.org

=== START OF INFORMATION SECTION ===
Model Number:                       INTEL SSDPED1D480GA
Serial Number:                      --
Firmware Version:                   E2010325
PCI Vendor/Subsystem ID:            0x8086
IEEE OUI Identifier:                0x5cd2e4
Controller ID:                      0
Number of Namespaces:               1
Namespace 1 Size/Capacity:          480,103,981,056 [480 GB]
Namespace 1 Formatted LBA Size:     512
Local Time is:                      --

=== START OF READ SMART DATA SECTION ===
SMART overall-health self-assessment test result: PASSED

SMART/Health Information (NVMe Log 0x02)
Critical Warning:                   0x00
Temperature:                        36 Celsius
Available Spare:                    100%
Available Spare Threshold:          0%
Percentage Used:                    46%
Data Units Read:                    695,332,643 [356 TB]
Data Units Written:                 4,702,399,379 [2.40 PB]
Host Read Commands:                 5,609,511,400
Host Write Commands:                50,569,638,884
Controller Busy Time:               27,341
Power Cycles:                       18
Power On Hours:                     22,880
Unsafe Shutdowns:                   10
Media and Data Integrity Errors:    0
Error Information Log Entries:      0

