smartctl 6.6 2017-11-05 r4594 [x86_64-linux-3.10.0-862...] (local build)
Copyright (C) 2002-17, Bruce Allen, Christian Franke, www.smartmontools.org

=== START OF INFORMATION SECTION ===
Model Family:     Intel 53x and Pro 2500 Series SSDs
Device Model:     INTEL SSDSC2BW120A4
Serial Number:    --
LU WWN Device Id: 5 5cd2e4 ...
Firmware Version: DC32
User Capacity:    120,034,123,776 bytes [120 GB]
Sector Size:      512 bytes logical/physical
Rotation Rate:    Solid State Device
Device is:        In smartctl database [for details use: -P show]
ATA Version is:   ACS-2 (minor revision not indicated)
SATA Version is:  SATA 3.0, 6.0 Gb/s (current: 6.0 Gb/s)
Local Time is:    Mon Nov ... 2019 +07

=== START OF READ SMART DATA SECTION ===
SMART overall-health self-assessment test result: PASSED

SMART Attributes Data Structure revision number: 10
Vendor Specific SMART Attributes with Thresholds:
ID# ATTRIBUTE_NAME          FLAGS    VALUE WORST THRESH FAIL RAW_VALUE
  5 Reallocated_Sector_Ct   -O--CK   100   100   000    -    0
  9 Power_On_Hours_and_Msec -O--CK   100   100   000    -    12583h+32m+07.020s
 12 Power_Cycle_Count       -O--CK   100   100   000    -    136
170 Available_Reservd_Space PO--CK   100   100   010    -    0
171 Program_Fail_Count      -O--CK   100   100   000    -    0
172 Erase_Fail_Count        -O--CK   100   100   000    -    0
174 Unexpect_Power_Loss_Ct  -O--CK   100   100   000    -    37
183 SATA_Downshift_Count    -O--CK   100   100   000    -    10
184 End-to-End_Error        PO--CK   100   100   090    -    0
187 Uncorrectable_Error_Cnt -O--CK   100   100   000    -    0
190 Airflow_Temperature_Cel -O--CK   021   046   000    -    21 (Min/Max 14/46)
192 Power-Off_Retract_Count -O--CK   100   100   000    -    37
199 UDMA_CRC_Error_Count    -O--CK   100   100   000    -    0
225 Host_Writes_32MiB       -O--CK   100   100   000    -    1577495
226 Workld_Media_Wear_Indic -O--CK   100   100   000    -    65535
227 Workld_Host_Reads_Perc  -O--CK   100   100   000    -    80
228 Workload_Minutes        -O--CK   100   100   000    -    65535
232 Available_Reservd_Space PO--CK   100   100   010    -    0
233 Media_Wearout_Indicator -O--CK   054   054   000    -    0
241 Host_Writes_32MiB       -O--CK   100   100   000    -    1577495
242 Host_Reads_32MiB        -O--CK   100   100   000    -    6390141
249 NAND_Writes_1GiB        -O--CK   100   100   000    -    154116
                            ||||||_ K auto-keep
                            |||||__ C event count
                            ||||___ R error rate
                            |||____ S speed/performance
                            ||_____ O updated online
                            |______ P prefailure warning

Current Temperature:                    21 Celsius

