smartctl 6.6 2017-11-05 r4594 [x86_64-linux-3.10.0-693...] (local build)
Copyright (C) 2002-17, Bruce Allen, Christian Franke, www.smartmontools.org

=== START OF INFORMATION SECTION ===
Model Family:     Intel 730 and DC S35x0/3610/3700 Series SSDs
Device Model:     INTEL SSDSC2BB016T6
Serial Number:    --
LU WWN Device Id: 5 5cd2e4 ...
Firmware Version: G2010150
User Capacity:    1,600,321,314,816 bytes [1.60 TB]
Sector Sizes:     512 bytes logical, 4096 bytes physical
Rotation Rate:    Solid State Device
Form Factor:      2.5 inches
Device is:        In smartctl database [for details use: -P show]
ATA Version is:   ACS-2 T13/2015-D revision 3
SATA Version is:  SATA 2.6, 6.0 Gb/s (current: 6.0 Gb/s)
Local Time is:    Wed Sep ... 2018 EDT

=== START OF READ SMART DATA SECTION ===
SMART overall-health self-assessment test result: PASSED

SMART Attributes Data Structure revision number: 16441
Vendor Specific SMART Attributes with Thresholds:
ID# ATTRIBUTE_NAME          FLAGS    VALUE WORST THRESH FAIL RAW_VALUE
  5 Reallocated_Sector_Ct   -O--CK   100   100   000    -    0
  9 Power_On_Hours          -O--CK   100   100   000    -    21615
 12 Power_Cycle_Count       -O--CK   100   100   000    -    11
170 Available_Reservd_Space PO--CK   100   100   010    -    0
171 Program_Fail_Count      -O--CK   100   100   000    -    0
172 Erase_Fail_Count        -O--CK   100   100   000    -    0
174 Unsafe_Shutdown_Count   -O--CK   100   100   000    -    8
175 Power_Loss_Cap_Test     PO--CK   100   100   010    -    8590 (128 9146)
183 SATA_Downshift_Count    -O--CK   100   100   000    -    0
184 End-to-End_Error        PO--CK   100   100   090    -    0
187 Reported_Uncorrect      -O--CK   100   100   000    -    0
190 Temperature_Case        -O---K   075   074   000    -    25 (Min/Max 23/39)
192 Unsafe_Shutdown_Count   -O--CK   100   100   000    -    8
194 Temperature_Internal    -O---K   100   100   000    -    25
197 Current_Pending_Sector  -O--C-   100   100   000    -    0
199 CRC_Error_Count         -OSRCK   100   100   000    -    0
225 Host_Writes_32MiB       -O--CK   100   100   000    -    6733911
226 Workld_Media_Wear_Indic -O--CK   100   100   000    -    65535
227 Workld_Host_Reads_Perc  -O--CK   100   100   000    -    65535
228 Workload_Minutes        -O--CK   100   100   000    -    65535
232 Available_Reservd_Space PO--CK   100   100   010    -    0
233 Media_Wearout_Indicator -O--CK   091   091   000    -    0
234 Thermal_Throttle        -O--CK   100   100   000    -    0/0
241 Host_Writes_32MiB       -O--CK   100   100   000    -    6733911
242 Host_Reads_32MiB        -O--CK   100   100   000    -    4302551
243 NAND_Writes_32MiB       -O--CK   100   100   000    -    16130669
                            ||||||_ K auto-keep
                            |||||__ C event count
                            ||||___ R error rate
                            |||____ S speed/performance
                            ||_____ O updated online
                            |______ P prefailure warning

SMART Extended Comprehensive Error Log Version: 1 (20 sectors)
No Errors Logged

Current Temperature:                    25 Celsius

