smartctl 6.6 2017-11-05 r4594 [x86_64-linux-3.10.0-862...] (local build)
Copyright (C) 2002-17, Bruce Allen, Christian Franke, www.smartmontools.org

=== START OF INFORMATION SECTION ===
Model Family:     Seagate Enterprise Capacity 3.5 HDD
Device Model:     ST10000NM0016-1TT101
Serial Number:    --
LU WWN Device Id: 5 000c50 ...
Firmware Version: SND0
User Capacity:    10,000,831,348,736 bytes [10.0 TB]
Sector Sizes:     512 bytes logical, 4096 bytes physical
Rotation Rate:    7200 rpm
Form Factor:      3.5 inches
Device is:        In smartctl database [for details use: -P show]
ATA Version is:   ACS-3 T13/2161-D revision 5
SATA Version is:  SATA 3.1, 6.0 Gb/s (current: 6.0 Gb/s)
Local Time is:    Thu Aug ... 2019 EDT

=== START OF READ SMART DATA SECTION ===
SMART overall-health self-assessment test result: PASSED

SMART Attributes Data Structure revision number: 10
Vendor Specific SMART Attributes with Thresholds:
ID# ATTRIBUTE_NAME          FLAGS    VALUE WORST THRESH FAIL RAW_VALUE
  1 Raw_Read_Error_Rate     POSR--   081   064   044    -    122390824
  3 Spin_Up_Time            PO----   095   095   000    -    0
  4 Start_Stop_Count        -O--CK   100   100   020    -    5
  5 Reallocated_Sector_Ct   PO--CK   100   100   010    -    0
  7 Seek_Error_Rate         POSR--   088   060   045    -    563284116
  9 Power_On_Hours          -O--CK   098   098   000    -    2490 (53 186 0)
 10 Spin_Retry_Count        PO--C-   100   100   097    -    0
 12 Power_Cycle_Count       -O--CK   100   100   020    -    5
184 End-to-End_Error        -O--CK   100   100   099    -    0
187 Reported_Uncorrect      -O--CK   100   100   000    -    0
188 Command_Timeout         -O--CK   100   100   000    -    0 0 0
189 High_Fly_Writes         -O-RCK   001   001   000    -    185
190 Airflow_Temperature_Cel -O---K   055   054   040    -    45 (Min/Max 36/46)
191 G-Sense_Error_Rate      -O--CK   096   096   000    -    8071
192 Power-Off_Retract_Count -O--CK   100   100   000    -    21
193 Load_Cycle_Count        -O--CK   100   100   000    -    131
194 Temperature_Celsius     -O---K   045   046   000    -    45 (0 26 0 0 0)
195 Hardware_ECC_Recovered  -O-RC-   035   007   000    -    122390824
197 Current_Pending_Sector  -O--C-   100   100   000    -    0
198 Offline_Uncorrectable   ----C-   100   100   000    -    0
199 UDMA_CRC_Error_Count    -OSRCK   200   200   000    -    0
240 Head_Flying_Hours       ------   100   253   000    -    2458h+20m+12.879s
241 Total_LBAs_Written      ------   100   253   000    -    166220241168
242 Total_LBAs_Read         ------   100   253   000    -    73292521791
                            ||||||_ K auto-keep
                            |||||__ C event count
                            ||||___ R error rate
                            |||____ S speed/performance
                            ||_____ O updated online
                            |______ P prefailure warning

SMART Extended Comprehensive Error Log Version: 1 (5 sectors)
No Errors Logged

Current Temperature:                    45 Celsius

