smartctl 7.1 2020-06-20 r5066 [x86_64-linux-3.10.0-1160...] (local build)
Copyright (C) 2002-19, Bruce Allen, Christian Franke, www.smartmontools.org

=== START OF INFORMATION SECTION ===
Device Model:     VK0800GDJYA
Serial Number:    --
LU WWN Device Id: 5 5cd2e4 ...
Firmware Version: 4IWVHPG1
User Capacity:    800,166,076,416 bytes [800 GB]
Sector Size:      512 bytes logical/physical
Rotation Rate:    Solid State Device
Form Factor:      2.5 inches
Device is:        Not in smartctl database [for details use: -P showall]
ATA Version is:   ATA8-ACS T13/1699-D revision 4
SATA Version is:  SATA 2.6, 6.0 Gb/s (current: 6.0 Gb/s)
Local Time is:    --
Rd look-ahead is: Enabled
Write cache is:   Enabled

=== START OF READ SMART DATA SECTION ===
SMART overall-health self-assessment test result: PASSED

General SMART Values:
Offline data collection status:  (0x00)	Offline data collection activity
					was never started.

Self-test execution status:      (   0)	The previous self-test routine completed
					without error or no self-test has ever 
					been run.
Total time to complete Offline 
data collection: 		(    0) seconds.
Offline data collection
capabilities: 			 (0x79) SMART execute Offline immediate.

					Suspend Offline collection upon new
					command.
					Offline surface scan supported.
					Self-test supported.
					Conveyance Self-test supported.
					Selective Self-test supported.
SMART capabilities:            (0x0003)	Saves SMART data before entering
					power-saving mode.

Error logging capability:        (0x01)	Error logging supported.
					General Purpose Logging supported.
Short self-test routine 
recommended polling time: 	 (   1) minutes.
Extended self-test routine
recommended polling time: 	 (   2) minutes.
Conveyance self-test routine
recommended polling time: 	 (   2) minutes.
SCT capabilities: 	       (0x0039)	SCT Status supported.
					SCT Error Recovery Control supported.
					SCT Feature Control supported.
					SCT Data Table supported.

SMART Attributes Data Structure revision number: 1
Vendor Specific SMART Attributes with Thresholds:
ID# ATTRIBUTE_NAME          FLAGS    VALUE WORST THRESH FAIL RAW_VALUE
  1 Raw_Read_Error_Rate     POSR--   130   130   039    -    2064904
  5 Reallocated_Sector_Ct   PO--CK   097   097   001    -    0
  9 Power_On_Hours          -O--CK   100   100   000    -    50703
173 Unknown_Attribute       PO--CK   071   071   001    -    0
175 Program_Fail_Count_Chip PO--CK   100   100   010    -    1241322488439
180 Unused_Rsvd_Blk_Cnt_Tot PO-RCK   130   130   039    -    256927064
194 Temperature_Celsius     -O---K   100   100   000    -    19
196 Reallocated_Event_Count PO--CK   100   100   010    -    0
                            ||||||_ K auto-keep
                            |||||__ C event count
                            ||||___ R error rate
                            |||____ S speed/performance
                            ||_____ O updated online
                            |______ P prefailure warning

General Purpose Log Directory Version 1
SMART           Log Directory Version 1 [multi-sector log support]
Address    Access  R/W   Size  Description
0x00       GPL,SL  R/O      1  Log Directory
0x01       GPL,SL  R/O      1  Summary SMART error log
0x02       GPL,SL  R/O      8  Comprehensive SMART error log
0x03       GPL,SL  R/O     20  Ext. Comprehensive SMART error log
0x04       GPL,SL  R/O      8  Device Statistics log
0x06       GPL,SL  R/O      1  SMART self-test log
0x07       GPL,SL  R/O      2  Extended self-test log
0x09       GPL,SL  R/W      1  Selective self-test log
0x10       GPL,SL  R/O      1  NCQ Command Error log
0x11       GPL,SL  R/O      1  SATA Phy Event Counters log
0x80-0x9f  GPL,SL  R/W     16  Host vendor specific log
0xb0       GPL,SL  VS       1  Device vendor specific log
0xb1       GPL,SL  VS      33  Device vendor specific log
0xb5       GPL,SL  VS       1  Device vendor specific log
0xb6       GPL,SL  VS     127  Device vendor specific log
0xd0       GPL,SL  VS       1  Device vendor specific log
0xd1       GPL     VS   13056  Device vendor specific log
0xdf       GPL     VS    1152  Device vendor specific log
0xdf       SL      VS     128  Device vendor specific log
0xe0       GPL,SL  R/W      1  SCT Command/Status
0xe1       GPL,SL  R/W      1  SCT Data Transfer

SMART Extended Comprehensive Error Log Version: 1 (20 sectors)
Device Error Count: 65535 (device log contains only the most recent 80 errors)
	CR     = Command Register
	FEATR  = Features Register
	COUNT  = Count (was: Sector Count) Register
	LBA_48 = Upper bytes of LBA High/Mid/Low Registers ]  ATA-8
	LH     = LBA High (was: Cylinder High) Register    ]   LBA
	LM     = LBA Mid (was: Cylinder Low) Register      ] Register
	LL     = LBA Low (was: Sector Number) Register     ]
	DV     = Device (was: Device/Head) Register
	DC     = Device Control Register
	ER     = Error register
	ST     = Status register
Powered_Up_Time is measured from power on, and printed as
DDd+hh:mm:SS.sss where DD=days, hh=hours, mm=minutes,
SS=sec, and sss=millisec. It "wraps" after 49.710 days.

Error 65535 [15] occurred at disk power-on lifetime: 49500 hours (2062 days + 12 hours)
  When the command that caused the error occurred, the device was active or idle.

  After command completion occurred, registers were:
  ER -- ST COUNT  LBA_48  LH LM LL DV DC
  -- -- -- == -- == == == -- -- -- -- --
  84 -- 41 00 08 00 22 c7 00 aa c8 40 00  Error: ICRC, ABRT at LBA = 0x22c700aac8 = 149367597768

  Commands leading to the command that caused the error were:
  CR FEATR COUNT  LBA_48  LH LM LL DV DC  Powered_Up_Time  Command/Feature_Name
  -- == -- == -- == == == -- -- -- -- --  ---------------  --------------------
  61 00 00 00 08 00 22 c7 00 aa c8 40 00 17d+ ...          WRITE FPDMA QUEUED
  ea 00 00 00 00 00 00 00 00 00 00 00 00 17d+ ...          FLUSH CACHE EXT
  61 00 00 00 08 00 22 c7 00 aa c0 40 00 17d+ ...          WRITE FPDMA QUEUED
  ea 00 00 00 00 00 00 00 00 00 00 00 00 17d+ ...          FLUSH CACHE EXT
  61 00 00 00 08 00 22 c7 00 aa b8 40 00 17d+ ...          WRITE FPDMA QUEUED

Error 65534 [14] occurred at disk power-on lifetime: 49147 hours (2047 days + 19 hours)
  When the command that caused the error occurred, the device was active or idle.

  After command completion occurred, registers were:
  ER -- ST COUNT  LBA_48  LH LM LL DV DC
  -- -- -- == -- == == == -- -- -- -- --
  84 -- 41 00 08 00 19 29 00 4b 98 40 00  Error: ICRC, ABRT at LBA = 0x1929004b98 = 108062067608

  Commands leading to the command that caused the error were:
  CR FEATR COUNT  LBA_48  LH LM LL DV DC  Powered_Up_Time  Command/Feature_Name
  -- == -- == -- == == == -- -- -- -- --  ---------------  --------------------
  61 00 00 00 08 00 19 29 00 4b 98 40 00  3d+ ...          WRITE FPDMA QUEUED
  ea 00 00 00 00 00 00 00 00 00 00 00 00  3d+ ...          FLUSH CACHE EXT
  61 00 00 00 08 00 19 29 00 4b 90 40 00  3d+ ...          WRITE FPDMA QUEUED
  ea 00 00 00 00 00 00 00 00 00 00 00 00  3d+ ...          FLUSH CACHE EXT
  61 00 00 00 08 00 19 29 00 4b 88 40 00  3d+ ...          WRITE FPDMA QUEUED

Error 65533 [13] occurred at disk power-on lifetime: 48944 hours (2039 days + 8 hours)
  When the command that caused the error occurred, the device was active or idle.

  After command completion occurred, registers were:
  ER -- ST COUNT  LBA_48  LH LM LL DV DC
  -- -- -- == -- == == == -- -- -- -- --
  84 -- 51 04 00 00 15 24 00 4a 00 40 00  Error: ICRC, ABRT at LBA = 0x1524004a00 = 90798311936

  Commands leading to the command that caused the error were:
  CR FEATR COUNT  LBA_48  LH LM LL DV DC  Powered_Up_Time  Command/Feature_Name
  -- == -- == -- == == == -- -- -- -- --  ---------------  --------------------
  61 00 00 04 00 00 15 24 00 4a 00 40 00 44d+ ...          WRITE FPDMA QUEUED
  61 00 00 04 00 00 15 20 00 4a 00 40 00 44d+ ...          WRITE FPDMA QUEUED
  61 00 00 04 00 00 15 1c 00 4a 00 40 00 44d+ ...          WRITE FPDMA QUEUED
  61 00 00 04 00 00 15 18 00 4a 00 40 00 44d+ ...          WRITE FPDMA QUEUED
  61 00 00 04 00 00 15 20 00 4a 00 40 00 44d+ ...          WRITE FPDMA QUEUED

Error 65532 [12] occurred at disk power-on lifetime: 48735 hours (2030 days + 15 hours)
  When the command that caused the error occurred, the device was active or idle.

  After command completion occurred, registers were:
  ER -- ST COUNT  LBA_48  LH LM LL DV DC
  -- -- -- == -- == == == -- -- -- -- --
  84 -- 41 00 08 00 2b eb 00 f4 f0 40 00  Error: ICRC, ABRT at LBA = 0x2beb00f4f0 = 188626302192

  Commands leading to the command that caused the error were:
  CR FEATR COUNT  LBA_48  LH LM LL DV DC  Powered_Up_Time  Command/Feature_Name
  -- == -- == -- == == == -- -- -- -- --  ---------------  --------------------
  61 00 00 00 08 00 2b eb 00 f4 f0 40 00 35d+ ...          WRITE FPDMA QUEUED
  ea 00 00 00 00 00 00 00 00 00 00 00 00 35d+ ...          FLUSH CACHE EXT
  61 00 00 00 08 00 2b eb 00 f4 e8 40 00 35d+ ...          WRITE FPDMA QUEUED
  ea 00 00 00 00 00 00 00 00 00 00 00 00 35d+ ...          FLUSH CACHE EXT
  61 00 00 00 08 00 2b eb 00 f4 e0 40 00 35d+ ...          WRITE FPDMA QUEUED

Error 65531 [11] occurred at disk power-on lifetime: 48297 hours (2012 days + 9 hours)
  When the command that caused the error occurred, the device was active or idle.

  After command completion occurred, registers were:
  ER -- ST COUNT  LBA_48  LH LM LL DV DC
  -- -- -- == -- == == == -- -- -- -- --
  84 -- 41 01 00 00 24 34 00 68 e0 40 00  Error: ICRC, ABRT at LBA = 0x24340068e0 = 155491264736

  Commands leading to the command that caused the error were:
  CR FEATR COUNT  LBA_48  LH LM LL DV DC  Powered_Up_Time  Command/Feature_Name
  -- == -- == -- == == == -- -- -- -- --  ---------------  --------------------
  60 00 00 01 00 00 24 34 00 68 e0 40 00 17d+ ...          READ FPDMA QUEUED
  60 00 00 01 00 00 24 33 00 68 e0 40 00 17d+ ...          READ FPDMA QUEUED
  60 00 00 01 00 00 24 32 00 68 e0 40 00 17d+ ...          READ FPDMA QUEUED
  60 00 00 01 00 00 24 31 00 68 e0 40 00 17d+ ...          READ FPDMA QUEUED
  60 00 00 01 00 00 24 30 00 68 e0 40 00 17d+ ...          READ FPDMA QUEUED

Error 65530 [10] occurred at disk power-on lifetime: 48046 hours (2001 days + 22 hours)
  When the command that caused the error occurred, the device was active or idle.

  After command completion occurred, registers were:
  ER -- ST COUNT  LBA_48  LH LM LL DV DC
  -- -- -- == -- == == == -- -- -- -- --
  84 -- 41 00 08 00 1f 74 00 e3 b8 40 00  Error: ICRC, ABRT at LBA = 0x1f7400e3b8 = 135090201528

  Commands leading to the command that caused the error were:
  CR FEATR COUNT  LBA_48  LH LM LL DV DC  Powered_Up_Time  Command/Feature_Name
  -- == -- == -- == == == -- -- -- -- --  ---------------  --------------------
  61 00 00 00 08 00 1f 74 00 e3 b8 40 00  6d+ ...          WRITE FPDMA QUEUED
  ea 00 00 00 00 00 00 00 00 00 00 00 00  6d+ ...          FLUSH CACHE EXT
  61 00 00 00 08 00 1f 74 00 e3 b0 40 00  6d+ ...          WRITE FPDMA QUEUED
  ea 00 00 00 00 00 00 00 00 00 00 00 00  6d+ ...          FLUSH CACHE EXT
  61 00 00 00 08 00 1f 74 00 e3 a8 40 00  6d+ ...          WRITE FPDMA QUEUED

Error 65529 [9] occurred at disk power-on lifetime: 47756 hours (1989 days + 20 hours)
  When the command that caused the error occurred, the device was active or idle.

  After command completion occurred, registers were:
  ER -- ST COUNT  LBA_48  LH LM LL DV DC
  -- -- -- == -- == == == -- -- -- -- --
  84 -- 41 00 08 00 1a 7f 00 d1 18 40 00  Error: ICRC, ABRT at LBA = 0x1a7f00d118 = 113799909656

  Commands leading to the command that caused the error were:
  CR FEATR COUNT  LBA_48  LH LM LL DV DC  Powered_Up_Time  Command/Feature_Name
  -- == -- == -- == == == -- -- -- -- --  ---------------  --------------------
  61 00 00 00 08 00 1a 7f 00 d1 18 40 00 44d+ ...          WRITE FPDMA QUEUED
  ea 00 00 00 00 00 00 00 00 00 00 00 00 44d+ ...          FLUSH CACHE EXT
  61 00 00 00 08 00 1a 7f 00 d1 10 40 00 44d+ ...          WRITE FPDMA QUEUED
  ea 00 00 00 00 00 00 00 00 00 00 00 00 44d+ ...          FLUSH CACHE EXT
  61 00 00 00 08 00 1a 7f 00 d1 08 40 00 44d+ ...          WRITE FPDMA QUEUED

Error 65528 [8] occurred at disk power-on lifetime: 47626 hours (1984 days + 10 hours)
  When the command that caused the error occurred, the device was active or idle.

  After command completion occurred, registers were:
  ER -- ST COUNT  LBA_48  LH LM LL DV DC
  -- -- -- == -- == == == -- -- -- -- --
  84 -- 41 00 08 00 18 58 00 bf 78 40 00  Error: ICRC, ABRT at LBA = 0x185800bf78 = 104555659128

  Commands leading to the command that caused the error were:
  CR FEATR COUNT  LBA_48  LH LM LL DV DC  Powered_Up_Time  Command/Feature_Name
  -- == -- == -- == == == -- -- -- -- --  ---------------  --------------------
  61 00 00 00 08 00 18 58 00 bf 78 40 00 39d+ ...          WRITE FPDMA QUEUED
  ea 00 00 00 00 00 00 00 00 00 00 00 00 39d+ ...          FLUSH CACHE EXT
  61 00 00 00 08 00 18 58 00 bf 70 40 00 39d+ ...          WRITE FPDMA QUEUED
  ea 00 00 00 00 00 00 00 00 00 00 00 00 39d+ ...          FLUSH CACHE EXT
  61 00 00 00 08 00 18 58 00 bf 68 40 00 39d+ ...          WRITE FPDMA QUEUED

SMART Extended Self-test Log Version: 1 (2 sectors)
No self-tests have been logged.  [To run self-tests, use: smartctl -t]

SMART Selective self-test log data structure revision number 1
 SPAN  MIN_LBA  MAX_LBA  CURRENT_TEST_STATUS
    1        0        0  Not_testing
    2        0        0  Not_testing
    3        0        0  Not_testing
    4        0        0  Not_testing
    5        0        0  Not_testing
Selective self-test flags (0x0):
  After scanning selected spans, do NOT read-scan remainder of disk.
If Selective self-test is pending on power-up, resume after 0 minute delay.

SCT Status Version:                  3
SCT Version (vendor specific):       1 (0x0001)
Device State:                        Active (0)
Current Temperature:                    19 Celsius
Power Cycle Min/Max Temperature:     17/22 Celsius
Lifetime    Min/Max Temperature:      7/28 Celsius
Specified Max Operating Temperature:    55 Celsius
Under/Over Temperature Limit Count:   0/0

SCT Temperature History Version:     2
Temperature Sampling Period:         1 minute
Temperature Logging Interval:        1 minute
Min/Max recommended Temperature:      0/55 Celsius
Min/Max Temperature Limit:            0/55 Celsius
Temperature History Size (Index):    478 (447)

SCT Error Recovery Control:
           Read: Disabled
          Write: Disabled

Device Statistics (GP Log 0x04)
Page  Offset Size        Value Flags Description
0x01  =====  =               =  ===  == General Statistics (rev 1) ==
0x01  0x008  4             167  ---  Lifetime Power-On Resets
0x01  0x018  6    892136428590  ---  Logical Sectors Written
0x01  0x020  6      9454190088  ---  Number of Write Commands
0x01  0x028  6    701697367240  ---  Logical Sectors Read
0x01  0x030  6     10222306591  ---  Number of Read Commands
0x04  =====  =               =  ===  == General Errors Statistics (rev 1) ==
0x04  0x008  4               0  ---  Number of Reported Uncorrectable Errors
0x04  0x010  4            2909  ---  Resets Between Cmd Acceptance and Completion
0x05  =====  =               =  ===  == Temperature Statistics (rev 1) ==
0x05  0x008  1              19  ---  Current Temperature
0x05  0x010  1              18  ---  Average Short Term Temperature
0x05  0x018  1              17  ---  Average Long Term Temperature
0x05  0x020  1              28  ---  Highest Temperature
0x05  0x028  1              14  ---  Lowest Temperature
0x05  0x030  1              23  ---  Highest Average Short Term Temperature
0x05  0x038  1              15  ---  Lowest Average Short Term Temperature
0x05  0x040  1              21  ---  Highest Average Long Term Temperature
0x05  0x048  1              16  ---  Lowest Average Long Term Temperature
0x05  0x050  4               0  ---  Time in Over-Temperature
0x05  0x058  1              55  ---  Specified Maximum Operating Temperature
0x05  0x060  4               0  ---  Time in Under-Temperature
0x05  0x068  1               0  ---  Specified Minimum Operating Temperature
0x06  =====  =               =  ===  == Transport Statistics (rev 1) ==
0x06  0x008  4           37630  ---  Number of Hardware Resets
0x06  0x010  4           10292  ---  Number of ASR Events
0x06  0x018  4         2369530  ---  Number of Interface CRC Errors
0x07  =====  =               =  ===  == Solid State Device Statistics (rev 1) ==
0x07  0x008  1              29  ---  Percentage Used Endurance Indicator
                                |||_ C monitored condition met
                                ||__ D supports DSN
                                |___ N normalized value

SATA Phy Event Counters (GP Log 0x11)
ID      Size     Value  Description
0x0001  4            0  Command failed due to ICRC error
0x0003  4            0  R_ERR response for device-to-host data FIS
0x0004  4            0  R_ERR response for host-to-device data FIS
0x0006  4            0  R_ERR response for device-to-host non-data FIS
0x000a  4            5  Device-to-host register FISes sent due to a COMRESET
0x000b  4            0  CRC errors within host-to-device FIS
0x000d  4            0  Non-CRC errors within host-to-device FIS

