smartctl 7.1 2020-06-20 r5066 [x86_64-linux-3.10.0-1127...] (local build)
Copyright (C) 2002-19, Bruce Allen, Christian Franke, www.smartmontools.org

=== START OF INFORMATION SECTION ===
Model Number:                       WDC CL SN720 SDAQNTW-512G-2000
Serial Number:                      --
Firmware Version:                   10104122
PCI Vendor/Subsystem ID:            0x15b7
IEEE OUI Identifier:                0x001b44
Total NVM Capacity:                 512,110,190,592 [512 GB]
Unallocated NVM Capacity:           0
Controller ID:                      8215
Number of Namespaces:               1
Namespace 1 Size/Capacity:          512,110,190,592 [512 GB]
Namespace 1 Formatted LBA Size:     512
Namespace 1 IEEE EUI-64:            001b44 ...
Local Time is:                      --

=== START OF READ SMART DATA SECTION ===
SMART overall-health self-assessment test result: FAILED!
- NVM subsystem reliability has been degraded

SMART/Health Information (NVMe Log 0x02)
Critical Warning:                   0x04
Temperature:                        46 Celsius
Available Spare:                    100%
Available Spare Threshold:          10%
Percentage Used:                    0%
Data Units Read:                    11,671,608 [5.97 TB]
Data Units Written:                 11,551,049 [5.91 TB]
Host Read Commands:                 100,632,307
Host Write Commands:                426,594,744
Controller Busy Time:               1,361
Power Cycles:                       9
Power On Hours:                     11,775
Unsafe Shutdowns:                   5
Media and Data Integrity Errors:    384
Error Information Log Entries:      384
Warning  Comp. Temperature Time:    0
Critical Comp. Temperature Time:    0

