smartctl 7.0 2019-05-21 r4916 [x86_64-linux-3.10.0-957...] (local build)
Copyright (C) 2002-18, Bruce Allen, Christian Franke, www.smartmontools.org

=== START OF INFORMATION SECTION ===
Model Family:     Western Digital Re
Device Model:     WDC WD4000FYYZ-01UL1B0
Serial Number:    --
LU WWN Device Id: 5 0014ee ...
Firmware Version: 01.01K01
User Capacity:    4,000,787,030,016 bytes [4.00 TB]
Sector Size:      512 bytes logical/physical
Rotation Rate:    7200 rpm
Device is:        In smartctl database [for details use: -P show]
ATA Version is:   ATA8-ACS (minor revision not indicated)
SATA Version is:  SATA 3.0, 6.0 Gb/s (current: 3.0 Gb/s)
Local Time is:    --
APM level is:     128 (minimum power consumption without standby)
Rd look-ahead is: Enabled
Write cache is:   Enabled
ATA Security is:  Disabled, NOT FROZEN [SEC1]

=== START OF READ SMART DATA SECTION ===
SMART overall-health self-assessment test result: PASSED

General SMART Values:
Offline data collection status:  (0x84)	Offline data collection activity
					was suspended by an interrupting command from host.

Self-test execution status:      (   0)	The previous self-test routine completed
					without error or no self-test has ever 
					been run.
Total time to complete Offline 
data collection: 		(46440) seconds.
Offline data collection
capabilities: 			 (0x7b) SMART execute Offline immediate.

					Suspend Offline collection upon new
					command.
					Offline surface scan supported.
					Self-test supported.
					Conveyance Self-test supported.
					Selective Self-test supported.
SMART capabilities:            (0x0003)	Saves SMART data before entering
					power-saving mode.

Error logging capability:        (0x01)	Error logging supported.
					General Purpose Logging supported.
Short self-test routine 
recommended polling time: 	 (   2) minutes.
Extended self-test routine
recommended polling time: 	 ( 502) minutes.
Conveyance self-test routine
recommended polling time: 	 (   5) minutes.
SCT capabilities: 	       (0x70bd)	SCT Status supported.
					SCT Error Recovery Control supported.
					SCT Feature Control supported.
					SCT Data Table supported.

SMART Attributes Data Structure revision number: 16
Vendor Specific SMART Attributes with Thresholds:
ID# ATTRIBUTE_NAME          FLAGS    VALUE WORST THRESH FAIL RAW_VALUE
  1 Raw_Read_Error_Rate     POSR-K   200   200   051    -    0
  3 Spin_Up_Time            POS--K   163   146   021    -    10833
  4 Start_Stop_Count        -O--CK   100   100   000    -    40
  5 Reallocated_Sector_Ct   PO--CK   200   200   140    -    0
  7 Seek_Error_Rate         -OSR-K   100   253   000    -    0
  9 Power_On_Hours          -O--CK   038   038   000    -    45481
 10 Spin_Retry_Count        -O--CK   100   253   000    -    0
 11 Calibration_Retry_Count -O--CK   100   253   000    -    0
 12 Power_Cycle_Count       -O--CK   100   100   000    -    40
183 Runtime_Bad_Block       -O--CK   100   100   000    -    0
192 Power-Off_Retract_Count -O--CK   200   200   000    -    39
193 Load_Cycle_Count        -O--CK   200   200   000    -    128
194 Temperature_Celsius     -O---K   118   107   000    -    34
196 Reallocated_Event_Count -O--CK   200   200   000    -    0
197 Current_Pending_Sector  -O--CK   200   200   000    -    0
198 Offline_Uncorrectable   ----CK   200   200   000    -    0
199 UDMA_CRC_Error_Count    -O--CK   200   200   000    -    1
200 Multi_Zone_Error_Rate   ---R--   200   200   000    -    0
                            ||||||_ K auto-keep
                            |||||__ C event count
                            ||||___ R error rate
                            |||____ S speed/performance
                            ||_____ O updated online
                            |______ P prefailure warning

General Purpose Log Directory Version 1
SMART           Log Directory Version 1 [multi-sector log support]
Address    Access  R/W   Size  Description
0x00       GPL,SL  R/O      1  Log Directory
0x01           SL  R/O      1  Summary SMART error log
0x02           SL  R/O      5  Comprehensive SMART error log
0x03       GPL     R/O      6  Ext. Comprehensive SMART error log
0x06           SL  R/O      1  SMART self-test log
0x07       GPL     R/O      1  Extended self-test log
0x08       GPL     R/O      2  Power Conditions log
0x09           SL  R/W      1  Selective self-test log
0x10       GPL     R/O      1  NCQ Command Error log
0x11       GPL     R/O      1  SATA Phy Event Counters log
0x24       GPL     R/O      1  Current Device Internal Status Data log
0x80-0x9f  GPL,SL  R/W     16  Host vendor specific log
0xa0-0xa7  GPL,SL  VS      16  Device vendor specific log
0xa8-0xb7  GPL,SL  VS       1  Device vendor specific log
0xbd       GPL,SL  VS       1  Device vendor specific log
0xc0       GPL,SL  VS       1  Device vendor specific log
0xc1       GPL     VS      24  Device vendor specific log
0xe0       GPL,SL  R/W      1  SCT Command/Status
0xe1       GPL,SL  R/W      1  SCT Data Transfer

SMART Extended Comprehensive Error Log Version: 1 (6 sectors)
Device Error Count: 9
	CR     = Command Register
	FEATR  = Features Register
	COUNT  = Count (was: Sector Count) Register
	LBA_48 = Upper bytes of LBA High/Mid/Low Registers ]  ATA-8
	LH     = LBA High (was: Cylinder High) Register    ]   LBA
	LM     = LBA Mid (was: Cylinder Low) Register      ] Register
	LL     = LBA Low (was: Sector Number) Register     ]
	DV     = Device (was: Device/Head) Register
	DC     = Device Control Register
	ER     = Error register
	ST     = Status register
Powered_Up_Time is measured from power on, and printed as
DDd+hh:mm:SS.sss where DD=days, hh=hours, mm=minutes,
SS=sec, and sss=millisec. It "wraps" after 49.710 days.

Error 9 [8] occurred at disk power-on lifetime: 8924 hours (371 days + 20 hours)
  When the command that caused the error occurred, the device was active or idle.

  After command completion occurred, registers were:
  ER -- ST COUNT  LBA_48  LH LM LL DV DC
  -- -- -- == -- == == == -- -- -- -- --
  40 -- 51 00 00 00 00 96 35 6a 52 40 00  Error: UNC at LBA = 0x96356a52 = 2520083026

  Commands leading to the command that caused the error were:
  CR FEATR COUNT  LBA_48  LH LM LL DV DC  Powered_Up_Time  Command/Feature_Name
  -- == -- == -- == == == -- -- -- -- --  ---------------  --------------------
  60 01 ae 00 10 00 00 96 35 6a 52 40 00 18d+ ...          READ FPDMA QUEUED
  60 00 02 00 08 00 00 96 35 6a 50 40 00 18d+ ...          READ FPDMA QUEUED
  60 00 02 00 00 00 00 96 35 6a 4c 40 00 18d+ ...          READ FPDMA QUEUED
  60 00 02 00 08 00 00 96 35 6a 4e 40 00 18d+ ...          READ FPDMA QUEUED
  60 00 02 00 00 00 00 96 35 6a 4a 40 00 18d+ ...          READ FPDMA QUEUED

Error 8 [7] occurred at disk power-on lifetime: 8626 hours (359 days + 10 hours)
  When the command that caused the error occurred, the device was active or idle.

  After command completion occurred, registers were:
  ER -- ST COUNT  LBA_48  LH LM LL DV DC
  -- -- -- == -- == == == -- -- -- -- --
  40 -- 51 00 00 00 00 16 9d 36 ac 40 00  Error: UNC at LBA = 0x169d36ac = 379401900

  Commands leading to the command that caused the error were:
  CR FEATR COUNT  LBA_48  LH LM LL DV DC  Powered_Up_Time  Command/Feature_Name
  -- == -- == -- == == == -- -- -- -- --  ---------------  --------------------
  60 01 54 00 00 00 00 16 9d 36 ac 40 00  5d+ ...          READ FPDMA QUEUED
  60 00 02 00 00 00 00 16 9d 36 aa 40 00  5d+ ...          READ FPDMA QUEUED
  60 00 01 00 10 00 00 16 9d 36 8c 40 00  5d+ ...          READ FPDMA QUEUED
  60 00 02 00 08 00 00 16 9d 36 a8 40 00  5d+ ...          READ FPDMA QUEUED
  60 00 01 00 00 00 00 16 9d 36 8a 40 00  5d+ ...          READ FPDMA QUEUED

Error 7 [6] occurred at disk power-on lifetime: 6492 hours (270 days + 12 hours)
  When the command that caused the error occurred, the device was active or idle.

  After command completion occurred, registers were:
  ER -- ST COUNT  LBA_48  LH LM LL DV DC
  -- -- -- == -- == == == -- -- -- -- --
  40 -- 51 00 00 00 00 d9 58 70 38 40 00  Error: UNC at LBA = 0xd9587038 = 3646451768

  Commands leading to the command that caused the error were:
  CR FEATR COUNT  LBA_48  LH LM LL DV DC  Powered_Up_Time  Command/Feature_Name
  -- == -- == -- == == == -- -- -- -- --  ---------------  --------------------
  60 01 c8 00 00 00 00 d9 58 70 38 40 00 16d+ ...          READ FPDMA QUEUED
  60 00 01 00 18 00 00 d9 58 70 2f 40 00 16d+ ...          READ FPDMA QUEUED
  60 00 02 00 10 00 00 d9 58 70 16 40 00 16d+ ...          READ FPDMA QUEUED
  60 00 02 00 08 00 00 d9 58 70 25 40 00 16d+ ...          READ FPDMA QUEUED
  60 00 02 00 00 00 00 d9 58 70 10 40 00 16d+ ...          READ FPDMA QUEUED

Error 6 [5] occurred at disk power-on lifetime: 5914 hours (246 days + 10 hours)
  When the command that caused the error occurred, the device was active or idle.

  After command completion occurred, registers were:
  ER -- ST COUNT  LBA_48  LH LM LL DV DC
  -- -- -- == -- == == == -- -- -- -- --
  40 -- 51 00 00 00 00 74 c3 6b 22 40 00  Error: UNC at LBA = 0x74c36b22 = 1958964002

  Commands leading to the command that caused the error were:
  CR FEATR COUNT  LBA_48  LH LM LL DV DC  Powered_Up_Time  Command/Feature_Name
  -- == -- == -- == == == -- -- -- -- --  ---------------  --------------------
  60 00 de 00 00 00 00 74 c3 6b 22 40 00 41d+ ...          READ FPDMA QUEUED
  60 00 01 00 08 00 00 74 c3 6b 1b 40 00 41d+ ...          READ FPDMA QUEUED
  60 00 02 00 00 00 00 74 c3 6b 13 40 00 41d+ ...          READ FPDMA QUEUED
  60 00 02 00 08 00 00 74 c3 6b 17 40 00 41d+ ...          READ FPDMA QUEUED
  60 00 02 00 00 00 00 74 c3 6b 0b 40 00 41d+ ...          READ FPDMA QUEUED

Error 5 [4] occurred at disk power-on lifetime: 5767 hours (240 days + 7 hours)
  When the command that caused the error occurred, the device was active or idle.

  After command completion occurred, registers were:
  ER -- ST COUNT  LBA_48  LH LM LL DV DC
  -- -- -- == -- == == == -- -- -- -- --
  40 -- 51 00 00 00 00 c8 75 0e 00 40 00  Error: UNC at LBA = 0xc8750e00 = 3363114496

  Commands leading to the command that caused the error were:
  CR FEATR COUNT  LBA_48  LH LM LL DV DC  Powered_Up_Time  Command/Feature_Name
  -- == -- == -- == == == -- -- -- -- --  ---------------  --------------------
  60 02 00 00 00 00 00 c8 75 0e 00 40 00 35d+ ...          READ FPDMA QUEUED
  60 00 4f 00 00 00 00 c8 75 0d b1 40 00 35d+ ...          READ FPDMA QUEUED
  60 00 01 00 00 00 00 c8 75 0d a8 40 00 35d+ ...          READ FPDMA QUEUED
  60 00 01 00 10 00 00 c8 75 0d aa 40 00 35d+ ...          READ FPDMA QUEUED
  60 00 02 00 00 00 00 c8 75 0d a4 40 00 35d+ ...          READ FPDMA QUEUED

Error 4 [3] occurred at disk power-on lifetime: 5413 hours (225 days + 13 hours)
  When the command that caused the error occurred, the device was active or idle.

  After command completion occurred, registers were:
  ER -- ST COUNT  LBA_48  LH LM LL DV DC
  -- -- -- == -- == == == -- -- -- -- --
  40 -- 51 00 00 00 00 9e 1b 2c 00 40 00  Error: UNC at LBA = 0x9e1b2c00 = 2652580864

  Commands leading to the command that caused the error were:
  CR FEATR COUNT  LBA_48  LH LM LL DV DC  Powered_Up_Time  Command/Feature_Name
  -- == -- == -- == == == -- -- -- -- --  ---------------  --------------------
  60 02 00 00 00 00 00 9e 1b 2c 00 40 00 21d+ ...          READ FPDMA QUEUED
  60 00 3d 00 00 00 00 9e 1b 2b c3 40 00 21d+ ...          READ FPDMA QUEUED
  60 00 02 00 00 00 00 9e 1b 2b bf 40 00 21d+ ...          READ FPDMA QUEUED
  60 00 01 00 10 00 00 9e 1b 2b b8 40 00 21d+ ...          READ FPDMA QUEUED
  60 00 01 00 08 00 00 9e 1b 2b ba 40 00 21d+ ...          READ FPDMA QUEUED

Error 3 [2] occurred at disk power-on lifetime: 5080 hours (211 days + 16 hours)
  When the command that caused the error occurred, the device was active or idle.

  After command completion occurred, registers were:
  ER -- ST COUNT  LBA_48  LH LM LL DV DC
  -- -- -- == -- == == == -- -- -- -- --
  40 -- 51 00 00 00 00 36 2a 0e ea 40 00  Error: UNC at LBA = 0x362a0eea = 908725994

  Commands leading to the command that caused the error were:
  CR FEATR COUNT  LBA_48  LH LM LL DV DC  Powered_Up_Time  Command/Feature_Name
  -- == -- == -- == == == -- -- -- -- --  ---------------  --------------------
  60 01 16 00 00 00 00 36 2a 0e ea 40 00  7d+ ...          READ FPDMA QUEUED
  60 00 02 00 08 00 00 36 2a 0e e6 40 00  7d+ ...          READ FPDMA QUEUED
  60 00 02 00 00 00 00 36 2a 0e e0 40 00  7d+ ...          READ FPDMA QUEUED
  60 00 02 00 08 00 00 36 2a 0e e2 40 00  7d+ ...          READ FPDMA QUEUED
  60 00 02 00 00 00 00 36 2a 0e de 40 00  7d+ ...          READ FPDMA QUEUED

Error 2 [1] occurred at disk power-on lifetime: 2578 hours (107 days + 10 hours)
  When the command that caused the error occurred, the device was active or idle.

  After command completion occurred, registers were:
  ER -- ST COUNT  LBA_48  LH LM LL DV DC
  -- -- -- == -- == == == -- -- -- -- --
  40 -- 51 00 00 00 00 a4 40 67 ba 40 00  Error: UNC at LBA = 0xa44067ba = 2755684282

  Commands leading to the command that caused the error were:
  CR FEATR COUNT  LBA_48  LH LM LL DV DC  Powered_Up_Time  Command/Feature_Name
  -- == -- == -- == == == -- -- -- -- --  ---------------  --------------------
  60 00 7a 00 00 00 00 a4 40 67 ba 40 00 47d+ ...          READ FPDMA QUEUED
  60 00 02 00 18 00 00 a4 40 68 04 40 00 47d+ ...          READ FPDMA QUEUED
  60 00 02 00 10 00 00 a4 40 67 b5 40 00 47d+ ...          READ FPDMA QUEUED
  60 00 02 00 08 00 00 a4 40 68 00 40 00 47d+ ...          READ FPDMA QUEUED
  60 00 02 00 00 00 00 a4 40 67 b3 40 00 47d+ ...          READ FPDMA QUEUED

SMART Extended Self-test Log Version: 1 (1 sectors)
No self-tests have been logged.  [To run self-tests, use: smartctl -t]

SMART Selective self-test log data structure revision number 1
 SPAN  MIN_LBA  MAX_LBA  CURRENT_TEST_STATUS
    1        0        0  Not_testing
    2        0        0  Not_testing
    3        0        0  Not_testing
    4        0        0  Not_testing
    5        0        0  Not_testing
Selective self-test flags (0x0):
  After scanning selected spans, do NOT read-scan remainder of disk.
If Selective self-test is pending on power-up, resume after 0 minute delay.

SCT Status Version:                  3
SCT Version (vendor specific):       258 (0x0102)
Device State:                        Active (0)
Current Temperature:                    34 Celsius
Power Cycle Min/Max Temperature:     26/45 Celsius
Lifetime    Min/Max Temperature:     19/45 Celsius
Under/Over Temperature Limit Count:   0/0
Vendor specific:
01 00 00 00 00 00 00 00 00 00 00 00 00 00 00 00
00 00 00 00 00 00 00 00 00 00 00 00 00 00 00 00

SCT Temperature History Version:     2
Temperature Sampling Period:         1 minute
Temperature Logging Interval:        1 minute
Min/Max recommended Temperature:      0/60 Celsius
Min/Max Temperature Limit:           -41/85 Celsius
Temperature History Size (Index):    478 (13)

SCT Error Recovery Control:
           Read:     70 (7.0 seconds)
          Write:     70 (7.0 seconds)

SATA Phy Event Counters (GP Log 0x11)
ID      Size     Value  Description
0x0001  2            0  Command failed due to ICRC error
0x0002  2            0  R_ERR response for data FIS
0x0003  2            0  R_ERR response for device-to-host data FIS
0x0004  2            0  R_ERR response for host-to-device data FIS
0x0005  2            0  R_ERR response for non-data FIS
0x0006  2            0  R_ERR response for device-to-host non-data FIS
0x0007  2            0  R_ERR response for host-to-device non-data FIS
0x0008  2            0  Device-to-host non-data FIS retries
0x0009  2           19  Transition from drive PhyRdy to drive PhyNRdy
0x000a  2           20  Device-to-host register FISes sent due to a COMRESET
0x000b  2            0  CRC errors within host-to-device FIS
0x000f  2            0  R_ERR response for host-to-device data FIS, CRC
0x0012  2            0  R_ERR response for host-to-device non-data FIS, CRC
0x8000  4      5497680  Vendor specific

