smartctl 7.1 2019-12-30 r5022 [x86_64-linux-3.10.0-1127...] (local build)
Copyright (C) 2002-19, Bruce Allen, Christian Franke, www.smartmontools.org

=== START OF INFORMATION SECTION ===
Model Family:     Western Digital Re
Device Model:     WDC WD4000FYYZ-01UL1B0
Serial Number:    --
LU WWN Device Id: 5 0014ee ...
Firmware Version: 01.01K01
User Capacity:    4,000,787,030,016 bytes [4.00 TB]
Sector Size:      512 bytes logical/physical
Rotation Rate:    7200 rpm
Device is:        In smartctl database [for details use: -P show]
ATA Version is:   ATA8-ACS (minor revision not indicated)
SATA Version is:  SATA 3.0, 6.0 Gb/s (current: 3.0 Gb/s)
Local Time is:    --
APM level is:     128 (minimum power consumption without standby)
Rd look-ahead is: Enabled
Write cache is:   Enabled
ATA Security is:  Disabled, frozen [SEC2]

=== START OF READ SMART DATA SECTION ===
SMART overall-health self-assessment test result: PASSED

General SMART Values:
Offline data collection status:  (0x82)	Offline data collection activity
					was completed without error.

Self-test execution status:      (   0)	The previous self-test routine completed
					without error or no self-test has ever 
					been run.
Total time to complete Offline 
data collection: 		(44820) seconds.
Offline data collection
capabilities: 			 (0x7b) SMART execute Offline immediate.

					Suspend Offline collection upon new
					command.
					Offline surface scan supported.
					Self-test supported.
					Conveyance Self-test supported.
					Selective Self-test supported.
SMART capabilities:            (0x0003)	Saves SMART data before entering
					power-saving mode.

Error logging capability:        (0x01)	Error logging supported.
					General Purpose Logging supported.
Short self-test routine 
recommended polling time: 	 (   2) minutes.
Extended self-test routine
recommended polling time: 	 ( 484) minutes.
Conveyance self-test routine
recommended polling time: 	 (   5) minutes.
SCT capabilities: 	       (0x70bd)	SCT Status supported.
					SCT Error Recovery Control supported.
					SCT Feature Control supported.
					SCT Data Table supported.

SMART Attributes Data Structure revision number: 16
Vendor Specific SMART Attributes with Thresholds:
ID# ATTRIBUTE_NAME          FLAGS    VALUE WORST THRESH FAIL RAW_VALUE
  1 Raw_Read_Error_Rate     POSR-K   200   200   051    -    0
  3 Spin_Up_Time            POS--K   161   159   021    -    10950
  4 Start_Stop_Count        -O--CK   100   100   000    -    44
  5 Reallocated_Sector_Ct   PO--CK   200   200   140    -    0
  7 Seek_Error_Rate         -OSR-K   100   253   000    -    0
  9 Power_On_Hours          -O--CK   013   013   000    -    63826
 10 Spin_Retry_Count        -O--CK   100   253   000    -    0
 11 Calibration_Retry_Count -O--CK   100   253   000    -    0
 12 Power_Cycle_Count       -O--CK   100   100   000    -    44
183 Runtime_Bad_Block       -O--CK   100   100   000    -    0
192 Power-Off_Retract_Count -O--CK   200   200   000    -    42
193 Load_Cycle_Count        -O--CK   200   200   000    -    138
194 Temperature_Celsius     -O---K   123   106   000    -    29
196 Reallocated_Event_Count -O--CK   200   200   000    -    0
197 Current_Pending_Sector  -O--CK   200   200   000    -    0
198 Offline_Uncorrectable   ----CK   200   200   000    -    0
199 UDMA_CRC_Error_Count    -O--CK   200   200   000    -    0
200 Multi_Zone_Error_Rate   ---R--   200   200   000    -    0
                            ||||||_ K auto-keep
                            |||||__ C event count
                            ||||___ R error rate
                            |||____ S speed/performance
                            ||_____ O updated online
                            |______ P prefailure warning

General Purpose Log Directory Version 1
SMART           Log Directory Version 1 [multi-sector log support]
Address    Access  R/W   Size  Description
0x00       GPL,SL  R/O      1  Log Directory
0x01           SL  R/O      1  Summary SMART error log
0x02           SL  R/O      5  Comprehensive SMART error log
0x03       GPL     R/O      6  Ext. Comprehensive SMART error log
0x06           SL  R/O      1  SMART self-test log
0x07       GPL     R/O      1  Extended self-test log
0x08       GPL     R/O      2  Power Conditions log
0x09           SL  R/W      1  Selective self-test log
0x10       GPL     R/O      1  NCQ Command Error log
0x11       GPL     R/O      1  SATA Phy Event Counters log
0x24       GPL     R/O      1  Current Device Internal Status Data log
0x80-0x9f  GPL,SL  R/W     16  Host vendor specific log
0xa0-0xa7  GPL,SL  VS      16  Device vendor specific log
0xa8-0xb7  GPL,SL  VS       1  Device vendor specific log
0xbd       GPL,SL  VS       1  Device vendor specific log
0xc0       GPL,SL  VS       1  Device vendor specific log
0xc1       GPL     VS      24  Device vendor specific log
0xe0       GPL,SL  R/W      1  SCT Command/Status
0xe1       GPL,SL  R/W      1  SCT Data Transfer

SMART Extended Comprehensive Error Log Version: 1 (6 sectors)
Device Error Count: 6
	CR     = Command Register
	FEATR  = Features Register
	COUNT  = Count (was: Sector Count) Register
	LBA_48 = Upper bytes of LBA High/Mid/Low Registers ]  ATA-8
	LH     = LBA High (was: Cylinder High) Register    ]   LBA
	LM     = LBA Mid (was: Cylinder Low) Register      ] Register
	LL     = LBA Low (was: Sector Number) Register     ]
	DV     = Device (was: Device/Head) Register
	DC     = Device Control Register
	ER     = Error register
	ST     = Status register
Powered_Up_Time is measured from power on, and printed as
DDd+hh:mm:SS.sss where DD=days, hh=hours, mm=minutes,
SS=sec, and sss=millisec. It "wraps" after 49.710 days.

Error 6 [5] occurred at disk power-on lifetime: 7091 hours (295 days + 11 hours)
  When the command that caused the error occurred, the device was active or idle.

  After command completion occurred, registers were:
  ER -- ST COUNT  LBA_48  LH LM LL DV DC
  -- -- -- == -- == == == -- -- -- -- --
  40 -- 51 00 00 00 00 0f dd c4 de 40 00  Error: UNC at LBA = 0x0fddc4de = 266192094

  Commands leading to the command that caused the error were:
  CR FEATR COUNT  LBA_48  LH LM LL DV DC  Powered_Up_Time  Command/Feature_Name
  -- == -- == -- == == == -- -- -- -- --  ---------------  --------------------
  60 01 22 00 00 00 00 0f dd c4 de 40 00 41d+ ...          READ FPDMA QUEUED
  60 00 02 00 08 00 00 0f dd c4 dc 40 00 41d+ ...          READ FPDMA QUEUED
  60 00 02 00 00 00 00 0f dd c4 82 40 00 41d+ ...          READ FPDMA QUEUED
  60 00 02 00 08 00 00 0f dd c4 84 40 00 41d+ ...          READ FPDMA QUEUED
  60 00 02 00 00 00 00 0f dd c4 7e 40 00 41d+ ...          READ FPDMA QUEUED

Error 5 [4] occurred at disk power-on lifetime: 7012 hours (292 days + 4 hours)
  When the command that caused the error occurred, the device was active or idle.

  After command completion occurred, registers were:
  ER -- ST COUNT  LBA_48  LH LM LL DV DC
  -- -- -- == -- == == == -- -- -- -- --
  40 -- 51 00 00 00 00 ca 37 ce d1 40 00  Error: UNC at LBA = 0xca37ced1 = 3392655057

  Commands leading to the command that caused the error were:
  CR FEATR COUNT  LBA_48  LH LM LL DV DC  Powered_Up_Time  Command/Feature_Name
  -- == -- == -- == == == -- -- -- -- --  ---------------  --------------------
  60 01 2f 00 00 00 00 ca 37 ce d1 40 00 37d+ ...          READ FPDMA QUEUED
  60 00 02 00 00 00 00 ca 37 ce cf 40 00 37d+ ...          READ FPDMA QUEUED
  60 00 02 00 10 00 00 ca 37 ce cb 40 00 37d+ ...          READ FPDMA QUEUED
  60 00 02 00 08 00 00 ca 37 ce cd 40 00 37d+ ...          READ FPDMA QUEUED
  60 00 02 00 00 00 00 ca 37 ce c9 40 00 37d+ ...          READ FPDMA QUEUED

Error 4 [3] occurred at disk power-on lifetime: 5766 hours (240 days + 6 hours)
  When the command that caused the error occurred, the device was active or idle.

  After command completion occurred, registers were:
  ER -- ST COUNT  LBA_48  LH LM LL DV DC
  -- -- -- == -- == == == -- -- -- -- --
  40 -- 51 00 00 00 00 c8 75 bd 7f 40 00  Error: UNC at LBA = 0xc875bd7f = 3363159423

  Commands leading to the command that caused the error were:
  CR FEATR COUNT  LBA_48  LH LM LL DV DC  Powered_Up_Time  Command/Feature_Name
  -- == -- == -- == == == -- -- -- -- --  ---------------  --------------------
  60 00 81 00 00 00 00 c8 75 bd 7f 40 00 35d+ ...          READ FPDMA QUEUED
  60 00 02 00 08 00 00 c8 75 bd 70 40 00 35d+ ...          READ FPDMA QUEUED
  60 00 02 00 00 00 00 c8 75 bd 6a 40 00 35d+ ...          READ FPDMA QUEUED
  60 00 02 00 08 00 00 c8 75 bd 6c 40 00 35d+ ...          READ FPDMA QUEUED
  60 00 01 00 00 00 00 c8 75 bd 63 40 00 35d+ ...          READ FPDMA QUEUED

Error 3 [2] occurred at disk power-on lifetime: 5115 hours (213 days + 3 hours)
  When the command that caused the error occurred, the device was active or idle.

  After command completion occurred, registers were:
  ER -- ST COUNT  LBA_48  LH LM LL DV DC
  -- -- -- == -- == == == -- -- -- -- --
  40 -- 51 00 00 00 00 32 7f ec 24 40 00  Error: UNC at LBA = 0x327fec24 = 847244324

  Commands leading to the command that caused the error were:
  CR FEATR COUNT  LBA_48  LH LM LL DV DC  Powered_Up_Time  Command/Feature_Name
  -- == -- == -- == == == -- -- -- -- --  ---------------  --------------------
  60 01 dc 00 00 00 00 32 7f ec 24 40 00  8d+ ...          READ FPDMA QUEUED
  60 00 02 00 00 00 00 32 7f ec 22 40 00  8d+ ...          READ FPDMA QUEUED
  60 00 02 00 10 00 00 32 7f ec 1e 40 00  8d+ ...          READ FPDMA QUEUED
  60 00 02 00 08 00 00 32 7f ec 20 40 00  8d+ ...          READ FPDMA QUEUED
  60 00 02 00 00 00 00 32 7f ec 1c 40 00  8d+ ...          READ FPDMA QUEUED

Error 2 [1] occurred at disk power-on lifetime: 2697 hours (112 days + 9 hours)
  When the command that caused the error occurred, the device was active or idle.

  After command completion occurred, registers were:
  ER -- ST COUNT  LBA_48  LH LM LL DV DC
  -- -- -- == -- == == == -- -- -- -- --
  40 -- 51 00 00 00 00 21 c7 89 52 40 00  Error: UNC at LBA = 0x21c78952 = 566724946

  Commands leading to the command that caused the error were:
  CR FEATR COUNT  LBA_48  LH LM LL DV DC  Powered_Up_Time  Command/Feature_Name
  -- == -- == -- == == == -- -- -- -- --  ---------------  --------------------
  60 00 ae 00 00 00 00 21 c7 89 52 40 00  2d+ ...          READ FPDMA QUEUED
  60 00 02 00 08 00 00 21 c7 89 63 40 00  2d+ ...          READ FPDMA QUEUED
  60 00 02 00 00 00 00 21 c7 89 4e 40 00  2d+ ...          READ FPDMA QUEUED
  60 00 02 00 08 00 00 21 c7 89 61 40 00  2d+ ...          READ FPDMA QUEUED
  60 00 02 00 00 00 00 21 c7 89 4a 40 00  2d+ ...          READ FPDMA QUEUED

Error 1 [0] occurred at disk power-on lifetime: 1579 hours (65 days + 19 hours)
  When the command that caused the error occurred, the device was active or idle.

  After command completion occurred, registers were:
  ER -- ST COUNT  LBA_48  LH LM LL DV DC
  -- -- -- == -- == == == -- -- -- -- --
  40 -- 51 00 00 00 00 5b ef 35 59 40 00  Error: UNC at LBA = 0x5bef3559 = 1542403417

  Commands leading to the command that caused the error were:
  CR FEATR COUNT  LBA_48  LH LM LL DV DC  Powered_Up_Time  Command/Feature_Name
  -- == -- == -- == == == -- -- -- -- --  ---------------  --------------------
  60 00 7f 00 00 00 00 5b ef 35 59 40 00  5d+ ...          READ FPDMA QUEUED
  60 00 02 00 18 00 00 5b ef 35 a9 40 00  5d+ ...          READ FPDMA QUEUED
  60 00 02 00 10 00 00 5b ef 35 57 40 00  5d+ ...          READ FPDMA QUEUED
  60 00 02 00 08 00 00 5b ef 35 a1 40 00  5d+ ...          READ FPDMA QUEUED
  60 00 02 00 00 00 00 5b ef 35 55 40 00  5d+ ...          READ FPDMA QUEUED

SMART Extended Self-test Log Version: 1 (1 sectors)
No self-tests have been logged.  [To run self-tests, use: smartctl -t]

SMART Selective self-test log data structure revision number 1
 SPAN  MIN_LBA  MAX_LBA  CURRENT_TEST_STATUS
    1        0        0  Not_testing
    2        0        0  Not_testing
    3        0        0  Not_testing
    4        0        0  Not_testing
    5        0        0  Not_testing
Selective self-test flags (0x0):
  After scanning selected spans, do NOT read-scan remainder of disk.
If Selective self-test is pending on power-up, resume after 0 minute delay.

SCT Status Version:                  3
SCT Version (vendor specific):       258 (0x0102)
Device State:                        Active (0)
Current Temperature:                    29 Celsius
Power Cycle Min/Max Temperature:     22/43 Celsius
Lifetime    Min/Max Temperature:      0/46 Celsius
Under/Over Temperature Limit Count:   0/0
Vendor specific:
01 00 00 00 00 00 00 00 00 00 00 00 00 00 00 00
00 00 00 00 00 00 00 00 00 00 00 00 00 00 00 00

SCT Temperature History Version:     2
Temperature Sampling Period:         1 minute
Temperature Logging Interval:        1 minute
Min/Max recommended Temperature:      0/60 Celsius
Min/Max Temperature Limit:           -41/85 Celsius
Temperature History Size (Index):    478 (10)

SCT Error Recovery Control:
           Read:     70 (7.0 seconds)
          Write:     70 (7.0 seconds)

SATA Phy Event Counters (GP Log 0x11)
ID      Size     Value  Description
0x0001  2            0  Command failed due to ICRC error
0x0002  2            0  R_ERR response for data FIS
0x0003  2            0  R_ERR response for device-to-host data FIS
0x0004  2            0  R_ERR response for host-to-device data FIS
0x0005  2            0  R_ERR response for non-data FIS
0x0006  2            0  R_ERR response for device-to-host non-data FIS
0x0007  2            0  R_ERR response for host-to-device non-data FIS
0x0008  2            0  Device-to-host non-data FIS retries
0x0009  2            6  Transition from drive PhyRdy to drive PhyNRdy
0x000a  2            7  Device-to-host register FISes sent due to a COMRESET
0x000b  2            0  CRC errors within host-to-device FIS
0x000f  2            0  R_ERR response for host-to-device data FIS, CRC
0x0012  2            0  R_ERR response for host-to-device non-data FIS, CRC
0x8000  4     20197589  Vendor specific

