smartctl 6.6 2017-11-05 r4594 [x86_64-linux-3.10.0-862...] (local build)
Copyright (C) 2002-17, Bruce Allen, Christian Franke, www.smartmontools.org

=== START OF INFORMATION SECTION ===
Device Model:     ADATA SU800
Serial Number:    --
LU WWN Device Id: 5 707c18 ...
Firmware Version: Q0518BS
User Capacity:    256,060,514,304 bytes [256 GB]
Sector Size:      512 bytes logical/physical
Rotation Rate:    Solid State Device
Form Factor:      2.5 inches
Device is:        Not in smartctl database [for details use: -P showall]
ATA Version is:   ACS-3 (minor revision not indicated)
SATA Version is:  SATA 3.1, 6.0 Gb/s (current: 6.0 Gb/s)
Local Time is:    --

=== START OF READ SMART DATA SECTION ===
SMART overall-health self-assessment test result: PASSED

SMART Attributes Data Structure revision number: 1
Vendor Specific SMART Attributes with Thresholds:
ID# ATTRIBUTE_NAME          FLAGS    VALUE WORST THRESH FAIL RAW_VALUE
  1 Raw_Read_Error_Rate     ------   100   100   000    -    0
  5 Reallocated_Sector_Ct   ------   100   100   000    -    0
  9 Power_On_Hours          ------   100   100   000    -    4130
 12 Power_Cycle_Count       ------   100   100   000    -    47
160 Unknown_Attribute       ------   100   100   000    -    0
161 Unknown_Attribute       ------   100   100   000    -    59
163 Unknown_Attribute       ------   100   100   000    -    7
164 Unknown_Attribute       ------   100   100   000    -    1711
165 Unknown_Attribute       ------   100   100   000    -    10
166 Unknown_Attribute       ------   100   100   000    -    1
167 Unknown_Attribute       ------   100   100   000    -    3
148 Unknown_Attribute       ------   100   100   000    -    785
149 Unknown_Attribute       ------   100   100   000    -    34
150 Unknown_Attribute       ------   100   100   000    -    0
151 Unknown_Attribute       ------   100   100   000    -    23
159 Unknown_Attribute       ------   100   100   000    -    0
168 Unknown_Attribute       ------   100   100   000    -    1500
169 Unknown_Attribute       ------   100   100   000    -    100
177 Wear_Leveling_Count     ------   100   100   050    -    0
181 Program_Fail_Cnt_Total  ------   100   100   000    -    0
182 Erase_Fail_Count_Total  ------   100   100   000    -    0
192 Power-Off_Retract_Count ------   100   100   000    -    10
194 Temperature_Celsius     ------   100   100   000    -    53
195 Hardware_ECC_Recovered  ------   100   100   000    -    184010
196 Reallocated_Event_Count ------   100   100   016    -    0
199 UDMA_CRC_Error_Count    ------   100   100   050    -    0
232 Available_Reservd_Space ------   100   100   000    -    100
241 Total_LBAs_Written      ------   100   100   000    -    5362
242 Total_LBAs_Read         ------   100   100   000    -    10492
245 Unknown_Attribute       ------   100   100   000    -    30798
                            ||||||_ K auto-keep
                            |||||__ C event count
                            ||||___ R error rate
                            |||____ S speed/performance
                            ||_____ O updated online
                            |______ P prefailure warning

SMART Extended Comprehensive Error Log Version: 1 (1 sectors)
No Errors Logged

Current Temperature:                     0 Celsius

