smartctl 7.0 2019-08-20 r4949 [x86_64-linux-3.10.0-1062...] (local build)
Copyright (C) 2002-18, Bruce Allen, Christian Franke, www.smartmontools.org

=== START OF INFORMATION SECTION ===
Model Number:                       SAMSUNG MZQLB7T6HMLA-00007
Serial Number:                      --
Firmware Version:                   EDB5202Q
PCI Vendor/Subsystem ID:            0x144d
IEEE OUI Identifier:                0x002538
Total NVM Capacity:                 7,681,501,126,656 [7.68 TB]
Unallocated NVM Capacity:           0
Controller ID:                      4
Number of Namespaces:               1
Namespace 1 Size/Capacity:          7,681,501,126,656 [7.68 TB]
Namespace 1 Utilization:            36,641,452,032 [36.6 GB]
Namespace 1 Formatted LBA Size:     512
Local Time is:                      --

=== START OF READ SMART DATA SECTION ===
SMART overall-health self-assessment test result: PASSED

SMART/Health Information (NVMe Log 0x02)
Critical Warning:                   0x00
Temperature:                        38 Celsius
Available Spare:                    100%
Available Spare Threshold:          10%
Percentage Used:                    0%
Data Units Read:                    17,502,207 [8.96 TB]
Data Units Written:                 3,734,718 [1.91 TB]
Host Read Commands:                 351,841,594
Host Write Commands:                295,885,592
Controller Busy Time:               166
Power Cycles:                       18
Power On Hours:                     1,109
Unsafe Shutdowns:                   15
Media and Data Integrity Errors:    0
Error Information Log Entries:      0
Warning  Comp. Temperature Time:    0
Critical Comp. Temperature Time:    0
Temperature Sensor 1:               38 Celsius
Temperature Sensor 2:               45 Celsius
Temperature Sensor 3:               51 Celsius

