smartctl 7.4 2023-08-01 r5530 [x86_64-linux-3.10.0-1160...] (local build)
Copyright (C) 2002-23, Bruce Allen, Christian Franke, www.smartmontools.org

=== START OF INFORMATION SECTION ===
Model Number:                       Dell Express Flash PM1725b 1.6TB SFF
Serial Number:                      --
Firmware Version:                   1.1.0
PCI Vendor ID:                      0x144d
PCI Vendor Subsystem ID:            0x1028
IEEE OUI Identifier:                0x002538
Total NVM Capacity:                 1,600,321,314,816 [1.60 TB]
Unallocated NVM Capacity:           0
Controller ID:                      33
NVMe Version:                       1.2.1
Number of Namespaces:               1
Namespace 1 Size/Capacity:          1,600,321,314,816 [1.60 TB]
Namespace 1 Formatted LBA Size:     512
Namespace 1 IEEE EUI-64:            002538 ...
Local Time is:                      Fri Jun ... 2024 MSK

=== START OF READ SMART DATA SECTION ===
SMART overall-health self-assessment test result: PASSED

SMART/Health Information (NVMe Log 0x02)
Critical Warning:                   0x00
Temperature:                        26 Celsius
Available Spare:                    100%
Available Spare Threshold:          10%
Percentage Used:                    0%
Data Units Read:                    356,392,316 [182 TB]
Data Units Written:                 504,367,560 [258 TB]
Host Read Commands:                 11,908,851,958
Host Write Commands:                20,965,615,587
Controller Busy Time:               9,537
Power Cycles:                       27
Power On Hours:                     35,521
Unsafe Shutdowns:                   25
Media and Data Integrity Errors:    0
Error Information Log Entries:      0
Warning  Comp. Temperature Time:    0
Critical Comp. Temperature Time:    0
Temperature Sensor 1:               26 Celsius
Temperature Sensor 2:               26 Celsius
Temperature Sensor 3:               21 Celsius

Error Information (NVMe Log 0x01, 16 of 64 entries)
No Errors Logged

Self-test Log (NVMe Log 0x06)
Self-test status: No self-test in progress
No Self-tests Logged

